None,Maxima Women White Dial Watch,http://www.myntra.com/watches/maxima/maxima-women-white-dial-watch/182491/buy,Rs. 968,women-accessories-new-arrivals,Accessories,Shwa,http://myntra.myntassets.com/images/style/properties/Maxima-Women-White-Dial-Watch_15d0dd40495072a95650e5e318a9854b_images_1080_1440_mini.jpg,Rs. 1,075,None,women,http://www.myntra.com/watches/maxima/maxima-women-white-dial-watch/182491/buy,Sold byVector Ecommerce Pvt Ltd,None,None,single size,None,<ul class="mk-pdpv1-product-helper mk-cf"><li class="desc-main-title">Product Description</li><li class="desc-sub-title">Style Note</li><li class="desc-sub-text " itemprop="description"><p>This wrist watch is a great buy for those who enjoy style. It makes for a fabulous and fashionable daily wear for those who enjoy that urban touch to their outfit.</p></li><li class="desc-sub-title ">Product Details</li><li class="desc-sub-text"><p>Case style: Analogue watch with a gold toned circular case, with  studded detail around the dial<br/>Dial style: White dial with three gold toned hands, branding at the 12 hour mark<br/>Features: Screw to reset time<br/>Strap style: Gold toned strap with a fold-over clasp closure<br/>Comes in a signature Maxima case<br/>Water resistant up to 30 meters<br/>Warranty: 1 year against manufacturing defects</p></li><li class="desc-sub-title">Size &amp; Fit</li><li class="desc-sub-text"><p>Dial width: 22 mm<br/>Strap width: 6 mm</p></li></ul>,25:02:2014,None
None,High Sierra Women Black Printed Backpack,http://www.myntra.com/backpacks/high-sierra/high-sierra-women-black-printed-backpack/162048/buy,Rs. 1,990,women-accessories-new-arrivals,Accessories,Shwa,http://myntra.myntassets.com/images/style/properties/High-Sierra-Women-Black-Printed-Backpack_1328c831dc84df739abf1e1804d85cf5_images_1080_1440_mini.jpg,None,None,women,http://www.myntra.com/backpacks/high-sierra/high-sierra-women-black-printed-backpack/162048/buy,Sold byVector Ecommerce Pvt Ltd,None,None,single size,None,<ul class="mk-pdpv1-product-helper mk-cf"><li class="desc-main-title">Product Description</li><li class="desc-sub-title">Style Note</li><li class="desc-sub-text " itemprop="description"><p>Adventure begins with the right travel accessory and High Sierra offers this with its ultimate backpacks that have a unique combination of function, fashion and durability. This backpack is sure to become your travel mate as it lets you carry your essentials in style without a fret.</p></li><li class="desc-sub-title ">Product Details</li><li class="desc-sub-text"><p>Black, printed backpack with multi-coloured floral prints, has stitched detail and embroidered branding in the front<br/>One non-padded, contoured haul loop at the top and two S-shaped, padded VAPEL™ mesh, adjustable shoulder straps with Suspension System<br/>Two main zipped compartments<br/>Two zipped pockets in the front, one has a premium organiser with multiple pockets, key fob and headphone port<br/>A monster hook in the front to attach extra gear<br/>Adjustable compression straps on either side<br/>Primary padded back panel<br/>Warranty: Limited lifetime warranty</p></li><li class="desc-sub-title ">Material &amp; Care</li><li class="desc-sub-text "><p>100% polyester, Duralite® ripstop, 600-denier Duralite® and waffle weave<br/>Wipe with a clean, dry cloth when needed</p></li><li class="desc-sub-title">Size &amp; Fit</li><li class="desc-sub-text"><p>Height: 49 cm<br/>Width: 33 cm<br/>Depth: 18 cm</p></li></ul>,25:02:2014,None
None,Cappuccino Women Blue Backpack,http://www.myntra.com/backpacks/cappuccino/cappuccino-women-blue-backpack/192965/buy,Rs. 1,005,women-accessories-new-arrivals,Accessories,Shwa,http://myntra.myntassets.com/images/style/properties/Cappuccino-Women-Blue-Backpack_aba52dc366de8b8831470281e53053c5_images_1080_1440_mini.jpg,Rs. 1,299,None,women,http://www.myntra.com/backpacks/cappuccino/cappuccino-women-blue-backpack/192965/buy,Sold byVector Ecommerce Pvt Ltd,None,None,single size,None,<ul class="mk-pdpv1-product-helper mk-cf"><li class="desc-main-title">Product Description</li><li class="desc-sub-title">Style Note</li><li class="desc-sub-text " itemprop="description"><p>A backpack that has ample space for all your essentails is this Cappuccino backpack. Your travel time is no more a burden but assured comfort with this backpack.</p></li><li class="desc-sub-title ">Product Details</li><li class="desc-sub-text"><p>Blue backpack with textured detailing, has a haul loop at the top<br/>Two padded and adjustable shoulder straps, padded back<br/>One main zipped compartment, has an inner laptop compatible sleeve with a Velcro closure and a zipped pocket<br/>One zipped pocket in the front with an organiser sleeve inside<br/>Zipped pockets on both the sides<br/>Warranty: 3 months for manufacturing defects only</p></li><li class="desc-sub-title ">Material &amp; Care</li><li class="desc-sub-text "><p>Synthetic<br/>Wipe with a clean, dry cloth when needed</p></li><li class="desc-sub-title">Size &amp; Fit</li><li class="desc-sub-text"><p>Height: 46 cm<br/>Width: 32 cm<br/>Depth: 14 cm</p></li></ul>,25:02:2014,None
None,DressBerry Cream Toned Sling Bag,http://www.myntra.com/handbags/dressberry/dressberry-cream-toned-sling-bag/219703/buy,Rs. 839,women-accessories-new-arrivals,Accessories,Shwa,http://myntra.myntassets.com/images/style/properties/DressBerry-Cream-Toned-Sling-Bag_361a4ae9ce63d1393bc39259d6f4b2b0_images_1080_1440_mini.jpg,Rs. 1,399,None,women,http://www.myntra.com/handbags/dressberry/dressberry-cream-toned-sling-bag/219703/buy,Sold byVector Ecommerce Pvt Ltd,None,None,single size,None,<ul class="mk-pdpv1-product-helper mk-cf"><li class="desc-main-title">Product Description</li><li class="desc-sub-title">Style Note</li><li class="desc-sub-text " itemprop="description"><p>This adorable and stylish sling bag from DressBerry is perfect for those who want to keep their essentials close and safe. You can carry it work or a casual day out with your friends.</p></li><li class="desc-sub-title ">Product Details</li><li class="desc-sub-text"><p>Cream toned sling bag with a flap across the mouth that is secured with magnetic buttons, has textured detail<br/>A long, adjustable and detachable sling strap and a top handle<br/>Three main compartments with a zipped pocket and a slip pocket inbetween</p></li><li class="desc-sub-title ">Material &amp; Care</li><li class="desc-sub-text "><p>Synthetic and metal<br/>Wipe with a clean, dry cloth when needed</p></li><li class="desc-sub-title">Size &amp; Fit</li><li class="desc-sub-text"><p>Height: 22 cm<br/>Width: 27 cm</p></li></ul>,25:02:2014,None
None,Cappuccino Cream Coloured Handbag,http://www.myntra.com/handbags/cappuccino/cappuccino-cream-coloured-handbag/192936/buy,Rs. 1,470,women-accessories-new-arrivals,Accessories,Shwa,http://myntra.myntassets.com/images/style/properties/Cappuccino-Beige-Handbag_52bf5c7284e4335b649398de4e5883f5_images_1080_1440_mini.jpg,Rs. 1,650,None,women,http://www.myntra.com/handbags/cappuccino/cappuccino-cream-coloured-handbag/192936/buy,Sold byVector Ecommerce Pvt Ltd,None,None,single size,None,<ul class="mk-pdpv1-product-helper mk-cf"><li class="desc-main-title">Product Description</li><li class="desc-sub-title">Style Note</li><li class="desc-sub-text " itemprop="description"><p>Cappuccino brings us this chic handbag inspired by the season's fashion trends. In a classic silhouette with stand-out design detail, this is an accessory that will get a lot of attention.</p></li><li class="desc-sub-title ">Product Details</li><li class="desc-sub-text"><p>Cream coloured handbag, has a textured upper with stitched overlays and buckle detail at the sides<br/>One short handle for carrying ease<br/>One main zipped compartment with a zipped pocket, a slip pocket and a mobile holder inside<br/>Two pockets on the sides<br/>Metallic studs at the base<br/>Warranty: 3 months</p></li><li class="desc-sub-title ">Material &amp; Care</li><li class="desc-sub-text "><p>Synthetic leather<br/> Wipe with a clean cloth to remove dirt</p></li><li class="desc-sub-title">Size &amp; Fit</li><li class="desc-sub-text"><p>Height: 30 cm<br/> Width: 44 cm<br/> Depth: 13.5 cm</p></li></ul>,25:02:2014,None
None,Kanvas Katha Women Black Tote Bag,http://www.myntra.com/tote-bags/kanvas-katha/kanvas-katha-women-black-tote-bag/183494/buy,Rs. 229,women-accessories-new-arrivals,Accessories,Shwa,http://myntra.myntassets.com/images/style/properties/Kanvas-Katha-Women-Tote-Bags_ef498f3cdf7b0c164bfe1c039ecc24b1_images_1080_1440_mini.jpg,Rs. 249,None,women,http://www.myntra.com/tote-bags/kanvas-katha/kanvas-katha-women-black-tote-bag/183494/buy,Sold byVector Ecommerce Pvt Ltd,None,None,single size,None,<ul class="mk-pdpv1-product-helper mk-cf"><li class="desc-main-title">Product Description</li><li class="desc-sub-title">Style Note</li><li class="desc-sub-text " itemprop="description"><p>This Kanvas Katha tote bag, with its contrast colours and lively prints, is sure to add some style to your look. Team it with shorts and a t-shirt for a casual look.</p></li><li class="desc-sub-title ">Product Details</li><li class="desc-sub-text"><p>Black tote bag with yellow and purple accents<br/>Printed branding at the back, brand tag on the right side above the hem<br/>Two short yellow handles<br/>One main compartment with a magnetic button closure</p></li><li class="desc-sub-title ">Material &amp; Care</li><li class="desc-sub-text "><p>100% cotton canvas<br/>Wipe with a clean, dry cloth to remove dust</p></li><li class="desc-sub-title">Size &amp; Fit</li><li class="desc-sub-text"><p>Height: 35 cm<br/>Width: 34.5 cm<br/>Depth: 6 cm</p></li></ul>,25:02:2014,None
None,Figo Fashion Women Pink Dial Watch,http://www.myntra.com/watches/figo-fashion/figo-fashion-women-pink-dial-watch/196475/buy,Rs. 999,women-accessories-new-arrivals,Accessories,Shwa,http://myntra.myntassets.com/images/style/properties/Figo-Fashion-Women-Pink-Dial-Watch_29d927c4ce536442da8c244b76b501d9_images_1080_1440_mini.jpg,None,None,women,http://www.myntra.com/watches/figo-fashion/figo-fashion-women-pink-dial-watch/196475/buy,Sold byVector Ecommerce Pvt Ltd,None,None,single size,None,<ul class="mk-pdpv1-product-helper mk-cf"><li class="desc-main-title">Product Description</li><li class="desc-sub-title">Style Note</li><li class="desc-sub-text " itemprop="description"><p>Update your accessory range this season with Figo Fashion's range of stylish timepieces. This wrist watch is designed with a classy look and for versatile use making it a perfect everyday wear.</p></li><li class="desc-sub-title ">Product Details</li><li class="desc-sub-text"><p>Case style: Analogue watch with a rectangular, high quality metal alloy case<br/> Dial style: Pink dial with steel toned hands and markings, and branding at the 12 hour mark<br/> Features: Screw to reset the time<br/> Strap style: Textured pink genuine leather strap with a tang clasp closure<br/> Water resistant<br/> Comes in a signature Figo Fashion case<br/> Warranty: 1 year against manufacturing defects</p></li><li class="desc-sub-title">Size &amp; Fit</li><li class="desc-sub-text"><p>Dial dimension: 20 mm x 17 mm<br/> Strap width: 12 mm</p></li></ul>,25:02:2014,None
