None,Roadster Men Maroon Printed T-shirt,http://www.myntra.com/tshirts/roadster/roadster-men-maroon-printed-t-shirt/219549/buy,Rs. 399,men-tees-polos,T-shirts & Collared Tees,Colt,http://myntra.myntassets.com/images/style/properties/Roadster-Men-Maroon-Vinatge-Club-Printed-T-shirt_0f75916971264d1726e6eea0f4563939_images_1080_1440_mini.jpg,None,None,men,http://www.myntra.com/tshirts/roadster/roadster-men-maroon-printed-t-shirt/219549/buy,Sold byVector Ecommerce Pvt Ltd,None,None,['S', 'M', 'L', 'XL'],None,<ul class="mk-pdpv1-product-helper mk-cf"><li class="desc-main-title">Product Description</li><li class="desc-sub-title">Style Note</li><li class="desc-sub-text " itemprop="description"><p>This cool and trendy printed T-shirt from Roadster is sure to amplify your energy all day long. Style it with denim jeans or cargos and canvas sneakers for a perfect casual look.</p></li><li class="desc-sub-title ">Product Details</li><li class="desc-sub-text"><p>Maroon printed T-shirt, knit, ribbed round neck, short sleeves, graphic print at front</p></li><li class="desc-sub-title ">Material &amp; Care</li><li class="desc-sub-text "><p>100% cotton<br/>Machine wash cold<br/>You are unique and wouldn't like it if the Creator made too many people ditto.<br/>Similarly, this product is unique, handmade and crafted with love.<br/>There are no two products we make, which will ever be ditto.<br/>To maintain a high degree of authenticity, we advise our patrons to wash our products separately and expect some fading, colour bleeding and wear &amp; tear. The article ages uniquely as you treat it, acquiring your personalised feel.<br/>Go on, enjoy this specially created product to the hilt. Have fun.</p></li><li class="desc-sub-title">Size &amp; Fit</li><li class="desc-sub-text"><p>Slim fit<br/>The model (height 6' and shoulders 18") is wearing a size M</p></li></ul>,25:02:2014,None
None,Kook N Keech Men Black Printed T-shirt,http://www.myntra.com/tshirts/kook-n-keech/kook-n-keech-men-black-printed-t-shirt/234647/buy,Rs. 499,men-tees-polos,T-shirts & Collared Tees,Colt,http://myntra.myntassets.com/images/style/properties/Kooch-N-Keech-Men-Black-Printed-T-shirt_a3bbfde9fb958bec96fbd99416dcfd05_images_1080_1440_mini.jpg,None,None,men,http://www.myntra.com/tshirts/kook-n-keech/kook-n-keech-men-black-printed-t-shirt/234647/buy,Sold byVector Ecommerce Pvt Ltd,None,None,['S', 'M', 'L', 'XL'],None,<ul class="mk-pdpv1-product-helper mk-cf"><li class="desc-main-title">Product Description</li><li class="desc-sub-title">Style Note</li><li class="desc-sub-text " itemprop="description"><p>Inject some youth into your casual repertoire with Kook N Keech's range of fun graphic tees. We think this piece will look cool styled with pop coloured trousers and skate shoes on the weekend.</p></li><li class="desc-sub-title ">Product Details</li><li class="desc-sub-text"><p>Black T-shirt, ribbed round neck, short sleeves with print branding at left arm, graphic print on front, stitch detail throughout</p></li><li class="desc-sub-title ">Material &amp; Care</li><li class="desc-sub-text "><p>100% cotton<br/>Machine wash cold</p></li><li class="desc-sub-title">Size &amp; Fit</li><li class="desc-sub-text"><p>Slim fit<br/>The model (height 6' and shoulders 18") is wearing a size M</p></li></ul>,25:02:2014,None
None,Mast & Harbour Men Navy & Grey Melange Polo T-shirt,http://www.myntra.com/tshirts/mast-harbour/mast-harbour-men-navy-grey-melange-polo-t-shirt/163680/buy,Rs. 999,men-tees-polos,T-shirts & Collared Tees,Colt,http://myntra.myntassets.com/images/style/properties/Mast-&-Harbour-Men-Navy-&-Grey-Melange-Polo-T-shirt_53ee89bd05afc4cc73368826ec9193a4_images_1080_1440_mini.jpg,None,None,men,http://www.myntra.com/tshirts/mast-harbour/mast-harbour-men-navy-grey-melange-polo-t-shirt/163680/buy,Sold byVector Ecommerce Pvt Ltd,None,None,['S', 'M', 'L', 'XL'],None,<ul class="mk-pdpv1-product-helper mk-cf"><li class="desc-main-title">Product Description</li><li class="desc-sub-title">Style Note</li><li class="desc-sub-text " itemprop="description"><p>Maritime styling at its best, this polo tee by Mast &amp; Harbour exudes preppy charm. This piece by our in-house brand will surely set you apart from the crowd, when styled with slim fit chinos and boat shoes.</p></li><li class="desc-sub-title ">Product Details</li><li class="desc-sub-text"><p>Navy, grey melange and blue polo T-shirt, pique knit, embroidered detail at back neck below the collar, short buttoned chest placket, short sleeves with ribbed cuffs, brand appliqué on either side at chest, embroidered branding at front, vented hem with back hem longer than front</p></li><li class="desc-sub-title ">Material &amp; Care</li><li class="desc-sub-text "><p>100% cotton<br/>Machine wash cold</p></li><li class="desc-sub-title">Size &amp; Fit</li><li class="desc-sub-text"><p>Slim fit<br/>The model (height 6' and shoulders 18") is wearing a size M</p></li></ul>,25:02:2014,None
None,Roadster Men Calico Pack of 3 T-shirts,http://www.myntra.com/tshirts/roadster/roadster-men-calico-pack-of-3-t-shirts/203839/buy,Rs. 849,men-tees-polos,T-shirts & Collared Tees,Colt,http://myntra.myntassets.com/images/style/properties/Roadster-Men-Calico-Pack-of-3-T-shirts_9eec258536fb32a3c7253a35af5387c4_images_1080_1440_mini.jpg,None,None,men,http://www.myntra.com/tshirts/roadster/roadster-men-calico-pack-of-3-t-shirts/203839/buy,Sold byVector Ecommerce Pvt Ltd,None,None,['S', 'M', 'L', 'XL'],None,<ul class="mk-pdpv1-product-helper mk-cf"><li class="desc-main-title">Product Description</li><li class="desc-sub-title">Style Note</li><li class="desc-sub-text " itemprop="description"><p>Stock up on super-soft tees from Roadster. With its simple styling, this pack of three will form the foundation of your casual wardrobe. Best styled with jeans or cargo shorts and casual shoes.</p></li><li class="desc-sub-title ">Product Details</li><li class="desc-sub-text"><p>Pack of three T-shirts<br/>White, grey melange and black T-shirts, each with a ribbed round necks, short sleeves and print at left chest</p></li><li class="desc-sub-title ">Material &amp; Care</li><li class="desc-sub-text "><p>100% cotton<br/>Machine wash cold<br/>You are unique and wouldn't like it if the Creator made too many people ditto.<br/>Similarly, this product is unique, handmade and crafted with love.<br/>There are no two products we make, which will ever be ditto.<br/>To maintain a high degree of authenticity, we advise our patrons to wash our products separately and expect some fading, colour bleeding, wear and tear.<br/>The article ages uniquely as you treat it, acquiring your personalised feel.<br/>Go on, enjoy this specially created product to the hilt. Have fun.</p></li><li class="desc-sub-title">Size &amp; Fit</li><li class="desc-sub-text"><p>Slim fit<br/>The model (height 6' and shoulders 18") is wearing a size M</p></li></ul>,25:02:2014,None
None,Roadster Men Olive Green Camo Pocket T-shirt,http://www.myntra.com/tshirts/roadster/roadster-men-olive-green-camo-pocket-t-shirt/192653/buy,Rs. 499,men-tees-polos,T-shirts & Collared Tees,Colt,http://myntra.myntassets.com/images/style/properties/Roadster-Men-Olive-Green-Camo-Pocket-T-shirt_1f5e802842c3c694e03300e7a2f1196b_images_1080_1440_mini.jpg,None,None,men,http://www.myntra.com/tshirts/roadster/roadster-men-olive-green-camo-pocket-t-shirt/192653/buy,Sold byVector Ecommerce Pvt Ltd,None,None,['S', 'M', 'L', 'XL'],None,<ul class="mk-pdpv1-product-helper mk-cf"><li class="desc-main-title">Product Description</li><li class="desc-sub-title">Style Note</li><li class="desc-sub-text " itemprop="description"><p>If you have a rebellious streak, then this T-shirt by Roadster is for you. Featuring camouflage print accents, we think piece will look best teamed with dark jeans or trousers and combat boots.</p></li><li class="desc-sub-title ">Product Details</li><li class="desc-sub-text"><p>Olive green T-shirt with camouflage print accents, ribbed round neck, short printed raglan sleeves, patch pocket with printed branding at left chest</p></li><li class="desc-sub-title ">Material &amp; Care</li><li class="desc-sub-text "><p>100% cotton<br/>Machine wash cold<br/>You are unique and wouldn't like it if the Creator made too many people ditto.<br/>Similarly, this product is unique, handmade and crafted with love.<br/>There are no two products we make, which will ever be ditto.<br/>To maintain a high degree of authenticity, we advise our patrons to wash our products separately and expect some fading, colour bleeding and wear &amp; tear. The article ages uniquely as you treat it, acquiring your personalised feel.<br/>Go on, enjoy this specially created product to the hilt. Have fun.</p></li><li class="desc-sub-title">Size &amp; Fit</li><li class="desc-sub-text"><p>Slim fit<br/>The model (height 6' and shoulders 18") is wearing a size M</p></li></ul>,25:02:2014,None
None,HRX Men Black T-shirt,http://www.myntra.com/tshirts/hrx/hrx-men-black-t-shirt/210706/buy,Rs. 799,men-tees-polos,T-shirts & Collared Tees,Colt,http://myntra.myntassets.com/images/style/properties/HRX-Men-Black-T-shirt_ab4c6c467b2e8395012b36f7e4cca8d5_images_1080_1440_mini.jpg,None,None,men,http://www.myntra.com/tshirts/hrx/hrx-men-black-t-shirt/210706/buy,Sold byVector Ecommerce Pvt Ltd,None,None,['S', 'M', 'L', 'XL'],None,<ul class="mk-pdpv1-product-helper mk-cf"><li class="desc-main-title">Product Description</li><li class="desc-sub-title">Style Note</li><li class="desc-sub-text " itemprop="description"><p>Hrithik Roshan is known for his super-trendy fashion sense which is at once relaxed and sophisticated. You can now emulate this super star's unique style sensibility with his urban collection of casual wardrobe separates. Match this cool HRX tee with your favourite pair of distressed jeans and high-top trainers for a youthful vibe.</p></li><li class="desc-sub-title ">Product Details</li><li class="desc-sub-text"><p>Black T-shirt, knitted, ribbed V neck, long sleeves, brand print at left chest, straight hem</p></li><li class="desc-sub-title ">Material &amp; Care</li><li class="desc-sub-text "><p>100% cotton<br/>Machine wash cold</p></li><li class="desc-sub-title">Size &amp; Fit</li><li class="desc-sub-text"><p>Slim fit<br/>The model (height 6' and shoulders 18") is wearing a size M</p></li></ul>,25:02:2014,None
None,FREECULTR Men Blue & Grey Vermont Printed T-shirt,http://www.myntra.com/tshirts/freecultr/freecultr-men-blue-grey-vermont-printed-t-shirt/228439/buy,Rs. 699,men-tees-polos,T-shirts & Collared Tees,Colt,http://myntra.myntassets.com/images/style/properties/FREECULTR-Men-Blue-&-Grey-Vermont-Printed-T-shirt_f94c4147b24029739a7a99b3d89ba314_images_1080_1440_mini.jpg,None,None,men,http://www.myntra.com/tshirts/freecultr/freecultr-men-blue-grey-vermont-printed-t-shirt/228439/buy,Sold byVector Ecommerce Pvt Ltd,None,None,['S', 'M', 'L', 'XL'],None,<ul class="mk-pdpv1-product-helper mk-cf"><li class="desc-main-title">Product Description</li><li class="desc-sub-title">Style Note</li><li class="desc-sub-text " itemprop="description"><p>Allowing you to create a plethora of different looks based on your mood, this printed tee by FREECULTR is a true classic. Go for a casual look and style this piece with chinos or denims.</p></li><li class="desc-sub-title ">Product Details</li><li class="desc-sub-text"><p>Blue and grey printed T-shirt, knitted, V neck with raw edge detailing, short sleeves</p></li><li class="desc-sub-title ">Material &amp; Care</li><li class="desc-sub-text "><p>100% cotton<br/>Machine wash cold</p></li><li class="desc-sub-title">Size &amp; Fit</li><li class="desc-sub-text"><p>Slim fit<br/>The model (height 6' and shoulders 18") is wearing a size M</p></li></ul>,25:02:2014,None
