None,Nike Men Lime Green Pique Polo T-shirt,http://www.myntra.com/tshirts/nike/nike-men-lime-green-pique-polo-t-shirt/245883/buy,Rs. 1,595,men-tees-polos,T-shirts & Collared Tees,Colt,http://myntra.myntassets.com/images/style/properties/Nike-Men-Yellow-Pique-Polo-T-shirt_b443f68f0e2dd31061c9d38740129eba_images_1080_1440_mini.jpg,None,None,men,http://www.myntra.com/tshirts/nike/nike-men-lime-green-pique-polo-t-shirt/245883/buy,Sold byVector Ecommerce Pvt Ltd,None,None,['S', 'M', 'L', 'XL', 'XXL'],None,<ul class="mk-pdpv1-product-helper mk-cf"><li class="desc-main-title">Product Description</li><li class="desc-sub-title">Style Note</li><li class="desc-sub-text " itemprop="description"><p>Especially created for sports fans, this polo tee by Nike is the perfect alternative to a sports jersey. Soft and breathable, slip into this when you're supporting your team at the sports bar.</p></li><li class="desc-sub-title ">Product Details</li><li class="desc-sub-text"><p>Lime green pique polo T-shirt, knitted, ribbed collar with contrast stripes, short sleeves with ribbed cuffs and contrast stripes, short buttoned chest placket, brand appliqué at left chest, straight vented hem with back slightly longer than front<br/>Warranty for manufacturing defects: 6 months (not valid on products with more than 20% discount)</p></li><li class="desc-sub-title ">Material &amp; Care</li><li class="desc-sub-text "><p>95% cotton, 5% Spandex<br/>Machine wash cold</p></li><li class="desc-sub-title">Size &amp; Fit</li><li class="desc-sub-text"><p>The model (height 6' and shoulders 18") is wearing a size M</p></li></ul>,25:02:2014,None
None,Roadster Men Maroon Printed T-shirt,http://www.myntra.com/tshirts/roadster/roadster-men-maroon-printed-t-shirt/219551/buy,Rs. 399,men-tees-polos,T-shirts & Collared Tees,Colt,http://myntra.myntassets.com/images/style/properties/Roadster-Men-Maroon-Custom-Auto-Printed-T-shirt_b89bc9f4c9788f54f22834cd82f2b746_images_1080_1440_mini.jpg,None,None,men,http://www.myntra.com/tshirts/roadster/roadster-men-maroon-printed-t-shirt/219551/buy,Sold byVector Ecommerce Pvt Ltd,None,None,['S', 'M', 'L', 'XL'],None,<ul class="mk-pdpv1-product-helper mk-cf"><li class="desc-main-title">Product Description</li><li class="desc-sub-title">Style Note</li><li class="desc-sub-text " itemprop="description"><p>This cool and trendy printed T-shirt from Roadster is sure to amplify your energy all day long. Style it with denim jeans or cargos and canvas sneakers for a perfect casual look.</p></li><li class="desc-sub-title ">Product Details</li><li class="desc-sub-text"><p>Maroon printed T-shirt, knit, ribbed V neck, short sleeves, printed at front</p></li><li class="desc-sub-title ">Material &amp; Care</li><li class="desc-sub-text "><p>100% cotton<br/>Machine wash cold<br/>You are unique and wouldn't like it if the Creator made too many people ditto.<br/>Similarly, this product is unique, handmade and crafted with love.<br/>There are no two products we make, which will ever be ditto.<br/>To maintain a high degree of authenticity, we advise our patrons to wash our products separately and expect some fading, colour bleeding and wear &amp; tear. The article ages uniquely as you treat it, acquiring your personalised feel.<br/>Go on, enjoy this specially created product to the hilt. Have fun.</p></li><li class="desc-sub-title">Size &amp; Fit</li><li class="desc-sub-text"><p>Slim fit<br/>The model (height 6' and shoulders 18") is wearing a size M</p></li></ul>,25:02:2014,None
None,FIFA Men Green Printed T-shirt,http://www.myntra.com/tshirts/fifa/fifa-men-green-printed-t-shirt/200126/buy,Rs. 799,men-tees-polos,T-shirts & Collared Tees,Colt,http://myntra.myntassets.com/images/style/properties/FIFA-Men-Green-Printed-T-shirt_0cd4b762de6e9561b51e8adda6a3dbb6_images_1080_1440_mini.jpg,None,None,men,http://www.myntra.com/tshirts/fifa/fifa-men-green-printed-t-shirt/200126/buy,Sold byVector Ecommerce Pvt Ltd,None,None,['S', 'M', 'L', 'XL', 'XXL'],None,<ul class="mk-pdpv1-product-helper mk-cf"><li class="desc-main-title">Product Description</li><li class="desc-sub-title">Style Note</li><li class="desc-sub-text " itemprop="description"><p>With its soft fabric and vibrant colour, this T-shirt from FIFA is designed to make you comfortable and stylish at the same time. Wear it with shorts or trousers and flip flops to complete the look.</p></li><li class="desc-sub-title ">Product Details</li><li class="desc-sub-text"><p>Green printed T-shirt, knitted, has a ribbed round neck, short sleeves, print at front with branding, straight hem</p></li><li class="desc-sub-title ">Material &amp; Care</li><li class="desc-sub-text "><p>100% cotton<br/>Machine wash warm</p></li><li class="desc-sub-title">Size &amp; Fit</li><li class="desc-sub-text"><p>The model (height 6' and shoulders 18") is wearing a size M</p></li></ul>,25:02:2014,None
None,Adidas Men White T-shirt,http://www.myntra.com/tshirts/adidas/adidas-men-white-t-shirt/42106/buy,Rs. 674,men-tees-polos,T-shirts & Collared Tees,Colt,http://myntra.myntassets.com/images/style/properties/7d5cb00def22abc9129899694f979b9f_images_1080_1440_mini.jpg,Rs. 899,None,men,http://www.myntra.com/tshirts/adidas/adidas-men-white-t-shirt/42106/buy,Sold byVector Ecommerce Pvt Ltd,None,None,['S', 'M', 'L', 'XL', 'XXL'],None,<ul class="mk-pdpv1-product-helper mk-cf"><li class="desc-main-title">Product Description</li><li class="desc-sub-title ">Product Details</li><li class="desc-sub-text"><p><strong>Style Note</strong> <br/> <a href="../adidas">adidas</a> helps you avoid discomfort and keep dry and comfortable. This T-shirt, engineered with Climalite technology, offers you a flattering stylised look. Pair it with a pair of <a href="../jeans">jeans</a> and <a href="../sports-shoes">sports shoes</a> on your day off, or with <a href="../shorts">shorts</a> and <a href="../Sports">Sports</a> <a href="../shoes">shoes</a> when you're hitting the gym.<br/> <br/> <strong>Product Details</strong> <br/> White T-shirt, has a round neckline, short sleeves with Adidas patented three stripes and branding on the left chest<br/> <br/> <strong>Material and Care</strong><br/> 70% cotton and 30% polyester<br/> Machine wash below 40 degrees with like colours using a mild detergent<br/> Do not soak, tumble dry, bleach or dry clean<br/> Dry in shade<br/> Cold iron  do not iron on decorations<br/> <br/> <strong>Size and <a href="../Fit">Fit</a></strong><br/> Regular fit<br/> The model (height 6' and shoulders 18") is wearing a size M</p></li></ul>,25:02:2014,None
None,Mast & Harbour Men Navy Polo T-shirt,http://www.myntra.com/tshirts/mast-harbour/mast-harbour-men-navy-polo-t-shirt/163678/buy,Rs. 999,men-tees-polos,T-shirts & Collared Tees,Colt,http://myntra.myntassets.com/images/style/properties/Mast-&-Harbour-Men-Navy-Polo-T-shirt_40f5c2e5a3742ea17a31f6be5cf67ff9_images_1080_1440_mini.jpg,None,None,men,http://www.myntra.com/tshirts/mast-harbour/mast-harbour-men-navy-polo-t-shirt/163678/buy,Sold byVector Ecommerce Pvt Ltd,None,None,['S', 'M', 'L', 'XL'],None,<ul class="mk-pdpv1-product-helper mk-cf"><li class="desc-main-title">Product Description</li><li class="desc-sub-title">Style Note</li><li class="desc-sub-text " itemprop="description"><p>Maritime styling at its best, this polo tee by Mast &amp; Harbour exudes preppy charm. This piece by our in-house brand will surely set you apart from the crowd, when styled with slim fit chinos and boat shoes.</p></li><li class="desc-sub-title ">Product Details</li><li class="desc-sub-text"><p>Navy polo T-shirt with blue and red accents, has a ribbed spread collar with embroidery behind the collar, contrast short sleeves with ribbed cuffs and branding on the right sleeve, short buttoned chest placket, branding at left chest, contrast fabric panelling below chest with embroidery, yoke at back, side slits with contrast fabric taping, back hem longer than front</p></li><li class="desc-sub-title ">Material &amp; Care</li><li class="desc-sub-text "><p>100% cotton<br/>Machine wash cold</p></li><li class="desc-sub-title">Size &amp; Fit</li><li class="desc-sub-text"><p>Slim fit<br/>The model (height 6' and shoulders 18") is wearing a size M</p></li></ul>,25:02:2014,None
None,U.S. Polo Assn. Men Orange Polo T-shirt,http://www.myntra.com/tshirts/us-polo-assn/us-polo-assn-men-orange-polo-t-shirt/236388/buy,Rs. 1,299,men-tees-polos,T-shirts & Collared Tees,Colt,http://myntra.myntassets.com/images/style/properties/US-Polo-Assn-Men-Red-Polo-T-shirt_a6725f54bd1b58b87a8705385f336981_images_1080_1440_mini.jpg,None,None,men,http://www.myntra.com/tshirts/us-polo-assn/us-polo-assn-men-orange-polo-t-shirt/236388/buy,Sold byVector Ecommerce Pvt Ltd,None,None,['S', 'M', 'L', 'XL', 'XXL'],None,<ul class="mk-pdpv1-product-helper mk-cf"><li class="desc-main-title">Product Description</li><li class="desc-sub-title">Style Note</li><li class="desc-sub-text " itemprop="description"><p>Get that refined casual look in this polo T-shirt by U.S. Polo Assn. Its luxurious fabric composition and immaculately finished look make it that much more desirable. Style it with a pair of slim fit chinos and canvas shoes for a chic, relaxed appeal.</p></li><li class="desc-sub-title ">Product Details</li><li class="desc-sub-text"><p>Orange polo T-shirt, ribbed spread collar, short button placket at front, short sleeves with ribbed cuffs, numerical appliquè on right sleeve, embroidered branding at left chest, vented hem with back longer than front</p></li><li class="desc-sub-title ">Material &amp; Care</li><li class="desc-sub-text "><p>100% cotton<br/>Machine wash cold</p></li><li class="desc-sub-title">Size &amp; Fit</li><li class="desc-sub-text"><p>Slim fit<br/>The model (height 6' and shoulders 18") is wearing a size M</p></li></ul>,25:02:2014,None
None,Roadster Men Maroon Bardan Polo T-Shirt,http://www.myntra.com/tshirts/roadster/roadster-men-maroon-bardan-polo-t-shirt/141601/buy,Rs. 699,men-tees-polos,T-shirts & Collared Tees,Colt,http://myntra.myntassets.com/images/style/properties/Roadster-Men-Tshirts_a63afcdcba467ed235a4e93e07ec8e25_images_1080_1440_mini.jpg,None,None,men,http://www.myntra.com/tshirts/roadster/roadster-men-maroon-bardan-polo-t-shirt/141601/buy,Sold byVector Ecommerce Pvt Ltd,None,None,['S', 'M', 'L', 'XL'],None,<ul class="mk-pdpv1-product-helper mk-cf"><li class="desc-main-title">Product Description</li><li class="desc-sub-title">Style Note</li><li class="desc-sub-text " itemprop="description"><p>Our in-house brand Roadster presents a range of pique knit polo tees that'll up the sartorial credibility of your casual repertoire. Pair this piece with coloured chino trousers and leather trainers for a cool look.</p></li><li class="desc-sub-title ">Product Details</li><li class="desc-sub-text"><p>Maroon, navy and cream striped polo T-shirt, has a ribbed spread collar in maroon, short buttoned chest placket, brand patch on the left chest, short sleeves with ribbed cuffs and has applique on the right sleeve and has a vented hem with back longer than the front</p></li><li class="desc-sub-title ">Material &amp; Care</li><li class="desc-sub-text "><p>100% cotton<br/>Machine wash cold<br/>You are unique and wouldn't like it if the Creator made too many people ditto.<br/>Similarly, this product is unique, handmade and crafted with love.<br/>There are no two products we make, which will ever be ditto.<br/>To maintain a high degree of authenticity, we advise our patrons to wash our products separately and expect some fading, colour bleeding and wear and tear.<br/>The article ages uniquely as you treat it, acquiring your personalised feel. Go on, enjoy this specially created product to the hilt. Have fun.</p></li><li class="desc-sub-title">Size &amp; Fit</li><li class="desc-sub-text"><p>Slim fit<br/>The model (height 6' and shoulders 18") is wearing a size M</p></li></ul>,25:02:2014,None
None,Kook N Keech Marvel Men Grey Captain America Printed T-shirt,http://www.myntra.com/tshirts/kook-n-keech-marvel/kook-n-keech-marvel-men-grey-captain-america-print/217774/buy,Rs. 499,men-tees-polos,T-shirts & Collared Tees,Colt,http://myntra.myntassets.com/images/style/properties/Kook-N-Keech-Marvel-Men-Grey-Captain-America-Printed-T-shirt_626a56a0d2afe91e324f5ee73c77d771_images_1080_1440_mini.jpg,None,None,men,http://www.myntra.com/tshirts/kook-n-keech-marvel/kook-n-keech-marvel-men-grey-captain-america-print/217774/buy,Sold byVector Ecommerce Pvt Ltd,None,None,['S', 'M', 'L', 'XL'],None,<ul class="mk-pdpv1-product-helper mk-cf"><li class="desc-main-title">Product Description</li><li class="desc-sub-title">Style Note</li><li class="desc-sub-text " itemprop="description"><p>Inject some youth into your casual repertoire with Kook N Keech's Marvel range of fun graphic tees. We think this piece will look cool styled with pop coloured trousers and skate shoes on the weekend.</p></li><li class="desc-sub-title ">Product Details</li><li class="desc-sub-text"><p>Grey printed T-shirt, ribbed round neck, short sleeves with textured brand print on left sleeve, graphic print at front, printed branding at back</p></li><li class="desc-sub-title ">Material &amp; Care</li><li class="desc-sub-text "><p>100% cotton<br/>Machine wash cold</p></li><li class="desc-sub-title">Size &amp; Fit</li><li class="desc-sub-text"><p>Slim fit<br/>The model (height 6' and shoulders 18") is wearing a size M</p></li></ul>,25:02:2014,None
None,Mast & Harbour Men Red Pique Polo T-shirt,http://www.myntra.com/tshirts/mast-harbour/mast-harbour-men-red-pique-polo-t-shirt/163671/buy,Rs. 899,men-tees-polos,T-shirts & Collared Tees,Colt,http://myntra.myntassets.com/images/style/properties/Mast-&-Harbour-Men-Red-Pique-Polo-T-shirt_1fa037f4ac55f69d0302041b7bde3141_images_1080_1440_mini.jpg,None,None,men,http://www.myntra.com/tshirts/mast-harbour/mast-harbour-men-red-pique-polo-t-shirt/163671/buy,Sold byVector Ecommerce Pvt Ltd,None,None,['S', 'M', 'L', 'XL'],None,<ul class="mk-pdpv1-product-helper mk-cf"><li class="desc-main-title">Product Description</li><li class="desc-sub-title">Style Note</li><li class="desc-sub-text " itemprop="description"><p>Maritime styling at its best, this polo tee by Mast &amp; Harbour exudes preppy charm. This piece by our in-house brand will surely set you apart from the crowd, when styled with slim fit chinos and boat shoes.</p></li><li class="desc-sub-title ">Product Details</li><li class="desc-sub-text"><p>Red pique polo T-shirt with mustard yellow accents, ribbed spread collar with tipping, short sleeves with contrast stripe ribbed cuffs, short buttoned chest placket, embroidery and appliqué at left chest, longer back hem, side slits</p></li><li class="desc-sub-title ">Material &amp; Care</li><li class="desc-sub-text "><p>100% cotton<br/>Machine wash cold</p></li><li class="desc-sub-title">Size &amp; Fit</li><li class="desc-sub-text"><p>Slim fit<br/>The model (height 6' and shoulders 18") is wearing a size M</p></li></ul>,25:02:2014,None
None,Reebok Men Black Printed T-shirt,http://www.myntra.com/tshirts/reebok/reebok-men-black-printed-t-shirt/181253/buy,Rs. 1,104,men-tees-polos,T-shirts & Collared Tees,Colt,http://myntra.myntassets.com/images/style/properties/Reebok-Men-Tshirts_217898207a59b1de7830e855c633e50a_images_1080_1440_mini.jpg,Rs. 1,299,None,men,http://www.myntra.com/tshirts/reebok/reebok-men-black-printed-t-shirt/181253/buy,Sold byVector Ecommerce Pvt Ltd,None,None,['S', 'M', 'L', 'XL', 'XXL'],None,<ul class="mk-pdpv1-product-helper mk-cf"><li class="desc-main-title">Product Description</li><li class="desc-sub-title">Style Note</li><li class="desc-sub-text " itemprop="description"><p>Reebok has always integrated the spirit of sports in its range of fashionable casual separates. Match this stylish tee with a pair of tapered jeans and skate shoes for a youthful casual attire.</p></li><li class="desc-sub-title ">Product Details</li><li class="desc-sub-text"><p>Black printed T-shirt, knit, ribbed round neck, short sleeves, graphic print at front, straight hem, brand tag at front left hem</p></li><li class="desc-sub-title ">Material &amp; Care</li><li class="desc-sub-text "><p>100% cotton<br/>Machine wash cold</p></li><li class="desc-sub-title">Size &amp; Fit</li><li class="desc-sub-text"><p>Regular fit<br/>The model (height 6' and shoulders 18") is wearing a size M</p></li></ul>,25:02:2014,None
None,United Colors of Benetton Men Navy Polo T-shirt,http://www.myntra.com/tshirts/united-colors-of-benetton/united-colors-of-benetton-men-navy-polo-t-shirt/244075/buy,Rs. 1,099,men-tees-polos,T-shirts & Collared Tees,Colt,http://myntra.myntassets.com/images/style/properties/United-Colors-Of-Benetton-Men-Navy-Polo-T-shirt_124e8fcb793b681ac053266ba87dceb8_images_1080_1440_mini.jpg,None,None,men,http://www.myntra.com/tshirts/united-colors-of-benetton/united-colors-of-benetton-men-navy-polo-t-shirt/244075/buy,Sold byVector Ecommerce Pvt Ltd,None,None,['S', 'M', 'L', 'XL', 'XXL'],None,<ul class="mk-pdpv1-product-helper mk-cf"><li class="desc-main-title">Product Description</li><li class="desc-sub-title">Style Note</li><li class="desc-sub-text " itemprop="description"><p>UCB brings you this super comfortable and stylish polo tee which is a must-have for your casual wear collection. Wear it with a pair of well fitted denims and sneakers to create a neat ensemble for yourself.</p></li><li class="desc-sub-title ">Product Details</li><li class="desc-sub-text"><p>Navy blue polo T-shirt, has a ribbed spread collar with contrast stripes and tipping, short sleeves with ribbed hem that has contrast stripes and tipping, short buttoned placket at chest, branding at left chest, vented hem, back hem longer than front</p></li><li class="desc-sub-title ">Material &amp; Care</li><li class="desc-sub-text "><p>100% cotton<br/>Machine wash delicate</p></li><li class="desc-sub-title">Size &amp; Fit</li><li class="desc-sub-text"><p>The model (height 6' and shoulders 18") is wearing a size M</p></li></ul>,25:02:2014,None
None,Roadster Men Black Printed T-shirt,http://www.myntra.com/tshirts/roadster/roadster-men-black-printed-t-shirt/219555/buy,Rs. 399,men-tees-polos,T-shirts & Collared Tees,Colt,http://myntra.myntassets.com/images/style/properties/Roadster-Men-Black-Automotive-Printed-T-shirt_2667a41150fbcf6a76f5385438cf6265_images_1080_1440_mini.jpg,None,None,men,http://www.myntra.com/tshirts/roadster/roadster-men-black-printed-t-shirt/219555/buy,Sold byVector Ecommerce Pvt Ltd,None,None,['S', 'M', 'L', 'XL'],None,<ul class="mk-pdpv1-product-helper mk-cf"><li class="desc-main-title">Product Description</li><li class="desc-sub-title">Style Note</li><li class="desc-sub-text " itemprop="description"><p>This cool and trendy printed T-shirt from Roadster is sure to amplify your energy all day long. Style it with denim jeans or cargos and canvas sneakers for a perfect casual look.</p></li><li class="desc-sub-title ">Product Details</li><li class="desc-sub-text"><p>Black printed T-shirt, knit, ribbed round neck, short sleeves, printed at front</p></li><li class="desc-sub-title ">Material &amp; Care</li><li class="desc-sub-text "><p>100% cotton<br/>Machine wash cold<br/>You are unique and wouldn't like it if the Creator made too many people ditto.<br/>Similarly, this product is unique, handmade and crafted with love.<br/>There are no two products we make, which will ever be ditto.<br/>To maintain a high degree of authenticity, we advise our patrons to wash our products separately and expect some fading, colour bleeding and wear &amp; tear. The article ages uniquely as you treat it, acquiring your personalised feel.<br/>Go on, enjoy this specially created product to the hilt. Have fun.</p></li><li class="desc-sub-title">Size &amp; Fit</li><li class="desc-sub-text"><p>Slim fit<br/>The model (height 6' and shoulders 18") is wearing a size M</p></li></ul>,25:02:2014,None
None,FREECULTR Men Navy Burgundy Comfort Fit Henley T-shirt,http://www.myntra.com/tshirts/freecultr/freecultr-men-navy-burgundy-comfort-fit-henley-t-s/238935/buy,Rs. 999,men-tees-polos,T-shirts & Collared Tees,Colt,http://myntra.myntassets.com/images/style/properties/Freecultr-Men-Navy-Burgundy-Comfort-Fit-Henley-T-shirt_235d649586daf7d02264148c7b09fdfa_images_1080_1440_mini.jpg,None,None,men,http://www.myntra.com/tshirts/freecultr/freecultr-men-navy-burgundy-comfort-fit-henley-t-s/238935/buy,Sold byVector Ecommerce Pvt Ltd,None,None,['S', 'M', 'L', 'XL'],None,<ul class="mk-pdpv1-product-helper mk-cf"><li class="desc-main-title">Product Description</li><li class="desc-sub-title">Style Note</li><li class="desc-sub-text " itemprop="description"><p>Be stylish with this tee from FREECULTR. Team it with a pair of jeans and style it with leather accessories for maximum effect.</p></li><li class="desc-sub-title ">Product Details</li><li class="desc-sub-text"><p>Burgundy pique knit T-shirt, Henley neckline, short buttoned placket, long sleeves, brand appliqué on left chest, vented hem</p></li><li class="desc-sub-title ">Material &amp; Care</li><li class="desc-sub-text "><p>100% cotton<br/>Hand wash cold</p></li><li class="desc-sub-title">Size &amp; Fit</li><li class="desc-sub-text"><p>Comfort fit<br/>The model (height 6' and shoulders 18'') is wearing a size M</p></li></ul>,25:02:2014,None
None,Ruggers Young Men Green & White Striped T-Shirt,http://www.myntra.com/tshirts/ruggers-young/ruggers-young-men-green-white-striped-t-shirt/167699/buy,Rs. 439,men-tees-polos,T-shirts & Collared Tees,Colt,http://myntra.myntassets.com/images/style/properties/Ruggers-Young-Men-Tshirts_c5cb7d871a170be287778c62c4186a0e_images_1080_1440_mini.jpg,Rs. 549,None,men,http://www.myntra.com/tshirts/ruggers-young/ruggers-young-men-green-white-striped-t-shirt/167699/buy,Sold byVector Ecommerce Pvt Ltd,None,None,['S', 'M', 'L', 'XL'],None,<ul class="mk-pdpv1-product-helper mk-cf"><li class="desc-main-title">Product Description</li><li class="desc-sub-title">Style Note</li><li class="desc-sub-text " itemprop="description"><p>Look your causal best in this T-shirt from Ruggers Young. We think it will look perfect styled with washed denims and desert boots for effortless off-duty dressing.</p></li><li class="desc-sub-title ">Product Details</li><li class="desc-sub-text"><p>Green T-shirt with white stripes, round neck, short sleeves with up turned hems and bar-tack detail, patch pocket with embroidered branding at left chest, brand label at side seam, panelled hem</p></li><li class="desc-sub-title ">Material &amp; Care</li><li class="desc-sub-text "><p>100% cotton<br/>Machine wash</p></li><li class="desc-sub-title">Size &amp; Fit</li><li class="desc-sub-text"><p>Slim fit<br/>The model (height 6' and shoulders 18") is wearing a size M</p></li></ul>,25:02:2014,None
None,Nike Men White T-shirt,http://www.myntra.com/tshirts/nike/nike-men-white-t-shirt/60939/buy,Rs. 1,095,men-tees-polos,T-shirts & Collared Tees,Colt,http://myntra.myntassets.com/images/style/properties/Nike-Men-White-T-shirt_f35491e0fd06c212414097500a8451f2_images_1080_1440_mini.jpg,None,None,men,http://www.myntra.com/tshirts/nike/nike-men-white-t-shirt/60939/buy,Sold byVector Ecommerce Pvt Ltd,None,None,['S', 'M', 'L', 'XL', 'XXL'],None,<ul class="mk-pdpv1-product-helper mk-cf"><li class="desc-main-title">Product Description</li><li class="desc-sub-title">Style Note</li><li class="desc-sub-text " itemprop="description"><p>Nike sportswear not only gets you in the game but makes you a star performer! For those goal driven and ambitious sportsmen and gym goers, this fine T-shirt from Nike makes your active enterprises more comfortable. Engineered with DRI &amp;ndash  FIT technology, this T-shirt wicks your sweat away to keep you refreshed. Whether it's in the gym, on the field or you're out for a jog around the block, this is a great choice.</p></li><li class="desc-sub-title ">Product Details</li><li class="desc-sub-text"><p>White T-shirt, has a round, ribbed neckline, short sleeves and <a href="../nike">nike</a> swoosh on the left chest</p></li><li class="desc-sub-title ">Material &amp; Care</li><li class="desc-sub-text "><p>100% polyester<br/> Machine wash</p></li><li class="desc-sub-title">Size &amp; Fit</li><li class="desc-sub-text"><p>Regular fit</p></li></ul>,25:02:2014,None
None,Mast & Harbour Men Blue Pique Polo T-shirt,http://www.myntra.com/tshirts/mast-harbour/mast-harbour-men-blue-pique-polo-t-shirt/163670/buy,Rs. 899,men-tees-polos,T-shirts & Collared Tees,Colt,http://myntra.myntassets.com/images/style/properties/Mast-&-Harbour-Men-Blue-Pique-Polo-T-shirt_4fa40cdf5aab6927e5ceaaf629bf6f72_images_1080_1440_mini.jpg,None,None,men,http://www.myntra.com/tshirts/mast-harbour/mast-harbour-men-blue-pique-polo-t-shirt/163670/buy,Sold byVector Ecommerce Pvt Ltd,None,None,['S', 'M', 'L', 'XL'],None,<ul class="mk-pdpv1-product-helper mk-cf"><li class="desc-main-title">Product Description</li><li class="desc-sub-title">Style Note</li><li class="desc-sub-text " itemprop="description"><p>Maritime styling at its best, this polo tee by Mast &amp; Harbour exudes preppy charm. This piece by our in-house brand will surely set you apart from the crowd, when styled with slim fit chinos and boat shoes.</p></li><li class="desc-sub-title ">Product Details</li><li class="desc-sub-text"><p>Blue pique polo T-shirt with light blue accents, ribbed spread collar with tipping, short sleeves with contrast stripe ribbed cuffs, short buttoned chest placket, embroidery and appliqué at left chest, longer back hem, side slits</p></li><li class="desc-sub-title ">Material &amp; Care</li><li class="desc-sub-text "><p>100% cotton<br/>Machine wash cold</p></li><li class="desc-sub-title">Size &amp; Fit</li><li class="desc-sub-text"><p>Slim fit<br/>The model (height 6' and shoulders 18") is wearing a size M</p></li></ul>,25:02:2014,None
