None,Language Men Dark Blue Leather Casual Shoes,http://www.myntra.com/Casual-Shoes/Language/Language-Men-Dark-Blue-Leather-Casual-Shoes/198806/buy,Rs. 3,817,sale-men-footwear,Footwear,Language,http://myntra.myntassets.com/images/style/properties/Language-Men-Casual-Shoes_9db8c7081f351946fbd3463a4afe1217_images_1080_1440_mini.jpg,Rs. 4,490,None,sale,http://www.myntra.com/Casual-Shoes/Language/Language-Men-Dark-Blue-Leather-Casual-Shoes/198806/buy,Sold byVector Ecommerce Pvt Ltd,None,None,['6.5', '7', '7.5', '8', '9', '9.5', '11'],None,<ul class="mk-pdpv1-product-helper mk-cf"><li class="desc-main-title">Product Description</li><li class="desc-sub-title">Style Note</li><li class="desc-sub-text " itemprop="description"><p>We love this pair of casual shoes with easy slip-on styling, from Language. Wear it with your casual ensembles for a trendy and cool look.</p></li><li class="desc-sub-title ">Product Details</li><li class="desc-sub-text"><p>Square toed, dark blue casual shoes with slip-on and loafers type styling<br/>Leather, textured upper, with overlays, stitched detail along the seams of the forefoot<br/>Cushioned footbed with branding at the heel<br/>Tough outsole with textured circular nubs<br/>Warranty: 6 months against manufacturing defects</p></li><li class="desc-sub-title ">Material &amp; Care</li><li class="desc-sub-text "><p>Leather<br/>Use a branded leather conditioner to clean this product<br/>Click <a href="http://www.myntra.com/other-smooth-leather-care">here</a> for the perfect care products for leather shoes</p></li></ul>,26:02:2014,None
None,Language Men Brown Leather Semi-Formal Boots,http://www.myntra.com/Casual-Shoes/Language/Language-Men-Brown-Leather-Semi-Formal-Boots/218332/buy,Rs. 4,491,sale-men-footwear,Footwear,Language,http://myntra.myntassets.com/images/style/properties/Language-Men-Casual-Shoes_ab3b5a5014f95fac98301bae099482b5_images_1080_1440_mini.jpg,Rs. 4,990,None,sale,http://www.myntra.com/Casual-Shoes/Language/Language-Men-Brown-Leather-Semi-Formal-Boots/218332/buy,Sold byVector Ecommerce Pvt Ltd,None,None,['6.5', '7', '7.5', '8', '9', '9.5', '11'],None,<ul class="mk-pdpv1-product-helper mk-cf"><li class="desc-main-title">Product Description</li><li class="desc-sub-title">Style Note</li><li class="desc-sub-text " itemprop="description"><p>Language never compromises on the design and comfort of shoes. Smart and simple in design, this pair of boots is best worn with denims and a slim-fit shirt.</p></li><li class="desc-sub-title ">Product Details</li><li class="desc-sub-text"><p>Round toed, brown boots with slip-on and high top styling<br/>Leather, textured upper with overlays, stitched detail, elasticated inserts on the sides, and reinforced heel collar with a pull tab detail<br/>Cushioned footbed with branding at the heel<br/>Tough and textured outsole with patterned grooves, stitched detail and a stacked heel<br/>Warranty: 6 months against manufacturing defects</p></li><li class="desc-sub-title ">Material &amp; Care</li><li class="desc-sub-text "><p>Leather<br/>Use a branded leather conditioner to clean the product<br/>Click <a href="http://www.myntra.com/brown-smooth-leather-care">here</a> for the perfect care products for brown leather shoes</p></li></ul>,26:02:2014,None
None,Language Men Brown Loafers,http://www.myntra.com/Casual-Shoes/Language/Language-Men-Brown-Loafers/198811/buy,Rs. 2,841,sale-men-footwear,Footwear,Language,http://myntra.myntassets.com/images/style/properties/Language-Men-Casual-Shoes_363f2300a7ab409ff82add8172951a6a_images_1080_1440_mini.jpg,Rs. 2,990,None,sale,http://www.myntra.com/Casual-Shoes/Language/Language-Men-Brown-Loafers/198811/buy,Sold byVector Ecommerce Pvt Ltd,None,None,['6.5', '7', '7.5', '8', '9', '9.5', '11'],None,<ul class="mk-pdpv1-product-helper mk-cf"><li class="desc-main-title">Product Description</li><li class="desc-sub-title">Style Note</li><li class="desc-sub-text " itemprop="description"><p>Language never compromises on the design and comfort of its shoes. We suggest you wear this pair with slim fit pants and a casual shirt for a stylish look.</p></li><li class="desc-sub-title ">Product Details</li><li class="desc-sub-text"><p>Square toed, navy blue loafers with low top and slip-on styling<br/>Suede upper, with overlays, contrast stitched detail along the seams of the forefoot and backfoot, has a midfoot strap with stitched and cut-out detail, reinforced overlay at the heel collar<br/>Cushioned footbed with branding at the heel and perforated detail<br/>Tough outsole with patterned grooves and extends to the backfoot<br/>Warranty: 6 months against manufacturing defects</p></li><li class="desc-sub-title ">Material &amp; Care</li><li class="desc-sub-text "><p>Suede<br/>Use a branded suede conditioner to clean the product<br/>Click <a href="http://www.myntra.com/other-suede-care">here</a> for the perfect care products for suede shoes</p></li></ul>,26:02:2014,None
None,Language Men Coffee Brown Formal Shoes,http://www.myntra.com/Formal-Shoes/Language/Language-Men-Coffee-Brown-Formal-Shoes/86292/buy,Rs. 2,694,sale-men-footwear,Footwear,Language,http://myntra.myntassets.com/images/style/properties/Language-Men-Casual-Shoes_9c778406aca924267069d53e720504ab_images_1080_1440_mini.jpg,Rs. 4,490,None,sale,http://www.myntra.com/Formal-Shoes/Language/Language-Men-Coffee-Brown-Formal-Shoes/86292/buy,Sold byVector Ecommerce Pvt Ltd,None,None,['6', '6.5', '7', '8', '9', '10', '11'],None,<ul class="mk-pdpv1-product-helper mk-cf"><li class="desc-main-title">Product Description</li><li class="desc-sub-title">Style Note</li><li class="desc-sub-text " itemprop="description"><p>A spunky and avant-garde brand that combines classic hand-crafted styles with edgy urban instincts, Language manages to get the pulse of the tech-savvy youth just right. Crafted from premium quality leather this pair is great for black tie events.</p></li><li class="desc-sub-title ">Product Details</li><li class="desc-sub-text"><p>Coffee brown slip on shoes, stitch detail along periphery, strap at midfoot(embossed branding)<br/> Round toed<br/> Padded footbed, embossed branding on lateral side<br/> One piece foam rubber outsole with horizontal grooves<br/> Stack heel<br/>Warranty: 6 months from the date of purchase</p></li><li class="desc-sub-title ">Material &amp; Care</li><li class="desc-sub-text "><p>Leather<br/> Wipe with clean, dry cloth to remove dirt<br/>Click <a href="http://www.myntra.com/brown-smooth-leather-care">here</a> for the perfect care products for brown leather shoes</p></li><li class="desc-sub-title">Size &amp; Fit</li><li class="desc-sub-text"><br/></li></ul>,26:02:2014,None
None,Language Men Brown Formal Shoes,http://www.myntra.com/Formal-Shoes/Language/Language-Men-Brown-Formal-Shoes/86282/buy,Rs. 3,294,sale-men-footwear,Footwear,Language,http://myntra.myntassets.com/images/style/properties/Language-Men-Casual-Shoes_fd2df05c89e0bcd9021fad5f8d5fcb5c_images_1080_1440_mini.jpg,Rs. 5,490,None,sale,http://www.myntra.com/Formal-Shoes/Language/Language-Men-Brown-Formal-Shoes/86282/buy,Sold byVector Ecommerce Pvt Ltd,None,None,['6', '6.5', '7', '8', '9', '10', '11'],None,<ul class="mk-pdpv1-product-helper mk-cf"><li class="desc-main-title">Product Description</li><li class="desc-sub-title">Style Note</li><li class="desc-sub-text " itemprop="description"><p>Crafted from the finest leather, this slip-on shoe from Language is designed to offer comfort at its best, without compromising on style. Packed with features that offer luxurious comfort, this pair makes you look your executive best when paired with formals and classy accessories.</p></li><li class="desc-sub-title ">Product Details</li><li class="desc-sub-text"><p>Brown slip-on with stitched detailing and perforations on the upper<br/> A padded tongue and inner and is elasticated on the sides of the tongue<br/> Branding at insole near heel as well as on the side<br/> TPU out sole with heels and patterned grooves<br/>Warranty: 6 months from the date of purchase</p></li><li class="desc-sub-title ">Material &amp; Care</li><li class="desc-sub-text "><p>&lt;p&gt;Leather&lt;br /&gt; Do not machine wash&lt;br /&gt; Remove dust and dirt with damp clean cloth&lt;br /&gt; Do not store in direct sunlight&lt;br&gt;Click &lt;a href="http://www.myntra.com/brown-smooth-leather-care"&gt;here&lt;/a&gt; for the perfect care products for brown leather shoes&lt;/p&gt;<br/></p></li><li class="desc-sub-title">Size &amp; Fit</li><li class="desc-sub-text"><p><br/></p></li></ul>,26:02:2014,None
None,Language Men Brown Suede Loafers,http://www.myntra.com/Casual-Shoes/Language/Language-Men-Brown-Suede-Loafers/86300/buy,Rs. 2,792,sale-men-footwear,Footwear,Language,http://myntra.myntassets.com/images/style/properties/Language-Men-Brown-Suede-Loafers_cb37c7aeb7701892a6480446fe81470a_images_1080_1440_mini.jpg,Rs. 3,490,None,sale,http://www.myntra.com/Casual-Shoes/Language/Language-Men-Brown-Suede-Loafers/86300/buy,Sold byVector Ecommerce Pvt Ltd,None,None,['6', '6.5', '7', '8', '9', '10', '11'],None,<ul class="mk-pdpv1-product-helper mk-cf"><li class="desc-main-title">Product Description</li><li class="desc-sub-title">Style Note</li><li class="desc-sub-text " itemprop="description"><p>Language presents its brand new collection of footwear for men. A spunky, avant-garde range that combines classic handcrafted styles with edgy urban instincts to give it a fun twist. A superbly stylish pair for a casual or semi-formal occasion, will look great paired with chinos.</p></li><li class="desc-sub-title ">Product Details</li><li class="desc-sub-text"><p>Square toed, brown loafers with low top and slip-on styling<br/> Suede upper with stitched detail along the seams of the forefoot, a midfoot strap and an reinforced overlay at the heel collar <br/> Soft inner and cushioned footbed with branding on it<br/> Tough rubber outsole with patterned grooves, outsole extends to cover the backfoot<br/>Warranty: 6 months against manufacturing defects</p></li><li class="desc-sub-title ">Material &amp; Care</li><li class="desc-sub-text "><p>Suede<br/> Use a suede brush and a branded leather conditioner to clean this product <br/> Do not expose to sunlight or water</p></li></ul>,26:02:2014,None
None,Language Men Brown Leather Casual Shoes,http://www.myntra.com/Casual-Shoes/Language/Language-Men-Brown-Leather-Casual-Shoes/218333/buy,Rs. 4,491,sale-men-footwear,Footwear,Language,http://myntra.myntassets.com/images/style/properties/Language-Men-Brown-Leather-Casual-Shoes_efbb9033be05f2771c4d452502f98cd6_images_1080_1440_mini.jpg,Rs. 4,990,None,sale,http://www.myntra.com/Casual-Shoes/Language/Language-Men-Brown-Leather-Casual-Shoes/218333/buy,Sold byVector Ecommerce Pvt Ltd,None,None,['6.5', '7', '7.5', '8', '9', '9.5', '11'],None,<ul class="mk-pdpv1-product-helper mk-cf"><li class="desc-main-title">Product Description</li><li class="desc-sub-title">Style Note</li><li class="desc-sub-text " itemprop="description"><p>Language never compromises on the design and comfort of shoes. Smart and simple in design, this pair of casual shoes is best worn with denims and a slim fit shirt.</p></li><li class="desc-sub-title ">Product Details</li><li class="desc-sub-text"><p>Round toed, brown casual shoes with slip-on and high top styling<br/>Leather, textured upper with overlays, stitched detail, elasticated inserts on the sides, and reinforced heel collar with a pull tab detail<br/>Cushioned footbed with branding at the heel<br/>Tough and textured outsole with patterned grooves, stitched detail and has a stacked heel<br/>Warranty: 6 months against manufacturing defects</p></li><li class="desc-sub-title ">Material &amp; Care</li><li class="desc-sub-text "><p>Leather<br/>Use a branded leather conditioner to clean the product<br/>Click <a href="http://www.myntra.com/brown-smooth-leather-care">here</a> for the perfect care products for brown leather shoes</p></li></ul>,26:02:2014,None
None,Language Men Brown Casual Shoes,http://www.myntra.com/Casual-Shoes/Language/Language-Men-Brown-Casual-Shoes/174564/buy,Rs. 4,193,sale-men-footwear,Footwear,Language,http://myntra.myntassets.com/images/style/properties/Language-Men-Brown-Casual-Shoes_3fffe1db4c5e22f537acd42b0022b397_images_1080_1440_mini.jpg,Rs. 5,990,None,sale,http://www.myntra.com/Casual-Shoes/Language/Language-Men-Brown-Casual-Shoes/174564/buy,Sold byVector Ecommerce Pvt Ltd,None,None,['7', '7.5', '8', '9', '9.5'],None,<ul class="mk-pdpv1-product-helper mk-cf"><li class="desc-main-title">Product Description</li><li class="desc-sub-title">Style Note</li><li class="desc-sub-text " itemprop="description"><p>A stylish pair of shoes for casual outings, this one from Language is replete with features to enhance your style and comfort. Team this with jeans and a tee for casual outing.</p></li><li class="desc-sub-title ">Product Details</li><li class="desc-sub-text"><p>Round toed, brown casual shoes with central lace-ups and low top styling<br/>Leather upper with overlays and stitched detail, has reinforced overlay at the heel collar<br/>Soft tongue and inner<br/>Comfortable footbed with branding at the heel<br/>Tough and textured outsole<br/>Warranty: 6 months warranty against manufacturing defects</p></li><li class="desc-sub-title ">Material &amp; Care</li><li class="desc-sub-text "><p>Leather<br/>Use a branded leather conditioner to clean</p></li></ul>,26:02:2014,None
None,Language Men Blue Shoes,http://www.myntra.com/Casual-Shoes/Language/Language-Men-Blue-Shoes/91080/buy,Rs. 2,793,sale-men-footwear,Footwear,Language,http://myntra.myntassets.com/images/style/properties/Language-Men-Casual-Shoes_e3376f50e50a70b198b5780a2286b82f_images_1080_1440_mini.jpg,Rs. 3,990,None,sale,http://www.myntra.com/Casual-Shoes/Language/Language-Men-Blue-Shoes/91080/buy,Sold byVector Ecommerce Pvt Ltd,None,None,['6', '6.5', '7', '8', '9', '10', '11'],None,<ul class="mk-pdpv1-product-helper mk-cf"><li class="desc-main-title">Product Description</li><li class="desc-sub-title">Style Note</li><li class="desc-sub-text " itemprop="description"><p>Add some colour pop to your outfit this season with Language's range of casual shoes. Exquisitely crafted with to-die-for designs and available in myriad colour palettes, slip them on with your favourite denims and a trendy tee for a relaxing time with friends.</p></li><li class="desc-sub-title ">Product Details</li><li class="desc-sub-text"><p>Blue boat shoes crafted from genuine suede and with top-stitch details at the seams of the forefoot region<br/> Branding on the side, leather lacing on both sides and central lace-ups<br/> Soft comfortable footbed with branding<br/> Reinforced heel collar for in-step comfort<br/> Durable rubber outsole with grooves <br/> Warranty: 6 months from the date of purchase</p></li><li class="desc-sub-title ">Material &amp; Care</li><li class="desc-sub-text "><p>suede<br/> Wipe with a dry, clean cloth or use a branded leather conditioner</p></li></ul>,26:02:2014,None
None,Language Men Green Casual Shoes,http://www.myntra.com/Casual-Shoes/Language/Language-Men-Green-Casual-Shoes/198805/buy,Rs. 3,392,sale-men-footwear,Footwear,Language,http://myntra.myntassets.com/images/style/properties/Language-Men-Casual-Shoes_77c4a6a208b85f4a92f3c397cbb14337_images_1080_1440_mini.jpg,Rs. 3,990,None,sale,http://www.myntra.com/Casual-Shoes/Language/Language-Men-Green-Casual-Shoes/198805/buy,Sold byVector Ecommerce Pvt Ltd,None,None,['6.5', '7', '7.5', '8', '9', '9.5', '11'],None,<ul class="mk-pdpv1-product-helper mk-cf"><li class="desc-main-title">Product Description</li><li class="desc-sub-title">Style Note</li><li class="desc-sub-text " itemprop="description"><p>We love this pair of casual shoes with easy slip-on styling, from Language. Wear these with your casual ensembles for a trendy and cool look.</p></li><li class="desc-sub-title ">Product Details</li><li class="desc-sub-text"><p>Square toed, green casual shoes with slip-on and loafers type styling<br/>Suede upper, with overlays, stitched detail along the seams of the forefoot<br/>Cushioned footbed with branding at the heel<br/>Tough outsole with textured circular nubs<br/>Warranty: 6 months against manufacturing defects</p></li><li class="desc-sub-title ">Material &amp; Care</li><li class="desc-sub-text "><p>Suede<br/>Use a branded suede conditioner to clean the product<br/>Click <a href="http://www.myntra.com/green-suede-care">here</a> for the perfect care products for green suede shoes</p></li></ul>,26:02:2014,None
None,Language Men Black Leather Smart Casual Shoes,http://www.myntra.com/Formal-Shoes/Language/Language-Men-Black-Leather-Smart-Casual-Shoes/203612/buy,Rs. 5,841,sale-men-footwear,Footwear,Language,http://myntra.myntassets.com/images/style/properties/Language-Men-Black-Leather-Smart-Casual-Shoes_07a2b07a5a11da0f411b5fd07d0d6bcd_images_1080_1440_mini.jpg,Rs. 6,490,None,sale,http://www.myntra.com/Formal-Shoes/Language/Language-Men-Black-Leather-Smart-Casual-Shoes/203612/buy,Sold byVector Ecommerce Pvt Ltd,None,None,['6', '6.5', '7', '8', '9', '10', '11'],None,<ul class="mk-pdpv1-product-helper mk-cf"><li class="desc-main-title">Product Description</li><li class="desc-sub-title">Style Note</li><li class="desc-sub-text " itemprop="description"><p>These formal shoes from Language have the ability to make your everyday formals look different. The stylised upper lightens the serious look, while the luxurious leather adds class.</p></li><li class="desc-sub-title ">Product Details</li><li class="desc-sub-text"><p>Square toed, black derby shoes with central lace-ups and low top styling<br/>Leather upper with stitched and overlay detail, has perforated design detail at forefoot and sides<br/>Reinforced overlay at the heel collar<br/>Soft and padded footbed with branding<br/>Tough and textured outsole with stack heels<br/>Warranty: 6 months warranty against manufacturing defects</p></li><li class="desc-sub-title ">Material &amp; Care</li><li class="desc-sub-text "><p>Leather<br/>Wipe with a clean, dry cloth when needed<br/> Click <a href="http://www.myntra.com/black-smooth-leather-care">here</a> for the perfect care products for black leather shoes</p></li></ul>,26:02:2014,None
None,Language Men Green Leather Sandals,http://www.myntra.com/Sandals/Language/Language-Men-Green-Leather-Sandals/164910/buy,Rs. 3,192,sale-men-footwear,Footwear,Language,http://myntra.myntassets.com/images/style/properties/Language-Men-Green-Leather-Sandals_02f1f8dbdd5582fdb28e41df9da1df62_images_1080_1440_mini.jpg,Rs. 3,990,None,sale,http://www.myntra.com/Sandals/Language/Language-Men-Green-Leather-Sandals/164910/buy,Sold byVector Ecommerce Pvt Ltd,None,None,['7', '7.5', '8', '9', '9.5'],None,<ul class="mk-pdpv1-product-helper mk-cf"><li class="desc-main-title">Product Description</li><li class="desc-sub-title">Style Note</li><li class="desc-sub-text " itemprop="description"><p>Stylish sandals for casual outings, this  pair from Language is replete with  features to enhance your style and comfort. Team this with a kurta and jeans for an ethno-Western vibe.</p></li><li class="desc-sub-title ">Product Details</li><li class="desc-sub-text"><p>Open toed, green sandals with stripe detail, has slip-on styling<br/>Criss-cross straps across the forefoot and midfoot forms a toe separator and is secured at the midfoot with a mock buckle detail<br/>Comfortable footbed with branding<br/>Tough and textured outsole that is slightly raised at the heel<br/>Warranty: 6 months warranty against manufacturing defects</p></li><li class="desc-sub-title ">Material &amp; Care</li><li class="desc-sub-text "><p>Leather<br/>Wipe with a clean, dry cloth when needed</p></li></ul>,26:02:2014,None
None,Language Men Black Monk Strap Shoes,http://www.myntra.com/Formal-Shoes/Language/Language-Men-Black-Monk-Strap-Shoes/203615/buy,Rs. 6,166,sale-men-footwear,Footwear,Language,http://myntra.myntassets.com/images/style/properties/Language-Men-Black-Casual-Shoes_27ee82dba992bfbeb53dbcd0b033b38b_images_1080_1440_mini.jpg,Rs. 6,490,None,sale,http://www.myntra.com/Formal-Shoes/Language/Language-Men-Black-Monk-Strap-Shoes/203615/buy,Sold byVector Ecommerce Pvt Ltd,None,None,['6', '6.5', '7', '8', '9', '10', '11'],None,<ul class="mk-pdpv1-product-helper mk-cf"><li class="desc-main-title">Product Description</li><li class="desc-sub-title">Style Note</li><li class="desc-sub-text " itemprop="description"><p>These shoes from Language promise to add a finishing touch of class and style to your ensemble. Wear this pair with a light coloured shirt, a corduroy jacket and dark chinos when going for a lunch date and exude inimitable style.</p></li><li class="desc-sub-title ">Product Details</li><li class="desc-sub-text"><p>Square toed, black casual shoes with a buckle closure and low top styling<br/>Leather upper with stitched and overlay detail<br/>Has a tab across the midfoot with a buckle closure that has an elasticated insert<br/>Soft and padded footbed with branding<br/>Tough and textured outsole with a stack heel<br/>Warranty: 6 months warranty against manufacturing defects</p></li><li class="desc-sub-title ">Material &amp; Care</li><li class="desc-sub-text "><p>Leather<br/>Wipe with a clean, dry cloth when needed<br/>Click <a href="http://www.myntra.com/black-smooth-leather-care">here</a> for the perfect care products for black leather shoes</p></li></ul>,26:02:2014,None
None,Language Men Brown & Navy Casual Shoes,http://www.myntra.com/Casual-Shoes/Language/Language-Men-Brown-&-Navy-Casual-Shoes/131354/buy,Rs. 2,793,sale-men-footwear,Footwear,Language,http://myntra.myntassets.com/images/style/properties/Language-Men-Brown-&-Navy-Casual-Shoes_bdb77e440f3427b2e2aa81eeddc8abd8_images_1080_1440_mini.jpg,Rs. 3,990,None,sale,http://www.myntra.com/Casual-Shoes/Language/Language-Men-Brown-&-Navy-Casual-Shoes/131354/buy,Sold byVector Ecommerce Pvt Ltd,None,None,['6', '6.5', '7', '8', '9', '10', '11'],None,<ul class="mk-pdpv1-product-helper mk-cf"><li class="desc-main-title">Product Description</li><li class="desc-sub-title">Style Note</li><li class="desc-sub-text " itemprop="description"><p>Crafted from the finest leather, this slip-on shoe from Language is designed to offer comfort at its best, without compromising on style. Packed with features that offer luxurious comfort, this pair makes you look best when paired with casuals and classy accessories.</p></li><li class="desc-sub-title ">Product Details</li><li class="desc-sub-text"><p>Square toed, brown casual shoes, has navy bue accents<br/>Leather upper with stitched detail and orange toned overlay at the mouth and forefoot area, branding on one side of the backfoot region<br/>Cushioned footbed with perforated insert at one side, branding on the heel region<br/>TPR outsole with an upraised heel and patterned grooves<br/>Warranty: 6 months from the date of purchase</p></li><li class="desc-sub-title ">Material &amp; Care</li><li class="desc-sub-text "><p>Leather<br/> Remove dust and dirt with damp clean cloth<br/> Do not store in direct sunlight</p></li></ul>,26:02:2014,None
None,Language Men Brown Leather Formal Shoes,http://www.myntra.com/Formal-Shoes/Language/Language-Men-Brown-Leather-Formal-Shoes/218334/buy,Rs. 5,841,sale-men-footwear,Footwear,Language,http://myntra.myntassets.com/images/style/properties/Language-Men-Formal-Shoes_475de19bab7f4228413800b02492610c_images_1080_1440_mini.jpg,Rs. 6,490,None,sale,http://www.myntra.com/Formal-Shoes/Language/Language-Men-Brown-Leather-Formal-Shoes/218334/buy,Sold byVector Ecommerce Pvt Ltd,None,None,['7', '7.5', '8', '9', '9.5'],None,<ul class="mk-pdpv1-product-helper mk-cf"><li class="desc-main-title">Product Description</li><li class="desc-sub-title">Style Note</li><li class="desc-sub-text " itemprop="description"><p>Complete your formal look with this pair of shoes from Language. Crafted from leather, this pair makes a distinctly stylish impression. Wear yours with a well-tailored pair of trousers and shirt to look your formal best.</p></li><li class="desc-sub-title ">Product Details</li><li class="desc-sub-text"><p>Round toed, brown formal shoes with central lace-ups and low top styling<br/>Leather upper with stitched overlays, perforated detail, and reinforced heel collar<br/>Soft tongue and cushioned footbed with branding at the heel<br/>Tough outsole with texturing at forefoot, has a stacked heel<br/>Warranty: 6 months against manufacturing defects</p></li><li class="desc-sub-title ">Material &amp; Care</li><li class="desc-sub-text "><p>Leather<br/>Use a branded leather polish to clean the product<br/>Click <a href="http://www.myntra.com/brown-smooth-leather-care">here</a> for the perfect care products for brown leather shoes</p></li></ul>,26:02:2014,None
