None,Language Men Black Formal Shoes,http://www.myntra.com/Formal-Shoes/Language/Language-Men-Black-Formal-Shoes/86281/buy,Rs. 3,294,sale-men-footwear,Footwear,Language,http://myntra.myntassets.com/images/style/properties/Language-Men-Casual-Shoes_93959d0b7622c13defd5bd11c888af5c_images_1080_1440_mini.jpg,Rs. 5,490,None,sale,http://www.myntra.com/Formal-Shoes/Language/Language-Men-Black-Formal-Shoes/86281/buy,Sold byVector Ecommerce Pvt Ltd,None,None,['6', '6.5', '7', '8', '9', '10', '11'],None,<ul class="mk-pdpv1-product-helper mk-cf"><li class="desc-main-title">Product Description</li><li class="desc-sub-title">Style Note</li><li class="desc-sub-text " itemprop="description"><p>Crafted from the finest leather, this slip-on shoe from Language is designed to offer comfort at its best, without compromising on style. Packed with features that offer luxurious comfort , this pair makes you look your executive best when paired with formals and classy accessories.</p></li><li class="desc-sub-title ">Product Details</li><li class="desc-sub-text"><p>Black slip-on with stitched detailing and perforations on the upper<br/> A padded tongue and inner and is elasticated on the sides of the tongue<br/> Branding at insole near heel as well as on the side<br/> TPU out sole with heel and patterned grooves<br/>Warranty: 6 months against manufacturing defects</p></li><li class="desc-sub-title ">Material &amp; Care</li><li class="desc-sub-text "><p>Leather<br/> Do not machine wash<br/> Remove dust and dirt with damp clean cloth<br/> Do not store in direct sunlight<br/>Click <a href="http://www.myntra.com/black-smooth-leather-care">here</a> for the perfect care products for black leather shoes</p></li><li class="desc-sub-title">Size &amp; Fit</li><li class="desc-sub-text"><p><br/></p></li></ul>,26:02:2014,None
None,Language Men Navy Casual Shoes,http://www.myntra.com/Casual-Shoes/Language/Language-Men-Navy-Casual-Shoes/164912/buy,Rs. 3,591,sale-men-footwear,Footwear,Language,http://myntra.myntassets.com/images/style/properties/Language-Men-Navy-Blue-Casual-Shoes_ab7af913889194d85a465647898954d8_images_1080_1440_mini.jpg,Rs. 3,990,None,sale,http://www.myntra.com/Casual-Shoes/Language/Language-Men-Navy-Casual-Shoes/164912/buy,Sold byVector Ecommerce Pvt Ltd,None,None,['6.5', '7', '7.5', '8', '9', '9.5', '11'],None,<ul class="mk-pdpv1-product-helper mk-cf"><li class="desc-main-title">Product Description</li><li class="desc-sub-title">Style Note</li><li class="desc-sub-text " itemprop="description"><p>Crafted from the finest leather, this slip-on shoe from Language is  designed to offer comfort at its best, without compromising on style.  Packed with features that offer luxurious comfort, this pair makes you  look best when paired with casuals and classy accessories.</p></li><li class="desc-sub-title ">Product Details</li><li class="desc-sub-text"><p>Round toed, navy blue, textured casual shoes<br/>Leather upper  with stitched detail and overlays<br/>Cushioned footbed with perforated insert at one side, branding at the heel region<br/>TPR outsole with nubs<br/>Warranty: 6 months from the date of purchase</p></li><li class="desc-sub-title ">Material &amp; Care</li><li class="desc-sub-text "><p>Leather<br/> Remove dust and dirt with damp clean cloth<br/> Do not store in direct sunlight</p></li></ul>,26:02:2014,None
None,Language Men Brown Leather Casual Shoes,http://www.myntra.com/Casual-Shoes/Language/Language-Men-Brown-Leather-Casual-Shoes/203613/buy,Rs. 3,817,sale-men-footwear,Footwear,Language,http://myntra.myntassets.com/images/style/properties/Language-Men-Brown-Leather-Casual-Shoes_87511ad1107c0d587837ec701e653f4f_images_1080_1440_mini.jpg,Rs. 4,490,None,sale,http://www.myntra.com/Casual-Shoes/Language/Language-Men-Brown-Leather-Casual-Shoes/203613/buy,Sold byVector Ecommerce Pvt Ltd,None,None,['6.5', '7', '7.5', '8', '9', '9.5', '11'],None,<ul class="mk-pdpv1-product-helper mk-cf"><li class="desc-main-title">Product Description</li><li class="desc-sub-title">Style Note</li><li class="desc-sub-text " itemprop="description"><p>Language never compromises on the design and comfort of their shoes.  Smart and suave, these casual shoes are best worn with well-tailored chinos  and slim fit shirts.</p></li><li class="desc-sub-title ">Product Details</li><li class="desc-sub-text"><p>Square toed, brown casual shoes with slip-on and low top styling<br/>Leather, textured upper with stitched and overlay detail<br/>Low cut styling at the back<br/>Soft and padded footbed with branding<br/>Tough and textured outsole with circular nubs<br/>Warranty: 6 months warranty against manufacturing defects</p></li><li class="desc-sub-title ">Material &amp; Care</li><li class="desc-sub-text "><p>Leather<br/>Wipe with a clean, dry cloth when needed<br/>Click <a href="http://www.myntra.com/brown-smooth-leather-care">here</a> for the perfect care products for brown leather shoes</p></li></ul>,26:02:2014,None
None,Language Men Brown Formal Shoes,http://www.myntra.com/Formal-Shoes/Language/Language-Men-Brown-Formal-Shoes/86296/buy,Rs. 3,143,sale-men-footwear,Footwear,Language,http://myntra.myntassets.com/images/style/properties/Language-Men-Casual-Shoes_1811443cbfe01ee91d34d422e8e13fe8_images_1080_1440_mini.jpg,Rs. 4,490,None,sale,http://www.myntra.com/Formal-Shoes/Language/Language-Men-Brown-Formal-Shoes/86296/buy,Sold byVector Ecommerce Pvt Ltd,None,None,['6', '6.5', '7', '8', '9', '10', '11'],None,<ul class="mk-pdpv1-product-helper mk-cf"><li class="desc-main-title">Product Description</li><li class="desc-sub-title">Style Note</li><li class="desc-sub-text " itemprop="description"><p>This pair of oxford shoes from Language has been especially handcrafted using natural leather, which adds a unique beauty to it. Wear it with crisp formal shirts and slim fit trousers to make a perfect impression on those business meetings and interviews.</p></li><li class="desc-sub-title ">Product Details</li><li class="desc-sub-text"><p>Brown oxford shoes crafted from genuine leather with leather overlays and top-stitch details<br/> Mono-tongue construction with branding and central lace-ups<br/> Soft comfortable footbed with branding<br/> Reinforced heel collar for in-step comfort<br/> Durable textured outsole with a stack heel for ergonomic comfort<br/>Warranty: 6 months from the date of purchase</p></li><li class="desc-sub-title ">Material &amp; Care</li><li class="desc-sub-text "><p>Genuine leather<br/> Wipe with a dry, clean cloth or use a branded leather conditioner<br/>Click <a href="http://www.myntra.com/brown-smooth-leather-care">here</a> for the perfect care products for brown leather shoes</p></li><li class="desc-sub-title">Size &amp; Fit</li><li class="desc-sub-text"><p><br/></p></li></ul>,26:02:2014,None
None,Language Men Black Leather Smart Casual Shoes,http://www.myntra.com/Formal-Shoes/Language/Language-Men-Black-Leather-Smart-Casual-Shoes/203612/buy,Rs. 5,841,sale-men-footwear,Footwear,Language,http://myntra.myntassets.com/images/style/properties/Language-Men-Black-Leather-Smart-Casual-Shoes_07a2b07a5a11da0f411b5fd07d0d6bcd_images_1080_1440_mini.jpg,Rs. 6,490,None,sale,http://www.myntra.com/Formal-Shoes/Language/Language-Men-Black-Leather-Smart-Casual-Shoes/203612/buy,Sold byVector Ecommerce Pvt Ltd,None,None,['6', '6.5', '7', '8', '9', '10', '11'],None,<ul class="mk-pdpv1-product-helper mk-cf"><li class="desc-main-title">Product Description</li><li class="desc-sub-title">Style Note</li><li class="desc-sub-text " itemprop="description"><p>These formal shoes from Language have the ability to make your everyday formals look different. The stylised upper lightens the serious look, while the luxurious leather adds class.</p></li><li class="desc-sub-title ">Product Details</li><li class="desc-sub-text"><p>Square toed, black derby shoes with central lace-ups and low top styling<br/>Leather upper with stitched and overlay detail, has perforated design detail at forefoot and sides<br/>Reinforced overlay at the heel collar<br/>Soft and padded footbed with branding<br/>Tough and textured outsole with stack heels<br/>Warranty: 6 months warranty against manufacturing defects</p></li><li class="desc-sub-title ">Material &amp; Care</li><li class="desc-sub-text "><p>Leather<br/>Wipe with a clean, dry cloth when needed<br/> Click <a href="http://www.myntra.com/black-smooth-leather-care">here</a> for the perfect care products for black leather shoes</p></li></ul>,26:02:2014,None
None,Language Men Black Monk Strap Shoes,http://www.myntra.com/Formal-Shoes/Language/Language-Men-Black-Monk-Strap-Shoes/203615/buy,Rs. 6,166,sale-men-footwear,Footwear,Language,http://myntra.myntassets.com/images/style/properties/Language-Men-Black-Casual-Shoes_27ee82dba992bfbeb53dbcd0b033b38b_images_1080_1440_mini.jpg,Rs. 6,490,None,sale,http://www.myntra.com/Formal-Shoes/Language/Language-Men-Black-Monk-Strap-Shoes/203615/buy,Sold byVector Ecommerce Pvt Ltd,None,None,['6', '6.5', '7', '8', '9', '10', '11'],None,<ul class="mk-pdpv1-product-helper mk-cf"><li class="desc-main-title">Product Description</li><li class="desc-sub-title">Style Note</li><li class="desc-sub-text " itemprop="description"><p>These shoes from Language promise to add a finishing touch of class and style to your ensemble. Wear this pair with a light coloured shirt, a corduroy jacket and dark chinos when going for a lunch date and exude inimitable style.</p></li><li class="desc-sub-title ">Product Details</li><li class="desc-sub-text"><p>Square toed, black casual shoes with a buckle closure and low top styling<br/>Leather upper with stitched and overlay detail<br/>Has a tab across the midfoot with a buckle closure that has an elasticated insert<br/>Soft and padded footbed with branding<br/>Tough and textured outsole with a stack heel<br/>Warranty: 6 months warranty against manufacturing defects</p></li><li class="desc-sub-title ">Material &amp; Care</li><li class="desc-sub-text "><p>Leather<br/>Wipe with a clean, dry cloth when needed<br/>Click <a href="http://www.myntra.com/black-smooth-leather-care">here</a> for the perfect care products for black leather shoes</p></li></ul>,26:02:2014,None
None,Language Men Black Leather Formal Shoes,http://www.myntra.com/Formal-Shoes/Language/Language-Men-Black-Leather-Formal-Shoes/218335/buy,Rs. 5,841,sale-men-footwear,Footwear,Language,http://myntra.myntassets.com/images/style/properties/Language-Men-Black-Leather-Formal-Shoes_e187fba04fdb47d089a48ee9a8de277a_images_1080_1440_mini.jpg,Rs. 6,490,None,sale,http://www.myntra.com/Formal-Shoes/Language/Language-Men-Black-Leather-Formal-Shoes/218335/buy,Sold byVector Ecommerce Pvt Ltd,None,None,['6.5', '7', '7.5', '8', '9', '9.5', '11'],None,<ul class="mk-pdpv1-product-helper mk-cf"><li class="desc-main-title">Product Description</li><li class="desc-sub-title">Style Note</li><li class="desc-sub-text " itemprop="description"><p>Complete your formal look with this pair of shoes from Language. Crafted from leather, this pair makes a distinctly stylish impression. Wear yours with a well-tailored pair of trousers and shirt to look your formal best.</p></li><li class="desc-sub-title ">Product Details</li><li class="desc-sub-text"><p>Round toed, black brogue shoes with central lace-ups and low top styling<br/>Leather upper with overlays, stitched detail, perforations, and reinforced heel collar<br/>Soft tongue and cushioned footbed with branding at the heel<br/>Tough outsole with stitched detail, branding, and has a stacked heel<br/>Warranty: 6 months against manufacturing defects</p></li><li class="desc-sub-title ">Material &amp; Care</li><li class="desc-sub-text "><p>Leather<br/>Use a branded leather polish to clean the product<br/>Click <a href="http://www.myntra.com/black-smooth-leather-care">here</a> for the perfect care products for black leather shoes</p></li></ul>,26:02:2014,None
None,Language Men Dark Brown Casual Shoes,http://www.myntra.com/Casual-Shoes/Language/Language-Men-Dark-Brown-Casual-Shoes/174567/buy,Rs. 4,792,sale-men-footwear,Footwear,Language,http://myntra.myntassets.com/images/style/properties/Language-Men-Brown-Casual-Shoes_c693ab7de0a05996f98234b073527637_images_1080_1440_mini.JPG,Rs. 5,990,None,sale,http://www.myntra.com/Casual-Shoes/Language/Language-Men-Dark-Brown-Casual-Shoes/174567/buy,Sold byVector Ecommerce Pvt Ltd,None,None,['7', '7.5', '8', '9', '9.5'],None,<ul class="mk-pdpv1-product-helper mk-cf"><li class="desc-main-title">Product Description</li><li class="desc-sub-title">Style Note</li><li class="desc-sub-text " itemprop="description"><p>A stylish pair of shoes for casual outings, this one from Language is replete with features to enhance your style and comfort. Team this with jeans and a tee for casual outing.</p></li><li class="desc-sub-title ">Product Details</li><li class="desc-sub-text"><p>Round toed, dark brown casual shoes with brown accents, has central lace-ups and low top styling<br/>Leather upper with stitched detail, has perforated detail, braided overlay along the edges and reinforced overlay at the heel collar<br/>Soft tongue and inner<br/>Comfortable footbed with branding at the heel<br/>Tough outsole with a stacked heel<br/>Warranty: 6 months warranty against manufacturing defects</p></li><li class="desc-sub-title ">Material &amp; Care</li><li class="desc-sub-text "><p>Leather<br/>Use a branded leather conditioner to clean</p></li></ul>,26:02:2014,None
None,Language Men Brown Leather Casual Shoes,http://www.myntra.com/Casual-Shoes/Language/Language-Men-Brown-Leather-Casual-Shoes/218333/buy,Rs. 4,491,sale-men-footwear,Footwear,Language,http://myntra.myntassets.com/images/style/properties/Language-Men-Brown-Leather-Casual-Shoes_efbb9033be05f2771c4d452502f98cd6_images_1080_1440_mini.jpg,Rs. 4,990,None,sale,http://www.myntra.com/Casual-Shoes/Language/Language-Men-Brown-Leather-Casual-Shoes/218333/buy,Sold byVector Ecommerce Pvt Ltd,None,None,['6.5', '7', '7.5', '8', '9', '9.5', '11'],None,<ul class="mk-pdpv1-product-helper mk-cf"><li class="desc-main-title">Product Description</li><li class="desc-sub-title">Style Note</li><li class="desc-sub-text " itemprop="description"><p>Language never compromises on the design and comfort of shoes. Smart and simple in design, this pair of casual shoes is best worn with denims and a slim fit shirt.</p></li><li class="desc-sub-title ">Product Details</li><li class="desc-sub-text"><p>Round toed, brown casual shoes with slip-on and high top styling<br/>Leather, textured upper with overlays, stitched detail, elasticated inserts on the sides, and reinforced heel collar with a pull tab detail<br/>Cushioned footbed with branding at the heel<br/>Tough and textured outsole with patterned grooves, stitched detail and has a stacked heel<br/>Warranty: 6 months against manufacturing defects</p></li><li class="desc-sub-title ">Material &amp; Care</li><li class="desc-sub-text "><p>Leather<br/>Use a branded leather conditioner to clean the product<br/>Click <a href="http://www.myntra.com/brown-smooth-leather-care">here</a> for the perfect care products for brown leather shoes</p></li></ul>,26:02:2014,None
None,Language Men Brown Casual Shoes,http://www.myntra.com/Casual-Shoes/Language/Language-Men-Brown-Casual-Shoes/174564/buy,Rs. 4,193,sale-men-footwear,Footwear,Language,http://myntra.myntassets.com/images/style/properties/Language-Men-Brown-Casual-Shoes_3fffe1db4c5e22f537acd42b0022b397_images_1080_1440_mini.jpg,Rs. 5,990,None,sale,http://www.myntra.com/Casual-Shoes/Language/Language-Men-Brown-Casual-Shoes/174564/buy,Sold byVector Ecommerce Pvt Ltd,None,None,['7', '7.5', '8', '9', '9.5'],None,<ul class="mk-pdpv1-product-helper mk-cf"><li class="desc-main-title">Product Description</li><li class="desc-sub-title">Style Note</li><li class="desc-sub-text " itemprop="description"><p>A stylish pair of shoes for casual outings, this one from Language is replete with features to enhance your style and comfort. Team this with jeans and a tee for casual outing.</p></li><li class="desc-sub-title ">Product Details</li><li class="desc-sub-text"><p>Round toed, brown casual shoes with central lace-ups and low top styling<br/>Leather upper with overlays and stitched detail, has reinforced overlay at the heel collar<br/>Soft tongue and inner<br/>Comfortable footbed with branding at the heel<br/>Tough and textured outsole<br/>Warranty: 6 months warranty against manufacturing defects</p></li><li class="desc-sub-title ">Material &amp; Care</li><li class="desc-sub-text "><p>Leather<br/>Use a branded leather conditioner to clean</p></li></ul>,26:02:2014,None
None,Language Men Brown Leather Formal Shoes,http://www.myntra.com/Formal-Shoes/Language/Language-Men-Brown-Leather-Formal-Shoes/218334/buy,Rs. 5,841,sale-men-footwear,Footwear,Language,http://myntra.myntassets.com/images/style/properties/Language-Men-Formal-Shoes_475de19bab7f4228413800b02492610c_images_1080_1440_mini.jpg,Rs. 6,490,None,sale,http://www.myntra.com/Formal-Shoes/Language/Language-Men-Brown-Leather-Formal-Shoes/218334/buy,Sold byVector Ecommerce Pvt Ltd,None,None,['7', '7.5', '8', '9', '9.5'],None,<ul class="mk-pdpv1-product-helper mk-cf"><li class="desc-main-title">Product Description</li><li class="desc-sub-title">Style Note</li><li class="desc-sub-text " itemprop="description"><p>Complete your formal look with this pair of shoes from Language. Crafted from leather, this pair makes a distinctly stylish impression. Wear yours with a well-tailored pair of trousers and shirt to look your formal best.</p></li><li class="desc-sub-title ">Product Details</li><li class="desc-sub-text"><p>Round toed, brown formal shoes with central lace-ups and low top styling<br/>Leather upper with stitched overlays, perforated detail, and reinforced heel collar<br/>Soft tongue and cushioned footbed with branding at the heel<br/>Tough outsole with texturing at forefoot, has a stacked heel<br/>Warranty: 6 months against manufacturing defects</p></li><li class="desc-sub-title ">Material &amp; Care</li><li class="desc-sub-text "><p>Leather<br/>Use a branded leather polish to clean the product<br/>Click <a href="http://www.myntra.com/brown-smooth-leather-care">here</a> for the perfect care products for brown leather shoes</p></li></ul>,26:02:2014,None
None,Language Men Black Leather Loafers,http://www.myntra.com/Formal-Shoes/Language/Language-Men-Black-Leather-Loafers/86289/buy,Rs. 3,143,sale-men-footwear,Footwear,Language,http://myntra.myntassets.com/images/style/properties/Language-Men-Casual-Shoes_b6825e5a859e84925649242236e52d92_images_1080_1440_mini.jpg,Rs. 4,490,None,sale,http://www.myntra.com/Formal-Shoes/Language/Language-Men-Black-Leather-Loafers/86289/buy,Sold byVector Ecommerce Pvt Ltd,None,None,['6', '6.5', '7', '8', '9', '10', '11'],None,<ul class="mk-pdpv1-product-helper mk-cf"><li class="desc-main-title">Product Description</li><li class="desc-sub-title">Style Note</li><li class="desc-sub-text " itemprop="description"><p>Language presents its brand new 2012 collection of footwear for men. A spunky, avant-garde range that combines classic handcrafted styles with edgy urban instincts to give it a fun twist. Wear this classic pair of loafers to work or for an upper crust event, exuding a classy persona.</p></li><li class="desc-sub-title ">Product Details</li><li class="desc-sub-text"><p>Black leather slip-on loafers<br/> Square toed with stitch detail at seams of toe box<br/> Grown on tongue with embossed branding<br/> Strap with triangular cut-out across middle of tongue, stitch detail at sides<br/> Panel around mouth of shoe, embossed branding on outer side<br/> Panel at heel with a raised ridge along the middle and stitch detail<br/> Reinforced collar at heel<br/> Slightly cushioned leather insole with perforations, printed branding at heel<br/> Rubber sole with horizontal groves for traction, stacked heel<br/>Warranty: Six months from the date of purchase</p></li><li class="desc-sub-title ">Material &amp; Care</li><li class="desc-sub-text "><p>Leather<br/> Use a branded leather conditioner to clean this product<br/> Do not expose to sunlight or water<br/>Click <a href="http://www.myntra.com/black-smooth-leather-care">here</a> for the perfect care products for black leather shoes</p></li><li class="desc-sub-title">Size &amp; Fit</li><li class="desc-sub-text"><p><br/></p></li></ul>,26:02:2014,None
None,Language Men Navy Leather Loafers,http://www.myntra.com/Casual-Shoes/Language/Language-Men-Navy-Leather-Loafers/203614/buy,Rs. 4,941,sale-men-footwear,Footwear,Language,http://myntra.myntassets.com/images/style/properties/Language-Men-Navy-Leather-Loafers_3036d44a68fb30ebef0c6d2a75ea2e63_images_1080_1440_mini.jpg,Rs. 5,490,None,sale,http://www.myntra.com/Casual-Shoes/Language/Language-Men-Navy-Leather-Loafers/203614/buy,Sold byVector Ecommerce Pvt Ltd,None,None,['6.5', '7', '7.5', '8', '9', '9.5', '11'],None,<ul class="mk-pdpv1-product-helper mk-cf"><li class="desc-main-title">Product Description</li><li class="desc-sub-title">Style Note</li><li class="desc-sub-text " itemprop="description"><p>Language never compromises on the design and comfort of their shoes. Smart and suave, these loafers are best worn with well-tailored trousers and slim fit shirts.</p></li><li class="desc-sub-title ">Product Details</li><li class="desc-sub-text"><p>Round toed, navy blue loafers with slip-on and low top styling<br/>Leather upper with stitched detail, has a cut-out at the forefoot region<br/>Reinforced overlay at the heel collar<br/>Soft and padded footbed with branding at the heel<br/>Tough outsole with circular nubs<br/>Warranty: 6 months warranty against manufacturing defects</p></li><li class="desc-sub-title ">Material &amp; Care</li><li class="desc-sub-text "><p>Leather<br/>Wipe with a clean, dry cloth when needed<br/>Click <a href="http://www.myntra.com/other-smooth-leather-care">here</a> for the perfect care products for leather shoes</p></li></ul>,26:02:2014,None
None,Language Men Green Casual Shoes,http://www.myntra.com/Casual-Shoes/Language/Language-Men-Green-Casual-Shoes/198805/buy,Rs. 3,392,sale-men-footwear,Footwear,Language,http://myntra.myntassets.com/images/style/properties/Language-Men-Casual-Shoes_77c4a6a208b85f4a92f3c397cbb14337_images_1080_1440_mini.jpg,Rs. 3,990,None,sale,http://www.myntra.com/Casual-Shoes/Language/Language-Men-Green-Casual-Shoes/198805/buy,Sold byVector Ecommerce Pvt Ltd,None,None,['6.5', '7', '7.5', '8', '9', '9.5', '11'],None,<ul class="mk-pdpv1-product-helper mk-cf"><li class="desc-main-title">Product Description</li><li class="desc-sub-title">Style Note</li><li class="desc-sub-text " itemprop="description"><p>We love this pair of casual shoes with easy slip-on styling, from Language. Wear these with your casual ensembles for a trendy and cool look.</p></li><li class="desc-sub-title ">Product Details</li><li class="desc-sub-text"><p>Square toed, green casual shoes with slip-on and loafers type styling<br/>Suede upper, with overlays, stitched detail along the seams of the forefoot<br/>Cushioned footbed with branding at the heel<br/>Tough outsole with textured circular nubs<br/>Warranty: 6 months against manufacturing defects</p></li><li class="desc-sub-title ">Material &amp; Care</li><li class="desc-sub-text "><p>Suede<br/>Use a branded suede conditioner to clean the product<br/>Click <a href="http://www.myntra.com/green-suede-care">here</a> for the perfect care products for green suede shoes</p></li></ul>,26:02:2014,None
None,Language Men Brown Suede Casual Shoes,http://www.myntra.com/Casual-Shoes/Language/Language-Men-Brown-Suede-Casual-Shoes/91079/buy,Rs. 3,493,sale-men-footwear,Footwear,Language,http://myntra.myntassets.com/images/style/properties/Language-Men-Brown-Suede-Casual-Shoes_a0f3ec839c1fdff8fe06a401e3ea0e5b_images_1080_1440_mini.jpg,Rs. 4,990,None,sale,http://www.myntra.com/Casual-Shoes/Language/Language-Men-Brown-Suede-Casual-Shoes/91079/buy,Sold byVector Ecommerce Pvt Ltd,None,None,['6', '6.5', '7', '8', '9', '10', '11'],None,<ul class="mk-pdpv1-product-helper mk-cf"><li class="desc-main-title">Product Description</li><li class="desc-sub-title">Style Note</li><li class="desc-sub-text " itemprop="description"><p>This pair of shoes from Language has been specially handcrafted using natural suede, which adds a unique beauty to it. Wear it with crisp formal shirts and slim fit trousers to make a perfect impression on those business meetings and interviews.</p></li><li class="desc-sub-title ">Product Details</li><li class="desc-sub-text"><p>Round toed, brown shoes with central lace-ups and mid top styling<br/> Suede upper with stitched detail along the seams of the shoe box, overlay at the heel and reinforced heel collar<br/> Soft comfortable footbed with branding<br/> Durable textured outsole for ergonomic comfort<br/> Warranty: 6 months from the date of purchase</p></li><li class="desc-sub-title ">Material &amp; Care</li><li class="desc-sub-text "><p>Genuine suede with leather<br/> Wipe with a dry, clean cloth or use a branded leather conditioner</p></li></ul>,26:02:2014,None
