None,Casio Sheen Women Silver Toned Dial Watch,http://www.myntra.com/watches/casio/casio-sheen-women-silver-toned-dial-watch/209911/buy,Rs. 7,995,women-watches,Watches,Lee Cooper,http://myntra.myntassets.com/images/style/properties/Casio-Sheen-Women-Silver-Toned-Dial-Watch_811ae974552cf3e73be78414d10d0618_images_1080_1440_mini.jpg,None,None,women,http://www.myntra.com/watches/casio/casio-sheen-women-silver-toned-dial-watch/209911/buy,Sold byVector Ecommerce Pvt Ltd,None,None,single size,None,<ul class="mk-pdpv1-product-helper mk-cf"><li class="desc-main-title">Product Description</li><li class="desc-sub-title">Style Note</li><li class="desc-sub-text " itemprop="description"><p>This wrist watch by Sheen from Casio comes in the latest styles and trends. Designed with a classy look and for versatile use, it'll be a great accessory to wear everyday.</p></li><li class="desc-sub-title ">Product Details</li><li class="desc-sub-text"><p>Case style: Analogue watch with a circular stainless steel case<br/>Dial style: Silver toned dial, steel toned and white hands, rose gold toned and studded markings, branding on the dial<br/>Features: Screw to reset the time, day and date display<br/>Strap style: Metal, bracelet style strap with a butterfly clasp closure<br/>Water resistant up to 30 m<br/>Comes in a signature Sheen case<br/>Warranty: 1 year against manufacturing defects</p></li><li class="desc-sub-title">Size &amp; Fit</li><li class="desc-sub-text"><p>Dial width: 35 mm<br/>Strap width: 15 mm</p></li></ul>,26:02:2014,None
None,Maxima Women Pink Dial Watch,http://www.myntra.com/watches/maxima/maxima-women-pink-dial-watch/182205/buy,Rs. 1,035,women-watches,Watches,Lee Cooper,http://myntra.myntassets.com/images/style/properties/Maxima-Women-Pink-Dial-Watch_93aca7763e45898c7f554f9edd1794bd_images_1080_1440_mini.jpg,Rs. 1,150,None,women,http://www.myntra.com/watches/maxima/maxima-women-pink-dial-watch/182205/buy,Sold byVector Ecommerce Pvt Ltd,None,None,single size,None,<ul class="mk-pdpv1-product-helper mk-cf"><li class="desc-main-title">Product Description</li><li class="desc-sub-title">Style Note</li><li class="desc-sub-text " itemprop="description"><p>Contouring your wrist, this timepiece from Maxima lends class to any off-duty ensemble. The new range of watches is a fresh take on the eye for perfection and are a great accessory to any ensemble.</p></li><li class="desc-sub-title ">Product Details</li><li class="desc-sub-text"><p>Case style: Analogue watch with a stainless steel, oval shaped case<br/>Dial style: Pink dial with light pink floral accents, has steel toned hands, branding and stone studded detail at the 12 hour mark<br/>Features: Screw to reset the time<br/>Strap style: Stainless steel, mesh-like strap with a fold over clasp<br/>Water resistant up to 30 m<br/>Comes in a signature Maxima case<br/>Warranty: 1 year against manufacturing defects</p></li><li class="desc-sub-title">Size &amp; Fit</li><li class="desc-sub-text"><p>Dial dimensions: 34 mm x 18 mm<br/>Strap width: 16 mm</p></li></ul>,26:02:2014,None
None,ESPRIT Women Silver Dial Watch,http://www.myntra.com/watches/esprit/esprit-women-silver-dial-watch/212352/buy,Rs. 10,795,women-watches,Watches,Lee Cooper,http://myntra.myntassets.com/images/style/properties/Esprit-Women-Metal-Watch_bf2b037bc2a2c6a971aedf5753e0b7c3_images_1080_1440_mini.jpg,None,None,women,http://www.myntra.com/watches/esprit/esprit-women-silver-dial-watch/212352/buy,Sold byVector Ecommerce Pvt Ltd,None,None,single size,None,<ul class="mk-pdpv1-product-helper mk-cf"><li class="desc-main-title">Product Description</li><li class="desc-sub-title">Style Note</li><li class="desc-sub-text " itemprop="description"><p>Crafted with finesse, this ESPRIT watch is every watch collector's dream. Accessorise your look and add class with this exclusive timepiece for those cocktail hours, weekend escapes, date nights or power lunches.</p></li><li class="desc-sub-title ">Product Details</li><li class="desc-sub-text"><p>Case style: Analogue watch has a stainless steel rectangular case with crystal studded embellishment on the dial<br/>Dial style: Silver toned dial, steel hands and hour markings, branding at the 6 hour mark<br/>Features: Screw to reset time<br/>Strap style: Metal bracelet style strap with crystal embellishments enclosed with a fold over clasp<br/>Water resistant<br/>Comes in a ESPRIT signature case<br/>Warranty: 2 years limited warranty</p></li><li class="desc-sub-title">Size &amp; Fit</li><li class="desc-sub-text"><p>Dial dimension: 33 mm x 17 mm<br/>Strap width: 17 mm</p></li></ul>,26:02:2014,None
None,Timex Empera Women Silver Toned Dial Watch,http://www.myntra.com/watches/timex/timex-empera-women-silver-toned-dial-watch/233847/buy,Rs. 4,345,women-watches,Watches,Lee Cooper,http://myntra.myntassets.com/images/style/properties/Timex-Women-Watches_ac3f6d660d6bcc1dc74e87bd1c5cccb1_images_1080_1440_mini.jpg,None,None,women,http://www.myntra.com/watches/timex/timex-empera-women-silver-toned-dial-watch/233847/buy,Sold byVector Ecommerce Pvt Ltd,None,None,single size,None,<ul class="mk-pdpv1-product-helper mk-cf"><li class="desc-main-title">Product Description</li><li class="desc-sub-title">Style Note</li><li class="desc-sub-text " itemprop="description"><p>Add sophistication to your style with this watch from Timex. With unique design and finish, this is sure to enhance your look.</p></li><li class="desc-sub-title ">Product Details</li><li class="desc-sub-text"><p>Case style: Analogue watch with a stainless steel circular case with stone studded detail on the rim of the dial<br/>Dial style: Silver toned dial with branding, has gold toned hands and stone studded markings<br/>Features: Screw to reset time<br/>Strap style: Silver toned bracelet style strap with gold toned accents and stone studded detail, secured with a foldover closure<br/>Water resistant<br/>Comes in a signature Timex case<br/>Warranty: 1 year from date of purchase against manufacturing defects</p></li><li class="desc-sub-title">Size &amp; Fit</li><li class="desc-sub-text"><p>Dial width: 20 mm<br/>Strap width: 8 mm</p></li></ul>,26:02:2014,None
None,Olvin Women White & Green Dial Watch,http://www.myntra.com/watches/olvin/olvin-women-white-green-dial-watch/241342/buy,Rs. 695,women-watches,Watches,Lee Cooper,http://myntra.myntassets.com/images/style/properties/Olvin-Women-White-Dial-Watch_d0ce69d0de814562ec946f944b23906e_images_1080_1440_mini.jpg,None,None,women,http://www.myntra.com/watches/olvin/olvin-women-white-green-dial-watch/241342/buy,Sold byVector Ecommerce Pvt Ltd,None,None,single size,None,<ul class="mk-pdpv1-product-helper mk-cf"><li class="desc-main-title">Product Description</li><li class="desc-sub-title">Style Note</li><li class="desc-sub-text " itemprop="description"><p>Add this chic and modish watch from Olvin to your collection as it will definitely meet your fashion and practical needs. Team it with either your evening attire or casual ensemble for a perfect look.</p></li><li class="desc-sub-title ">Product Details</li><li class="desc-sub-text"><p>Case style: Analogue watch with a stylised rectangular case and a stainless steel back<br/>Dial style: White dial with green accents, steel toned hands and markings along with branding at the 12 hour mark<br/>Features: Screw to reset time<br/>Strap style: White leather strap secured with a tang clasp<br/>Water resistant<br/>Comes in a signature Olvin case<br/>Warranty: 1 year against manufacturing defects</p></li><li class="desc-sub-title">Size &amp; Fit</li><li class="desc-sub-text"><p>Dial dimension: 23 mm x 32 mm<br/>Strap width: 16 mm</p></li></ul>,26:02:2014,None
None,Q&Q Attractive Women White Dial Watch,http://www.myntra.com/watches/qq/qq-attractive-women-white-dial-watch/107057/buy,Rs. 1,463,women-watches,Watches,Lee Cooper,http://myntra.myntassets.com/images/style/properties/Q&Q-Women-Watches_40236b6868416ea225510a0ea46acfa3_images_1080_1440_mini.jpg,Rs. 1,625,None,women,http://www.myntra.com/watches/qq/qq-attractive-women-white-dial-watch/107057/buy,Sold byVector Ecommerce Pvt Ltd,None,None,single size,None,<ul class="mk-pdpv1-product-helper mk-cf"><li class="desc-main-title">Product Description</li><li class="desc-sub-title">Style Note</li><li class="desc-sub-text " itemprop="description"><p>A classic watch with a glamorous twist and the elegance of white, Q&amp;Q sure knows how to make it stand out. The smart way to incorporate gold into your look, we recommend that you team it with casuals at an evening do.</p></li><li class="desc-sub-title ">Product Details</li><li class="desc-sub-text"><p>Case style: Analog watch with a stainless steel, ion plated, gold coloured case, steel coloured back and embedded crystal detail around the dial<br/>Dial  style: White dial with gold hour marks, alternate hour marks have sparkle detail, gold coloured hands and branding on the dial<br/>Strap style: White strap with tang clasp<br/>Features: Screw to reset time<br/>Water resistant up to 3 Bar<br/>Warranty: 1 year</p></li><li class="desc-sub-title">Size &amp; Fit</li><li class="desc-sub-text"><p>Case Diameter: 33 mm<br/>Case Thickness: 5 mm</p></li></ul>,26:02:2014,None
None,Titan Raga Women Silver Toned & Blue Dial Watch,http://www.myntra.com/watches/titan/titan-raga-women-silver-toned-blue-dial-watch/240237/buy,Rs. 3,495,women-watches,Watches,Lee Cooper,http://myntra.myntassets.com/images/style/properties/Titan-Raga-Women-Silver-Toned-Dial-Watch_cb747ce30bb5b1c48ea1ffd188d24d65_images_1080_1440_mini.jpg,None,None,women,http://www.myntra.com/watches/titan/titan-raga-women-silver-toned-blue-dial-watch/240237/buy,Sold byVector Ecommerce Pvt Ltd,None,None,single size,None,<ul class="mk-pdpv1-product-helper mk-cf"><li class="desc-main-title">Product Description</li><li class="desc-sub-title">Style Note</li><li class="desc-sub-text " itemprop="description"><p>This intricately designed watch from Titan Raga is sure to enchant you. Pair it with a dress and flaunt your personal style.</p></li><li class="desc-sub-title ">Product Details</li><li class="desc-sub-text"><p>Case style: Analogue watch with an oval shaped case and stainless steel back<br/>Dial style: Silver toned dial with blue accents and printed detail, has steel toned hands, stone studded markings, branding on the dial<br/>Features: Screw to reset the time<br/>Strap style: Steel toned, bracelet style strap secured with a fold over clasp<br/>Water resistant up to 30 m<br/>Comes in signature Titan Raga case<br/>Warranty: 2 years against manufacturing defects</p></li><li class="desc-sub-title">Size &amp; Fit</li><li class="desc-sub-text"><p>Dial dimensions: 16 mm x 27 mm<br/>Strap width: 5 mm</p></li></ul>,26:02:2014,None
None,Titan Women Brown Dial Watch,http://www.myntra.com/watches/titan/titan-women-brown-dial-watch/229265/buy,Rs. 2,995,women-watches,Watches,Lee Cooper,http://myntra.myntassets.com/images/style/properties/Titan-Women-Watches_bc92fc29356ecd9a8f91aadcb1a8d5a0_images_1080_1440_mini.jpg,None,None,women,http://www.myntra.com/watches/titan/titan-women-brown-dial-watch/229265/buy,Sold byVector Ecommerce Pvt Ltd,None,None,single size,None,<ul class="mk-pdpv1-product-helper mk-cf"><li class="desc-main-title">Product Description</li><li class="desc-sub-title">Style Note</li><li class="desc-sub-text " itemprop="description"><p>A fashion accessory that comes with great performance and style is this elegant watch from Titan. The classic design will complement your formals and semi-formals perfectly.</p></li><li class="desc-sub-title ">Product Details</li><li class="desc-sub-text"><p>Case style: Analogue watch with a gold toned, oval case, has stainless steel back<br/>Dial style: Brown, textured dial with stone studded markings, gold toned hands, has branding at the twelve hour mark<br/>Features: Screw to reset the time<br/>Strap style: Brown, textured leather strap with a gold toned tang clasp<br/>Water resistant up to 30 metres<br/>Comes in a signature Titan case<br/>Warranty: 2 years against manufacturing defects</p></li><li class="desc-sub-title">Size &amp; Fit</li><li class="desc-sub-text"><p>Dial dimensions: 40 X 15 mm<br/>Strap width: 7 mm</p></li></ul>,26:02:2014,None
None,Q&Q Attractive Women Pink Dial Watch,http://www.myntra.com/watches/qq/qq-attractive-women-pink-dial-watch/107054/buy,Rs. 1,436,women-watches,Watches,Lee Cooper,http://myntra.myntassets.com/images/style/properties/Q&Q-Women-Watches_67c26c59f375348ad5a621d6ed0fa0f9_images_1080_1440_mini.jpg,Rs. 1,595,None,women,http://www.myntra.com/watches/qq/qq-attractive-women-pink-dial-watch/107054/buy,Sold byVector Ecommerce Pvt Ltd,None,None,single size,None,<ul class="mk-pdpv1-product-helper mk-cf"><li class="desc-main-title">Product Description</li><li class="desc-sub-title">Style Note</li><li class="desc-sub-text " itemprop="description"><p>A classic watch with a glamorous twist, Q&amp; Q sure knows how to make it stand out. The unusual pink dial and strap adds to the aesthetic. The tasteful use of crystal and sparkle makes it party wear ready.</p></li><li class="desc-sub-title ">Product Details</li><li class="desc-sub-text"><p>Case style: Analog watch with a stainless steel, ion plated case, has embedded crystal detail around the dial<br/>Dial  style: Pink dial with steel and white hands, steel hour marks with sparkle detail and branding on the dial<br/>Strap style: Pink strap with tang clasp<br/>Features: Screw to reset time<br/>Water resistant up to 3 Bar<br/>Warranty: 1 year</p></li><li class="desc-sub-title">Size &amp; Fit</li><li class="desc-sub-text"><p>Case Diameter: 37 mm<br/>Case Thickness: 6 mm</p></li></ul>,26:02:2014,None
None,Figo Fashion Women Pink Dial Watch,http://www.myntra.com/watches/figo-fashion/figo-fashion-women-pink-dial-watch/196475/buy,Rs. 999,women-watches,Watches,Lee Cooper,http://myntra.myntassets.com/images/style/properties/Figo-Fashion-Women-Pink-Dial-Watch_29d927c4ce536442da8c244b76b501d9_images_1080_1440_mini.jpg,None,None,women,http://www.myntra.com/watches/figo-fashion/figo-fashion-women-pink-dial-watch/196475/buy,Sold byVector Ecommerce Pvt Ltd,None,None,single size,None,<ul class="mk-pdpv1-product-helper mk-cf"><li class="desc-main-title">Product Description</li><li class="desc-sub-title">Style Note</li><li class="desc-sub-text " itemprop="description"><p>Update your accessory range this season with Figo Fashion's range of stylish timepieces. This wrist watch is designed with a classy look and for versatile use making it a perfect everyday wear.</p></li><li class="desc-sub-title ">Product Details</li><li class="desc-sub-text"><p>Case style: Analogue watch with a rectangular, high quality metal alloy case<br/> Dial style: Pink dial with steel toned hands and markings, and branding at the 12 hour mark<br/> Features: Screw to reset the time<br/> Strap style: Textured pink genuine leather strap with a tang clasp closure<br/> Water resistant<br/> Comes in a signature Figo Fashion case<br/> Warranty: 1 year against manufacturing defects</p></li><li class="desc-sub-title">Size &amp; Fit</li><li class="desc-sub-text"><p>Dial dimension: 20 mm x 17 mm<br/> Strap width: 12 mm</p></li></ul>,26:02:2014,None
None,Titan Raga Women Silver Toned Dial Watch,http://www.myntra.com/watches/titan/titan-raga-women-silver-toned-dial-watch/229131/buy,Rs. 3,295,women-watches,Watches,Lee Cooper,http://myntra.myntassets.com/images/style/properties/Titan-Women-Watches_27c4f9a52f95875cb1ad7fc043c4ca07_images_1080_1440_mini.jpg,None,None,women,http://www.myntra.com/watches/titan/titan-raga-women-silver-toned-dial-watch/229131/buy,Sold byVector Ecommerce Pvt Ltd,None,None,single size,None,<ul class="mk-pdpv1-product-helper mk-cf"><li class="desc-main-title">Product Description</li><li class="desc-sub-title">Style Note</li><li class="desc-sub-text " itemprop="description"><p>A fashion accessory that comes with great performance and style is this elegant watch from Titan Raga. The classic design will complement your formals and semi-formals perfectly.</p></li><li class="desc-sub-title ">Product Details</li><li class="desc-sub-text"><p>Case style: Analogue watch with a circular case and stainless steel back<br/>Dial style: Silver toned dial, has steel toned hands and metallic studs at the hour marks, has branding at the 6 hour mark<br/>Features: Date display at the 3 hour mark, screw to reset the time<br/>Strap style: Steel toned, metallic, bracelet strap, has a fold over clasp<br/>Water resistant up to 30 m<br/>Comes in a signature Titan Raga case<br/>Warranty: 2 years against manufacturing defects</p></li><li class="desc-sub-title">Size &amp; Fit</li><li class="desc-sub-text"><p>Dial width: 25 mm<br/>Strap width: 5 mm</p></li></ul>,26:02:2014,None
None,Tommy Hilfiger Women White Dial Watch,http://www.myntra.com/watches/tommy-hilfiger/tommy-hilfiger-women-white-dial-watch/215490/buy,Rs. 6,495,women-watches,Watches,Lee Cooper,http://myntra.myntassets.com/images/style/properties/Tommy-Hilfiger-Women-Watches_9e265338fb6cb583c51e9679c769991e_images_1080_1440_mini.jpg,None,None,women,http://www.myntra.com/watches/tommy-hilfiger/tommy-hilfiger-women-white-dial-watch/215490/buy,Sold byVector Ecommerce Pvt Ltd,None,None,single size,None,<ul class="mk-pdpv1-product-helper mk-cf"><li class="desc-main-title">Product Description</li><li class="desc-sub-title">Style Note</li><li class="desc-sub-text " itemprop="description"><p>This watch from Tommy Hilfiger features the best of fresh styles fused together, making it a winning combination for any watch enthusiast! Wear it to exude an impeccable sense of style and attitude.</p></li><li class="desc-sub-title ">Product Details</li><li class="desc-sub-text"><p>Case style: Analogue watch, has a rectangular case, stainless steel back, crystal studded detail along the edges<br/>Dial style: White dial, stell toned hands with, seconds hand with orange accent, black and steel toned studded markings, branding near the 12 hour mark <br/>Features: Screw to reset time<br/>Strap style: White, textured leather strap with a tang clasp<br/>Water resistant up to 3 ATM<br/>Warranty: 2 year international warranty</p></li><li class="desc-sub-title">Size &amp; Fit</li><li class="desc-sub-text"><p>Dial dimensions: 32 mm x 22 mm<br/>Strap width: 13 mm</p></li></ul>,26:02:2014,None
None,Timex Women White Dial Watch,http://www.myntra.com/watches/timex/timex-women-white-dial-watch/237970/buy,Rs. 1,465,women-watches,Watches,Lee Cooper,http://myntra.myntassets.com/images/style/properties/Timex-Women-White-Dial-Watch_71fd495ec7e0c875f14aa83d86ea7f8e_images_1080_1440_mini.jpg,None,None,women,http://www.myntra.com/watches/timex/timex-women-white-dial-watch/237970/buy,Sold byVector Ecommerce Pvt Ltd,None,None,single size,None,<ul class="mk-pdpv1-product-helper mk-cf"><li class="desc-main-title">Product Description</li><li class="desc-sub-title">Style Note</li><li class="desc-sub-text " itemprop="description"><p>One fashion accessory that is sure to redefine your style statement is this watch from Timex. Team it with any casual or formal outfit for a fashionable look.</p></li><li class="desc-sub-title ">Product Details</li><li class="desc-sub-text"><p>Case style: Analogue watch with a circular case and stainless steel back<br/>Dial style: White dial with branding below the 12 hour mark, silver toned hands and markings<br/>Features: Screw to reset time<br/>Strap style: White, leather strap with a tang clasp and two loops<br/>Water resistant<br/>Comes in a signature Timex case<br/>Warranty: 1 year against manufacturing defects</p></li><li class="desc-sub-title">Size &amp; Fit</li><li class="desc-sub-text"><p>Dial width: 27 mm<br/>Strap width: 16 mm</p></li></ul>,26:02:2014,None
None,Casio Women Sheen Steel Watch,http://www.myntra.com/watches/casio/casio-women-sheen-steel-watch/25334/buy,Rs. 4,995,women-watches,Watches,Lee Cooper,http://myntra.myntassets.com/images/style/properties/Casio-Women-Sheen-Steel-Watch7209889f0a05a00de6f1d7dcab0b69b1_images_1080_1440_mini.jpg,None,None,women,http://www.myntra.com/watches/casio/casio-women-sheen-steel-watch/25334/buy,Sold byVector Ecommerce Pvt Ltd,None,None,single size,None,<ul class="mk-pdpv1-product-helper mk-cf"><li class="desc-main-title">Product Description</li><li class="desc-sub-title ">Product Details</li><li class="desc-sub-text"><p>Taking traditional designs and giving them a modern twist is what makes <a href="../casio-watches">casio watches</a> so desirable, and this classic analog wrist watch is no exception. Contemporary and trendy, it&amp;            rsquo s an affordable timepiece, with an exquisite design that highlights your individuality.<br/> <br/> <span style="font-style: normal  font-weight;">Case diameter:</span><span style="font-style: normal  font-weight;"> 30 mm<br/> </span><span style="font-style: normal  font-weight;">Case thickness: </span><span style="font-style: normal  font-weight;">6 mm<br/> </span><span style="font-style: normal  font-weight;">Dial shape: </span><span style="font-style: normal  font-weight;">Round<br/> </span><span style="font-style: normal  font-weight;">Warranty: </span><span style="font-style: normal  font-weight;">2 years<br/> <br/> Metallic case with crystal encrusted bezel<br/> <a href="../casio">casio</a> logo at the 12 hour mark<br/> Stainless steel strap with a butterfly clasp<br/> Metallic dial with metallic lines for numbers<br/> Polished hands to mark sub dials<br/> Screw to reset time, alarm and set the timer<br/> Solid case back made of stainless steel for enhanced durability</span></p></li></ul>,26:02:2014,None
None,Maxima Attivo Women Blue Watch,http://www.myntra.com/watches/maxima/maxima-attivo-women-blue-watch/103415/buy,Rs. 855,women-watches,Watches,Lee Cooper,http://myntra.myntassets.com/images/style/properties/Maxima-Attivo-Women-Blue-Dial-Watch_8322b8788ccb2e5062105982db845a36_images_1080_1440_mini.jpg,Rs. 950,None,women,http://www.myntra.com/watches/maxima/maxima-attivo-women-blue-watch/103415/buy,Sold byVector Ecommerce Pvt Ltd,None,None,single size,None,<ul class="mk-pdpv1-product-helper mk-cf"><li class="desc-main-title">Product Description</li><li class="desc-sub-title">Style Note</li><li class="desc-sub-text " itemprop="description"><p>An inventive way to reference colour pop, this watch from Maxima gives your casual outfits the required style update. We recommend that you match your accessories, like your handbag, shoes and earrings to the colour of this watch to draw more attention to it.</p></li><li class="desc-sub-title ">Product Details</li><li class="desc-sub-text"><p>Case style: Analog watch with a metal rectangular case<br/>Dial style: Blue dial with a striped detail, branding on the dial, steel coloured hands and hour marks<br/>Strap style: Blue leather strap with a tang clasp<br/>Features: Screw to reset time<br/>Water resistant up to 30 m<br/>Warranty: 1 year</p></li><li class="desc-sub-title">Size &amp; Fit</li><li class="desc-sub-text"><p>Case Dimensions: 25 mm x 20 mm<br/>Case Thickness: 7 mm</p></li></ul>,26:02:2014,None
None,Fastrack Women Silver Casual Watch,http://www.myntra.com/watches/fastrack/fastrack-women-silver-casual-watch/25675/buy,Rs. 1,895,women-watches,Watches,Lee Cooper,http://myntra.myntassets.com/images/style/properties/d50a076dbdfea5e839258f89fb3a548d_images_1080_1440_mini.jpg,None,None,women,http://www.myntra.com/watches/fastrack/fastrack-women-silver-casual-watch/25675/buy,Sold byVector Ecommerce Pvt Ltd,None,None,single size,None,<ul class="mk-pdpv1-product-helper mk-cf"><li class="desc-main-title">Product Description</li><li class="desc-sub-title ">Product Details</li><li class="desc-sub-text"><p>Inspired by <a href="../pretty-women">pretty women</a> and femininity, this <a href="../fastrack">fastrack</a> watch refuses to conform, with its stylish dial. Minimalist design, quadrilateral <a href="../face">face</a> and a white synthetic leather strap with pink stitch detailing, to give it a modern feel backed up by a steel case for optimal performance. Wear this with trendy, casual ensembles - colour-pop tees, denims and casual <a href="../sandals">sandals</a> or <a href="../shoes">shoes</a>.<br/><br/><strong>Case diameter</strong>: 23 mm<br/><strong>Case thickness</strong>: 5 mm<br/><strong>Dial shape</strong>: Quadrilateral<br/><br/>Steel case with a fixed bezel for added durability, style and comfort<br/>Synthetic leather strap with a tang clasp for comfort and style<br/>Silver and pink dial with branding between the 6 hour mark and brand logo at the 5 hour mark <br/>Quartz movement of time display <br/>Screw to reset time<br/>Solid case back made of stainless steel for enhanced durability<br/>Water resistant up to 30 meters allowing you to use it when washing your hands or in light rain</p></li></ul>,26:02:2014,None
