None,Nike Men Red Hooded Sweatshirt,http://www.myntra.com/Sweatshirts/Nike/Nike-Men-Red-Hooded-Sweatshirt/196432/buy,Rs. 3,147,sale-men-clothing,Clothing,Nike,http://myntra.myntassets.com/images/style/properties/Nike-Men-Red-Hooded-Sweatshirt_82b3a360e0257c3561c1bb92dd95f7c1_images_1080_1440_mini.jpg,Rs. 4,495,None,sale,http://www.myntra.com/Sweatshirts/Nike/Nike-Men-Red-Hooded-Sweatshirt/196432/buy,Sold byVector Ecommerce Pvt Ltd,None,None,['S', 'M', 'L', 'XL', 'XXL'],None,<ul class="mk-pdpv1-product-helper mk-cf"><li class="desc-main-title">Product Description</li><li class="desc-sub-title">Style Note</li><li class="desc-sub-text " itemprop="description"><p>Keep your style intact even during the coldest days with this Nike engineered sweatshirt that will keep you warm and cosy. Team it with a pair of cargo pants and canvas sneakers to complete this smart ensemble.</p></li><li class="desc-sub-title ">Product Details</li><li class="desc-sub-text"><p>Red sweatshirt, knitted, flat lock stitch detail, attached hood with contrast drawstring closure, panelled long sleeves with contrast elasticated binding at cuffs, full zipped closure at front, brand print at left chest, two insert pockets at front waist, ribbed hem band<br/>Warranty for manufacturing defects: 6 months (not valid on products with more than 20% discount)</p></li><li class="desc-sub-title ">Material &amp; Care</li><li class="desc-sub-text "><p>66% cotton, 34% polyester<br/>Machine wash warm</p></li><li class="desc-sub-title">Size &amp; Fit</li><li class="desc-sub-text"><p>Regular fit<br/>The model (height 6' and shoulders 18") is wearing a size M</p></li></ul>,26:02:2014,None
None,Nike Men White Jordan Black Tie T-Shirt,http://www.myntra.com/Tshirts/Nike/Nike-Men-White-Jordan-Black-Tie-T-Shirt/184400/buy,Rs. 1,526,sale-men-clothing,Clothing,Nike,http://myntra.myntassets.com/images/style/properties/Nike-Men-White-Jordan-Black-Tie-T-Shirt_006d1e2917efd51d01e944d262bb88f4_images_1080_1440_mini.jpg,Rs. 1,795,None,sale,http://www.myntra.com/Tshirts/Nike/Nike-Men-White-Jordan-Black-Tie-T-Shirt/184400/buy,Sold byVector Ecommerce Pvt Ltd,None,None,['S', 'M', 'L', 'XL', 'XXL'],None,<ul class="mk-pdpv1-product-helper mk-cf"><li class="desc-main-title">Product Description</li><li class="desc-sub-title">Style Note</li><li class="desc-sub-text " itemprop="description"><p>Keeping you cool and dry, this T-shirt from Nike is sure to become a favourite for your morning jogs. Team it with track pants or shorts and sturdy trainers, and you're good to go.</p></li><li class="desc-sub-title ">Product Details</li><li class="desc-sub-text"><p>White T-shirt, knitted, ribbed round neck, short sleeves, print at chest, branding near front left hem, print at back below neck<br/><br/>Warranty for manufacturing defects: 6 months (not valid on products with more than 20% discount)</p></li><li class="desc-sub-title ">Material &amp; Care</li><li class="desc-sub-text "><p>100% cotton<br/>Machine wash cold</p></li><li class="desc-sub-title">Size &amp; Fit</li><li class="desc-sub-text"><p>Regular fit<br/>The model (height 6' and shoulders 18") is wearing a size M</p></li></ul>,26:02:2014,None
None,Nike Men Navy Manchester City FC Squad T-shirt,http://www.myntra.com/Tshirts/Nike/Nike-Men-Navy-Manchester-City-FC-Squad-T-shirt/196552/buy,Rs. 2,291,sale-men-clothing,Clothing,Nike,http://myntra.myntassets.com/images/style/properties/Nike-Men-Navy-Manchester-City-FC-Squad-Jersey_3e40cee38ad90bc162d78866b6487ad7_images_1080_1440_mini.jpg,Rs. 2,695,None,sale,http://www.myntra.com/Tshirts/Nike/Nike-Men-Navy-Manchester-City-FC-Squad-T-shirt/196552/buy,Sold byVector Ecommerce Pvt Ltd,None,None,['S', 'M', 'L', 'XL', 'XXL'],None,<ul class="mk-pdpv1-product-helper mk-cf"><li class="desc-main-title">Product Description</li><li class="desc-sub-title">Style Note</li><li class="desc-sub-text " itemprop="description"><p>Get into the mood of football with this Manchester City FC jersey from Nike. It is ultra-comfortable, featuring Dri-FIT and Stay Cool technologies to provide ventilation and manage moisture. Wear it with shorts and cleats for your weekly match.</p></li><li class="desc-sub-title ">Product Details</li><li class="desc-sub-text"><p>Navy blue football jersey with white accents, knitted with Dri-FIT and Stay Cool technologies, round neck with trim that tapers towards front, panelled short sleeves, embroidered branding at right chest, M.C.F.C badge at left chest, back yoke with printed branding, striped panel below yoke<br/>Warranty: 6 months against manufacturing defects (not valid on products with more than 20% discount)</p></li><li class="desc-sub-title ">Material &amp; Care</li><li class="desc-sub-text "><p>100% polyester<br/>Machine wash warm</p></li><li class="desc-sub-title">Size &amp; Fit</li><li class="desc-sub-text"><p>Regular fit<br/>The model (height 6' and shoulders 18") is wearing a size M</p></li></ul>,26:02:2014,None
None,Nike Men Blue Sahara Indian Cricket Team Jersey,http://www.myntra.com/Tshirts/Nike/Nike-Men-Blue-Sahara-Indian-Cricket-Team-Jersey/178679/buy,Rs. 2,517,sale-men-clothing,Clothing,Nike,http://myntra.myntassets.com/images/style/properties/Nike-Men-Blue-Replica-Indian-Cricket-Team-Jersey_d51ca552e7776bdee7017b21e51602af_images_1080_1440_mini.jpg,Rs. 3,595,None,sale,http://www.myntra.com/Tshirts/Nike/Nike-Men-Blue-Sahara-Indian-Cricket-Team-Jersey/178679/buy,Sold byVector Ecommerce Pvt Ltd,None,None,['S', 'M', 'L', 'XL', 'XXL'],None,<ul class="mk-pdpv1-product-helper mk-cf"><li class="desc-main-title">Product Description</li><li class="desc-sub-title">Style Note</li><li class="desc-sub-text " itemprop="description"><p>Crafted for those who love cricket, this jersey from Nike comes integrated with the brand's famed Dri-FIT and Stay Cool technologies that are sure to keep you dry and cool as you train. With mesh inserts for ventilation, this stylish pick ensures that you look and perform your best out on the field.</p></li><li class="desc-sub-title ">Product Details</li><li class="desc-sub-text"><p>Blue cricket jersey with Dri-FIT and Stay Cool technologies, printed, has a polo collar with short buttoned placket, short sleeves, print at chest and panel detail below, high-density printed detail along the sleeves and behind the collar<br/>Warranty for manufacturing defects: 6 months (not valid on products with more than 20% discount)</p></li><li class="desc-sub-title ">Material &amp; Care</li><li class="desc-sub-text "><p>100% polyester<br/>Machine wash cold</p></li><li class="desc-sub-title">Size &amp; Fit</li><li class="desc-sub-text"><p>The model (height 6' and shoulders 18") is wearing a size M</p></li></ul>,26:02:2014,None
None,Nike Men Grey Printed Kobe Strike With Fury T-shirt,http://www.myntra.com/Tshirts/Nike/Nike-Men-Grey-Printed-Kobe-Strike-With-Fury-T-shirt/155289/buy,Rs. 1,047,sale-men-clothing,Clothing,Nike,http://myntra.myntassets.com/images/style/properties/Nike-Men-Grey-Printed-Kobe-Strike-With-Fury-T-shirt_8bbcfc1f564d999828f6ad52365b0132_images_1080_1440_mini.jpg,Rs. 1,495,None,sale,http://www.myntra.com/Tshirts/Nike/Nike-Men-Grey-Printed-Kobe-Strike-With-Fury-T-shirt/155289/buy,Sold byVector Ecommerce Pvt Ltd,None,None,['S', 'M', 'L', 'XL'],None,<ul class="mk-pdpv1-product-helper mk-cf"><li class="desc-main-title">Product Description</li><li class="desc-sub-title">Style Note</li><li class="desc-sub-text " itemprop="description"><p>Nike has perfected the balance between performance and cutting-edge sports fashion and this stylish tee is a case in point. Its special Dri-FIT technology will keep you dry and comfortable by wicking sweat away from the body as you score that winning basket.</p></li><li class="desc-sub-title ">Product Details</li><li class="desc-sub-text"><p>Grey T-shirt with Dri-FIT and Stay Cool technology, ribbed round neck, short sleeves, printed branding on left sleeve, graphic print on front, graphic print below back neck<br/>Warranty for manufacturing defects: 6 months (not valid on products with more than 20% discount)</p></li><li class="desc-sub-title ">Material &amp; Care</li><li class="desc-sub-text "><p>60% cotton, 40% polyester<br/>Machine wash cold</p></li><li class="desc-sub-title">Size &amp; Fit</li><li class="desc-sub-text"><p>Regular fit<br/>The model (height 6' and shoulders 18") is wearing a size M</p></li></ul>,26:02:2014,None
None,Nike Men Blue & White Striped Polo T-shirt,http://www.myntra.com/Tshirts/Nike/Nike-Men-Blue-&-White-Striped-Polo-T-shirt/157387/buy,Rs. 1,047,sale-men-clothing,Clothing,Nike,http://myntra.myntassets.com/images/style/properties/Nike-Men-Blue-&-White-Striped-Matchup-Polo-T-shirt_94786f76035be8a45ee0736b98a329c5_images_1080_1440_mini.jpg,Rs. 1,495,None,sale,http://www.myntra.com/Tshirts/Nike/Nike-Men-Blue-&-White-Striped-Polo-T-shirt/157387/buy,Sold byVector Ecommerce Pvt Ltd,None,None,['S', 'M', 'L', 'XL', 'XXL'],None,<ul class="mk-pdpv1-product-helper mk-cf"><li class="desc-main-title">Product Description</li><li class="desc-sub-title">Style Note</li><li class="desc-sub-text " itemprop="description"><p>Live the sporting lifestyle with Nike's range of polo tees. This neat striped number will look great both on and off the field. Style with chinos or cargo shorts and leather trainers when you're hanging out with your friends.</p></li><li class="desc-sub-title ">Product Details</li><li class="desc-sub-text"><p>Blue and white striped polo T-shirt, knit, has a ribbed spread collar, short sleeves, short buttoned placket on front, brand print at left chest, longer back hem, side slits<br/>Warranty: 6 months against manufacturing defects (not valid on products with more than 20% discount)</p></li><li class="desc-sub-title ">Material &amp; Care</li><li class="desc-sub-text "><p>100% cotton<br/>Machine wash cold</p></li><li class="desc-sub-title">Size &amp; Fit</li><li class="desc-sub-text"><p>Regular fit<br/>The model (height 6' and shoulders 18") is wearing a size M</p></li></ul>,26:02:2014,None
None,Nike Men Blue & Navy Striped Pique Polo T-shirt,http://www.myntra.com/Tshirts/Nike/Nike-Men-Blue-&-Navy-Striped-Pique-Polo-T-shirt/157385/buy,Rs. 907,sale-men-clothing,Clothing,Nike,http://myntra.myntassets.com/images/style/properties/Nike-Men-Blue-&-Navy-Striped-Matchup-Pique-Polo-T-shirt_7994345f6b075a69151f0d5f61af3c55_images_1080_1440_mini.jpg,Rs. 1,295,None,sale,http://www.myntra.com/Tshirts/Nike/Nike-Men-Blue-&-Navy-Striped-Pique-Polo-T-shirt/157385/buy,Sold byVector Ecommerce Pvt Ltd,None,None,['S', 'M', 'L', 'XL', 'XXL'],None,<ul class="mk-pdpv1-product-helper mk-cf"><li class="desc-main-title">Product Description</li><li class="desc-sub-title">Style Note</li><li class="desc-sub-text " itemprop="description"><p>Live the sporting lifestyle with Nike's range of polo tees. Made from cotton pique knit, this one is a smart pick for the season. Style it with chinos or cargo shorts and leather trainers when you're hanging out with your friends.</p></li><li class="desc-sub-title ">Product Details</li><li class="desc-sub-text"><p>Blue and  navy striped pique polo T-shirt, ribbed collar, short sleeves with ribbed cuffs, short buttoned placket on front, printed branding at left chest, longer back hem, side slits<br/>Warranty: 6 months against manufacturing defects (not valid on products with more than 20% discount)</p></li><li class="desc-sub-title ">Material &amp; Care</li><li class="desc-sub-text "><p>100% cotton<br/>Machine wash</p></li><li class="desc-sub-title">Size &amp; Fit</li><li class="desc-sub-text"><p>Regular fit<br/>The model (height 6' and shoulders 18") is wearing a size M</p></li></ul>,26:02:2014,None
None,Nike Men As Bb Kobe Chapter Two Pocket White T-Shirts,http://www.myntra.com/Tshirts/Nike/Nike-Men-As-Bb-Kobe-Chapter-Two-Pocket-White-T-Shirts/152053/buy,Rs. 1,047,sale-men-clothing,Clothing,Nike,http://myntra.myntassets.com/images/style/properties/Nike-Men-White-Kobe-Bryant-Chapter-Two-Basketball-T-shirt_0021891bea04ab89816697184a4c9c18_images_1080_1440_mini.jpg,Rs. 1,495,None,sale,http://www.myntra.com/Tshirts/Nike/Nike-Men-As-Bb-Kobe-Chapter-Two-Pocket-White-T-Shirts/152053/buy,Sold byVector Ecommerce Pvt Ltd,None,None,['S', 'M', 'L', 'XL'],None,<ul class="mk-pdpv1-product-helper mk-cf"><li class="desc-main-title">Product Description</li><li class="desc-sub-title">Style Note</li><li class="desc-sub-text " itemprop="description"><p>Turn up the style quotient on the basketball court in super-trendy Kobe Bryant range of knit tees by Nike. Match this number with a pair of loose shorts and high-top trainers for a cool sporty look.</p></li><li class="desc-sub-title ">Product Details</li><li class="desc-sub-text"><p>White T-shirt, knit, has a ribbed round neck, stitch detail at back neck and shoulder seams, short sleeves, print at left chest with patch pocket (with textured print) on it, brand tag straight hem on left</p></li><li class="desc-sub-title ">Material &amp; Care</li><li class="desc-sub-text "><p>100% cotton<br/>Machine wash</p></li><li class="desc-sub-title">Size &amp; Fit</li><li class="desc-sub-text"><p>Regular fit<br/>The model (height 6' and shoulders 18") is wearing a size M</p></li></ul>,26:02:2014,None
None,Nike Men Grey Melange & Black Striped Hooded Sweatshirt,http://www.myntra.com/Sweatshirts/Nike/Nike-Men-Grey-Melange-&-Black-Striped-Hooded-Sweatshirt/184341/buy,Rs. 1,648,sale-men-clothing,Clothing,Nike,http://myntra.myntassets.com/images/style/properties/Nike-Men-Grey-Melange-&-Black-Striped-Hooded-Sweatshirt_6c4d2f1406425de5fa689ed982137d1a_images_1080_1440_mini.jpg,Rs. 3,295,None,sale,http://www.myntra.com/Sweatshirts/Nike/Nike-Men-Grey-Melange-&-Black-Striped-Hooded-Sweatshirt/184341/buy,Sold byVector Ecommerce Pvt Ltd,None,None,['S', 'M', 'L', 'XL', 'XXL'],None,<ul class="mk-pdpv1-product-helper mk-cf"><li class="desc-main-title">Product Description</li><li class="desc-sub-title">Style Note</li><li class="desc-sub-text " itemprop="description"><p>A piece from Nike's range of sweatshirts is your solution to staying warm and fashionable this season. Team this piece with over-dyed denims and high top trainers for the best look.</p></li><li class="desc-sub-title ">Product Details</li><li class="desc-sub-text"><p>Grey melange and black striped sweatshirt, knit, round neck with an attached hood that has drawstrings at sides, long sleeves with ribbed cuffs, zipped front, brand print at left chest, insert pockets at front waist, ribbed hem, fleece lining<br/>Warranty for manufacturing defects: 6 months (not valid on products with more than 20% discount)</p></li><li class="desc-sub-title ">Material &amp; Care</li><li class="desc-sub-text "><p>Body: 80% cotton, 20% polyester<br/>Hood: 100% cotton<br/>Machine wash warm</p></li><li class="desc-sub-title">Size &amp; Fit</li><li class="desc-sub-text"><p>The model (height 6' and shoulders 18") is wearing a size M</p></li></ul>,26:02:2014,None
None,Nike Men Black Brasil CBF Soccer Jersey,http://www.myntra.com/Tshirts/Nike/Nike-Men-Black-Brasil-CBF-Soccer-Jersey/152044/buy,Rs. 3,497,sale-men-clothing,Clothing,Nike,http://myntra.myntassets.com/images/style/properties/Nike-Men-Black-Brasil-CBF-Soccer-Jersey_178f00894a01fa50403fb6c8f5c27608_images_1080_1440_mini.jpg,Rs. 4,995,None,sale,http://www.myntra.com/Tshirts/Nike/Nike-Men-Black-Brasil-CBF-Soccer-Jersey/152044/buy,Sold byVector Ecommerce Pvt Ltd,None,None,['S', 'M', 'L', 'XL'],None,<ul class="mk-pdpv1-product-helper mk-cf"><li class="desc-main-title">Product Description</li><li class="desc-sub-title">Style Note</li><li class="desc-sub-text " itemprop="description"><p>Featuring revolutionary Dri-FIT and Stay-Cool technologies that help you stay cool and sweat free, this jersey features the Brasil soccer logo at the chest. For maximized performance we suggest you pair this piece, with football shorts and trainers.</p></li><li class="desc-sub-title ">Product Details</li><li class="desc-sub-text"><p>Style Description</p></li><li class="desc-sub-title ">Material &amp; Care</li><li class="desc-sub-text "><p>Front panel: 96% polyester, 4% cotton<br/>Back panel: 100% polyester<br/>Sleeves: 96% polyester, 4% cotton<br/>Cuffs: 98% polyester, 2% Spandex<br/>Machine wash cold</p></li><li class="desc-sub-title">Size &amp; Fit</li><li class="desc-sub-text"><p>Regular fit<br/> The model (height 6' and shoulders 18") is wearing a size M</p></li></ul>,26:02:2014,None
None,Nike Men Green T-shirt,http://www.myntra.com/Tshirts/Nike/Nike-Men-Green-T-shirt/157417/buy,Rs. 977,sale-men-clothing,Clothing,Nike,http://myntra.myntassets.com/images/style/properties/Nike-Men-Green-T-shirt_04716f037dc3698ef98dc250957fc05b_images_1080_1440_mini.jpg,Rs. 1,395,None,sale,http://www.myntra.com/Tshirts/Nike/Nike-Men-Green-T-shirt/157417/buy,Sold byVector Ecommerce Pvt Ltd,None,None,['S', 'M', 'L', 'XL'],None,<ul class="mk-pdpv1-product-helper mk-cf"><li class="desc-main-title">Product Description</li><li class="desc-sub-title">Style Note</li><li class="desc-sub-text " itemprop="description"><p>Engineered for superior athletic performance as well as to lower environmental impact, this Nike tee is made from organically grown cotton, which is produced without use of synthetic pesticides. Match it with your track pants for a work out or with your favourite jeans for a casual ensemble.</p></li><li class="desc-sub-title ">Product Details</li><li class="desc-sub-text"><p>Green T-shirt, knit, ribbed round neck, short sleeves, brand print on left chest, print on back<br/>Warranty for manufacturing defects: 6 months (not valid on products with more than 20% discount)</p></li><li class="desc-sub-title ">Material &amp; Care</li><li class="desc-sub-text "><p>100% cotton<br/>Machine wash cold</p></li><li class="desc-sub-title">Size &amp; Fit</li><li class="desc-sub-text"><p>Slim fit<br/>The model (height 6' and shoulders 18") is wearing a size M</p></li></ul>,26:02:2014,None
None,Nike Men White Printed T-shirt,http://www.myntra.com/Tshirts/Nike/Nike-Men-White-Printed-T-shirt/157416/buy,Rs. 977,sale-men-clothing,Clothing,Nike,http://myntra.myntassets.com/images/style/properties/Nike-Men-Tshirts_ac10648a3fbae4cc3ce98f198dfcb1fd_images_1080_1440_mini.jpg,Rs. 1,395,None,sale,http://www.myntra.com/Tshirts/Nike/Nike-Men-White-Printed-T-shirt/157416/buy,Sold byVector Ecommerce Pvt Ltd,None,None,['S', 'M', 'L', 'XL', 'XXL'],None,<ul class="mk-pdpv1-product-helper mk-cf"><li class="desc-main-title">Product Description</li><li class="desc-sub-title">Style Note</li><li class="desc-sub-text " itemprop="description"><p>Nike has perfected the balance between performance and cutting-edge sports fashion. The super soft fabric of this tee makes it a style you will want to live in. Match it with your training shorts or even your favourite pair of jeans for a sporty, casual ensemble.</p></li><li class="desc-sub-title ">Product Details</li><li class="desc-sub-text"><p>White T-shirt, knit, ribbed round neck, short sleeves, brand print on chest<br/>Warranty for manufacturing defects: 6 months (not valid on products with more than 20% discount)</p></li><li class="desc-sub-title ">Material &amp; Care</li><li class="desc-sub-text "><p>50% polyester, 25% cotton, 25% rayon<br/>Machine wash cold</p></li><li class="desc-sub-title">Size &amp; Fit</li><li class="desc-sub-text"><p>Slim fit<br/>The model (height 6' and shoulders 18") is wearing a size M</p></li></ul>,26:02:2014,None
None,Nike Men Red Slim Fit Polo T-Shirt,http://www.myntra.com/Tshirts/Nike/Nike-Men-Red-Slim-Fit-Polo-T-Shirt/157415/buy,Rs. 1,117,sale-men-clothing,Clothing,Nike,http://myntra.myntassets.com/images/style/properties/Nike-Men-Red-Slim-Polo-T-Shirt_10a417b946b99b7b7741e3660c98037a_images_1080_1440_mini.jpg,Rs. 1,595,None,sale,http://www.myntra.com/Tshirts/Nike/Nike-Men-Red-Slim-Fit-Polo-T-Shirt/157415/buy,Sold byVector Ecommerce Pvt Ltd,None,None,['S', 'M', 'L', 'XL', 'XXL'],None,<ul class="mk-pdpv1-product-helper mk-cf"><li class="desc-main-title">Product Description</li><li class="desc-sub-title">Style Note</li><li class="desc-sub-text " itemprop="description"><p>Live the sporting lifestyle with Nike's range of polo tees. Made from a soft cotton blend, this one is a smart pick for the season. Style it with chinos or cargo shorts and leather trainers when you're hanging out with your friends.</p></li><li class="desc-sub-title ">Product Details</li><li class="desc-sub-text"><p>Red pique polo T-shirt with white accents, ribbed collar with tipping, short sleeves with ribbed cuffs, short buttoned placket on front, embroidered branding at left chest, longer back hem, side slits<br/>Warranty: 6 months against manufacturing defects (not valid on products with more than 20% discount)</p></li><li class="desc-sub-title ">Material &amp; Care</li><li class="desc-sub-text "><p>95% cotton, 5% elastane<br/>Machine wash warm</p></li><li class="desc-sub-title">Size &amp; Fit</li><li class="desc-sub-text"><p>Slim fit<br/>The model (height 6' and shoulders 18") is wearing a size M</p></li></ul>,26:02:2014,None
None,Nike Men Black Printed Pegasus World Tour T-shirt,http://www.myntra.com/Tshirts/Nike/Nike-Men-Black-Printed-Pegasus-World-Tour-T-shirt/155296/buy,Rs. 977,sale-men-clothing,Clothing,Nike,http://myntra.myntassets.com/images/style/properties/Nike-Men-Black-Pegasus-World-Tour-T-shirt_3d1603e2b5717173b274093eab3c6ac2_images_1080_1440_mini.jpg,Rs. 1,395,None,sale,http://www.myntra.com/Tshirts/Nike/Nike-Men-Black-Printed-Pegasus-World-Tour-T-shirt/155296/buy,Sold byVector Ecommerce Pvt Ltd,None,None,['S', 'M', 'L', 'XL'],None,<ul class="mk-pdpv1-product-helper mk-cf"><li class="desc-main-title">Product Description</li><li class="desc-sub-title">Style Note</li><li class="desc-sub-text " itemprop="description"><p>Exercise environmental consciousness as well as your body with this Nike T-shirt. Made from absorbent and eco-friendly cotton, this tee is definitely a keeper.</p></li><li class="desc-sub-title ">Product Details</li><li class="desc-sub-text"><p>Black T-shirt, ribbed round neck, short sleeves, printed branding on left sleeve, graphic print on front, printed type at back<br/><br/>Warranty for manufacturing defects: 6 months (not valid on products with more than 20% discount)</p></li><li class="desc-sub-title ">Material &amp; Care</li><li class="desc-sub-text "><p>100% organic cotton<br/>Machine wash cold</p></li><li class="desc-sub-title">Size &amp; Fit</li><li class="desc-sub-text"><p>Regular fit<br/>The model (height 6' and shoulders 18") is wearing a size M</p></li></ul>,26:02:2014,None
None,Nike Men White Printed Kobe Strike With Fury T-shirt,http://www.myntra.com/Tshirts/Nike/Nike-Men-White-Printed-Kobe-Strike-With-Fury-T-shirt/155290/buy,Rs. 1,047,sale-men-clothing,Clothing,Nike,http://myntra.myntassets.com/images/style/properties/Nike-Men-White-Printed-Kobe-Strike-With-Fury-T-shirt_d92b8d9d74bc95838057b569dac2816c_images_1080_1440_mini.jpg,Rs. 1,495,None,sale,http://www.myntra.com/Tshirts/Nike/Nike-Men-White-Printed-Kobe-Strike-With-Fury-T-shirt/155290/buy,Sold byVector Ecommerce Pvt Ltd,None,None,['S', 'M', 'L', 'XL'],None,<ul class="mk-pdpv1-product-helper mk-cf"><li class="desc-main-title">Product Description</li><li class="desc-sub-title">Style Note</li><li class="desc-sub-text " itemprop="description"><p>Nike has perfected the balance between performance and cutting-edge sports fashion, this stylish tee is a case in point. Its special Dri-FIT technology will keep you dry and comfortable by wicking sweat away from the body as you score that winning basket.</p></li><li class="desc-sub-title ">Product Details</li><li class="desc-sub-text"><p>White T-shirt with Dri-FIT and Stay Cool technology, ribbed round neck, short sleeves, printed branding on left sleeve, graphic print on front, graphic print below back neck<br/>Warranty for manufacturing defects: 6 months (not valid on products with more than 20% discount)</p></li><li class="desc-sub-title ">Material &amp; Care</li><li class="desc-sub-text "><p>60% cotton, 40% polyester<br/>Machine wash cold</p></li><li class="desc-sub-title">Size &amp; Fit</li><li class="desc-sub-text"><p>Regular fit<br/>The model (height 6' and shoulders 18") is wearing a size M</p></li></ul>,26:02:2014,None
