None,OTLS Unisex Blue Sports Travel Duffle Bag,http://www.myntra.com/Duffle-Bag/OTLS/OTLS-Unisex-Blue-Sports-Travel-Duffle-Bag/220843/buy,Rs. 1,699,women-bags-wallets,Bags & Wallets,OTLS,http://myntra.myntassets.com/images/style/properties/OTLS-Unisex-Blue-Sports-Travel-Duffle-Bag_543e03912479290b962bbdf04407c1fa_images_1080_1440_mini.jpg,None,None,women,http://www.myntra.com/Duffle-Bag/OTLS/OTLS-Unisex-Blue-Sports-Travel-Duffle-Bag/220843/buy,Sold byVector Ecommerce Pvt Ltd,None,None,single size,None,<ul class="mk-pdpv1-product-helper mk-cf"><li class="desc-main-title">Product Description</li><li class="desc-sub-title">Style Note</li><li class="desc-sub-text " itemprop="description"><p>Spacious, comfortable to carry and stylish, this duffle bag can be used for long holidays and weekend trips. The shoulder straps allow to carry it as a backpack and can be used for adventurous trips with friends.</p></li><li class="desc-sub-title ">Product Details</li><li class="desc-sub-text"><p>Blue and black duffle bag with branding badge at the front<br/>Has two short handles with a Velcro tab, one long sling strap with a shoulder patch<br/>One main zipped compartment with a slip pocket<br/>External zipped pockets at the front and the back<br/>Two zipped pockets at the sides, one has a loop<br/>Has two shoulder padded straps that can be converted into a backpack, has a strap with a clasp closure at the waist<br/>Warranty: 6 months from the date of purchase, against manufacturing defects</p></li><li class="desc-sub-title ">Material &amp; Care</li><li class="desc-sub-text "><p>Synthetic<br/>Wipe with a clean, dry cloth when needed</p></li><li class="desc-sub-title">Size &amp; Fit</li><li class="desc-sub-text"><p>Height: 21 cm<br/>Width: 58 cm<br/>Depth: 40 cm</p></li></ul>,26:02:2014,None
None,OTLS Unisex Pink Gym Bag,http://www.myntra.com/Duffle-Bag/OTLS/OTLS-Unisex-Pink-Gym-Bag/220850/buy,Rs. 1,199,women-bags-wallets,Bags & Wallets,OTLS,http://myntra.myntassets.com/images/style/properties/OTLS-Unisex-Bag_603471de224fcd3b35038d2438fb5eb6_images_1080_1440_mini.JPG,None,None,women,http://www.myntra.com/Duffle-Bag/OTLS/OTLS-Unisex-Pink-Gym-Bag/220850/buy,Sold byVector Ecommerce Pvt Ltd,None,None,single size,None,<ul class="mk-pdpv1-product-helper mk-cf"><li class="desc-main-title">Product Description</li><li class="desc-sub-title">Style Note</li><li class="desc-sub-text " itemprop="description"><p>Hit the gym in style with this gym bag from OTLS. It comes with short handles as well as a long shoulder strap to suit your convenience.</p></li><li class="desc-sub-title ">Product Details</li><li class="desc-sub-text"><p>Pink crinkled gym bag with branding at the front<br/>Two short handles and one long adjustable shoulder strap with a shoulder pad<br/>One main zipped compartment with one zipped pocket and two slip pockets inside<br/>Zipped pocket at the right side for keeping shoes<br/>Has a zipped pocket at the back<br/>Five legs at the base<br/>Warranty: 1 year from date of purchase against any manufacturing defects</p></li><li class="desc-sub-title ">Material &amp; Care</li><li class="desc-sub-text "><p>Synthetic<br/>Wipe with a clean, dry cloth to remove dust</p></li><li class="desc-sub-title">Size &amp; Fit</li><li class="desc-sub-text"><p>Height: 33 cm<br/>Width: 50 cm<br/>Depth: 21 cm</p></li></ul>,26:02:2014,None
None,OTLS Unisex Navy Gym Bag,http://www.myntra.com/Duffle-Bag/OTLS/OTLS-Unisex-Navy-Gym-Bag/220848/buy,Rs. 1,199,women-bags-wallets,Bags & Wallets,OTLS,http://myntra.myntassets.com/images/style/properties/OTLS-Unisex-Bag_9f537dd30f368c36f70ac9f98858ffee_images_1080_1440_mini.JPG,None,None,women,http://www.myntra.com/Duffle-Bag/OTLS/OTLS-Unisex-Navy-Gym-Bag/220848/buy,Sold byVector Ecommerce Pvt Ltd,None,None,single size,None,<ul class="mk-pdpv1-product-helper mk-cf"><li class="desc-main-title">Product Description</li><li class="desc-sub-title">Style Note</li><li class="desc-sub-text " itemprop="description"><p>Hit the gym in style with this gym bag from OTLS. It comes with short handles as well as a long shoulder strap to suit your convenience.</p></li><li class="desc-sub-title ">Product Details</li><li class="desc-sub-text"><p>Navy blue crinkled gym bag with branding at the front<br/>Two short handles and one long adjustable shoulder strap with a shoulder pad<br/>One main zipped compartment with one zipped pocket and two slip pockets inside<br/>Zipped pocket at the right side for keeping shoes<br/>Has a zipped pocket at the back<br/>Five legs at the base<br/>Warranty: 1 year from date of purchase against any manufacturing defects</p></li><li class="desc-sub-title ">Material &amp; Care</li><li class="desc-sub-text "><p>Synthetic<br/>Wipe with a clean, dry cloth to remove dust</p></li><li class="desc-sub-title">Size &amp; Fit</li><li class="desc-sub-text"><p>Height: 33 cm<br/>Width: 50 cm<br/>Depth: 21 cm</p></li></ul>,26:02:2014,None
None,OTLS Unisex Blue Sway Messenger Bag,http://www.myntra.com/Messenger-Bag/OTLS/OTLS-Unisex-Blue-Sway-Messenger-Bag/214515/buy,Rs. 799,women-bags-wallets,Bags & Wallets,OTLS,http://myntra.myntassets.com/images/style/properties/OTLS-Unisex-Messenger-Bag_2f02ad3ed8f4d249f6b220297cc7b33b_images_1080_1440_mini.jpg,None,None,women,http://www.myntra.com/Messenger-Bag/OTLS/OTLS-Unisex-Blue-Sway-Messenger-Bag/214515/buy,Sold byVector Ecommerce Pvt Ltd,None,None,single size,None,<ul class="mk-pdpv1-product-helper mk-cf"><li class="desc-main-title">Product Description</li><li class="desc-sub-title">Style Note</li><li class="desc-sub-text " itemprop="description"><p>Perfect for college, this messenger bag by OTLS has ample space for all your essentials. The durable material and practical design make it a piece you can use over and over again.</p></li><li class="desc-sub-title ">Product Details</li><li class="desc-sub-text"><p>Blue messenger bag with a washed look<br/>Flap at front with a circular rubber patch and Velcro closures<br/>One long detachable and adjustable canvas strap<br/>One main zipped compartment with an inbuilt zipped pocket<br/>Brand label and a mobile pocket with a Velcro fastened flap at left side<br/>An external zipped pocket at front flap<br/>A zipped pocket with an organiser sleeve under the front flap<br/>Warranty: 6 months from the date of purchase, against manufacturing defects</p></li><li class="desc-sub-title ">Material &amp; Care</li><li class="desc-sub-text "><p>Synthetic<br/>Wipe with a clean, dry cloth when needed</p></li><li class="desc-sub-title">Size &amp; Fit</li><li class="desc-sub-text"><p>Height: 25 cm<br/>Width: 35 cm<br/>Depth: 11 cm</p></li></ul>,26:02:2014,None
None,OTLS Unisex Green Sports Travel Duffle Bag,http://www.myntra.com/Duffle-Bag/OTLS/OTLS-Unisex-Green-Sports-Travel-Duffle-Bag/220845/buy,Rs. 1,699,women-bags-wallets,Bags & Wallets,OTLS,http://myntra.myntassets.com/images/style/properties/OTLS-Unisex-Blue-Sports-Travel-Duffle-Bag_44c6ffed73ac158d92d6708761c9eb3c_images_1080_1440_mini.jpg,None,None,women,http://www.myntra.com/Duffle-Bag/OTLS/OTLS-Unisex-Green-Sports-Travel-Duffle-Bag/220845/buy,Sold byVector Ecommerce Pvt Ltd,None,None,single size,None,<ul class="mk-pdpv1-product-helper mk-cf"><li class="desc-main-title">Product Description</li><li class="desc-sub-title">Style Note</li><li class="desc-sub-text " itemprop="description"><p>Spacious, comfortable to carry and stylish, this duffle bag can be used for long holidays and weekend trips. The shoulder straps allow to carry it as a backpack and can be used for adventurous trips with friends.</p></li><li class="desc-sub-title ">Product Details</li><li class="desc-sub-text"><p>Green duffle bag with branding badge at the front<br/>Has two short handles with a Velcro tab, one long sling strap with a shoulder patch<br/>One main zipped compartment with a slip pocket<br/>External zipped pockets at the front and the back<br/>Two zipped pockets at the sides, one has a loop<br/>Has two shoulder padded straps that can be converted into a backpack, has a strap with a clasp closure at the waist<br/>Warranty: 6 months from the date of purchase, against manufacturing defects</p></li><li class="desc-sub-title ">Material &amp; Care</li><li class="desc-sub-text "><p>Synthetic<br/>Wipe with a clean, dry cloth when needed</p></li><li class="desc-sub-title">Size &amp; Fit</li><li class="desc-sub-text"><p>Height: 21 cm<br/>Width: 58 cm<br/>Depth: 40 cm</p></li></ul>,26:02:2014,None
None,OTLS Unisex Blue Vertical Messenger Bag,http://www.myntra.com/Messenger-Bag/OTLS/OTLS-Unisex-Blue-Vertical-Messenger-Bag/214518/buy,Rs. 999,women-bags-wallets,Bags & Wallets,OTLS,http://myntra.myntassets.com/images/style/properties/OTLS-Unisex-Messenger-Bag_2e281f0573e24c770bcec081a1d8073e_images_1080_1440_mini.jpg,None,None,women,http://www.myntra.com/Messenger-Bag/OTLS/OTLS-Unisex-Blue-Vertical-Messenger-Bag/214518/buy,Sold byVector Ecommerce Pvt Ltd,None,None,single size,None,<ul class="mk-pdpv1-product-helper mk-cf"><li class="desc-main-title">Product Description</li><li class="desc-sub-title">Style Note</li><li class="desc-sub-text " itemprop="description"><p>Perfect for college, this messenger bag by OTLS has ample space for all your essentials. The durable material and practical design make it a piece you can use over and over again.</p></li><li class="desc-sub-title ">Product Details</li><li class="desc-sub-text"><p>Blue messenger bag with a washed look<br/>Flap at front with a circular rubber patch and metal ring detail at bottom<br/>One long adjustable canvas strap<br/>One main zipped compartment with an inbuilt zipped pocket<br/>A smaller zipped compartment with an inbuilt zipped pocket under the front flap<br/>Brand label at left front side<br/>An external zipped pocket at front flap, an external zipped pocket at back<br/>Warranty: 6 months from the date of purchase, against manufacturing defects</p></li><li class="desc-sub-title ">Material &amp; Care</li><li class="desc-sub-text "><p>Synthetic<br/>Wipe with a clean, dry cloth when needed</p></li><li class="desc-sub-title">Size &amp; Fit</li><li class="desc-sub-text"><p>Height: 33 cm<br/>Width: 29 cm<br/>Depth: 10.5 cm</p></li></ul>,26:02:2014,None
None,OTLS Unisex Blue Notebook Bag,http://www.myntra.com/Laptop-Bag/OTLS/OTLS-Unisex-Blue-Notebook-Bag/214526/buy,Rs. 999,women-bags-wallets,Bags & Wallets,OTLS,http://myntra.myntassets.com/images/style/properties/OTLS-Unisex-Laptop-Bag_c8b15527906d325ffc42446787ec7d06_images_1080_1440_mini.jpg,None,None,women,http://www.myntra.com/Laptop-Bag/OTLS/OTLS-Unisex-Blue-Notebook-Bag/214526/buy,Sold byVector Ecommerce Pvt Ltd,None,None,single size,None,<ul class="mk-pdpv1-product-helper mk-cf"><li class="desc-main-title">Product Description</li><li class="desc-sub-title">Style Note</li><li class="desc-sub-text " itemprop="description"><p>OTLS is the one stop shop for those who prefer reliable and quality bags. Carry your laptop in style with this bag. With ample space for accessories as well as your laptop, this bag is best suited for both office and college use.</p></li><li class="desc-sub-title ">Product Details</li><li class="desc-sub-text"><p>Blue, textured laptop bag<br/>Two short handles and a long, detachable and adjustable sling strap<br/>One main zipped compartment with an inner laptop sleeve that is secured with a Velcro closure and a zipped pocket<br/>Three external zipped pockets at front<br/>A patch pocket at front with a flap that is secured with a looped Velcro closure<br/>Warranty: 6 months from the date of purchase, against manufacturing defects</p></li><li class="desc-sub-title ">Material &amp; Care</li><li class="desc-sub-text "><p>Synthetic<br/>Wipe with a clean, dry cloth when needed</p></li><li class="desc-sub-title">Size &amp; Fit</li><li class="desc-sub-text"><p>Height: 29 cm<br/>Width: 36 cm<br/>Depth: 8 cm<br/>Laptop compartment can hold up to a 15" laptop</p></li></ul>,26:02:2014,None
None,OTLS Women Brown Tote Bag,http://www.myntra.com/Tote-Bags/OTLS/OTLS-Women-Brown-Tote-Bag/220852/buy,Rs. 799,women-bags-wallets,Bags & Wallets,OTLS,http://myntra.myntassets.com/images/style/properties/OTLS-Women-Brown-Tote-Bag_0fa7c5ae25090fd656dfcabdc6e6ac76_images_1080_1440_mini.jpg,None,None,women,http://www.myntra.com/Tote-Bags/OTLS/OTLS-Women-Brown-Tote-Bag/220852/buy,Sold byVector Ecommerce Pvt Ltd,None,None,single size,None,<ul class="mk-pdpv1-product-helper mk-cf"><li class="desc-main-title">Product Description</li><li class="desc-sub-title">Style Note</li><li class="desc-sub-text " itemprop="description"><p>This is a stylish tote bag from OTLS to carry your essentials in comfort and ease. Carry it to work or a lunch date while you're dressed in a casual ensemble.</p></li><li class="desc-sub-title ">Product Details</li><li class="desc-sub-text"><p>Brown tote bag, has a strap across the mouth with magnetic button closure<br/>Two short handles<br/>One main zipped compartment with two inner zipped pockets, an inner slip pocket with a mobile pouch<br/>Warranty: 6 months from the date of purchase, against manufacturing defects</p></li><li class="desc-sub-title ">Material &amp; Care</li><li class="desc-sub-text "><p>Synthetic<br/>Wipe with a clean, dry cloth when needed</p></li><li class="desc-sub-title">Size &amp; Fit</li><li class="desc-sub-text"><p>Height: 33 cm<br/>Width: 53 cm<br/></p></li></ul>,26:02:2014,None
None,OTLS Unisex Blue Gym Bag,http://www.myntra.com/Duffle-Bag/OTLS/OTLS-Unisex-Blue-Gym-Bag/220847/buy,Rs. 1,199,women-bags-wallets,Bags & Wallets,OTLS,http://myntra.myntassets.com/images/style/properties/OTLS-Unisex-Bag_2958fe2f0716509364411d016afe26c0_images_1080_1440_mini.JPG,None,None,women,http://www.myntra.com/Duffle-Bag/OTLS/OTLS-Unisex-Blue-Gym-Bag/220847/buy,Sold byVector Ecommerce Pvt Ltd,None,None,single size,None,<ul class="mk-pdpv1-product-helper mk-cf"><li class="desc-main-title">Product Description</li><li class="desc-sub-title">Style Note</li><li class="desc-sub-text " itemprop="description"><p>Hit the gym in style with this gym bag from OTLS. It comes with short handles as well as a long shoulder strap to suit your convenience.</p></li><li class="desc-sub-title ">Product Details</li><li class="desc-sub-text"><p>Blue crinkled gym bag with branding at the front<br/>Two short handles and one long adjustable shoulder strap with a shoulder pad<br/>One main zipped compartment with one zipped pocket and two slip pockets inside<br/>Zipped pocket at the right side bfor keeping shoes<br/>Has a zipped pocket at the back<br/>Five legs at the base<br/>Warranty: 1 year from date of purchase, against any manufacturing defects</p></li><li class="desc-sub-title ">Material &amp; Care</li><li class="desc-sub-text "><p>Synthetic<br/>Wipe with a clean, dry cloth to remove dust</p></li><li class="desc-sub-title">Size &amp; Fit</li><li class="desc-sub-text"><p>Height: 33 cm<br/>Width: 50 cm<br/>Depth: 21 cm</p></li></ul>,26:02:2014,None
None,OTLS Unisex Shaded Pink Sports Travel Duffle Bag,http://www.myntra.com/Duffle-Bag/OTLS/OTLS-Unisex-Shaded-Pink-Sports-Travel-Duffle-Bag/220846/buy,Rs. 1,699,women-bags-wallets,Bags & Wallets,OTLS,http://myntra.myntassets.com/images/style/properties/OTLS-Unisex-Pink-Sports-Travel-Duffle-Bag_27b435a264fe5e6768e80fa33d9c9a54_images_1080_1440_mini.jpg,None,None,women,http://www.myntra.com/Duffle-Bag/OTLS/OTLS-Unisex-Shaded-Pink-Sports-Travel-Duffle-Bag/220846/buy,Sold byVector Ecommerce Pvt Ltd,None,None,single size,None,<ul class="mk-pdpv1-product-helper mk-cf"><li class="desc-main-title">Product Description</li><li class="desc-sub-title">Style Note</li><li class="desc-sub-text " itemprop="description"><p>Spacious, comfortable to carry and stylish, this duffle bag can be used for long holidays and weekend trips. The shoulder straps allow to carry it as a backpack and can be used for adventurous trips with friends.</p></li><li class="desc-sub-title ">Product Details</li><li class="desc-sub-text"><p>Shaded pink duffle bag with branding badge at the front<br/>Has two short handles with a Velcro tab, one long sling strap with a shoulder patch<br/>One main zipped compartment with a slip pocket<br/>External zipped pockets at the front and the back<br/>Two zipped pockets at the sides, one has a loop<br/>Has two shoulder padded straps that can be converted into a backpack, has a strap with a clasp closure at the waist<br/>Warranty: 6 months from the date of purchase, against manufacturing defects</p></li><li class="desc-sub-title ">Material &amp; Care</li><li class="desc-sub-text "><p>Synthetic<br/>Wipe with a clean, dry cloth when needed</p></li><li class="desc-sub-title">Size &amp; Fit</li><li class="desc-sub-text"><p>Height: 21 cm<br/>Width: 58 cm<br/>Depth: 40 cm</p></li></ul>,26:02:2014,None
None,OTLS Unisex Sea Green Gym Bag,http://www.myntra.com/Duffle-Bag/OTLS/OTLS-Unisex-Sea-Green-Gym-Bag/220849/buy,Rs. 1,199,women-bags-wallets,Bags & Wallets,OTLS,http://myntra.myntassets.com/images/style/properties/OTLS-Unisex-Bag_b50231a5b93a23cfdf8f315708eaa64c_images_1080_1440_mini.jpg,None,None,women,http://www.myntra.com/Duffle-Bag/OTLS/OTLS-Unisex-Sea-Green-Gym-Bag/220849/buy,Sold byVector Ecommerce Pvt Ltd,None,None,single size,None,<ul class="mk-pdpv1-product-helper mk-cf"><li class="desc-main-title">Product Description</li><li class="desc-sub-title">Style Note</li><li class="desc-sub-text " itemprop="description"><p>Hit the gym in style with this gym bag from OTLS. It comes with short handles as well as a long shoulder strap to suit your convenience.</p></li><li class="desc-sub-title ">Product Details</li><li class="desc-sub-text"><p>Sea green crinkled gym bag with branding at the front<br/>Two short handles and one long adjustable shoulder strap with a shoulder pad<br/>One main zipped compartment with one zipped pocket and two slip pockets inside<br/>Zipped pocket at the right side for keeping shoes<br/>Has a zipped pocket at the back<br/>Five legs at the base<br/>Warranty: 1 year from date of purchase against any manufacturing defects</p></li><li class="desc-sub-title ">Material &amp; Care</li><li class="desc-sub-text "><p>Synthetic<br/>Wipe with a clean, dry cloth to remove dust</p></li><li class="desc-sub-title">Size &amp; Fit</li><li class="desc-sub-text"><p>Height: 33 cm<br/>Width: 50 cm<br/>Depth: 21 cm</p></li></ul>,26:02:2014,None
None,OTLS Unisex Blue Sway Messenger Bag,http://www.myntra.com/Messenger-Bag/OTLS/OTLS-Unisex-Blue-Sway-Messenger-Bag/214514/buy,Rs. 799,women-bags-wallets,Bags & Wallets,OTLS,http://myntra.myntassets.com/images/style/properties/OTLS-Unisex-Messenger-Bag_9213f5107d05cf64475506b9cab9601a_images_1080_1440_mini.jpg,None,None,women,http://www.myntra.com/Messenger-Bag/OTLS/OTLS-Unisex-Blue-Sway-Messenger-Bag/214514/buy,Sold byVector Ecommerce Pvt Ltd,None,None,single size,None,<ul class="mk-pdpv1-product-helper mk-cf"><li class="desc-main-title">Product Description</li><li class="desc-sub-title">Style Note</li><li class="desc-sub-text " itemprop="description"><p>Carry your essentials in style with this super handy messenger bag from OTLS. The multiple compartments with smart allocation of space makes this piece the perfect companion to stay organised.</p></li><li class="desc-sub-title ">Product Details</li><li class="desc-sub-text"><p>Blue messenger bag, has a flap with Velcro closure, a zipped pocket and branding at the front<br/>One long detachable and adjustable strap<br/>One main zipped compartment, with an inner zipped pocket<br/>One zipped compartment at the front<br/>One mobile holder secured by a flap across the mouth with Velcro closure on one side<br/>Warranty: 6 months from the date of purchase against manufacturing defects</p></li><li class="desc-sub-title ">Material &amp; Care</li><li class="desc-sub-text "><p>Synthetic<br/>Wipe with a clean, dry cloth when needed</p></li><li class="desc-sub-title">Size &amp; Fit</li><li class="desc-sub-text"><p>Height: 31 cm<br/>Width: 41 cm<br/>Depth: 10 cm</p></li></ul>,26:02:2014,None
None,OTLS Unisex Shaded Pink Sports Travel Duffle Bag,http://www.myntra.com/Duffle-Bag/OTLS/OTLS-Unisex-Shaded-Pink-Sports-Travel-Duffle-Bag/220846/buy,Rs. 1,699,women-bags-wallets,Bags & Wallets,OTLS,http://myntra.myntassets.com/images/style/properties/OTLS-Unisex-Pink-Sports-Travel-Duffle-Bag_27b435a264fe5e6768e80fa33d9c9a54_images_1080_1440_mini.jpg,None,None,women,http://www.myntra.com/Duffle-Bag/OTLS/OTLS-Unisex-Shaded-Pink-Sports-Travel-Duffle-Bag/220846/buy,Sold byVector Ecommerce Pvt Ltd,None,None,single size,None,<ul class="mk-pdpv1-product-helper mk-cf"><li class="desc-main-title">Product Description</li><li class="desc-sub-title">Style Note</li><li class="desc-sub-text " itemprop="description"><p>Spacious, comfortable to carry and stylish, this duffle bag can be used for long holidays and weekend trips. The shoulder straps allow to carry it as a backpack and can be used for adventurous trips with friends.</p></li><li class="desc-sub-title ">Product Details</li><li class="desc-sub-text"><p>Shaded pink duffle bag with branding badge at the front<br/>Has two short handles with a Velcro tab, one long sling strap with a shoulder patch<br/>One main zipped compartment with a slip pocket<br/>External zipped pockets at the front and the back<br/>Two zipped pockets at the sides, one has a loop<br/>Has two shoulder padded straps that can be converted into a backpack, has a strap with a clasp closure at the waist<br/>Warranty: 6 months from the date of purchase, against manufacturing defects</p></li><li class="desc-sub-title ">Material &amp; Care</li><li class="desc-sub-text "><p>Synthetic<br/>Wipe with a clean, dry cloth when needed</p></li><li class="desc-sub-title">Size &amp; Fit</li><li class="desc-sub-text"><p>Height: 21 cm<br/>Width: 58 cm<br/>Depth: 40 cm</p></li></ul>,26:02:2014,None
None,OTLS Unisex Green Trolley Backpack,http://www.myntra.com/Trolley-Bag/OTLS/OTLS-Unisex-Green-Trolley-Backpack/214532/buy,Rs. 1,999,women-bags-wallets,Bags & Wallets,OTLS,http://myntra.myntassets.com/images/style/properties/OTLS-Unisex-Green-Laptop-Trolley-Backpack_69b862d187cab771a7642e3f7dcf307c_images_1080_1440_mini.jpg,None,None,women,http://www.myntra.com/Trolley-Bag/OTLS/OTLS-Unisex-Green-Trolley-Backpack/214532/buy,Sold byVector Ecommerce Pvt Ltd,None,None,single size,None,<ul class="mk-pdpv1-product-helper mk-cf"><li class="desc-main-title">Product Description</li><li class="desc-sub-title">Style Note</li><li class="desc-sub-text " itemprop="description"><p>OTLS brings to you a trolley backpack that is stylish and unique. This piece has enough space to accommodate all your essentials.</p></li><li class="desc-sub-title ">Product Details</li><li class="desc-sub-text"><p>Green trolley backpack, with branding at the front, a zipped and padded laptop compartment in the front with a zip pocket on top<br/>Two padded and adjustable shoulder straps, a haul loop for carrying ease<br/>A trolley concealed at the mesh lined back<br/>One main zipped compartment with elasticated straps that have click clasp closure, zipped lining, a zipped pocket and mesh slip pocket built into the lining of the flap<br/>Zipped pockets at the sides for easy accessibility and trolley beneath with wheels<br/>Warranty: 6 months from the date of purchase, against manufacturing defects</p></li><li class="desc-sub-title ">Material &amp; Care</li><li class="desc-sub-text "><p>Synthetic<br/>Wipe with a damp cloth when needed</p></li><li class="desc-sub-title">Size &amp; Fit</li><li class="desc-sub-text"><p>Height: 45 cm<br/>Width: 38 cm<br/>Depth: 20 cm<br/>Laptop sleeve: 33 cm x 26 cm</p></li></ul>,26:02:2014,None
None,OTLS Unisex Turquoise Blue Vertical Messenger Bag,http://www.myntra.com/Messenger-Bag/OTLS/OTLS-Unisex-Turquoise-Blue-Vertical-Messenger-Bag/214516/buy,Rs. 999,women-bags-wallets,Bags & Wallets,OTLS,http://myntra.myntassets.com/images/style/properties/OTLS-Unisex-Messenger-Bag_dfa7af0d0d7ddc3f5a54af32eec42583_images_1080_1440_mini.jpg,None,None,women,http://www.myntra.com/Messenger-Bag/OTLS/OTLS-Unisex-Turquoise-Blue-Vertical-Messenger-Bag/214516/buy,Sold byVector Ecommerce Pvt Ltd,None,None,single size,None,<ul class="mk-pdpv1-product-helper mk-cf"><li class="desc-main-title">Product Description</li><li class="desc-sub-title">Style Note</li><li class="desc-sub-text " itemprop="description"><p>Perfect for college, this messenger bag by OTLS has ample space for all your essentials. The durable material and practical design make it a piece you can use over and over again.</p></li><li class="desc-sub-title ">Product Details</li><li class="desc-sub-text"><p>Turquoise blue messenger bag with a washed look<br/>Flap at front with a circular rubber patch and metal ring detail at bottom<br/>One long adjustable canvas strap<br/>One main zipped compartment with an inbuilt zipped pocket<br/>A smaller zipped compartment with an inbuilt zipped pocket under the front flap<br/>Brand label at left front side<br/>An external zipped pocket at front flap, an external zipped pocket at back<br/>Warranty: 6 months from the date of purchase, against manufacturing defects</p></li><li class="desc-sub-title ">Material &amp; Care</li><li class="desc-sub-text "><p>Synthetic<br/>Wipe with a clean, dry cloth when needed</p></li><li class="desc-sub-title">Size &amp; Fit</li><li class="desc-sub-text"><p>Height: 33 cm<br/>Width: 29 cm<br/>Depth: 10.5 cm</p></li></ul>,26:02:2014,None
