None,Puma Men Grey Yacht Cvs Boat Shoes,http://www.myntra.com/Casual-Shoes/Puma/Puma-Men-Grey-Yacht-Cvs-Boat-Shoes/244913/buy,Rs. 2,999,men-casual-shoes,Casual Shoes,Puma,http://myntra.myntassets.com/images/style/properties/Puma-Men-Grey-Yacht-Cvs-Boat-Shoes_3680157cfff1dd1739138680ade22602_images_1080_1440_mini.jpg,None,None,men,http://www.myntra.com/Casual-Shoes/Puma/Puma-Men-Grey-Yacht-Cvs-Boat-Shoes/244913/buy,Sold byVector Ecommerce Pvt Ltd,None,None,['6', '7', '8', '9', '10', '11'],None,<ul class="mk-pdpv1-product-helper mk-cf"><li class="desc-main-title">Product Description</li><li class="desc-sub-title">Style Note</li><li class="desc-sub-text " itemprop="description"><p>This trendy pair of shoes from Puma is crafted with perfection to make you look absolutely fabulous. Team it with matching sports accessories for a cool look.</p></li><li class="desc-sub-title ">Product Details</li><li class="desc-sub-text"><p>Round toed, grey boat shoes with white accents, has central lace-ups and low top styling<br/>Textile upper with overlays and contrast stitched detail, has lace detailing along the mouth, multiple branding and reinforced heel collar<br/>Soft and padded footbed with branding at the heel<br/>Tough and textured outsole with patterned grooves<br/>Warranty: 3 months against manufacturing defects only<br/>Comes with an extra pair of laces</p></li><li class="desc-sub-title ">Material &amp; Care</li><li class="desc-sub-text "><p>Textile<br/>Wipe with a clean, dry cloth when needed<br/>Click <a href="http://www.myntra.com/textile-care">here</a> for the perfect care products for shoes made of textile/fabric</p></li></ul>,26:02:2014,None
None,Puma Men Black Yacht Cvs Boat Shoes,http://www.myntra.com/Casual-Shoes/Puma/Puma-Men-Black-Yacht-Cvs-Boat-Shoes/244916/buy,Rs. 2,999,men-casual-shoes,Casual Shoes,Puma,http://myntra.myntassets.com/images/style/properties/Puma-Men-Black-Yacht-Cvs-Boat-Shoes_eb817bfd20ee05b8000e492f3beee541_images_1080_1440_mini.jpg,None,None,men,http://www.myntra.com/Casual-Shoes/Puma/Puma-Men-Black-Yacht-Cvs-Boat-Shoes/244916/buy,Sold byVector Ecommerce Pvt Ltd,None,None,['6', '7', '8', '9', '10', '11'],None,<ul class="mk-pdpv1-product-helper mk-cf"><li class="desc-main-title">Product Description</li><li class="desc-sub-title">Style Note</li><li class="desc-sub-text " itemprop="description"><p>This trendy pair of shoes from Puma is crafted with perfection to make you look absolutely fabulous. Team it with matching sports accessories for a cool look.</p></li><li class="desc-sub-title ">Product Details</li><li class="desc-sub-text"><p>Round toed, black boat shoes with white accents, has central lace-ups and low top styling<br/>Textile upper with overlays and contrast stitched detail, has lace detailing along the mouth, multiple branding and reinforced heel collar<br/>Soft and padded footbed with branding at the heel<br/>Tough and textured outsole with patterned grooves<br/>Warranty: 3 months against manufacturing defects only<br/>Comes with an extra pair of laces</p></li><li class="desc-sub-title ">Material &amp; Care</li><li class="desc-sub-text "><p>Textile<br/>Wipe with a clean, dry cloth when needed<br/>Click <a href="http://www.myntra.com/textile-care">here</a> for the perfect care products for shoes made of textile/fabric</p></li></ul>,26:02:2014,None
None,Puma Men Red Yacht Cvs Boat Shoes,http://www.myntra.com/Casual-Shoes/Puma/Puma-Men-Red-Yacht-Cvs-Boat-Shoes/244914/buy,Rs. 2,999,men-casual-shoes,Casual Shoes,Puma,http://myntra.myntassets.com/images/style/properties/Puma-Men-Red-Yacht-Cvs-Boat-Shoes_eb817bfd20ee05b8000e492f3beee541_images_1080_1440_mini.jpg,None,None,men,http://www.myntra.com/Casual-Shoes/Puma/Puma-Men-Red-Yacht-Cvs-Boat-Shoes/244914/buy,Sold byVector Ecommerce Pvt Ltd,None,None,['6', '7', '8', '9', '10', '11'],None,<ul class="mk-pdpv1-product-helper mk-cf"><li class="desc-main-title">Product Description</li><li class="desc-sub-title">Style Note</li><li class="desc-sub-text " itemprop="description"><p>This trendy pair of shoes from Puma is crafted with perfection to make you look absolutely fabulous. Team it with matching sports accessories for a cool look.</p></li><li class="desc-sub-title ">Product Details</li><li class="desc-sub-text"><p>Round toed, red boat shoes with white accents, has central lace-ups and low top styling<br/>Textile upper with overlays and contrast stitched detail, has lace detailing along the mouth, multiple branding and reinforced heel collar<br/>Soft and padded footbed with branding at the heel<br/>Tough and textured outsole with patterned grooves<br/>Warranty: 3 months against manufacturing defects only<br/>Comes with an extra pair of laces</p></li><li class="desc-sub-title ">Material &amp; Care</li><li class="desc-sub-text "><p>Textile<br/>Wipe with a clean, dry cloth when needed<br/>Click <a href="http://www.myntra.com/textile-care">here</a> for the perfect care products for shoes made of textile/fabric</p></li></ul>,26:02:2014,None
None,Puma Men Black & Blue Touring Cat Mamgp Leather Casual Shoes,http://www.myntra.com/Casual-Shoes/Puma/Puma-Men-Black-&-Blue-Touring-Cat-Mamgp-Leather-Casual-Shoes/244894/buy,Rs. 6,499,men-casual-shoes,Casual Shoes,Puma,http://myntra.myntassets.com/images/style/properties/Puma-Men-Black-&-Blue-Touring-Cat-Leather-Casual-Shoes_0e33900a8163bc04e5d91b81dc3a547e_images_1080_1440_mini.jpg,None,None,men,http://www.myntra.com/Casual-Shoes/Puma/Puma-Men-Black-&-Blue-Touring-Cat-Mamgp-Leather-Casual-Shoes/244894/buy,Sold byVector Ecommerce Pvt Ltd,None,None,['6', '7', '8', '9', '10', '11'],None,<ul class="mk-pdpv1-product-helper mk-cf"><li class="desc-main-title">Product Description</li><li class="desc-sub-title">Style Note</li><li class="desc-sub-text " itemprop="description"><p>Stylish shoes from the house of Puma for those who want a perfect blend of fashion, style and comfort. It is versatile enough to be paired with any casuals.</p></li><li class="desc-sub-title ">Product Details</li><li class="desc-sub-text"><p>Round toed, black and blue casual shoes with central lace-ups and low top styling<br/>Leather upper with stitched overlays, printed detail, multiple branding, mesh inlay along the mouth and reinforced heel collar with Mercedes brand badge<br/>Padded tongue and inner, branding on the tongue<br/>EcoOrthoLite footbed for optimum fit and comfort, branding at the heel<br/>Tough and textured outsole with patterned grooves, outsole extends to the heel collar<br/>Warranty: 3 months for manufacturing defect only</p></li><li class="desc-sub-title ">Material &amp; Care</li><li class="desc-sub-text "><p>Leather<br/>Wipe with a clean, dry cloth when needed<br/>Click <a href="http://www.myntra.com/black-smooth-leather-care">here</a> for the perfect care products for black leather shoes</p></li></ul>,26:02:2014,None
None,Puma Men White Future Cat M1 SF NM Leather Casual Shoes,http://www.myntra.com/Casual-Shoes/Puma/Puma-Men-White-Future-Cat-M1-SF-NM-Leather-Casual-Shoes/244908/buy,Rs. 6,699,men-casual-shoes,Casual Shoes,Puma,http://myntra.myntassets.com/images/style/properties/Puma-Men-White-Future-Cat-M1-SF-NM-Leather-Casual-Shoes_79f75f9e7a7ba3fcfc65bc5d04837286_images_1080_1440_mini.jpg,None,None,men,http://www.myntra.com/Casual-Shoes/Puma/Puma-Men-White-Future-Cat-M1-SF-NM-Leather-Casual-Shoes/244908/buy,Sold byVector Ecommerce Pvt Ltd,None,None,['6', '7', '8', '9', '10', '11'],None,<ul class="mk-pdpv1-product-helper mk-cf"><li class="desc-main-title">Product Description</li><li class="desc-sub-title">Style Note</li><li class="desc-sub-text " itemprop="description"><p>Stylish shoes from the house of Puma for those who want a perfect blend of fashion, style and comfort. It is versatile enough to be paired with any casuals.</p></li><li class="desc-sub-title ">Product Details</li><li class="desc-sub-text"><p>Round toed, white casual shoes with red accents, has asymmetrical lace-ups and low top styling<br/>Leather upper with stitched detail, multiple branding, silver toned detail along the mouth and reinforced heel collar<br/>Padded tongue and inner, branding on the tongue<br/>EcoOrthoLite footbed for optimum fit and comfort, branding at the heel<br/>Ferrari shield at the side<br/>Tough and textured outsole with patterned grooves, outsole extends to the heel collar<br/>Warranty: 3 months for manufacturing defect only</p></li><li class="desc-sub-title ">Material &amp; Care</li><li class="desc-sub-text "><p>Leather<br/>Wipe with a clean, dry cloth when needed<br/>Click <a href="http://www.myntra.com/black-smooth-leather-care">here</a> for the perfect care products for black leather shoes</p></li></ul>,26:02:2014,None
None,Puma Men Red Basket City Casual shoes,http://www.myntra.com/Casual-Shoes/Puma/Puma-Men-Red-Basket-City-Casual-shoes/235432/buy,Rs. 3,499,men-casual-shoes,Casual Shoes,Puma,http://myntra.myntassets.com/images/style/properties/Puma-Men-Red-Basket-City-Casual-shoes_6fd8c4d885add284fca9cc8b8bd045e5_images_1080_1440_mini.jpg,None,None,men,http://www.myntra.com/Casual-Shoes/Puma/Puma-Men-Red-Basket-City-Casual-shoes/235432/buy,Sold byVector Ecommerce Pvt Ltd,None,None,['6', '7', '8', '9', '10', '11'],None,<ul class="mk-pdpv1-product-helper mk-cf"><li class="desc-main-title">Product Description</li><li class="desc-sub-title">Style Note</li><li class="desc-sub-text " itemprop="description"><p>The Basket City line of casual shoes from Puma brings back that old school yet trendy look. Neat design and an awesome colour combination makes this a coveted shoe style. We recommend you pair it with a sporty T-shirt and denims for a stylish and casual vibe.</p></li><li class="desc-sub-title ">Product Details</li><li class="desc-sub-text"><p>Round toed, red casual shoes with black accents, has central lace-ups and low top styling<br/>Synthetic leather upper, has contrast stitched detail and overlays, graphic print detail, multiple branding and reinforced heel collar<br/>Soft and padded tongue and inner, branding on the tongue<br/>Cushioned footbed with branding at the heel<br/>Thick, textured midsole with branding and foxing at the forefoot<br/>Tough rubber outsole with branding and patterned grooves<br/>Warranty: 3 months against manufacturing defects</p></li><li class="desc-sub-title ">Material &amp; Care</li><li class="desc-sub-text "><p>Synthetic leather<br/>Wipe with a clean, dry cloth to keep clean<br/>Click <a href="http://www.myntra.com/synthetic-care">here</a> for the perfect care products for synthetic shoes</p></li></ul>,26:02:2014,None
None,Puma Men Grey Modern Court Casual Shoes,http://www.myntra.com/Casual-Shoes/Puma/Puma-Men-Grey-Modern-Court-Casual-Shoes/244948/buy,Rs. 4,999,men-casual-shoes,Casual Shoes,Puma,http://myntra.myntassets.com/images/style/properties/Puma-Men-Grey-Modern-Court-Casual-Shoes_f6f7f8e6cef306ad33cf2e7f634a86c3_images_1080_1440_mini.jpg,None,None,men,http://www.myntra.com/Casual-Shoes/Puma/Puma-Men-Grey-Modern-Court-Casual-Shoes/244948/buy,Sold byVector Ecommerce Pvt Ltd,None,None,['6', '7', '8', '9', '10', '11'],None,<ul class="mk-pdpv1-product-helper mk-cf"><li class="desc-main-title">Product Description</li><li class="desc-sub-title">Style Note</li><li class="desc-sub-text " itemprop="description"><p>This trendy pair of shoes from Puma is crafted with perfection to make you look absolutely fabulous. Team it with matching sports accessories for a cool look.</p></li><li class="desc-sub-title ">Product Details</li><li class="desc-sub-text"><p>Round toed, grey casual shoes, has central lace-ups and low top styling<br/>Leather upper with overlays and stitched detail, has multiple branding and reinforced heel collar<br/>Padded tongue and inner, soft and padded footbed with branding at the heel<br/>Foxing at the forefoot, tough and textured outsole with patterned grooves and pivot point at the forefoot<br/>Warranty: 3 months against manufacturing defects only</p></li><li class="desc-sub-title ">Material &amp; Care</li><li class="desc-sub-text "><p>Leather<br/>Wipe with a clean, dry cloth when needed<br/>Click <a href="http://www.myntra.com/other-smooth-leather-care">here</a> for the perfect care products for leather shoes</p></li></ul>,26:02:2014,None
None,Puma Men Black Modern Court Casual Shoes,http://www.myntra.com/Casual-Shoes/Puma/Puma-Men-Black-Modern-Court-Casual-Shoes/244947/buy,Rs. 4,999,men-casual-shoes,Casual Shoes,Puma,http://myntra.myntassets.com/images/style/properties/Puma-Men-Black-Modern-Court-Casual-Shoes_6e17113e6b495f4306f2535384513261_images_1080_1440_mini.jpg,None,None,men,http://www.myntra.com/Casual-Shoes/Puma/Puma-Men-Black-Modern-Court-Casual-Shoes/244947/buy,Sold byVector Ecommerce Pvt Ltd,None,None,['6', '7', '8', '9', '10', '11'],None,<ul class="mk-pdpv1-product-helper mk-cf"><li class="desc-main-title">Product Description</li><li class="desc-sub-title">Style Note</li><li class="desc-sub-text " itemprop="description"><p>This trendy pair of shoes from Puma is crafted with perfection to make you look absolutely fabulous. Team it with matching sports accessories for a cool look.</p></li><li class="desc-sub-title ">Product Details</li><li class="desc-sub-text"><p>Round toed, black casual shoes, has central lace-ups and low top styling<br/>Leather upper with overlays and stitched detail, has multiple branding and reinforced heel collar<br/>Padded tongue and inner, soft and padded footbed with branding at the heel<br/>Foxing at the forefoot, tough and textured outsole with patterned grooves and pivot point at the forefoot<br/>Warranty: 3 months against manufacturing defects only</p></li><li class="desc-sub-title ">Material &amp; Care</li><li class="desc-sub-text "><p>Leather<br/>Wipe with a clean, dry cloth when needed<br/>Click <a href="http://www.myntra.com/black-smooth-leather-care">here</a> for the perfect care products for black leather shoes</p></li></ul>,26:02:2014,None
None,Puma Men Green & White El Tex Mid Ind. Casual Shoes,http://www.myntra.com/Casual-Shoes/Puma/Puma-Men-Green-&-White-El-Tex-Mid-Ind.-Casual-Shoes/197553/buy,Rs. 3,229,men-casual-shoes,Casual Shoes,Puma,http://myntra.myntassets.com/images/style/properties/Puma-Men-Casual-Shoes_0a16840ea3e8dc42673db7f8eeae49ce_images_1080_1440_mini.jpg,Rs. 3,799,None,men,http://www.myntra.com/Casual-Shoes/Puma/Puma-Men-Green-&-White-El-Tex-Mid-Ind.-Casual-Shoes/197553/buy,Sold byVector Ecommerce Pvt Ltd,None,None,['7', '8', '9', '10', '11'],None,<ul class="mk-pdpv1-product-helper mk-cf"><li class="desc-main-title">Product Description</li><li class="desc-sub-title">Style Note</li><li class="desc-sub-text " itemprop="description"><p>The El Tex Mid Ind. casual shoes are one of those low-profile kicks that goes with pretty much anything. This mid version pairs the shoe's signature moulded rubber strap.</p></li><li class="desc-sub-title ">Product Details</li><li class="desc-sub-text"><p>Round toed, green and white casual shoes with grey accents, has central lace-ups and mid top styling<br/>Canvas upper with overlays and stitched detail, has multiple branding and reinforced heel collar<br/>Soft and padded tongue and inner, branding on the tongue<br/>Soft and padded footbed with branding at the heel<br/>Tough and textured outsole with patterned grooves<br/>Warranty: 3 months for manufacturing defects only</p></li><li class="desc-sub-title ">Material &amp; Care</li><li class="desc-sub-text "><p>Canvas<br/>Wipe with a clean, dry cloth when needed</p></li></ul>,26:02:2014,None
None,Puma Men Black Pooler Mini Casual Shoes,http://www.myntra.com/Casual-Shoes/Puma/Puma-Men-Black-Pooler-Mini-Casual-Shoes/213489/buy,Rs. 6,799,men-casual-shoes,Casual Shoes,Puma,http://myntra.myntassets.com/images/style/properties/Puma-Men-Black-Pooler-Mini-Sports-Shoes_ed2edb462d0e92915ba36fbf58db078d_images_1080_1440_mini.jpg,Rs. 7,999,None,men,http://www.myntra.com/Casual-Shoes/Puma/Puma-Men-Black-Pooler-Mini-Casual-Shoes/213489/buy,Sold byVector Ecommerce Pvt Ltd,None,None,['6', '7', '8', '9', '10', '11', '12'],None,<ul class="mk-pdpv1-product-helper mk-cf"><li class="desc-main-title">Product Description</li><li class="desc-sub-title">Style Note</li><li class="desc-sub-text " itemprop="description"><p>This pair of casual shoes from Puma, with its sleek design and materials provide comfort and boost your style quotient instantly. Team it with denims and a tee to make a style statement.</p></li><li class="desc-sub-title ">Product Details</li><li class="desc-sub-text"><p>Round toed, black casual shoes with central lace-ups and low top styling<br/>Suede upper with overlays and stitched detail, has multiple branding, perforated detail and reinforced heel collar<br/>Soft tongue and inner, branding on the tongue<br/>Cushioned footbed with branding at the heel<br/>Tough and textured outsole with grooves and branding<br/>Warranty: 3 months for manufacturing defects only</p></li><li class="desc-sub-title ">Material &amp; Care</li><li class="desc-sub-text "><p>Suede<br/>Wipe with a clean, dry cloth when needed<br/>Click <a href="http://www.myntra.com/black-suede-care">here</a> for the perfect care products for black suede shoes</p></li></ul>,26:02:2014,None
None,Puma Unisex Green Hip Hop III Casual Shoes,http://www.myntra.com/Casual-Shoes/Puma/Puma-Unisex-Green-Hip-Hop-III-Casual-Shoes/159180/buy,Rs. 1,359,men-casual-shoes,Casual Shoes,Puma,http://myntra.myntassets.com/images/style/properties/Puma-Unisex-Green-Hip-Hop-III-Casual-Shoes_1d8d128a92eedae5a10552ca515880b5_images_1080_1440_mini.jpg,Rs. 1,599,None,men,http://www.myntra.com/Casual-Shoes/Puma/Puma-Unisex-Green-Hip-Hop-III-Casual-Shoes/159180/buy,Sold byVector Ecommerce Pvt Ltd,None,None,['UK4', 'UK5', 'UK6', 'UK7', 'UK8', 'UK9', 'UK10', 'UK11'],None,<ul class="mk-pdpv1-product-helper mk-cf"><li class="desc-main-title">Product Description</li><li class="desc-sub-title">Style Note</li><li class="desc-sub-text " itemprop="description"><p>A stylish shoe for casual outings, the Puma Hip Hop is replete with  features to enhance your style and help you walk with ease. Designed in a  low-profile manner, it is created keeping the foot anatomy in mind to  make your walks all the more stable and comfortable. Team this with jeans and tee for the casual days.</p></li><li class="desc-sub-title ">Product Details</li><li class="desc-sub-text"><p>Round toed, green casual shoes with yellow accents, central lace-ups and low top styling<br/>Canvas upper with stitched detail, formstrip on the sides, multiple branding and reinforced heel collar<br/>Soft, comfy footbed for a comfortable fit<br/>Thick midsole with foxing at the forefoot<br/>Tough rubber outsole with branded grooves<br/>Warranty: 3 months against manufacturing defects</p></li><li class="desc-sub-title ">Material &amp; Care</li><li class="desc-sub-text "><p>Canvas<br/>Wipe with a dry, clean cloth to remove dust</p></li></ul>,26:02:2014,None
None,Puma Men Black Future Suede Lite Tech Casual Shoes,http://www.myntra.com/Casual-Shoes/Puma/Puma-Men-Black-Future-Suede-Lite-Tech-Casual-Shoes/162130/buy,Rs. 4,249,men-casual-shoes,Casual Shoes,Puma,http://myntra.myntassets.com/images/style/properties/Puma-Men-Black-Future-Suede-Lite-Tech-Casual-Shoes_4a33c303617a79f38c6697621f0e2c16_images_1080_1440_mini.jpg,Rs. 4,999,None,men,http://www.myntra.com/Casual-Shoes/Puma/Puma-Men-Black-Future-Suede-Lite-Tech-Casual-Shoes/162130/buy,Sold byVector Ecommerce Pvt Ltd,None,None,['6', '7', '8', '9', '10', '11', '12'],None,<ul class="mk-pdpv1-product-helper mk-cf"><li class="desc-main-title">Product Description</li><li class="desc-sub-title">Style Note</li><li class="desc-sub-text " itemprop="description"><p>Puma may have pioneered many things - including the original Puma Suede in 1968. The Future Suede is light on weight, and heavy on the futuristic tweaks: a lightweight bottom, with painted midsole. Team it with your casuals for a relaxed look.</p></li><li class="desc-sub-title ">Product Details</li><li class="desc-sub-text"><p>Round toed, black casual shoes with grey accents, has contrast central lace-ups and low top styling<br/>Synthetic upper, has formstrips on the sides, stitched overlays, multiple branding, reinforced heel collar with plastic detail and pull tab<br/>Soft tongue and inner, branding on the tongue<br/>Cushioned EcoOrthoLite® footbed with branding at the heel<br/>Thick midsole with textured foxing at the forefoot and printed detail at the backfoot<br/>Tough rubber outsole with branding and patterned grooves<br/>Warranty: 3 months against manufacturing defects</p></li><li class="desc-sub-title ">Material &amp; Care</li><li class="desc-sub-text "><p>Synthetic<br/>Wipe with a clean, dry cloth to keep clean<br/>Click <a href="http://www.myntra.com/synthetic-care">here</a> for the perfect care products for synthetic shoes</p></li><li class="desc-sub-title">Size &amp; Fit</li><li class="desc-sub-text"><br/></li></ul>,26:02:2014,None
None,Puma Men Grey & Blue Future Slipstream Lo Mix Casual Shoes,http://www.myntra.com/Casual-Shoes/Puma/Puma-Men-Grey-&-Blue-Future-Slipstream-Lo-Mix-Casual-Shoes/244951/buy,Rs. 4,999,men-casual-shoes,Casual Shoes,Puma,http://myntra.myntassets.com/images/style/properties/Puma-Men-Grey-&-Blue-Future-Slipstream-Lo-Mix-Casual-Shoes_01d2ac1f0e51b4e07be265fa10d361d3_images_1080_1440_mini.jpg,None,None,men,http://www.myntra.com/Casual-Shoes/Puma/Puma-Men-Grey-&-Blue-Future-Slipstream-Lo-Mix-Casual-Shoes/244951/buy,Sold byVector Ecommerce Pvt Ltd,None,None,['6', '7', '8', '9', '10', '11'],None,<ul class="mk-pdpv1-product-helper mk-cf"><li class="desc-main-title">Product Description</li><li class="desc-sub-title">Style Note</li><li class="desc-sub-text " itemprop="description"><p>This trendy pair of shoes from Puma is crafted with perfection to make you look absolutely fabulous. Team it with matching sports accessories for a cool look.</p></li><li class="desc-sub-title ">Product Details</li><li class="desc-sub-text"><p>Round toed, grey and blue casual shoes with cream toned and orange accents, has central lace-ups and low top styling<br/>Mesh upper with overlays and stitched detail, multiple branding and reinforced heel collar<br/>Padded tongue and inner, soft and padded footbed with branding at the heel<br/>Tough and textured outsole with patterned grooves<br/>Warranty: 3 months against manufacturing defects only</p></li><li class="desc-sub-title ">Material &amp; Care</li><li class="desc-sub-text "><p>Mesh<br/>Wipe with a clean, dry cloth when needed<br/>Click <a href="http://www.myntra.com/synthetic-care">here</a> for the perfect care products for synthetic shoes</p></li></ul>,26:02:2014,None
None,Puma Men Black El Rey Future Casual Shoes,http://www.myntra.com/Casual-Shoes/Puma/Puma-Men-Black-El-Rey-Future-Casual-Shoes/159149/buy,Rs. 5,949,men-casual-shoes,Casual Shoes,Puma,http://myntra.myntassets.com/images/style/properties/Puma-Men-Black-El-Rey-Future-Casual-Shoes_5f32f7e7473a60d6421ad1df4f900b3c_images_1080_1440_mini.jpg,Rs. 6,999,None,men,http://www.myntra.com/Casual-Shoes/Puma/Puma-Men-Black-El-Rey-Future-Casual-Shoes/159149/buy,Sold byVector Ecommerce Pvt Ltd,None,None,['6', '7', '8', '9', '10', '11', '12'],None,<ul class="mk-pdpv1-product-helper mk-cf"><li class="desc-main-title">Product Description</li><li class="desc-sub-title">Style Note</li><li class="desc-sub-text " itemprop="description"><p>El Rey has never been an ordinary, vulcanized slip-on. It's been a PUMA icon since day uno. And this take is no exception. The El Rey Future takes the rubber-band sneaker icon and kicks it up a few notches. It reinvents the original low-profile version with a higher collar, bootie construction, and breathable mesh windows. The band gets an update, too: it criss-crosses from side panels to tongue for that signature, laidback style and swagger.</p></li><li class="desc-sub-title ">Product Details</li><li class="desc-sub-text"><p>Round toed, black casual shoes with yellow accents, Velcro closure and low top styling<br/>Synthetic upper with a tab with Velcro closure across the midfoot<br/>Perforated detail throughout, has overlay detail, reinforced overlay at the heel collar<br/>Branding at the closure, heel collar and midfoot<br/>Soft and padded footbed with branding<br/>Glazed finish at the midsole region<br/>Tough and textured outsole with square nubs and grooves<br/>Warranty: 3 months against manufacturing defects</p></li><li class="desc-sub-title ">Material &amp; Care</li><li class="desc-sub-text "><p>Synthetic<br/>Wipe with a clean, dry cloth when needed</p></li></ul>,26:02:2014,None
