None,Puma Men Blue Speeder Tetron II Casual Shoes,http://www.myntra.com/Casual-Shoes/Puma/Puma-Men-Blue-Speeder-Tetron-II-Casual-Shoes/114252/buy,Rs. 2,124,men-casual-shoes,Casual Shoes,Puma,http://myntra.myntassets.com/images/style/properties/Puma-Men-Casual-Shoes_3723a178754ba2910f671d00892b3072_images_1080_1440_mini.jpg,Rs. 2,499,None,men,http://www.myntra.com/Casual-Shoes/Puma/Puma-Men-Blue-Speeder-Tetron-II-Casual-Shoes/114252/buy,Sold byVector Ecommerce Pvt Ltd,None,None,['6', '7', '8', '9', '10', '11'],None,<ul class="mk-pdpv1-product-helper mk-cf"><li class="desc-main-title">Product Description</li><li class="desc-sub-title">Style Note</li><li class="desc-sub-text " itemprop="description"><p>A stylish shoe for sports, the Puma Speeder Tetron is packed with features to keep your feet well protected while you sweat it out. We love the compact design and the different colour hues which lend to its appeal. You can also team this pair with jeans and tees for casual outings.</p></li><li class="desc-sub-title ">Product Details</li><li class="desc-sub-text"><p>Round toed, blue sneakers with low top styling and central lace-ups<br/>Synthetic upper with overlays, light blue foam stripes at the sides and reinforced heel collar<br/>Branding on the tongue, side, footbed and heel collar<br/>Padded inner, tongue and cushioned footbed<br/>Thick midsole with white and light blue stripes<br/>Durable rubber outsole with spikes all over and pivot points at the forefoot<br/>Warranty: 3 months for manufacturing defect only</p></li><li class="desc-sub-title ">Material &amp; Care</li><li class="desc-sub-text "><p>Synthetic<br/> Wipe with clean dry cloth to keep clean</p></li></ul>,26:02:2014,None
None,Puma Men Black Casual Shoes,http://www.myntra.com/Casual-Shoes/Puma/Puma-Men-Black-Casual-Shoes/213468/buy,Rs. 1,699,men-casual-shoes,Casual Shoes,Puma,http://myntra.myntassets.com/images/style/properties/Puma-Men-Black-Casual-Shoes_36fe29cab7dc1574571c40bfe16b9ff4_images_1080_1440_mini.jpg,Rs. 1,999,None,men,http://www.myntra.com/Casual-Shoes/Puma/Puma-Men-Black-Casual-Shoes/213468/buy,Sold byVector Ecommerce Pvt Ltd,None,None,['6', '7', '8', '9', '10', '11'],None,<ul class="mk-pdpv1-product-helper mk-cf"><li class="desc-main-title">Product Description</li><li class="desc-sub-title">Style Note</li><li class="desc-sub-text " itemprop="description"><p>A pair like this can only be the brainchild of a sports lifestyle brand like Puma. We love the sleek look and stylish design. We recommend that you team it with clean look jeans for a sporty vibe.</p></li><li class="desc-sub-title ">Product Details</li><li class="desc-sub-text"><p>Round toed, black casual shoes with red accents, has central lace-ups and low top styling<br/>Synthetic upper with multiple branding, stitched overlays<br/>Padded collar, tongue and inner, reinforced heel collar<br/>Soft and cushioned footbed with branding on the heel<br/>Rubber outsole with patterned grooves<br/>Warranty: 3 months for manufacturing defects only</p></li><li class="desc-sub-title ">Material &amp; Care</li><li class="desc-sub-text "><p>Synthetic<br/>Wipe with a clean, dry cloth when needed<br/>Click <a href="http://www.myntra.com/synthetic-care">here</a> for the perfect care products for synthetic shoes</p></li></ul>,26:02:2014,None
None,Puma Men Black Acer Casual Shoes,http://www.myntra.com/Casual-Shoes/Puma/Puma-Men-Black-Acer-Casual-Shoes/213450/buy,Rs. 2,974,men-casual-shoes,Casual Shoes,Puma,http://myntra.myntassets.com/images/style/properties/Puma-Men-Black-Acer-Casual-Shoes_f5621596bed4cd244a695b69fe377503_images_1080_1440_mini.jpg,Rs. 3,499,None,men,http://www.myntra.com/Casual-Shoes/Puma/Puma-Men-Black-Acer-Casual-Shoes/213450/buy,Sold byVector Ecommerce Pvt Ltd,None,None,single size,None,<ul class="mk-pdpv1-product-helper mk-cf"><li class="desc-main-title">Product Description</li><li class="desc-sub-title">Style Note</li><li class="desc-sub-text " itemprop="description"><p>Stylish shoes from the house of Puma for those who want a perfect blend of fashion, style and comfort. It is versatile enough to be paired with any casuals.</p></li><li class="desc-sub-title ">Product Details</li><li class="desc-sub-text"><p>Black with red accents, casual shoes, has Velcro closure and low top styling<br/>Synthetic upper with overlays, stitch detailing, has dual Velcro closures, has formstripe on one side and branding on the other, reinforced heel collar with branding<br/>Soft and padded tongue and inner, branding on the tongue<br/>Cushioned footbed with branding at the heel<br/>Tough and textured outsole which extends to the heel collar<br/>Warranty: 3 months for manufacturing defect only</p></li><li class="desc-sub-title ">Material &amp; Care</li><li class="desc-sub-text "><p>Synthetic leather<br/>Wipe with a clean, dry cloth when needed<br/>Click <a href="http://www.myntra.com/synthetic-care">here</a> for the perfect care products for synthetic shoes</p></li></ul>,26:02:2014,None
None,Puma Men White Sky 2 Hi Urban Triple Leather Casual Shoes,http://www.myntra.com/Casual-Shoes/Puma/Puma-Men-White-Sky-2-Hi-Urban-Triple-Leather-Casual-Shoes/220641/buy,Rs. 6,204,men-casual-shoes,Casual Shoes,Puma,http://myntra.myntassets.com/images/style/properties/Puma-Men-White-Sky-2-Hi-Urban-Triple-Leather-Casual-Shoes_132103889ab1943c7edefc5ebc499b47_images_1080_1440_mini.jpg,Rs. 7,299,None,men,http://www.myntra.com/Casual-Shoes/Puma/Puma-Men-White-Sky-2-Hi-Urban-Triple-Leather-Casual-Shoes/220641/buy,Sold byVector Ecommerce Pvt Ltd,None,None,['6', '7', '8', '9', '10', '11', '12'],None,<ul class="mk-pdpv1-product-helper mk-cf"><li class="desc-main-title">Product Description</li><li class="desc-sub-title">Style Note</li><li class="desc-sub-text " itemprop="description"><p>This pair of basketball style casual shoes from Puma, comes in a modern and smashing design ready to take people's breath away. It features shiny leather on the upper with perforations so your feet can breathe. Featuring classic styling, this pair is a shoe closet essential.</p></li><li class="desc-sub-title ">Product Details</li><li class="desc-sub-text"><p>Round toed, white casual shoes, with yellow accents, high top styling and central lace-ups<br/>Leather upper with overlays,stitch detail, perforations at the sides and on the front, white stripes at the sides and reinforced heel collar, with two ankle straps secured with Velcro closures, branding at the heel collar<br/>Cushioned tongue with branding and perforated detail<br/>Cushioned footbed with branding<br/>Thick white EVA midsole with textured patterns and branding on it<br/>Tough rubber outsole with patterned grooves and branding<br/>Warranty: 3 months for manufacturing defects only</p></li><li class="desc-sub-title ">Material &amp; Care</li><li class="desc-sub-text "><p>Leather and rubber<br/>Use a branded leather conditioner to clean the product<br/>Click <a href="http://www.myntra.com/white-smooth-leather-care">here</a> for the perfect care products for white leather shoes</p></li></ul>,26:02:2014,None
None,Puma Unisex Red Glyde Espadrille Casual Shoes,http://www.myntra.com/Casual-Shoes/Puma/Puma-Unisex-Red-Glyde-Espadrille-Casual-Shoes/148958/buy,Rs. 3,499,men-casual-shoes,Casual Shoes,Puma,http://myntra.myntassets.com/images/style/properties/Puma-Unisex-Casual-Shoes_cd7362ed6cdc6fa64951f2df8056704b_images_1080_1440_mini.jpg,Rs. 4,999,None,men,http://www.myntra.com/Casual-Shoes/Puma/Puma-Unisex-Red-Glyde-Espadrille-Casual-Shoes/148958/buy,Sold byVector Ecommerce Pvt Ltd,None,None,['6', '7', '8', '9', '10', '11', '12'],None,<ul class="mk-pdpv1-product-helper mk-cf"><li class="desc-main-title">Product Description</li><li class="desc-sub-title">Style Note</li><li class="desc-sub-text " itemprop="description"><p>From the Puma archive in 1968, the Clyde was a request from Walt ‘Clyde’ Frazier who wanted a shoe that was wide enough to play basketball in and colourful enough to make a statement. For a fresh take on the Clyde, Puma lowered the profile, created a spring-inspired layered mesh body surrounded by a sturdy die cut rubber bottom with a stylish espadrille wrap. Get your hands on this stylish pair to add colour pop to your look!</p></li><li class="desc-sub-title ">Product Details</li><li class="desc-sub-text"><p>Round toed, red casual shoes with low top styling and central lace-ups<br/>Suede upper with mesh panels at the sides and reinforced heel collar<br/>Cushioned footbed, formstrips at the side, branding on the tongue and heel collar<br/>Thick rubber midsole with braided detail <br/>Tough rubber outsole with patterned grooves and branding in the centre<br/>Warranty: 3 months from the date of purchase, against manufacturing defects only</p></li><li class="desc-sub-title ">Material &amp; Care</li><li class="desc-sub-text "><p>Suede and rubber<br/> Use a clean, dry cloth to clean the product<br/>Click <a href="http://www.myntra.com/other-suede-care">here</a> for the perfect care products for suede shoes</p><p></p></li><li class="desc-sub-title">Size &amp; Fit</li><li class="desc-sub-text"><br/></li></ul>,26:02:2014,None
None,Puma Men Yellow Grimme Lo Slipon InterestCVS Casual Shoes,http://www.myntra.com/Casual-Shoes/Puma/Puma-Men-Yellow-Grimme-Lo-Slipon-InterestCVS-Casual-Shoes/222424/buy,Rs. 3,009,men-casual-shoes,Casual Shoes,Puma,http://myntra.myntassets.com/images/style/properties/Puma-Men-Yellow-Grimme-Lo-Slipon-InterestCVS-Casual-Shoes_293b631fcd5c4e6af270e4047bd348cb_images_1080_1440_mini.jpg,Rs. 4,299,None,men,http://www.myntra.com/Casual-Shoes/Puma/Puma-Men-Yellow-Grimme-Lo-Slipon-InterestCVS-Casual-Shoes/222424/buy,Sold byVector Ecommerce Pvt Ltd,None,None,['7', '9', '10', '11', '12'],None,<ul class="mk-pdpv1-product-helper mk-cf"><li class="desc-main-title">Product Description</li><li class="desc-sub-title">Style Note</li><li class="desc-sub-text " itemprop="description"><p>With a slip-on construction and sleek design, this pair of casual shoes from Puma will boost your style quotient instantly. Team this with denims and a tee to make a style statement.</p></li><li class="desc-sub-title ">Product Details</li><li class="desc-sub-text"><p>Round toed, yellow casual shoes with black and white accents, low top and slip-on styling<br/>Canvas upper with printed detail, overlays and stitched detailing, has elasticated gussets on the sides of the tongue with brand tag on one side, reinforced heel collar, has a pull tab with reflective stripes<br/>Cushioned footbed with graphic detailing at the heel<br/>Vulcanized rubber outsole with patterned grooves<br/>Warranty: 3 months for manufacturing defects</p></li><li class="desc-sub-title ">Material &amp; Care</li><li class="desc-sub-text "><p>Canvas<br/> Wipe surface with soft, clean cloth to remove dust<br/>Click <a href="http://www.myntra.com/textile-care">here</a> for the perfect care products for shoes made of textile</p></li></ul>,26:02:2014,None
None,Puma Men Black Evospeed Ferrari Casual Shoes,http://www.myntra.com/Casual-Shoes/Puma/Puma-Men-Black-Evospeed-Ferrari-Casual-Shoes/67305/buy,Rs. 4,929,men-casual-shoes,Casual Shoes,Puma,http://myntra.myntassets.com/images/style/properties/Puma-Men-Black-Evospeed-Casual-Shoes_88fb754f34e452ae6a6110e2c24ad599_images_1080_1440_mini.jpg,Rs. 5,799,None,men,http://www.myntra.com/Casual-Shoes/Puma/Puma-Men-Black-Evospeed-Ferrari-Casual-Shoes/67305/buy,Sold byVector Ecommerce Pvt Ltd,None,None,['6', '7', '8', '9', '10', '11', '12'],None,<ul class="mk-pdpv1-product-helper mk-cf"><li class="desc-main-title">Product Description</li><li class="desc-sub-title">Style Note</li><li class="desc-sub-text " itemprop="description"><p>Evospeed from Puma is a running shoe aims to looks good while you're on the race track and when're you're off it. It's superior cushioning and all-over comfort is packed into the sleek shoe.</p></li><li class="desc-sub-title ">Product Details</li><li class="desc-sub-text"><p>Premium lightweight upper<br/> Ortholite sockliner for a good <a href="../Fit">Fit</a> and moisture control<br/> Lightweight midsole fir cushioning and response<br/> Abrasion resistant rubber outsole with an EverTrack component for added cushioning</p></li><li class="desc-sub-title ">Material &amp; Care</li><li class="desc-sub-text "><p>Synthetic<br/> Wipe with a clean cloth to remove dust</p></li></ul>,26:02:2014,None
None,Puma Men's Yacht Battleship Black Red Shoe,http://www.myntra.com/Casual-Shoes/Puma/Puma-Men's-Yacht-Battleship-Black-Red-Shoe/3218/buy,Rs. 4,999,men-casual-shoes,Casual Shoes,Puma,http://myntra.myntassets.com/images/style/properties/10c6d438f0fde183466726a2b030c501_images_1080_1440_mini.jpg,None,None,men,http://www.myntra.com/Casual-Shoes/Puma/Puma-Men's-Yacht-Battleship-Black-Red-Shoe/3218/buy,Sold byVector Ecommerce Pvt Ltd,None,None,['7', '8', '9', '10', '11'],None,<ul class="mk-pdpv1-product-helper mk-cf"><li class="desc-main-title">Product Description</li><li class="desc-sub-title ">Product Details</li><li class="desc-sub-text"><p style="text-align: justify;">Look trendy and stay comfortable in these Yatch Battleship lifestyle <a href="/shoes">shoes</a> from <a href="/puma">puma</a>. This black and white combo is a fresh take on the classic design and looks cool on the yatch and off it.<br/><br/><strong>Upper</strong></p><ul><li>Black suede uppers for comfort and protection</li><li>Stitch detailing in the form of formstripes on the sides</li><li>Contrast lace-ups for snug <a href="/Fit">Fit</a></li><li>Leather lining for greater comfort</li><li><a href="/cat">cat</a> logo on the tongue</li></ul><p style="text-align: justify;"><strong>Midsole<br/></strong></p><ul><li>Cushioned insole for all day comfort</li><li>Phylon midsole for comfort and stability</li></ul><p style="text-align: justify;"><strong>Outsole<br/></strong></p><ul><li>Rubber non-marking outsole with thin horizontal grooves</li><li>Scooped heel and flex groove on forefoot with ventilation holes for maximum cushioned comfort</li></ul><p style="text-align: justify;"><strong><br/></strong></p></li><li class="desc-sub-title ">Material &amp; Care</li><li class="desc-sub-text "><strong></strong>Rub surface with a soft, damp cloth to remove dust<br/>Do not machine wash <br/>Click <a href="http://www.myntra.com/black-suede-care">here</a> for the perfect care products for black suede shoes<p></p></li></ul>,26:02:2014,None
None,Puma Men White & Grey Serve Pro L/L Casual Shoes,http://www.myntra.com/Casual-Shoes/Puma/Puma-Men-White-&-Grey-Serve-Pro-L/L-Casual-Shoes/148962/buy,Rs. 2,659,men-casual-shoes,Casual Shoes,Puma,http://myntra.myntassets.com/images/style/properties/Puma-Unisex-Casual-Shoes_faf49d67612a5d8b6f99cd2df73fad4f_images_1080_1440_mini.jpg,Rs. 3,799,None,men,http://www.myntra.com/Casual-Shoes/Puma/Puma-Men-White-&-Grey-Serve-Pro-L/L-Casual-Shoes/148962/buy,Sold byVector Ecommerce Pvt Ltd,None,None,['7', '8', '9', '10', '11'],None,<ul class="mk-pdpv1-product-helper mk-cf"><li class="desc-main-title">Product Description</li><li class="desc-sub-title">Style Note</li><li class="desc-sub-text " itemprop="description"><p>Inspired by 1980s indoor court shoe, the Serve Pro is the type that'll choose a ping-pong paddle over a tennis racquet – without feeling any less the competitor. Its leather silhouette features a protective toe cap and the low profile style suited to killer serves and late night shenanigans.</p></li><li class="desc-sub-title ">Product Details</li><li class="desc-sub-text"><p>White casual shoes with grey accents, has central lace-ups for a snug fit with metal eyelets and low top styling<br/>Leather upper with overlays, including an asymmetric toe cap for forefoot reinforcement<br/>Eco OrthoLite technology to provide breathability, moisture control, anti-microbial properties and long term cushioning<br/>Textile lining for added comfort<br/>Heel pull tab<br/>Grippy rubber outsole with branding<br/>Puma formstrip at medial and lateral sides<br/>Embroidered branding on the tongue and cat logo at the reinforced heel<br/>Warranty: 3 months against manufacturing defects</p></li><li class="desc-sub-title ">Material &amp; Care</li><li class="desc-sub-text "><p>Leather<br/>Wipe with a clean cloth to remove dust</p></li></ul>,26:02:2014,None
None,Puma Men White Casual Shoes,http://www.myntra.com/Casual-Shoes/Puma/Puma-Men-White-Casual-Shoes/213469/buy,Rs. 1,699,men-casual-shoes,Casual Shoes,Puma,http://myntra.myntassets.com/images/style/properties/Puma-Men-White-Casual-Shoes_8dfdfb6acae0e8c003858f63a2b1663e_images_1080_1440_mini.jpg,Rs. 1,999,None,men,http://www.myntra.com/Casual-Shoes/Puma/Puma-Men-White-Casual-Shoes/213469/buy,Sold byVector Ecommerce Pvt Ltd,None,None,['6', '7', '8', '9', '10', '11'],None,<ul class="mk-pdpv1-product-helper mk-cf"><li class="desc-main-title">Product Description</li><li class="desc-sub-title">Style Note</li><li class="desc-sub-text " itemprop="description"><p>A pair like this can only be the brainchild of a sports lifestyle brand like Puma. We love the sleek look and stylish design. We recommend that you team it with clean look jeans for a sporty vibe.</p></li><li class="desc-sub-title ">Product Details</li><li class="desc-sub-text"><p>Round toed, white casual shoes with black accents, has central lace-ups and low top styling<br/>Synthetic upper with multiple branding, stitched overlays<br/>Padded collar, tongue and inner, reinforced heel collar<br/>Soft and cushioned footbed with branding on the heel<br/>Rubber outsole with patterned grooves<br/>Warranty: 3 months for manufacturing defects only</p></li><li class="desc-sub-title ">Material &amp; Care</li><li class="desc-sub-text "><p>Synthetic<br/>Wipe with a clean, dry cloth when needed<br/>Click <a href="http://www.myntra.com/synthetic-care">here</a> for the perfect care products for synthetic shoes</p></li></ul>,26:02:2014,None
None,Puma Men Black Alwyn Mid Mini Casual Shoes,http://www.myntra.com/Casual-Shoes/Puma/Puma-Men-Black-Alwyn-Mid-Mini-Casual-Shoes/207850/buy,Rs. 6,374,men-casual-shoes,Casual Shoes,Puma,http://myntra.myntassets.com/images/style/properties/Puma-Men-Casual-Shoes_961aae3a69e81847428ca613823b124d_images_1080_1440_mini.jpg,Rs. 7,499,None,men,http://www.myntra.com/Casual-Shoes/Puma/Puma-Men-Black-Alwyn-Mid-Mini-Casual-Shoes/207850/buy,Sold byVector Ecommerce Pvt Ltd,None,None,['8', '9'],None,<ul class="mk-pdpv1-product-helper mk-cf"><li class="desc-main-title">Product Description</li><li class="desc-sub-title">Style Note</li><li class="desc-sub-text " itemprop="description"><p>This pair of casual shoes from Puma, with its sleek design and materials, provide comfort and boost your style quotient instantly. Team this pair, with denims and a tee to make a style statement.</p></li><li class="desc-sub-title ">Product Details</li><li class="desc-sub-text"><p>Round toed, black casual shoes with mid top styling and central lace-ups<br/>Suede upper with stitched detail, overlays, perforated detail, and reinforced heel collar, has an overlay with branding at the backfoot<br/>Padded inner tongue with branding and cushioned footbed with branding at the heel<br/>Tough and textured outsole with patterned grooves and branding<br/>Warranty: 3 months against manufacturing defects</p></li><li class="desc-sub-title ">Material &amp; Care</li><li class="desc-sub-text "><p>Suede<br/>Use a branded suede conditioner to clean the product<br/>Click <a href="http://www.myntra.com/black-suede-care">here</a> for the perfect care products for black suede shoes</p></li></ul>,26:02:2014,None
None,Puma Men Green Limnos III Casual Shoes,http://www.myntra.com/Casual-Shoes/Puma/Puma-Men-Green-Limnos-III-Casual-Shoes/207853/buy,Rs. 1,529,men-casual-shoes,Casual Shoes,Puma,http://myntra.myntassets.com/images/style/properties/Puma-Men-Green-Limnos-III-Casual-Shoes_76d643363b5f940ca3ad726df4b135e8_images_1080_1440_mini.jpg,Rs. 1,799,None,men,http://www.myntra.com/Casual-Shoes/Puma/Puma-Men-Green-Limnos-III-Casual-Shoes/207853/buy,Sold byVector Ecommerce Pvt Ltd,None,None,['6', '7', '8', '9', '10'],None,<ul class="mk-pdpv1-product-helper mk-cf"><li class="desc-main-title">Product Description</li><li class="desc-sub-title">Style Note</li><li class="desc-sub-text " itemprop="description"><p>A stylish shoe for casual outings, the Puma Limnos III Ind is replete with features to enhance your style and helps you walk with ease. Team this with jeans and tees for casual outings.</p></li><li class="desc-sub-title ">Product Details</li><li class="desc-sub-text"><p>Round toed, green canvas shoes with central lace-ups and low top styling<br/>Canvas upper with stitched and overlay detail<br/>Reinforced overlay at the heel collar with branding and a pull tab<br/>Soft tongue with branding<br/>Soft and padded footbed with branding<br/>Foxing along the forefoot at midsole region<br/>Tough and textured outsole with branding<br/>Warranty: 3 months for manufacturing defects only</p></li><li class="desc-sub-title ">Material &amp; Care</li><li class="desc-sub-text "><p>Canvas<br/>Wipe with a clean, dry cloth when needed<br/>Click <a href="http://www.myntra.com/textile-care">here</a> for the perfect care products for shoes made of textile/fabric</p></li></ul>,26:02:2014,None
None,Puma Unisex Black & Green Limnos Cat Casual Shoes,http://www.myntra.com/Casual-Shoes/Puma/Puma-Unisex-Black-&-Green-Limnos-Cat-Casual-Shoes/171398/buy,Rs. 1,699,men-casual-shoes,Casual Shoes,Puma,http://myntra.myntassets.com/images/style/properties/Puma-Unisex-Black-&-Green-Limnos-CAT-Casual-Shoes_108d70f7d703f5f267189b756e00b7a2_images_1080_1440_mini.jpg,Rs. 1,999,None,men,http://www.myntra.com/Casual-Shoes/Puma/Puma-Unisex-Black-&-Green-Limnos-Cat-Casual-Shoes/171398/buy,Sold byVector Ecommerce Pvt Ltd,None,None,['4', '5', '6', '7', '8', '9', '10', '11'],None,<ul class="mk-pdpv1-product-helper mk-cf"><li class="desc-main-title">Product Description</li><li class="desc-sub-title">Style Note</li><li class="desc-sub-text " itemprop="description"><p>A stylish shoe for casual outings, the Puma Limnos is replete with  features to enhance your style and help you walk with ease. Team this with jeans and tee on casual outings.</p></li><li class="desc-sub-title ">Product Details</li><li class="desc-sub-text"><p>Round toed, black casual shoes with green accents, eyelet detail, has central lace-ups and low top styling<br/>Canvas upper with stitched detail, overlays, foamstripe on one side and Puma jumping cat print on the other, reinforced heel collar with branding<br/>Soft tongue and padded footbed with branding<br/>Thick midsole with foxing at the forefoot<br/>Tough rubber outsole with branded grooves<br/>Warranty: 3 months against manufacturing defects</p></li><li class="desc-sub-title ">Material &amp; Care</li><li class="desc-sub-text "><p>Canvas<br/>Wipe with a dry, clean cloth to remove dust</p></li></ul>,26:02:2014,None
None,Puma Unisex Red & Black Limnos Cat Casual Shoes,http://www.myntra.com/Casual-Shoes/Puma/Puma-Unisex-Red-&-Black-Limnos-Cat-Casual-Shoes/171399/buy,Rs. 1,699,men-casual-shoes,Casual Shoes,Puma,http://myntra.myntassets.com/images/style/properties/Puma-Unisex-Red-&-Black-Limnos-CAT-Casual-Shoes_d21603eedb7fc9b31f2ac265a9e1feab_images_1080_1440_mini.jpg,Rs. 1,999,None,men,http://www.myntra.com/Casual-Shoes/Puma/Puma-Unisex-Red-&-Black-Limnos-Cat-Casual-Shoes/171399/buy,Sold byVector Ecommerce Pvt Ltd,None,None,['4', '5', '6', '7', '8', '9', '10', '11'],None,<ul class="mk-pdpv1-product-helper mk-cf"><li class="desc-main-title">Product Description</li><li class="desc-sub-title">Style Note</li><li class="desc-sub-text " itemprop="description"><p>A stylish shoe for casual outings, the Puma Limnos is replete with features to enhance your style and help you walk with ease. Team this with jeans and tee on casual outings.</p></li><li class="desc-sub-title ">Product Details</li><li class="desc-sub-text"><p>Round toed, red casual shoes with black accents, has eyelet detail, has central lace-ups and low top styling<br/>Canvas upper with stitched detail, overlays, foamstripe on one side and Puma jumping cat print on the other, reinforced heel collar with branding<br/>Soft tongue and padded footbed with branding<br/>Thick midsole with foxing at the forefoot<br/>Tough rubber outsole with branded grooves<br/>Warranty: 3 months against manufacturing defects</p></li><li class="desc-sub-title ">Material &amp; Care</li><li class="desc-sub-text "><p>Canvas<br/>Wipe with a dry, clean cloth to remove dust<br/>Click <a href="http://www.myntra.com/textile-care">here</a> for the perfect care products for shoes made of textile/fabric</p></li><li class="desc-sub-title">Size &amp; Fit</li><li class="desc-sub-text"><p><br/></p></li></ul>,26:02:2014,None
