None,Puma Men Black Villian S Casual Shoes,http://www.myntra.com/Casual-Shoes/Puma/Puma-Men-Black-Villian-S-Casual-Shoes/159145/buy,Rs. 3,144,men-casual-shoes,Casual Shoes,Puma,http://myntra.myntassets.com/images/style/properties/Puma-Men-Black-Villian-S-Casual-Shoes_696ef11da59b56e175b1860be429ba41_images_1080_1440_mini.jpg,Rs. 3,699,None,men,http://www.myntra.com/Casual-Shoes/Puma/Puma-Men-Black-Villian-S-Casual-Shoes/159145/buy,Sold byVector Ecommerce Pvt Ltd,None,None,['7', '8', '9', '10', '11', '12'],None,<ul class="mk-pdpv1-product-helper mk-cf"><li class="desc-main-title">Product Description</li><li class="desc-sub-title">Style Note</li><li class="desc-sub-text " itemprop="description"><p>The Villian S from Puma takes one massive, stylish, smooth step away from the ordinary. Its design cues pull from the worlds of cycling and skating. The outsole foxing tape wraps up the lateral  side while the upper enjoys a sporty mash-up of canvas and ripstop  nylon.</p></li><li class="desc-sub-title ">Product Details</li><li class="desc-sub-text"><p>Round toed, black casual shoes with yellow accents, central lace-ups and low top styling<br/>Canvas upper with paneled construction, reinforced heel collar, branding on the tongue, midfoot and heel collar<br/>Breathable EcoOrthoLite® sockliner for optimum fit and comfort, has branding<br/>Grippy rubber outsole, with foxing tape that wraps up the lateral side for a unique look<br/>Warranty: 3 months for manufacturing defects only</p></li><li class="desc-sub-title ">Material &amp; Care</li><li class="desc-sub-text "><p>Canvas<br/>Wipe with a clean, dry cloth when needed<br/>Click <a href="http://www.myntra.com/textile-care">here</a> for the perfect care products for shoes made of textile/fabric</p><p></p></li><li class="desc-sub-title">Size &amp; Fit</li><li class="desc-sub-text"><br/></li></ul>,26:02:2014,None
None,Puma Men Red Evospeed Low Sf Nm Casual Shoes,http://www.myntra.com/Casual-Shoes/Puma/Puma-Men-Red-Evospeed-Low-Sf-Nm-Casual-Shoes/148949/buy,Rs. 5,099,men-casual-shoes,Casual Shoes,Puma,http://myntra.myntassets.com/images/style/properties/Puma-Men-Red-evoSPEED-Low-SF-NM-Casual-Shoes_ead61a19d526963504afaae03af7d30a_images_1080_1440_mini.jpg,Rs. 5,999,None,men,http://www.myntra.com/Casual-Shoes/Puma/Puma-Men-Red-Evospeed-Low-Sf-Nm-Casual-Shoes/148949/buy,Sold byVector Ecommerce Pvt Ltd,None,None,['6', '7', '8', '9', '10', '11'],None,<ul class="mk-pdpv1-product-helper mk-cf"><li class="desc-main-title">Product Description</li><li class="desc-sub-title">Style Note</li><li class="desc-sub-text " itemprop="description"><p>Make a swanky style statement with this pair of ultra chic leather Evospeed Puma shoes. These have been designed combining the exclusive silhouette of the Puma Motorsports Replica range with the performance of pilot shoes. This elegant and minimalistic model focuses on a light weight, flexibility and great fit. Pair them with your tapered jeans and a black T-shirt for an edgy look.</p></li><li class="desc-sub-title ">Product Details</li><li class="desc-sub-text"><p>Round toed, low top shoes with asymmetrical lace ups<br/>Leather upper with synthetic leather trimmings, Ferrari team branding and formstrip on the sides, perforations and reinforced overlay at the heel collar<br/>Padded inner and cushioned footbed with branding<br/>EVA midsole for additional support<br/>Driver's rounded heel with branding on the heel<br/>Tough rubber outsole with branding and perforations for light weight feel<br/>Warranty: 3 months against manufacturing defects</p></li><li class="desc-sub-title ">Material &amp; Care</li><li class="desc-sub-text "><p>Leather, EVA and rubber<br/>Wipe with a clean, dry cloth to remove dust</p></li></ul>,26:02:2014,None
None,Puma Men White evoSPEED Sports Shoes,http://www.myntra.com/Casual-Shoes/Puma/Puma-Men-White-evoSPEED-Sports-Shoes/215861/buy,Rs. 5,099,men-casual-shoes,Casual Shoes,Puma,http://myntra.myntassets.com/images/style/properties/Puma-Men-White-evoSPEED-Sports-Shoes_e92068a13d07b583bb948ebd0b6d77df_images_1080_1440_mini.jpg,Rs. 5,999,None,men,http://www.myntra.com/Casual-Shoes/Puma/Puma-Men-White-evoSPEED-Sports-Shoes/215861/buy,Sold byVector Ecommerce Pvt Ltd,None,None,['7', '8', '9', '11'],None,<ul class="mk-pdpv1-product-helper mk-cf"><li class="desc-main-title">Product Description</li><li class="desc-sub-title">Style Note</li><li class="desc-sub-text " itemprop="description"><p>Puma excels in the stylish sports wear arena yet again. This pair of motorsport shoes is a must-have. It has added cushioning as well as a great design. It's best paired up with track pants and tees for a sporty looking morning jog or even a pair of jeans and polo neck tees for a neat, casual look!</p></li><li class="desc-sub-title ">Product Details</li><li class="desc-sub-text"><p>Round toed, white sports shoes with asymmetrical lace-ups and low top styling<br/>Synthetic upper with multiple branding, has stitched and overlay detail<br/>Reinforced overlay at the heel collar<br/>Cushioned footbed with branding<br/>Tough and textured, non-marking outsole with perforated detail, outsole extends at the back<br/>Engineered with light-fit flex technology<br/>Warranty: 3 months for manufacturing defect only</p></li><li class="desc-sub-title ">Material &amp; Care</li><li class="desc-sub-text "><p>Synthetic and leather<br/>Wipe with a clean, dry cloth when needed<br/>Click <a href="http://www.myntra.com/sports-synthetic-care">here</a> for the perfect care products for synthetic sports shoes</p></li></ul>,26:02:2014,None
None,Puma Men Black Amp Scramble XW Golf Shoes,http://www.myntra.com/Casual-Shoes/Puma/Puma-Men-Black-Amp-Scramble-XW-Golf-Shoes/110859/buy,Rs. 5,524,men-casual-shoes,Casual Shoes,Puma,http://myntra.myntassets.com/images/style/properties/Puma-Men-Black-Amp-Scramble-XW-Golf-Shoes_a6a3ab95b20e73135cd77b8a65364de9_images_1080_1440_mini.jpg,Rs. 6,499,None,men,http://www.myntra.com/Casual-Shoes/Puma/Puma-Men-Black-Amp-Scramble-XW-Golf-Shoes/110859/buy,Sold byVector Ecommerce Pvt Ltd,None,None,['7', '8', '9', '10', '11', '12'],None,<ul class="mk-pdpv1-product-helper mk-cf"><li class="desc-main-title">Product Description</li><li class="desc-sub-title">Style Note</li><li class="desc-sub-text " itemprop="description"><p>Packed with features that make sure you get the most out of your  sporting experience, these shoes from Puma are every golfers dream.  Offering maximum support and comfort, this style will become your go-to  pair.</p></li><li class="desc-sub-title ">Product Details</li><li class="desc-sub-text"><p>Black golf shoes with red accents<br/>Synthetic leather micro fibre upper, branding at outer forefoot, lace-up closure with tongue loop, padded tongue with branding, cat and formstripe overlay at midfoot with stitch detail, small branded panel above heel<br/>Reinforced heel collar, cushioned EverFoam inner, padded footbed<br/>Full length EVA midsole<br/>S2QuillTec spikeless outsole with branding and lugs for traction<br/>Warranty: 3 months for manufacturing defect only<br/><br/></p></li><li class="desc-sub-title ">Material &amp; Care</li><li class="desc-sub-text "><p>Synthetic leather<br/>Wipe with a clean dry cloth when needed</p></li></ul>,26:02:2014,None
None,Puma Men White Hyperazzo Ducati Sports Shoes,http://www.myntra.com/Casual-Shoes/Puma/Puma-Men-White-Hyperazzo-Ducati-Sports-Shoes/159204/buy,Rs. 5,949,men-casual-shoes,Casual Shoes,Puma,http://myntra.myntassets.com/images/style/properties/Puma-Men-White-Hyperazzo-Ducati-Sports-Shoes_174959c6fe44996850fbf5b7d1dfa9f5_images_1080_1440_mini.jpg,Rs. 6,999,None,men,http://www.myntra.com/Casual-Shoes/Puma/Puma-Men-White-Hyperazzo-Ducati-Sports-Shoes/159204/buy,Sold byVector Ecommerce Pvt Ltd,None,None,['6', '7', '8', '9', '10', '11', '12'],None,<ul class="mk-pdpv1-product-helper mk-cf"><li class="desc-main-title">Product Description</li><li class="desc-sub-title">Style Note</li><li class="desc-sub-text " itemprop="description"><p>This Ducati shoe from Puma is a great pick for the racer guy in you. Featuring a fresh in a sophisticated and modern look, this pair works well as an everyday sneaker too.</p></li><li class="desc-sub-title ">Product Details</li><li class="desc-sub-text"><p>Round toed, white shoes, has central lace-ups with low top styling<br/><span style="font-style: normal; font-weight: normal;">Synthetic upper with stitched and seamless overlays, multiple branding, mesh inlay at the sides and reinforced heel collar<br/>Soft, padded tongue and inner, ecoOrthoLite footbed with branding at the heel<br/> </span><span style="font-style: normal; font-weight: normal;">Rubber outsole with textured grooves and branding<br/> Warranty: 3 months against manufacturing defect only</span></p></li><li class="desc-sub-title ">Material &amp; Care</li><li class="desc-sub-text "><p>Synthetic leather<br/> Wipe with a clean, dry cloth when needed<br/>Click <a href="http://www.myntra.com/sports-synthetic-care">here</a> for the perfect care products for synthetic sports shoes</p><p></p></li><li class="desc-sub-title">Size &amp; Fit</li><li class="desc-sub-text"><br/></li></ul>,26:02:2014,None
None,Puma Men Black G. Vilas Urban Statement Casual Shoes,http://www.myntra.com/Casual-Shoes/Puma/Puma-Men-Black-G.-Vilas-Urban-Statement-Casual-Shoes/198142/buy,Rs. 4,249,men-casual-shoes,Casual Shoes,Puma,http://myntra.myntassets.com/images/style/properties/Puma-Men-Black-G-Vilas-Urban-Statement-Casual-Shoes_cbd346a2b9ec0e0c6d87c13e15e90bd8_images_1080_1440_mini.jpg,Rs. 4,999,None,men,http://www.myntra.com/Casual-Shoes/Puma/Puma-Men-Black-G.-Vilas-Urban-Statement-Casual-Shoes/198142/buy,Sold byVector Ecommerce Pvt Ltd,None,None,['6', '7', '8', '9', '10', '11', '12'],None,<ul class="mk-pdpv1-product-helper mk-cf"><li class="desc-main-title">Product Description</li><li class="desc-sub-title">Style Note</li><li class="desc-sub-text " itemprop="description"><p>From the Puma archive in 1982, this shoe is one of the cornerstones of their past and was worn by G. Vilas during his successful career. This take on the tennis classic features urban-inspired materials. We recommend you wear them with jeans and sporty tee to lend a fashionable edge to your look.</p></li><li class="desc-sub-title ">Product Details</li><li class="desc-sub-text"><p>Round toed, black casual shoes with contrast central lace-ups and low top styling<br/>Leather upper with overlays and stitched detail, has perforated detail, brand tag at the midfoot and reinforced heel collar with branding<br/>Soft tongue and inner, branding on the tongue<br/>Cushioned, ecoOrtholite footbed for prolonged comfort, branding at the heel<br/>Tough and textured outsole with patterned grooves and pivot point at the forefoot<br/>Warranty: 3 months for manufacturing defects only</p></li><li class="desc-sub-title ">Material &amp; Care</li><li class="desc-sub-text "><p>Leather<br/>Wipe with a clean, dry cloth when needed<br/>Click <a href="http://www.myntra.com/black-smooth-leather-care">here</a> for the perfect care products for black leather shoes</p></li></ul>,26:02:2014,None
None,Puma Men Grey Archive Lite Lo Ripstop Casual Shoes,http://www.myntra.com/Casual-Shoes/Puma/Puma-Men-Grey-Archive-Lite-Lo-Ripstop-Casual-Shoes/162131/buy,Rs. 3,994,men-casual-shoes,Casual Shoes,Puma,http://myntra.myntassets.com/images/style/properties/Puma-Men-Grey-Archive-Lite-Lo-Ripstop-Casual-Shoes_1185dbc43510d4405c5a6d0448cf8bd4_images_1080_1440_mini.jpg,Rs. 4,699,None,men,http://www.myntra.com/Casual-Shoes/Puma/Puma-Men-Grey-Archive-Lite-Lo-Ripstop-Casual-Shoes/162131/buy,Sold byVector Ecommerce Pvt Ltd,None,None,['6', '7', '8', '9', '10', '11', '12'],None,<ul class="mk-pdpv1-product-helper mk-cf"><li class="desc-main-title">Product Description</li><li class="desc-sub-title">Style Note</li><li class="desc-sub-text " itemprop="description"><p>Get yourself ready for some fun with these Puma shoes. Soft collar, lightweight construct and EcoOrthoLite® footbed offer all day  comfort.</p></li><li class="desc-sub-title ">Product Details</li><li class="desc-sub-text"><p>Round toed, grey casual shoes with orange and white accents, has central lace-ups and low top styling<br/>Synthetic upper with stitched detail, white formstripe on both the sides and reinforced heel collar, branding at the midfoot and heel collar<br/>Soft tongue and inner, branding on the tongue<br/>Cushioned EcoOrthoLite® footbed with branding at the heel<br/>Thick midsole with textured foxing<br/>Tough rubber outsole with branding and patterned grooves<br/>Warranty: 3 months against manufacturing defects</p></li><li class="desc-sub-title ">Material &amp; Care</li><li class="desc-sub-text "><p>Synthetic<br/>Wipe with a clean, dry cloth to keep clean<br/>Click <a href="http://www.myntra.com/synthetic-care">here</a> for the perfect care products for synthetic shoes</p></li><li class="desc-sub-title">Size &amp; Fit</li><li class="desc-sub-text"><br/></li></ul>,26:02:2014,None
None,Puma Men Black Pooler Mini Casual Shoes,http://www.myntra.com/Casual-Shoes/Puma/Puma-Men-Black-Pooler-Mini-Casual-Shoes/213489/buy,Rs. 6,799,men-casual-shoes,Casual Shoes,Puma,http://myntra.myntassets.com/images/style/properties/Puma-Men-Black-Pooler-Mini-Sports-Shoes_ed2edb462d0e92915ba36fbf58db078d_images_1080_1440_mini.jpg,Rs. 7,999,None,men,http://www.myntra.com/Casual-Shoes/Puma/Puma-Men-Black-Pooler-Mini-Casual-Shoes/213489/buy,Sold byVector Ecommerce Pvt Ltd,None,None,['6', '7', '8', '9', '10', '11', '12'],None,<ul class="mk-pdpv1-product-helper mk-cf"><li class="desc-main-title">Product Description</li><li class="desc-sub-title">Style Note</li><li class="desc-sub-text " itemprop="description"><p>This pair of casual shoes from Puma, with its sleek design and materials provide comfort and boost your style quotient instantly. Team it with denims and a tee to make a style statement.</p></li><li class="desc-sub-title ">Product Details</li><li class="desc-sub-text"><p>Round toed, black casual shoes with central lace-ups and low top styling<br/>Suede upper with overlays and stitched detail, has multiple branding, perforated detail and reinforced heel collar<br/>Soft tongue and inner, branding on the tongue<br/>Cushioned footbed with branding at the heel<br/>Tough and textured outsole with grooves and branding<br/>Warranty: 3 months for manufacturing defects only</p></li><li class="desc-sub-title ">Material &amp; Care</li><li class="desc-sub-text "><p>Suede<br/>Wipe with a clean, dry cloth when needed<br/>Click <a href="http://www.myntra.com/black-suede-care">here</a> for the perfect care products for black suede shoes</p></li></ul>,26:02:2014,None
None,Puma Men Grey & White Future Slipstream Lite 2 Ltr Casual Shoes,http://www.myntra.com/Casual-Shoes/Puma/Puma-Men-Grey-&-White-Future-Slipstream-Lite-2-Ltr-Casual-Shoes/244950/buy,Rs. 5,999,men-casual-shoes,Casual Shoes,Puma,http://myntra.myntassets.com/images/style/properties/Puma-Men-Grey-&-White-Future-Slipstream-Lite-2-Ltr-Casual-Shoes_01d2ac1f0e51b4e07be265fa10d361d3_images_1080_1440_mini.jpg,None,None,men,http://www.myntra.com/Casual-Shoes/Puma/Puma-Men-Grey-&-White-Future-Slipstream-Lite-2-Ltr-Casual-Shoes/244950/buy,Sold byVector Ecommerce Pvt Ltd,None,None,['6', '7', '8', '9', '10', '11'],None,<ul class="mk-pdpv1-product-helper mk-cf"><li class="desc-main-title">Product Description</li><li class="desc-sub-title">Style Note</li><li class="desc-sub-text " itemprop="description"><p>This trendy pair of shoes from Puma is crafted with perfection to make you look absolutely fabulous. Team it with matching sports accessories for a cool look.</p></li><li class="desc-sub-title ">Product Details</li><li class="desc-sub-text"><p>Round toed, grey and white casual shoes with black and yellow accents, has central lace-ups and mid top styling<br/>Leather upper with overlays and stitched detail, has perforations at the forefoot and midfoot region, multiple branding and reinforced heel collar with mesh and pull loop detail<br/>Padded and mesh tongue and inner, soft and padded footbed with branding at the heel<br/>EVA midsole for lightweight cushioning, has formstrip at medial and lateral sides<br/>Tough and textured rubber outsole with patterned grooves<br/>Warranty: 3 months against manufacturing defects only</p></li><li class="desc-sub-title ">Material &amp; Care</li><li class="desc-sub-text "><p>Leather<br/>Wipe with a clean, dry cloth when needed<br/>Click <a href="http://www.myntra.com/other-smooth-leather-care">here</a> for the perfect care products for leather shoes</p></li></ul>,26:02:2014,None
None,Puma Men Navy BMW Motorsport Nyter 2 Casual Shoes,http://www.myntra.com/Casual-Shoes/Puma/Puma-Men-Navy-BMW-Motorsport-Nyter-2-Casual-Shoes/244889/buy,Rs. 6,499,men-casual-shoes,Casual Shoes,Puma,http://myntra.myntassets.com/images/style/properties/Puma-Men-Navy-BMW-Motorsport-Nyter-2-Casual-Shoes_3ff9349da5f034e1363eb162de8afbc5_images_1080_1440_mini.jpg,None,None,men,http://www.myntra.com/Casual-Shoes/Puma/Puma-Men-Navy-BMW-Motorsport-Nyter-2-Casual-Shoes/244889/buy,Sold byVector Ecommerce Pvt Ltd,None,None,['6', '7', '8', '9', '10', '11'],None,<ul class="mk-pdpv1-product-helper mk-cf"><li class="desc-main-title">Product Description</li><li class="desc-sub-title">Style Note</li><li class="desc-sub-text " itemprop="description"><p>This pair of casual shoes from Puma is a great pick for the racer guy in you. Team this pair with your jeans and tee to sport a cool image.</p></li><li class="desc-sub-title ">Product Details</li><li class="desc-sub-text"><p>Round toed, navy blue casual shoes with white and red accents, has Velcro closures and low top styling<br/>Synthetic upper with overlays and stitched detail, has multiple branding, formstrip on both the sides, perforated detail at the backfoot, reinforced heel collar<br/>Soft tongue and inner<br/>Cushioned, ecoOrtholite footbed with branding at the heel<br/>Tough and textured outsole with patterned grooves and branding<br/>Warranty: 3 months against manufacturing defect only</p></li><li class="desc-sub-title ">Material &amp; Care</li><li class="desc-sub-text "><p>Synthetic<br/>Wipe with a dry, clean cloth when needed<br/>Click <a href="http://www.myntra.com/synthetic-care">here</a> for the perfect care products for synthetic shoes</p></li></ul>,26:02:2014,None
None,Puma Men White Xelerate Low Ducati NM Motorsports Shoes,http://www.myntra.com/Casual-Shoes/Puma/Puma-Men-White-Xelerate-Low-Ducati-NM-Motorsports-Shoes/149772/buy,Rs. 4,249,men-casual-shoes,Casual Shoes,Puma,http://myntra.myntassets.com/images/style/properties/Puma-Men-White-Xelerate-Low-Ducati-NM-Motorsports-Shoes_18eb79dbe2c3855cd43a4a8ad9b2d7e4_images_1080_1440_mini.jpg,Rs. 4,999,None,men,http://www.myntra.com/Casual-Shoes/Puma/Puma-Men-White-Xelerate-Low-Ducati-NM-Motorsports-Shoes/149772/buy,Sold byVector Ecommerce Pvt Ltd,None,None,['6', '7', '8', '9', '10', '11', '12'],None,<ul class="mk-pdpv1-product-helper mk-cf"><li class="desc-main-title">Product Description</li><li class="desc-sub-title">Style Note</li><li class="desc-sub-text " itemprop="description"><p>This Xelerate Ducati shoe from Puma is a great pick for the racer guy in you. Featuring a fresh in a sophisticated and modern look, this pair works well as an everyday sneaker too.</p></li><li class="desc-sub-title ">Product Details</li><li class="desc-sub-text"><p>Round toed, white shoes with red accents, has central lace-ups with low top styling<br/><span style="font-style: normal; font-weight: normal;">Synthetic upper with overlays and stitched details, reinforced heel collar, has Ducati branding on the side and heel collar<br/>Soft, padded tongue with branding, has a padded panel inside at the heel collar<br/>ecoOrthoLite footbed with branding at the heel<br/> </span><span style="font-style: normal; font-weight: normal;">Rubber outsole with textured grooves and branding<br/> Warranty: 3 months against manufacturing defect only</span></p></li><li class="desc-sub-title ">Material &amp; Care</li><li class="desc-sub-text "><p>Synthetic leather<br/> Wipe with a clean, dry cloth when needed</p></li></ul>,26:02:2014,None
None,Puma Men Cream Toned Limnos Bird Casual Shoes,http://www.myntra.com/Casual-Shoes/Puma/Puma-Men-Cream-Toned-Limnos-Bird-Casual-Shoes/197550/buy,Rs. 2,124,men-casual-shoes,Casual Shoes,Puma,http://myntra.myntassets.com/images/style/properties/Puma-Men-Casual-Shoes_cef7f4541b614bc4802cc16edfc11e65_images_1080_1440_mini.jpg,Rs. 2,499,None,men,http://www.myntra.com/Casual-Shoes/Puma/Puma-Men-Cream-Toned-Limnos-Bird-Casual-Shoes/197550/buy,Sold byVector Ecommerce Pvt Ltd,None,None,['4', '5', '6', '7', '8', '9', '10', '11'],None,<ul class="mk-pdpv1-product-helper mk-cf"><li class="desc-main-title">Product Description</li><li class="desc-sub-title">Style Note</li><li class="desc-sub-text " itemprop="description"><p>A stylish shoe for casual outings, this Puma shoe is replete with features to enhance your style and help you walk with ease. We love the quirky styling and printed upper, which add to its appeal. Team this with jeans and tee on casual outings.</p></li><li class="desc-sub-title ">Product Details</li><li class="desc-sub-text"><p>Round toed, cream toned casual shoes with central lace-ups and low top styling<br/>Canvas upper with printed, stitched and overlay detail, reinforced at the heel collar<br/>Branding on the tongue, soft and padded footbed with branding<br/>Foxing along the midsole at forefoot<br/>Tough outsole with branding<br/>Warranty: 3 months for manufacturing defects only</p></li><li class="desc-sub-title ">Material &amp; Care</li><li class="desc-sub-text "><p>Canvas<br/>Wipe with a clean, dry cloth when needed<br/>Click <a href="http://www.myntra.com/textile-care">here</a> for the perfect care products for shoes made of textile/fabric</p></li></ul>,26:02:2014,None
None,Puma Men Black Future Cat M1 SF NM Leather Casual Shoes,http://www.myntra.com/Casual-Shoes/Puma/Puma-Men-Black-Future-Cat-M1-SF-NM-Leather-Casual-Shoes/244909/buy,Rs. 6,699,men-casual-shoes,Casual Shoes,Puma,http://myntra.myntassets.com/images/style/properties/Puma-Men-Black-Future-Cat-M1-SF-NM-Leather-Casual-Shoes_a7456a4a415b4a1958fbab4e22ba8f0d_images_1080_1440_mini.jpg,None,None,men,http://www.myntra.com/Casual-Shoes/Puma/Puma-Men-Black-Future-Cat-M1-SF-NM-Leather-Casual-Shoes/244909/buy,Sold byVector Ecommerce Pvt Ltd,None,None,['6', '7', '8', '9', '10', '11'],None,<ul class="mk-pdpv1-product-helper mk-cf"><li class="desc-main-title">Product Description</li><li class="desc-sub-title">Style Note</li><li class="desc-sub-text " itemprop="description"><p>Stylish shoes from the house of Puma for those who want a perfect blend of fashion, style and comfort. It is versatile enough to be paired with any casuals.</p></li><li class="desc-sub-title ">Product Details</li><li class="desc-sub-text"><p>Round toed, black casual shoes with red accents, has asymmetrical lace-ups and low top styling<br/>Leather upper with stitched detail, multiple branding, silver toned detail along the mouth and reinforced heel collar<br/>Padded tongue and inner, branding on the tongue<br/>EcoOrthoLite footbed for optimum fit and comfort, branding at the heel<br/>Ferrari shield at the side<br/>Tough and textured outsole with patterned grooves, outsole extends to the heel collar<br/>Warranty: 3 months for manufacturing defect only</p></li><li class="desc-sub-title ">Material &amp; Care</li><li class="desc-sub-text "><p>Leather<br/>Wipe with a clean, dry cloth when needed<br/>Click <a href="http://www.myntra.com/black-smooth-leather-care">here</a> for the perfect care products for black leather shoes</p></li></ul>,26:02:2014,None
None,Puma Men Grey Yacht Cvs Boat Shoes,http://www.myntra.com/Casual-Shoes/Puma/Puma-Men-Grey-Yacht-Cvs-Boat-Shoes/244913/buy,Rs. 2,999,men-casual-shoes,Casual Shoes,Puma,http://myntra.myntassets.com/images/style/properties/Puma-Men-Grey-Yacht-Cvs-Boat-Shoes_3680157cfff1dd1739138680ade22602_images_1080_1440_mini.jpg,None,None,men,http://www.myntra.com/Casual-Shoes/Puma/Puma-Men-Grey-Yacht-Cvs-Boat-Shoes/244913/buy,Sold byVector Ecommerce Pvt Ltd,None,None,['6', '7', '8', '9', '10', '11'],None,<ul class="mk-pdpv1-product-helper mk-cf"><li class="desc-main-title">Product Description</li><li class="desc-sub-title">Style Note</li><li class="desc-sub-text " itemprop="description"><p>This trendy pair of shoes from Puma is crafted with perfection to make you look absolutely fabulous. Team it with matching sports accessories for a cool look.</p></li><li class="desc-sub-title ">Product Details</li><li class="desc-sub-text"><p>Round toed, grey boat shoes with white accents, has central lace-ups and low top styling<br/>Textile upper with overlays and contrast stitched detail, has lace detailing along the mouth, multiple branding and reinforced heel collar<br/>Soft and padded footbed with branding at the heel<br/>Tough and textured outsole with patterned grooves<br/>Warranty: 3 months against manufacturing defects only<br/>Comes with an extra pair of laces</p></li><li class="desc-sub-title ">Material &amp; Care</li><li class="desc-sub-text "><p>Textile<br/>Wipe with a clean, dry cloth when needed<br/>Click <a href="http://www.myntra.com/textile-care">here</a> for the perfect care products for shoes made of textile/fabric</p></li></ul>,26:02:2014,None
