None,Samsonite Men Brown Panarea Sandals,http://www.myntra.com/Flip-Flops/Samsonite/Samsonite-Men-Brown-Panarea-Sandals/100262/buy,Rs. 1,862,sale-men-footwear,Footwear,Samsonite,http://myntra.myntassets.com/images/style/properties/Samsonite-Men-Slippers_9a0edbbd1a66e5f6079371d733e91adb_images_1080_1440.jpg,Rs. 2,190,None,sale,http://www.myntra.com/Flip-Flops/Samsonite/Samsonite-Men-Brown-Panarea-Sandals/100262/buy,Sold byVector Ecommerce Pvt Ltd,None,None,['6', '7', '8', '9', '10'],None,<ul class="mk-pdpv1-product-helper mk-cf"><li class="desc-main-title">Product Description</li><li class="desc-sub-title">Style Note</li><li class="desc-sub-text " itemprop="description"><p>These sandals from Samsonite ensure that your casual wear has a classy finish to it with its leather upper and stylish design details.</p></li><li class="desc-sub-title ">Product Details</li><li class="desc-sub-text"><p>Open toed sandals with a brown thong style upper with stitch and thread detailing<br/>Tough brown sole with embossed branding at the heel region<br/>Tough rubber sole that's upraised at the heel with deep grooves all over<br/>Warranty: 3 months</p></li><li class="desc-sub-title ">Material &amp; Care</li><li class="desc-sub-text "><p>Leather<br/>Use a branded leather conditioner to clean this product</p></li></ul>,26:02:2014,None
None,Samsonite Men Black Leather Casual Shoes,http://www.myntra.com/Casual-Shoes/Samsonite/Samsonite-Men-Black-Leather-Casual-Shoes/203983/buy,Rs. 2,712,sale-men-footwear,Footwear,Samsonite,http://myntra.myntassets.com/images/style/properties/Samsonite-Men-Black-&-Grey-Leather-Casual-Shoes_106b4a66a5280bc199c45ff75501706d_images_1080_1440_mini.jpg,Rs. 3,190,None,sale,http://www.myntra.com/Casual-Shoes/Samsonite/Samsonite-Men-Black-Leather-Casual-Shoes/203983/buy,Sold byVector Ecommerce Pvt Ltd,None,None,['6', '7', '8', '9', '10'],None,<ul class="mk-pdpv1-product-helper mk-cf"><li class="desc-main-title">Product Description</li><li class="desc-sub-title">Style Note</li><li class="desc-sub-text " itemprop="description"><p>Samsonite never compromises on the design and comfort of their shoes. Smart and simple in design, this pair of casual shoes is best worn with denims and a checked shirt.</p></li><li class="desc-sub-title ">Product Details</li><li class="desc-sub-text"><p>Round toed, black casual shoes with central lace-ups and low top styling<br/>Leather upper with stitched suede overlays, reinforced heel collar<br/>Soft tongue with branding and cushioned footbed with branding at the heel<br/>Tough rubber outsole with patterned grooves, has foxing<br/>Warranty: 3 months from the date of purchase against manufacturing defects</p></li><li class="desc-sub-title ">Material &amp; Care</li><li class="desc-sub-text "><p>Leather<br/>Wipe with a clean, dry cloth when needed<br/>Click <a href="http://www.myntra.com/black-smooth-leather-care">here</a> for the perfect care products for black leather shoes</p></li></ul>,26:02:2014,None
None,Samsonite Men Black Leather Semi-Formal Shoes,http://www.myntra.com/Formal-Shoes/Samsonite/Samsonite-Men-Black-Leather-Semi-Formal-Shoes/204013/buy,Rs. 4,412,sale-men-footwear,Footwear,Samsonite,http://myntra.myntassets.com/images/style/properties/Samsonite-Men-Black-Leather-Semi-Formal-Shoes_f950ff17e0d4e22578fa5f690b83de5b_images_1080_1440_mini.JPG,Rs. 5,190,None,sale,http://www.myntra.com/Formal-Shoes/Samsonite/Samsonite-Men-Black-Leather-Semi-Formal-Shoes/204013/buy,Sold byVector Ecommerce Pvt Ltd,None,None,['6', '7', '8', '9', '10'],None,<ul class="mk-pdpv1-product-helper mk-cf"><li class="desc-main-title">Product Description</li><li class="desc-sub-title">Style Note</li><li class="desc-sub-text " itemprop="description"><p>Samsonite is synonymous with high quality standards and use of premium materials. This pair of semi-formal shoes from the brand definitely lives up to it. Team it with a crisp shirt and slim-fit trousers and make a perfect impression at work.</p></li><li class="desc-sub-title ">Product Details</li><li class="desc-sub-text"><p>Round toed, black semi-formal shoes with slip-on and low top styling<br/>Leather upper with textured and stitched detail, elasticated gussets near the mouth, metallic branding on one side  at mid foot<br/>Soft and padded footbed with branding<br/>Tough outsole with stitched detail and has a stacked heel<br/>Warranty:  3 months from the date of purchase, against manufacturing defects</p></li><li class="desc-sub-title ">Material &amp; Care</li><li class="desc-sub-text "><p>Leather<br/>Use a branded leather conditioner to clean the product<br/>Click <a href="http://www.myntra.com/black-smooth-leather-care">here</a> for the perfect care products for black leather shoes</p></li></ul>,26:02:2014,None
None,Samsonite Men Black Leather Formal Shoes,http://www.myntra.com/Formal-Shoes/Samsonite/Samsonite-Men-Black-Leather-Formal-Shoes/203787/buy,Rs. 5,007,sale-men-footwear,Footwear,Samsonite,http://myntra.myntassets.com/images/style/properties/Samsonite-Men-Black-Leather-Formal-Shoes_5d464c399b7ba45e083b3115b0a942a9_images_1080_1440.jpg,Rs. 5,890,None,sale,http://www.myntra.com/Formal-Shoes/Samsonite/Samsonite-Men-Black-Leather-Formal-Shoes/203787/buy,Sold byVector Ecommerce Pvt Ltd,None,None,['6', '7', '8', '9', '10'],None,<ul class="mk-pdpv1-product-helper mk-cf"><li class="desc-main-title">Product Description</li><li class="desc-sub-title">Style Note</li><li class="desc-sub-text " itemprop="description"><p>Samsonite is synonymous with high quality standards and use of premium materials. This pair of semi-formal shoes from the brand definitely lives up to it. Team it with a crisp shirt and slim-fit trousers and make a perfect impression at work.</p></li><li class="desc-sub-title ">Product Details</li><li class="desc-sub-text"><p>Pointed toe, black formal shoes with central lace-ups and low top styling<br/>Leather upper with stitched overlays, branding on the midfoot, reinforced heel collar<br/>Soft tongue with branding and cushioned footbed with branding at the heel<br/>Tough outsole, with patterned grooves and has a stacked heel<br/>Warranty: 3 months from the date of purchase against manufacturing defects</p></li><li class="desc-sub-title ">Material &amp; Care</li><li class="desc-sub-text "><p>Leather<br/>Use a branded leather conditioner to clean the product<br/>Click <a href="http://www.myntra.com/black-smooth-leather-care">here</a> for the perfect care products for black leather shoes</p></li></ul>,26:02:2014,None
None,Samsonite Men Black Leather Loafers,http://www.myntra.com/Casual-Shoes/Samsonite/Samsonite-Men-Black-Leather-Loafers/204016/buy,Rs. 2,233,sale-men-footwear,Footwear,Samsonite,http://myntra.myntassets.com/images/style/properties/Samsonite-Men-Black-Leather-Loafers_b304c8ae8c77180b4c30cc41d88ae798_images_1080_1440_mini.jpg,Rs. 3,190,None,sale,http://www.myntra.com/Casual-Shoes/Samsonite/Samsonite-Men-Black-Leather-Loafers/204016/buy,Sold byVector Ecommerce Pvt Ltd,None,None,['6', '7', '8', '9', '10'],None,<ul class="mk-pdpv1-product-helper mk-cf"><li class="desc-main-title">Product Description</li><li class="desc-sub-title">Style Note</li><li class="desc-sub-text " itemprop="description"><p>Samsonite is synonymous with high quality standards and use of premium materials. These slip-on shoes from the brand definitely lives up to it. Pair them with crisp formal shirts and slim-fit trousers and make a perfect impression at your board meetings and interviews.</p></li><li class="desc-sub-title ">Product Details</li><li class="desc-sub-text"><p>Square toed, black loafers with slip-on and low top styling<br/>Leather upper with textured and stitched detail<br/>Reinforced overlay at the heel collar<br/>Soft and padded footbed with branding<br/>Tough outsole with patterned grooves<br/>Warranty:  3 months from the date of purchase, against manufacturing defects</p></li><li class="desc-sub-title ">Material &amp; Care</li><li class="desc-sub-text "><p>Leather<br/>Wipe with a clean, dry cloth when needed<br/>Click <a href="http://www.myntra.com/black-smooth-leather-care">here</a> for the perfect care products for black leather shoes</p></li></ul>,26:02:2014,None
None,Samsonite Men Black Panarea Sandals,http://www.myntra.com/Flip-Flops/Samsonite/Samsonite-Men-Black-Panarea-Sandals/100263/buy,Rs. 1,862,sale-men-footwear,Footwear,Samsonite,http://myntra.myntassets.com/images/style/properties/Samsonite-Men-Slippers_b326135aacaf376d6abd162f6079a7c1_images_1080_1440_mini.jpg,Rs. 2,190,None,sale,http://www.myntra.com/Flip-Flops/Samsonite/Samsonite-Men-Black-Panarea-Sandals/100263/buy,Sold byVector Ecommerce Pvt Ltd,None,None,['6', '7', '8', '9', '10'],None,<ul class="mk-pdpv1-product-helper mk-cf"><li class="desc-main-title">Product Description</li><li class="desc-sub-title">Style Note</li><li class="desc-sub-text " itemprop="description"><p>Casual sandals of leather from Samsonite to ensure that even your casual wear has a classy finish to it.</p></li><li class="desc-sub-title ">Product Details</li><li class="desc-sub-text"><p>Black leather sandals<br/>Forefoot strap with a toe separator<br/>Dual straps across the midfoot region<br/>Smooth soft footbed with branding at the heel area<br/>Tough textured outsole with grooves for traction<br/>Warranty: 3 months against manufacturing defects</p></li><li class="desc-sub-title ">Material &amp; Care</li><li class="desc-sub-text "><p>Leather<br/>Use a professional leather conditioner to clean this product</p></li></ul>,26:02:2014,None
None,Samsonite Men Greyish Blue Casual Shoes,http://www.myntra.com/Casual-Shoes/Samsonite/Samsonite-Men-Greyish-Blue-Casual-Shoes/203781/buy,Rs. 2,117,sale-men-footwear,Footwear,Samsonite,http://myntra.myntassets.com/images/style/properties/Samsonite-Men-Grey-Casual-Shoes_82cdbc0ae487ca0fb4bce44e7ae16336_images_1080_1440_mini.jpg,Rs. 2,490,None,sale,http://www.myntra.com/Casual-Shoes/Samsonite/Samsonite-Men-Greyish-Blue-Casual-Shoes/203781/buy,Sold byVector Ecommerce Pvt Ltd,None,None,['6', '7', '8', '9', '10'],None,<ul class="mk-pdpv1-product-helper mk-cf"><li class="desc-main-title">Product Description</li><li class="desc-sub-title">Style Note</li><li class="desc-sub-text " itemprop="description"><p>Make a style statement that conforms to the latest fashion trends while still managing to stand out. This pair from Samsonite fills that gap in your footwear choices. We recommend that you team it with chinos, a mandarin collar shirt and add a waistcoat to complete the look.</p></li><li class="desc-sub-title ">Product Details</li><li class="desc-sub-text"><p>Round toed, greyish blue casual shoes with central lace-ups and low top styling<br/>Canvas upper with stitched detail along the seams of the shoe box, and reinforced heel collar<br/>Padded inner and cushioned footbed with branding at the heel<br/>Tough rubber outsole with patterned grooves and a stacked heel<br/>Warranty: 3 months against manufacturing defects</p></li><li class="desc-sub-title ">Material &amp; Care</li><li class="desc-sub-text "><p>Canvas<br/>Wipe with a clean, dry cloth when needed<br/>Click <a href="http://www.myntra.com/textile-care">here</a> for the perfect care products for shoes made of textile/fabric</p></li></ul>,26:02:2014,None
None,Samsonite Men Black London Formal Shoes,http://www.myntra.com/Formal-Shoes/Samsonite/Samsonite-Men-Black-London-Formal-Shoes/100258/buy,Rs. 4,242,sale-men-footwear,Footwear,Samsonite,http://myntra.myntassets.com/images/style/properties/Samsonite-Men-Formal-Shoes_258774603a300402429dc24f88870cd1_images_1080_1440_mini.jpg,Rs. 4,990,None,sale,http://www.myntra.com/Formal-Shoes/Samsonite/Samsonite-Men-Black-London-Formal-Shoes/100258/buy,Sold byVector Ecommerce Pvt Ltd,None,None,['UK6', 'UK7', 'UK8', 'UK9', 'UK10'],None,<ul class="mk-pdpv1-product-helper mk-cf"><li class="desc-main-title">Product Description</li><li class="desc-sub-title">Style Note</li><li class="desc-sub-text " itemprop="description"><p>Stylish formal shoes that are easy to slip on from Samsonite. They are the perfect finish to your daily work wear. We recommend you match your shoes with your belt or tie to lend it a fashionable finish.</p></li><li class="desc-sub-title ">Product Details</li><li class="desc-sub-text"><p>Black formal slip on shoes<br/>Branding at the midfoot region<br/>Top stitch detail along the stitch lines<br/>Reinforced overlay at the heel collar<br/>Soft and padded footbed with branding at the heel region<br/>Tough smooth and patterned outsole that is textured at the forefoot and heel area<br/>Slightly upraised at the heel by about 1 inch</p></li><li class="desc-sub-title ">Material &amp; Care</li><li class="desc-sub-text "><p>Leather<br/>Use a professional leather conditioner to clean this product</p></li></ul>,26:02:2014,None
None,Samsonite Men Brown Formal Shoes,http://www.myntra.com/Formal-Shoes/Samsonite/Samsonite-Men-Brown-Formal-Shoes/154335/buy,Rs. 4,242,sale-men-footwear,Footwear,Samsonite,http://myntra.myntassets.com/images/style/properties/Samsonite-Men-Formal-Shoes_23405c36055644bb5a3c7ee1e3453c4a_images_1080_1440_mini.jpg,Rs. 4,990,None,sale,http://www.myntra.com/Formal-Shoes/Samsonite/Samsonite-Men-Brown-Formal-Shoes/154335/buy,Sold byVector Ecommerce Pvt Ltd,None,None,['6', '7', '8', '9', '10'],None,<ul class="mk-pdpv1-product-helper mk-cf"><li class="desc-main-title">Product Description</li><li class="desc-sub-title">Style Note</li><li class="desc-sub-text " itemprop="description"><p>Samsonite is synonymous with high quality standards and the use of premium materials. These formal shoes definitely live up to the brand's name. Pair them with crisp formal shirts and slim-fit trousers to make the perfect impression at your board meetings and interviews.</p></li><li class="desc-sub-title ">Product Details</li><li class="desc-sub-text"><p>Square toed, brown formal shoes with central lace-ups and low top styling<br/>Smooth leather upper, stitched detail along the toe box seam, branding at the lace-up panel<br/>Reinforced heel collar, cushioned footbed with branding at the heel<br/>Durable outsole with grooves and an upraised heel<br/>Warranty: 3 months against manufacturing defects</p></li><li class="desc-sub-title ">Material &amp; Care</li><li class="desc-sub-text "><p>Leather<br/>Use a branded leather conditioner to clean<br/>Click <a href="http://www.myntra.com/brown-smooth-leather-care">here</a> for the perfect care products for brown leather shoes</p></li><li class="desc-sub-title">Size &amp; Fit</li><li class="desc-sub-text"><br/></li></ul>,26:02:2014,None
None,Samsonite Men Black Leather Formal Shoes,http://www.myntra.com/Formal-Shoes/Samsonite/Samsonite-Men-Black-Leather-Formal-Shoes/203797/buy,Rs. 4,157,sale-men-footwear,Footwear,Samsonite,http://myntra.myntassets.com/images/style/properties/Samsonite-Men-Formal-Shoes_7b93ec03250b154c24871bd4a23c225c_images_1080_1440_mini.jpg,Rs. 4,890,None,sale,http://www.myntra.com/Formal-Shoes/Samsonite/Samsonite-Men-Black-Leather-Formal-Shoes/203797/buy,Sold byVector Ecommerce Pvt Ltd,None,None,['6', '7', '8', '9', '10'],None,<ul class="mk-pdpv1-product-helper mk-cf"><li class="desc-main-title">Product Description</li><li class="desc-sub-title">Style Note</li><li class="desc-sub-text " itemprop="description"><p>Samsonite is synonymous with high quality standards and the use of premium materials. This pair of formal shoes definitely live up to the brand's name. Pair it with crisp formal shirts and slim-fit trousers to make the perfect impression at your board meetings and interviews.</p></li><li class="desc-sub-title ">Product Details</li><li class="desc-sub-text"><p>Round toed, black formal shoes with central lace-ups and low top styling<br/>Smooth, textured leather upper, stitched overlays and reinforced heel collar<br/>Soft, cushioned footbed with branding at the heel<br/>Durable outsole with patterned grooves and has a stacked heel<br/>Warranty: 3 months against manufacturing defects</p></li><li class="desc-sub-title ">Material &amp; Care</li><li class="desc-sub-text "><p>Leather<br/>Wipe with a clean, dry cloth when needed<br/>Click <a href="http://www.myntra.com/black-smooth-leather-care">here</a> for the perfect care products for black leather shoes</p></li></ul>,26:02:2014,None
None,Samsonite Men Brown London Formal Shoes,http://www.myntra.com/Formal-Shoes/Samsonite/Samsonite-Men-Brown-London-Formal-Shoes/100254/buy,Rs. 3,392,sale-men-footwear,Footwear,Samsonite,http://myntra.myntassets.com/images/style/properties/Samsonite-Men-Formal-Shoes_7c67f7dfc6147d714dc31d38508b2b0b_images_1080_1440_mini.jpg,Rs. 3,990,None,sale,http://www.myntra.com/Formal-Shoes/Samsonite/Samsonite-Men-Brown-London-Formal-Shoes/100254/buy,Sold byVector Ecommerce Pvt Ltd,None,None,['UK6', 'UK7', 'UK8', 'UK9', 'UK10'],None,<ul class="mk-pdpv1-product-helper mk-cf"><li class="desc-main-title">Product Description</li><li class="desc-sub-title">Style Note</li><li class="desc-sub-text " itemprop="description"><p>Stylish formal shoes that are easy to slip on from Samsonite. They are the perfect finish to your daily work wear. We recommend you match your shoes with your belt or tie to lend it a fashionable finish.</p></li><li class="desc-sub-title ">Product Details</li><li class="desc-sub-text"><p>Brown leather formal shoes<br/>Stitch detailing towards the midfoot and backfoot area<br/>Central lace up closure<br/>Branding on the tongue<br/>Soft slightly padded footbed with branding on the heel<br/>Tough outsole with grooves and stitch detailing<br/>Outsole has branding<br/>Warranty: 3 months from the date of purchase against manufacturing defects</p></li><li class="desc-sub-title ">Material &amp; Care</li><li class="desc-sub-text "><p>Leather<br/>Use a professional leather conditioner to clean this product</p></li></ul>,26:02:2014,None
None,Samsonite Men Black Business Elite Formal Shoes,http://www.myntra.com/Formal-Shoes/Samsonite/Samsonite-Men-Black-Business-Elite-Formal-Shoes/100246/buy,Rs. 3,392,sale-men-footwear,Footwear,Samsonite,http://myntra.myntassets.com/images/style/properties/Samsonite-Men-Formal-Shoes_1ce509d612e08a7a70cfae08422d4c7d_images_1080_1440_mini.jpg,Rs. 3,990,None,sale,http://www.myntra.com/Formal-Shoes/Samsonite/Samsonite-Men-Black-Business-Elite-Formal-Shoes/100246/buy,Sold byVector Ecommerce Pvt Ltd,None,None,['UK6', 'UK7', 'UK8', 'UK9', 'UK10'],None,<ul class="mk-pdpv1-product-helper mk-cf"><li class="desc-main-title">Product Description</li><li class="desc-sub-title">Style Note</li><li class="desc-sub-text " itemprop="description"><p>Samsonite brings you formal shoes that are perfect for your everyday fashion at work. They are classic in style and will match perfectly with almost anything you could pull out of your formal wardrobe.</p></li><li class="desc-sub-title ">Product Details</li><li class="desc-sub-text"><p>Black shoes with central lace up fastener<br/>Top stitch detailing<br/>Soft padded footbed with branding at the heel area<br/>Tough textured outsole that is slightly upraised at the heel and has branding<br/>Warranty: 3 months against manufacturing defects</p></li><li class="desc-sub-title ">Material &amp; Care</li><li class="desc-sub-text "><p>Leather<br/>Use a professional leather conditioner to clean this product</p></li></ul>,26:02:2014,None
None,Samsonite Men Black Formal Slip-Ons,http://www.myntra.com/Formal-Shoes/Samsonite/Samsonite-Men-Black-Formal-Slip-Ons/154332/buy,Rs. 4,242,sale-men-footwear,Footwear,Samsonite,http://myntra.myntassets.com/images/style/properties/Samsonite-Men-Formal-Shoes_1eee4bda45cff48cae43eaadfd59a7c3_images_1080_1440_mini.jpg,Rs. 4,990,None,sale,http://www.myntra.com/Formal-Shoes/Samsonite/Samsonite-Men-Black-Formal-Slip-Ons/154332/buy,Sold byVector Ecommerce Pvt Ltd,None,None,['6', '7', '8', '9', '10'],None,<ul class="mk-pdpv1-product-helper mk-cf"><li class="desc-main-title">Product Description</li><li class="desc-sub-title">Style Note</li><li class="desc-sub-text " itemprop="description"><p>Samsonite is synonymous with high quality standards and the use of premium materials. These slip-on shoes definitely live up to the brand's name. Pair them with crisp formal shirts and slim-fit trousers to make the perfect impression at your board meetings and interviews.</p></li><li class="desc-sub-title ">Product Details</li><li class="desc-sub-text"><p>Square toed, black slip-ons with low top styling<br/>Panelled leather upper, stitched detail along the toe box seam, branding on the tongue, elasticated gusset on either side of the tongue<br/>Reinforced heel collar, cushioned footbed with branding at the heel<br/>Durable outsole with grooves and an upraised heel<br/>Warranty: 3 months against manufacturing defects</p></li><li class="desc-sub-title ">Material &amp; Care</li><li class="desc-sub-text "><p>Leather<br/>Use a branded leather conditioner to clean<br/>Click <a href="http://www.myntra.com/black-smooth-leather-care">here</a> for the perfect care products for black leather shoes</p></li><li class="desc-sub-title">Size &amp; Fit</li><li class="desc-sub-text"><br/></li></ul>,26:02:2014,None
None,Samsonite Men Black Leather Formal Shoes,http://www.myntra.com/Formal-Shoes/Samsonite/Samsonite-Men-Black-Leather-Formal-Shoes/154322/buy,Rs. 5,092,sale-men-footwear,Footwear,Samsonite,http://myntra.myntassets.com/images/style/properties/Samsonite-Men-Black-Leather-Formal-Shoes_139f69b0d6023c194d98d4916c9e6250_images_1080_1440_mini.JPG,Rs. 5,990,None,sale,http://www.myntra.com/Formal-Shoes/Samsonite/Samsonite-Men-Black-Leather-Formal-Shoes/154322/buy,Sold byVector Ecommerce Pvt Ltd,None,None,['6', '7', '8', '9', '10'],None,<ul class="mk-pdpv1-product-helper mk-cf"><li class="desc-main-title">Product Description</li><li class="desc-sub-title">Style Note</li><li class="desc-sub-text " itemprop="description"><p>Samsonite is synonymous with high quality standards and use of premium materials. These shoes from the brand definitely lives up to it. Pair these with crisp formal shirts and slim-fit trousers and make a perfect impression at your board meetings and interviews.</p></li><li class="desc-sub-title ">Product Details</li><li class="desc-sub-text"><p>Pointy toed, black formal shoes with central lace-ups and low top styling<br/>Leather upper with stitched overlays, and reinforced heel collar<br/>Soft, cushioned footbed with branding at the heel<br/>Durable rubber outsole with texturing at the forefoot and has stacked heels<br/>Warranty: 3 months against manufacturing defects</p></li><li class="desc-sub-title ">Material &amp; Care</li><li class="desc-sub-text "><p>Leather<br/>Use a branded leather conditioner to clean the product<br/>Click <a href="http://www.myntra.com/black-smooth-leather-care">here</a> for the perfect care products for black leather shoes</p></li></ul>,26:02:2014,None
None,Samsonite Men Brown Leather Casual Shoes,http://www.myntra.com/Casual-Shoes/Samsonite/Samsonite-Men-Brown-Leather-Casual-Shoes/203779/buy,Rs. 5,942,sale-men-footwear,Footwear,Samsonite,http://myntra.myntassets.com/images/style/properties/Samsonite-Men-Brown-Leather-Casual-Shoes_b26d12c590648248d04b2ded70c57d0e_images_1080_1440_mini.jpg,Rs. 6,990,None,sale,http://www.myntra.com/Casual-Shoes/Samsonite/Samsonite-Men-Brown-Leather-Casual-Shoes/203779/buy,Sold byVector Ecommerce Pvt Ltd,None,None,['6', '7', '8', '9', '10'],None,<ul class="mk-pdpv1-product-helper mk-cf"><li class="desc-main-title">Product Description</li><li class="desc-sub-title">Style Note</li><li class="desc-sub-text " itemprop="description"><p>Samsonite never compromises on the design and comfort of their shoes. Smart and simple in design, this pair of casual shoes is best worn with denims and a checked shirt.</p></li><li class="desc-sub-title ">Product Details</li><li class="desc-sub-text"><p>Round toed, brown casual shoes with mid top styling and central lace-ups<br/>Leather upper with overlays, stitched detail, branding on one side, and reinforced heel collar<br/>Soft tongue with branding and cushioned footbed with branding at the heel<br/>Tough and textured outsole with circular nubs, branding and has a upraised heel<br/>Warranty: 3 months from the date of purchase against manufacturing defects</p></li><li class="desc-sub-title ">Material &amp; Care</li><li class="desc-sub-text "><p>Leather<br/>Use a branded leather conditioner to clean the product<br/>Click <a href="http://www.myntra.com/brown-smooth-leather-care">here</a> for the perfect care products for brown leather shoes</p></li></ul>,26:02:2014,None
