None,Fort Collins Women Green Hooded Padded Jacket,http://www.myntra.com/jackets/fort-collins/fort-collins-women-green-hooded-padded-jacket/223624/buy,Rs. 2,867,women-jackets,Jackets,Duke,http://myntra.myntassets.com/images/style/properties/Fort-Collins-Women-Green-Hooded-Padded-Jacket_c235b1b092cffb30941961b23fc46e02_images_1080_1440_mini.jpg,Rs. 3,185,None,women,http://www.myntra.com/jackets/fort-collins/fort-collins-women-green-hooded-padded-jacket/223624/buy,Sold byVector Ecommerce Pvt Ltd,None,None,['M', 'L', 'XL', 'XXL'],None,<ul class="mk-pdpv1-product-helper mk-cf"><li class="desc-main-title">Product Description</li><li class="desc-sub-title">Style Note</li><li class="desc-sub-text " itemprop="description"><p>Spruce up your dull winter wear with the winter wear collection from Fort Collins. This latest piece has everything that takes to add spice and make you look like a zillion bucks even in this chilly weather. We suggest you team it up with a pair of jeans and funky sneakers to add zing to this season.</p></li><li class="desc-sub-title ">Product Details</li><li class="desc-sub-text"><p>Green padded jacket with stitch detail, panelled detail at front and back, detachable zipped hood with drawstring closure and contrast faux fur trim, mock collar with a ribbed inner layer, long sleeves with zip detail at concealed ribbed cuffs, piping detail near the armholes, full zipped closure below buttoned placket at front, two insert pockets at front waist with mock zipped pockets on the outside, metallic trim detail above insert pockets, inner drawstring fastening at waist, a welt pocket with mock buttoned detail built into lining on the left, metallic hanging loop at the back</p></li><li class="desc-sub-title ">Material &amp; Care</li><li class="desc-sub-text "><p>100% cotton<br/>Machine wash gentle</p></li><li class="desc-sub-title">Size &amp; Fit</li><li class="desc-sub-text"><p>The model (height 5'8" and chest 33") is wearing a size M</p></li></ul>,26:02:2014,None
None,Elle Women Off-White Jacket,http://www.myntra.com/jackets/elle/elle-women-off-white-jacket/240951/buy,Rs. 2,395,women-jackets,Jackets,Duke,http://myntra.myntassets.com/images/style/properties/Elle-Women-Off-White-Jacket_b50ca67cd262770b0cc9bf7c4f229b18_images_1080_1440_mini.jpg,None,None,women,http://www.myntra.com/jackets/elle/elle-women-off-white-jacket/240951/buy,Sold byVector Ecommerce Pvt Ltd,None,None,['XXS', 'XS', 'S', 'M', 'L'],None,<ul class="mk-pdpv1-product-helper mk-cf"><li class="desc-main-title">Product Description</li><li class="desc-sub-title">Style Note</li><li class="desc-sub-text " itemprop="description"><p>Stay chic this season in this clean and stylish summer jacket by Elle. We love its minimalistic detailing and fresh colour. Layer over a tank top with a pair of baggy boyfriend jeans and strappy wedges for a look that says that you are ready to take on the world.</p></li><li class="desc-sub-title ">Product Details</li><li class="desc-sub-text"><p>Off-white jacket, woven and panelled, has a shawl collar, single breasted with an inner buttoned closure and a single hook and eye closure at chest, three quarter length sleeves with pleats at shoulders and upturned vented cuffs, metal branding on left curved hem that is slightly longer in the front</p></li><li class="desc-sub-title ">Material &amp; Care</li><li class="desc-sub-text "><p>98% cotton, 2% Spandex<br/>Machine wash cold</p></li><li class="desc-sub-title">Size &amp; Fit</li><li class="desc-sub-text"><p>Regular fit<br/>The model (height 5'8" and chest 33") is wearing a size S</p></li></ul>,26:02:2014,None
None,Fort Collins Women Red Padded Jacket,http://www.myntra.com/jackets/fort-collins/fort-collins-women-red-padded-jacket/223538/buy,Rs. 2,147,women-jackets,Jackets,Duke,http://myntra.myntassets.com/images/style/properties/Fort-Collins-Women-Red-Padded-Jacket_050341966dd131bcb0cbae546dc17800_images_1080_1440_mini.jpg,Rs. 2,385,None,women,http://www.myntra.com/jackets/fort-collins/fort-collins-women-red-padded-jacket/223538/buy,Sold byVector Ecommerce Pvt Ltd,None,None,['M', 'L', 'XL', 'XXL'],None,<ul class="mk-pdpv1-product-helper mk-cf"><li class="desc-main-title">Product Description</li><li class="desc-sub-title">Style Note</li><li class="desc-sub-text " itemprop="description"><p>Spruce up your dull winter wear with the collection from Fort Collins. This latest piece has everything it takes to add spice and make you look like a zillion bucks even in this chilly weather. We suggest you team this jacket with a pair of jeans or jeggings and funky sneakers to add zing to this season.</p></li><li class="desc-sub-title ">Product Details</li><li class="desc-sub-text"><p>Red padded jacket with stitch detail, panelled, has a mock collar, detachable hood with faux fur trim and drawstring feature, long sleeves with button tab detail near cuffs, concealed full zipped placket underneath a full button placket, scoop pockets with ribbed mouth at front waist, welt pocket built into lining at right<br/>Comes with a hanger</p></li><li class="desc-sub-title ">Material &amp; Care</li><li class="desc-sub-text "><p>100% cotton<br/>Machine wash gentle</p></li><li class="desc-sub-title">Size &amp; Fit</li><li class="desc-sub-text"><p>Regular fit<br/>The model (height 5'8" and chest 33") is wearing a size M</p></li></ul>,26:02:2014,None
None,Fort Collins Women Pink Padded Jacket,http://www.myntra.com/jackets/fort-collins/fort-collins-women-pink-padded-jacket/223536/buy,Rs. 2,147,women-jackets,Jackets,Duke,http://myntra.myntassets.com/images/style/properties/Fort-Collins-Women-Pink-Padded-Jacket_127344b1fcc7fc3a868168614de5858c_images_1080_1440_mini.jpg,Rs. 2,385,None,women,http://www.myntra.com/jackets/fort-collins/fort-collins-women-pink-padded-jacket/223536/buy,Sold byVector Ecommerce Pvt Ltd,None,None,['M', 'L', 'XL', 'XXL'],None,<ul class="mk-pdpv1-product-helper mk-cf"><li class="desc-main-title">Product Description</li><li class="desc-sub-title">Style Note</li><li class="desc-sub-text " itemprop="description"><p>Spruce up your dull winter wear with the collection from Fort Collins. This latest piece has everything that takes to add spice and make you look like a zillion bucks even in this chilly weather. We suggest you team this jacket with a pair of jeans or jeggings and funky sneakers to add zing to this season.</p></li><li class="desc-sub-title ">Product Details</li><li class="desc-sub-text"><p>Pink padded jacket, woven, stitch detailing throughout, has a mock collar, detachable padded hood with faux fur lining, full zipped front closure with a press buttoned placket hiding the zipper, long sleeves with buttoned tab feature at the cuffs, two insert pockets with ribbed panelling, inner pocket at the left chest, inner drawstring tie up for better fit</p></li><li class="desc-sub-title ">Material &amp; Care</li><li class="desc-sub-text "><p>100% Nylon<br/>Hand wash</p></li><li class="desc-sub-title">Size &amp; Fit</li><li class="desc-sub-text"><p>Reular fit<br/>The model (height 5'8" and chest 33") is wearing a size M</p></li></ul>,26:02:2014,None
None,Roadster Women Orange & Peach Ombre Jacket,http://www.myntra.com/jackets/roadster/roadster-women-orange-peach-ombre-jacket/147554/buy,Rs. 500,women-jackets,Jackets,Duke,http://myntra.myntassets.com/images/style/properties/Roadster-Women-Orange-&-Peach-Sleeveless-Ombre-Jacket_f98d7c440206e5c4b398aac0b206fddd_images_1080_1440_mini.jpg,Rs. 999,None,women,http://www.myntra.com/jackets/roadster/roadster-women-orange-peach-ombre-jacket/147554/buy,Sold byVector Ecommerce Pvt Ltd,None,None,['S', 'M', 'L', 'XL'],None,<ul class="mk-pdpv1-product-helper mk-cf"><li class="desc-main-title">Product Description</li><li class="desc-sub-title">Style Note</li><li class="desc-sub-text " itemprop="description"><p>Ride the ombre trend wave with this uber cool jacket by Roadster. Style it with a plain tee, distressed shorts and ankle boots for a rock star look.</p></li><li class="desc-sub-title ">Product Details</li><li class="desc-sub-text"><p>Orange and peach ombre dyed jacket, spread collar, sleeveless, patch pockets with buttoned flaps at chest, buttoned placket at front with tuck detail at either side, hem band with buttoned tab at sides</p></li><li class="desc-sub-title ">Material &amp; Care</li><li class="desc-sub-text "><p>100% cotton<br/>Machine wash cold</p></li><li class="desc-sub-title">Size &amp; Fit</li><li class="desc-sub-text"><p>The model (height 5'8" and chest 33") is wearing a size S</p></li></ul>,26:02:2014,None
None,Fort Collins Women Coffee Brown Jacket,http://www.myntra.com/jackets/fort-collins/fort-collins-women-coffee-brown-jacket/211840/buy,Rs. 1,454,women-jackets,Jackets,Duke,http://myntra.myntassets.com/images/style/properties/Fort-Collins-Women-Jackets_79d0be6c22962736a161c49ea3991f33_images_1080_1440_mini.jpg,Rs. 1,615,None,women,http://www.myntra.com/jackets/fort-collins/fort-collins-women-coffee-brown-jacket/211840/buy,Sold byVector Ecommerce Pvt Ltd,None,None,['M', 'L', 'XL', 'XXL'],None,<ul class="mk-pdpv1-product-helper mk-cf"><li class="desc-main-title">Product Description</li><li class="desc-sub-title">Style Note</li><li class="desc-sub-text " itemprop="description"><p>With this trendy jacket from Fort Collins, raise your style quotient to maximum. The modern design and comfortable fit keeps you feeling stylish. Team it with jeans and winter boots for a fashionable look.</p></li><li class="desc-sub-title ">Product Details</li><li class="desc-sub-text"><p>Coffee brown jacket, padded and woven, stitched detailing throughout, has a mock collar, detachable padded hood with drawstring fastening, long sleeves with panelled cuffs, has a buttoned tab feature, full zipped closure at the front, panelling with button below the chest, insert pockets on either sides of front waist</p></li><li class="desc-sub-title ">Material &amp; Care</li><li class="desc-sub-text "><p>100% Nylon<br/>Dry clean</p></li><li class="desc-sub-title">Size &amp; Fit</li><li class="desc-sub-text"><p>Regular fit<br/>The model (height 5'8" and chest 33") is wearing a size M</p></li></ul>,26:02:2014,None
None,Fort Collins Women Maroon Padded Jacket,http://www.myntra.com/jackets/fort-collins/fort-collins-women-maroon-padded-jacket/223550/buy,Rs. 2,475,women-jackets,Jackets,Duke,http://myntra.myntassets.com/images/style/properties/Fort-Collins-Women-Red-Padded-Jacket_52caffff2f09e2c696dac9c41eb4cd5e_images_1080_1440_mini.jpg,Rs. 2,750,None,women,http://www.myntra.com/jackets/fort-collins/fort-collins-women-maroon-padded-jacket/223550/buy,Sold byVector Ecommerce Pvt Ltd,None,None,['M', 'L', 'XL'],None,<ul class="mk-pdpv1-product-helper mk-cf"><li class="desc-main-title">Product Description</li><li class="desc-sub-title">Style Note</li><li class="desc-sub-text " itemprop="description"><p>Let’s tackle the chill in style this season with Fort Colins' collection of winter wear. This latest piece has everything that takes to add spice and make you look like a zillion bucks even in the chilly weather. We suggest you team this jacket with a pair of jeans or jeggings and funky sneakers to add zing to this season.</p></li><li class="desc-sub-title ">Product Details</li><li class="desc-sub-text"><p>Maroon padded jacket with stitch detail, panelled, has a mock collar, detachable hood with drawstrings, upturned detail and faux fur trim, long sleeves with ribbed cuffs, concealed full zipped placket with buttoned flap, patch pockets at front waist with buttoned flap detail and pleat detail, back yoke with tuck detail below, welt pocket built into lining</p></li><li class="desc-sub-title ">Material &amp; Care</li><li class="desc-sub-text "><p>Cotton blend<br/>Machine wash warm</p></li><li class="desc-sub-title">Size &amp; Fit</li><li class="desc-sub-text"><p>Regular fit<br/>The model (height 5'8" and chest 33") is wearing a size M</p></li></ul>,26:02:2014,None
None,Fort Collins Women Green Padded Jacket,http://www.myntra.com/jackets/fort-collins/fort-collins-women-green-padded-jacket/223601/buy,Rs. 2,102,women-jackets,Jackets,Duke,http://myntra.myntassets.com/images/style/properties/Fort-Collins-Women-Jackets_d630f95a47fbb466eb122fcd56da2c81_images_1080_1440_mini.jpg,Rs. 2,335,None,women,http://www.myntra.com/jackets/fort-collins/fort-collins-women-green-padded-jacket/223601/buy,Sold byVector Ecommerce Pvt Ltd,None,None,['M', 'L', 'XL'],None,<ul class="mk-pdpv1-product-helper mk-cf"><li class="desc-main-title">Product Description</li><li class="desc-sub-title">Style Note</li><li class="desc-sub-text " itemprop="description"><p>Spruce up your dull winter wear with the winter wear collection from Fort Collins. This latest piece has everything that takes to add spice and make you look like a zillion bucks even in this chilly weather. We suggest you team it up with a pair of jeans and funky sneakers to add zing to this season.</p></li><li class="desc-sub-title ">Product Details</li><li class="desc-sub-text"><p>Green padded jacket with stitch detail, paneled, detachable zipped hood with drawstring closure, faux fur lining and trim detail at hood, mock collar, long sleeves with ribbed cuffs, full zipped closure below buttoned placket at front, two pockets in the front with button and flap detailing, elasticated smocking at sides of waist, a welt pocket built into faux fur lining at right, embroidered branding below left pocket</p></li><li class="desc-sub-title ">Material &amp; Care</li><li class="desc-sub-text "><p>100% nylon<br/>Machine wash gentle</p></li><li class="desc-sub-title">Size &amp; Fit</li><li class="desc-sub-text"><p>The model (height 5'8" and chest 33") is wearing a size M</p></li></ul>,26:02:2014,None
None,Fort Collins Women Navy Padded Jacket,http://www.myntra.com/jackets/fort-collins/fort-collins-women-navy-padded-jacket/223582/buy,Rs. 1,791,women-jackets,Jackets,Duke,http://myntra.myntassets.com/images/style/properties/Fort-Collins-Women-Jackets_c4f5bff7e4f6ce21aae4d2e5ab4fecba_images_1080_1440_mini.jpg,Rs. 1,990,None,women,http://www.myntra.com/jackets/fort-collins/fort-collins-women-navy-padded-jacket/223582/buy,Sold byVector Ecommerce Pvt Ltd,None,None,['M', 'L', 'XL'],None,<ul class="mk-pdpv1-product-helper mk-cf"><li class="desc-main-title">Product Description</li><li class="desc-sub-title">Style Note</li><li class="desc-sub-text " itemprop="description"><p>Spruce up your dull winter wear with the collection from Fort Collins. This latest piece has everything that takes to add spice and make you look like a zillion bucks even in this chilly weather. We suggest you team this jacket with a pair of jeans or jeggings and funky sneakers to add zing to this season.</p></li><li class="desc-sub-title ">Product Details</li><li class="desc-sub-text"><p>Navy blue padded jacket with stitch detailing, woven, panelled, has a mock collar flap and press button detail, detachable hood with drawstring fastening, faux fur lining and zipped closure, long sleeves with stitch detailing at cuffs, embroidered branding at left sleeve, concealed full zipped placket at front with flap and press buttoned closure above, insert pockets at front waist, insert pocket built into lining at right chest with Velcro closure</p></li><li class="desc-sub-title ">Material &amp; Care</li><li class="desc-sub-text "><p>100% nylon<br/>Machine wash warm</p></li><li class="desc-sub-title">Size &amp; Fit</li><li class="desc-sub-text"><p>Regular fit<br/>The model (height 5'8" and chest 33") is wearing a size M</p></li></ul>,26:02:2014,None
None,Fort Collins Women Pink Padded Jacket,http://www.myntra.com/jackets/fort-collins/fort-collins-women-pink-padded-jacket/223588/buy,Rs. 1,967,women-jackets,Jackets,Duke,http://myntra.myntassets.com/images/style/properties/Fort-Collins-Women-Pink-Padded-Jacket_a05d0075a4bbc6a63d7c3bc7d6449b7b_images_1080_1440_mini.jpg,Rs. 2,185,None,women,http://www.myntra.com/jackets/fort-collins/fort-collins-women-pink-padded-jacket/223588/buy,Sold byVector Ecommerce Pvt Ltd,None,None,['M', 'L', 'XL'],None,<ul class="mk-pdpv1-product-helper mk-cf"><li class="desc-main-title">Product Description</li><li class="desc-sub-title">Style Note</li><li class="desc-sub-text " itemprop="description"><p>Start warming up with the winter wear collection from Fort Collins. This latest piece has everything that takes to add spice and make you look like a zillion bucks even in this chilly weather. We suggest you team it up with a pair of jeans or jeggings and funky sneakers to add zing to this season.</p></li><li class="desc-sub-title ">Product Details</li><li class="desc-sub-text"><p>Pink padded jacket, panelled, has a mock collar, detachable zipped hood with button tab fastening, contrast faux fur trim and contrat printed lining, long sleeves with ribbed knit cuffs, full zipped closure beneath full press buttoned placket, brand embroidered detail at left sleeve, flaps with stitch detail at either sides at chest, insert pockets at front waist with metallic trim detail, back yoke with flap below, ribbed hem, Velcro fastened mobile slot built into lining at right<br/>Comes with a hanger</p></li><li class="desc-sub-title ">Material &amp; Care</li><li class="desc-sub-text "><p>100% nylon<br/>Machine wash gentle</p></li><li class="desc-sub-title">Size &amp; Fit</li><li class="desc-sub-text"><p>Regular fit<br/>The model (height 5'8" and chest 33") is wearing a size M</p></li></ul>,26:02:2014,None
None,Fort Collins Women Maroon Padded Jacket,http://www.myntra.com/jackets/fort-collins/fort-collins-women-maroon-padded-jacket/223571/buy,Rs. 2,417,women-jackets,Jackets,Duke,http://myntra.myntassets.com/images/style/properties/Fort-Collins-Women-Maroon-Padded-Jacket_3ba98ddf307c61b8c9f3f96458096c05_images_1080_1440_mini.jpg,Rs. 2,685,None,women,http://www.myntra.com/jackets/fort-collins/fort-collins-women-maroon-padded-jacket/223571/buy,Sold byVector Ecommerce Pvt Ltd,None,None,['M', 'L', 'XL'],None,<ul class="mk-pdpv1-product-helper mk-cf"><li class="desc-main-title">Product Description</li><li class="desc-sub-title">Style Note</li><li class="desc-sub-text " itemprop="description"><p>Spruce up your dull winter wear with this trendy jacket from Fort Collins. This sporty piece has everything it takes to add spice and make you look like a zillion bucks even in this chilly weather. We suggest, you team it with a plain contrast tee or just a pair of jeans and funky sneakers.</p></li><li class="desc-sub-title ">Product Details</li><li class="desc-sub-text"><p>Maroon padded jacket with stitch detail, woven, panelled, detachable zipped hood with faux fur lining and trim detail at hem, mock collar, long sleeves with tab and rivet detail towards ribbed cuffs, concealed full zipped closure below buttoned placket at front, insert pockets with zipped closures at chest, band along waist with belt loop at back, insert pockets with flap and rivet detail at waist sides, insert pocket built into faux fur lining at right with a Velcro closure</p></li><li class="desc-sub-title ">Material &amp; Care</li><li class="desc-sub-text "><p>100% cotton<br/>Machine wash warm</p></li><li class="desc-sub-title">Size &amp; Fit</li><li class="desc-sub-text"><p>Regular fit<br/>The model (height 5'8" and chest 33") is wearing a size M</p></li></ul>,26:02:2014,None
None,Fort Collins Women Green Padded Jacket,http://www.myntra.com/jackets/fort-collins/fort-collins-women-green-padded-jacket/223540/buy,Rs. 1,454,women-jackets,Jackets,Duke,http://myntra.myntassets.com/images/style/properties/Fort-Collins-Women-Green-Padded-Jacket_d846a33abac1120723cf9c561e5b194d_images_1080_1440_mini.jpg,Rs. 1,615,None,women,http://www.myntra.com/jackets/fort-collins/fort-collins-women-green-padded-jacket/223540/buy,Sold byVector Ecommerce Pvt Ltd,None,None,['M', 'L', 'XL', 'XXL'],None,<ul class="mk-pdpv1-product-helper mk-cf"><li class="desc-main-title">Product Description</li><li class="desc-sub-title">Style Note</li><li class="desc-sub-text " itemprop="description"><p>Spruce up your dull winter wear with this collection from Fort Collins. This latest piece has everything that takes to add spice and make you look like a zillion bucks even in this chilly weather. We suggest you team this jacket with a pair of jeans or jeggings and funky sneakers to add zing to this season.</p></li><li class="desc-sub-title ">Product Details</li><li class="desc-sub-text"><p>Green padded jacket with stitch detail, mock collar, detachable zipped hood with drawstrings and contrast lining, long sleeves with button tab detail and slit at cuffs, full zipped closure at front, flaps with button detail above welt pockets at front waist, welt pocket built into contrast lining</p></li><li class="desc-sub-title ">Material &amp; Care</li><li class="desc-sub-text "><p>100% nylon<br/>Machine wash gentle</p></li><li class="desc-sub-title">Size &amp; Fit</li><li class="desc-sub-text"><p>Regular fit<br/>The model (height 5'8" and chest 33") is wearing a size M</p></li></ul>,26:02:2014,None
