None,Anouk Women Pink Kurta,http://www.myntra.com/Kurtas/Anouk/Anouk-Women-Pink-Kurta/219746/buy,Rs. 539,sale-women-clothing,Clothing,Anouk,http://myntra.myntassets.com/images/style/properties/Anouk-Women-Pink-Kurta_2f5812a3b27b489ffb1da122170a3e04_images_1080_1440_mini.jpg,Rs. 899,None,sale,http://www.myntra.com/Kurtas/Anouk/Anouk-Women-Pink-Kurta/219746/buy,Sold byVector Ecommerce Pvt Ltd,None,None,['S', 'M', 'L', 'XL', 'XXL'],None,<ul class="mk-pdpv1-product-helper mk-cf"><li class="desc-main-title">Product Description</li><li class="desc-sub-title">Style Note</li><li class="desc-sub-text " itemprop="description"><p>For a much adored ethnic look, Anouk presents this kurta. Made with the best of tailoring expertise, this kurta can be highlighted by pairing it with solid churidar leggings and strappy sandals for a complete look or with skinny denims for a casual look.</p></li><li class="desc-sub-title ">Product Details</li><li class="desc-sub-text"><p>Pink kurta, woven, contrast mandarin collar with slit, three quarter sleeves with contrast taping at upturned cuffs with mock roll-up tab feature, short mock buttoned chest placket with contrast overlays, tucks and piping on either side, side slits</p></li><li class="desc-sub-title ">Material &amp; Care</li><li class="desc-sub-text "><p>100% cotton<br/>Hand wash cold</p></li><li class="desc-sub-title">Size &amp; Fit</li><li class="desc-sub-text"><p>The model (height 5'8" and chest 33") is wearing a size S</p></li></ul>,26:02:2014,None
None,Anouk Women Coffee Brown Kurta,http://www.myntra.com/Kurtas/Anouk/Anouk-Women-Coffee-Brown-Kurta/219787/buy,Rs. 539,sale-women-clothing,Clothing,Anouk,http://myntra.myntassets.com/images/style/properties/Anouk-Women-Coffee-Brown-Kurta_ac1026b46c8dbebae34283d295f38adf_images_1080_1440_mini.jpg,Rs. 899,None,sale,http://www.myntra.com/Kurtas/Anouk/Anouk-Women-Coffee-Brown-Kurta/219787/buy,Sold byVector Ecommerce Pvt Ltd,None,None,['S', 'M', 'L', 'XL', 'XXL'],None,<ul class="mk-pdpv1-product-helper mk-cf"><li class="desc-main-title">Product Description</li><li class="desc-sub-title">Style Note</li><li class="desc-sub-text " itemprop="description"><p>For a much adored ethnic look, Anouk presents this kurta. Made with the best of tailoring expertise, this kurta can be highlighted by pairing it with solid churidar leggings and strappy sandals for a complete look or with skinny denims for a casual look.</p></li><li class="desc-sub-title ">Product Details</li><li class="desc-sub-text"><p>Coffee brown kurta, woven, mandarin collar with slit, three quarter sleeves with buttoned cuffs and roll-up tab feature, gathers at shoulders, short buttoned chest placket, panel at chest with tucks, stitch detail and pleats below, tie-up fastening at chest sides, side slits</p></li><li class="desc-sub-title ">Material &amp; Care</li><li class="desc-sub-text "><p>100% cotton<br/>Hand wash cold</p></li><li class="desc-sub-title">Size &amp; Fit</li><li class="desc-sub-text"><p>The model (height 5'8" and chest 33") is wearing a size S</p></li></ul>,26:02:2014,None
None,Anouk Women Blue & Green Printed Kurta,http://www.myntra.com/Kurtas/Anouk/Anouk-Women-Blue-&-Green-Printed-Kurta/203083/buy,Rs. 359,sale-women-clothing,Clothing,Anouk,http://myntra.myntassets.com/images/style/properties/Anouk-Women-Kurtas_7d360f17c036b82774af0b182ce8a94f_images_1080_1440_mini.JPG,Rs. 599,None,sale,http://www.myntra.com/Kurtas/Anouk/Anouk-Women-Blue-&-Green-Printed-Kurta/203083/buy,Sold byVector Ecommerce Pvt Ltd,None,None,['XS', 'S', 'M', 'L', 'XL', 'XXL'],None,<ul class="mk-pdpv1-product-helper mk-cf"><li class="desc-main-title">Product Description</li><li class="desc-sub-title">Style Note</li><li class="desc-sub-text " itemprop="description"><p>For a much adored ethnic look, Anouk presents this kurta. Made with the best of tailoring expertise, this kurta can be highlighted by pairing it with solid churidar leggings and strappy sandals for a complete look or with skinny denims for a casual look.</p></li><li class="desc-sub-title ">Product Details</li><li class="desc-sub-text"><p>Blue kurta with green prints at front, has a round neck with slit and contrast piping, short sleeves with taping at the cuffs, has a vented hem with printed detailing above it</p></li><li class="desc-sub-title ">Material &amp; Care</li><li class="desc-sub-text "><p>100% cotton<br/>Hand wash cold</p></li><li class="desc-sub-title">Size &amp; Fit</li><li class="desc-sub-text"><p>Comfort fit<br/>The model (height 5'8" and chest 33") is wearing a size S</p></li></ul>,26:02:2014,None
None,Anouk Women Red Kurta,http://www.myntra.com/Kurtas/Anouk/Anouk-Women-Red-Kurta/219788/buy,Rs. 539,sale-women-clothing,Clothing,Anouk,http://myntra.myntassets.com/images/style/properties/Anouk-Women-Red-Kurta_13929921121f3c379dd5f1f216abdd5b_images_1080_1440_mini.jpg,Rs. 899,None,sale,http://www.myntra.com/Kurtas/Anouk/Anouk-Women-Red-Kurta/219788/buy,Sold byVector Ecommerce Pvt Ltd,None,None,['S', 'M', 'L', 'XL', 'XXL'],None,<ul class="mk-pdpv1-product-helper mk-cf"><li class="desc-main-title">Product Description</li><li class="desc-sub-title">Style Note</li><li class="desc-sub-text " itemprop="description"><p>For a much adored ethnic look, Anouk presents this kurta. Made with the best of tailoring expertise, this kurta can be highlighted by pairing it with solid churidar leggings and strappy sandals for a complete look or with skinny denims for a casual look.</p></li><li class="desc-sub-title ">Product Details</li><li class="desc-sub-text"><p>Red kurta, woven, mandarin collar with slit, three quarter sleeves with buttoned cuffs and roll-up tab feature, gathers at shoulders, short buttoned chest placket, panel at chest with tucks, stitch detail and pleats below, tie-up fastening at chest sides, side slits</p></li><li class="desc-sub-title ">Material &amp; Care</li><li class="desc-sub-text "><p>100% cotton<br/>Hand wash cold</p></li><li class="desc-sub-title">Size &amp; Fit</li><li class="desc-sub-text"><p>The model (height 5'8" and chest 33") is wearing a size S</p></li></ul>,26:02:2014,None
None,Anouk Women Off-White & Burgundy Printed Churidar Kurta Set,http://www.myntra.com/Salwar-Suit/Anouk/Anouk-Women-Off-White-&-Burgundy-Printed-Churidar-Kurta-Set/207990/buy,Rs. 1,399,sale-women-clothing,Clothing,Anouk,http://myntra.myntassets.com/images/style/properties/Anouk-Women-Off-White-&-Burgundy-Printed-Churidar-Kurta-Set_85c0881da27b24ca07656d323b7c2fe8_images_1080_1440_mini.jpg,Rs. 1,999,None,sale,http://www.myntra.com/Salwar-Suit/Anouk/Anouk-Women-Off-White-&-Burgundy-Printed-Churidar-Kurta-Set/207990/buy,Sold byVector Ecommerce Pvt Ltd,None,None,['XS', 'S', 'M', 'L', 'XL'],None,<ul class="mk-pdpv1-product-helper mk-cf"><li class="desc-main-title">Product Description</li><li class="desc-sub-title">Style Note</li><li class="desc-sub-text " itemprop="description"><p>Desi elegance at its best - Anouk brings you a gorgeous range of churidar kurta sets to up the sartorial credibility of your ethnic repertoire. Pair this set with silver jhumkas and Kolhapuri sandals.</p></li><li class="desc-sub-title ">Product Details</li><li class="desc-sub-text"><p>Off-white and burgundy churidar and kurta set<br/>Off-white kurta with mustard yellow, pink and green prints, woven, contrast binding along round neck with a slit below, contrast taping at chest, three quarter length sleeves with contrast overlay at hems, contrast taping print at hem, side slits<br/>Burgundy woven churidar pants, has drawstring fastening, tapered legs<br/>Burgundy and brown crushed dupatta, has ombre dyed effect<br/>Comes with a cloth bag</p></li><li class="desc-sub-title ">Material &amp; Care</li><li class="desc-sub-text "><p>100% cotton<br/>Hand wash cold</p></li><li class="desc-sub-title">Size &amp; Fit</li><li class="desc-sub-text"><p>Dupatta length: 216 cm<br/>Dupatta width: 115 cm<br/>The model (height 5'8" and chest 33") is wearing a size S</p></li></ul>,26:02:2014,None
None,Anouk Women Yellow Jacquard with Embroidered Yoke Kurta,http://www.myntra.com/Kurtas/Anouk/Anouk-Women-Yellow-Jacquard-with-Embroidered-Yoke-Kurta/212289/buy,Rs. 559,sale-women-clothing,Clothing,Anouk,http://myntra.myntassets.com/images/style/properties/Anouk-Women-Yellow-Jacquard-with-Embroidered-Yoke-Kurta_5a111435434d5a17ffe0e9e538d4b687_images_1080_1440_mini.JPG,Rs. 799,None,sale,http://www.myntra.com/Kurtas/Anouk/Anouk-Women-Yellow-Jacquard-with-Embroidered-Yoke-Kurta/212289/buy,Sold byVector Ecommerce Pvt Ltd,None,None,['XS', 'S', 'M', 'L', 'XL', 'XXL'],None,<ul class="mk-pdpv1-product-helper mk-cf"><li class="desc-main-title">Product Description</li><li class="desc-sub-title">Style Note</li><li class="desc-sub-text " itemprop="description"><p>This versatile kurta from Anouk will instantly become your wardrobe favourite with its soft fabric and comfortable fit. Wear it with churidar leggings and Kolhapuri sandals for a chic ethnic look.</p></li><li class="desc-sub-title ">Product Details</li><li class="desc-sub-text"><p>Yellow kurta, jacquard weave detailing, round neck with a split V, three quarter length sleeves, cross stitch embroidery at chest, straight vented hem</p></li><li class="desc-sub-title ">Material &amp; Care</li><li class="desc-sub-text "><p>100% cotton<br/>Hand wash</p></li><li class="desc-sub-title">Size &amp; Fit</li><li class="desc-sub-text"><p>Comfort fit<br/>The model (height 5'8" and chest 33") is wearing a size S</p></li></ul>,26:02:2014,None
None,Anouk Women Blue Kurta,http://www.myntra.com/Kurtas/Anouk/Anouk-Women-Blue-Kurta/219735/buy,Rs. 539,sale-women-clothing,Clothing,Anouk,http://myntra.myntassets.com/images/style/properties/Anouk-Women-Blue-Kurta_205baf90bbaa5fb29de6947d2bc59a54_images_1080_1440_mini.jpg,Rs. 899,None,sale,http://www.myntra.com/Kurtas/Anouk/Anouk-Women-Blue-Kurta/219735/buy,Sold byVector Ecommerce Pvt Ltd,None,None,['S', 'M', 'L', 'XL', 'XXL'],None,<ul class="mk-pdpv1-product-helper mk-cf"><li class="desc-main-title">Product Description</li><li class="desc-sub-title">Style Note</li><li class="desc-sub-text " itemprop="description"><p>For a much adored ethnic look, Anouk presents this kurta. Made with the best of tailoring expertise, this kurta can be highlighted by pairing it with solid churidar leggings or contrast harem pants and strappy sandals for a complete look.</p></li><li class="desc-sub-title ">Product Details</li><li class="desc-sub-text"><p>Blue kurta with contrast stitch detail, woven, round neck with binding, sleeveless with binding at arm holes, short mock buttoned chest placket with stylised pin tucks, tucks and contrast embroidery on either side, side slits, contrast printed taping along front hem</p></li><li class="desc-sub-title ">Material &amp; Care</li><li class="desc-sub-text "><p>100% cotton<br/>Hand wash cold</p></li><li class="desc-sub-title">Size &amp; Fit</li><li class="desc-sub-text"><p>The model (height 5'8" and chest 33") is wearing a size S</p></li></ul>,26:02:2014,None
None,Anouk Women Neon Yellow Kurta,http://www.myntra.com/Kurtas/Anouk/Anouk-Women-Neon-Yellow-Kurta/219747/buy,Rs. 539,sale-women-clothing,Clothing,Anouk,http://myntra.myntassets.com/images/style/properties/Anouk-Women-Yellow-Kurta_6f07de41d9bf78000ada7f671db445f2_images_1080_1440_mini.jpg,Rs. 899,None,sale,http://www.myntra.com/Kurtas/Anouk/Anouk-Women-Neon-Yellow-Kurta/219747/buy,Sold byVector Ecommerce Pvt Ltd,None,None,['S', 'M', 'L', 'XL', 'XXL'],None,<ul class="mk-pdpv1-product-helper mk-cf"><li class="desc-main-title">Product Description</li><li class="desc-sub-title">Style Note</li><li class="desc-sub-text " itemprop="description"><p>For a much adored ethnic look, Anouk presents this kurta. Made with the best of tailoring expertise, this kurta can be highlighted by pairing it with solid churidar leggings and strappy sandals for a complete look.</p></li><li class="desc-sub-title ">Product Details</li><li class="desc-sub-text"><p>Neon yellow kurta, woven, contrast mandarin collar with slit, three quarter sleeves with contrast taping at cuffs with mock roll-up tab feature, short mock buttoned chest placket with contrast overlays, tucks and piping on either side, side slits</p></li><li class="desc-sub-title ">Material &amp; Care</li><li class="desc-sub-text "><p>100% cotton<br/>Hand wash cold</p></li><li class="desc-sub-title">Size &amp; Fit</li><li class="desc-sub-text"><p>The model (height 5'8" and chest 33") is wearing a size S</p></li></ul>,26:02:2014,None
None,Anouk Women Olive Green Kurta,http://www.myntra.com/Kurtas/Anouk/Anouk-Women-Olive-Green-Kurta/219784/buy,Rs. 539,sale-women-clothing,Clothing,Anouk,http://myntra.myntassets.com/images/style/properties/Anouk-Women-Olive-Green-Kurta_c1d5d628cf7d4a5f4859d6c8e5c8ff3d_images_1080_1440_mini.jpg,Rs. 899,None,sale,http://www.myntra.com/Kurtas/Anouk/Anouk-Women-Olive-Green-Kurta/219784/buy,Sold byVector Ecommerce Pvt Ltd,None,None,['S', 'M', 'L', 'XL', 'XXL'],None,<ul class="mk-pdpv1-product-helper mk-cf"><li class="desc-main-title">Product Description</li><li class="desc-sub-title">Style Note</li><li class="desc-sub-text " itemprop="description"><p>For a much adored ethnic look, Anouk presents this kurta. Made with the best of tailoring expertise, this kurta can be highlighted by pairing it with solid churidar leggings and strappy sandals for a complete look or with skinny denims for a casual look.</p></li><li class="desc-sub-title ">Product Details</li><li class="desc-sub-text"><p>Olive green kurta, woven, mandarin collar with slit, three quarter sleeves with buttoned cuffs and roll-up tab feature, gathers at shoulders, short buttoned chest placket, panel at chest with tucks, stitch detail and pleats below, tie-up fastening at chest sides, side slits</p></li><li class="desc-sub-title ">Material &amp; Care</li><li class="desc-sub-text "><p>100% cotton<br/>Hand wash cold</p></li><li class="desc-sub-title">Size &amp; Fit</li><li class="desc-sub-text"><p>The model (height 5'8" and chest 33") is wearing a size S</p></li></ul>,26:02:2014,None
None,Anouk Women Pink Jacquard Kurta,http://www.myntra.com/Kurtas/Anouk/Anouk-Women-Pink-Jacquard-Kurta/203157/buy,Rs. 559,sale-women-clothing,Clothing,Anouk,http://myntra.myntassets.com/images/style/properties/Anouk-Women-Kurtas_a91c534250b03b02ccabc93ef5df9d74_images_1080_1440_mini.JPG,Rs. 799,None,sale,http://www.myntra.com/Kurtas/Anouk/Anouk-Women-Pink-Jacquard-Kurta/203157/buy,Sold byVector Ecommerce Pvt Ltd,None,None,['XS', 'S', 'M', 'L', 'XL', 'XXL'],None,<ul class="mk-pdpv1-product-helper mk-cf"><li class="desc-main-title">Product Description</li><li class="desc-sub-title">Style Note</li><li class="desc-sub-text " itemprop="description"><p>This versatile kurta from Anouk will instantly become your wardrobe favourite with its soft fabric and comfortable fit. Wear it with churidar leggings and Kolhapuri sandals for a chic ethnic look.</p></li><li class="desc-sub-title ">Product Details</li><li class="desc-sub-text"><p>Pink kurta, jacquard weave detailing, round neck with a split V neckline, contrast printed overlay at chest, three quarter sleeves with contrast printed overlay at cuffs, printed overlay at straight vented hem</p></li><li class="desc-sub-title ">Material &amp; Care</li><li class="desc-sub-text "><p>100% cotton<br/>Hand wash</p></li><li class="desc-sub-title">Size &amp; Fit</li><li class="desc-sub-text"><p>The model (height 5'8" and chest 33") is wearing a size S</p></li></ul>,26:02:2014,None
None,Anouk Women Black Kurta,http://www.myntra.com/Kurtas/Anouk/Anouk-Women-Black-Kurta/214544/buy,Rs. 629,sale-women-clothing,Clothing,Anouk,http://myntra.myntassets.com/images/style/properties/Anouk-Women-Kurtas_94d37a614289e29639c50d8bcd9f8470_images_1080_1440_mini.jpg,Rs. 899,None,sale,http://www.myntra.com/Kurtas/Anouk/Anouk-Women-Black-Kurta/214544/buy,Sold byVector Ecommerce Pvt Ltd,None,None,['XS', 'S', 'M', 'L', 'XL', 'XXL'],None,<ul class="mk-pdpv1-product-helper mk-cf"><li class="desc-main-title">Product Description</li><li class="desc-sub-title">Style Note</li><li class="desc-sub-text " itemprop="description"><p>Look your ethnic best in this kurta by Anouk. We recommend, styling this versatile piece with skinny denims or leggings and Kolhapuri sandals for the day.</p></li><li class="desc-sub-title ">Product Details</li><li class="desc-sub-text"><p>Black kurta, woven, has a V neck with contrast taping, mirror work and embroidered detail, three quarter length sleeves with contrast taping at hems, contrast taping along front hem, side slits</p></li><li class="desc-sub-title ">Material &amp; Care</li><li class="desc-sub-text "><p>Cotton<br/>Hand wash cold</p></li><li class="desc-sub-title">Size &amp; Fit</li><li class="desc-sub-text"><p>The model (height 5'8" and chest 33") is wearing a size S</p></li></ul>,26:02:2014,None
None,Anouk Women Off-White Kurta,http://www.myntra.com/Kurtas/Anouk/Anouk-Women-Off-White-Kurta/219743/buy,Rs. 539,sale-women-clothing,Clothing,Anouk,http://myntra.myntassets.com/images/style/properties/Anouk-Women-Off-White-Kurta_cd11fbb1c4055a71fdc14a9b77500f0f_images_1080_1440_mini.jpg,Rs. 899,None,sale,http://www.myntra.com/Kurtas/Anouk/Anouk-Women-Off-White-Kurta/219743/buy,Sold byVector Ecommerce Pvt Ltd,None,None,['S', 'M', 'L', 'XL', 'XXL'],None,<ul class="mk-pdpv1-product-helper mk-cf"><li class="desc-main-title">Product Description</li><li class="desc-sub-title">Style Note</li><li class="desc-sub-text " itemprop="description"><p>For a much adored ethnic look, Anouk presents this kurta. Made with the best of tailoring expertise, this kurta can be highlighted by pairing it with solid churidar leggings and strappy sandals for a complete look or with skinny denims for a casual look.</p></li><li class="desc-sub-title ">Product Details</li><li class="desc-sub-text"><p>Off-white kurta, woven, contrast mandarin collar with slit, three quarter sleeves with contrast taping at cuffs with loops, short mock buttoned chest placket with contrast overlay and piping on either sides, side slits</p></li><li class="desc-sub-title ">Material &amp; Care</li><li class="desc-sub-text "><p>100% cotton<br/>Hand wash cold</p></li><li class="desc-sub-title">Size &amp; Fit</li><li class="desc-sub-text"><p>The model (height 5'8" and chest 33") is wearing a size S</p></li></ul>,26:02:2014,None
None,Anouk Women White Kurta,http://www.myntra.com/Kurtas/Anouk/Anouk-Women-White-Kurta/219783/buy,Rs. 539,sale-women-clothing,Clothing,Anouk,http://myntra.myntassets.com/images/style/properties/Anouk-Women-White-Kurta_08450054ca9ef7433f88e02d39ce74a8_images_1080_1440_mini.jpg,Rs. 899,None,sale,http://www.myntra.com/Kurtas/Anouk/Anouk-Women-White-Kurta/219783/buy,Sold byVector Ecommerce Pvt Ltd,None,None,['S', 'M', 'L', 'XL', 'XXL'],None,<ul class="mk-pdpv1-product-helper mk-cf"><li class="desc-main-title">Product Description</li><li class="desc-sub-title">Style Note</li><li class="desc-sub-text " itemprop="description"><p>For a much adored ethnic look, Anouk presents this kurta. Made with the best of tailoring expertise, this kurta can be highlighted by pairing it with solid churidar leggings and strappy sandals for a complete look or with skinny denims for a casual look.</p></li><li class="desc-sub-title ">Product Details</li><li class="desc-sub-text"><p>White kurta, woven, mandarin collar, three quarter sleeves with buttoned cuffs and roll up button tab feature, slight gathers at shoulders, front yoke with short button placket, stitch detail and tucks below, gathers below front yoke, tie up belt attached at sides, vented hem</p></li><li class="desc-sub-title ">Material &amp; Care</li><li class="desc-sub-text "><p>100% cotton<br/>Hand wash cold</p></li><li class="desc-sub-title">Size &amp; Fit</li><li class="desc-sub-text"><p>Comfort fit<br/>The model (height 5'8" and chest 33") is wearing a size S</p></li></ul>,26:02:2014,None
None,Anouk Women Purple Printed Kurta,http://www.myntra.com/Kurtas/Anouk/Anouk-Women-Purple-Printed-Kurta/193167/buy,Rs. 629,sale-women-clothing,Clothing,Anouk,http://myntra.myntassets.com/images/style/properties/Anouk-Women-Purple-Printed-Kurta_a89e94cd7169f67a63d58736bc3ee41a_images_1080_1440_mini.jpg,Rs. 899,None,sale,http://www.myntra.com/Kurtas/Anouk/Anouk-Women-Purple-Printed-Kurta/193167/buy,Sold byVector Ecommerce Pvt Ltd,None,None,['S', 'M', 'L', 'XL', 'XXL'],None,<ul class="mk-pdpv1-product-helper mk-cf"><li class="desc-main-title">Product Description</li><li class="desc-sub-title">Style Note</li><li class="desc-sub-text " itemprop="description"><p>This versatile kurta from Anouk will instantly become your wardrobe favourite with its soft fabric and comfortable fit. Wear it with churidar leggings and Kolhapuri sandals for the best look.</p></li><li class="desc-sub-title ">Product Details</li><li class="desc-sub-text"><p>Purple kurta, woven, mandarin collar, three quarter sleeves with contrast printed overlay and taping at cuffs, contrast printed overlay with short buttoned placket at chest, vented hem</p></li><li class="desc-sub-title ">Material &amp; Care</li><li class="desc-sub-text "><p>Cotton<br/>Dry clean</p></li><li class="desc-sub-title">Size &amp; Fit</li><li class="desc-sub-text"><p>The model (height 5'8" and chest 33") is wearing a size S</p></li></ul>,26:02:2014,None
None,Anouk Women Purple Embroidered Jacquard Kurta,http://www.myntra.com/Kurtas/Anouk/Anouk-Women-Purple-Embroidered-Jacquard-Kurta/212286/buy,Rs. 559,sale-women-clothing,Clothing,Anouk,http://myntra.myntassets.com/images/style/properties/Anouk-Women-Purple-Embroidered-Jacquard-Kurta_10b64ca1e3e4c86bb60f46396df1813e_images_1080_1440_mini.JPG,Rs. 799,None,sale,http://www.myntra.com/Kurtas/Anouk/Anouk-Women-Purple-Embroidered-Jacquard-Kurta/212286/buy,Sold byVector Ecommerce Pvt Ltd,None,None,['XS', 'S', 'M', 'L', 'XL', 'XXL'],None,<ul class="mk-pdpv1-product-helper mk-cf"><li class="desc-main-title">Product Description</li><li class="desc-sub-title">Style Note</li><li class="desc-sub-text " itemprop="description"><p>This versatile kurta from Anouk will instantly become your wardrobe favourite with its soft fabric and comfortable fit. Wear it with churidar leggings and Kolhapuri sandals for a chic ethnic look.</p></li><li class="desc-sub-title ">Product Details</li><li class="desc-sub-text"><p>Purple kurta in a jacquard weave, notched round neck, three quarter sleeves, contrast embroidery at chest, side slits</p></li><li class="desc-sub-title ">Material &amp; Care</li><li class="desc-sub-text "><p>100% cotton<br/>Hand wash cold</p></li><li class="desc-sub-title">Size &amp; Fit</li><li class="desc-sub-text"><p>Comfort fit<br/>The model (height 5'8" and chest 33") is wearing a size S</p></li></ul>,26:02:2014,None
None,Anouk Women Red Printed Kurta,http://www.myntra.com/Kurtas/Anouk/Anouk-Women-Red-Printed-Kurta/219740/buy,Rs. 539,sale-women-clothing,Clothing,Anouk,http://myntra.myntassets.com/images/style/properties/Anouk-Women-Red-Printed-Kurta_9cf2c7d987c2bfe0197d7b94f628b143_images_1080_1440_mini.JPG,Rs. 899,None,sale,http://www.myntra.com/Kurtas/Anouk/Anouk-Women-Red-Printed-Kurta/219740/buy,Sold byVector Ecommerce Pvt Ltd,None,None,['S', 'M', 'L', 'XL', 'XXL'],None,<ul class="mk-pdpv1-product-helper mk-cf"><li class="desc-main-title">Product Description</li><li class="desc-sub-title">Style Note</li><li class="desc-sub-text " itemprop="description"><p>For a much adored ethnic look, Anouk presents this kurta. Made with the best of tailoring expertise, this kurta can be highlighted by pairing it with solid churidar leggings and strappy sandals for a complete look or with skinny denims for a casual look.</p></li><li class="desc-sub-title ">Product Details</li><li class="desc-sub-text"><p>Red and black printed kurta, woven, mandarin collar with a slit below, three quarter length sleeves with contrast taping at hems, short mock buttoned chest placket with contrast embroidered overlay and taping on either side, side slits, contrast taping along front hem</p></li><li class="desc-sub-title ">Material &amp; Care</li><li class="desc-sub-text "><p>100% cotton<br/>Hand wash cold</p></li><li class="desc-sub-title">Size &amp; Fit</li><li class="desc-sub-text"><p>The model (height 5'8" and chest 33") is wearing a size S</p></li></ul>,26:02:2014,None
None,Anouk Women Pink & Purple Kurta,http://www.myntra.com/Kurtas/Anouk/Anouk-Women-Pink-&-Purple-Kurta/203317/buy,Rs. 539,sale-women-clothing,Clothing,Anouk,http://myntra.myntassets.com/images/style/properties/Anouk-Women-Red-&-Purple-Kurta_4d72d7cf5bf10bc515a5ff6e1f8569fa_images_1080_1440_mini.jpg,Rs. 899,None,sale,http://www.myntra.com/Kurtas/Anouk/Anouk-Women-Pink-&-Purple-Kurta/203317/buy,Sold byVector Ecommerce Pvt Ltd,None,None,['XS', 'S', 'M', 'L', 'XL', 'XXL'],None,<ul class="mk-pdpv1-product-helper mk-cf"><li class="desc-main-title">Product Description</li><li class="desc-sub-title">Style Note</li><li class="desc-sub-text " itemprop="description"><p>For a much adored ethnic look, Anouk presents this kurta. Made with the best of tailoring expertise, this kurta can be highlighted by pairing it with solid churidar leggings and strappy sandals for a complete look or with skinny denims for a casual look.</p></li><li class="desc-sub-title ">Product Details</li><li class="desc-sub-text"><p>Pink and purple kurta in a textured weave, contrast printed mandarin collar, three quarter sleeves with contrast printed taping at hems, short buttoned chest placket with contrast printed overlays and tucks on either side, side slits</p></li><li class="desc-sub-title ">Material &amp; Care</li><li class="desc-sub-text "><p>100% cotton<br/>Hand wash cold</p></li><li class="desc-sub-title">Size &amp; Fit</li><li class="desc-sub-text"><p>The model (height 5'8" and chest 33") is wearing a size S</p></li></ul>,26:02:2014,None
