None,Anouk Women Red Jacquard Kurta,http://www.myntra.com/Kurtas/Anouk/Anouk-Women-Red-Jacquard-Kurta/203152/buy,Rs. 559,sale-women-clothing,Clothing,Anouk,http://myntra.myntassets.com/images/style/properties/Anouk-Women-Kurtas_c67591e572a5de677a32f83fcdf31f57_images_1080_1440_mini.jpg,Rs. 799,None,sale,http://www.myntra.com/Kurtas/Anouk/Anouk-Women-Red-Jacquard-Kurta/203152/buy,Sold byVector Ecommerce Pvt Ltd,None,None,['XS', 'S', 'M', 'L', 'XL', 'XXL'],None,<ul class="mk-pdpv1-product-helper mk-cf"><li class="desc-main-title">Product Description</li><li class="desc-sub-title">Style Note</li><li class="desc-sub-text " itemprop="description"><p>Look your ethnic best in this kurta by Anouk. We recommend, styling this versatile piece with skinny denims or leggings and Kolhapuri sandals for the day.</p></li><li class="desc-sub-title ">Product Details</li><li class="desc-sub-text"><p>Red kurta, has jacquard weave design, a spread collar with contrast taping at the inside, short sleeves with contrast button tab detailing, short button placket at chest with contrast buttons and loop, curved vented hem</p></li><li class="desc-sub-title ">Material &amp; Care</li><li class="desc-sub-text "><p>100% cotton<br/>Hand wash cold</p></li><li class="desc-sub-title">Size &amp; Fit</li><li class="desc-sub-text"><p>The model (height 5'8" and chest 33") is wearing a size S</p></li></ul>,26:02:2014,None
None,Anouk Women Blue Jacquard Kurta,http://www.myntra.com/Kurtas/Anouk/Anouk-Women-Blue-Jacquard-Kurta/203149/buy,Rs. 559,sale-women-clothing,Clothing,Anouk,http://myntra.myntassets.com/images/style/properties/Anouk-Women-Kurtas_1e9d9f78c991f392990d0eb32a61689c_images_1080_1440_mini.jpg,Rs. 799,None,sale,http://www.myntra.com/Kurtas/Anouk/Anouk-Women-Blue-Jacquard-Kurta/203149/buy,Sold byVector Ecommerce Pvt Ltd,None,None,['XS', 'S', 'M', 'L', 'XL', 'XXL'],None,<ul class="mk-pdpv1-product-helper mk-cf"><li class="desc-main-title">Product Description</li><li class="desc-sub-title">Style Note</li><li class="desc-sub-text " itemprop="description"><p>Look your ethnic best in this kurta by Anouk. We recommend, styling this versatile piece with skinny denims or leggings and Kolhapuri sandals for the day.</p></li><li class="desc-sub-title ">Product Details</li><li class="desc-sub-text"><p>Blue kurta, has jacquard weave design, a spread collar with contrast taping at the inside, short sleeves with contrast button tab detailing, short button placket at chest with contrast buttons and loop, curved vented hem</p></li><li class="desc-sub-title ">Material &amp; Care</li><li class="desc-sub-text "><p>100% cotton<br/>Hand wash cold</p></li><li class="desc-sub-title">Size &amp; Fit</li><li class="desc-sub-text"><p>The model (height 5'8" and chest 33") is wearing a size S</p></li></ul>,26:02:2014,None
None,Anouk Women Blue Kurta,http://www.myntra.com/Kurtas/Anouk/Anouk-Women-Blue-Kurta/219767/buy,Rs. 539,sale-women-clothing,Clothing,Anouk,http://myntra.myntassets.com/images/style/properties/Anouk-Women-Blue-Kurta_68f0358db8757188ca19ac645d103ba3_images_1080_1440_mini.jpg,Rs. 899,None,sale,http://www.myntra.com/Kurtas/Anouk/Anouk-Women-Blue-Kurta/219767/buy,Sold byVector Ecommerce Pvt Ltd,None,None,['S', 'M', 'L', 'XL', 'XXL'],None,<ul class="mk-pdpv1-product-helper mk-cf"><li class="desc-main-title">Product Description</li><li class="desc-sub-title">Style Note</li><li class="desc-sub-text " itemprop="description"><p>For a much adored ethnic look, Anouk presents this kurta. Made with the best of tailoring expertise, this kurta can be highlighted by pairing it with solid churidar leggings and strappy sandals for a complete look or with skinny denims for a casual look.</p></li><li class="desc-sub-title ">Product Details</li><li class="desc-sub-text"><p>Blue kurta, woven, mandarin collar with slit, three quarter sleeves with roll-up tab feature, short mock buttoned chest placket with contrast stitch detail, princess panels, side slits, curved hem</p></li><li class="desc-sub-title ">Material &amp; Care</li><li class="desc-sub-text "><p>100% cotton<br/>Hand wash cold</p></li><li class="desc-sub-title">Size &amp; Fit</li><li class="desc-sub-text"><p>The model (height 5'8" and chest 33") is wearing a size S</p></li></ul>,26:02:2014,None
None,Anouk Women Charcoal Grey Kurta,http://www.myntra.com/Kurtas/Anouk/Anouk-Women-Charcoal-Grey-Kurta/219779/buy,Rs. 539,sale-women-clothing,Clothing,Anouk,http://myntra.myntassets.com/images/style/properties/Anouk-Women-Charcoal-Grey-Kurta_4a36290002fc032c26ac2e8180e1ff38_images_1080_1440_mini.jpg,Rs. 899,None,sale,http://www.myntra.com/Kurtas/Anouk/Anouk-Women-Charcoal-Grey-Kurta/219779/buy,Sold byVector Ecommerce Pvt Ltd,None,None,['S', 'M', 'L', 'XL', 'XXL'],None,<ul class="mk-pdpv1-product-helper mk-cf"><li class="desc-main-title">Product Description</li><li class="desc-sub-title">Style Note</li><li class="desc-sub-text " itemprop="description"><p>For a much adored ethnic look, Anouk presents this kurta. Made with the best of tailoring expertise, this kurta can be highlighted by pairing it with solid churidar leggings and strappy sandals for a complete look or with skinny denims for a casual look.</p></li><li class="desc-sub-title ">Product Details</li><li class="desc-sub-text"><p>Charcoal grey kurta, woven, mandarin collar with slit, three quarter sleeves with buttoned cuffs and roll-up tab feature, gathers at shoulders, short buttoned chest placket, panel at chest with tucks, stitch detail and pleats below, tie-up fastening at chest sides, side slits</p></li><li class="desc-sub-title ">Material &amp; Care</li><li class="desc-sub-text "><p>100% cotton<br/>Hand wash cold</p></li><li class="desc-sub-title">Size &amp; Fit</li><li class="desc-sub-text"><p>The model (height 5'8" and chest 33") is wearing a size S</p></li></ul>,26:02:2014,None
None,Anouk Women Yellow Kurta,http://www.myntra.com/Kurtas/Anouk/Anouk-Women-Yellow-Kurta/210134/buy,Rs. 559,sale-women-clothing,Clothing,Anouk,http://myntra.myntassets.com/images/style/properties/Anouk-Women-Kurtas_4b0eb507777f41c6d21dc878b1d01403_images_1080_1440.jpg,Rs. 799,None,sale,http://www.myntra.com/Kurtas/Anouk/Anouk-Women-Yellow-Kurta/210134/buy,Sold byVector Ecommerce Pvt Ltd,None,None,['XS', 'S', 'M', 'L', 'XL', 'XXL'],None,<ul class="mk-pdpv1-product-helper mk-cf"><li class="desc-main-title">Product Description</li><li class="desc-sub-title">Style Note</li><li class="desc-sub-text " itemprop="description"><p>Look your ethnic best in this kurta by Anouk. We recommend, styling this versatile piece with skinny denims or leggings and Kolhapuri sandals for the day.</p></li><li class="desc-sub-title ">Product Details</li><li class="desc-sub-text"><p>Orangish yellow kurta, has a round neck with notch and sequin detailing along the neckline, three quarter sleeves with contrast taping at cuffs, panels at sides with tuck detailing, contrast printed taping at hem, side slits</p></li><li class="desc-sub-title ">Material &amp; Care</li><li class="desc-sub-text "><p>100% cotton<br/>Hand wash cold</p></li><li class="desc-sub-title">Size &amp; Fit</li><li class="desc-sub-text"><p>The model (height 5'8" and chest 33") is wearing a size S</p></li></ul>,26:02:2014,None
None,Anouk Women Pink & Red Printed Kurta,http://www.myntra.com/Kurtas/Anouk/Anouk-Women-Pink-&-Red-Printed-Kurta/211763/buy,Rs. 359,sale-women-clothing,Clothing,Anouk,http://myntra.myntassets.com/images/style/properties/Anouk-Women-Pink-&-Red-Printed-Kurta_082086075dbf6c6d619045bfb7ccf2e9_images_1080_1440_mini.jpg,Rs. 599,None,sale,http://www.myntra.com/Kurtas/Anouk/Anouk-Women-Pink-&-Red-Printed-Kurta/211763/buy,Sold byVector Ecommerce Pvt Ltd,None,None,['XS', 'S', 'M', 'L', 'XL', 'XXL'],None,<ul class="mk-pdpv1-product-helper mk-cf"><li class="desc-main-title">Product Description</li><li class="desc-sub-title">Style Note</li><li class="desc-sub-text " itemprop="description"><p>This versatile kurta from Anouk will instantly become your wardrobe favourite with its soft fabric and comfortable fit. Wear it with leggings or Patiala pants and Kolhapuri sandals for a chic ethnic look.</p></li><li class="desc-sub-title ">Product Details</li><li class="desc-sub-text"><p>Pink and red printed kurta, woven, contrast taping along round neck, three quarter sleeves with contrast taping at hems, contrast short mock buttoned chest placket, side slits</p></li><li class="desc-sub-title ">Material &amp; Care</li><li class="desc-sub-text "><p>100% cotton<br/>Hand wash cold</p></li><li class="desc-sub-title">Size &amp; Fit</li><li class="desc-sub-text"><p>The model (height 5'8" and chest 33") is wearing a size S</p></li></ul>,26:02:2014,None
None,Anouk Women Orange Kurta,http://www.myntra.com/Kurtas/Anouk/Anouk-Women-Orange-Kurta/219733/buy,Rs. 539,sale-women-clothing,Clothing,Anouk,http://myntra.myntassets.com/images/style/properties/Anouk-Women-Orange-Kurta_0be4cb414012f3dd3780b546a260abfc_images_1080_1440_mini.jpg,Rs. 899,None,sale,http://www.myntra.com/Kurtas/Anouk/Anouk-Women-Orange-Kurta/219733/buy,Sold byVector Ecommerce Pvt Ltd,None,None,['S', 'M', 'L', 'XL', 'XXL'],None,<ul class="mk-pdpv1-product-helper mk-cf"><li class="desc-main-title">Product Description</li><li class="desc-sub-title">Style Note</li><li class="desc-sub-text " itemprop="description"><p>For a much adored ethnic look, Anouk presents this kurta. Made with the best of tailoring expertise, this kurta can be highlighted by pairing it with solid churidar leggings and strappy sandals for a complete look or with skinny denims for a casual look.</p></li><li class="desc-sub-title ">Product Details</li><li class="desc-sub-text"><p>Orange kurta, woven, mandarin collar with slit, three quarter sleeves with contrast panel at upturned cuffs and tab detail, button detail and tucks at chest, contrast embroidered panel and taping at front hem, side slits</p></li><li class="desc-sub-title ">Material &amp; Care</li><li class="desc-sub-text "><p>100% cotton<br/>Hand wash cold</p></li><li class="desc-sub-title">Size &amp; Fit</li><li class="desc-sub-text"><p>Comfort fit<br/>The model (height 5'8" and chest 33") is wearing a size S</p></li></ul>,26:02:2014,None
None,Anouk Women Blue & White Printed Kurta,http://www.myntra.com/Kurtas/Anouk/Anouk-Women-Blue-&-White-Printed-Kurta/210412/buy,Rs. 594,sale-women-clothing,Clothing,Anouk,http://myntra.myntassets.com/images/style/properties/Anouk-Women-Kurtas_754a09ca8c4e29167a5352109d28aff1_images_1080_1440.JPG,Rs. 849,None,sale,http://www.myntra.com/Kurtas/Anouk/Anouk-Women-Blue-&-White-Printed-Kurta/210412/buy,Sold byVector Ecommerce Pvt Ltd,None,None,['XS', 'S', 'M', 'L', 'XL', 'XXL'],None,<ul class="mk-pdpv1-product-helper mk-cf"><li class="desc-main-title">Product Description</li><li class="desc-sub-title">Style Note</li><li class="desc-sub-text " itemprop="description"><p>This versatile kurta from Anouk will instantly become your wardrobe favourite with its soft fabric and comfortable fit. Wear it with churidar leggings or harem pants and Kolhapuri sandals for a chic ethnic look.</p></li><li class="desc-sub-title ">Product Details</li><li class="desc-sub-text"><p>Blue and white printed kurta, woven, contrast taping along stylised square neck with mock cross-over detail and panel, three quarter sleeves with contrast taping at hems, contrast mock tie-up detail at left waist with sequinned pom-poms at ends, side slits</p></li><li class="desc-sub-title ">Material &amp; Care</li><li class="desc-sub-text "><p>100% cotton<br/>Hand wash cold<br/>Natural indigo dyes have been used on this product, colour will bleed during initial washes. Hand wash separately or with darker colours, dry inside out.</p></li><li class="desc-sub-title">Size &amp; Fit</li><li class="desc-sub-text"><p>The model (height 5'8" and chest 33") is wearing a size S</p></li></ul>,26:02:2014,None
None,Anouk Women Pink Kurta,http://www.myntra.com/Kurtas/Anouk/Anouk-Women-Pink-Kurta/210135/buy,Rs. 559,sale-women-clothing,Clothing,Anouk,http://myntra.myntassets.com/images/style/properties/Anouk-Women-Kurtas_93cf21fccd69f4756693ddd3ee2ce3c7_images_1080_1440_mini.jpg,Rs. 799,None,sale,http://www.myntra.com/Kurtas/Anouk/Anouk-Women-Pink-Kurta/210135/buy,Sold byVector Ecommerce Pvt Ltd,None,None,['XS', 'S', 'M', 'L', 'XL', 'XXL'],None,<ul class="mk-pdpv1-product-helper mk-cf"><li class="desc-main-title">Product Description</li><li class="desc-sub-title">Style Note</li><li class="desc-sub-text " itemprop="description"><p>Look your ethnic best in this kurta by Anouk. We recommend, styling this versatile piece with skinny denims or leggings and Kolhapuri sandals for the day.</p></li><li class="desc-sub-title ">Product Details</li><li class="desc-sub-text"><p>Pink kurta, has round neck with notch and sequin detailing along the neckline, three quarter sleeves with contrast taping at cuffs, panels at sides with tuck detailing, contrast printed taping at hem, side slits</p></li><li class="desc-sub-title ">Material &amp; Care</li><li class="desc-sub-text "><p>100% cotton<br/>Hand wash cold</p></li><li class="desc-sub-title">Size &amp; Fit</li><li class="desc-sub-text"><p>The model (height 5'8" and chest 33") is wearing a size S</p></li></ul>,26:02:2014,None
None,Anouk Women White & Blue Printed Churidar Kurta Set,http://www.myntra.com/Churidar-Kurta/Anouk/Anouk-Women-White-&-Blue-Printed-Churidar-Kurta-Set/207989/buy,Rs. 1,199,sale-women-clothing,Clothing,Anouk,http://myntra.myntassets.com/images/style/properties/Anouk-Women-Salwar-Suit_f1d198d72ca69415dde3e34089868de9_images_1080_1440_mini.JPG,Rs. 1,999,None,sale,http://www.myntra.com/Churidar-Kurta/Anouk/Anouk-Women-White-&-Blue-Printed-Churidar-Kurta-Set/207989/buy,Sold byVector Ecommerce Pvt Ltd,None,None,['XS', 'S', 'M', 'L', 'XL'],None,<ul class="mk-pdpv1-product-helper mk-cf"><li class="desc-main-title">Product Description</li><li class="desc-sub-title">Style Note</li><li class="desc-sub-text " itemprop="description"><p>For a much adored Indian look, Anouk presents this churidar kurta set. Made with the best of tailoring expertise, this set can be highlighted by pairing it with tonal heels and jewellery.</p></li><li class="desc-sub-title ">Product Details</li><li class="desc-sub-text"><p>White and blue churidar kurta set<br/>White kurta with blue and green prints, woven, contrast binding along round neck with a slit below, contrast taping at chest, three quarter length sleeves with contrast taping at hems, contrast taping and print at hem, side slits<br/>Blue woven churidar pants, has drawstring fastening, tapered legs<br/>Blue crushed dupatta</p></li><li class="desc-sub-title ">Material &amp; Care</li><li class="desc-sub-text "><p>100% cotton<br/>Hand wash cold</p></li><li class="desc-sub-title">Size &amp; Fit</li><li class="desc-sub-text"><p>Dupatta length: 216 cm<br/>Dupatta width: 115 cm<br/>The model (height 5'8", chest 33" and waist 28") is wearing a size S</p></li></ul>,26:02:2014,None
None,Anouk Women Off-White & Burgundy Printed Churidar Kurta Set,http://www.myntra.com/Salwar-Suit/Anouk/Anouk-Women-Off-White-&-Burgundy-Printed-Churidar-Kurta-Set/207990/buy,Rs. 1,399,sale-women-clothing,Clothing,Anouk,http://myntra.myntassets.com/images/style/properties/Anouk-Women-Off-White-&-Burgundy-Printed-Churidar-Kurta-Set_85c0881da27b24ca07656d323b7c2fe8_images_1080_1440_mini.jpg,Rs. 1,999,None,sale,http://www.myntra.com/Salwar-Suit/Anouk/Anouk-Women-Off-White-&-Burgundy-Printed-Churidar-Kurta-Set/207990/buy,Sold byVector Ecommerce Pvt Ltd,None,None,['XS', 'S', 'M', 'L', 'XL'],None,<ul class="mk-pdpv1-product-helper mk-cf"><li class="desc-main-title">Product Description</li><li class="desc-sub-title">Style Note</li><li class="desc-sub-text " itemprop="description"><p>Desi elegance at its best - Anouk brings you a gorgeous range of churidar kurta sets to up the sartorial credibility of your ethnic repertoire. Pair this set with silver jhumkas and Kolhapuri sandals.</p></li><li class="desc-sub-title ">Product Details</li><li class="desc-sub-text"><p>Off-white and burgundy churidar and kurta set<br/>Off-white kurta with mustard yellow, pink and green prints, woven, contrast binding along round neck with a slit below, contrast taping at chest, three quarter length sleeves with contrast overlay at hems, contrast taping print at hem, side slits<br/>Burgundy woven churidar pants, has drawstring fastening, tapered legs<br/>Burgundy and brown crushed dupatta, has ombre dyed effect<br/>Comes with a cloth bag</p></li><li class="desc-sub-title ">Material &amp; Care</li><li class="desc-sub-text "><p>100% cotton<br/>Hand wash cold</p></li><li class="desc-sub-title">Size &amp; Fit</li><li class="desc-sub-text"><p>Dupatta length: 216 cm<br/>Dupatta width: 115 cm<br/>The model (height 5'8" and chest 33") is wearing a size S</p></li></ul>,26:02:2014,None
None,Anouk Women Pink Kurta,http://www.myntra.com/Kurtas/Anouk/Anouk-Women-Pink-Kurta/210136/buy,Rs. 359,sale-women-clothing,Clothing,Anouk,http://myntra.myntassets.com/images/style/properties/Anouk-Women-Kurtas_85421347bca4d6f581e7370a43e05858_images_1080_1440_mini.jpg,Rs. 599,None,sale,http://www.myntra.com/Kurtas/Anouk/Anouk-Women-Pink-Kurta/210136/buy,Sold byVector Ecommerce Pvt Ltd,None,None,['XS', 'S', 'M', 'L', 'XL', 'XXL'],None,<ul class="mk-pdpv1-product-helper mk-cf"><li class="desc-main-title">Product Description</li><li class="desc-sub-title">Style Note</li><li class="desc-sub-text " itemprop="description"><p>Look your ethnic best in this kurta by Anouk. We recommend, styling this versatile piece with skinny denims or leggings and Kolhapuri sandals for the day.</p></li><li class="desc-sub-title ">Product Details</li><li class="desc-sub-text"><p>Pink kurta, has a mandarin collar with notch with sequin detailing, three quarter sleeves with contrast taping at cuffs, contrast printed yoke at chest, contrast taping at hem, side slits</p></li><li class="desc-sub-title ">Material &amp; Care</li><li class="desc-sub-text "><p>100% cotton<br/>Hand wash cold</p></li><li class="desc-sub-title">Size &amp; Fit</li><li class="desc-sub-text"><p>The model (height 5'8" and chest 33") is wearing a size S</p></li></ul>,26:02:2014,None
None,Anouk Women Pink Printed Kurti,http://www.myntra.com/Kurtis/Anouk/Anouk-Women-Pink-Printed-Kurti/214062/buy,Rs. 419,sale-women-clothing,Clothing,Anouk,http://myntra.myntassets.com/images/style/properties/Anouk-Women-Pink-Printed-Kurti_5f323fc279a1f6e23e3cf7a4e04d5bf4_images_1080_1440_mini.jpg,Rs. 699,None,sale,http://www.myntra.com/Kurtis/Anouk/Anouk-Women-Pink-Printed-Kurti/214062/buy,Sold byVector Ecommerce Pvt Ltd,None,None,['XS', 'S', 'M', 'L', 'XL', 'XXL'],None,<ul class="mk-pdpv1-product-helper mk-cf"><li class="desc-main-title">Product Description</li><li class="desc-sub-title">Style Note</li><li class="desc-sub-text " itemprop="description"><p>For a much adored ethnic look, Anouk presents this kurti. Made with the best of tailoring expertise, this kurti can be highlighted by pairing it with solid churidar leggings and strappy sandals for a complete look or with skinny denims for a casual look.</p></li><li class="desc-sub-title ">Product Details</li><li class="desc-sub-text"><p>Pink printed kurti, taping at mandarin collar with slit, three quarter sleeves with zari embroidered taping at cuffs, zari embroidered taping at chest, vented hem</p></li><li class="desc-sub-title ">Material &amp; Care</li><li class="desc-sub-text "><p>100% cotton<br/>Hand wash cold</p></li><li class="desc-sub-title">Size &amp; Fit</li><li class="desc-sub-text"><p>The model (height 5'8" and chest 33") is wearing a size S</p></li></ul>,26:02:2014,None
None,Anouk Women Rust Orange Kurta,http://www.myntra.com/Kurtas/Anouk/Anouk-Women-Rust-Orange-Kurta/203313/buy,Rs. 539,sale-women-clothing,Clothing,Anouk,http://myntra.myntassets.com/images/style/properties/Anouk-Women-Rust-Orange-Kurta_8cfdef7cfdb06251d7d6c3e517d91fb7_images_1080_1440_mini.JPG,Rs. 899,None,sale,http://www.myntra.com/Kurtas/Anouk/Anouk-Women-Rust-Orange-Kurta/203313/buy,Sold byVector Ecommerce Pvt Ltd,None,None,['XS', 'S', 'M', 'L', 'XL', 'XXL'],None,<ul class="mk-pdpv1-product-helper mk-cf"><li class="desc-main-title">Product Description</li><li class="desc-sub-title">Style Note</li><li class="desc-sub-text " itemprop="description"><p>For a much adored ethnic look, Anouk presents this kurta. Made with the best of tailoring expertise, this kurta can be highlighted by pairing it with solid churidar leggings and strappy sandals for a complete look or with skinny denims for a casual look.</p></li><li class="desc-sub-title ">Product Details</li><li class="desc-sub-text"><p>Rust orange kurta, has a patterned weave, contrast printed mandarin collar, three quarter length sleeves with contrast printed taping at hems, contrast printed taping along short buttoned chest placket, pin tucks at either side of the placket, side slits</p></li><li class="desc-sub-title ">Material &amp; Care</li><li class="desc-sub-text "><p>100% cotton<br/>Hand wash cold</p></li><li class="desc-sub-title">Size &amp; Fit</li><li class="desc-sub-text"><p>The model (height 5'8" and chest 33") is wearing a size S</p></li></ul>,26:02:2014,None
None,Anouk Women Red Printed Kurta,http://www.myntra.com/Kurtas/Anouk/Anouk-Women-Red-Printed-Kurta/212970/buy,Rs. 419,sale-women-clothing,Clothing,Anouk,http://myntra.myntassets.com/images/style/properties/Anouk-Women-Red-Printed-Kurta_92ddbc48c9c39b022be18bb077adb171_images_1080_1440_mini.jpg,Rs. 699,None,sale,http://www.myntra.com/Kurtas/Anouk/Anouk-Women-Red-Printed-Kurta/212970/buy,Sold byVector Ecommerce Pvt Ltd,None,None,['XS', 'S', 'M', 'L', 'XL', 'XXL'],None,<ul class="mk-pdpv1-product-helper mk-cf"><li class="desc-main-title">Product Description</li><li class="desc-sub-title">Style Note</li><li class="desc-sub-text " itemprop="description"><p>For a much adored ethnic look, Anouk presents this kurta. Made with the best of tailoring expertise, this kurta can be highlighted by pairing it with solid churidar leggings and strappy sandals for a complete look or with skinny denims for a casual look.</p></li><li class="desc-sub-title ">Product Details</li><li class="desc-sub-text"><p>Red printed kurta in a patterned weave, mandarin collar with slit and an insert panel below, contrast taping with metallic stitched detail below neck, contrast printed chest panel, three quarter sleeves with contrast taping with metallic stitched detail along cuffs, contrast taping with metallic stitched detail and a contrast printed overlay along hem, side slits</p></li><li class="desc-sub-title ">Material &amp; Care</li><li class="desc-sub-text "><p>100% cotton<br/>Hand wash cold</p></li><li class="desc-sub-title">Size &amp; Fit</li><li class="desc-sub-text"><p>The model (height 5'8" and chest 33") is wearing a size S</p></li></ul>,26:02:2014,None
None,Anouk Women Black Embroidered Kurta,http://www.myntra.com/Kurtas/Anouk/Anouk-Women-Black-Embroidered-Kurta/214542/buy,Rs. 659,sale-women-clothing,Clothing,Anouk,http://myntra.myntassets.com/images/style/properties/Anouk-Women-Kurtas_f9b57f26e7d70e33390bea3939ae2d86_images_1080_1440_mini.jpg,Rs. 1,099,None,sale,http://www.myntra.com/Kurtas/Anouk/Anouk-Women-Black-Embroidered-Kurta/214542/buy,Sold byVector Ecommerce Pvt Ltd,None,None,['XS', 'S', 'M', 'L', 'XL', 'XXL'],None,<ul class="mk-pdpv1-product-helper mk-cf"><li class="desc-main-title">Product Description</li><li class="desc-sub-title">Style Note</li><li class="desc-sub-text " itemprop="description"><p>Look your ethnic best in this kurta by Anouk. We recommend, styling this versatile piece with skinny denims or leggings and Kolhapuri sandals for the day.</p></li><li class="desc-sub-title ">Product Details</li><li class="desc-sub-text"><p>Black kurta, woven, has a mandarin collar with contrast piping, three quarter length sleeves with contrast taping at hems, contrast concealed hook-and-eye closure at chest with mock buttoned outer, embroidered detail at chest, contrast taping along front hem, side slits</p></li><li class="desc-sub-title ">Material &amp; Care</li><li class="desc-sub-text "><p>Cotton<br/>Hand wash cold</p></li><li class="desc-sub-title">Size &amp; Fit</li><li class="desc-sub-text"><p>The model (height 5'8" and chest 33") is wearing a size S</p></li></ul>,26:02:2014,None
None,Anouk Women Off-White Dobby Weave Kurta,http://www.myntra.com/Kurtas/Anouk/Anouk-Women-Off-White-Dobby-Weave-Kurta/219776/buy,Rs. 539,sale-women-clothing,Clothing,Anouk,http://myntra.myntassets.com/images/style/properties/Anouk-Women-Off-White-Kurta_9771e0c84e3621847db2ddd96cbf9a19_images_1080_1440_mini.jpg,Rs. 899,None,sale,http://www.myntra.com/Kurtas/Anouk/Anouk-Women-Off-White-Dobby-Weave-Kurta/219776/buy,Sold byVector Ecommerce Pvt Ltd,None,None,['S', 'M', 'L', 'XL', 'XXL'],None,<ul class="mk-pdpv1-product-helper mk-cf"><li class="desc-main-title">Product Description</li><li class="desc-sub-title">Style Note</li><li class="desc-sub-text " itemprop="description"><p>For a much adored ethnic look, Anouk presents this kurta. Made with the best of tailoring expertise, this kurta can be highlighted by pairing it with solid churidar leggings or contrast harem pants and strappy sandals for a complete look.</p></li><li class="desc-sub-title ">Product Details</li><li class="desc-sub-text"><p>Off-white kurta, dobby weave, contrast embroidery along round neck at front, sleeveless, short mock buttoned chest placket with stitch detail, side slits, contrast taping along front hem</p></li><li class="desc-sub-title ">Material &amp; Care</li><li class="desc-sub-text "><p>100% cotton<br/>Hand wash cold</p></li><li class="desc-sub-title">Size &amp; Fit</li><li class="desc-sub-text"><p>The model (height 5'8" and chest 33") is wearing a size S</p></li></ul>,26:02:2014,None
