None,Anouk Women Olive Green Kurta,http://www.myntra.com/Kurtas/Anouk/Anouk-Women-Olive-Green-Kurta/219784/buy,Rs. 539,sale-women-clothing,Clothing,Anouk,http://myntra.myntassets.com/images/style/properties/Anouk-Women-Olive-Green-Kurta_c1d5d628cf7d4a5f4859d6c8e5c8ff3d_images_1080_1440_mini.jpg,Rs. 899,None,sale,http://www.myntra.com/Kurtas/Anouk/Anouk-Women-Olive-Green-Kurta/219784/buy,Sold byVector Ecommerce Pvt Ltd,None,None,['S', 'M', 'L', 'XL', 'XXL'],None,<ul class="mk-pdpv1-product-helper mk-cf"><li class="desc-main-title">Product Description</li><li class="desc-sub-title">Style Note</li><li class="desc-sub-text " itemprop="description"><p>For a much adored ethnic look, Anouk presents this kurta. Made with the best of tailoring expertise, this kurta can be highlighted by pairing it with solid churidar leggings and strappy sandals for a complete look or with skinny denims for a casual look.</p></li><li class="desc-sub-title ">Product Details</li><li class="desc-sub-text"><p>Olive green kurta, woven, mandarin collar with slit, three quarter sleeves with buttoned cuffs and roll-up tab feature, gathers at shoulders, short buttoned chest placket, panel at chest with tucks, stitch detail and pleats below, tie-up fastening at chest sides, side slits</p></li><li class="desc-sub-title ">Material &amp; Care</li><li class="desc-sub-text "><p>100% cotton<br/>Hand wash cold</p></li><li class="desc-sub-title">Size &amp; Fit</li><li class="desc-sub-text"><p>The model (height 5'8" and chest 33") is wearing a size S</p></li></ul>,26:02:2014,None
None,Anouk Women Pink & Purple Kurta,http://www.myntra.com/Kurtas/Anouk/Anouk-Women-Pink-&-Purple-Kurta/203317/buy,Rs. 539,sale-women-clothing,Clothing,Anouk,http://myntra.myntassets.com/images/style/properties/Anouk-Women-Red-&-Purple-Kurta_4d72d7cf5bf10bc515a5ff6e1f8569fa_images_1080_1440_mini.jpg,Rs. 899,None,sale,http://www.myntra.com/Kurtas/Anouk/Anouk-Women-Pink-&-Purple-Kurta/203317/buy,Sold byVector Ecommerce Pvt Ltd,None,None,['XS', 'S', 'M', 'L', 'XL', 'XXL'],None,<ul class="mk-pdpv1-product-helper mk-cf"><li class="desc-main-title">Product Description</li><li class="desc-sub-title">Style Note</li><li class="desc-sub-text " itemprop="description"><p>For a much adored ethnic look, Anouk presents this kurta. Made with the best of tailoring expertise, this kurta can be highlighted by pairing it with solid churidar leggings and strappy sandals for a complete look or with skinny denims for a casual look.</p></li><li class="desc-sub-title ">Product Details</li><li class="desc-sub-text"><p>Pink and purple kurta in a textured weave, contrast printed mandarin collar, three quarter sleeves with contrast printed taping at hems, short buttoned chest placket with contrast printed overlays and tucks on either side, side slits</p></li><li class="desc-sub-title ">Material &amp; Care</li><li class="desc-sub-text "><p>100% cotton<br/>Hand wash cold</p></li><li class="desc-sub-title">Size &amp; Fit</li><li class="desc-sub-text"><p>The model (height 5'8" and chest 33") is wearing a size S</p></li></ul>,26:02:2014,None
None,Anouk Women Blue Kurta,http://www.myntra.com/Kurtas/Anouk/Anouk-Women-Blue-Kurta/219735/buy,Rs. 539,sale-women-clothing,Clothing,Anouk,http://myntra.myntassets.com/images/style/properties/Anouk-Women-Blue-Kurta_205baf90bbaa5fb29de6947d2bc59a54_images_1080_1440_mini.jpg,Rs. 899,None,sale,http://www.myntra.com/Kurtas/Anouk/Anouk-Women-Blue-Kurta/219735/buy,Sold byVector Ecommerce Pvt Ltd,None,None,['S', 'M', 'L', 'XL', 'XXL'],None,<ul class="mk-pdpv1-product-helper mk-cf"><li class="desc-main-title">Product Description</li><li class="desc-sub-title">Style Note</li><li class="desc-sub-text " itemprop="description"><p>For a much adored ethnic look, Anouk presents this kurta. Made with the best of tailoring expertise, this kurta can be highlighted by pairing it with solid churidar leggings or contrast harem pants and strappy sandals for a complete look.</p></li><li class="desc-sub-title ">Product Details</li><li class="desc-sub-text"><p>Blue kurta with contrast stitch detail, woven, round neck with binding, sleeveless with binding at arm holes, short mock buttoned chest placket with stylised pin tucks, tucks and contrast embroidery on either side, side slits, contrast printed taping along front hem</p></li><li class="desc-sub-title ">Material &amp; Care</li><li class="desc-sub-text "><p>100% cotton<br/>Hand wash cold</p></li><li class="desc-sub-title">Size &amp; Fit</li><li class="desc-sub-text"><p>The model (height 5'8" and chest 33") is wearing a size S</p></li></ul>,26:02:2014,None
None,Anouk Women Purple Printed Kurta,http://www.myntra.com/Kurtas/Anouk/Anouk-Women-Purple-Printed-Kurta/193167/buy,Rs. 629,sale-women-clothing,Clothing,Anouk,http://myntra.myntassets.com/images/style/properties/Anouk-Women-Purple-Printed-Kurta_a89e94cd7169f67a63d58736bc3ee41a_images_1080_1440_mini.jpg,Rs. 899,None,sale,http://www.myntra.com/Kurtas/Anouk/Anouk-Women-Purple-Printed-Kurta/193167/buy,Sold byVector Ecommerce Pvt Ltd,None,None,['S', 'M', 'L', 'XL', 'XXL'],None,<ul class="mk-pdpv1-product-helper mk-cf"><li class="desc-main-title">Product Description</li><li class="desc-sub-title">Style Note</li><li class="desc-sub-text " itemprop="description"><p>This versatile kurta from Anouk will instantly become your wardrobe favourite with its soft fabric and comfortable fit. Wear it with churidar leggings and Kolhapuri sandals for the best look.</p></li><li class="desc-sub-title ">Product Details</li><li class="desc-sub-text"><p>Purple kurta, woven, mandarin collar, three quarter sleeves with contrast printed overlay and taping at cuffs, contrast printed overlay with short buttoned placket at chest, vented hem</p></li><li class="desc-sub-title ">Material &amp; Care</li><li class="desc-sub-text "><p>Cotton<br/>Dry clean</p></li><li class="desc-sub-title">Size &amp; Fit</li><li class="desc-sub-text"><p>The model (height 5'8" and chest 33") is wearing a size S</p></li></ul>,26:02:2014,None
None,Anouk Blue & White Printed Flared Skirt,http://www.myntra.com/Skirts/Anouk/Anouk-Blue-&-White-Printed-Flared-Skirt/210416/buy,Rs. 629,sale-women-clothing,Clothing,Anouk,http://myntra.myntassets.com/images/style/properties/Anouk-Women-Skirts_088fb98d25a348ddfb763dd1cf672374_images_1080_1440_mini.JPG,Rs. 899,None,sale,http://www.myntra.com/Skirts/Anouk/Anouk-Blue-&-White-Printed-Flared-Skirt/210416/buy,Sold byVector Ecommerce Pvt Ltd,None,None,['26', '28', '30', '32', '34'],None,<ul class="mk-pdpv1-product-helper mk-cf"><li class="desc-main-title">Product Description</li><li class="desc-sub-title">Style Note</li><li class="desc-sub-text " itemprop="description"><p>Go for a boho look with Anouk's range of ethnic skirts. This piece is both stylish and comfy. You can wear it with tank tops, tees and kurtis alike.</p></li><li class="desc-sub-title ">Product Details</li><li class="desc-sub-text"><p>Blue, navy and white printed panelled skirt, waistband with short hook-and-eye closure at left, contrast binding along curved and flared hem</p></li><li class="desc-sub-title ">Material &amp; Care</li><li class="desc-sub-text "><p>100% cotton<br/>Hand wash cold<br/>Natural indigo dyes have been used on this product, colour will bleed during initial washes. Hand wash separately or with darker colours, dry inside out.</p></li><li class="desc-sub-title">Size &amp; Fit</li><li class="desc-sub-text"><p>The model (height 5'8" and waist 28") is wearing a size 28</p></li></ul>,26:02:2014,None
None,Anouk Women Purple Embroidered Jacquard Kurta,http://www.myntra.com/Kurtas/Anouk/Anouk-Women-Purple-Embroidered-Jacquard-Kurta/212286/buy,Rs. 559,sale-women-clothing,Clothing,Anouk,http://myntra.myntassets.com/images/style/properties/Anouk-Women-Purple-Embroidered-Jacquard-Kurta_10b64ca1e3e4c86bb60f46396df1813e_images_1080_1440_mini.JPG,Rs. 799,None,sale,http://www.myntra.com/Kurtas/Anouk/Anouk-Women-Purple-Embroidered-Jacquard-Kurta/212286/buy,Sold byVector Ecommerce Pvt Ltd,None,None,['XS', 'S', 'M', 'L', 'XL', 'XXL'],None,<ul class="mk-pdpv1-product-helper mk-cf"><li class="desc-main-title">Product Description</li><li class="desc-sub-title">Style Note</li><li class="desc-sub-text " itemprop="description"><p>This versatile kurta from Anouk will instantly become your wardrobe favourite with its soft fabric and comfortable fit. Wear it with churidar leggings and Kolhapuri sandals for a chic ethnic look.</p></li><li class="desc-sub-title ">Product Details</li><li class="desc-sub-text"><p>Purple kurta in a jacquard weave, notched round neck, three quarter sleeves, contrast embroidery at chest, side slits</p></li><li class="desc-sub-title ">Material &amp; Care</li><li class="desc-sub-text "><p>100% cotton<br/>Hand wash cold</p></li><li class="desc-sub-title">Size &amp; Fit</li><li class="desc-sub-text"><p>Comfort fit<br/>The model (height 5'8" and chest 33") is wearing a size S</p></li></ul>,26:02:2014,None
None,Anouk Women Blue Embroidered Jacquard Kurta,http://www.myntra.com/Kurtas/Anouk/Anouk-Women-Blue-Embroidered-Jacquard-Kurta/212287/buy,Rs. 559,sale-women-clothing,Clothing,Anouk,http://myntra.myntassets.com/images/style/properties/Anouk-Women-Blue-Embroidered-Jacquard-Kurta_287226c5438ea960a912104acf8ccb53_images_1080_1440_mini.JPG,Rs. 799,None,sale,http://www.myntra.com/Kurtas/Anouk/Anouk-Women-Blue-Embroidered-Jacquard-Kurta/212287/buy,Sold byVector Ecommerce Pvt Ltd,None,None,['XS', 'S', 'M', 'L', 'XL', 'XXL'],None,<ul class="mk-pdpv1-product-helper mk-cf"><li class="desc-main-title">Product Description</li><li class="desc-sub-title">Style Note</li><li class="desc-sub-text " itemprop="description"><p>This versatile kurta from Anouk will instantly become your wardrobe favourite with its soft fabric and comfortable fit. Wear it with churidar leggings and Kolhapuri sandals for a chic ethnic look.</p></li><li class="desc-sub-title ">Product Details</li><li class="desc-sub-text"><p>Blue kurta in a jacquard weave, notched round neck, three quarter sleeves, contrast embroidery at chest, side slits</p></li><li class="desc-sub-title ">Material &amp; Care</li><li class="desc-sub-text "><p>100% cotton<br/>Hand wash cold</p></li><li class="desc-sub-title">Size &amp; Fit</li><li class="desc-sub-text"><p>Comfort fit<br/>The model (height 5'8" and chest 33") is wearing a size S</p></li></ul>,26:02:2014,None
None,Anouk Women Neon Yellow Kurta,http://www.myntra.com/Kurtas/Anouk/Anouk-Women-Neon-Yellow-Kurta/219747/buy,Rs. 539,sale-women-clothing,Clothing,Anouk,http://myntra.myntassets.com/images/style/properties/Anouk-Women-Yellow-Kurta_6f07de41d9bf78000ada7f671db445f2_images_1080_1440_mini.jpg,Rs. 899,None,sale,http://www.myntra.com/Kurtas/Anouk/Anouk-Women-Neon-Yellow-Kurta/219747/buy,Sold byVector Ecommerce Pvt Ltd,None,None,['S', 'M', 'L', 'XL', 'XXL'],None,<ul class="mk-pdpv1-product-helper mk-cf"><li class="desc-main-title">Product Description</li><li class="desc-sub-title">Style Note</li><li class="desc-sub-text " itemprop="description"><p>For a much adored ethnic look, Anouk presents this kurta. Made with the best of tailoring expertise, this kurta can be highlighted by pairing it with solid churidar leggings and strappy sandals for a complete look.</p></li><li class="desc-sub-title ">Product Details</li><li class="desc-sub-text"><p>Neon yellow kurta, woven, contrast mandarin collar with slit, three quarter sleeves with contrast taping at cuffs with mock roll-up tab feature, short mock buttoned chest placket with contrast overlays, tucks and piping on either side, side slits</p></li><li class="desc-sub-title ">Material &amp; Care</li><li class="desc-sub-text "><p>100% cotton<br/>Hand wash cold</p></li><li class="desc-sub-title">Size &amp; Fit</li><li class="desc-sub-text"><p>The model (height 5'8" and chest 33") is wearing a size S</p></li></ul>,26:02:2014,None
None,Anouk Women Pink Jacquard with Embroidered Yoke Kurta,http://www.myntra.com/Kurtas/Anouk/Anouk-Women-Pink-Jacquard-with-Embroidered-Yoke-Kurta/212288/buy,Rs. 559,sale-women-clothing,Clothing,Anouk,http://myntra.myntassets.com/images/style/properties/Anouk-Women-Pink-Jacquard-with-Embroidered-Yoke-Kurta_dfcae725c788e3ae140daa9168d1de21_images_1080_1440_mini.JPG,Rs. 799,None,sale,http://www.myntra.com/Kurtas/Anouk/Anouk-Women-Pink-Jacquard-with-Embroidered-Yoke-Kurta/212288/buy,Sold byVector Ecommerce Pvt Ltd,None,None,['XS', 'S', 'M', 'L', 'XL', 'XXL'],None,<ul class="mk-pdpv1-product-helper mk-cf"><li class="desc-main-title">Product Description</li><li class="desc-sub-title">Style Note</li><li class="desc-sub-text " itemprop="description"><p>This versatile kurta from Anouk will instantly become your wardrobe favourite with its soft fabric and comfortable fit. Wear it with churidar leggings and Kolhapuri sandals for a chic ethnic look.</p></li><li class="desc-sub-title ">Product Details</li><li class="desc-sub-text"><p>Pink kurta, jacquard weave detailing, round neck with a split V, three quarter length sleeves, cross stitch embroidery at chest, straight vented hem</p></li><li class="desc-sub-title ">Material &amp; Care</li><li class="desc-sub-text "><p>100% cotton<br/>Hand wash</p></li><li class="desc-sub-title">Size &amp; Fit</li><li class="desc-sub-text"><p>Comfort fit<br/>The model (height 5'8" and chest 33") is wearing a size S</p></li></ul>,26:02:2014,None
None,Anouk Women Blue Silk Blend Embroidered Kurta,http://www.myntra.com/Kurtas/Anouk/Anouk-Women-Blue-Silk-Blend-Embroidered-Kurta/159308/buy,Rs. 320,sale-women-clothing,Clothing,Anouk,http://myntra.myntassets.com/images/style/properties/Anouk-Turquoise-Stitch-line-Detail-Kurta_d7201f654d79e6dea8b23165b0b42987_images_1080_1440_mini.jpg,Rs. 799,None,sale,http://www.myntra.com/Kurtas/Anouk/Anouk-Women-Blue-Silk-Blend-Embroidered-Kurta/159308/buy,Sold byVector Ecommerce Pvt Ltd,None,None,['XS', 'S', 'M', 'L', 'XL', 'XXL'],None,<ul class="mk-pdpv1-product-helper mk-cf"><li class="desc-main-title">Product Description</li><li class="desc-sub-title">Style Note</li><li class="desc-sub-text " itemprop="description"><p>This season, don't go by the book. Invest in this pretty kurta from Anouk. We suggest teaming this number with dhoti pants, a tasselled scarf and ethnic heels.</p></li><li class="desc-sub-title ">Product Details</li><li class="desc-sub-text"><p>Blue kurta with stitch detailed stripes, woven, notched round neck, short sleeves, embroidery at chest, side slits, comes with a cloth bag</p></li><li class="desc-sub-title ">Material &amp; Care</li><li class="desc-sub-text "><p>Polyester and silk blend<br/>Hand wash cold</p></li><li class="desc-sub-title">Size &amp; Fit</li><li class="desc-sub-text"><p>Comfort fit<br/>The model (height 5'8" and chest 33") is wearing a size S</p></li></ul>,26:02:2014,None
None,Anouk Women Orange Printed Kurti,http://www.myntra.com/Kurtis/Anouk/Anouk-Women-Orange-Printed-Kurti/214060/buy,Rs. 419,sale-women-clothing,Clothing,Anouk,http://myntra.myntassets.com/images/style/properties/Anouk-Women-Orange-Printed-Kurti_5f603ecef93ad9762d4b073df8b31f01_images_1080_1440.jpg,Rs. 699,None,sale,http://www.myntra.com/Kurtis/Anouk/Anouk-Women-Orange-Printed-Kurti/214060/buy,Sold byVector Ecommerce Pvt Ltd,None,None,['XS', 'S', 'M', 'L', 'XL', 'XXL'],None,<ul class="mk-pdpv1-product-helper mk-cf"><li class="desc-main-title">Product Description</li><li class="desc-sub-title">Style Note</li><li class="desc-sub-text " itemprop="description"><p>For a much adored ethnic look, Anouk presents this kurti. Made with the best of tailoring expertise, this kurti can be highlighted by pairing it with solid churidar leggings and strappy sandals for a complete look or with skinny denims for a casual look.</p></li><li class="desc-sub-title ">Product Details</li><li class="desc-sub-text"><p>Orange printed kurti, taping at mandarin collar with slit, three quarter sleeves with zari embroidered taping at cuffs, zari embroidered taping at chest, vented hem</p></li><li class="desc-sub-title ">Material &amp; Care</li><li class="desc-sub-text "><p>100% cotton<br/>Hand wash cold</p></li><li class="desc-sub-title">Size &amp; Fit</li><li class="desc-sub-text"><p>The model (height 5'8" and chest 33") is wearing a size S</p></li></ul>,26:02:2014,None
None,Anouk Women Off-White Kurta,http://www.myntra.com/Kurtas/Anouk/Anouk-Women-Off-White-Kurta/219743/buy,Rs. 539,sale-women-clothing,Clothing,Anouk,http://myntra.myntassets.com/images/style/properties/Anouk-Women-Off-White-Kurta_cd11fbb1c4055a71fdc14a9b77500f0f_images_1080_1440_mini.jpg,Rs. 899,None,sale,http://www.myntra.com/Kurtas/Anouk/Anouk-Women-Off-White-Kurta/219743/buy,Sold byVector Ecommerce Pvt Ltd,None,None,['S', 'M', 'L', 'XL', 'XXL'],None,<ul class="mk-pdpv1-product-helper mk-cf"><li class="desc-main-title">Product Description</li><li class="desc-sub-title">Style Note</li><li class="desc-sub-text " itemprop="description"><p>For a much adored ethnic look, Anouk presents this kurta. Made with the best of tailoring expertise, this kurta can be highlighted by pairing it with solid churidar leggings and strappy sandals for a complete look or with skinny denims for a casual look.</p></li><li class="desc-sub-title ">Product Details</li><li class="desc-sub-text"><p>Off-white kurta, woven, contrast mandarin collar with slit, three quarter sleeves with contrast taping at cuffs with loops, short mock buttoned chest placket with contrast overlay and piping on either sides, side slits</p></li><li class="desc-sub-title ">Material &amp; Care</li><li class="desc-sub-text "><p>100% cotton<br/>Hand wash cold</p></li><li class="desc-sub-title">Size &amp; Fit</li><li class="desc-sub-text"><p>The model (height 5'8" and chest 33") is wearing a size S</p></li></ul>,26:02:2014,None
None,Anouk Women White Printed Kurta,http://www.myntra.com/Kurtas/Anouk/Anouk-Women-White-Printed-Kurta/193216/buy,Rs. 559,sale-women-clothing,Clothing,Anouk,http://myntra.myntassets.com/images/style/properties/Anouk-Women-Kurtas_af4140220acfa7e8aa33b39b5217238b_images_1080_1440_mini.jpg,Rs. 799,None,sale,http://www.myntra.com/Kurtas/Anouk/Anouk-Women-White-Printed-Kurta/193216/buy,Sold byVector Ecommerce Pvt Ltd,None,None,['S', 'M', 'L', 'XL', 'XXL'],None,<ul class="mk-pdpv1-product-helper mk-cf"><li class="desc-main-title">Product Description</li><li class="desc-sub-title">Style Note</li><li class="desc-sub-text " itemprop="description"><p>This versatile kurta from Anouk will instantly become your wardrobe favourite with its soft fabric and comfortable fit. Wear it with churidar leggings and Kolhapuri sandals for the best look.</p></li><li class="desc-sub-title ">Product Details</li><li class="desc-sub-text"><p>White kurta, has neon print at front and sleeves, woven design all over, mandarin collar with slit, three quarter sleeves with contrast taping at cuffs, contrast printed overlay at chest with satin taping, vented hem with contrast printed taping</p></li><li class="desc-sub-title ">Material &amp; Care</li><li class="desc-sub-text "><p>100% cotton<br/>Hand wash cold</p></li><li class="desc-sub-title">Size &amp; Fit</li><li class="desc-sub-text"><p>Comfort fit<br/>The model (height 5'8" and chest 33") is wearing a size S</p></li></ul>,26:02:2014,None
None,Anouk Women Pink Printed Kurta,http://www.myntra.com/Kurtas/Anouk/Anouk-Women-Pink-Printed-Kurta/210931/buy,Rs. 559,sale-women-clothing,Clothing,Anouk,http://myntra.myntassets.com/images/style/properties/Anouk-Women-Pink-Printed-Kurta_55138a831322f80d6985b9ddccb43d4a_images_1080_1440_mini.jpg,Rs. 799,None,sale,http://www.myntra.com/Kurtas/Anouk/Anouk-Women-Pink-Printed-Kurta/210931/buy,Sold byVector Ecommerce Pvt Ltd,None,None,['XS', 'S', 'M', 'L', 'XL', 'XXL'],None,<ul class="mk-pdpv1-product-helper mk-cf"><li class="desc-main-title">Product Description</li><li class="desc-sub-title">Style Note</li><li class="desc-sub-text " itemprop="description"><p>Look your ethnic best in this kurta by Anouk. We recommend, styling this versatile piece with skinny denims or leggings and Kolhapuri sandals for the day.</p></li><li class="desc-sub-title ">Product Details</li><li class="desc-sub-text"><p>Pink, orange and brown printed kurta, V neckline with contrast taping at front neck that extends till chest, three quarter sleeves with contrast taping at cuffs, contrast taping on front at vented hem</p></li><li class="desc-sub-title ">Material &amp; Care</li><li class="desc-sub-text "><p>100% cotton<br/>Hand wash cold</p></li><li class="desc-sub-title">Size &amp; Fit</li><li class="desc-sub-text"><p>The model (height 5'8" and chest 33") is wearing a size S</p></li></ul>,26:02:2014,None
None,Anouk Women Green Kurta,http://www.myntra.com/Kurtas/Anouk/Anouk-Women-Green-Kurta/219793/buy,Rs. 539,sale-women-clothing,Clothing,Anouk,http://myntra.myntassets.com/images/style/properties/Anouk-Women-Green-Kurta_4e32f05dc2f7889693c177fd76b92499_images_1080_1440_mini.jpg,Rs. 899,None,sale,http://www.myntra.com/Kurtas/Anouk/Anouk-Women-Green-Kurta/219793/buy,Sold byVector Ecommerce Pvt Ltd,None,None,['S', 'M', 'L', 'XL', 'XXL'],None,<ul class="mk-pdpv1-product-helper mk-cf"><li class="desc-main-title">Product Description</li><li class="desc-sub-title">Style Note</li><li class="desc-sub-text " itemprop="description"><p>For a much adored ethnic look, Anouk presents this kurta. Made with the best of tailoring expertise, this kurta can be highlighted by pairing it with solid churidar leggings and strappy sandals for a complete look or with skinny denims for a casual look.</p></li><li class="desc-sub-title ">Product Details</li><li class="desc-sub-text"><p>Green kurta, woven, mandarin collar with slit, three quarter sleeves with buttoned cuffs and roll-up tab feature, gathers at shoulders, short buttoned chest placket, panel at chest with tucks, stitch detail and gathers below, tie-up fastening at chest sides, side slits</p></li><li class="desc-sub-title ">Material &amp; Care</li><li class="desc-sub-text "><p>100% cotton<br/>Hand wash cold</p></li><li class="desc-sub-title">Size &amp; Fit</li><li class="desc-sub-text"><p>The model (height 5'8" and chest 33") is wearing a size S</p></li></ul>,26:02:2014,None
None,Anouk Women Teal Blue Jacquard with Embroidered Yoke Kurta,http://www.myntra.com/Kurtas/Anouk/Anouk-Women-Teal-Blue-Jacquard-with-Embroidered-Yoke-Kurta/212291/buy,Rs. 559,sale-women-clothing,Clothing,Anouk,http://myntra.myntassets.com/images/style/properties/Anouk-Women-Teal-Blue-Jacquard-with-Embroidered-Yoke-Kurta_f7080254d84218cd0d0dfbcdac3df491_images_1080_1440_mini.JPG,Rs. 799,None,sale,http://www.myntra.com/Kurtas/Anouk/Anouk-Women-Teal-Blue-Jacquard-with-Embroidered-Yoke-Kurta/212291/buy,Sold byVector Ecommerce Pvt Ltd,None,None,['XS', 'S', 'M', 'L', 'XL', 'XXL'],None,<ul class="mk-pdpv1-product-helper mk-cf"><li class="desc-main-title">Product Description</li><li class="desc-sub-title">Style Note</li><li class="desc-sub-text " itemprop="description"><p>This versatile kurta from Anouk will instantly become your wardrobe favourite with its soft fabric and comfortable fit. Wear it with churidar leggings and Kolhapuri sandals for a chic ethnic look.</p></li><li class="desc-sub-title ">Product Details</li><li class="desc-sub-text"><p>Teal blue kurta, jacquard weave detailing, round neck with a split V, three quarter length sleeves, cross stitch embroidery at chest, straight vented hem</p></li><li class="desc-sub-title ">Material &amp; Care</li><li class="desc-sub-text "><p>100% cotton<br/>Hand wash</p></li><li class="desc-sub-title">Size &amp; Fit</li><li class="desc-sub-text"><p>Comfort fit<br/>The model (height 5'8" and chest 33") is wearing a size S</p></li></ul>,26:02:2014,None
None,Anouk Women Yellow Kurta,http://www.myntra.com/Kurtas/Anouk/Anouk-Women-Yellow-Kurta/219754/buy,Rs. 539,sale-women-clothing,Clothing,Anouk,http://myntra.myntassets.com/images/style/properties/Anouk-Women-Yellow-Kurta_4ef688770f0e5f03a94979bebfe22238_images_1080_1440_mini.jpg,Rs. 899,None,sale,http://www.myntra.com/Kurtas/Anouk/Anouk-Women-Yellow-Kurta/219754/buy,Sold byVector Ecommerce Pvt Ltd,None,None,['S', 'M', 'L', 'XL', 'XXL'],None,<ul class="mk-pdpv1-product-helper mk-cf"><li class="desc-main-title">Product Description</li><li class="desc-sub-title">Style Note</li><li class="desc-sub-text " itemprop="description"><p>For a much adored ethnic look, Anouk presents this kurta. Made with the best of tailoring expertise, this kurta can be highlighted by pairing it with solid churidar leggings and strappy sandals for a complete look or with skinny denims for a casual look.</p></li><li class="desc-sub-title ">Product Details</li><li class="desc-sub-text"><p>Yellow kurta, woven, round neck, three quarter sleeves with tucks and stitch detail at hems, short mock buttoned chest placket with tucks and stitch detail on either side, hemline curving at side slits</p></li><li class="desc-sub-title ">Material &amp; Care</li><li class="desc-sub-text "><p>100% cotton<br/>Hand wash cold</p></li><li class="desc-sub-title">Size &amp; Fit</li><li class="desc-sub-text"><p>The model (height 5'8" and chest 33") is wearing a size S</p></li></ul>,26:02:2014,None
