None,Elle Women Black Panelled Top,http://www.myntra.com/Tops/Elle/Elle-Women-Black-Panelled-Top/168702/buy,Rs. 1,395,women-shirts-tops-tees,Shirts,Elle,http://myntra.myntassets.com/images/style/properties/Elle-Women-Tops_6d5beac99d98aa57ca07cf142f14f19a_images_1080_1440_mini.jpg,None,None,women,http://www.myntra.com/Tops/Elle/Elle-Women-Black-Panelled-Top/168702/buy,Sold byVector Ecommerce Pvt Ltd,None,None,['XS', 'S', 'M', 'L', 'XL'],None,<ul class="mk-pdpv1-product-helper mk-cf"><li class="desc-main-title">Product Description</li><li class="desc-sub-title">Style Note</li><li class="desc-sub-text " itemprop="description"><p>This panelled top from Elle is a versatile pick for your wardrobe, which can be dressed up or down. Style it with a golden layered chain necklace, leather look jeans and killer pumps for a night out with the girls.</p></li><li class="desc-sub-title ">Product Details</li><li class="desc-sub-text"><p>Black panelled top, knitted and woven combo, round neck, short extended sleeves, metal brand tag towards front hem</p></li><li class="desc-sub-title ">Material &amp; Care</li><li class="desc-sub-text "><p>Viscose and polyester blend<br/>Hand wash cold</p></li><li class="desc-sub-title">Size &amp; Fit</li><li class="desc-sub-text"><p>Regular fit<br/>The model (height 5'8" and chest 33") is wearing a size S</p></li></ul>,26:02:2014,None
None,Elle Women Grey Vintage Top,http://www.myntra.com/Tops/Elle/Elle-Women-Grey-Vintage-Top/57065/buy,Rs. 1,680,women-shirts-tops-tees,Shirts,Elle,http://myntra.myntassets.com/images/style/properties/Elle-Women-Grey-Vintage-Top_3eb6cd6ab87706027bee0292380ef731_images_1080_1440_mini.jpg,Rs. 2,400,None,women,http://www.myntra.com/Tops/Elle/Elle-Women-Grey-Vintage-Top/57065/buy,Sold byVector Ecommerce Pvt Ltd,None,None,['XS', 'S', 'M', 'L', 'XL'],None,<ul class="mk-pdpv1-product-helper mk-cf"><li class="desc-main-title">Product Description</li><li class="desc-sub-title">Style Note</li><li class="desc-sub-text " itemprop="description"><p>Elle embodies femininity in all its creations. Trendy with detailed styling, while remaining both smart and understated, this top can easily be styled. Wear it with jeans and flats for a chic and casual look. This top would make for an excellent evening wear option with the slight sheen quality.</p></li><li class="desc-sub-title ">Product Details</li><li class="desc-sub-text"><p>Grey woven top, has a round neckline with ruffles around the neckline, three quarter sleeves with an elasticated band at the cuffs, lace detail at the shoulder, full buttoned placket and elasticated band at the hemline</p></li><li class="desc-sub-title ">Material &amp; Care</li><li class="desc-sub-text "><p>50% rayon and 50% polyester<br/>Hand wash<br/>Do not bleach or tumble dry<br/>Use cool iron</p></li><li class="desc-sub-title">Size &amp; Fit</li><li class="desc-sub-text"><p>Regular fit<br/>The model (height 5'8&amp;rdquo  and chest 33&amp;rdquo ) is wearing a size M</p></li></ul>,26:02:2014,None
None,Elle Women White Lace Tank Top,http://www.myntra.com/Tops/Elle/Elle-Women-White-Lace-Tank-Top/160163/buy,Rs. 600,women-shirts-tops-tees,Shirts,Elle,http://myntra.myntassets.com/images/style/properties/Elle-Women-White-Lace-Tank-Top_7870f6ea76a0f7b4b47fa6ead154f85f_images_1080_1440_mini.jpg,None,None,women,http://www.myntra.com/Tops/Elle/Elle-Women-White-Lace-Tank-Top/160163/buy,Sold byVector Ecommerce Pvt Ltd,None,None,['XS', 'S', 'M', 'L', 'ZS'],None,<ul class="mk-pdpv1-product-helper mk-cf"><li class="desc-main-title">Product Description</li><li class="desc-sub-title">Style Note</li><li class="desc-sub-text " itemprop="description"><p>Looking for a basic tank top that can be a versatile piece in your wardrobe? This top from Elle is the best bet for you. Wear it under a sheer shirt or with just a pair of slim fitting jeans for a simple but stylish outfit.</p></li><li class="desc-sub-title ">Product Details</li><li class="desc-sub-text"><p>White knit spaghetti top, adjustable shoulder straps, neckline with lace detailing and a straight hem</p></li><li class="desc-sub-title ">Material &amp; Care</li><li class="desc-sub-text "><p>95% cotton, 5% Lycra<br/>Machine wash cold</p></li><li class="desc-sub-title">Size &amp; Fit</li><li class="desc-sub-text"><p>The model (height 5'8" and chest 33") is wearing a size S</p></li></ul>,26:02:2014,None
None,Elle Women Lavender Floral Print Top,http://www.myntra.com/Tops/Elle/Elle-Women-Lavender-Floral-Print-Top/160142/buy,Rs. 1,600,women-shirts-tops-tees,Shirts,Elle,http://myntra.myntassets.com/images/style/properties/Elle-Women-Lavender-Floral-Print-Top_b0717a6ab4b1500dd707aad80bf9e38a_images_1080_1440_mini.jpg,None,None,women,http://www.myntra.com/Tops/Elle/Elle-Women-Lavender-Floral-Print-Top/160142/buy,Sold byVector Ecommerce Pvt Ltd,None,None,['XS', 'S', 'M', 'L', 'XL', 'XXL'],None,<ul class="mk-pdpv1-product-helper mk-cf"><li class="desc-main-title">Product Description</li><li class="desc-sub-title">Style Note</li><li class="desc-sub-text " itemprop="description"><p>Elle embodies femininity in all its creations. Trendy with detailed styling, while remaining both smart and understated, this top can easily be styled. Wear this with slim fit jeans and wedge heels for a chic and casual look.</p></li><li class="desc-sub-title ">Product Details</li><li class="desc-sub-text"><p>Lavender floral print chiffon top with pink, purple and blue accents, sequin detailing along round neck with a split, pleating on chest, short sleeves with tucks, curved hem</p></li><li class="desc-sub-title ">Material &amp; Care</li><li class="desc-sub-text "><p>Polyester chiffon<br/>Hand wash cold</p></li><li class="desc-sub-title">Size &amp; Fit</li><li class="desc-sub-text"><p>The model (height 5'8" and chest 33") is wearing a size S</p></li></ul>,26:02:2014,None
None,Elle Women Hibiscus Red Botanical Top,http://www.myntra.com/Tops/Elle/Elle-Women-Hibiscus-Red-Botanical-Top/123065/buy,Rs. 1,400,women-shirts-tops-tees,Shirts,Elle,http://myntra.myntassets.com/images/style/properties/Elle-Women-Tshirts_2154688948ba92bdcb814694393ace49_images_1080_1440_mini.jpg,None,None,women,http://www.myntra.com/Tops/Elle/Elle-Women-Hibiscus-Red-Botanical-Top/123065/buy,Sold byVector Ecommerce Pvt Ltd,None,None,['XS', 'S', 'M', 'L'],None,<ul class="mk-pdpv1-product-helper mk-cf"><li class="desc-main-title">Product Description</li><li class="desc-sub-title">Style Note</li><li class="desc-sub-text " itemprop="description"><p>Elle gives the classic tee a cutesy makeover with this pretty top. We love the simple yet unique style of this piece. Best worn with denim shorts or a skirt.</p></li><li class="desc-sub-title ">Product Details</li><li class="desc-sub-text"><p>Red printed sleeveless top, has a V-neckline, pintucks at the shoulder, panelled flaps at the back that drape over the shoulder</p></li><li class="desc-sub-title ">Material &amp; Care</li><li class="desc-sub-text "><p>100% Cotton<br/>Machine wash</p></li><li class="desc-sub-title">Size &amp; Fit</li><li class="desc-sub-text"><p>The model (height 5'8" and chest 33") is wearing size M</p></li></ul>,26:02:2014,None
None,Elle Women Marvel Blue Lace Trimmed Top,http://www.myntra.com/Tops/Elle/Elle-Women-Marvel-Blue-Lace-Trimmed-Top/115196/buy,Rs. 2,400,women-shirts-tops-tees,Shirts,Elle,http://myntra.myntassets.com/images/style/properties/Elle-Women-Marvel-Blue-Lace-Trimmed-Top_f32bad6b8d97c2fe9779343f7ab77b1c_images_1080_1440_mini.jpg,None,None,women,http://www.myntra.com/Tops/Elle/Elle-Women-Marvel-Blue-Lace-Trimmed-Top/115196/buy,Sold byVector Ecommerce Pvt Ltd,None,None,['XS', 'S', 'M', 'L', 'XL'],None,<ul class="mk-pdpv1-product-helper mk-cf"><li class="desc-main-title">Product Description</li><li class="desc-sub-title">Style Note</li><li class="desc-sub-text " itemprop="description"><p>Elle brings you this intricate top imbibing a vintage Victorian feel. With lace and tuck detail to add interest, this piece will look best paired with black skinny denims or trousers and lace-up Oxford wedges.</p></li><li class="desc-sub-title ">Product Details</li><li class="desc-sub-text"><p>Blue woven top, has a round neckline with floral lace trim, three quarter sleeves with tuck detail and lace trimmed hem, tuck detail down front alternating with lace trim, cover button and loop fastening at back neck, tuck detail down centre back, and tuck detail along hemline</p></li><li class="desc-sub-title ">Material &amp; Care</li><li class="desc-sub-text "><p>52% viscose and 48% cotton<br/>Dry clean only</p></li><li class="desc-sub-title">Size &amp; Fit</li><li class="desc-sub-text"><p>Regular fit<br/>The model (height 5'8'' and chest 33'') is wearing a size XS</p></li></ul>,26:02:2014,None
None,Elle Women Lilac Coloured Nutopia Top,http://www.myntra.com/Tops/Elle/Elle-Women-Lilac-Coloured-Nutopia-Top/135260/buy,Rs. 1,800,women-shirts-tops-tees,Shirts,Elle,http://myntra.myntassets.com/images/style/properties/Elle-Women-Lilac-Coloured-Nutopia-Top_ee29c65e44b4be87c740e180d27d1d1e_images_1080_1440_mini.jpg,None,None,women,http://www.myntra.com/Tops/Elle/Elle-Women-Lilac-Coloured-Nutopia-Top/135260/buy,Sold byVector Ecommerce Pvt Ltd,None,None,['S', 'M', 'L'],None,<ul class="mk-pdpv1-product-helper mk-cf"><li class="desc-main-title">Product Description</li><li class="desc-sub-title">Style Note</li><li class="desc-sub-text " itemprop="description"><p>It is love at first sight. In a shade of delicate lilac, this top from Elle is truly hard to ignore. We love its even pleat details and suggest you pair this piece with basic washed denims for maximum impact.</p></li><li class="desc-sub-title ">Product Details</li><li class="desc-sub-text"><p>Lilac coloured top, has a round neck with split V detailing, pin tucks at the chest, extended bat sleeves and elastication at the hem at the back</p></li><li class="desc-sub-title ">Material &amp; Care</li><li class="desc-sub-text "><p>100% viscose<br/>Machine wash</p></li><li class="desc-sub-title">Size &amp; Fit</li><li class="desc-sub-text"><p>The model (height 5'8" and chest 33") is wearing a size S</p></li></ul>,26:02:2014,None
None,Elle Cream Printed T-shirt,http://www.myntra.com/Tops/Elle/Elle-Cream-Printed-T-shirt/57176/buy,Rs. 980,women-shirts-tops-tees,Shirts,Elle,http://myntra.myntassets.com/images/style/properties/Elle-Cream-Printed-T-shirt_ef362f40027dbbcf49d733d35ff366b9_images_1080_1440_mini.jpg,Rs. 1,400,None,women,http://www.myntra.com/Tops/Elle/Elle-Cream-Printed-T-shirt/57176/buy,Sold byVector Ecommerce Pvt Ltd,None,None,['S', 'M', 'L'],None,<ul class="mk-pdpv1-product-helper mk-cf"><li class="desc-main-title">Product Description</li><li class="desc-sub-title">Style Note</li><li class="desc-sub-text " itemprop="description"><p>Elle embodies femininity in all its creations. Trendy with detailed styling, while remaining both smart and understated, this T-shirt can easily be styled. Wear it with jeans and flats for a chic and casual look.</p></li><li class="desc-sub-title ">Product Details</li><li class="desc-sub-text"><p>Cream coloured knit T-shirt, has a round neckline with flaring pin tucks, flutter sleeves and graphic print with sequin detail in front</p></li><li class="desc-sub-title ">Material &amp; Care</li><li class="desc-sub-text "><p>100% cotton<br/>Machine wash cold<br/>Tumble dry<br/>Use warm iron</p></li><li class="desc-sub-title">Size &amp; Fit</li><li class="desc-sub-text"><p>Regular fit<br/>The model (height 5'8&amp;rdquo  and chest 33&amp;rdquo ) is wearing a size M</p></li></ul>,26:02:2014,None
None,Elle Women Printed Pink Top,http://www.myntra.com/Tops/Elle/Elle-Women-Printed-Pink-Top/57119/buy,Rs. 1,120,women-shirts-tops-tees,Shirts,Elle,http://myntra.myntassets.com/images/style/properties/Elle-Women-Printed-Pink-Top_aac10d1becdce9972a81dbcd0a3f2e67_images_1080_1440_mini.jpg,Rs. 1,600,None,women,http://www.myntra.com/Tops/Elle/Elle-Women-Printed-Pink-Top/57119/buy,Sold byVector Ecommerce Pvt Ltd,None,None,['S', 'M', 'L', 'XL'],None,<ul class="mk-pdpv1-product-helper mk-cf"><li class="desc-main-title">Product Description</li><li class="desc-sub-title">Style Note</li><li class="desc-sub-text " itemprop="description"><p>ï » ¿ ï » ¿ Elle embodies femininity in all its creations. Trendy with detailed styling, while remaining both smart and understated, this top can easily be styled. Wear it with jeans and flats for a chic and casual look.</p></li><li class="desc-sub-title ">Product Details</li><li class="desc-sub-text"><p>ï » ¿ Pink, printed, woven, sleeveless top, has a round neckline, ruffle detail with trims on the edge around the neckline, gathers at the neckline and slightly curved hemline</p></li><li class="desc-sub-title ">Material &amp; Care</li><li class="desc-sub-text "><p>ï » ¿ ï » ¿ 52% cotton and 48% Polyester<br/>Machine wash cold<br/>Do not bleach or tumble dry<br/>Use cool iron</p></li><li class="desc-sub-title">Size &amp; Fit</li><li class="desc-sub-text"><p>Regular fit<br/>The model (height 5'8&amp; rdquo  and chest 33&amp; rdquo ) is wearing a size M</p></li></ul>,26:02:2014,None
None,Elle Women Dark Pink T-shirt,http://www.myntra.com/Tshirts/Elle/Elle-Women-Dark-Pink-T-shirt/57174/buy,Rs. 1,260,women-shirts-tops-tees,Shirts,Elle,http://myntra.myntassets.com/images/style/properties/Elle-Women-Red-T-shirt_5f41427ded4dc5e0cda0cf7acbc891e5_images_1080_1440_mini.jpg,Rs. 1,800,None,women,http://www.myntra.com/Tshirts/Elle/Elle-Women-Dark-Pink-T-shirt/57174/buy,Sold byVector Ecommerce Pvt Ltd,None,None,['XS', 'S', 'M', 'L', 'XL'],None,<ul class="mk-pdpv1-product-helper mk-cf"><li class="desc-main-title">Product Description</li><li class="desc-sub-title">Style Note</li><li class="desc-sub-text " itemprop="description"><p>Elle embodies femininity in all its creations. Trendy with detailed styling, while remaining both smart and understated, this top can easily be styled. Wear it with jeans and flats for a chic and casual look.</p></li><li class="desc-sub-title ">Product Details</li><li class="desc-sub-text"><p>Dark pink knit top, has a round neckline, crochet detail appliqued around the neckline and short sleeves with fold over cuffs</p></li><li class="desc-sub-title ">Material &amp; Care</li><li class="desc-sub-text "><p>95% cotton and 5% lycra<br/>Machine wash cold<br/>Do not bleach or tumble dry<br/>Use cool iron</p></li><li class="desc-sub-title">Size &amp; Fit</li><li class="desc-sub-text"><p>Regular fit<br/>The model (height 5'8"  and chest 33") is wearing a size M</p></li></ul>,26:02:2014,None
None,Elle Women Brown Into The Wild Top,http://www.myntra.com/Tops/Elle/Elle-Women-Brown-Into-The-Wild-Top/123034/buy,Rs. 1,200,women-shirts-tops-tees,Shirts,Elle,http://myntra.myntassets.com/images/style/properties/Elle-Women-Tops_7db9de4fef8c224b1a313eef5e9c6e54_images_1080_1440_mini.jpg,None,None,women,http://www.myntra.com/Tops/Elle/Elle-Women-Brown-Into-The-Wild-Top/123034/buy,Sold byVector Ecommerce Pvt Ltd,None,None,['XS', 'S', 'M', 'L', 'XL'],None,<ul class="mk-pdpv1-product-helper mk-cf"><li class="desc-main-title">Product Description</li><li class="desc-sub-title">Style Note</li><li class="desc-sub-text " itemprop="description"><p>Featuring floral lace in a dark brown hue, this top from Elle draws from the trend for lace as well as the one for earthy hues. Pair this piece with navy, slim fit trousers and pumps for a chic street look.</p></li><li class="desc-sub-title ">Product Details</li><li class="desc-sub-text"><p>Brown top, round neck, sleeveless, raw edge finish, lace in front and at hem, knit inner and back panel</p></li><li class="desc-sub-title ">Material &amp; Care</li><li class="desc-sub-text "><p>100% Viscose<br/>Machine wash</p></li><li class="desc-sub-title">Size &amp; Fit</li><li class="desc-sub-text"><p>The model (height 5'8" and chest 33") is wearing a size M</p></li></ul>,26:02:2014,None
None,Elle Women Red T-shirt,http://www.myntra.com/Tshirts/Elle/Elle-Women-Red-T-shirt/240971/buy,Rs. 895,women-shirts-tops-tees,Shirts,Elle,http://myntra.myntassets.com/images/style/properties/Elle-Women-Red-Essentials-T-shirt_045c66a64943488a6949b3375251940d_images_1080_1440_mini.JPG,None,None,women,http://www.myntra.com/Tshirts/Elle/Elle-Women-Red-T-shirt/240971/buy,Sold byVector Ecommerce Pvt Ltd,None,None,['XXS', 'XS', 'S', 'M', 'L'],None,<ul class="mk-pdpv1-product-helper mk-cf"><li class="desc-main-title">Product Description</li><li class="desc-sub-title">Style Note</li><li class="desc-sub-text " itemprop="description"><p>Look bright with this vibrant tee from Elle. Team this piece with a pair of dark denims and you're good to go.</p></li><li class="desc-sub-title ">Product Details</li><li class="desc-sub-text"><p>Red T-shirt, knitted, slub effect, round neckline, extended short sleeves, patch pocket with lace trim at left chest, branding above left hem</p></li><li class="desc-sub-title ">Material &amp; Care</li><li class="desc-sub-text "><p>100% cotton<br/>Hand wash</p></li><li class="desc-sub-title">Size &amp; Fit</li><li class="desc-sub-text"><p>The model (5'8" and chest 33") is wearing size S</p></li></ul>,26:02:2014,None
None,Elle Women Black Essentials T-shirt,http://www.myntra.com/Tshirts/Elle/Elle-Women-Black-Essentials-T-shirt/240965/buy,Rs. 995,women-shirts-tops-tees,Shirts,Elle,http://myntra.myntassets.com/images/style/properties/Elle-Women-Black-Essentials-T-shirt_38b0c04cca785b1170685dddcb79c2bd_images_1080_1440_mini.jpg,None,None,women,http://www.myntra.com/Tshirts/Elle/Elle-Women-Black-Essentials-T-shirt/240965/buy,Sold byVector Ecommerce Pvt Ltd,None,None,['XXS', 'XS', 'S', 'M', 'L'],None,<ul class="mk-pdpv1-product-helper mk-cf"><li class="desc-main-title">Product Description</li><li class="desc-sub-title">Style Note</li><li class="desc-sub-text " itemprop="description"><p>The basic tee gets an edgy makeover in this Elle number. Match this sequinned piece with your favourite pair of jeans and pumps for a chic casual ensemble.</p></li><li class="desc-sub-title ">Product Details</li><li class="desc-sub-text"><p>Black T-shirt, knitted, ribbed V neckline, three quarter length sleeves, sequinned branding on chest</p></li><li class="desc-sub-title ">Material &amp; Care</li><li class="desc-sub-text "><p>95% cotton, 5% Spandex<br/>Machine wash warm</p></li><li class="desc-sub-title">Size &amp; Fit</li><li class="desc-sub-text"><p>Regular fit<br/>The model (height 5'8" and chest 33") is wearing a size S</p></li></ul>,26:02:2014,None
None,Elle Women White Printed T-shirt,http://www.myntra.com/Tshirts/Elle/Elle-Women-White-Printed-T-shirt/240970/buy,Rs. 795,women-shirts-tops-tees,Shirts,Elle,http://myntra.myntassets.com/images/style/properties/Elle-Women-White-Printed-T-shirt_e8da8a2abe9d12c14f351a7eb4fe0221_images_1080_1440_mini.jpg,None,None,women,http://www.myntra.com/Tshirts/Elle/Elle-Women-White-Printed-T-shirt/240970/buy,Sold byVector Ecommerce Pvt Ltd,None,None,['XXS', 'XS', 'S', 'M', 'L'],None,<ul class="mk-pdpv1-product-helper mk-cf"><li class="desc-main-title">Product Description</li><li class="desc-sub-title">Style Note</li><li class="desc-sub-text " itemprop="description"><p>This season go bright and fun with these vibrant printed tees from Elle. Team this piece with a pair of skinny jeans and ballerina flats for a simple casual look.</p></li><li class="desc-sub-title ">Product Details</li><li class="desc-sub-text"><p>White T-shirt, knitted, ribbed round neck, short extended sleeves, printed front</p></li><li class="desc-sub-title ">Material &amp; Care</li><li class="desc-sub-text "><p>100% cotton<br/>Hand wash</p></li><li class="desc-sub-title">Size &amp; Fit</li><li class="desc-sub-text"><p>Regular fit<br/>The model (height 5'8" and chest 33") is wearing a size S</p></li></ul>,26:02:2014,None
None,Elle Women White Printed T-shirt,http://www.myntra.com/Tshirts/Elle/Elle-Women-White-Printed-T-shirt/240973/buy,Rs. 1,095,women-shirts-tops-tees,Shirts,Elle,http://myntra.myntassets.com/images/style/properties/Elle-Women-White-Printed-T-shirt_e7490fbdb7b5ea9a9ca1a4403b90f2ba_images_1080_1440_mini.JPG,None,None,women,http://www.myntra.com/Tshirts/Elle/Elle-Women-White-Printed-T-shirt/240973/buy,Sold byVector Ecommerce Pvt Ltd,None,None,['XXS', 'XS', 'S', 'M', 'L'],None,<ul class="mk-pdpv1-product-helper mk-cf"><li class="desc-main-title">Product Description</li><li class="desc-sub-title">Style Note</li><li class="desc-sub-text " itemprop="description"><p>Look bright with this vibrant tee from Elle. Team this piece with a pair of dark denims and you're good to go.</p></li><li class="desc-sub-title ">Product Details</li><li class="desc-sub-text"><p>White printed T-shirt, knitted, round neckline, short extended sleeves, metal embellishments at front, contrast at back</p></li><li class="desc-sub-title ">Material &amp; Care</li><li class="desc-sub-text "><p>100% cotton<br/>Hand wash</p></li><li class="desc-sub-title">Size &amp; Fit</li><li class="desc-sub-text"><p>The model (5'8" and chest 33") is wearing size S</p></li></ul>,26:02:2014,None
None,Elle Women Maroon T-shirt,http://www.myntra.com/Tshirts/Elle/Elle-Women-Maroon-T-shirt/240966/buy,Rs. 995,women-shirts-tops-tees,Shirts,Elle,http://myntra.myntassets.com/images/style/properties/Elle-Women-Maroon-Essentials-T-shirt_fba07494b4dfdd4ca823ad6dc621a5b9_images_1080_1440_mini.jpg,None,None,women,http://www.myntra.com/Tshirts/Elle/Elle-Women-Maroon-T-shirt/240966/buy,Sold byVector Ecommerce Pvt Ltd,None,None,['XXS', 'XS', 'S', 'M', 'L'],None,<ul class="mk-pdpv1-product-helper mk-cf"><li class="desc-main-title">Product Description</li><li class="desc-sub-title">Style Note</li><li class="desc-sub-text " itemprop="description"><p>Look bright with this vibrant tee from Elle. Style this piece with a pair of dark denims and you're good to go.</p></li><li class="desc-sub-title ">Product Details</li><li class="desc-sub-text"><p>Maroon T-shirt, V neckline, crystal embellishments on front, long sleeves</p></li><li class="desc-sub-title ">Material &amp; Care</li><li class="desc-sub-text "><p>95% cotton, 5% Spandex<br/>Machine wash warm</p></li><li class="desc-sub-title">Size &amp; Fit</li><li class="desc-sub-text"><p>The model (5'8" and chest 33") is wearing size S</p></li></ul>,26:02:2014,None
None,Elle Women Green Top,http://www.myntra.com/Tops/Elle/Elle-Women-Green-Top/240967/buy,Rs. 895,women-shirts-tops-tees,Shirts,Elle,http://myntra.myntassets.com/images/style/properties/Elle-Women-Green-Essentials-Top_06163a4c0fd2df68a854c2a7b37c1606_images_1080_1440_mini.jpg,None,None,women,http://www.myntra.com/Tops/Elle/Elle-Women-Green-Top/240967/buy,Sold byVector Ecommerce Pvt Ltd,None,None,['XS', 'S', 'M', 'L', 'ZS'],None,<ul class="mk-pdpv1-product-helper mk-cf"><li class="desc-main-title">Product Description</li><li class="desc-sub-title">Style Note</li><li class="desc-sub-text " itemprop="description"><p>Look bright with this vibrant top from Elle. Team this piece with a pair of dark denims and you're good to go.</p></li><li class="desc-sub-title ">Product Details</li><li class="desc-sub-text"><p>Green top, knit, round neckline, sleeveless, bow detail at the back, printed branding on left chest with crystal embellishments above</p></li><li class="desc-sub-title ">Material &amp; Care</li><li class="desc-sub-text "><p>100% cotton<br/>Hand wash</p></li><li class="desc-sub-title">Size &amp; Fit</li><li class="desc-sub-text"><p>The model (5'8" and chest 33") is wearing size S</p></li></ul>,26:02:2014,None
None,Elle Women Off-White Clarity Top,http://www.myntra.com/Tops/Elle/Elle-Women-Off-White-Clarity-Top/123060/buy,Rs. 1,600,women-shirts-tops-tees,Shirts,Elle,http://myntra.myntassets.com/images/style/properties/Elle-Women-Tshirts_84634bd43e50e5acaeff54ac7e7f7f97_images_1080_1440_mini.jpg,None,None,women,http://www.myntra.com/Tops/Elle/Elle-Women-Off-White-Clarity-Top/123060/buy,Sold byVector Ecommerce Pvt Ltd,None,None,['XS', 'S', 'M', 'L', 'XL'],None,<ul class="mk-pdpv1-product-helper mk-cf"><li class="desc-main-title">Product Description</li><li class="desc-sub-title">Style Note</li><li class="desc-sub-text " itemprop="description"><p>It is love at first sight. In a shade of off-white, this top from Elle is truly hard to ignore. We love its lace details and suggest you pair this piece with basic washed denims for maximum impact.</p></li><li class="desc-sub-title ">Product Details</li><li class="desc-sub-text"><p>Off-white top, round neck, extended sleeves, sheer yoke with lace and tucks in front, curved hem</p></li><li class="desc-sub-title ">Material &amp; Care</li><li class="desc-sub-text "><p>100% Cotton<br/>Machine wash</p></li><li class="desc-sub-title">Size &amp; Fit</li><li class="desc-sub-text"><p>The model (height 5'8" and chest 33") is wearing a size M</p></li></ul>,26:02:2014,None
