None,Elle Women Blue Top,http://www.myntra.com/Tops/Elle/Elle-Women-Blue-Top/160168/buy,Rs. 1,400,women-shirts-tops-tees,Shirts,Elle,http://myntra.myntassets.com/images/style/properties/Elle-Women-Blue-Top_b60ba17bf15fbe901a2cc1dbe68be197_images_1080_1440_mini.jpg,None,None,women,http://www.myntra.com/Tops/Elle/Elle-Women-Blue-Top/160168/buy,Sold byVector Ecommerce Pvt Ltd,None,None,['XS', 'S', 'M', 'L', 'ZS'],None,<ul class="mk-pdpv1-product-helper mk-cf"><li class="desc-main-title">Product Description</li><li class="desc-sub-title">Style Note</li><li class="desc-sub-text " itemprop="description"><p>In a shade of vibrant blue, this top from Elle is truly hard to ignore. We love its even pleat and ruffle detailing and suggest you pair this piece with basic washed denims and pumps for maximum impact.</p></li><li class="desc-sub-title ">Product Details</li><li class="desc-sub-text"><p>Blue top, woven, round neck with button loop closure at front, sleeveless, fixed box pleats at centre front with ruffles at either side, brand tag towards front hem, pleats at back neck</p></li><li class="desc-sub-title ">Material &amp; Care</li><li class="desc-sub-text "><p>Shell: 100% viscose<br/>Lining: 100% cotton<br/>Machine wash cold</p></li><li class="desc-sub-title">Size &amp; Fit</li><li class="desc-sub-text"><p>The model (height 5'8" and chest 33") is wearing a size S</p></li></ul>,26:02:2014,None
None,Elle Women Marvel Lavender Lace Trim Top,http://www.myntra.com/Tops/Elle/Elle-Women-Marvel-Lavender-Lace-Trim-Top/115177/buy,Rs. 1,600,women-shirts-tops-tees,Shirts,Elle,http://myntra.myntassets.com/images/style/properties/Elle-Women-Tops_9c487df9a24e05a8f23aad82b88b1736_images_1080_1440_mini.jpg,None,None,women,http://www.myntra.com/Tops/Elle/Elle-Women-Marvel-Lavender-Lace-Trim-Top/115177/buy,Sold byVector Ecommerce Pvt Ltd,None,None,['XS', 'S', 'M', 'L', 'XL'],None,<ul class="mk-pdpv1-product-helper mk-cf"><li class="desc-main-title">Product Description</li><li class="desc-sub-title">Style Note</li><li class="desc-sub-text " itemprop="description"><p>Featuring floaty fabric crafted into a relaxed fit, this top from Elle is a summer time dream. Tuck this vibrant lavender piece into belted ankle-length chinos and pair with loafers or ballet flats for a smart look.</p></li><li class="desc-sub-title ">Product Details</li><li class="desc-sub-text"><p>Lavender woven top, has a lace trimmed round neckline with pleat detail at one side, and short extended sleeves</p></li><li class="desc-sub-title ">Material &amp; Care</li><li class="desc-sub-text "><p>100% polyester<br/>Hand wash cold</p></li><li class="desc-sub-title">Size &amp; Fit</li><li class="desc-sub-text"><p>Relaxed fit<br/>The model (height 5'8'' and chest 33'') is wearing a size XS</p></li></ul>,26:02:2014,None
None,Elle Women Peach Coloured Lace Spaghetti Top,http://www.myntra.com/Tops/Elle/Elle-Women-Peach-Coloured-Lace-Spaghetti-Top/240960/buy,Rs. 795,women-shirts-tops-tees,Shirts,Elle,http://myntra.myntassets.com/images/style/properties/Elle-Women-Peach-Coloured-Lace-Spaghetti-Tank-Top_72c1d6514c9537ac80846a1fb880a1b2_images_1080_1440_mini.jpg,None,None,women,http://www.myntra.com/Tops/Elle/Elle-Women-Peach-Coloured-Lace-Spaghetti-Top/240960/buy,Sold byVector Ecommerce Pvt Ltd,None,None,['XS', 'S', 'M', 'L', 'ZS'],None,<ul class="mk-pdpv1-product-helper mk-cf"><li class="desc-main-title">Product Description</li><li class="desc-sub-title">Style Note</li><li class="desc-sub-text " itemprop="description"><p>Look cute in this spaghetti top from Elle. Wear it under a sheer shirt or with just a pair of slim fitting jeans for a simple but stylish outfit.</p></li><li class="desc-sub-title ">Product Details</li><li class="desc-sub-text"><p>Peach coloured, polka dot printed, knit spaghetti tank top, adjustable spaghetti straps, round neckline with lace trim</p></li><li class="desc-sub-title ">Material &amp; Care</li><li class="desc-sub-text "><p>100% cotton<br/>Hand wash cold</p></li><li class="desc-sub-title">Size &amp; Fit</li><li class="desc-sub-text"><p>The model (height 5'8" and chest 33") is wearing a size S</p></li></ul>,26:02:2014,None
None,Elle Women Sapphire Blue Top,http://www.myntra.com/Tops/Elle/Elle-Women-Sapphire-Blue-Top/160153/buy,Rs. 995,women-shirts-tops-tees,Shirts,Elle,http://myntra.myntassets.com/images/style/properties/Elle-Women-Sapphire-Blue-Top_8ef24c864fcce4ca6c4fb7387b797c0a_images_1080_1440_mini.jpg,None,None,women,http://www.myntra.com/Tops/Elle/Elle-Women-Sapphire-Blue-Top/160153/buy,Sold byVector Ecommerce Pvt Ltd,None,None,['XS', 'S', 'M', 'L', 'ZS'],None,<ul class="mk-pdpv1-product-helper mk-cf"><li class="desc-main-title">Product Description</li><li class="desc-sub-title">Style Note</li><li class="desc-sub-text " itemprop="description"><p>Dress classy this season in tops from Elle. This top with its vibrant colour is sure to make you look stylish and elegant. Team it with skin fit jeans and heels for a chic look.</p></li><li class="desc-sub-title ">Product Details</li><li class="desc-sub-text"><p>Sapphire blue top, woven, has a round neck, loop and button closure with key hole detail at back neck,panel with tucks near cap sleeves, patch pocket at left chest, metallic brand tag above left hem</p></li><li class="desc-sub-title ">Material &amp; Care</li><li class="desc-sub-text "><p>100% viscose<br/>Machine wash cold</p></li><li class="desc-sub-title">Size &amp; Fit</li><li class="desc-sub-text"><p>The model (height 5'8" and chest 33") is wearing a size S</p></li></ul>,26:02:2014,None
None,Elle Women Marvel Pink Lace Trim Top,http://www.myntra.com/Tops/Elle/Elle-Women-Marvel-Pink-Lace-Trim-Top/115176/buy,Rs. 1,600,women-shirts-tops-tees,Shirts,Elle,http://myntra.myntassets.com/images/style/properties/Elle-Women-Marvel-Pink-Lace-Trim-Top_e4fcf74e35779c02761e63843a79cd2d_images_1080_1440_mini.jpg,None,None,women,http://www.myntra.com/Tops/Elle/Elle-Women-Marvel-Pink-Lace-Trim-Top/115176/buy,Sold byVector Ecommerce Pvt Ltd,None,None,['XS', 'S', 'M', 'L', 'XL'],None,<ul class="mk-pdpv1-product-helper mk-cf"><li class="desc-main-title">Product Description</li><li class="desc-sub-title">Style Note</li><li class="desc-sub-text " itemprop="description"><p>Featuring floaty fabric crafted into a relaxed fit, this top from Elle is a summer time dream. Tuck this vibrant pink piece into belted ankle-length chinos and pair with loafers or ballet flats; for a smart look.</p></li><li class="desc-sub-title ">Product Details</li><li class="desc-sub-text"><p>Pink woven top, has a lace trimmed round neckline with pleat detail at one side, and short extended sleeves</p></li><li class="desc-sub-title ">Material &amp; Care</li><li class="desc-sub-text "><p>100% polyester<br/>Hand wash cold</p></li><li class="desc-sub-title">Size &amp; Fit</li><li class="desc-sub-text"><p>Relaxed fit<br/>The model (height 5'8'' and chest 33'') is wearing a size XS</p></li></ul>,26:02:2014,None
None,Elle Women Blue Shirt,http://www.myntra.com/Shirts/Elle/Elle-Women-Blue-Shirt/57080/buy,Rs. 1,540,women-shirts-tops-tees,Shirts,Elle,http://myntra.myntassets.com/images/style/properties/Elle-Women-Blue-Shirt_e578d9db1234199abe2e0fe5c39306b3_images_1080_1440_mini.jpg,Rs. 2,200,None,women,http://www.myntra.com/Shirts/Elle/Elle-Women-Blue-Shirt/57080/buy,Sold byVector Ecommerce Pvt Ltd,None,None,['XS', 'S', 'M', 'L', 'XL'],None,<ul class="mk-pdpv1-product-helper mk-cf"><li class="desc-main-title">Product Description</li><li class="desc-sub-title">Style Note</li><li class="desc-sub-text " itemprop="description"><p>ï   »   ¿   ï   »   ¿   Denim always adds a dose of cool to any outfit. This shirt, neatly designed, ensures a fine fit and a smart look. You can pair it with simple semi-formal trousers.</p></li><li class="desc-sub-title ">Product Details</li><li class="desc-sub-text"><p>ï   »   ¿   ï   »   ¿   Blue <a href="../denim">denim</a> woven shirt, has a spread collar, full buttoned placket, long sleeves with buttoned cuffs, mid arm buttoned tab for rolled up sleeves, gathers at the arm hole, front and back yoke, two patch pockets with box pleat detail and button flap closures on the chest, elasticated at the sides on the waist and a curved hemline</p></li><li class="desc-sub-title ">Material &amp; Care</li><li class="desc-sub-text "><p>100% cotton<br/>Machine wash cold<br/>Do not bleach or tumble dry<br/>Use cool iron</p></li><li class="desc-sub-title">Size &amp; Fit</li><li class="desc-sub-text"><p>Regular fit<br/>The model (height 5'8&amp;   rdquo  and chest 33&amp;   rdquo ) is wearing a size M</p></li></ul>,26:02:2014,None
None,Elle Women Electric Blue Lace Trimmed Spaghetti Top,http://www.myntra.com/Tops/Elle/Elle-Women-Electric-Blue-Lace-Trimmed-Spaghetti-Top/160166/buy,Rs. 600,women-shirts-tops-tees,Shirts,Elle,http://myntra.myntassets.com/images/style/properties/Elle-Women-Electric-Blue-Lace-Trimmed-Spaghetti-Top_e4836058a2a1ef9f0f73204fd0a4d9c1_images_1080_1440_mini.jpg,None,None,women,http://www.myntra.com/Tops/Elle/Elle-Women-Electric-Blue-Lace-Trimmed-Spaghetti-Top/160166/buy,Sold byVector Ecommerce Pvt Ltd,None,None,['XS', 'S', 'M', 'L', 'ZS'],None,<ul class="mk-pdpv1-product-helper mk-cf"><li class="desc-main-title">Product Description</li><li class="desc-sub-title">Style Note</li><li class="desc-sub-text " itemprop="description"><p>Cut from soft, stretchy jersey and featuring lace trim at the neck, this spaghetti top by Elle will easily become one of your go-to pieces. Pair it with shorts and printed sneakers for a look that is effortless yet chic.</p></li><li class="desc-sub-title ">Product Details</li><li class="desc-sub-text"><p>Electric blue spaghetti top, knit, V neck, adjustable shoulder straps, lace trim along front neck with gathers below</p></li><li class="desc-sub-title ">Material &amp; Care</li><li class="desc-sub-text "><p>95% cotton, 5% elastane<br/>Machine wash cold</p></li><li class="desc-sub-title">Size &amp; Fit</li><li class="desc-sub-text"><p>The model (height 5'8" and chest 33") is wearing a size S</p></li></ul>,26:02:2014,None
None,Elle Women Off-White Top,http://www.myntra.com/Tops/Elle/Elle-Women-Off-White-Top/171830/buy,Rs. 1,595,women-shirts-tops-tees,Shirts,Elle,http://myntra.myntassets.com/images/style/properties/Elle-Women-Cream-toned-Top_2265b411abb37721cb6a668a3630bad3_images_1080_1440_mini.jpg,None,None,women,http://www.myntra.com/Tops/Elle/Elle-Women-Off-White-Top/171830/buy,Sold byVector Ecommerce Pvt Ltd,None,None,['XS', 'S', 'M', 'L', 'XL'],None,<ul class="mk-pdpv1-product-helper mk-cf"><li class="desc-main-title">Product Description</li><li class="desc-sub-title">Style Note</li><li class="desc-sub-text " itemprop="description"><p>Get cozy in this delicate knit top by Elle. We love its lace back and  suggest matching it with a tailored skirt and a pair of pumps for a  feminine look.</p></li><li class="desc-sub-title ">Product Details</li><li class="desc-sub-text"><p>Off-white top, knitted, round  neck with beaded detail, keyhole with tie-up detailing at back neck, short sleeves with rolled up detail</p></li><li class="desc-sub-title ">Material &amp; Care</li><li class="desc-sub-text "><p>100% viscose<br/>Hand wash</p></li><li class="desc-sub-title">Size &amp; Fit</li><li class="desc-sub-text"><p>Regular fit<br/>The model (height 5'8" and chest 33") is wearing a size S</p></li></ul>,26:02:2014,None
None,Elle Women White Clarity Top,http://www.myntra.com/Tops/Elle/Elle-Women-White-Clarity-Top/123044/buy,Rs. 1,800,women-shirts-tops-tees,Shirts,Elle,http://myntra.myntassets.com/images/style/properties/Elle-Women-White-Top_90ab65e0a1cab880cd053f23f3649fc8_images_1080_1440_mini.jpg,None,None,women,http://www.myntra.com/Tops/Elle/Elle-Women-White-Clarity-Top/123044/buy,Sold byVector Ecommerce Pvt Ltd,None,None,['XS', 'S', 'M', 'L', 'XL'],None,<ul class="mk-pdpv1-product-helper mk-cf"><li class="desc-main-title">Product Description</li><li class="desc-sub-title">Style Note</li><li class="desc-sub-text " itemprop="description"><p>It is love at first sight. In a shade of delicate white, this top from Elle is truly hard to ignore. We love its even pleat details and suggest you pair this piece with basic washed denims for maximum impact.</p></li><li class="desc-sub-title ">Product Details</li><li class="desc-sub-text"><p>White woven top, round neck with slit, layered cap sleeves with gathers at shoulder, stitched pleats in front, brand badge at hem, attached lining</p></li><li class="desc-sub-title ">Material &amp; Care</li><li class="desc-sub-text "><p>100% Polyester<br/>Machine wash</p></li><li class="desc-sub-title">Size &amp; Fit</li><li class="desc-sub-text"><p>The model (height 5'8" and chest 33") is wearing a size M</p></li></ul>,26:02:2014,None
None,Elle Women Yellow Printed Essentials T-shirt,http://www.myntra.com/Tshirts/Elle/Elle-Women-Yellow-Printed-Essentials-T-shirt/123056/buy,Rs. 1,400,women-shirts-tops-tees,Shirts,Elle,http://myntra.myntassets.com/images/style/properties/Elle-Women-Yellow-Printed-Essentials-T-shirt_ffd02b740fc745cf4f46d5ef4dff0c6d_images_1080_1440_mini.jpg,None,None,women,http://www.myntra.com/Tshirts/Elle/Elle-Women-Yellow-Printed-Essentials-T-shirt/123056/buy,Sold byVector Ecommerce Pvt Ltd,None,None,['XS', 'S', 'M', 'L', 'XL'],None,<ul class="mk-pdpv1-product-helper mk-cf"><li class="desc-main-title">Product Description</li><li class="desc-sub-title">Style Note</li><li class="desc-sub-text " itemprop="description"><p>Lemon yellow in hue, this tee from Elle is our pick for summer fresh fashion. Team it with white capris and wedge heels for a day by the poolside.</p></li><li class="desc-sub-title ">Product Details</li><li class="desc-sub-text"><p>Yellow T-shirt, round neck, extended sleeves, lace trims, print in front with crystal detail, curved hem with back longer than the front</p></li><li class="desc-sub-title ">Material &amp; Care</li><li class="desc-sub-text "><p>100% cotton<br/>Machine wash</p></li><li class="desc-sub-title">Size &amp; Fit</li><li class="desc-sub-text"><p>The model (height 5'8" and chest 33") is wearing a size M</p></li></ul>,26:02:2014,None
None,Elle Women White Top,http://www.myntra.com/Tops/Elle/Elle-Women-White-Top/240962/buy,Rs. 1,095,women-shirts-tops-tees,Shirts,Elle,http://myntra.myntassets.com/images/style/properties/Elle-Women-White-Top_f0861f30180fc447a4f29c6fd004bd2b_images_1080_1440_mini.jpg,None,None,women,http://www.myntra.com/Tops/Elle/Elle-Women-White-Top/240962/buy,Sold byVector Ecommerce Pvt Ltd,None,None,['XS', 'S', 'M', 'L', 'XL', 'ZS'],None,<ul class="mk-pdpv1-product-helper mk-cf"><li class="desc-main-title">Product Description</li><li class="desc-sub-title">Style Note</li><li class="desc-sub-text " itemprop="description"><p>With a hint of sophistication, this monochrome top by Elle can easily transition from a semi-formal setting to a casual get together with friends. We suggest that you try matching this piece with a pair of black cigarette trousers and patent leather pumps for the complete look.</p></li><li class="desc-sub-title ">Product Details</li><li class="desc-sub-text"><p>White top, woven, contrast taping along round neck, short buttoned placket, short extended sleeves with contrast taping along cuffs, metal branding above left hem</p></li><li class="desc-sub-title ">Material &amp; Care</li><li class="desc-sub-text "><p>100% viscose<br/>Machine wash cold</p></li><li class="desc-sub-title">Size &amp; Fit</li><li class="desc-sub-text"><p>Regular fit<br/>The model (height 5'8" and chest 33") is wearing a size S</p></li></ul>,26:02:2014,None
None,Elle Women Peach Printed Top,http://www.myntra.com/Tops/Elle/Elle-Women-Peach-Printed-Top/198088/buy,Rs. 1,295,women-shirts-tops-tees,Shirts,Elle,http://myntra.myntassets.com/images/style/properties/Elle-Women-Peach-Printed-Top_ea291103d1252760ec31e4c30e42a962_images_1080_1440_mini.jpg,None,None,women,http://www.myntra.com/Tops/Elle/Elle-Women-Peach-Printed-Top/198088/buy,Sold byVector Ecommerce Pvt Ltd,None,None,['XS', 'S', 'M', 'L', 'ZS'],None,<ul class="mk-pdpv1-product-helper mk-cf"><li class="desc-main-title">Product Description</li><li class="desc-sub-title">Style Note</li><li class="desc-sub-text " itemprop="description"><p>In a shade of delicate peach, this top from Elle is truly hard to ignore. We love its print detail and suggest you pair this piece with basic washed denims and pumps for maximum impact.</p></li><li class="desc-sub-title ">Product Details</li><li class="desc-sub-text"><p>Peach top, knit, has a round neck, contrast print with sequin detail on front, stylised shoulder straps extending to back neck, straight hem</p></li><li class="desc-sub-title ">Material &amp; Care</li><li class="desc-sub-text "><p>100% cotton<br/>Machine wash cold</p></li><li class="desc-sub-title">Size &amp; Fit</li><li class="desc-sub-text"><p>The model (height 5'8" and chest 33") is wearing a size S</p></li></ul>,26:02:2014,None
None,Elle Women Blue Printed T-shirt,http://www.myntra.com/Tshirts/Elle/Elle-Women-Blue-Printed-T-shirt/240969/buy,Rs. 795,women-shirts-tops-tees,Shirts,Elle,http://myntra.myntassets.com/images/style/properties/Elle-Women-Blue-Printed-T-shirt_c858938f3256ded1a331532928d5aff4_images_1080_1440_mini.jpg,None,None,women,http://www.myntra.com/Tshirts/Elle/Elle-Women-Blue-Printed-T-shirt/240969/buy,Sold byVector Ecommerce Pvt Ltd,None,None,['XXS', 'XS', 'S', 'M', 'L'],None,<ul class="mk-pdpv1-product-helper mk-cf"><li class="desc-main-title">Product Description</li><li class="desc-sub-title">Style Note</li><li class="desc-sub-text " itemprop="description"><p>This season go bright and fun with these vibrant printed tees from Elle. Team this piece with a pair of skinny jeans and ballerina flats for a simple casual look.</p></li><li class="desc-sub-title ">Product Details</li><li class="desc-sub-text"><p>Light blue T-shirt, knitted, ribbed round neck, short extended sleeves, printed front</p></li><li class="desc-sub-title ">Material &amp; Care</li><li class="desc-sub-text "><p>100% cotton<br/>Hand wash</p></li><li class="desc-sub-title">Size &amp; Fit</li><li class="desc-sub-text"><p>Regular fit<br/>The model (height 5'8" and chest 33") is wearing a size S</p></li></ul>,26:02:2014,None
None,Elle Women White Lace Spaghetti Top,http://www.myntra.com/Tops/Elle/Elle-Women-White-Lace-Spaghetti-Top/240958/buy,Rs. 595,women-shirts-tops-tees,Shirts,Elle,http://myntra.myntassets.com/images/style/properties/Elle-Women-White-Lace-Spaghetti-Tank-Top_3acdc7420d81cb3c0bd82c6b14907da1_images_1080_1440_mini.jpg,None,None,women,http://www.myntra.com/Tops/Elle/Elle-Women-White-Lace-Spaghetti-Top/240958/buy,Sold byVector Ecommerce Pvt Ltd,None,None,['XS', 'S', 'M', 'L', 'ZS'],None,<ul class="mk-pdpv1-product-helper mk-cf"><li class="desc-main-title">Product Description</li><li class="desc-sub-title">Style Note</li><li class="desc-sub-text " itemprop="description"><p>Looking for a basic tank top that can be a versatile piece in your wardrobe? This piece from Elle is the best bet for you. Wear it under a sheer shirt or with just a pair of slim fitting jeans for a simple but stylish outfit.</p></li><li class="desc-sub-title ">Product Details</li><li class="desc-sub-text"><p>White top, knitted, lace trim along square neckline with attached and adjustable spaghetti shoulder straps, branding above left hem</p></li><li class="desc-sub-title ">Material &amp; Care</li><li class="desc-sub-text "><p>95% cotton, 5% Lycra<br/>Hand wash</p></li><li class="desc-sub-title">Size &amp; Fit</li><li class="desc-sub-text"><p>Regular fit<br/>The model (height 5'8" and chest 33") is wearing a size S</p></li></ul>,26:02:2014,None
None,Elle Women Black Top,http://www.myntra.com/Tops/Elle/Elle-Women-Black-Top/240961/buy,Rs. 1,095,women-shirts-tops-tees,Shirts,Elle,http://myntra.myntassets.com/images/style/properties/Elle-Women-Black-Top_595584ad4ecc421938cf8f8ec7fb948c_images_1080_1440_mini.jpg,None,None,women,http://www.myntra.com/Tops/Elle/Elle-Women-Black-Top/240961/buy,Sold byVector Ecommerce Pvt Ltd,None,None,['XS', 'S', 'M', 'L', 'XL', 'ZS'],None,<ul class="mk-pdpv1-product-helper mk-cf"><li class="desc-main-title">Product Description</li><li class="desc-sub-title">Style Note</li><li class="desc-sub-text " itemprop="description"><p>With a hint of sophistication, this monochrome top by Elle can easily transition from a semi-formal setting to a casual get together with friends. We suggest that you try matching this piece with a pair of black cigarette trousers and patent leather pumps for the complete look.</p></li><li class="desc-sub-title ">Product Details</li><li class="desc-sub-text"><p>Black top, woven, contrast taping along round neck, short buttoned placket, short extended sleeves with contrast taping along cuffs, metal branding above left hem</p></li><li class="desc-sub-title ">Material &amp; Care</li><li class="desc-sub-text "><p>100% viscose<br/>Machine wash cold</p></li><li class="desc-sub-title">Size &amp; Fit</li><li class="desc-sub-text"><p>Regular fit<br/>The model (height 5'8" and chest 33") is wearing a size S</p></li></ul>,26:02:2014,None
None,Elle Women Green Botanical Printed Top,http://www.myntra.com/Tops/Elle/Elle-Women-Green-Botanical-Printed-Top/123045/buy,Rs. 1,800,women-shirts-tops-tees,Shirts,Elle,http://myntra.myntassets.com/images/style/properties/Elle-Women-Tops_970575eefca7dfdf46bdad88d7601942_images_1080_1440_mini.jpg,None,None,women,http://www.myntra.com/Tops/Elle/Elle-Women-Green-Botanical-Printed-Top/123045/buy,Sold byVector Ecommerce Pvt Ltd,None,None,['XS', 'S', 'M', 'L', 'XL'],None,<ul class="mk-pdpv1-product-helper mk-cf"><li class="desc-main-title">Product Description</li><li class="desc-sub-title">Style Note</li><li class="desc-sub-text " itemprop="description"><p>A fragrant and colourful vegetable garden inspires this vibrant green printed top from Elle. Designed to delight, this piece is best paired with khaki trousers and cork wedge heels.</p></li><li class="desc-sub-title ">Product Details</li><li class="desc-sub-text"><p>Green printed top, spread collar with tie-ups, full buttoned placket with ruffles at neck, cap sleeves with gathers on top, curved hem<br/>Comes with a camisole that has adjustable shoulder straps</p></li><li class="desc-sub-title ">Material &amp; Care</li><li class="desc-sub-text "><p>Shell - 100% Polyester<br/>Lining - 100% Viscose<br/>Machine wash</p></li><li class="desc-sub-title">Size &amp; Fit</li><li class="desc-sub-text"><p>Regular fit<br/>The model (height 5'8" and chest 33") is wearing a size M</p></li></ul>,26:02:2014,None
None,Elle Women Printed White Top,http://www.myntra.com/Tops/Elle/Elle-Women-Printed-White-Top/57134/buy,Rs. 1,260,women-shirts-tops-tees,Shirts,Elle,http://myntra.myntassets.com/images/style/properties/Elle-Women-Printed-White-Top_d14927ea0d2f7da3b747cdd2d8be6b0f_images_1080_1440_mini.jpg,Rs. 1,800,None,women,http://www.myntra.com/Tops/Elle/Elle-Women-Printed-White-Top/57134/buy,Sold byVector Ecommerce Pvt Ltd,None,None,['XS', 'S', 'M', 'L', 'XL'],None,<ul class="mk-pdpv1-product-helper mk-cf"><li class="desc-main-title">Product Description</li><li class="desc-sub-title">Style Note</li><li class="desc-sub-text " itemprop="description"><p>Elle embodies femininity in all its creations. Trendy with detailed styling, while remaining both smart and understated, this top can easily be styled. Wear it with jeans and flats for a chic and casual look.</p></li><li class="desc-sub-title ">Product Details</li><li class="desc-sub-text"><p>White printed, woven top, has a round neckline, sleeveless, two tiered ruffles at the sides from the shoulder to above the hemline giving a flutter sleeve look and elasticated smocking above the hemline</p></li><li class="desc-sub-title ">Material &amp; Care</li><li class="desc-sub-text "><p>52% cotton and 48% viscose<br/>Hand wash<br/>Do not bleach or tumble dry<br/>Use cool iron</p></li><li class="desc-sub-title">Size &amp; Fit</li><li class="desc-sub-text"><p>Regular fit<br/>The model (height 5'8&amp;   rdquo  and chest 33&amp;   rdquo ) is wearing a size M</p></li></ul>,26:02:2014,None
None,Elle Women Dark Pink T-shirt,http://www.myntra.com/Tshirts/Elle/Elle-Women-Dark-Pink-T-shirt/57174/buy,Rs. 1,260,women-shirts-tops-tees,Shirts,Elle,http://myntra.myntassets.com/images/style/properties/Elle-Women-Red-T-shirt_5f41427ded4dc5e0cda0cf7acbc891e5_images_1080_1440_mini.jpg,Rs. 1,800,None,women,http://www.myntra.com/Tshirts/Elle/Elle-Women-Dark-Pink-T-shirt/57174/buy,Sold byVector Ecommerce Pvt Ltd,None,None,['XS', 'S', 'M', 'L', 'XL'],None,<ul class="mk-pdpv1-product-helper mk-cf"><li class="desc-main-title">Product Description</li><li class="desc-sub-title">Style Note</li><li class="desc-sub-text " itemprop="description"><p>Elle embodies femininity in all its creations. Trendy with detailed styling, while remaining both smart and understated, this top can easily be styled. Wear it with jeans and flats for a chic and casual look.</p></li><li class="desc-sub-title ">Product Details</li><li class="desc-sub-text"><p>Dark pink knit top, has a round neckline, crochet detail appliqued around the neckline and short sleeves with fold over cuffs</p></li><li class="desc-sub-title ">Material &amp; Care</li><li class="desc-sub-text "><p>95% cotton and 5% lycra<br/>Machine wash cold<br/>Do not bleach or tumble dry<br/>Use cool iron</p></li><li class="desc-sub-title">Size &amp; Fit</li><li class="desc-sub-text"><p>Regular fit<br/>The model (height 5'8"  and chest 33") is wearing a size M</p></li></ul>,26:02:2014,None
