None,Reebok Men Black Shorts,http://www.myntra.com/shorts/reebok/reebok-men-black-shorts/181257/buy,Rs. 1,104,men-shorts,Shorts,U.S. Polo Assn.,http://myntra.myntassets.com/images/style/properties/Reebok-Men-Shorts_8d760597181dc44f75d7f2c6cb328744_images_1080_1440_mini.jpg,Rs. 1,299,None,men,http://www.myntra.com/shorts/reebok/reebok-men-black-shorts/181257/buy,Sold byVector Ecommerce Pvt Ltd,None,None,['30', '32', '34', '36', '38'],None,<ul class="mk-pdpv1-product-helper mk-cf"><li class="desc-main-title">Product Description</li><li class="desc-sub-title">Style Note</li><li class="desc-sub-text " itemprop="description"><p>Get fashionable with Reebok's active range which blends style with fabric that supplement a comfortable work out. The comfortable fit and PlayDry technology, sweat-wicking fabric makes this piece an absolute must-have.  Match this pair with a tee and canvas shoes for a jog.</p></li><li class="desc-sub-title ">Product Details</li><li class="desc-sub-text"><p>Black shorts, knit, elasticated waistband with inner drawstring fastening, insert pockets at the sides, panelling at back yoke and sides, brand printed detail below left pocket, PlayDry print below yoke at back</p></li><li class="desc-sub-title ">Material &amp; Care</li><li class="desc-sub-text "><p>100% polyester<br/>Machine wash warm</p></li><li class="desc-sub-title">Size &amp; Fit</li><li class="desc-sub-text"><p>Regular fit<br/>The model (height 6' and waist 32") is wearing a size 32</p></li></ul>,25:02:2014,None
None,Proline Men Navy Varsity Shorts,http://www.myntra.com/shorts/proline/proline-men-navy-varsity-shorts/228220/buy,Rs. 749,men-shorts,Shorts,U.S. Polo Assn.,http://myntra.myntassets.com/images/style/properties/Proline-Men-Shorts_d9b4e6bb2369eaaf3303643cdb0ed60a_images_1080_1440_mini.jpg,None,None,men,http://www.myntra.com/shorts/proline/proline-men-navy-varsity-shorts/228220/buy,Sold byVector Ecommerce Pvt Ltd,None,None,['30', '32', '34', '36', '38'],None,<ul class="mk-pdpv1-product-helper mk-cf"><li class="desc-main-title">Product Description</li><li class="desc-sub-title">Style Note</li><li class="desc-sub-text " itemprop="description"><p>Proline brings to you a perfect pair of shorts for your comfort. These shorts provide you with good movement space and help you through your workouts.</p></li><li class="desc-sub-title ">Product Details</li><li class="desc-sub-text"><p>Navy blue knit shorts, elasticated waistband with drawstring fastening, two insert pockets at sides, numerical eight printed on the left thigh, taping detailing along the sides, has a patch pocket with button and branding at the back on the right side</p></li><li class="desc-sub-title ">Material &amp; Care</li><li class="desc-sub-text "><p>100% cotton<br/>Machine wash cold</p></li><li class="desc-sub-title">Size &amp; Fit</li><li class="desc-sub-text"><p>Regular fit<br/>The model (height 6' and waist 32") is wearing a size 32</p></li></ul>,25:02:2014,None
None,Sports 52 Men Dark Brown Cargo Shorts,http://www.myntra.com/shorts/sports-52/sports-52-men-dark-brown-cargo-shorts/224952/buy,Rs. 1,095,men-shorts,Shorts,U.S. Polo Assn.,http://myntra.myntassets.com/images/style/properties/Sports-52-Men-Dark-Brown-Cargo-Shorts_c793e02c259676366ae207f343b7f3f8_images_1080_1440_mini.jpg,None,None,men,http://www.myntra.com/shorts/sports-52/sports-52-men-dark-brown-cargo-shorts/224952/buy,Sold byVector Ecommerce Pvt Ltd,None,None,['30', '32', '34', '36'],None,<ul class="mk-pdpv1-product-helper mk-cf"><li class="desc-main-title">Product Description</li><li class="desc-sub-title">Style Note</li><li class="desc-sub-text " itemprop="description"><p>Get a cool and relaxed look this season with this pair of shorts from Sports 52. Team it up with a tee or a casual shirt and sneakers for that fashionable look.</p></li><li class="desc-sub-title ">Product Details</li><li class="desc-sub-text"><p>Dark brown shorts, woven, waistband with belt loops and inner drawstring closure, button and zip closure, stylised slant pockets, panelled legs, cargo pockets with buttoned flaps at sides, branding on the right pocket, patch pockets with buttoned flaps at back, brand label at back waistband, drawstring channelled through hem with contrast checked taping, stitch detail throughout<br/><br/></p></li><li class="desc-sub-title ">Material &amp; Care</li><li class="desc-sub-text "><p>Cotton<br/>Hand wash</p></li><li class="desc-sub-title">Size &amp; Fit</li><li class="desc-sub-text"><p>Comfort fit<br/>The model (height 6' and waist 32") is wearing a size M<br/><br/></p></li></ul>,25:02:2014,None
None,Roadster Men Maroon & Navy Checked Shorts,http://www.myntra.com/shorts/roadster/roadster-men-maroon-navy-checked-shorts/215983/buy,Rs. 899,men-shorts,Shorts,U.S. Polo Assn.,http://myntra.myntassets.com/images/style/properties/Roadster-Men-Maroon-&-Grey-Checked-Shorts_7af1d1aa4d1d53a4cf2b8c50bff97a69_images_1080_1440_mini.jpg,None,None,men,http://www.myntra.com/shorts/roadster/roadster-men-maroon-navy-checked-shorts/215983/buy,Sold byVector Ecommerce Pvt Ltd,None,None,['30', '32', '34', '36', '38'],None,<ul class="mk-pdpv1-product-helper mk-cf"><li class="desc-main-title">Product Description</li><li class="desc-sub-title">Style Note</li><li class="desc-sub-text " itemprop="description"><p>Get summer ready in these super-cool checked cotton shorts by Roadster. Match them with a printed tee or a casual shirt, a pair of slip-on shoes and a straw fedora for a cool, summer ensemble.</p></li><li class="desc-sub-title ">Product Details</li><li class="desc-sub-text"><p>Maroon, navy, off-white and grey checked shorts, woven, zip and fly closure, waistband with belt loops, slant pockets at the sides, a welt change pocket on the right, buttoned welt pockets at the back</p></li><li class="desc-sub-title ">Material &amp; Care</li><li class="desc-sub-text "><p>100% cotton<br/>Machine wash cold<br/>You are unique and wouldn't like it if the creator made too many people ditto.<br/>Similarly, this product is unique, handmade and crafted with love.<br/>There are no two products we make, which will ever be ditto.<br/>To maintain a high degree of authenticity, we advise our patrons to wash our products separately and expect some fading, colour bleeding, wear and tear.<br/>The article ages uniquely as you treat it, acquiring your personalised feel. Go on, enjoy this specially created product to the hilt. Have fun.</p></li><li class="desc-sub-title">Size &amp; Fit</li><li class="desc-sub-text"><p>Slim fit<br/>The model (height 6' and waist 32") is wearing a size 32</p></li></ul>,25:02:2014,None
None,Chromozome Men Navy Blue Soccer Shorts,http://www.myntra.com/shorts/chromozome/chromozome-men-navy-blue-soccer-shorts/50665/buy,Rs. 435,men-shorts,Shorts,U.S. Polo Assn.,http://myntra.myntassets.com/images/style/properties/1114ce8523e90c8af0ecce21b372bb17_images_1080_1440_mini.jpg,None,None,men,http://www.myntra.com/shorts/chromozome/chromozome-men-navy-blue-soccer-shorts/50665/buy,Sold byVector Ecommerce Pvt Ltd,None,None,['30', '32', '34', '36', '38'],None,<ul class="mk-pdpv1-product-helper mk-cf"><li class="desc-main-title">Product Description</li><li class="desc-sub-title">Style Note</li><li class="desc-sub-text " itemprop="description"><p>Soccer shorts from Chromozome that let you play on - in unhindered comfort. Pair this piece with a loose cotton tee and soccer cleats for a morning game.</p></li><li class="desc-sub-title ">Product Details</li><li class="desc-sub-text"><p>Navy blue soccer shorts, welt pockets at side, elasticated waist with drawstrings, grey panelling with embroidered branding near hem</p></li><li class="desc-sub-title ">Material &amp; Care</li><li class="desc-sub-text "><p>100% Cotton<br/>Machine wash</p></li><li class="desc-sub-title">Size &amp; Fit</li><li class="desc-sub-text"><p>Regular fit<br/> The model (height 6' and waist 32") is wearing a size M</p></li></ul>,25:02:2014,None
None,Nike Men Black Shorts,http://www.myntra.com/shorts/nike/nike-men-black-shorts/233724/buy,Rs. 1,595,men-shorts,Shorts,U.S. Polo Assn.,http://myntra.myntassets.com/images/style/properties/Nike-Men-Black-Shorts_f2a330c3260a0136d3da21d57fad582d_images_1080_1440_mini.JPG,None,None,men,http://www.myntra.com/shorts/nike/nike-men-black-shorts/233724/buy,Sold byVector Ecommerce Pvt Ltd,None,None,['30', '32', '34', '36'],None,<ul class="mk-pdpv1-product-helper mk-cf"><li class="desc-main-title">Product Description</li><li class="desc-sub-title">Style Note</li><li class="desc-sub-text " itemprop="description"><p>Especially created for athletic individuals, this pair of shorts by Nike offers the best in functionality, comfort and style. Wear it with an absorbent tee when you hit the gym.</p></li><li class="desc-sub-title ">Product Details</li><li class="desc-sub-text"><p>Black shorts, woven, featuring Dri-FIT and Stay Cool technologies, elasticated waistband with inner drawstring fastening, insert pockets at sides with built in mesh detail, built-in stretch boxer brief, coin pocket built into the boxer brief at right waist, mesh like panel detailing on sides, branding on left thigh close to hem, print detail at back below right waistband, vented sides<br/>Warranty: 6 months against manufacturing defects (not valid on products with more than 20% discount)</p></li><li class="desc-sub-title ">Material &amp; Care</li><li class="desc-sub-text "><p>Polyester<br/>Machine wash cold</p></li><li class="desc-sub-title">Size &amp; Fit</li><li class="desc-sub-text"><p>The model (height 6' and waist 32") is wearing a size 32</p></li></ul>,25:02:2014,None
None,HRX Men Navy Active Workout Shorts,http://www.myntra.com/shorts/hrx/hrx-men-navy-active-workout-shorts/212797/buy,Rs. 699,men-shorts,Shorts,U.S. Polo Assn.,http://myntra.myntassets.com/images/style/properties/HRX-Active-Men-Navy-&-Red-Easy-Workout-Shorts_22271fd7043b81cc5f6483e35413f03b_images_1080_1440_mini.jpg,None,None,men,http://www.myntra.com/shorts/hrx/hrx-men-navy-active-workout-shorts/212797/buy,Sold byVector Ecommerce Pvt Ltd,None,None,['30', '32', '34', '36'],None,<ul class="mk-pdpv1-product-helper mk-cf"><li class="desc-main-title">Product Description</li><li class="desc-sub-title">Style Note</li><li class="desc-sub-text " itemprop="description"><p>This piece from HRX is the coolest bottomwear when you hit the gym. Pair it with sport shoes when you are out to play your favourite sport.</p></li><li class="desc-sub-title ">Product Details</li><li class="desc-sub-text"><p>Navy blue shorts, elasticated waistband with drawstrings, two insert pockets at the sides, contrast taping along the sides, branding above left hem</p></li><li class="desc-sub-title ">Material &amp; Care</li><li class="desc-sub-text "><p>100% cotton<br/>Machine wash cold</p></li><li class="desc-sub-title">Size &amp; Fit</li><li class="desc-sub-text"><p>Regular fit<br/>The model (height 6' and waist 32") is wearing a size 32</p></li></ul>,25:02:2014,None
None,Duke Men Grey Melange Shorts,http://www.myntra.com/shorts/duke/duke-men-grey-melange-shorts/245925/buy,Rs. 545,men-shorts,Shorts,U.S. Polo Assn.,http://myntra.myntassets.com/images/style/properties/Duke-Men-Grey-Melange-Shorts_65be7db49ed19195f7fa0dc8b69c9152_images_1080_1440_mini.jpg,None,None,men,http://www.myntra.com/shorts/duke/duke-men-grey-melange-shorts/245925/buy,Sold byVector Ecommerce Pvt Ltd,None,None,['30', '32', '34', '36'],None,<ul class="mk-pdpv1-product-helper mk-cf"><li class="desc-main-title">Product Description</li><li class="desc-sub-title">Style Note</li><li class="desc-sub-text " itemprop="description"><p>Maximise your relaxation with this fabulous pair of coloured shorts from Duke's collection. The vibrant colour and trendy fit make this a must-have. It's best teamed with a printed tee and flip flops.</p></li><li class="desc-sub-title ">Product Details</li><li class="desc-sub-text"><p>Grey melange shorts, knitted, has an elasticated waistband with inner drawstrings, insert pockets at the sides, contrast piping detail down sides, embroidered branding at left thigh in front</p></li><li class="desc-sub-title ">Material &amp; Care</li><li class="desc-sub-text "><p>Cotton<br/>Hand wash cold</p></li><li class="desc-sub-title">Size &amp; Fit</li><li class="desc-sub-text"><p>Regular fit<br/>The model (height 6' and waist 32") is wearing a size 32</p></li></ul>,25:02:2014,None
None,Roadster Men Navy & Maroon Checked Shorts,http://www.myntra.com/shorts/roadster/roadster-men-navy-maroon-checked-shorts/215980/buy,Rs. 899,men-shorts,Shorts,U.S. Polo Assn.,http://myntra.myntassets.com/images/style/properties/Roadster-Men-Navy-&-Maroon-Checked-Shorts_321c3ba5ebc78b10c11ff1371c4e6f58_images_1080_1440_mini.jpg,None,None,men,http://www.myntra.com/shorts/roadster/roadster-men-navy-maroon-checked-shorts/215980/buy,Sold byVector Ecommerce Pvt Ltd,None,None,['30', '32', '34', '36', '38'],None,<ul class="mk-pdpv1-product-helper mk-cf"><li class="desc-main-title">Product Description</li><li class="desc-sub-title">Style Note</li><li class="desc-sub-text " itemprop="description"><p>Stay cool and comfortable this season by slipping into this pair of classic checked shorts by Roadster. Match it with just a printed crew neck tee or a crisp shirt and high-top trainers for a summer casual look.</p></li><li class="desc-sub-title ">Product Details</li><li class="desc-sub-text"><p>Navy, maroon and white checked shorts, woven, button and zip closure at front, waistband with belt loops, insert pockets at sides, coin pocket at right, welt pockets with button closure at back</p></li><li class="desc-sub-title ">Material &amp; Care</li><li class="desc-sub-text "><p>100% cotton<br/>Machine wash cold<br/>You are unique and wouldn't like it if the Creator made too many people ditto.<br/>Similarly, this product is unique, handmade and crafted with love.<br/>There are no two products we make, which will ever be ditto.<br/>To maintain a high degree of authenticity, we advise our patrons to wash our products separately and expect some fading, colour bleeding and wear &amp; tear. The article ages uniquely as you treat it, acquiring  your personalised feel.<br/>Go on, enjoy this specially created product to the hilt. Have fun.</p></li><li class="desc-sub-title">Size &amp; Fit</li><li class="desc-sub-text"><p>The model (height 6' and waist 32") is wearing a size 32</p></li></ul>,25:02:2014,None
