None,HRX Men Grey & Green Striped Polo T-shirt,http://www.myntra.com/Tshirts/HRX/HRX-Men-Grey-&-Green-Striped-Polo-T-shirt/189266/buy,Rs. 599,men-tees-polos,T-shirts & Collared Tees,HRX,http://myntra.myntassets.com/images/style/properties/HRX-Men-Tshirts_60e78e1ef34dafa9cec41871f9b4e858_images_1080_1440_mini.jpg,Rs. 999,None,men,http://www.myntra.com/Tshirts/HRX/HRX-Men-Grey-&-Green-Striped-Polo-T-shirt/189266/buy,Sold byVector Ecommerce Pvt Ltd,None,None,['S', 'M', 'L', 'XL'],None,<ul class="mk-pdpv1-product-helper mk-cf"><li class="desc-main-title">Product Description</li><li class="desc-sub-title">Style Note</li><li class="desc-sub-text " itemprop="description"><p>Hrithik Roshan's HRX collection brings you casual and comfortable T-shirts that are designed to make a strong style statement. Team this one with denims and sneakers for a look that's effortlessly cool and casual.</p></li><li class="desc-sub-title ">Product Details</li><li class="desc-sub-text"><p>Grey, white, green and purple striped polo T-shirt, knitted, solid white ribbed spread collar, short buttoned chest placket with stitched detail below, short sleeves with solid white ribbed cuffs, brand appliqué at left chest, brand tag at seam above right hem, straight vented hem with longer back hem</p></li><li class="desc-sub-title ">Material &amp; Care</li><li class="desc-sub-text "><p>100% cotton<br/>Machine wash cold</p></li><li class="desc-sub-title">Size &amp; Fit</li><li class="desc-sub-text"><p>Slim fit<br/>The model (height 6' and shoulders 18") is wearing a size M</p></li></ul>,26:02:2014,None
None,HRX Men Red Printed T-shirt,http://www.myntra.com/Tshirts/HRX/HRX-Men-Red-Printed-T-shirt/188200/buy,Rs. 359,men-tees-polos,T-shirts & Collared Tees,HRX,http://myntra.myntassets.com/images/style/properties/HRX-Men-Red-Printed-T-shirt_cb9d26aa13f78612647ee0b23c82cc6b_images_1080_1440_mini.jpg,Rs. 599,None,men,http://www.myntra.com/Tshirts/HRX/HRX-Men-Red-Printed-T-shirt/188200/buy,Sold byVector Ecommerce Pvt Ltd,None,None,['S', 'M', 'L', 'XL'],None,<ul class="mk-pdpv1-product-helper mk-cf"><li class="desc-main-title">Product Description</li><li class="desc-sub-title">Style Note</li><li class="desc-sub-text " itemprop="description"><p>With a super rich motto to live the best life possible come what may, Hrithik Roshan brings to your wardrobe a range of shirts that are high on performance, just like him. Styled to perfection by a team of highly skilled designers, HRX reflects sheer class and extreme comfort. Best teamed with lightly washed jeans and desert boots, this piece offers style to the last detail.</p></li><li class="desc-sub-title ">Product Details</li><li class="desc-sub-text"><p>Red T-shirt, knit, ribbed round neck, short sleeves, print on front</p></li><li class="desc-sub-title ">Material &amp; Care</li><li class="desc-sub-text "><p>100% cotton<br/>Machine wash cold</p></li><li class="desc-sub-title">Size &amp; Fit</li><li class="desc-sub-text"><p>Slim fit<br/>The model (height 6' and shoulders 18") is wearing a size M</p></li></ul>,26:02:2014,None
None,HRX Men Lime Green Radio T-shirt,http://www.myntra.com/Tshirts/HRX/HRX-Men-Lime-Green-Radio-T-shirt/188197/buy,Rs. 359,men-tees-polos,T-shirts & Collared Tees,HRX,http://myntra.myntassets.com/images/style/properties/HRX-Men-Tshirts_98aaff6028d70cd12ed59cca19a45faf_images_1080_1440_mini.jpg,Rs. 599,None,men,http://www.myntra.com/Tshirts/HRX/HRX-Men-Lime-Green-Radio-T-shirt/188197/buy,Sold byVector Ecommerce Pvt Ltd,None,None,['S', 'M', 'L', 'XL'],None,<ul class="mk-pdpv1-product-helper mk-cf"><li class="desc-main-title">Product Description</li><li class="desc-sub-title">Style Note</li><li class="desc-sub-text " itemprop="description"><p>Hrithik Roshan is known for his super-trendy fashion sense which is at once relaxed and sophisticated. You can now emulate this super star's unique style sensibility with his urban collection of casual wardrobe separates. Match this cool printed HRX tee with your favourite pair of distressed jeans and high-top trainers for a youthful vibe.</p></li><li class="desc-sub-title ">Product Details</li><li class="desc-sub-text"><p>Lime green printed T-shirt, knit, ribbed round neck, short sleeves, print on chest, brand tag above left hem</p></li><li class="desc-sub-title ">Material &amp; Care</li><li class="desc-sub-text "><p>100% cotton<br/>Machine wash cold</p></li><li class="desc-sub-title">Size &amp; Fit</li><li class="desc-sub-text"><p>Slim fit<br/>The model (height 6' and shoulders 18") is wearing a size L</p></li></ul>,26:02:2014,None
None,HRX Men Black T-shirt,http://www.myntra.com/Tshirts/HRX/HRX-Men-Black-T-shirt/210706/buy,Rs. 799,men-tees-polos,T-shirts & Collared Tees,HRX,http://myntra.myntassets.com/images/style/properties/HRX-Men-Black-T-shirt_ab4c6c467b2e8395012b36f7e4cca8d5_images_1080_1440_mini.jpg,None,None,men,http://www.myntra.com/Tshirts/HRX/HRX-Men-Black-T-shirt/210706/buy,Sold byVector Ecommerce Pvt Ltd,None,None,['S', 'M', 'L', 'XL'],None,<ul class="mk-pdpv1-product-helper mk-cf"><li class="desc-main-title">Product Description</li><li class="desc-sub-title">Style Note</li><li class="desc-sub-text " itemprop="description"><p>Hrithik Roshan is known for his super-trendy fashion sense which is at once relaxed and sophisticated. You can now emulate this super star's unique style sensibility with his urban collection of casual wardrobe separates. Match this cool HRX tee with your favourite pair of distressed jeans and high-top trainers for a youthful vibe.</p></li><li class="desc-sub-title ">Product Details</li><li class="desc-sub-text"><p>Black T-shirt, knitted, ribbed V neck, long sleeves, brand print at left chest, straight hem</p></li><li class="desc-sub-title ">Material &amp; Care</li><li class="desc-sub-text "><p>100% cotton<br/>Machine wash cold</p></li><li class="desc-sub-title">Size &amp; Fit</li><li class="desc-sub-text"><p>Slim fit<br/>The model (height 6' and shoulders 18") is wearing a size M</p></li></ul>,26:02:2014,None
None,HRX Men White Printed T-shirt,http://www.myntra.com/Tshirts/HRX/HRX-Men-White-Printed-T-shirt/188202/buy,Rs. 359,men-tees-polos,T-shirts & Collared Tees,HRX,http://myntra.myntassets.com/images/style/properties/HRX-Men-White-Printed-T-shirt_f394ac7f7bd88d721b30c8e7b3212d1f_images_1080_1440_mini.jpg,Rs. 599,None,men,http://www.myntra.com/Tshirts/HRX/HRX-Men-White-Printed-T-shirt/188202/buy,Sold byVector Ecommerce Pvt Ltd,None,None,['S', 'M', 'L', 'XL'],None,<ul class="mk-pdpv1-product-helper mk-cf"><li class="desc-main-title">Product Description</li><li class="desc-sub-title">Style Note</li><li class="desc-sub-text " itemprop="description"><p>Hrithik Roshan brings to your wardrobe a range of tees that are high on performance, just like him. Styled to perfection by highly skilled designers, apparel from HRX reflects sheer class and extreme comfort. Team this tee with lightly washed jeans and desert boots.</p></li><li class="desc-sub-title ">Product Details</li><li class="desc-sub-text"><p>White T-shirt, knit, ribbed round neck, short sleeves, graphic print at front, brand label along the seam on the left</p></li><li class="desc-sub-title ">Material &amp; Care</li><li class="desc-sub-text "><p>100% cotton<br/>Machine wash cold</p></li><li class="desc-sub-title">Size &amp; Fit</li><li class="desc-sub-text"><p>Slim fit<br/>The model (height 6' and shoulders 18") is wearing a size M</p></li></ul>,26:02:2014,None
None,HRX Men Grey Melange T-shirt,http://www.myntra.com/Tshirts/HRX/HRX-Men-Grey-Melange-T-shirt/210703/buy,Rs. 799,men-tees-polos,T-shirts & Collared Tees,HRX,http://myntra.myntassets.com/images/style/properties/HRX-Men-Grey-Melange-T-shirt_840b6f5b1f10c02805ec5b971ed1b88d_images_1080_1440_mini.jpg,None,None,men,http://www.myntra.com/Tshirts/HRX/HRX-Men-Grey-Melange-T-shirt/210703/buy,Sold byVector Ecommerce Pvt Ltd,None,None,['S', 'M', 'L', 'XL'],None,<ul class="mk-pdpv1-product-helper mk-cf"><li class="desc-main-title">Product Description</li><li class="desc-sub-title">Style Note</li><li class="desc-sub-text " itemprop="description"><p>Hrithik Roshan is known for his super-trendy fashion sense which is at once relaxed and sophisticated. You can now emulate this super star's unique style sensibility with his urban collection of casual wardrobe separates. Match this cool HRX tee with your favourite pair of distressed jeans and high-top trainers for a youthful vibe.</p></li><li class="desc-sub-title ">Product Details</li><li class="desc-sub-text"><p>Grey melange T-shirt, knitted, ribbed V neck, long sleeves, brand print at left chest, brand tag above left hem</p></li><li class="desc-sub-title ">Material &amp; Care</li><li class="desc-sub-text "><p>Cotton<br/>Machine wash cold</p></li><li class="desc-sub-title">Size &amp; Fit</li><li class="desc-sub-text"><p>Slim fit<br/>The model (height 6' and shoulders 18") is wearing a size L</p></li></ul>,26:02:2014,None
None,HRX Men White Printed T-shirt,http://www.myntra.com/Tshirts/HRX/HRX-Men-White-Printed-T-shirt/190460/buy,Rs. 599,men-tees-polos,T-shirts & Collared Tees,HRX,http://myntra.myntassets.com/images/style/properties/HRX-Men-White-Printed-T-shirt_c1cf584b626373a5db0f25cd7c210c20_images_1080_1440_mini.JPG,None,None,men,http://www.myntra.com/Tshirts/HRX/HRX-Men-White-Printed-T-shirt/190460/buy,Sold byVector Ecommerce Pvt Ltd,None,None,['S', 'M', 'L', 'XL'],None,<ul class="mk-pdpv1-product-helper mk-cf"><li class="desc-main-title">Product Description</li><li class="desc-sub-title">Style Note</li><li class="desc-sub-text " itemprop="description"><p>HRX brings to your wardrobe a range of T-shirts that are high on performance and style with extreme comfort. Team this piece with lightly washed jeans or chinos, and desert boots for stylish look.</p></li><li class="desc-sub-title ">Product Details</li><li class="desc-sub-text"><p>White T-shirt, knitted, ribbed round neck, short sleeves, print detail on front</p></li><li class="desc-sub-title ">Material &amp; Care</li><li class="desc-sub-text "><p>Cotton<br/>Machine wash warm</p></li><li class="desc-sub-title">Size &amp; Fit</li><li class="desc-sub-text"><p>Slim fit<br/>The model (height 6' and shoulders 18") is wearing a size M</p></li></ul>,26:02:2014,None
None,HRX Men Orange Printed T-shirt,http://www.myntra.com/Tshirts/HRX/HRX-Men-Orange-Printed-T-shirt/188196/buy,Rs. 599,men-tees-polos,T-shirts & Collared Tees,HRX,http://myntra.myntassets.com/images/style/properties/HRX-Men-Tshirts_413aeb9e510c11c97f6e5ca4b8649c6a_images_1080_1440_mini.jpg,None,None,men,http://www.myntra.com/Tshirts/HRX/HRX-Men-Orange-Printed-T-shirt/188196/buy,Sold byVector Ecommerce Pvt Ltd,None,None,['S', 'M', 'L', 'XL'],None,<ul class="mk-pdpv1-product-helper mk-cf"><li class="desc-main-title">Product Description</li><li class="desc-sub-title">Style Note</li><li class="desc-sub-text " itemprop="description"><p>With a super rich motto to live the best life possible come what may, Hrithik Roshan brings to your wardrobe a range of shirts that are high on performance, just like him. Styled to perfection by a team of highly skilled designers, HRX reflects sheer class and extreme comfort. Best teamed with lightly washed jeans and desert boots, this piece offers style to the last detail.</p></li><li class="desc-sub-title ">Product Details</li><li class="desc-sub-text"><p>Orange T-shirt, knit, ribbed round neck, short sleeves, graphic print on front</p></li><li class="desc-sub-title ">Material &amp; Care</li><li class="desc-sub-text "><p>100% cotton<br/>Machine wash cold</p></li><li class="desc-sub-title">Size &amp; Fit</li><li class="desc-sub-text"><p>Slim fit<br/>The model (height 6' and shoulders 18") is wearing a size M</p></li></ul>,26:02:2014,None
None,HRX Men Purple Pique Polo T-shirt,http://www.myntra.com/Tshirts/HRX/HRX-Men-Purple-Pique-Polo-T-shirt/188252/buy,Rs. 599,men-tees-polos,T-shirts & Collared Tees,HRX,http://myntra.myntassets.com/images/style/properties/HRX-Men-Purple-Pique-Polo-T-shirt_d9716418cc2f2b6b57f60d74a54d5fd1_images_1080_1440_mini.jpg,Rs. 999,None,men,http://www.myntra.com/Tshirts/HRX/HRX-Men-Purple-Pique-Polo-T-shirt/188252/buy,Sold byVector Ecommerce Pvt Ltd,None,None,['S', 'M', 'L', 'XL'],None,<ul class="mk-pdpv1-product-helper mk-cf"><li class="desc-main-title">Product Description</li><li class="desc-sub-title">Style Note</li><li class="desc-sub-text " itemprop="description"><p>Hrithik Roshan's HRX collection brings you casual and comfortable T-shirts that are designed to make a strong style statement. Team this one with denims and sneakers for a look that's effortlessly cool and casual.</p></li><li class="desc-sub-title ">Product Details</li><li class="desc-sub-text"><p>Purple pique knit polo T-shirt, ribbed spread collar, short buttoned chest placket with stitched detail below, short sleeves with ribbed cuffs, brand embroidery at left chest, brand label along the side seam at right, straight vented hem with longer back hem</p></li><li class="desc-sub-title ">Material &amp; Care</li><li class="desc-sub-text "><p>100% cotton<br/>Machine wash cold</p></li><li class="desc-sub-title">Size &amp; Fit</li><li class="desc-sub-text"><p>Slim fit<br/>The model (height 6' and shoulders 18") is wearing a size M</p></li></ul>,26:02:2014,None
None,HRX Men Blue Printed T-shirt,http://www.myntra.com/Tshirts/HRX/HRX-Men-Blue-Printed-T-shirt/190461/buy,Rs. 359,men-tees-polos,T-shirts & Collared Tees,HRX,http://myntra.myntassets.com/images/style/properties/HRX-Men-Tshirts_42bbe4834bf321cf09d982cf2f2e76c1_images_1080_1440_mini.JPG,Rs. 599,None,men,http://www.myntra.com/Tshirts/HRX/HRX-Men-Blue-Printed-T-shirt/190461/buy,Sold byVector Ecommerce Pvt Ltd,None,None,['S', 'M', 'L', 'XL'],None,<ul class="mk-pdpv1-product-helper mk-cf"><li class="desc-main-title">Product Description</li><li class="desc-sub-title">Style Note</li><li class="desc-sub-text " itemprop="description"><p>HRX brings to your wardrobe a range of T-shirts that are high on performance and style with extreme comfort .Team this piece with lightly washed jeans and desert boots for stylish look.</p></li><li class="desc-sub-title ">Product Details</li><li class="desc-sub-text"><p>Blue printed T-shirt, knitted, ribbed round neck, short sleeves, branding at right shoulder at back, straight hem</p></li><li class="desc-sub-title ">Material &amp; Care</li><li class="desc-sub-text "><p>Cotton<br/>Machine wash warm</p></li><li class="desc-sub-title">Size &amp; Fit</li><li class="desc-sub-text"><p>Slim fit<br/>The model (height 6' and shoulders 18") is wearing a size M</p></li></ul>,26:02:2014,None
None,HRX Men Blue T-shirt,http://www.myntra.com/Tshirts/HRX/HRX-Men-Blue-T-shirt/190470/buy,Rs. 359,men-tees-polos,T-shirts & Collared Tees,HRX,http://myntra.myntassets.com/images/style/properties/HRX-Men-Tshirts_8ddaa60f93b28c3d823b858379ee0095_images_1080_1440_mini.jpg,Rs. 599,None,men,http://www.myntra.com/Tshirts/HRX/HRX-Men-Blue-T-shirt/190470/buy,Sold byVector Ecommerce Pvt Ltd,None,None,['S', 'M', 'L', 'XL'],None,<ul class="mk-pdpv1-product-helper mk-cf"><li class="desc-main-title">Product Description</li><li class="desc-sub-title">Style Note</li><li class="desc-sub-text " itemprop="description"><p>Hrithik Roshan brings to your wardrobe, a range of T-shirts that are high on performance, just like him. Designed by a team of highly skilled designers, HRX reflects sheer class and comfort. Best teamed with lightly washed jeans and sneakers, this piece offers style to the last detail.</p></li><li class="desc-sub-title ">Product Details</li><li class="desc-sub-text"><p>Blue T-shirt, knit, ribbed round neck, short sleeves, contrast stripes at shoulder, branding at left chest</p></li><li class="desc-sub-title ">Material &amp; Care</li><li class="desc-sub-text "><p>100% cotton<br/>Machine wash cold</p></li><li class="desc-sub-title">Size &amp; Fit</li><li class="desc-sub-text"><p>Slim Fit<br/>The model (height 6' and shoulders 18") is wearing a size M</p></li></ul>,26:02:2014,None
None,HRX Men Black & Coral Red T-shirt,http://www.myntra.com/Tshirts/HRX/HRX-Men-Black-&-Coral-Red-T-shirt/190473/buy,Rs. 359,men-tees-polos,T-shirts & Collared Tees,HRX,http://myntra.myntassets.com/images/style/properties/HRX-Men-Tshirts_c87352692863cdc8619d352cc6ec5d94_images_1080_1440_mini.jpg,Rs. 599,None,men,http://www.myntra.com/Tshirts/HRX/HRX-Men-Black-&-Coral-Red-T-shirt/190473/buy,Sold byVector Ecommerce Pvt Ltd,None,None,['S', 'M', 'L', 'XL'],None,<ul class="mk-pdpv1-product-helper mk-cf"><li class="desc-main-title">Product Description</li><li class="desc-sub-title">Style Note</li><li class="desc-sub-text " itemprop="description"><p>Hrithik Roshan brings to your wardrobe a range of tees that are high on performance, just like him. Styled to perfection by highly skilled designers, apparel from HRX reflects sheer class and extreme comfort. Team this tee with lightly washed jeans or cargo pants, and desert boots.</p></li><li class="desc-sub-title ">Product Details</li><li class="desc-sub-text"><p>Black T-shirt, knit, has a contrast ribbed round neck, contrast short raglan sleeves with taping, brand print at left chest, contrast panels at front and back, regular hemline</p></li><li class="desc-sub-title ">Material &amp; Care</li><li class="desc-sub-text "><p>100% cotton<br/>Machine wash warm</p></li><li class="desc-sub-title">Size &amp; Fit</li><li class="desc-sub-text"><p>Slim fit<br/>The model (height 6' and shoulders 18") is wearing a size M</p></li></ul>,26:02:2014,None
None,HRX Men Black & Orange Striped T-shirt,http://www.myntra.com/Tshirts/HRX/HRX-Men-Black-&-Orange-Striped-T-shirt/189270/buy,Rs. 599,men-tees-polos,T-shirts & Collared Tees,HRX,http://myntra.myntassets.com/images/style/properties/HRX-Men-Tshirts_74bf7e7f7f17205e9eee9f6410b27b06_images_1080_1440_mini.JPG,Rs. 999,None,men,http://www.myntra.com/Tshirts/HRX/HRX-Men-Black-&-Orange-Striped-T-shirt/189270/buy,Sold byVector Ecommerce Pvt Ltd,None,None,['S', 'M', 'L', 'XL'],None,<ul class="mk-pdpv1-product-helper mk-cf"><li class="desc-main-title">Product Description</li><li class="desc-sub-title">Style Note</li><li class="desc-sub-text " itemprop="description"><p>Hrithik Roshan's HRX collection brings you casual and comfortable T-shirts that are designed to make a strong style statement. Team this one with denims and sneakers for a look that's effortlessly cool and casual.</p></li><li class="desc-sub-title ">Product Details</li><li class="desc-sub-text"><p>Black, orange and white striped polo T-shirt, knit, ribbed spread collar, short buttoned chest placket with stitched detail below, short sleeves with ribbed cuffs, brand print at left chest, brand label along the side seam at right, straight vented hem with longer back hem</p></li><li class="desc-sub-title ">Material &amp; Care</li><li class="desc-sub-text "><p>100% cotton<br/>Machine wash cold</p></li><li class="desc-sub-title">Size &amp; Fit</li><li class="desc-sub-text"><p>Slim fit<br/>The model (height 6' and shoulders 18") is wearing a size M</p></li></ul>,26:02:2014,None
None,HRX Men Red Pique Polo T-shirt,http://www.myntra.com/Tshirts/HRX/HRX-Men-Red-Pique-Polo-T-shirt/188253/buy,Rs. 599,men-tees-polos,T-shirts & Collared Tees,HRX,http://myntra.myntassets.com/images/style/properties/HRX-Men-Red-Pique-Polo-T-shirt_7cc27507de328b0674f3a054f33e7fb3_images_1080_1440_mini.jpg,Rs. 999,None,men,http://www.myntra.com/Tshirts/HRX/HRX-Men-Red-Pique-Polo-T-shirt/188253/buy,Sold byVector Ecommerce Pvt Ltd,None,None,['S', 'M', 'L', 'XL'],None,<ul class="mk-pdpv1-product-helper mk-cf"><li class="desc-main-title">Product Description</li><li class="desc-sub-title">Style Note</li><li class="desc-sub-text " itemprop="description"><p>Hrithik Roshan's HRX collection brings you casual and comfortable T-shirts that are designed to make a strong style statement. Team this one with denims and sneakers for a look that's effortlessly cool and casual.</p></li><li class="desc-sub-title ">Product Details</li><li class="desc-sub-text"><p>Red pique knit polo T-shirt, ribbed spread collar, short buttoned chest placket with stitched detail below, short sleeves with ribbed cuffs, brand embroidery at left chest, brand label along the side seam at right, straight vented hem with longer back hem</p></li><li class="desc-sub-title ">Material &amp; Care</li><li class="desc-sub-text "><p>100% cotton<br/>Machine wash cold</p></li><li class="desc-sub-title">Size &amp; Fit</li><li class="desc-sub-text"><p>Slim fit<br/>The model (height 6' and shoulders 18") is wearing a size M</p></li></ul>,26:02:2014,None
None,HRX Men Multi-Coloured Striped Polo T-shirt,http://www.myntra.com/Tshirts/HRX/HRX-Men-Multi-Coloured-Striped-Polo-T-shirt/189261/buy,Rs. 599,men-tees-polos,T-shirts & Collared Tees,HRX,http://myntra.myntassets.com/images/style/properties/HRX-Men-Multi-Coloured-Striped-Polo-T-shirt_cd8085b832374be78ba713de31ce9648_images_1080_1440_mini.jpg,Rs. 999,None,men,http://www.myntra.com/Tshirts/HRX/HRX-Men-Multi-Coloured-Striped-Polo-T-shirt/189261/buy,Sold byVector Ecommerce Pvt Ltd,None,None,['S', 'M', 'L', 'XL'],None,<ul class="mk-pdpv1-product-helper mk-cf"><li class="desc-main-title">Product Description</li><li class="desc-sub-title">Style Note</li><li class="desc-sub-text " itemprop="description"><p>Hrithik Roshan's HRX collection brings you casual and comfortable T-shirts that are designed to make a strong style statement. Team this one with denims and sneakers for a look that's effortlessly cool and casual.</p></li><li class="desc-sub-title ">Product Details</li><li class="desc-sub-text"><p>Multi-coloured striped polo T-shirt, knit, solid ribbed polo collar, short buttoned chest placket with stitched detail below, short sleeves with ribbed cuffs, brand print at left chest, brand label along the side seam at right, straight vented hem with longer back hem</p></li><li class="desc-sub-title ">Material &amp; Care</li><li class="desc-sub-text "><p>100% cotton<br/>Machine wash cold</p></li><li class="desc-sub-title">Size &amp; Fit</li><li class="desc-sub-text"><p>Slim fit<br/>The model (height 6' and shoulders 18") is wearing a size M</p></li></ul>,26:02:2014,None
None,HRX Men White T-shirt,http://www.myntra.com/Tshirts/HRX/HRX-Men-White-T-shirt/190468/buy,Rs. 799,men-tees-polos,T-shirts & Collared Tees,HRX,http://myntra.myntassets.com/images/style/properties/HRX-Men-White-T-shirt_37e610d2d32f50506fd8a2acd9e4e2fe_images_1080_1440_mini.jpg,None,None,men,http://www.myntra.com/Tshirts/HRX/HRX-Men-White-T-shirt/190468/buy,Sold byVector Ecommerce Pvt Ltd,None,None,['S', 'M', 'L', 'XL'],None,<ul class="mk-pdpv1-product-helper mk-cf"><li class="desc-main-title">Product Description</li><li class="desc-sub-title">Style Note</li><li class="desc-sub-text " itemprop="description"><p>HRX brings to your wardrobe a range of T-shirts that are high on performance and style with extreme comfort. Team this piece with lightly washed jeans or chinos, and desert boots for stylish look.</p></li><li class="desc-sub-title ">Product Details</li><li class="desc-sub-text"><p>White T-shirt, knitted, ribbed V neck, long sleeves with ribbed cuffs, high density branding at left chest</p></li><li class="desc-sub-title ">Material &amp; Care</li><li class="desc-sub-text "><p>Cotton<br/>Machine wash warm</p></li><li class="desc-sub-title">Size &amp; Fit</li><li class="desc-sub-text"><p>Slim fit<br/>The model (height 6' and shoulders 18") is wearing a size M</p></li></ul>,26:02:2014,None
None,HRX Men Blue Printed T-shirt,http://www.myntra.com/Tshirts/HRX/HRX-Men-Blue-Printed-T-shirt/203830/buy,Rs. 359,men-tees-polos,T-shirts & Collared Tees,HRX,http://myntra.myntassets.com/images/style/properties/HRX-Men-Blue-Printed-T-shirt_3b718fd1956bbbf8574d34c171009d94_images_1080_1440_mini.jpg,Rs. 599,None,men,http://www.myntra.com/Tshirts/HRX/HRX-Men-Blue-Printed-T-shirt/203830/buy,Sold byVector Ecommerce Pvt Ltd,None,None,['S', 'M', 'L', 'XL'],None,<ul class="mk-pdpv1-product-helper mk-cf"><li class="desc-main-title">Product Description</li><li class="desc-sub-title">Style Note</li><li class="desc-sub-text " itemprop="description"><p>Hrithik Roshan brings to your wardrobe a range of tees that are high on performance, just like him. Styled to perfection by highly skilled designers, apparel from HRX reflects sheer class and extreme comfort. Team this tee with lightly washed jeans or cargos, and desert boots.</p></li><li class="desc-sub-title ">Product Details</li><li class="desc-sub-text"><p>Blue printed T-shirt, knit, ribbed round neck, short sleeves, multi-coloured stripes at chest with a contrast flock print branding at left, contrast panels at front and back, regular hemline<br/>Treated for moisture management for enhanced performance<br/></p></li><li class="desc-sub-title ">Material &amp; Care</li><li class="desc-sub-text "><p>Cotton blend<br/>Machine wash warm</p></li><li class="desc-sub-title">Size &amp; Fit</li><li class="desc-sub-text"><p>Regular fit<br/>The model (height 6' and shoulders 18") is wearing a size M</p></li></ul>,26:02:2014,None
