None,HRX Men Red T-shirt,http://www.myntra.com/Tshirts/HRX/HRX-Men-Red-T-shirt/190467/buy,Rs. 799,men-tees-polos,T-shirts & Collared Tees,HRX,http://myntra.myntassets.com/images/style/properties/HRX-Men-Red-T-shirt_2731e235705b278ae6c5fed422304173_images_1080_1440_mini.jpg,None,None,men,http://www.myntra.com/Tshirts/HRX/HRX-Men-Red-T-shirt/190467/buy,Sold byVector Ecommerce Pvt Ltd,None,None,['S', 'M', 'L', 'XL'],None,<ul class="mk-pdpv1-product-helper mk-cf"><li class="desc-main-title">Product Description</li><li class="desc-sub-title">Style Note</li><li class="desc-sub-text " itemprop="description"><p>HRX brings to your wardrobe a range of T-shirts that are high on performance and style with extreme comfort. Team this piece with lightly washed jeans or chinos, and desert boots for stylish look.</p></li><li class="desc-sub-title ">Product Details</li><li class="desc-sub-text"><p>Red T-shirt, knitted, ribbed V neck, long sleeves with ribbed cuffs, high density branding at left chest</p></li><li class="desc-sub-title ">Material &amp; Care</li><li class="desc-sub-text "><p>Cotton<br/>Machine wash warm</p></li><li class="desc-sub-title">Size &amp; Fit</li><li class="desc-sub-text"><p>Slim fit<br/>The model (height 6' and shoulders 18") is wearing a size M</p></li></ul>,26:02:2014,None
None,HRX Men White Cat T-shirt,http://www.myntra.com/Tshirts/HRX/HRX-Men-White-Cat-T-shirt/188207/buy,Rs. 599,men-tees-polos,T-shirts & Collared Tees,HRX,http://myntra.myntassets.com/images/style/properties/HRX-Men-Tshirts_c127666aa42127d5de5dd4dd3b854bec_images_1080_1440_mini.jpg,None,None,men,http://www.myntra.com/Tshirts/HRX/HRX-Men-White-Cat-T-shirt/188207/buy,Sold byVector Ecommerce Pvt Ltd,None,None,['S', 'M', 'L', 'XL'],None,<ul class="mk-pdpv1-product-helper mk-cf"><li class="desc-main-title">Product Description</li><li class="desc-sub-title">Style Note</li><li class="desc-sub-text " itemprop="description"><p>Hrithik Roshan is known for his super-trendy fashion sense which is at once relaxed and sophisticated. You can now emulate this super star's unique style sensibility with his urban collection of casual wardrobe separates. Match this cool printed HRX tee with your favourite pair of distressed jeans and high-top trainers for a youthful vibe.</p></li><li class="desc-sub-title ">Product Details</li><li class="desc-sub-text"><p>White printed T-shirt, knit, ribbed round neck, short sleeves, print on chest, brand tag above left hem</p></li><li class="desc-sub-title ">Material &amp; Care</li><li class="desc-sub-text "><p>100% cotton<br/>Machine wash cold</p></li><li class="desc-sub-title">Size &amp; Fit</li><li class="desc-sub-text"><p>Slim fit<br/>The model (height 6' and shoulders 18") is wearing a size L</p></li></ul>,26:02:2014,None
None,HRX Men Red Printed T-shirt,http://www.myntra.com/Tshirts/HRX/HRX-Men-Red-Printed-T-shirt/203826/buy,Rs. 599,men-tees-polos,T-shirts & Collared Tees,HRX,http://myntra.myntassets.com/images/style/properties/HRX-Men-Red-Printed-T-shirt_cb361a6d7835776771eb00703c0164cd_images_1080_1440_mini.jpg,None,None,men,http://www.myntra.com/Tshirts/HRX/HRX-Men-Red-Printed-T-shirt/203826/buy,Sold byVector Ecommerce Pvt Ltd,None,None,['S', 'M', 'L', 'XL'],None,<ul class="mk-pdpv1-product-helper mk-cf"><li class="desc-main-title">Product Description</li><li class="desc-sub-title">Style Note</li><li class="desc-sub-text " itemprop="description"><p>Hrithik Roshan brings to your wardrobe a range of tees that are high on performance, just like him. Styled to perfection by highly skilled designers, apparel from HRX reflects sheer class and extreme comfort. Team this tee with lightly washed jeans or cargo pants, and desert boots.</p></li><li class="desc-sub-title ">Product Details</li><li class="desc-sub-text"><p>Red printed T-shirt, knit, has a ribbed round neck, short sleeves with contrast panel at sides, branding at left chest, graphic print at front, brand print at back, regular hemline</p></li><li class="desc-sub-title ">Material &amp; Care</li><li class="desc-sub-text "><p>Cotton<br/>Machine wash warm</p></li><li class="desc-sub-title">Size &amp; Fit</li><li class="desc-sub-text"><p>Slim fit<br/>The model (height 6' and shoulders 18") is wearing a size M</p></li></ul>,26:02:2014,None
None,HRX Men Grey T-shirt,http://www.myntra.com/Tshirts/HRX/HRX-Men-Grey-T-shirt/190476/buy,Rs. 359,men-tees-polos,T-shirts & Collared Tees,HRX,http://myntra.myntassets.com/images/style/properties/HRX-Men-Tshirts_939905d90f2a18cbb02a2005fec63c6c_images_1080_1440_mini.JPG,Rs. 599,None,men,http://www.myntra.com/Tshirts/HRX/HRX-Men-Grey-T-shirt/190476/buy,Sold byVector Ecommerce Pvt Ltd,None,None,['S', 'M', 'L', 'XL'],None,<ul class="mk-pdpv1-product-helper mk-cf"><li class="desc-main-title">Product Description</li><li class="desc-sub-title">Style Note</li><li class="desc-sub-text " itemprop="description"><p>Hrithik Roshan brings to your wardrobe, a range of T-shirts that are high on performance, just like him. Designed by a team of highly skilled designers, HRX reflects quality, class and comfort. Best teamed with lightly washed jeans and sneakers, this piece offers style to the last detail.</p></li><li class="desc-sub-title ">Product Details</li><li class="desc-sub-text"><p>Grey T-shirt, knit, ribbed round neck, short sleeves, contrast piping at shoulder, branding at left chest, contrast panel at centre back</p></li><li class="desc-sub-title ">Material &amp; Care</li><li class="desc-sub-text "><p>100% cotton<br/>Machine wash cold</p></li><li class="desc-sub-title">Size &amp; Fit</li><li class="desc-sub-text"><p>Slim Fit<br/>The model (height 6' and shoulders 18") is wearing a size M</p></li></ul>,26:02:2014,None
None,HRX Men Grey Printed T-shirt,http://www.myntra.com/Tshirts/HRX/HRX-Men-Grey-Printed-T-shirt/188198/buy,Rs. 599,men-tees-polos,T-shirts & Collared Tees,HRX,http://myntra.myntassets.com/images/style/properties/HRX-Men-Tshirts_74506c257909502fdfbd40c5bde62f77_images_1080_1440_mini.jpg,None,None,men,http://www.myntra.com/Tshirts/HRX/HRX-Men-Grey-Printed-T-shirt/188198/buy,Sold byVector Ecommerce Pvt Ltd,None,None,['S', 'M', 'L', 'XL'],None,<ul class="mk-pdpv1-product-helper mk-cf"><li class="desc-main-title">Product Description</li><li class="desc-sub-title">Style Note</li><li class="desc-sub-text " itemprop="description"><p>With a super rich motto to live the best life possible come what may, Hrithik Roshan brings to your wardrobe a range of shirts that are high on performance, just like him. Styled to perfection by a team of highly skilled designers, HRX reflects sheer class and extreme comfort. Best teamed with lightly washed jeans and desert boots, this piece offers style to the last detail.</p></li><li class="desc-sub-title ">Product Details</li><li class="desc-sub-text"><p>Grey T-shirt, knit, ribbed round neck, short sleeves, graphic print on front</p></li><li class="desc-sub-title ">Material &amp; Care</li><li class="desc-sub-text "><p>100% cotton<br/>Machine wash cold</p></li><li class="desc-sub-title">Size &amp; Fit</li><li class="desc-sub-text"><p>Slim fit<br/>The model (height 6' and shoulders 18") is wearing a size M</p></li></ul>,26:02:2014,None
None,HRX Men Black T-shirt,http://www.myntra.com/Tshirts/HRX/HRX-Men-Black-T-shirt/190475/buy,Rs. 359,men-tees-polos,T-shirts & Collared Tees,HRX,http://myntra.myntassets.com/images/style/properties/HRX-Men-Tshirts_5be02aa395d810815cbe36a1ff8a9545_images_1080_1440_mini.JPG,Rs. 599,None,men,http://www.myntra.com/Tshirts/HRX/HRX-Men-Black-T-shirt/190475/buy,Sold byVector Ecommerce Pvt Ltd,None,None,['S', 'M', 'L', 'XL'],None,<ul class="mk-pdpv1-product-helper mk-cf"><li class="desc-main-title">Product Description</li><li class="desc-sub-title">Style Note</li><li class="desc-sub-text " itemprop="description"><p>Hrithik Roshan brings to your wardrobe, a range of T-shirts that are high on performance, just like him. Designed by a team of highly skilled designers, HRX reflects quality, class and comfort. Best teamed with lightly washed jeans and sneakers, this piece offers style to the last detail.</p></li><li class="desc-sub-title ">Product Details</li><li class="desc-sub-text"><p>Black T-shirt, knit, ribbed round neck, short sleeves, contrast piping at shoulder, branding at left chest, contrast panel at centre back</p></li><li class="desc-sub-title ">Material &amp; Care</li><li class="desc-sub-text "><p>100% cotton<br/>Machine wash cold</p></li><li class="desc-sub-title">Size &amp; Fit</li><li class="desc-sub-text"><p>Slim Fit<br/>The model (height 6' and shoulders 18") is wearing a size M</p></li></ul>,26:02:2014,None
None,HRX Men White Breathe T-shirt,http://www.myntra.com/Tshirts/HRX/HRX-Men-White-Breathe-T-shirt/188209/buy,Rs. 359,men-tees-polos,T-shirts & Collared Tees,HRX,http://myntra.myntassets.com/images/style/properties/HRX-Men-Tshirts_9806e3444dd07a6998a6a6a789819ddc_images_1080_1440_mini.jpg,Rs. 599,None,men,http://www.myntra.com/Tshirts/HRX/HRX-Men-White-Breathe-T-shirt/188209/buy,Sold byVector Ecommerce Pvt Ltd,None,None,['S', 'M', 'L', 'XL'],None,<ul class="mk-pdpv1-product-helper mk-cf"><li class="desc-main-title">Product Description</li><li class="desc-sub-title">Style Note</li><li class="desc-sub-text " itemprop="description"><p>Hrithik Roshan is known for his super-trendy fashion sense which is at once relaxed and sophisticated. You can now emulate this super star's unique style sensibility with his urban collection of casual wardrobe separates. Match this cool printed HRX tee with your favourite pair of distressed jeans and high-top trainers for a youthful vibe.</p></li><li class="desc-sub-title ">Product Details</li><li class="desc-sub-text"><p>White printed T-shirt, knit, ribbed round neck, short sleeves, print on chest, brand tag above left hem</p></li><li class="desc-sub-title ">Material &amp; Care</li><li class="desc-sub-text "><p>100% cotton<br/>Machine wash cold</p></li><li class="desc-sub-title">Size &amp; Fit</li><li class="desc-sub-text"><p>Slim fit<br/>The model (height 6' and shoulders 18") is wearing a size L</p></li></ul>,26:02:2014,None
None,HRX Men Navy & Red Pique Polo T-shirt,http://www.myntra.com/Tshirts/HRX/HRX-Men-Navy-&-Red-Pique-Polo-T-shirt/188250/buy,Rs. 699,men-tees-polos,T-shirts & Collared Tees,HRX,http://myntra.myntassets.com/images/style/properties/HRX-Men-Navy-&-Red-Pique-Polo-T-shirt_0f801594ddacd063323a3a2c5fa8c4b3_images_1080_1440_mini.jpg,Rs. 999,None,men,http://www.myntra.com/Tshirts/HRX/HRX-Men-Navy-&-Red-Pique-Polo-T-shirt/188250/buy,Sold byVector Ecommerce Pvt Ltd,None,None,['S', 'M', 'L', 'XL'],None,<ul class="mk-pdpv1-product-helper mk-cf"><li class="desc-main-title">Product Description</li><li class="desc-sub-title">Style Note</li><li class="desc-sub-text " itemprop="description"><p>Hrithik Roshan's HRX collection brings you casual and comfortable T-shirts that are designed to make a strong style statement. Team this one with denims and sneakers for a look that's effortlessly cool and casual.</p></li><li class="desc-sub-title ">Product Details</li><li class="desc-sub-text"><p>Navy, red, and purple pique knit polo T-shirt, ribbed spread collar, short buttoned chest placket, short sleeves with ribbed cuffs, panelled at front and back, brand embroidery at left chest, striped label on right shoulder, straight vented hem with longer back hem</p></li><li class="desc-sub-title ">Material &amp; Care</li><li class="desc-sub-text "><p>100% cotton<br/>Machine wash cold</p></li><li class="desc-sub-title">Size &amp; Fit</li><li class="desc-sub-text"><p>Slim fit<br/>The model (height 6' and shoulders 18") is wearing a size M</p></li></ul>,26:02:2014,None
None,HRX Men Grey & Green T-shirt,http://www.myntra.com/Tshirts/HRX/HRX-Men-Grey-&-Green-T-shirt/190478/buy,Rs. 599,men-tees-polos,T-shirts & Collared Tees,HRX,http://myntra.myntassets.com/images/style/properties/HRX-Men-Grey-&-Green-T-shirt_e4911b1898985eb4d0b3eb918740393c_images_1080_1440_mini.jpg,None,None,men,http://www.myntra.com/Tshirts/HRX/HRX-Men-Grey-&-Green-T-shirt/190478/buy,Sold byVector Ecommerce Pvt Ltd,None,None,['S', 'M', 'L', 'XL'],None,<ul class="mk-pdpv1-product-helper mk-cf"><li class="desc-main-title">Product Description</li><li class="desc-sub-title">Style Note</li><li class="desc-sub-text " itemprop="description"><p>Hrithik Roshan brings to your wardrobe a range of tees that are high on performance, just like him. Styled to perfection by highly skilled designers, apparel from HRX reflects sheer class and extreme comfort. Team this tee with lightly washed jeans or cargo pants, and desert boots.</p></li><li class="desc-sub-title ">Product Details</li><li class="desc-sub-text"><p>Grey and green T-shirt, knit, has a contrast ribbed round neck, contrast short raglan sleeves, brand print at left chest, regular hemline</p></li><li class="desc-sub-title ">Material &amp; Care</li><li class="desc-sub-text "><p>Cotton<br/>Machine wash warm</p></li><li class="desc-sub-title">Size &amp; Fit</li><li class="desc-sub-text"><p>Slim fit<br/>The model (height 6' and shoulders 18") is wearing a size M</p></li></ul>,26:02:2014,None
None,HRX Men Grey Printed T-shirt,http://www.myntra.com/Tshirts/HRX/HRX-Men-Grey-Printed-T-shirt/203829/buy,Rs. 599,men-tees-polos,T-shirts & Collared Tees,HRX,http://myntra.myntassets.com/images/style/properties/HRX-Men-Grey-Printed-T-shirt_30c6300d1372db8bf89eb0543117aaf6_images_1080_1440_mini.jpg,None,None,men,http://www.myntra.com/Tshirts/HRX/HRX-Men-Grey-Printed-T-shirt/203829/buy,Sold byVector Ecommerce Pvt Ltd,None,None,['S', 'M', 'L', 'XL'],None,<ul class="mk-pdpv1-product-helper mk-cf"><li class="desc-main-title">Product Description</li><li class="desc-sub-title">Style Note</li><li class="desc-sub-text " itemprop="description"><p>Hrithik Roshan is known for his super-trendy fashion sense which is at once relaxed and sophisticated. You can now emulate this super star's unique style sensibility with his urban collection of casual wardrobe separates. Match this cool HRX tee with your favourite pair of distressed jeans or cargos and high-top trainers for a youthful vibe.</p></li><li class="desc-sub-title ">Product Details</li><li class="desc-sub-text"><p>Grey printed T-shirt, has a ribbed round neck, short sleeves, contrast stripes at chest, branding at left chest, contrast panels at sides and back<br/>Treated for moisture management for enhanced performance<br/></p></li><li class="desc-sub-title ">Material &amp; Care</li><li class="desc-sub-text "><p>Cotton blend<br/>Machine wash warm</p></li><li class="desc-sub-title">Size &amp; Fit</li><li class="desc-sub-text"><p>The model (height 6' and shoulders 18") is wearing a size M</p></li></ul>,26:02:2014,None
None,HRX Men Orange Free Spirited T-shirt,http://www.myntra.com/Tshirts/HRX/HRX-Men-Orange-Free-Spirited-T-shirt/188212/buy,Rs. 599,men-tees-polos,T-shirts & Collared Tees,HRX,http://myntra.myntassets.com/images/style/properties/HRX-Men-Tshirts_143287f1b6c84f6613cae6b7c03730af_images_1080_1440_mini.jpg,None,None,men,http://www.myntra.com/Tshirts/HRX/HRX-Men-Orange-Free-Spirited-T-shirt/188212/buy,Sold byVector Ecommerce Pvt Ltd,None,None,['S', 'M', 'L', 'XL'],None,<ul class="mk-pdpv1-product-helper mk-cf"><li class="desc-main-title">Product Description</li><li class="desc-sub-title">Style Note</li><li class="desc-sub-text " itemprop="description"><p>Hrithik Roshan is known for his super-trendy fashion sense which is at once relaxed and sophisticated. You can now emulate this super star's unique style sensibility with his urban collection of casual wardrobe separates. Match this cool printed HRX tee with your favourite pair of distressed jeans and high-top trainers for a youthful vibe.</p></li><li class="desc-sub-title ">Product Details</li><li class="desc-sub-text"><p>Orange printed T-shirt, knit, ribbed round neck, short sleeves, print on chest, brand tag above left hem</p></li><li class="desc-sub-title ">Material &amp; Care</li><li class="desc-sub-text "><p>100% cotton<br/>Machine wash cold</p></li><li class="desc-sub-title">Size &amp; Fit</li><li class="desc-sub-text"><p>Slim fit<br/>The model (height 6' and shoulders 18") is wearing a size L</p></li></ul>,26:02:2014,None
None,HRX Men White Printed T-shirt,http://www.myntra.com/Tshirts/HRX/HRX-Men-White-Printed-T-shirt/188211/buy,Rs. 599,men-tees-polos,T-shirts & Collared Tees,HRX,http://myntra.myntassets.com/images/style/properties/HRX-Men-Tshirts_d880c162151f32667c64c6a8539e1db4_images_1080_1440_mini.jpg,None,None,men,http://www.myntra.com/Tshirts/HRX/HRX-Men-White-Printed-T-shirt/188211/buy,Sold byVector Ecommerce Pvt Ltd,None,None,['S', 'M', 'L', 'XL'],None,<ul class="mk-pdpv1-product-helper mk-cf"><li class="desc-main-title">Product Description</li><li class="desc-sub-title">Style Note</li><li class="desc-sub-text " itemprop="description"><p>With a super rich motto to live the best life possible come what may, Hrithik Roshan brings to your wardrobe a range of shirts that are high on performance, just like him. Styled to perfection by a team of highly skilled designers, HRX reflects sheer class and extreme comfort. Best teamed with lightly washed jeans and desert boots, this piece offers style to the last detail.</p></li><li class="desc-sub-title ">Product Details</li><li class="desc-sub-text"><p>White T-shirt, knit, ribbed round neck, short sleeves, graphic print on front</p></li><li class="desc-sub-title ">Material &amp; Care</li><li class="desc-sub-text "><p>100% cotton<br/>Machine wash cold</p></li><li class="desc-sub-title">Size &amp; Fit</li><li class="desc-sub-text"><p>Slim fit<br/>The model (height 6' and shoulders 18") is wearing a size M</p></li></ul>,26:02:2014,None
None,HRX Men Purple Printed T-shirt,http://www.myntra.com/Tshirts/HRX/HRX-Men-Purple-Printed-T-shirt/188204/buy,Rs. 359,men-tees-polos,T-shirts & Collared Tees,HRX,http://myntra.myntassets.com/images/style/properties/HRX-Men-Tshirts_266affa11687c76b53ca9303f45e37a8_images_1080_1440_mini.jpg,Rs. 599,None,men,http://www.myntra.com/Tshirts/HRX/HRX-Men-Purple-Printed-T-shirt/188204/buy,Sold byVector Ecommerce Pvt Ltd,None,None,['S', 'M', 'L', 'XL'],None,<ul class="mk-pdpv1-product-helper mk-cf"><li class="desc-main-title">Product Description</li><li class="desc-sub-title">Style Note</li><li class="desc-sub-text " itemprop="description"><p>With a super rich motto to live the best life possible come what may, Hrithik Roshan brings to your wardrobe a range of shirts that are high on performance, just like him. Styled to perfection by a team of highly skilled designers, HRX reflects sheer class and extreme comfort. Best teamed with lightly washed jeans and desert boots, this piece offers style to the last detail.</p></li><li class="desc-sub-title ">Product Details</li><li class="desc-sub-text"><p>Purple T-shirt, knit, ribbed round neck, short sleeves, graphic print on front</p></li><li class="desc-sub-title ">Material &amp; Care</li><li class="desc-sub-text "><p>100% cotton<br/>Machine wash cold</p></li><li class="desc-sub-title">Size &amp; Fit</li><li class="desc-sub-text"><p>Slim fit<br/>The model (height 6' and shoulders 18") is wearing a size M</p></li></ul>,26:02:2014,None
None,HRX Men Grey Breathe T-shirt,http://www.myntra.com/Tshirts/HRX/HRX-Men-Grey-Breathe-T-shirt/188210/buy,Rs. 599,men-tees-polos,T-shirts & Collared Tees,HRX,http://myntra.myntassets.com/images/style/properties/HRX-Men-Tshirts_afc651c151aca99b08b91a91c2e14c67_images_1080_1440_mini.jpg,None,None,men,http://www.myntra.com/Tshirts/HRX/HRX-Men-Grey-Breathe-T-shirt/188210/buy,Sold byVector Ecommerce Pvt Ltd,None,None,['S', 'M', 'L', 'XL'],None,<ul class="mk-pdpv1-product-helper mk-cf"><li class="desc-main-title">Product Description</li><li class="desc-sub-title">Style Note</li><li class="desc-sub-text " itemprop="description"><p>Hrithik Roshan is known for his super-trendy fashion sense which is at once relaxed and sophisticated. You can now emulate this super star's unique style sensibility with his urban collection of casual wardrobe separates. Match this cool printed HRX tee with your favourite pair of distressed jeans and high-top trainers for a youthful vibe.</p></li><li class="desc-sub-title ">Product Details</li><li class="desc-sub-text"><p>Grey printed T-shirt, knit, ribbed round neck, short sleeves, print on chest, brand tag above left hem</p></li><li class="desc-sub-title ">Material &amp; Care</li><li class="desc-sub-text "><p>100% cotton<br/>Machine wash cold</p></li><li class="desc-sub-title">Size &amp; Fit</li><li class="desc-sub-text"><p>Slim fit<br/>The model (height 6' and shoulders 18") is wearing a size L</p></li></ul>,26:02:2014,None
None,HRX Men Charcoal Grey Printed T-shirt,http://www.myntra.com/Tshirts/HRX/HRX-Men-Charcoal-Grey-Printed-T-shirt/203837/buy,Rs. 499,men-tees-polos,T-shirts & Collared Tees,HRX,http://myntra.myntassets.com/images/style/properties/HRX-Men-Charcoal-Grey-Printed-T-shirt_1f20facb0665467700e5c44bcc29c894_images_1080_1440_mini.jpg,None,None,men,http://www.myntra.com/Tshirts/HRX/HRX-Men-Charcoal-Grey-Printed-T-shirt/203837/buy,Sold byVector Ecommerce Pvt Ltd,None,None,['S', 'M', 'L', 'XL'],None,<ul class="mk-pdpv1-product-helper mk-cf"><li class="desc-main-title">Product Description</li><li class="desc-sub-title">Style Note</li><li class="desc-sub-text " itemprop="description"><p>Hrithik Roshan brings to your wardrobe a range of tees that are high on performance, just like him. Styled to perfection by highly skilled designers, apparel from HRX reflects sheer class and extreme comfort. Team this tee with lightly washed jeans or cargos, and desert boots.</p></li><li class="desc-sub-title ">Product Details</li><li class="desc-sub-text"><p>Charcoal grey printed T-shirt, knit, ribbed V neck, short sleeves, contrast stripes at chest with brand print at left, contrast stylised shoulder panels at front, branding below the neck at back, regular hemline<br/>Treated for moisture management for enhanced performance</p></li><li class="desc-sub-title ">Material &amp; Care</li><li class="desc-sub-text "><p>Cotton blend<br/>Machine wash warm</p></li><li class="desc-sub-title">Size &amp; Fit</li><li class="desc-sub-text"><p>Regular fit<br/>The model (height 6' and shoulders 18") is wearing a size M</p></li></ul>,26:02:2014,None
None,HRX Men White Printed T-shirt,http://www.myntra.com/Tshirts/HRX/HRX-Men-White-Printed-T-shirt/188199/buy,Rs. 599,men-tees-polos,T-shirts & Collared Tees,HRX,http://myntra.myntassets.com/images/style/properties/HRX-Men-Tshirts_16605c1c485381f3c4bcc23514232005_images_1080_1440_mini.jpg,None,None,men,http://www.myntra.com/Tshirts/HRX/HRX-Men-White-Printed-T-shirt/188199/buy,Sold byVector Ecommerce Pvt Ltd,None,None,['S', 'M', 'L', 'XL'],None,<ul class="mk-pdpv1-product-helper mk-cf"><li class="desc-main-title">Product Description</li><li class="desc-sub-title">Style Note</li><li class="desc-sub-text " itemprop="description"><p>With a super rich motto to live the best life possible come what may, Hrithik Roshan brings to your wardrobe a range of shirts that are high on performance, just like him. Styled to perfection by a team of highly skilled designers, HRX reflects sheer class and extreme comfort. Best teamed with lightly washed jeans and desert boots, this piece offers style to the last detail.</p></li><li class="desc-sub-title ">Product Details</li><li class="desc-sub-text"><p>White T-shirt, knit, ribbed round neck, short sleeves, print on front</p></li><li class="desc-sub-title ">Material &amp; Care</li><li class="desc-sub-text "><p>100% cotton<br/>Machine wash cold</p></li><li class="desc-sub-title">Size &amp; Fit</li><li class="desc-sub-text"><p>Slim fit<br/>The model (height 6' and shoulders 18") is wearing a size M</p></li></ul>,26:02:2014,None
None,HRX Men Off-White T-shirt,http://www.myntra.com/Tshirts/HRX/HRX-Men-Off-White-T-shirt/190471/buy,Rs. 359,men-tees-polos,T-shirts & Collared Tees,HRX,http://myntra.myntassets.com/images/style/properties/HRX-Men-Tshirts_a41a9c959a9445646ebc81fa3f40c829_images_1080_1440_mini.jpg,Rs. 599,None,men,http://www.myntra.com/Tshirts/HRX/HRX-Men-Off-White-T-shirt/190471/buy,Sold byVector Ecommerce Pvt Ltd,None,None,['S', 'M', 'L', 'XL'],None,<ul class="mk-pdpv1-product-helper mk-cf"><li class="desc-main-title">Product Description</li><li class="desc-sub-title">Style Note</li><li class="desc-sub-text " itemprop="description"><p>Hrithik Roshan brings to your wardrobe a range of tees that are high on performance, just like him. Styled to perfection by highly skilled designers, apparel from HRX reflects sheer class and extreme comfort. Team this tee with lightly washed jeans or cargo pants, and desert boots.</p></li><li class="desc-sub-title ">Product Details</li><li class="desc-sub-text"><p>Off-white T-shirt, knit, has a ribbed round neck, short raglan sleeves with contrast taping from shoulder extending till the hems of the sleeves, brand print at left chest, contrast panels at front and back, regular hemline</p></li><li class="desc-sub-title ">Material &amp; Care</li><li class="desc-sub-text "><p>100% cotton<br/>Machine wash warm</p></li><li class="desc-sub-title">Size &amp; Fit</li><li class="desc-sub-text"><p>Slim fit<br/>The model (height 6' and shoulders 18") is wearing a size M</p></li></ul>,26:02:2014,None
