None,Roadster Men Beige Slim Fit Chinos,http://www.myntra.com/trousers/roadster/roadster-men-beige-slim-fit-chinos/197264/buy,Rs. 1,599,men-trousers,Pants,Trousers,http://myntra.myntassets.com/images/style/properties/Roadster-Men-Beige-Slim-Fit-Chinos_5c4c89db24ee87b391adce3f05653422_images_1080_1440_mini.jpg,None,None,men,http://www.myntra.com/trousers/roadster/roadster-men-beige-slim-fit-chinos/197264/buy,Sold byVector Ecommerce Pvt Ltd,None,None,['28', '30', '32', '34', '36'],None,<ul class="mk-pdpv1-product-helper mk-cf"><li class="desc-main-title">Product Description</li><li class="desc-sub-title">Style Note</li><li class="desc-sub-text " itemprop="description"><p>Take a break from your routine and try these super-trendy chinos by Roadster in the loveliest of hues. Match this pair with a fun graphic tee or a shirt and high-top trainers for a cool urban appeal.</p></li><li class="desc-sub-title ">Product Details</li><li class="desc-sub-text">Beige chinos, waistband with belt loops, button and zip closure at front, slant pockets on either side at front, welt coin pocket on the right, two welt pockets at back with buttoned closures<br/>Our stylist has paired these trousers with a belt<br/>The trousers will not come with a belt<br/></li><li class="desc-sub-title ">Material &amp; Care</li><li class="desc-sub-text "><p>98% cotton, 2% Spandex<br/>Machine wash cold<br/>You are unique and wouldn't like it if the Creator made too many people ditto.<br/>Similarly, this product is unique, handmade and crafted with love.<br/>There are no two products we make, which will ever be ditto.<br/>To maintain a high degree of authenticity, we advise our patrons to wash our products<br/>separately and expect some fading, colour bleeding and wear and tear.<br/>The article ages uniquely as you treat it, acquiring your personalised feel. Go on, enjoy this specially created product to the hilt. Have fun.</p></li><li class="desc-sub-title">Size &amp; Fit</li><li class="desc-sub-text"><p>Slim fit<br/>The model (height 6' and waist 32") is wearing a size 32</p></li></ul>,25:02:2014,None
None,HRX Men Navy Stretch Twill Trousers,http://www.myntra.com/trousers/hrx/hrx-men-navy-stretch-twill-trousers/164192/buy,Rs. 1,019,men-trousers,Pants,Trousers,http://myntra.myntassets.com/images/style/properties/HRX-Men-Navy-Stretch-Twill-Trousers_6ea531beeccd621ab6c088cd404578fc_images_1080_1440_mini.jpg,Rs. 1,699,None,men,http://www.myntra.com/trousers/hrx/hrx-men-navy-stretch-twill-trousers/164192/buy,Sold byVector Ecommerce Pvt Ltd,None,None,['28', '30', '32', '34', '36'],None,<ul class="mk-pdpv1-product-helper mk-cf"><li class="desc-main-title">Product Description</li><li class="desc-sub-title">Style Note</li><li class="desc-sub-text " itemprop="description"><p>Just like the superstar Hrithik Roshan himself, HRX's selection of men's clothing amplifies sheer class and extreme comfort. Match this pair with a fun graphic tee and high-top trainers for a cool, urban appeal.</p></li><li class="desc-sub-title ">Product Details</li><li class="desc-sub-text"><p>Navy stretch trousers, woven, has a button and zip closure, waistband with belt loops, slant pockets at either side at front, a double welt change pocket on the right, two welt pockets at the back with stitch detail above, brand appliqué   detail above right back pocket</p></li><li class="desc-sub-title ">Material &amp; Care</li><li class="desc-sub-text "><p>98% cotton, 2% Spandex<br/>Machine wash cold</p></li><li class="desc-sub-title">Size &amp; Fit</li><li class="desc-sub-text"><p>The model (height 6' and waist 32") is wearing a size 32</p></li></ul>,25:02:2014,None
None,Mast & Harbour Men Grey Stretch Trousers,http://www.myntra.com/trousers/mast-harbour/mast-harbour-men-grey-stretch-trousers/222767/buy,Rs. 1,599,men-trousers,Pants,Trousers,http://myntra.myntassets.com/images/style/properties/Mast-&-Harbour-Men-Cold-Grey-Stretch-Trousers_cf5c3fbc137efcafc721e6aad0a5dda7_images_1080_1440_mini.jpg,None,None,men,http://www.myntra.com/trousers/mast-harbour/mast-harbour-men-grey-stretch-trousers/222767/buy,Sold byVector Ecommerce Pvt Ltd,None,None,['28', '30', '32', '34', '36'],None,<ul class="mk-pdpv1-product-helper mk-cf"><li class="desc-main-title">Product Description</li><li class="desc-sub-title">Style Note</li><li class="desc-sub-text " itemprop="description"><p>Pep up your wardrobe with this pair of trousers to set a new style quotient. Team it up with a polo T-shirt and loafers to get that perfect, casual look.</p></li><li class="desc-sub-title ">Product Details</li><li class="desc-sub-text"><p>Grey trousers, woven, stretchable, waistband with belt loops, button and zip closure, two slant pockets at front sides, a coin pocket stitched to the right slant pocket, welt pockets with buttoned closures at the back, branding above the right pocket at the back.<br/>Our stylist has paired these trousers with a belt<br/>This pair of trousers will not come with a belt</p></li><li class="desc-sub-title ">Material &amp; Care</li><li class="desc-sub-text "><p>98% cotton, 2% Spandex<br/>Machine wash cold</p></li><li class="desc-sub-title">Size &amp; Fit</li><li class="desc-sub-text"><p>Regular fit<br/>The model (height 6' and waist 32") is wearing a size 32</p></li></ul>,25:02:2014,None
None,Timberland Men Beige Straight Fit Lynwood Vintage Chinos,http://www.myntra.com/trousers/timberland/timberland-men-beige-straight-fit-lynwood-vintage-/174962/buy,Rs. 4,990,men-trousers,Pants,Trousers,http://myntra.myntassets.com/images/style/properties/Timberland-Men-Beige-Straight-Fit-Lynwood-Vintage-Chinos_b968a8d844ee0a6d3fd225c9df209f97_images_1080_1440_mini.JPG,None,None,men,http://www.myntra.com/trousers/timberland/timberland-men-beige-straight-fit-lynwood-vintage-/174962/buy,Sold byVector Ecommerce Pvt Ltd,None,None,['30', '32', '34', '36', '38'],None,<ul class="mk-pdpv1-product-helper mk-cf"><li class="desc-main-title">Product Description</li><li class="desc-sub-title">Style Note</li><li class="desc-sub-text " itemprop="description"><p>Diversify your wardrobe with this pair of chinos from Timberland that are a great alternative to denim. Pair them with a combat style shirt, bomber jacket and leather trainers for a relaxed weekend brunch with friends.</p></li><li class="desc-sub-title ">Product Details</li><li class="desc-sub-text"><p>Beige canvas chinos, zip and fly closure, slant pockets at the sides, a change pocket on the right, waistband with belt loops, welt pockets on the back, brand patch above right back pocket</p><p><img alt="" src="http://myntra.myntassets.com/images/banners/march2013/1362646952-Timberland-Earthkeepers.jpg"/><br/>Earthkeepers® - Earthkeepers products represent Timberland's best efforts at utilizing their environmental values in action</p></li><li class="desc-sub-title ">Material &amp; Care</li><li class="desc-sub-text "><p>100% cotton<br/>Machine wash cold</p></li><li class="desc-sub-title">Size &amp; Fit</li><li class="desc-sub-text"><p>Straight fit<br/>The model (height 6' and waist 32") is wearing a size 32</p></li></ul>,25:02:2014,None
None,Mast & Harbour Men Brown Stretch Trousers,http://www.myntra.com/trousers/mast-harbour/mast-harbour-men-brown-stretch-trousers/222764/buy,Rs. 1,599,men-trousers,Pants,Trousers,http://myntra.myntassets.com/images/style/properties/Mast-&-Harbour-Men-Brown-Stretch-Trousers_a3695147eeb358b78933d4fa003ca735_images_1080_1440_mini.jpg,None,None,men,http://www.myntra.com/trousers/mast-harbour/mast-harbour-men-brown-stretch-trousers/222764/buy,Sold byVector Ecommerce Pvt Ltd,None,None,['28', '30', '32', '34', '36'],None,<ul class="mk-pdpv1-product-helper mk-cf"><li class="desc-main-title">Product Description</li><li class="desc-sub-title">Style Note</li><li class="desc-sub-text " itemprop="description"><p>Get ready to become the ultimate style icon with Mast &amp; Harbour's range of trousers. We recommend teaming it up with polo T-shirt and loafers to achieve that perfect look.</p></li><li class="desc-sub-title ">Product Details</li><li class="desc-sub-text"><p>Brown trousers, woven, stretchable, button and zip closure, waistband with belt loops, two slant pockets at front sides, a coin pocket stitched to the right slant pocket, two buttoned welt pockets at the back, branding above the right welt pocket at the back<br/>Our stylist has paired these trousers with a belt<br/>This pair of trousers will not come with a belt<br/></p></li><li class="desc-sub-title ">Material &amp; Care</li><li class="desc-sub-text "><p>98% cotton, 2% Spandex<br/>Machine wash cold</p></li><li class="desc-sub-title">Size &amp; Fit</li><li class="desc-sub-text"><p>Regular fit<br/>The model (height 6' and waist 32) is wearing a size 32</p></li></ul>,25:02:2014,None
None,The Indian Garage Co Men Khaki Slim Fit Chinos,http://www.myntra.com/trousers/the-indian-garage-co/the-indian-garage-co-men-khaki-slim-fit-chinos/207627/buy,Rs. 1,295,men-trousers,Pants,Trousers,http://myntra.myntassets.com/images/style/properties/The-Indian-Garage-Co-Men-Khaki-Slim-Fit-Chinos_9d204d89df1e18cfd290eeba248a04a7_images_1080_1440_mini.jpg,None,None,men,http://www.myntra.com/trousers/the-indian-garage-co/the-indian-garage-co-men-khaki-slim-fit-chinos/207627/buy,Sold byVector Ecommerce Pvt Ltd,None,None,['28', '30', '32', '34', '36'],None,<ul class="mk-pdpv1-product-helper mk-cf"><li class="desc-main-title">Product Description</li><li class="desc-sub-title">Style Note</li><li class="desc-sub-text " itemprop="description"><p>Take a break from your routine and try these super-trendy chinos by The Indian Garage Co in the loveliest of hues. Match this pair with a fun graphic tee or a shirt, and high-top trainers for a cool urban appeal.</p></li><li class="desc-sub-title ">Product Details</li><li class="desc-sub-text"><p>Khaki chinos, woven, waistband with belt loops, button and zip closure at front, slant pockets on either side at front, welt coin pocket on the right, two double welted pockets at back with buttoned closures and metallic brand detail above right pocket<br/>Our stylist has paired these chinos with a belt<br/>These chinos will not come with a belt<br/></p></li><li class="desc-sub-title ">Material &amp; Care</li><li class="desc-sub-text "><p>Cotton blend<br/>Machine wash warm</p></li><li class="desc-sub-title">Size &amp; Fit</li><li class="desc-sub-text"><p>Slim fit<br/>The model (height 6' and waist 32") is wearing a size 32</p></li></ul>,25:02:2014,None
None,HRX Men Beige Overdyed Trousers,http://www.myntra.com/trousers/hrx/hrx-men-beige-overdyed-trousers/168770/buy,Rs. 1,999,men-trousers,Pants,Trousers,http://myntra.myntassets.com/images/style/properties/HRX-Men-Beige-Overdyed-Trousers_c34ee0fc97b6cf84d0152d41a68c8f9d_images_1080_1440_mini.jpg,None,None,men,http://www.myntra.com/trousers/hrx/hrx-men-beige-overdyed-trousers/168770/buy,Sold byVector Ecommerce Pvt Ltd,None,None,['28', '30', '32', '34', '36'],None,<ul class="mk-pdpv1-product-helper mk-cf"><li class="desc-main-title">Product Description</li><li class="desc-sub-title">Style Note</li><li class="desc-sub-text " itemprop="description"><p>Crafted from premium cotton fabrics and styled to perfection by a team of highly skilled designers to the last detail, HRX is a range of casuals that enable you to embody the style of Hrithik Roshan himself. An undisputed super star, this pair of overdyed trousers is best styled with a denim shirt layered over a plain white tee.</p></li><li class="desc-sub-title ">Product Details</li><li class="desc-sub-text"><p>Beige trousers, waistband with belt loops, button and zip closure, welt pockets at front, welt pocket at left back, welt pocket at right back with brand patch above and smaller welt pocket below, darts at front and back knees</p></li><li class="desc-sub-title ">Material &amp; Care</li><li class="desc-sub-text "><p>98% cotton, 2% elastane<br/>Machine wash</p></li><li class="desc-sub-title">Size &amp; Fit</li><li class="desc-sub-text"><p>Regular fit<br/>The model (height 6' and waist 32") is wearing a size 32</p></li></ul>,25:02:2014,None
