None,Breakbounce Men Mushroom Olive Slim Fit Chinos,http://www.myntra.com/trousers/breakbounce/breakbounce-men-mushroom-olive-slim-fit-chinos/124490/buy,Rs. 1,899,men-trousers,Pants,Trousers,http://myntra.myntassets.com/images/style/properties/Breakbounce-Men-Trousers_ade6dc4eaf2edc95a819443cdf2b14d0_images_1080_1440_mini.jpg,None,None,men,http://www.myntra.com/trousers/breakbounce/breakbounce-men-mushroom-olive-slim-fit-chinos/124490/buy,Sold byVector Ecommerce Pvt Ltd,None,None,['28', '30', '32', '34', '36', '38'],None,<ul class="mk-pdpv1-product-helper mk-cf"><li class="desc-main-title">Product Description</li><li class="desc-sub-title">Style Note</li><li class="desc-sub-text " itemprop="description"><p>Sport Breakbounce's game look, with their superb range of form fitting chinos. The line's sporty colours and sleek, preppy forms ensure that you'll be dressed to score whether you're on the green or hitting up scenes.</p></li><li class="desc-sub-title ">Product Details</li><li class="desc-sub-text"><p>Mushroom olive green chino trousers with a brownish tinge, has a button and zip closure, belt loops at the waistband, two pockets in the front, a coin pocket on the right with two brand badges, rectangular panel above the knee, yoke at the back, two welt pockets at the back and a brand patch on the right at the waistband, double dyed for authentic, vintage look</p></li><li class="desc-sub-title ">Material &amp; Care</li><li class="desc-sub-text "><p>98% Cotton, 2% Spandex<br/>Machine wash cold</p></li><li class="desc-sub-title">Size &amp; Fit</li><li class="desc-sub-text"><p>Bear Hug (Slim Fit)<br/>The model (height 6' and waist 32'') is wearing a size 32</p></li></ul>,25:02:2014,None
None,Being Human Men Navy Slim Fit Chino Trousers,http://www.myntra.com/trousers/being-human/being-human-men-navy-slim-fit-chino-trousers/233543/buy,Rs. 2,699,men-trousers,Pants,Trousers,http://myntra.myntassets.com/images/style/properties/Being-Human-Men-Navy-Slim-Fit-Chino-Trousers_674abf0979758104c309e9a061a06cb8_images_1080_1440_mini.jpg,None,None,men,http://www.myntra.com/trousers/being-human/being-human-men-navy-slim-fit-chino-trousers/233543/buy,Sold byVector Ecommerce Pvt Ltd,None,None,['28', '30', '32', '34', '36', '38', '40'],None,<ul class="mk-pdpv1-product-helper mk-cf"><li class="desc-main-title">Product Description</li><li class="desc-sub-title">Style Note</li><li class="desc-sub-text " itemprop="description"><p>Love, care and share while looking good when you're wearing a piece from Being Human's range of trendy chinos. We suggest that you match this pair with a graphic tee and skate shoes.</p></li><li class="desc-sub-title ">Product Details</li><li class="desc-sub-text"><p>Navy blue chino trousers, waistband with belt loops and hanging loop detail at back, fly with concealed buttoned closure, slant pockets on front with insert panel detailing, has a coin pocket inside right pocket, 2 welt pockets at back with brand tag detail above right pocket, stitch detail throughout</p></li><li class="desc-sub-title ">Material &amp; Care</li><li class="desc-sub-text "><p>100% cotton<br/>Machine wash cold</p></li><li class="desc-sub-title">Size &amp; Fit</li><li class="desc-sub-text"><p>Slim fit, low rise<br/>The model (height 6' and waist 32") is wearing a size 32</p></li></ul>,25:02:2014,None
None,Roadster Men Brown Torino Slim Fit Trousers,http://www.myntra.com/trousers/roadster/roadster-men-brown-torino-slim-fit-trousers/161477/buy,Rs. 1,599,men-trousers,Pants,Trousers,http://myntra.myntassets.com/images/style/properties/Roadster-Men-Brown-Torino-Slim-Fit-Trousers_55a0f0ab03f693c6bd8dfec5b9dd5444_images_1080_1440_mini.jpg,None,None,men,http://www.myntra.com/trousers/roadster/roadster-men-brown-torino-slim-fit-trousers/161477/buy,Sold byVector Ecommerce Pvt Ltd,None,None,['28', '30', '32', '34', '36'],None,<ul class="mk-pdpv1-product-helper mk-cf"><li class="desc-main-title">Product Description</li><li class="desc-sub-title">Style Note</li><li class="desc-sub-text " itemprop="description"><p>Take a break from your routine and try these super-trendy chinos by Roadster in the loveliest of hues. Match this pair with a fun graphic tee or a shirt and high-top trainers for a cool urban appeal.</p></li><li class="desc-sub-title ">Product Details</li><li class="desc-sub-text"><p>Brown trousers, waistband with belt loops, button and zip closure at front, slant pockets on either side at front, welt coin pocket on the right, two welt pockets at back with buttoned closure, metal branding above right welt pocket at back<br/>Our stylist has paired these trousers with a belt<br/>The trousers will not come with a belt</p></li><li class="desc-sub-title ">Material &amp; Care</li><li class="desc-sub-text "><p>98% cotton, 2% Spandex<br/>Machine wash cold<br/>You are unique and wouldn't like it if the Creator made too many people ditto.<br/>Similarly, this product is unique, handmade and crafted with love.<br/>There are no two products we make, which will ever be ditto.<br/>To maintain a high degree of authenticity, we advise our patrons to wash our products<br/>separately and expect some fading, colour bleeding and wear and tear.<br/>The article ages uniquely as you treat it, acquiring your personalised feel. Go on, enjoy this specially created product to the hilt. Have fun.</p></li><li class="desc-sub-title">Size &amp; Fit</li><li class="desc-sub-text"><p>Torino fit (slim fit)<br/>The model (height 6' and waist 32") is wearing a size 32</p></li></ul>,25:02:2014,None
None,HRX Men Khaki Overdyed Trousers,http://www.myntra.com/trousers/hrx/hrx-men-khaki-overdyed-trousers/171537/buy,Rs. 2,199,men-trousers,Pants,Trousers,http://myntra.myntassets.com/images/style/properties/HRX-Men-Beige-Overdyed-Trousers_e8537d33b74cee518885c1683e644158_images_1080_1440_mini.jpg,None,None,men,http://www.myntra.com/trousers/hrx/hrx-men-khaki-overdyed-trousers/171537/buy,Sold byVector Ecommerce Pvt Ltd,None,None,['28', '30', '32', '34', '36'],None,<ul class="mk-pdpv1-product-helper mk-cf"><li class="desc-main-title">Product Description</li><li class="desc-sub-title">Style Note</li><li class="desc-sub-text " itemprop="description"><p>Crafted from premium cotton fabrics and styled to perfection by a team of highly skilled designers to the last detail, HRX is a range of casuals that enables you to embody the style of Hrithik Roshan himself. An undisputed super star, this pair of overdyed trousers is best styled with a denim shirt layered over a plain white tee.</p></li><li class="desc-sub-title ">Product Details</li><li class="desc-sub-text"><p>Khaki trousers, waistband with belt loops, button and zip closure, slant pockets at front, buttoned welt pockets at back with contrast flap on left pocket, brand patch above right welt pocket, darts at front and back knees</p></li><li class="desc-sub-title ">Material &amp; Care</li><li class="desc-sub-text "><p>98% cotton, 2% Lycra<br/>Machine wash</p></li><li class="desc-sub-title">Size &amp; Fit</li><li class="desc-sub-text"><p>Regular fit<br/>The model (height 6' and waist 32") is wearing a size 32</p></li></ul>,25:02:2014,None
None,Mast & Harbour Men Beige Stretch Twill Trouser,http://www.myntra.com/trousers/mast-harbour/mast-harbour-men-beige-stretch-twill-trouser/212048/buy,Rs. 1,699,men-trousers,Pants,Trousers,http://myntra.myntassets.com/images/style/properties/Mast-&-Harbour-Men-Beige-Stretch-Twill-Trouser_327c5902f31475c40ff79707c9928ec4_images_1080_1440_mini.jpg,None,None,men,http://www.myntra.com/trousers/mast-harbour/mast-harbour-men-beige-stretch-twill-trouser/212048/buy,Sold byVector Ecommerce Pvt Ltd,None,None,['28', '30', '32', '34', '36'],None,<ul class="mk-pdpv1-product-helper mk-cf"><li class="desc-main-title">Product Description</li><li class="desc-sub-title">Style Note</li><li class="desc-sub-text " itemprop="description"><p>Diversify your wardrobe with this pair of trousers from Mast &amp; Harbour. This piece by our in-house brand will surely set you apart from the crowd, when styled with striped casual shirt and suede loafers.</p></li><li class="desc-sub-title ">Product Details</li><li class="desc-sub-text"><p>Beige trousers, twill weave, stretchable, button and zip closure, belt loops at the waistband with brand tag at front left, 2 slant pockets at front, coin pocket on the right below waistband, 2 welt pockets with buttoned closure at the back, brand tag above the right pocket at the back</p></li><li class="desc-sub-title ">Material &amp; Care</li><li class="desc-sub-text "><p>98% cotton, 2% Spandex<br/>Machine wash cold</p></li><li class="desc-sub-title">Size &amp; Fit</li><li class="desc-sub-text"><p>The model (height 6' and waist 32") is wearing a size 32</p></li></ul>,25:02:2014,None
None,Ruggers Young Men Grey Tapered Fit Chino Trousers,http://www.myntra.com/trousers/ruggers-young/ruggers-young-men-grey-tapered-fit-chino-trousers/186711/buy,Rs. 1,119,men-trousers,Pants,Trousers,http://myntra.myntassets.com/images/style/properties/Ruggers-Young-Men-Grey-Tapered-Fit-Chino-Trousers_c6d9294998c4af18ba58eef694d15408_images_1080_1440_mini.jpg,Rs. 1,399,None,men,http://www.myntra.com/trousers/ruggers-young/ruggers-young-men-grey-tapered-fit-chino-trousers/186711/buy,Sold byVector Ecommerce Pvt Ltd,None,None,['30', '32', '34', '36'],None,<ul class="mk-pdpv1-product-helper mk-cf"><li class="desc-main-title">Product Description</li><li class="desc-sub-title">Style Note</li><li class="desc-sub-text " itemprop="description"><p>Bringing together comfort and style, these trousers from Ruggers are perfect as weekend wear for men. Team them with a casual shirt or a polo tee for a Sunday brunch with friends.</p></li><li class="desc-sub-title ">Product Details</li><li class="desc-sub-text"><p>Grey smart-casual trousers, woven, zip and fly closure, scoop pockets with rivets at the sides, a welt change pocket at the right, waistband with belt loops, welt pockets with buttoned flap closure at the back, brand embroidery above right back pocket</p></li><li class="desc-sub-title ">Material &amp; Care</li><li class="desc-sub-text "><p>97.5% cotton, 2.5 % Lycra<br/>Machine wash cold</p></li><li class="desc-sub-title">Size &amp; Fit</li><li class="desc-sub-text"><p>Tapered fit<br/>The model (height 6' and waist 32") is wearing a size 32</p></li></ul>,25:02:2014,None
None,Sher Singh Men Black Slim Fit Chinos,http://www.myntra.com/trousers/sher-singh/sher-singh-men-black-slim-fit-chinos/212051/buy,Rs. 1,699,men-trousers,Pants,Trousers,http://myntra.myntassets.com/images/style/properties/Sher-Singh-Men-Black-Slim-Fit-Chinos_8fa52623ea2aed3f19966547148131da_images_1080_1440_mini.jpg,None,None,men,http://www.myntra.com/trousers/sher-singh/sher-singh-men-black-slim-fit-chinos/212051/buy,Sold byVector Ecommerce Pvt Ltd,None,None,['28', '30', '32', '34', '36'],None,<ul class="mk-pdpv1-product-helper mk-cf"><li class="desc-main-title">Product Description</li><li class="desc-sub-title">Style Note</li><li class="desc-sub-text " itemprop="description"><p>Sher Singh presents a pair of chinos that can go both casual or dressier depending on what you wear it with. A versatile pick for any season, we think this pair will look great worn with a light coloured polo tee or even a plain white shirt.</p></li><li class="desc-sub-title ">Product Details</li><li class="desc-sub-text"><p>Black chinos, waistband with belt loops, button and zip closure, slant pockets at front with a welt change pocket on the right, buttoned welt pockets at back</p></li><li class="desc-sub-title ">Material &amp; Care</li><li class="desc-sub-text "><p>98% cotton, 2% Spandex<br/>Machine wash cold</p></li><li class="desc-sub-title">Size &amp; Fit</li><li class="desc-sub-text"><p>Slim fit<br/>The model (height 6' and waist 32") is wearing a size 32</p></li></ul>,25:02:2014,None
None,Breakbounce Men Vector Khaki Skinny Fit Chinos,http://www.myntra.com/trousers/breakbounce/breakbounce-men-vector-khaki-skinny-fit-chinos/115621/buy,Rs. 1,599,men-trousers,Pants,Trousers,http://myntra.myntassets.com/images/style/properties/Breakbounce-Men-Vector-Brown-Skinny-Fit-Chinos_0a01a867a26770fa87db09703c842af5_images_1080_1440_mini.jpg,None,None,men,http://www.myntra.com/trousers/breakbounce/breakbounce-men-vector-khaki-skinny-fit-chinos/115621/buy,Sold byVector Ecommerce Pvt Ltd,None,None,['28', '30', '32', '34', '36', '38'],None,<ul class="mk-pdpv1-product-helper mk-cf"><li class="desc-main-title">Product Description</li><li class="desc-sub-title">Style Note</li><li class="desc-sub-text " itemprop="description"><p>A pair of chinos that stretch to fit, this style from Breakbounce has a twill weave, and a special wash for premium hand-feel. Pair it with a white linen shirt and loafers on a Sunday barbecue.</p></li><li class="desc-sub-title ">Product Details</li><li class="desc-sub-text"><p>Khaki chino trousers with a waistband and loops, buttoned tabs at side,   buttoned fly closure at  front, two insert pockets in front and a coin  pocket in the right insert pocket (with branding), two welt pockets at the back with  buttoned closure for the right pocket</p></li><li class="desc-sub-title ">Material &amp; Care</li><li class="desc-sub-text "><p>98% cotton, 2% Spandex<br/>Machine wash</p></li><li class="desc-sub-title">Size &amp; Fit</li><li class="desc-sub-text"><p>Skinny-fit (Squeeze Hug)<br/> The model (height 6' and waist 32") is wearing a size 32</p></li></ul>,25:02:2014,None
None,Sports 52 Men Khaki Cargo Trousers,http://www.myntra.com/trousers/sports-52/sports-52-men-khaki-cargo-trousers/224936/buy,Rs. 1,395,men-trousers,Pants,Trousers,http://myntra.myntassets.com/images/style/properties/Sports-52-Men-Dark-Beige-Cargo-Trousers_9968ef398d71aef8b398d233926c06b2_images_1080_1440_mini.jpg,None,None,men,http://www.myntra.com/trousers/sports-52/sports-52-men-khaki-cargo-trousers/224936/buy,Sold byVector Ecommerce Pvt Ltd,None,None,['30', '32', '34', '36'],None,<ul class="mk-pdpv1-product-helper mk-cf"><li class="desc-main-title">Product Description</li><li class="desc-sub-title">Style Note</li><li class="desc-sub-text " itemprop="description"><p>Get a cool and relaxed look this season with this pair of trousers from Sports 52. Team it up with a tee or a casual shirt and sneakers for that fashionable look.</p></li><li class="desc-sub-title ">Product Details</li><li class="desc-sub-text"><p>Khaki cargo trousers , woven, waistband with belt loops and inner drawstring closure, button and zip closure, stylised slant pockets with metal rivet detailing at the sides, branding on the right pocket, panelled legs, cargo pockets with buttoned flaps at sides, patch pockets with buttoned flaps at back, brand label at back waistband, folded hem with roll-up tab features and contrast fabric overlay at the inside, stitch detail throughout</p></li><li class="desc-sub-title ">Material &amp; Care</li><li class="desc-sub-text "><p>Cotton<br/>Hand wash</p></li><li class="desc-sub-title">Size &amp; Fit</li><li class="desc-sub-text"><p>Comfort fit<br/>The model (height 6' and waist 32") is wearing a size 32</p></li></ul>,25:02:2014,None
None,The Indian Garage Co Men Brown Slim Fit Chinos,http://www.myntra.com/trousers/the-indian-garage-co/the-indian-garage-co-men-brown-slim-fit-chinos/207623/buy,Rs. 1,295,men-trousers,Pants,Trousers,http://myntra.myntassets.com/images/style/properties/The-Indian-Garage-Co-Men-Brown-Slim-Fit-Chinos_6172157e8f6db74853741a2da66ef33a_images_1080_1440_mini.jpg,None,None,men,http://www.myntra.com/trousers/the-indian-garage-co/the-indian-garage-co-men-brown-slim-fit-chinos/207623/buy,Sold byVector Ecommerce Pvt Ltd,None,None,['28', '30', '32', '34', '36'],None,<ul class="mk-pdpv1-product-helper mk-cf"><li class="desc-main-title">Product Description</li><li class="desc-sub-title">Style Note</li><li class="desc-sub-text " itemprop="description"><p>Take a break from your routine and try these super-trendy chinos by The Indian Garage Co in the loveliest of hues. Match this pair with a fun graphic tee or a shirt, and high-top trainers for a cool urban appeal.</p></li><li class="desc-sub-title ">Product Details</li><li class="desc-sub-text"><p>Brown chinos, woven, waistband with belt loops, button and zip closure at front, slant pockets on either side at front, welt coin pocket on the right, two double welted pockets at back with buttoned closures and metallic brand detail above right pocket<br/>Our stylist has paired these chinos with a belt<br/>These chinos will not come with a belt<br/></p></li><li class="desc-sub-title ">Material &amp; Care</li><li class="desc-sub-text "><p>Cotton blend<br/>Machine wash warm</p></li><li class="desc-sub-title">Size &amp; Fit</li><li class="desc-sub-text"><p>Slim fit<br/>The model (height 6' and waist 32") is wearing a size 32</p></li></ul>,25:02:2014,None
None,Breakbounce Men Blue Craven Regular Fit Chino Trousers,http://www.myntra.com/trousers/breakbounce/breakbounce-men-blue-craven-regular-fit-chino-trou/105809/buy,Rs. 1,599,men-trousers,Pants,Trousers,http://myntra.myntassets.com/images/style/properties/Breakbounce-Men-Blue-Craven-Regular-Fit-Chino-Trousers_1507b5f91fd844a2f61ae40755e0d217_images_1080_1440_mini.jpg,None,None,men,http://www.myntra.com/trousers/breakbounce/breakbounce-men-blue-craven-regular-fit-chino-trou/105809/buy,Sold byVector Ecommerce Pvt Ltd,None,None,['28', '30', '32', '34', '36', '38'],None,<ul class="mk-pdpv1-product-helper mk-cf"><li class="desc-main-title">Product Description</li><li class="desc-sub-title">Style Note</li><li class="desc-sub-text " itemprop="description"><p>Chinos in sporty colours and preppy forms from Breakbounce ensure that you're dressed to kill whether you're on the green or hitting up scenes. Team this comfortable piece with a tee and flip flops before heading out.</p></li><li class="desc-sub-title ">Product Details</li><li class="desc-sub-text"><p>Blue chino trousers with a waistband and loops,  buttoned fly closure at   front, two insert pockets in front and a coin pocket in the right  insert pocket, two insert pockets at the  back</p></li><li class="desc-sub-title ">Material &amp; Care</li><li class="desc-sub-text "><p>98% cotton, 2% spandex<br/>Wash with similar colours inside out</p></li><li class="desc-sub-title">Size &amp; Fit</li><li class="desc-sub-text"><p>Buddy hug (Regular fit)<br/>The model (height 6" and waist 32") is wearing size 32</p></li></ul>,25:02:2014,None
None,HRX Men Khaki Overdyed Trousers,http://www.myntra.com/trousers/hrx/hrx-men-khaki-overdyed-trousers/168762/buy,Rs. 2,199,men-trousers,Pants,Trousers,http://myntra.myntassets.com/images/style/properties/HRX-Men-Khaki-Overdyed-Trousers_fc498e3dc5d10af23e036c610aa87cc4_images_1080_1440_mini.jpg,None,None,men,http://www.myntra.com/trousers/hrx/hrx-men-khaki-overdyed-trousers/168762/buy,Sold byVector Ecommerce Pvt Ltd,None,None,['28', '30', '32', '34', '36'],None,<ul class="mk-pdpv1-product-helper mk-cf"><li class="desc-main-title">Product Description</li><li class="desc-sub-title">Style Note</li><li class="desc-sub-text " itemprop="description"><p>Crafted from premium cotton fabrics and styled to perfection by a team of highly skilled designers to the last detail, HRX is a range of casuals that enable you to embody the style of Hrithik Roshan himself. An undisputed superstar, this pair of overdyed trousers is best styled with a denim shirt layered over a plain white tee.</p></li><li class="desc-sub-title ">Product Details</li><li class="desc-sub-text"><p>Khaki trousers, waistband with belt loops, button and zip closure, slant pockets at front, a coin pocket on the right with a buttoned flap, pleats below front waistband, adjustable strap below either sides of back waistband, buttoned welt pockets at back with brand patch above right pocket, smaller welt pocket with buttoned flap below left welt pocket, darts at front and back knees<br/>Our stylist has paired these trousers with a belt<br/>These trousers do not come with a belt</p></li><li class="desc-sub-title ">Material &amp; Care</li><li class="desc-sub-text "><p>98% cotton, 2% elastane<br/>Machine wash</p></li><li class="desc-sub-title">Size &amp; Fit</li><li class="desc-sub-text"><p>Regular fit<br/>The model (height 6' and waist 32") is wearing a size 32</p></li></ul>,25:02:2014,None
None,Mast & Harbour Men Blue Chino Trousers,http://www.myntra.com/trousers/mast-harbour/mast-harbour-men-blue-chino-trousers/169567/buy,Rs. 1,119,men-trousers,Pants,Trousers,http://myntra.myntassets.com/images/style/properties/Mast-&-Harbour-Men-Blue-Chino-Trousers_15bb99e40a79c34b3d2c1ace87bce683_images_1080_1440_mini.jpg,Rs. 1,599,None,men,http://www.myntra.com/trousers/mast-harbour/mast-harbour-men-blue-chino-trousers/169567/buy,Sold byVector Ecommerce Pvt Ltd,None,None,['28', '30', '32', '34', '36'],None,<ul class="mk-pdpv1-product-helper mk-cf"><li class="desc-main-title">Product Description</li><li class="desc-sub-title">Style Note</li><li class="desc-sub-text " itemprop="description"><p>Get ready to channel ultimate preppy style with Mast &amp;  Harbour's range of over-dyed chinos. Team this pair with a striped pique polo T-shirt and suede loafers for the perfect yacht club look.</p></li><li class="desc-sub-title ">Product Details</li><li class="desc-sub-text"><p>Blue chino trousers, woven, over-dyed, waistband with belt loops, button and zip closure, two slant pockets at front sides, a coin pocket on the right, welt pockets with buttoned closures at the back, branding above right pocket at back</p></li><li class="desc-sub-title ">Material &amp; Care</li><li class="desc-sub-text "><p>98% cotton, 2% Spandex<br/>Machine wash cold</p></li><li class="desc-sub-title">Size &amp; Fit</li><li class="desc-sub-text"><p>Regular fit<br/>The model (height 6' and waist 32") is wearing a size 32</p></li></ul>,25:02:2014,None
None,United Colors of Benetton Men Grey Slim Fit Trousers,http://www.myntra.com/trousers/united-colors-of-benetton/united-colors-of-benetton-men-grey-slim-fit-trouse/244102/buy,Rs. 2,299,men-trousers,Pants,Trousers,http://myntra.myntassets.com/images/style/properties/United-Colors-of-Benetton-Men-Grey-Slim-Fit-Trousers_da5259e4bbcb7dc384716ea4ec84602c_images_1080_1440_mini.jpg,None,None,men,http://www.myntra.com/trousers/united-colors-of-benetton/united-colors-of-benetton-men-grey-slim-fit-trouse/244102/buy,Sold byVector Ecommerce Pvt Ltd,None,None,['28', '30', '32', '34', '36'],None,<ul class="mk-pdpv1-product-helper mk-cf"><li class="desc-main-title">Product Description</li><li class="desc-sub-title">Style Note</li><li class="desc-sub-text " itemprop="description"><p>Add a bit of flair with this super trendy pair of trousers from United Colors of Benetton. We suggest that you match it with a white linen shirt or a printed tee and tan moccasins for a relaxed casual ensemble.</p></li><li class="desc-sub-title ">Product Details</li><li class="desc-sub-text"><p>Grey trousers, woven, waistband with belt loops, zipped and buttoned closure, slant pockets at the sides, welt pocket on the right pocket, two welt pockets at back, brand badge on waistband at the right</p></li><li class="desc-sub-title ">Material &amp; Care</li><li class="desc-sub-text "><p>98% cotton, 2% elastane<br/>Machine wash cold</p></li><li class="desc-sub-title">Size &amp; Fit</li><li class="desc-sub-text"><p>Slim fit<br/>The model (height 6' and waist 32") is wearing a size 32</p></li></ul>,25:02:2014,None
None,Roadster Men Khaki Torino Slim Fit Trousers,http://www.myntra.com/trousers/roadster/roadster-men-khaki-torino-slim-fit-trousers/161471/buy,Rs. 1,599,men-trousers,Pants,Trousers,http://myntra.myntassets.com/images/style/properties/Roadster-Men-Khaki-Slim-Fit-Trousers_b68fab4e52ce670b1b84688e2b8554ce_images_1080_1440_mini.jpg,None,None,men,http://www.myntra.com/trousers/roadster/roadster-men-khaki-torino-slim-fit-trousers/161471/buy,Sold byVector Ecommerce Pvt Ltd,None,None,['28', '30', '32', '34', '36'],None,<ul class="mk-pdpv1-product-helper mk-cf"><li class="desc-main-title">Product Description</li><li class="desc-sub-title">Style Note</li><li class="desc-sub-text " itemprop="description"><p>Take a break from your routine and try these super-trendy chinos by Roadster in the loveliest of hues. Match this pair with a fun graphic tee or a shirt and high-top trainers for a cool urban appeal.</p></li><li class="desc-sub-title ">Product Details</li><li class="desc-sub-text"><p>Khaki trousers, waistband with belt loops, button and zip closure at front, slant pockets on either side at front, welt coin pocket on the right, two welt pockets at back with buttoned closure, metal branding above right welt pocket at back<br/>Our stylist has paired these trousers with a belt<br/>The trousers will not come with a belt</p></li><li class="desc-sub-title ">Material &amp; Care</li><li class="desc-sub-text "><p>98% cotton, 2% Spandex<br/>Machine wash cold<br/>You are unique and wouldn't like it if the Creator made too many people ditto.<br/>Similarly, this product is unique, handmade and crafted with love.<br/>There are no two products we make, which will ever be ditto.<br/>To maintain a high degree of authenticity, we advise our patrons to wash our products<br/>separately and expect some fading, colour bleeding and wear and tear.<br/>The article ages uniquely as you treat it, acquiring your personalised feel. Go on, enjoy this specially created product to the hilt. Have fun.</p></li><li class="desc-sub-title">Size &amp; Fit</li><li class="desc-sub-text"><p>Torino fit (slim fit)<br/>The model (height 6' and waist 32") is wearing a size 32</p></li></ul>,25:02:2014,None
