None,Fit and flared polka dot dress,http://www.myntra.com/Dresses/Tonga/Fit-and-flared-polka-dot-dress/193178/buy,Rs. 903,women-apparel-new-arrivals,Clothing,Tonga,http://myntra.myntassets.com/images/style/properties/Fit-and-flared-polka-dot-dress_cc31ce83cdd4878732f6b4209c3fc6a8_images_1080_1440_mini.jpg,Rs. 1,290,None,women,http://www.myntra.com/Dresses/Tonga/Fit-and-flared-polka-dot-dress/193178/buy,Sold byVector Ecommerce Pvt Ltd,None,None,['XS', 'S', 'M', 'L', 'XL'],None,<ul class="mk-pdpv1-product-helper mk-cf"><li class="desc-main-title">Product Description</li><li class="desc-sub-title">Style Note</li><li class="desc-sub-text " itemprop="description"><p>Feminine, chic and just a tad bit retro, polka dots never go out of style. This fit and flared black and white polka dot dress is a tribute to the era of retro fashion, a perfect blend of the past and the future, of tradition and modernity.</p></li><li class="desc-sub-title ">Product Details</li><li class="desc-sub-text"><p>Fit and flared polka dot dress, woven, collared neckline, half sleeves, polka dot waistline self belt and zip at back</p></li><li class="desc-sub-title ">Material &amp; Care</li><li class="desc-sub-text "><p>100% CottonHand wash cold, do not bleach, Hand dry, Iron low</p></li><li class="desc-sub-title">Size &amp; Fit</li><li class="desc-sub-text"><p>The model (height 5'6", chest 34", waist 26") is wearing a size 6 which measures 91.5 cm from shoulder to hem</p></li></ul>,26:02:2014,None
None,Tonga Cream Umbrella Cuff Dress,http://www.myntra.com/Dresses/Tonga/Tonga-Cream-Umbrella-Cuff-Dress/204548/buy,Rs. 903,women-apparel-new-arrivals,Clothing,Tonga,http://myntra.myntassets.com/images/style/properties/Tonga-Cream-Umbrella-Cuff-Dress_2eaea1cadfec080dfd1b809e0c9e2be0_images_1080_1440_mini.jpg,Rs. 1,290,None,women,http://www.myntra.com/Dresses/Tonga/Tonga-Cream-Umbrella-Cuff-Dress/204548/buy,Sold byVector Ecommerce Pvt Ltd,None,None,['XS', 'S', 'M', 'L', 'XL'],None,<ul class="mk-pdpv1-product-helper mk-cf"><li class="desc-main-title">Product Description</li><li class="desc-sub-title">Style Note</li><li class="desc-sub-text " itemprop="description"><p>A unique twist to the bell bottoms craze of the 1970's, this full sleeved umbrella cuff dress is retro and modern all at once. Pair with gold or beige platforms and bling accessories, and make a fashion statement in this Tonga creation.</p></li><li class="desc-sub-title ">Product Details</li><li class="desc-sub-text"><p>Full sleeved A-Line dress with umbrella cuffs, knit, round neck, full sleeved, tie up open back</p></li><li class="desc-sub-title ">Material &amp; Care</li><li class="desc-sub-text "><p>90% polyester<br/>10 % Spandex<br/>Hand wash cold</p></li><li class="desc-sub-title">Size &amp; Fit</li><li class="desc-sub-text"><p>The model (height 5'8", chest 33", waist 26") is wearing a size 6 which measures 81.5 cm from shoulder to hem</p></li></ul>,26:02:2014,None
None,Tonga 2-fer sheer mini dress,http://www.myntra.com/Dresses/Tonga/Tonga-2-fer-sheer-mini-dress/204540/buy,Rs. 910,women-apparel-new-arrivals,Clothing,Tonga,http://myntra.myntassets.com/images/style/properties/2-fer-sheer-mini-dress_d0e29df097f459cedcff38ccf91efb0d_images_1080_1440_mini.jpg,Rs. 1,300,None,women,http://www.myntra.com/Dresses/Tonga/Tonga-2-fer-sheer-mini-dress/204540/buy,Sold byVector Ecommerce Pvt Ltd,None,None,['XS', 'S', 'M', 'L', 'XL'],None,<ul class="mk-pdpv1-product-helper mk-cf"><li class="desc-main-title">Product Description</li><li class="desc-sub-title">Style Note</li><li class="desc-sub-text " itemprop="description"><p>This 2-fer dress from Tonga features a flowy sheer top that adds comfort, while the contrast black and white mini skirt adds some figure hugging flair. Pair up with gladiator sandals or Mary Jane heels for the complete look.</p></li><li class="desc-sub-title ">Product Details</li><li class="desc-sub-text"><p>2-fer sheer dress with contrast black and white skirt, knit and woven, scoop neck, sleeveless, black lining under sheer top</p></li><li class="desc-sub-title ">Material &amp; Care</li><li class="desc-sub-text "><p>90% Polyester, 10 % spandexHand wash cold, do not bleach, Hand dry, Iron low</p></li><li class="desc-sub-title">Size &amp; Fit</li><li class="desc-sub-text"><p>The model (height 5'6", chest 34", waist 26") is wearing a size 6 which measures 71 cm from shoulder to hem</p></li></ul>,26:02:2014,None
None,Tonga Blue Bodycon Dress,http://www.myntra.com/Dresses/Tonga/Tonga-Blue-Bodycon-Dress/215790/buy,Rs. 779,women-apparel-new-arrivals,Clothing,Tonga,http://myntra.myntassets.com/images/style/properties/Tonga-Women-Dresses_1feeb34d94ba1bc3fa2316ec12f2a053_images_1080_1440_mini.jpg,Rs. 1,199,None,women,http://www.myntra.com/Dresses/Tonga/Tonga-Blue-Bodycon-Dress/215790/buy,Sold byVector Ecommerce Pvt Ltd,None,None,['XS', 'S', 'M', 'L', 'XL'],None,<ul class="mk-pdpv1-product-helper mk-cf"><li class="desc-main-title">Product Description</li><li class="desc-sub-title">Style Note</li><li class="desc-sub-text " itemprop="description"><p>Tonga brings you dresses that will give you a unique statement look this season. Team this chic piece with strappy stilettos for your next party.</p></li><li class="desc-sub-title ">Product Details</li><li class="desc-sub-text"><p>Blue dress, has a round neck with binding, short extended sleeves with binding at hems, tuck detailing all over</p></li><li class="desc-sub-title ">Material &amp; Care</li><li class="desc-sub-text "><p>90% polyester, 10% Spandex<br/>Hand wash cold</p></li><li class="desc-sub-title">Size &amp; Fit</li><li class="desc-sub-text"><p>The model (height 5'6", chest 34", waist 26") is wearing a size S which measures 86 cm from shoulder to hem</p></li></ul>,26:02:2014,None
None,Tonga Women Black Top,http://www.myntra.com/Tops/Tonga/Tonga-Women-Black-Top/193189/buy,Rs. 749,women-apparel-new-arrivals,Clothing,Tonga,http://myntra.myntassets.com/images/style/properties/Tonga-Women-Black-Top_e97f36f1c00060431cd3e3627b4b867d_images_1080_1440_mini.jpg,Rs. 999,None,women,http://www.myntra.com/Tops/Tonga/Tonga-Women-Black-Top/193189/buy,Sold byVector Ecommerce Pvt Ltd,None,None,['XS', 'S', 'M', 'L', 'XL'],None,<ul class="mk-pdpv1-product-helper mk-cf"><li class="desc-main-title">Product Description</li><li class="desc-sub-title">Style Note</li><li class="desc-sub-text " itemprop="description"><p>Chic and girly, this frilly top from Tonga promises to turn heads at any occasion. Style with jeans, shorts or a skirt and step out looking your most feminine in this Tonga creation.</p></li><li class="desc-sub-title ">Product Details</li><li class="desc-sub-text"><p>Black top with red chiffon frill neckline, knit with woven contrast, V-neck, cap sleeved with frills and bow in front.</p></li><li class="desc-sub-title ">Material &amp; Care</li><li class="desc-sub-text "><p>95% polyester<br/> 5% Spandex<br/>Hand wash cold</p></li><li class="desc-sub-title">Size &amp; Fit</li><li class="desc-sub-text"><p>The model (height 5'8", chest 32"and waist 26") is wearing a size 9</p></li></ul>,26:02:2014,None
None,Tonga Women Cream Lace Blouse,http://www.myntra.com/Tops/Tonga/Tonga-Women-Cream-Lace-Blouse/193191/buy,Rs. 818,women-apparel-new-arrivals,Clothing,Tonga,http://myntra.myntassets.com/images/style/properties/Tonga-Women-Cream-Lace-Blouse_59b57a48dad210791261f2288b6cf371_images_1080_1440_mini.jpg,Rs. 1,090,None,women,http://www.myntra.com/Tops/Tonga/Tonga-Women-Cream-Lace-Blouse/193191/buy,Sold byVector Ecommerce Pvt Ltd,None,None,['XS', 'S', 'M', 'L', 'XL'],None,<ul class="mk-pdpv1-product-helper mk-cf"><li class="desc-main-title">Product Description</li><li class="desc-sub-title">Style Note</li><li class="desc-sub-text " itemprop="description"><p>Define your personal style with this fabulously feminine lace top with a Peter Pan collar. Innocent and sexy all at once, pair this with jeans, capris or a skirt and get set to make a true fashion statement.</p></li><li class="desc-sub-title ">Product Details</li><li class="desc-sub-text"><p>Cream lace top with contrast collar, knit, Peter Pan collar neck, half sleeves, cream lining attached</p></li><li class="desc-sub-title ">Material &amp; Care</li><li class="desc-sub-text "><p>90% polyester<br/> 10% Spandex<br/>Hand wash cold</p></li><li class="desc-sub-title">Size &amp; Fit</li><li class="desc-sub-text"><p>The model (height 5'8", chest 32"and waist 26") is wearing a size 10</p></li></ul>,26:02:2014,None
None,Tonga Black & Grey Printed Bodycon Dress,http://www.myntra.com/Dresses/Tonga/Tonga-Black-&-Grey-Printed-Bodycon-Dress/215781/buy,Rs. 812,women-apparel-new-arrivals,Clothing,Tonga,http://myntra.myntassets.com/images/style/properties/Tonga-Women-Dresses_f0051a27e66783af383a455de9679eda_images_1080_1440_mini.jpg,Rs. 1,249,None,women,http://www.myntra.com/Dresses/Tonga/Tonga-Black-&-Grey-Printed-Bodycon-Dress/215781/buy,Sold byVector Ecommerce Pvt Ltd,None,None,['XS', 'S', 'M', 'L', 'XL'],None,<ul class="mk-pdpv1-product-helper mk-cf"><li class="desc-main-title">Product Description</li><li class="desc-sub-title">Style Note</li><li class="desc-sub-text " itemprop="description"><p>Tonga brings you dresses that you wouldn't want to take off. Team this chic piece with strappy stilettos for your next shindig.</p></li><li class="desc-sub-title ">Product Details</li><li class="desc-sub-text"><p>Black, grey and off-white printed dress, knitted, round neck, sleeveless, solid below waistline with an attached lining</p></li><li class="desc-sub-title ">Material &amp; Care</li><li class="desc-sub-text "><p>90% polyester, 10% Spandex<br/>Hand wash cold</p></li><li class="desc-sub-title">Size &amp; Fit</li><li class="desc-sub-text"><p>The model (height 5'6", chest 34", waist 26") is wearing a size S which measures 80 cm from shoulder to hem</p></li></ul>,26:02:2014,None
None,Tonga Purple Tube Dress,http://www.myntra.com/Dresses/Tonga/Tonga-Purple-Tube-Dress/215791/buy,Rs. 944,women-apparel-new-arrivals,Clothing,Tonga,http://myntra.myntassets.com/images/style/properties/Tonga-Women-Dresses_cc9a00f01a2fb26f4ed0622c85bd4fdf_images_1080_1440_mini.jpg,Rs. 1,349,None,women,http://www.myntra.com/Dresses/Tonga/Tonga-Purple-Tube-Dress/215791/buy,Sold byVector Ecommerce Pvt Ltd,None,None,['XS', 'S', 'M', 'L', 'XL'],None,<ul class="mk-pdpv1-product-helper mk-cf"><li class="desc-main-title">Product Description</li><li class="desc-sub-title">Style Note</li><li class="desc-sub-text " itemprop="description"><p>Tonga brings you dresses that you wouldn't want to take off. Team this chic piece with strappy stilettos for your next shindig.</p></li><li class="desc-sub-title ">Product Details</li><li class="desc-sub-text"><p>Purple tube dress, woven, embossed all-over, off-shoulder, sweetheart styling at front and elasticated at back, concealed zipped closure at back, flared panels below waistline</p></li><li class="desc-sub-title ">Material &amp; Care</li><li class="desc-sub-text "><p>100% polyester<br/>Hand wash cold</p></li><li class="desc-sub-title">Size &amp; Fit</li><li class="desc-sub-text"><p>The model (height 5'6", chest 34", waist 26") is wearing a size S which measures 66 cm from shoulder to hem</p></li></ul>,26:02:2014,None
None,Tonga Cream Coloured & Gold Printed Blouson Mini Dress,http://www.myntra.com/Dresses/Tonga/Tonga-Cream-Coloured-&-Gold-Printed-Blouson-Mini-Dress/215784/buy,Rs. 909,women-apparel-new-arrivals,Clothing,Tonga,http://myntra.myntassets.com/images/style/properties/Tonga-Women-Dresses_08b36cc5ae5216be6fadd4d4d67c63fc_images_1080_1440.jpg,Rs. 1,399,None,women,http://www.myntra.com/Dresses/Tonga/Tonga-Cream-Coloured-&-Gold-Printed-Blouson-Mini-Dress/215784/buy,Sold byVector Ecommerce Pvt Ltd,None,None,['XS', 'S', 'M', 'L'],None,<ul class="mk-pdpv1-product-helper mk-cf"><li class="desc-main-title">Product Description</li><li class="desc-sub-title">Style Note</li><li class="desc-sub-text " itemprop="description"><p>Tonga brings you dresses that you wouldn't want to take off. Team this chic piece with strappy stilettos for your next shindig..</p></li><li class="desc-sub-title ">Product Details</li><li class="desc-sub-text"><p>Cream coloured, gold and silver printed dress, woven, round neck, sleeveless, blouson bodice, printed below waistline, has an attached knit lining</p></li><li class="desc-sub-title ">Material &amp; Care</li><li class="desc-sub-text "><p>70% polyester, 30% Spandex<br/>Hand wash cold</p></li><li class="desc-sub-title">Size &amp; Fit</li><li class="desc-sub-text"><p>The model (height 5'6", chest 34", waist 26") is wearing a size S which measures 70 cm from shoulder to hem</p></li></ul>,26:02:2014,None
None,Tonga One shoulder black shimmer dress,http://www.myntra.com/Dresses/Tonga/Tonga-One-shoulder-black-shimmer-dress/204541/buy,Rs. 890,women-apparel-new-arrivals,Clothing,Tonga,http://myntra.myntassets.com/images/style/properties/One-shoulder-black-shimmer-dress_f12b9cbbe2d3389ec8e9d91ea610555d_images_1080_1440_mini.jpg,Rs. 1,290,None,women,http://www.myntra.com/Dresses/Tonga/Tonga-One-shoulder-black-shimmer-dress/204541/buy,Sold byVector Ecommerce Pvt Ltd,None,None,['XS', 'S', 'M', 'L'],None,<ul class="mk-pdpv1-product-helper mk-cf"><li class="desc-main-title">Product Description</li><li class="desc-sub-title">Style Note</li><li class="desc-sub-text " itemprop="description"><p>Shimmer and shine in this black one shoulder dress from Tonga. Figure hugging and light in texture and feel, get ready to rock the dance floor in this number.</p></li><li class="desc-sub-title ">Product Details</li><li class="desc-sub-text"><p>One shoulder black dress, knit, one shoulder neck, 3/4 sleeve, straight hem</p></li><li class="desc-sub-title ">Material &amp; Care</li><li class="desc-sub-text "><p>95% Polyester, 5 % spandexHand wash cold, do not bleach, Hand dry, Iron low</p></li><li class="desc-sub-title">Size &amp; Fit</li><li class="desc-sub-text"><p>The model (height 5'6", chest 34", waist 26") is wearing a size 6 which measures 83.5 cm from shoulder to hem</p></li></ul>,26:02:2014,None
None,Tonga Cream Linen Pencil Skirt,http://www.myntra.com/Skirts/Tonga/Tonga-Cream-Linen-Pencil-Skirt/193182/buy,Rs. 990,women-apparel-new-arrivals,Clothing,Tonga,http://myntra.myntassets.com/images/style/properties/Tonga-Cream-Linen-Pencil-Skirt_2ffcc0d9a17def3a1f062ddc7288d644_images_1080_1440_mini.jpg,None,None,women,http://www.myntra.com/Skirts/Tonga/Tonga-Cream-Linen-Pencil-Skirt/193182/buy,Sold byVector Ecommerce Pvt Ltd,None,None,['26', '28', '30', '32', '34'],None,<ul class="mk-pdpv1-product-helper mk-cf"><li class="desc-main-title">Product Description</li><li class="desc-sub-title">Style Note</li><li class="desc-sub-text " itemprop="description"><p>Perfect for the office, lunch or a movie date, this form fitting pencil skirt shows off your gorgeous figure. Pair with a classic black or white blosue for a quintessentially elegant look.</p></li><li class="desc-sub-title ">Product Details</li><li class="desc-sub-text"><p>Cream linen skirt with black stripes on waist and sides,  regular fit, straight hem above knee</p></li><li class="desc-sub-title ">Material &amp; Care</li><li class="desc-sub-text "><p>100% linen<br/>Hand wash cold</p></li><li class="desc-sub-title">Size &amp; Fit</li><li class="desc-sub-text"><p>The model (height 5'8", chest 33", waist 26") is wearing a size 6 which measures 51 cm from waist to hem</p></li></ul>,26:02:2014,None
None,Tonga Green Tube Dress,http://www.myntra.com/Dresses/Tonga/Tonga-Green-Tube-Dress/215792/buy,Rs. 944,women-apparel-new-arrivals,Clothing,Tonga,http://myntra.myntassets.com/images/style/properties/Tonga-Green-Tube-Dress_259eb6abe8a74eaa902712176535f0ed_images_1080_1440_mini.jpg,Rs. 1,349,None,women,http://www.myntra.com/Dresses/Tonga/Tonga-Green-Tube-Dress/215792/buy,Sold byVector Ecommerce Pvt Ltd,None,None,['XS', 'S', 'M', 'L', 'XL'],None,<ul class="mk-pdpv1-product-helper mk-cf"><li class="desc-main-title">Product Description</li><li class="desc-sub-title">Style Note</li><li class="desc-sub-text " itemprop="description"><p>Tonga brings you dresses that you wouldn't want to take off. Team this chic piece with strappy stilettos for your next shindig.</p></li><li class="desc-sub-title ">Product Details</li><li class="desc-sub-text"><p>Green tube dress, woven, off-shoulder, sweetheart styling at front and elasticated at back, concealed zipped closure at back, flared panels below waistline</p></li><li class="desc-sub-title ">Material &amp; Care</li><li class="desc-sub-text "><p>100% polyester<br/>Hand wash cold</p></li><li class="desc-sub-title">Size &amp; Fit</li><li class="desc-sub-text"><p>The model (height 5'6", chest 34", waist 26") is wearing a size S which measures 66 cm from shoulder to hem</p></li></ul>,26:02:2014,None
None,Tonga Black & White Printed Bodycon Dress,http://www.myntra.com/Dresses/Tonga/Tonga-Black-&-White-Printed-Bodycon-Dress/215782/buy,Rs. 844,women-apparel-new-arrivals,Clothing,Tonga,http://myntra.myntassets.com/images/style/properties/Tonga-Women-Dresses_8c3c132fc939e5793a456f3e86d9c9b7_images_1080_1440_mini.jpg,Rs. 1,299,None,women,http://www.myntra.com/Dresses/Tonga/Tonga-Black-&-White-Printed-Bodycon-Dress/215782/buy,Sold byVector Ecommerce Pvt Ltd,None,None,['XS', 'S', 'M', 'L', 'XL'],None,<ul class="mk-pdpv1-product-helper mk-cf"><li class="desc-main-title">Product Description</li><li class="desc-sub-title">Style Note</li><li class="desc-sub-text " itemprop="description"><p>Tonga brings you dresses that you wouldn't want to take off. Team this chic piece with strappy stilettos for your next shindig.</p></li><li class="desc-sub-title ">Product Details</li><li class="desc-sub-text"><p>Black and white dress, knitted, round neck, sleeveless with cut-out detail at shoulders, printed panel at front</p></li><li class="desc-sub-title ">Material &amp; Care</li><li class="desc-sub-text "><p>90% polyester, 10% Spandex<br/>Hand wash cold</p></li><li class="desc-sub-title">Size &amp; Fit</li><li class="desc-sub-text"><p>The model (height 5'6", chest 34", waist 26") is wearing a size S which measures 81 cm from shoulder to hem</p></li></ul>,26:02:2014,None
None,Orange cut out dress,http://www.myntra.com/Dresses/Tonga/Orange-cut-out-dress/193180/buy,Rs. 839,women-apparel-new-arrivals,Clothing,Tonga,http://myntra.myntassets.com/images/style/properties/Orange-cut-out-dress_f12f159e17dfcd33e2390e04db5f2e98_images_1080_1440_mini.jpg,Rs. 1,290,None,women,http://www.myntra.com/Dresses/Tonga/Orange-cut-out-dress/193180/buy,Sold byVector Ecommerce Pvt Ltd,None,None,['XS', 'S', 'M', 'L', 'XL'],None,<ul class="mk-pdpv1-product-helper mk-cf"><li class="desc-main-title">Product Description</li><li class="desc-sub-title">Style Note</li><li class="desc-sub-text " itemprop="description"><p>It's clear from the runways that the cutout is having its sexy little moment this fall and of course, Tonga's never far behind! Get this original orange cut out dress from Tonga and pair with pumps, stilletos or platforms for the complete look.</p></li><li class="desc-sub-title ">Product Details</li><li class="desc-sub-text"><p>Orange cut out silhouette dress, woven, round neck, sleeveless, cut outs on bust with back zip</p></li><li class="desc-sub-title ">Material &amp; Care</li><li class="desc-sub-text "><p>100% PolyesterHand wash cold, do not bleach, Hand dry, Iron low</p></li><li class="desc-sub-title">Size &amp; Fit</li><li class="desc-sub-text"><p>The model (height 5'6", chest 34", waist 26") is wearing a size 6 which measures 84 cm from shoulder to hem</p></li></ul>,26:02:2014,None
None,Tonga Women Black Polka Dot Top,http://www.myntra.com/Tops/Tonga/Tonga-Women-Black-Polka-Dot-Top/193183/buy,Rs. 644,women-apparel-new-arrivals,Clothing,Tonga,http://myntra.myntassets.com/images/style/properties/Tonga-Women-Black-Polka-Dot-Top_37cfb0b561cf5d0fcaa0c62f285ba250_images_1080_1440_mini.jpg,Rs. 990,None,women,http://www.myntra.com/Tops/Tonga/Tonga-Women-Black-Polka-Dot-Top/193183/buy,Sold byVector Ecommerce Pvt Ltd,None,None,['XS', 'S', 'M', 'L', 'XL'],None,<ul class="mk-pdpv1-product-helper mk-cf"><li class="desc-main-title">Product Description</li><li class="desc-sub-title">Style Note</li><li class="desc-sub-text " itemprop="description"><p>Get your polka on with this smart casual top from Tonga. Pair with jeans, capris or a mini skirt and pumps for a brunch with the girls.</p></li><li class="desc-sub-title ">Product Details</li><li class="desc-sub-text"><p>Black top, knit, round neck, short net panel slevees with binding at the hem, polka dot net yoke neckline, straight hem</p></li><li class="desc-sub-title ">Material &amp; Care</li><li class="desc-sub-text "><p>95% polyester<br/> 5% Spandex<br/>Hand wash cold</p></li><li class="desc-sub-title">Size &amp; Fit</li><li class="desc-sub-text"><p>The model (height 5'8", chest 32"and waist 26") is wearing a size 6</p></li></ul>,26:02:2014,None
None,Tonga Sleeveless skater dress,http://www.myntra.com/Dresses/Tonga/Tonga-Sleeveless-skater-dress/204537/buy,Rs. 938,women-apparel-new-arrivals,Clothing,Tonga,http://myntra.myntassets.com/images/style/properties/Sleeveless-skater-dress_d56a06f28679d0223e1e90ea8628f9a1_images_1080_1440_mini.jpg,Rs. 1,250,None,women,http://www.myntra.com/Dresses/Tonga/Tonga-Sleeveless-skater-dress/204537/buy,Sold byVector Ecommerce Pvt Ltd,None,None,['XS', 'S', 'M', 'L', 'XL'],None,<ul class="mk-pdpv1-product-helper mk-cf"><li class="desc-main-title">Product Description</li><li class="desc-sub-title">Style Note</li><li class="desc-sub-text " itemprop="description"><p>Versatile and comfortable, this pink and black skater dress from Tonga can be dressed up or dressed down for any occasion. Add some bling with sparkling earrings and a shimmery clutch, or go casual with flats and a flowery hair piece.</p></li><li class="desc-sub-title ">Product Details</li><li class="desc-sub-text"><p>Pink and black skater dress, woven, round neck, sleeveless, with back zip</p></li><li class="desc-sub-title ">Material &amp; Care</li><li class="desc-sub-text "><p>95% Polyester, 5 % spandexHand wash cold, do not bleach, Hand dry, Iron low</p></li><li class="desc-sub-title">Size &amp; Fit</li><li class="desc-sub-text"><p>The model (height 5'6", chest 34", waist 26") is wearing a size 6 which measures 81.5 cm from shoulder to hem</p></li></ul>,26:02:2014,None
None,Tonga Black & White Fit & Flare Skater Dress,http://www.myntra.com/Dresses/Tonga/Tonga-Black-&-White-Fit-&-Flare-Skater-Dress/215788/buy,Rs. 877,women-apparel-new-arrivals,Clothing,Tonga,http://myntra.myntassets.com/images/style/properties/Tonga-Women-Dresses_359e9750a6d49ca68401d9e8386ace96_images_1080_1440_mini.jpg,Rs. 1,349,None,women,http://www.myntra.com/Dresses/Tonga/Tonga-Black-&-White-Fit-&-Flare-Skater-Dress/215788/buy,Sold byVector Ecommerce Pvt Ltd,None,None,['XS', 'S', 'M', 'L', 'XL'],None,<ul class="mk-pdpv1-product-helper mk-cf"><li class="desc-main-title">Product Description</li><li class="desc-sub-title">Style Note</li><li class="desc-sub-text " itemprop="description"><p>Reminiscent of the babydoll dresses and frocks from the 1990s, skater dresses are back with a bang this fall. The skater cut is perfect for most body types and this Tonga original is just the thing for your next shindig.</p></li><li class="desc-sub-title ">Product Details</li><li class="desc-sub-text"><p>Black dress with white piping, woven, round neck, sleeveless, concealed zipped closure at back</p></li><li class="desc-sub-title ">Material &amp; Care</li><li class="desc-sub-text "><p>100% polyester<br/>Hand wash cold</p></li><li class="desc-sub-title">Size &amp; Fit</li><li class="desc-sub-text"><p>The model (height 5'6", chest 34", waist 26") is wearing a size S which measures 84 cm from shoulder to hem</p></li></ul>,26:02:2014,None
None,Red cut out fit and flared dress,http://www.myntra.com/Dresses/Tonga/Red-cut-out-fit-and-flared-dress/193176/buy,Rs. 774,women-apparel-new-arrivals,Clothing,Tonga,http://myntra.myntassets.com/images/style/properties/Red-cut-out-fit-and-flared-dress_6c3478dcec853fef1494410fecd30f55_images_1080_1440_mini.jpg,Rs. 1,190,None,women,http://www.myntra.com/Dresses/Tonga/Red-cut-out-fit-and-flared-dress/193176/buy,Sold byVector Ecommerce Pvt Ltd,None,None,['XS', 'S', 'M', 'L', 'XL'],None,<ul class="mk-pdpv1-product-helper mk-cf"><li class="desc-main-title">Product Description</li><li class="desc-sub-title">Style Note</li><li class="desc-sub-text " itemprop="description"><p>It's clear from the runways that the cutout is having its sexy little moment this fall and of course, Tonga's never far behind! Get this original red cut out dress from Tonga and pair with pumps, stilletos or platforms for the complete look.</p></li><li class="desc-sub-title ">Product Details</li><li class="desc-sub-text"><p>Red cut out fit and flared dress, knit, high straight neck, sleeveless, cut outs in front and back with zip at back</p></li><li class="desc-sub-title ">Material &amp; Care</li><li class="desc-sub-text "><p>95% Polyester, 5% SpandexHand wash cold, do not bleach, Hand dry, Iron low</p></li><li class="desc-sub-title">Size &amp; Fit</li><li class="desc-sub-text"><p>The model (height 5'6", chest 34", waist 26") is wearing a size 6 which measures 86.5 cm from shoulder to hem</p></li></ul>,26:02:2014,None
