None,Tonga Purple skater dress,http://www.myntra.com/Dresses/Tonga/Tonga-Purple-skater-dress/204538/buy,Rs. 1,163,women-apparel-new-arrivals,Clothing,Tonga,http://myntra.myntassets.com/images/style/properties/Purple-skater-dress_d271af7703a8e1cd70980a1f6c794ccc_images_1080_1440_mini.jpg,Rs. 1,550,None,women,http://www.myntra.com/Dresses/Tonga/Tonga-Purple-skater-dress/204538/buy,Sold byVector Ecommerce Pvt Ltd,None,None,['XS', 'S', 'M', 'L', 'XL'],None,<ul class="mk-pdpv1-product-helper mk-cf"><li class="desc-main-title">Product Description</li><li class="desc-sub-title">Style Note</li><li class="desc-sub-text " itemprop="description"><p>Simple and sophisticated, this Tonga original is inspired by the opulent purples that are synonymous with royalty, balanced perfectly with the classic princess feel of its elegant skater cut.</p></li><li class="desc-sub-title ">Product Details</li><li class="desc-sub-text"><p>Purple skater dress, woven, square neck, sleeveless, back zip,belt loops on the side with black belt</p></li><li class="desc-sub-title ">Material &amp; Care</li><li class="desc-sub-text "><p>95% Polyester, 5 % spandexHand wash cold, do not bleach, Hand dry, Iron low</p></li><li class="desc-sub-title">Size &amp; Fit</li><li class="desc-sub-text"><p>The model (height 5'6", chest 34", waist 26") is wearing a size 6 which measures 82.5 cm from shoulder to hem</p></li></ul>,26:02:2014,None
None,Tonga Green Tube Dress,http://www.myntra.com/Dresses/Tonga/Tonga-Green-Tube-Dress/215792/buy,Rs. 944,women-apparel-new-arrivals,Clothing,Tonga,http://myntra.myntassets.com/images/style/properties/Tonga-Green-Tube-Dress_259eb6abe8a74eaa902712176535f0ed_images_1080_1440_mini.jpg,Rs. 1,349,None,women,http://www.myntra.com/Dresses/Tonga/Tonga-Green-Tube-Dress/215792/buy,Sold byVector Ecommerce Pvt Ltd,None,None,['XS', 'S', 'M', 'L', 'XL'],None,<ul class="mk-pdpv1-product-helper mk-cf"><li class="desc-main-title">Product Description</li><li class="desc-sub-title">Style Note</li><li class="desc-sub-text " itemprop="description"><p>Tonga brings you dresses that you wouldn't want to take off. Team this chic piece with strappy stilettos for your next shindig.</p></li><li class="desc-sub-title ">Product Details</li><li class="desc-sub-text"><p>Green tube dress, woven, off-shoulder, sweetheart styling at front and elasticated at back, concealed zipped closure at back, flared panels below waistline</p></li><li class="desc-sub-title ">Material &amp; Care</li><li class="desc-sub-text "><p>100% polyester<br/>Hand wash cold</p></li><li class="desc-sub-title">Size &amp; Fit</li><li class="desc-sub-text"><p>The model (height 5'6", chest 34", waist 26") is wearing a size S which measures 66 cm from shoulder to hem</p></li></ul>,26:02:2014,None
None,Tonga Black & White Fit & Flare Skater Dress,http://www.myntra.com/Dresses/Tonga/Tonga-Black-&-White-Fit-&-Flare-Skater-Dress/215788/buy,Rs. 877,women-apparel-new-arrivals,Clothing,Tonga,http://myntra.myntassets.com/images/style/properties/Tonga-Women-Dresses_359e9750a6d49ca68401d9e8386ace96_images_1080_1440_mini.jpg,Rs. 1,349,None,women,http://www.myntra.com/Dresses/Tonga/Tonga-Black-&-White-Fit-&-Flare-Skater-Dress/215788/buy,Sold byVector Ecommerce Pvt Ltd,None,None,['XS', 'S', 'M', 'L', 'XL'],None,<ul class="mk-pdpv1-product-helper mk-cf"><li class="desc-main-title">Product Description</li><li class="desc-sub-title">Style Note</li><li class="desc-sub-text " itemprop="description"><p>Reminiscent of the babydoll dresses and frocks from the 1990s, skater dresses are back with a bang this fall. The skater cut is perfect for most body types and this Tonga original is just the thing for your next shindig.</p></li><li class="desc-sub-title ">Product Details</li><li class="desc-sub-text"><p>Black dress with white piping, woven, round neck, sleeveless, concealed zipped closure at back</p></li><li class="desc-sub-title ">Material &amp; Care</li><li class="desc-sub-text "><p>100% polyester<br/>Hand wash cold</p></li><li class="desc-sub-title">Size &amp; Fit</li><li class="desc-sub-text"><p>The model (height 5'6", chest 34", waist 26") is wearing a size S which measures 84 cm from shoulder to hem</p></li></ul>,26:02:2014,None
None,Tonga Sea Green Peplum Dress,http://www.myntra.com/Dresses/Tonga/Tonga-Sea-Green-Peplum-Dress/183281/buy,Rs. 763,women-apparel-new-arrivals,Clothing,Tonga,http://myntra.myntassets.com/images/style/properties/Tonga-Women-Dresses_da8c9ad49813141670e7b5027f9ba29b_images_1080_1440_mini.jpg,Rs. 1,090,None,women,http://www.myntra.com/Dresses/Tonga/Tonga-Sea-Green-Peplum-Dress/183281/buy,Sold byVector Ecommerce Pvt Ltd,None,None,['XS', 'S', 'M', 'L', 'XL'],None,<ul class="mk-pdpv1-product-helper mk-cf"><li class="desc-main-title">Product Description</li><li class="desc-sub-title">Style Note</li><li class="desc-sub-text " itemprop="description"><p>Look ladylike and elegant in a piece from Tonga's range of dresses. This one will look fabulous when styled with peep-toe pumps for a weekend outing.</p></li><li class="desc-sub-title ">Product Details</li><li class="desc-sub-text"><p>Sea green peplum shift dress, woven, round neck, sleeveless, peplum panels at the waist, concealed zip closure at the back, panelled below the waist at back</p></li><li class="desc-sub-title ">Material &amp; Care</li><li class="desc-sub-text "><p>100% polyester<br/>Hand wash cold</p></li><li class="desc-sub-title">Size &amp; Fit</li><li class="desc-sub-text"><p>The model (height 5'8", chest 33" and waist 28") is wearing a size 6 which measures 85 cm from shoulder to hem</p></li></ul>,26:02:2014,None
None,Tonga Black & Brown Animal Print Bodycon Dress,http://www.myntra.com/Dresses/Tonga/Tonga-Black-&-Brown-Animal-Print-Bodycon-Dress/215780/buy,Rs. 874,women-apparel-new-arrivals,Clothing,Tonga,http://myntra.myntassets.com/images/style/properties/Tonga-Women-Dresses_dddf92f111e5159a9ff25604c97c9fd9_images_1080_1440_mini.jpg,Rs. 1,249,None,women,http://www.myntra.com/Dresses/Tonga/Tonga-Black-&-Brown-Animal-Print-Bodycon-Dress/215780/buy,Sold byVector Ecommerce Pvt Ltd,None,None,['XS', 'S', 'M', 'L', 'XL'],None,<ul class="mk-pdpv1-product-helper mk-cf"><li class="desc-main-title">Product Description</li><li class="desc-sub-title">Style Note</li><li class="desc-sub-text " itemprop="description"><p>Tonga brings you dresses that you wouldn't want to take off. Team this chic piece with strappy stilettos for your next shindig.</p></li><li class="desc-sub-title ">Product Details</li><li class="desc-sub-text"><p>Black, brown and off-white animal print dress, knitted, cowl neck, sleeveless, solid below waistline with an attached lining</p></li><li class="desc-sub-title ">Material &amp; Care</li><li class="desc-sub-text "><p>95% polyester, 5% Spandex<br/>Hand wash cold</p></li><li class="desc-sub-title">Size &amp; Fit</li><li class="desc-sub-text"><p>The model (height 5'6", chest 34", waist 26") is wearing a size S which measures 80 cm from shoulder to hem</p></li></ul>,26:02:2014,None
None,Tonga Black Polka Dot Skater Dress with Open Back,http://www.myntra.com/Dresses/Tonga/Tonga-Black-Polka-Dot-Skater-Dress-with-Open-Back/204542/buy,Rs. 954,women-apparel-new-arrivals,Clothing,Tonga,http://myntra.myntassets.com/images/style/properties/Tonga-Black-Polka-Dot-Skater-Dress-with-Open-Back_ccc5fc98d2371a5e8a2574df3beaf18e_images_1080_1440_mini.jpg,Rs. 1,590,None,women,http://www.myntra.com/Dresses/Tonga/Tonga-Black-Polka-Dot-Skater-Dress-with-Open-Back/204542/buy,Sold byVector Ecommerce Pvt Ltd,None,None,['XS', 'S', 'M', 'L'],None,<ul class="mk-pdpv1-product-helper mk-cf"><li class="desc-main-title">Product Description</li><li class="desc-sub-title">Style Note</li><li class="desc-sub-text " itemprop="description"><p>Discover your inner diva in this Tonga tribute to the 1970's. A demure skater dress with a daring open mesh back, this number is guaranteed to turn heads wherever you go. Pair with simple black Mary Jane heels and a black clutch.</p></li><li class="desc-sub-title ">Product Details</li><li class="desc-sub-text"><p>Polka dot mesh dress, woven, round neck, full sleeves, with open back and back zip on skirt</p></li><li class="desc-sub-title ">Material &amp; Care</li><li class="desc-sub-text "><p>95% Polyester, 5 % Spandex<br/>Hand wash cold, do not bleach, Hand dry, Iron low</p></li><li class="desc-sub-title">Size &amp; Fit</li><li class="desc-sub-text"><p>The model (height 5'6", chest 34", waist 26") is wearing a size 6 which measures 83.5 cm from shoulder to hem</p></li></ul>,26:02:2014,None
