None,Tonga Cream Umbrella Cuff Dress,http://www.myntra.com/Dresses/Tonga/Tonga-Cream-Umbrella-Cuff-Dress/204548/buy,Rs. 903,women-apparel-new-arrivals,Clothing,Tonga,http://myntra.myntassets.com/images/style/properties/Tonga-Cream-Umbrella-Cuff-Dress_2eaea1cadfec080dfd1b809e0c9e2be0_images_1080_1440_mini.jpg,Rs. 1,290,None,women,http://www.myntra.com/Dresses/Tonga/Tonga-Cream-Umbrella-Cuff-Dress/204548/buy,Sold byVector Ecommerce Pvt Ltd,None,None,['XS', 'S', 'M', 'L', 'XL'],None,<ul class="mk-pdpv1-product-helper mk-cf"><li class="desc-main-title">Product Description</li><li class="desc-sub-title">Style Note</li><li class="desc-sub-text " itemprop="description"><p>A unique twist to the bell bottoms craze of the 1970's, this full sleeved umbrella cuff dress is retro and modern all at once. Pair with gold or beige platforms and bling accessories, and make a fashion statement in this Tonga creation.</p></li><li class="desc-sub-title ">Product Details</li><li class="desc-sub-text"><p>Full sleeved A-Line dress with umbrella cuffs, knit, round neck, full sleeved, tie up open back</p></li><li class="desc-sub-title ">Material &amp; Care</li><li class="desc-sub-text "><p>90% polyester<br/>10 % Spandex<br/>Hand wash cold</p></li><li class="desc-sub-title">Size &amp; Fit</li><li class="desc-sub-text"><p>The model (height 5'8", chest 33", waist 26") is wearing a size 6 which measures 81.5 cm from shoulder to hem</p></li></ul>,26:02:2014,None
None,Tonga One shoulder black shimmer dress,http://www.myntra.com/Dresses/Tonga/Tonga-One-shoulder-black-shimmer-dress/204541/buy,Rs. 890,women-apparel-new-arrivals,Clothing,Tonga,http://myntra.myntassets.com/images/style/properties/One-shoulder-black-shimmer-dress_f12b9cbbe2d3389ec8e9d91ea610555d_images_1080_1440_mini.jpg,Rs. 1,290,None,women,http://www.myntra.com/Dresses/Tonga/Tonga-One-shoulder-black-shimmer-dress/204541/buy,Sold byVector Ecommerce Pvt Ltd,None,None,['XS', 'S', 'M', 'L'],None,<ul class="mk-pdpv1-product-helper mk-cf"><li class="desc-main-title">Product Description</li><li class="desc-sub-title">Style Note</li><li class="desc-sub-text " itemprop="description"><p>Shimmer and shine in this black one shoulder dress from Tonga. Figure hugging and light in texture and feel, get ready to rock the dance floor in this number.</p></li><li class="desc-sub-title ">Product Details</li><li class="desc-sub-text"><p>One shoulder black dress, knit, one shoulder neck, 3/4 sleeve, straight hem</p></li><li class="desc-sub-title ">Material &amp; Care</li><li class="desc-sub-text "><p>95% Polyester, 5 % spandexHand wash cold, do not bleach, Hand dry, Iron low</p></li><li class="desc-sub-title">Size &amp; Fit</li><li class="desc-sub-text"><p>The model (height 5'6", chest 34", waist 26") is wearing a size 6 which measures 83.5 cm from shoulder to hem</p></li></ul>,26:02:2014,None
None,Tonga Black & Grey Printed Bodycon Dress,http://www.myntra.com/Dresses/Tonga/Tonga-Black-&-Grey-Printed-Bodycon-Dress/215781/buy,Rs. 812,women-apparel-new-arrivals,Clothing,Tonga,http://myntra.myntassets.com/images/style/properties/Tonga-Women-Dresses_f0051a27e66783af383a455de9679eda_images_1080_1440_mini.jpg,Rs. 1,249,None,women,http://www.myntra.com/Dresses/Tonga/Tonga-Black-&-Grey-Printed-Bodycon-Dress/215781/buy,Sold byVector Ecommerce Pvt Ltd,None,None,['XS', 'S', 'M', 'L', 'XL'],None,<ul class="mk-pdpv1-product-helper mk-cf"><li class="desc-main-title">Product Description</li><li class="desc-sub-title">Style Note</li><li class="desc-sub-text " itemprop="description"><p>Tonga brings you dresses that you wouldn't want to take off. Team this chic piece with strappy stilettos for your next shindig.</p></li><li class="desc-sub-title ">Product Details</li><li class="desc-sub-text"><p>Black, grey and off-white printed dress, knitted, round neck, sleeveless, solid below waistline with an attached lining</p></li><li class="desc-sub-title ">Material &amp; Care</li><li class="desc-sub-text "><p>90% polyester, 10% Spandex<br/>Hand wash cold</p></li><li class="desc-sub-title">Size &amp; Fit</li><li class="desc-sub-text"><p>The model (height 5'6", chest 34", waist 26") is wearing a size S which measures 80 cm from shoulder to hem</p></li></ul>,26:02:2014,None
None,Tonga Women Black Top,http://www.myntra.com/Tops/Tonga/Tonga-Women-Black-Top/193189/buy,Rs. 749,women-apparel-new-arrivals,Clothing,Tonga,http://myntra.myntassets.com/images/style/properties/Tonga-Women-Black-Top_e97f36f1c00060431cd3e3627b4b867d_images_1080_1440_mini.jpg,Rs. 999,None,women,http://www.myntra.com/Tops/Tonga/Tonga-Women-Black-Top/193189/buy,Sold byVector Ecommerce Pvt Ltd,None,None,['XS', 'S', 'M', 'L', 'XL'],None,<ul class="mk-pdpv1-product-helper mk-cf"><li class="desc-main-title">Product Description</li><li class="desc-sub-title">Style Note</li><li class="desc-sub-text " itemprop="description"><p>Chic and girly, this frilly top from Tonga promises to turn heads at any occasion. Style with jeans, shorts or a skirt and step out looking your most feminine in this Tonga creation.</p></li><li class="desc-sub-title ">Product Details</li><li class="desc-sub-text"><p>Black top with red chiffon frill neckline, knit with woven contrast, V-neck, cap sleeved with frills and bow in front.</p></li><li class="desc-sub-title ">Material &amp; Care</li><li class="desc-sub-text "><p>95% polyester<br/> 5% Spandex<br/>Hand wash cold</p></li><li class="desc-sub-title">Size &amp; Fit</li><li class="desc-sub-text"><p>The model (height 5'8", chest 32"and waist 26") is wearing a size 9</p></li></ul>,26:02:2014,None
None,Tonga Black & White Bodycon Dress,http://www.myntra.com/Dresses/Tonga/Tonga-Black-&-White-Bodycon-Dress/215786/buy,Rs. 774,women-apparel-new-arrivals,Clothing,Tonga,http://myntra.myntassets.com/images/style/properties/Tonga-Women-Dresses_784252aba414f57fb92f7dbb71a55fdb_images_1080_1440_mini.jpg,Rs. 1,190,None,women,http://www.myntra.com/Dresses/Tonga/Tonga-Black-&-White-Bodycon-Dress/215786/buy,Sold byVector Ecommerce Pvt Ltd,None,None,['XS', 'S', 'M', 'L', 'XL'],None,<ul class="mk-pdpv1-product-helper mk-cf"><li class="desc-main-title">Product Description</li><li class="desc-sub-title">Style Note</li><li class="desc-sub-text " itemprop="description"><p>Tonga brings you dresses that you wouldn't want to take off. Team this chic piece with strappy stilettos for your next shindig.</p></li><li class="desc-sub-title ">Product Details</li><li class="desc-sub-text"><p>Black and white dress in a ribbed knit, round neck, sleeveless, stylised lace front and back yoke</p></li><li class="desc-sub-title ">Material &amp; Care</li><li class="desc-sub-text "><p>95% polyester, 5 % Spandex<br/>Hand wash cold</p></li><li class="desc-sub-title">Size &amp; Fit</li><li class="desc-sub-text"><p>The model (height 5'6", chest 34", waist 26") is wearing a size S which measures 81 cm from shoulder to hem</p></li></ul>,26:02:2014,None
None,Red cut out fit and flared dress,http://www.myntra.com/Dresses/Tonga/Red-cut-out-fit-and-flared-dress/193176/buy,Rs. 774,women-apparel-new-arrivals,Clothing,Tonga,http://myntra.myntassets.com/images/style/properties/Red-cut-out-fit-and-flared-dress_6c3478dcec853fef1494410fecd30f55_images_1080_1440_mini.jpg,Rs. 1,190,None,women,http://www.myntra.com/Dresses/Tonga/Red-cut-out-fit-and-flared-dress/193176/buy,Sold byVector Ecommerce Pvt Ltd,None,None,['XS', 'S', 'M', 'L', 'XL'],None,<ul class="mk-pdpv1-product-helper mk-cf"><li class="desc-main-title">Product Description</li><li class="desc-sub-title">Style Note</li><li class="desc-sub-text " itemprop="description"><p>It's clear from the runways that the cutout is having its sexy little moment this fall and of course, Tonga's never far behind! Get this original red cut out dress from Tonga and pair with pumps, stilletos or platforms for the complete look.</p></li><li class="desc-sub-title ">Product Details</li><li class="desc-sub-text"><p>Red cut out fit and flared dress, knit, high straight neck, sleeveless, cut outs in front and back with zip at back</p></li><li class="desc-sub-title ">Material &amp; Care</li><li class="desc-sub-text "><p>95% Polyester, 5% SpandexHand wash cold, do not bleach, Hand dry, Iron low</p></li><li class="desc-sub-title">Size &amp; Fit</li><li class="desc-sub-text"><p>The model (height 5'6", chest 34", waist 26") is wearing a size 6 which measures 86.5 cm from shoulder to hem</p></li></ul>,26:02:2014,None
None,Tonga Sleeveless skater dress,http://www.myntra.com/Dresses/Tonga/Tonga-Sleeveless-skater-dress/204537/buy,Rs. 938,women-apparel-new-arrivals,Clothing,Tonga,http://myntra.myntassets.com/images/style/properties/Sleeveless-skater-dress_d56a06f28679d0223e1e90ea8628f9a1_images_1080_1440_mini.jpg,Rs. 1,250,None,women,http://www.myntra.com/Dresses/Tonga/Tonga-Sleeveless-skater-dress/204537/buy,Sold byVector Ecommerce Pvt Ltd,None,None,['XS', 'S', 'M', 'L', 'XL'],None,<ul class="mk-pdpv1-product-helper mk-cf"><li class="desc-main-title">Product Description</li><li class="desc-sub-title">Style Note</li><li class="desc-sub-text " itemprop="description"><p>Versatile and comfortable, this pink and black skater dress from Tonga can be dressed up or dressed down for any occasion. Add some bling with sparkling earrings and a shimmery clutch, or go casual with flats and a flowery hair piece.</p></li><li class="desc-sub-title ">Product Details</li><li class="desc-sub-text"><p>Pink and black skater dress, woven, round neck, sleeveless, with back zip</p></li><li class="desc-sub-title ">Material &amp; Care</li><li class="desc-sub-text "><p>95% Polyester, 5 % spandexHand wash cold, do not bleach, Hand dry, Iron low</p></li><li class="desc-sub-title">Size &amp; Fit</li><li class="desc-sub-text"><p>The model (height 5'6", chest 34", waist 26") is wearing a size 6 which measures 81.5 cm from shoulder to hem</p></li></ul>,26:02:2014,None
None,Tonga Gold One-Shoulder Dress,http://www.myntra.com/Dresses/Tonga/Tonga-Gold-One-Shoulder-Dress/204547/buy,Rs. 875,women-apparel-new-arrivals,Clothing,Tonga,http://myntra.myntassets.com/images/style/properties/Tonga-Gold-One-Shoulder-Dress_6b9b2555a6f79b98b7572f102931a80b_images_1080_1440_mini.jpg,Rs. 1,250,None,women,http://www.myntra.com/Dresses/Tonga/Tonga-Gold-One-Shoulder-Dress/204547/buy,Sold byVector Ecommerce Pvt Ltd,None,None,['XS', 'S', 'M', 'L'],None,<ul class="mk-pdpv1-product-helper mk-cf"><li class="desc-main-title">Product Description</li><li class="desc-sub-title">Style Note</li><li class="desc-sub-text " itemprop="description"><p>Shimmer and shine in this gold one-shoulder dress from Tonga. Figure hugging and light in texture and feel, get ready to rock the dance floor in this number.</p></li><li class="desc-sub-title ">Product Details</li><li class="desc-sub-text"><p>Gold one shoulder bodycon dress, knit, one shoulder neck, sleeveless, straight hem</p></li><li class="desc-sub-title ">Material &amp; Care</li><li class="desc-sub-text "><p>95% polyester<br/>5 % Spandex<br/>Hand wash cold</p></li><li class="desc-sub-title">Size &amp; Fit</li><li class="desc-sub-text"><p>The model (height 5'8", chest 33", waist 26") is wearing a size 6 which measures 83.5 cm from shoulder to hem</p></li></ul>,26:02:2014,None
None,Tonga 2-fer sheer mini dress,http://www.myntra.com/Dresses/Tonga/Tonga-2-fer-sheer-mini-dress/204540/buy,Rs. 910,women-apparel-new-arrivals,Clothing,Tonga,http://myntra.myntassets.com/images/style/properties/2-fer-sheer-mini-dress_d0e29df097f459cedcff38ccf91efb0d_images_1080_1440_mini.jpg,Rs. 1,300,None,women,http://www.myntra.com/Dresses/Tonga/Tonga-2-fer-sheer-mini-dress/204540/buy,Sold byVector Ecommerce Pvt Ltd,None,None,['XS', 'S', 'M', 'L', 'XL'],None,<ul class="mk-pdpv1-product-helper mk-cf"><li class="desc-main-title">Product Description</li><li class="desc-sub-title">Style Note</li><li class="desc-sub-text " itemprop="description"><p>This 2-fer dress from Tonga features a flowy sheer top that adds comfort, while the contrast black and white mini skirt adds some figure hugging flair. Pair up with gladiator sandals or Mary Jane heels for the complete look.</p></li><li class="desc-sub-title ">Product Details</li><li class="desc-sub-text"><p>2-fer sheer dress with contrast black and white skirt, knit and woven, scoop neck, sleeveless, black lining under sheer top</p></li><li class="desc-sub-title ">Material &amp; Care</li><li class="desc-sub-text "><p>90% Polyester, 10 % spandexHand wash cold, do not bleach, Hand dry, Iron low</p></li><li class="desc-sub-title">Size &amp; Fit</li><li class="desc-sub-text"><p>The model (height 5'6", chest 34", waist 26") is wearing a size 6 which measures 71 cm from shoulder to hem</p></li></ul>,26:02:2014,None
None,Tonga Blue brocade skater dress,http://www.myntra.com/Dresses/Tonga/Tonga-Blue-brocade-skater-dress/204545/buy,Rs. 954,women-apparel-new-arrivals,Clothing,Tonga,http://myntra.myntassets.com/images/style/properties/Blue-brocade-skater-dress_f70e42a3780264b9d9f03cebd5752c58_images_1080_1440_mini.jpg,Rs. 1,590,None,women,http://www.myntra.com/Dresses/Tonga/Tonga-Blue-brocade-skater-dress/204545/buy,Sold byVector Ecommerce Pvt Ltd,None,None,['XS', 'S', 'M', 'L'],None,<ul class="mk-pdpv1-product-helper mk-cf"><li class="desc-main-title">Product Description</li><li class="desc-sub-title">Style Note</li><li class="desc-sub-text " itemprop="description"><p>Ride the bridal wave with this electric blue brocade skater dress from Tonga. This winter, Tonga takes inspiration from the rich fabrics and opulent splendour of Indian bridal tradition, with brocade infused cocktail dresses. Pair with heels and ethnic accessories for the complete look.</p></li><li class="desc-sub-title ">Product Details</li><li class="desc-sub-text"><p>Black skater dress with contrast blue brocade skirt, woven, square neck, sleeveless, with back zip</p></li><li class="desc-sub-title ">Material &amp; Care</li><li class="desc-sub-text "><p>95% Polyester, 5 % spandexHand wash cold, do not bleach, Hand dry, Iron low</p></li><li class="desc-sub-title">Size &amp; Fit</li><li class="desc-sub-text"><p>The model (height 5'6", chest 34", waist 26") is wearing a size 6 which measures 81.5 cm from shoulder to hem</p></li></ul>,26:02:2014,None
None,Tonga Peach skater dress with animal print collar,http://www.myntra.com/Dresses/Tonga/Tonga-Peach-skater-dress-with-animal-print-collar/204539/buy,Rs. 945,women-apparel-new-arrivals,Clothing,Tonga,http://myntra.myntassets.com/images/style/properties/Peach-skater-dress-with-animal-print-collar_92324e7c6b84c0d0d723f8efc907f1d6_images_1080_1440_mini.jpg,Rs. 1,350,None,women,http://www.myntra.com/Dresses/Tonga/Tonga-Peach-skater-dress-with-animal-print-collar/204539/buy,Sold byVector Ecommerce Pvt Ltd,None,None,['XS', 'S', 'M', 'L', 'XL'],None,<ul class="mk-pdpv1-product-helper mk-cf"><li class="desc-main-title">Product Description</li><li class="desc-sub-title">Style Note</li><li class="desc-sub-text " itemprop="description"><p>Reminiscent of the babydoll dresses and frocks of the 1990s, skater dresses are back with a bang this fall. The skater cut is perfect for most body types and this Tonga original has a sexy little twist with its animal print contrast collar - feminine and vixen all in one.</p></li><li class="desc-sub-title ">Product Details</li><li class="desc-sub-text"><p>Peach skater dress, woven, contrast animal print Peter Pan collar, half sleeved, zip on back</p></li><li class="desc-sub-title ">Material &amp; Care</li><li class="desc-sub-text "><p>95% Polyester, 5 % spandexHand wash cold, do not bleach, Hand dry, Iron low</p></li><li class="desc-sub-title">Size &amp; Fit</li><li class="desc-sub-text"><p>The model (height 5'6", chest 34", waist 26") is wearing a size 6 which measures 77.5 cm from shoulder to hem</p></li></ul>,26:02:2014,None
None,Tonga Purple Tube Dress,http://www.myntra.com/Dresses/Tonga/Tonga-Purple-Tube-Dress/215791/buy,Rs. 944,women-apparel-new-arrivals,Clothing,Tonga,http://myntra.myntassets.com/images/style/properties/Tonga-Women-Dresses_cc9a00f01a2fb26f4ed0622c85bd4fdf_images_1080_1440_mini.jpg,Rs. 1,349,None,women,http://www.myntra.com/Dresses/Tonga/Tonga-Purple-Tube-Dress/215791/buy,Sold byVector Ecommerce Pvt Ltd,None,None,['XS', 'S', 'M', 'L', 'XL'],None,<ul class="mk-pdpv1-product-helper mk-cf"><li class="desc-main-title">Product Description</li><li class="desc-sub-title">Style Note</li><li class="desc-sub-text " itemprop="description"><p>Tonga brings you dresses that you wouldn't want to take off. Team this chic piece with strappy stilettos for your next shindig.</p></li><li class="desc-sub-title ">Product Details</li><li class="desc-sub-text"><p>Purple tube dress, woven, embossed all-over, off-shoulder, sweetheart styling at front and elasticated at back, concealed zipped closure at back, flared panels below waistline</p></li><li class="desc-sub-title ">Material &amp; Care</li><li class="desc-sub-text "><p>100% polyester<br/>Hand wash cold</p></li><li class="desc-sub-title">Size &amp; Fit</li><li class="desc-sub-text"><p>The model (height 5'6", chest 34", waist 26") is wearing a size S which measures 66 cm from shoulder to hem</p></li></ul>,26:02:2014,None
None,Tonga Women Black Polka Dot Top,http://www.myntra.com/Tops/Tonga/Tonga-Women-Black-Polka-Dot-Top/193183/buy,Rs. 644,women-apparel-new-arrivals,Clothing,Tonga,http://myntra.myntassets.com/images/style/properties/Tonga-Women-Black-Polka-Dot-Top_37cfb0b561cf5d0fcaa0c62f285ba250_images_1080_1440_mini.jpg,Rs. 990,None,women,http://www.myntra.com/Tops/Tonga/Tonga-Women-Black-Polka-Dot-Top/193183/buy,Sold byVector Ecommerce Pvt Ltd,None,None,['XS', 'S', 'M', 'L', 'XL'],None,<ul class="mk-pdpv1-product-helper mk-cf"><li class="desc-main-title">Product Description</li><li class="desc-sub-title">Style Note</li><li class="desc-sub-text " itemprop="description"><p>Get your polka on with this smart casual top from Tonga. Pair with jeans, capris or a mini skirt and pumps for a brunch with the girls.</p></li><li class="desc-sub-title ">Product Details</li><li class="desc-sub-text"><p>Black top, knit, round neck, short net panel slevees with binding at the hem, polka dot net yoke neckline, straight hem</p></li><li class="desc-sub-title ">Material &amp; Care</li><li class="desc-sub-text "><p>95% polyester<br/> 5% Spandex<br/>Hand wash cold</p></li><li class="desc-sub-title">Size &amp; Fit</li><li class="desc-sub-text"><p>The model (height 5'8", chest 32"and waist 26") is wearing a size 6</p></li></ul>,26:02:2014,None
None,Tonga Red Brocade Dress,http://www.myntra.com/Dresses/Tonga/Tonga-Red-Brocade-Dress/204546/buy,Rs. 954,women-apparel-new-arrivals,Clothing,Tonga,http://myntra.myntassets.com/images/style/properties/Tonga-Red-Brocade-Dress_b0b11e92455bc6493a82dc67d6e2c01d_images_1080_1440_mini.jpg,Rs. 1,590,None,women,http://www.myntra.com/Dresses/Tonga/Tonga-Red-Brocade-Dress/204546/buy,Sold byVector Ecommerce Pvt Ltd,None,None,single size,None,<ul class="mk-pdpv1-product-helper mk-cf"><li class="desc-main-title">Product Description</li><li class="desc-sub-title">Style Note</li><li class="desc-sub-text " itemprop="description"><p>Ride the style wave with this red brocade skater dress from Tonga. This winter, Tonga takes inspiration from the rich fabrics and opulent splendour of Indian bridal tradition, with brocade infused cocktail dresses. Pair with heels and ethnic accessories for the complete look.</p></li><li class="desc-sub-title ">Product Details</li><li class="desc-sub-text"><p>Black skater dress with contrast red brocade skirt, woven, square neck, sleeveless, with back zip</p></li><li class="desc-sub-title ">Material &amp; Care</li><li class="desc-sub-text "><p>95% polyester<br/>5 % Spandex<br/>Hand wash cold</p></li><li class="desc-sub-title">Size &amp; Fit</li><li class="desc-sub-text"><p>The model (height 5'8", chest 33", waist 26") is wearing a size 6 which measures 81.5 cm from shoulder to hem</p></li></ul>,26:02:2014,None
None,Tonga Black Velvet Sequinned Shift Dress,http://www.myntra.com/Dresses/Tonga/Tonga-Black-Velvet-Sequinned-Shift-Dress/215785/buy,Rs. 909,women-apparel-new-arrivals,Clothing,Tonga,http://myntra.myntassets.com/images/style/properties/Tonga-Women-Dresses_11de23c5f986693b9d54d0f367812257_images_1080_1440_mini.jpg,Rs. 1,299,None,women,http://www.myntra.com/Dresses/Tonga/Tonga-Black-Velvet-Sequinned-Shift-Dress/215785/buy,Sold byVector Ecommerce Pvt Ltd,None,None,['S', 'M', 'L', 'XL'],None,<ul class="mk-pdpv1-product-helper mk-cf"><li class="desc-main-title">Product Description</li><li class="desc-sub-title">Style Note</li><li class="desc-sub-text " itemprop="description"><p>Tonga brings you dresses that will give a unique statement look this season. Team this chic piece with strappy stilettos for your next party.</p></li><li class="desc-sub-title ">Product Details</li><li class="desc-sub-text"><p>Black dress, sequinned, velvet panels throughout, has a round neck at front, long sleeves, scoop neck at back, curved hem, back hem longer than front</p></li><li class="desc-sub-title ">Material &amp; Care</li><li class="desc-sub-text "><p>95% polyester, 5% Spandex<br/>Hand wash cold</p></li><li class="desc-sub-title">Size &amp; Fit</li><li class="desc-sub-text"><p>The model (height 5'6", chest 34", waist 26") is wearing a size S which measures 89 cm from shoulder to hem</p></li></ul>,26:02:2014,None
None,Tonga White Polka Dot Skater Dress with Open Back,http://www.myntra.com/Dresses/Tonga/Tonga-White-Polka-Dot-Skater-Dress-with-Open-Back/204543/buy,Rs. 954,women-apparel-new-arrivals,Clothing,Tonga,http://myntra.myntassets.com/images/style/properties/Tonga-White-Polka-Dot-Skater-Dress-with-Open-Back_90e93973bcd560df7b52116e7ce3268b_images_1080_1440_mini.jpg,Rs. 1,590,None,women,http://www.myntra.com/Dresses/Tonga/Tonga-White-Polka-Dot-Skater-Dress-with-Open-Back/204543/buy,Sold byVector Ecommerce Pvt Ltd,None,None,['XS', 'S', 'M', 'L'],None,<ul class="mk-pdpv1-product-helper mk-cf"><li class="desc-main-title">Product Description</li><li class="desc-sub-title">Style Note</li><li class="desc-sub-text " itemprop="description"><p>Discover your inner diva in this Tonga tribute to the 1970's. A demure skater dress with a daring open mesh back, this number is guaranteed to turn heads wherever you go. Pair with simple black Mary Jane heels and a black clutch.</p></li><li class="desc-sub-title ">Product Details</li><li class="desc-sub-text"><p>Polka dot mesh dress, woven, round neck, full sleeves, with open back and back zip on skirt</p></li><li class="desc-sub-title ">Material &amp; Care</li><li class="desc-sub-text "><p>95% Polyester, 5 % Spandex<br/>Hand wash cold, do not bleach, Hand dry, Iron low</p></li><li class="desc-sub-title">Size &amp; Fit</li><li class="desc-sub-text"><p>The model (height 5'6", chest 34", waist 26") is wearing a size 6 which measures 83.5 cm from shoulder to hem</p></li></ul>,26:02:2014,None
None,Tonga Black & White Printed Bodycon Dress,http://www.myntra.com/Dresses/Tonga/Tonga-Black-&-White-Printed-Bodycon-Dress/215782/buy,Rs. 844,women-apparel-new-arrivals,Clothing,Tonga,http://myntra.myntassets.com/images/style/properties/Tonga-Women-Dresses_8c3c132fc939e5793a456f3e86d9c9b7_images_1080_1440_mini.jpg,Rs. 1,299,None,women,http://www.myntra.com/Dresses/Tonga/Tonga-Black-&-White-Printed-Bodycon-Dress/215782/buy,Sold byVector Ecommerce Pvt Ltd,None,None,['XS', 'S', 'M', 'L', 'XL'],None,<ul class="mk-pdpv1-product-helper mk-cf"><li class="desc-main-title">Product Description</li><li class="desc-sub-title">Style Note</li><li class="desc-sub-text " itemprop="description"><p>Tonga brings you dresses that you wouldn't want to take off. Team this chic piece with strappy stilettos for your next shindig.</p></li><li class="desc-sub-title ">Product Details</li><li class="desc-sub-text"><p>Black and white dress, knitted, round neck, sleeveless with cut-out detail at shoulders, printed panel at front</p></li><li class="desc-sub-title ">Material &amp; Care</li><li class="desc-sub-text "><p>90% polyester, 10% Spandex<br/>Hand wash cold</p></li><li class="desc-sub-title">Size &amp; Fit</li><li class="desc-sub-text"><p>The model (height 5'6", chest 34", waist 26") is wearing a size S which measures 81 cm from shoulder to hem</p></li></ul>,26:02:2014,None
None,Tonga Women White Lace Halter Top,http://www.myntra.com/Tops/Tonga/Tonga-Women-White-Lace-Halter-Top/193186/buy,Rs. 644,women-apparel-new-arrivals,Clothing,Tonga,http://myntra.myntassets.com/images/style/properties/Tonga-Women-White-Lace-Halter-Top_e6a40e479bc7a7f4f48c08def095f22a_images_1080_1440_mini.jpg,Rs. 990,None,women,http://www.myntra.com/Tops/Tonga/Tonga-Women-White-Lace-Halter-Top/193186/buy,Sold byVector Ecommerce Pvt Ltd,None,None,['XS', 'S', 'M', 'L', 'XL'],None,<ul class="mk-pdpv1-product-helper mk-cf"><li class="desc-main-title">Product Description</li><li class="desc-sub-title">Style Note</li><li class="desc-sub-text " itemprop="description"><p>This hot white lace halter top is the best friend your shoulders will ever have. Pair with jeans or a skirt, white heels or flats with your hair up and look gorgeous in this Tonga original.</p></li><li class="desc-sub-title ">Product Details</li><li class="desc-sub-text"><p>White lace halter top, knit, halter neck, sleeveless with lining</p></li><li class="desc-sub-title ">Material &amp; Care</li><li class="desc-sub-text "><p>90% polyester<br/> 10% Spandex<br/>Hand wash cold</p></li><li class="desc-sub-title">Size &amp; Fit</li><li class="desc-sub-text"><p>The model (height 5'8", chest 32"and waist 26") is wearing a size 7</p></li></ul>,26:02:2014,None
