None,Tonga Black & White Bodycon Dress,http://www.myntra.com/Dresses/Tonga/Tonga-Black-&-White-Bodycon-Dress/215786/buy,Rs. 774,women-apparel-new-arrivals,Clothing,Tonga,http://myntra.myntassets.com/images/style/properties/Tonga-Women-Dresses_784252aba414f57fb92f7dbb71a55fdb_images_1080_1440_mini.jpg,Rs. 1,190,None,women,http://www.myntra.com/Dresses/Tonga/Tonga-Black-&-White-Bodycon-Dress/215786/buy,Sold byVector Ecommerce Pvt Ltd,None,None,['XS', 'S', 'M', 'L', 'XL'],None,<ul class="mk-pdpv1-product-helper mk-cf"><li class="desc-main-title">Product Description</li><li class="desc-sub-title">Style Note</li><li class="desc-sub-text " itemprop="description"><p>Tonga brings you dresses that you wouldn't want to take off. Team this chic piece with strappy stilettos for your next shindig.</p></li><li class="desc-sub-title ">Product Details</li><li class="desc-sub-text"><p>Black and white dress in a ribbed knit, round neck, sleeveless, stylised lace front and back yoke</p></li><li class="desc-sub-title ">Material &amp; Care</li><li class="desc-sub-text "><p>95% polyester, 5 % Spandex<br/>Hand wash cold</p></li><li class="desc-sub-title">Size &amp; Fit</li><li class="desc-sub-text"><p>The model (height 5'6", chest 34", waist 26") is wearing a size S which measures 81 cm from shoulder to hem</p></li></ul>,26:02:2014,None
None,Tonga Black & Brown Animal Print Bodycon Dress,http://www.myntra.com/Dresses/Tonga/Tonga-Black-&-Brown-Animal-Print-Bodycon-Dress/215780/buy,Rs. 874,women-apparel-new-arrivals,Clothing,Tonga,http://myntra.myntassets.com/images/style/properties/Tonga-Women-Dresses_dddf92f111e5159a9ff25604c97c9fd9_images_1080_1440_mini.jpg,Rs. 1,249,None,women,http://www.myntra.com/Dresses/Tonga/Tonga-Black-&-Brown-Animal-Print-Bodycon-Dress/215780/buy,Sold byVector Ecommerce Pvt Ltd,None,None,['XS', 'S', 'M', 'L', 'XL'],None,<ul class="mk-pdpv1-product-helper mk-cf"><li class="desc-main-title">Product Description</li><li class="desc-sub-title">Style Note</li><li class="desc-sub-text " itemprop="description"><p>Tonga brings you dresses that you wouldn't want to take off. Team this chic piece with strappy stilettos for your next shindig.</p></li><li class="desc-sub-title ">Product Details</li><li class="desc-sub-text"><p>Black, brown and off-white animal print dress, knitted, cowl neck, sleeveless, solid below waistline with an attached lining</p></li><li class="desc-sub-title ">Material &amp; Care</li><li class="desc-sub-text "><p>95% polyester, 5% Spandex<br/>Hand wash cold</p></li><li class="desc-sub-title">Size &amp; Fit</li><li class="desc-sub-text"><p>The model (height 5'6", chest 34", waist 26") is wearing a size S which measures 80 cm from shoulder to hem</p></li></ul>,26:02:2014,None
None,Tonga Women Black Top With Scarf,http://www.myntra.com/Tops/Tonga/Tonga-Women-Black-Top-With-Scarf/193187/buy,Rs. 714,women-apparel-new-arrivals,Clothing,Tonga,http://myntra.myntassets.com/images/style/properties/Tonga-Women-Black-Top-With-Scarf_faba748499a249961407770b8734eff9_images_1080_1440_mini.jpg,Rs. 1,190,None,women,http://www.myntra.com/Tops/Tonga/Tonga-Women-Black-Top-With-Scarf/193187/buy,Sold byVector Ecommerce Pvt Ltd,None,None,['XS', 'S', 'M', 'L', 'XL'],None,<ul class="mk-pdpv1-product-helper mk-cf"><li class="desc-main-title">Product Description</li><li class="desc-sub-title">Style Note</li><li class="desc-sub-text " itemprop="description"><p>Tonga knows how to add some flair to a regular black top - this piece is an excellent case in point. With a pink and black polka dotted scarf attached to the neckline, this top is a throwback to the retro days. Match it with jeans, capris or a skirt and you're all set.</p></li><li class="desc-sub-title ">Product Details</li><li class="desc-sub-text"><p>Black top with pink and black polka scarf, knit with woven scarf, round neck, sleeveless, straight hem</p></li><li class="desc-sub-title ">Material &amp; Care</li><li class="desc-sub-text "><p>95% polyester<br/> 5% Spandex<br/>Hand wash cold</p></li><li class="desc-sub-title">Size &amp; Fit</li><li class="desc-sub-text"><p>The model (height 5'8", chest 32"and waist 26") is wearing a size 8</p></li></ul>,26:02:2014,None
None,Tonga Blue brocade skater dress,http://www.myntra.com/Dresses/Tonga/Tonga-Blue-brocade-skater-dress/204545/buy,Rs. 954,women-apparel-new-arrivals,Clothing,Tonga,http://myntra.myntassets.com/images/style/properties/Blue-brocade-skater-dress_f70e42a3780264b9d9f03cebd5752c58_images_1080_1440_mini.jpg,Rs. 1,590,None,women,http://www.myntra.com/Dresses/Tonga/Tonga-Blue-brocade-skater-dress/204545/buy,Sold byVector Ecommerce Pvt Ltd,None,None,['XS', 'S', 'M', 'L'],None,<ul class="mk-pdpv1-product-helper mk-cf"><li class="desc-main-title">Product Description</li><li class="desc-sub-title">Style Note</li><li class="desc-sub-text " itemprop="description"><p>Ride the bridal wave with this electric blue brocade skater dress from Tonga. This winter, Tonga takes inspiration from the rich fabrics and opulent splendour of Indian bridal tradition, with brocade infused cocktail dresses. Pair with heels and ethnic accessories for the complete look.</p></li><li class="desc-sub-title ">Product Details</li><li class="desc-sub-text"><p>Black skater dress with contrast blue brocade skirt, woven, square neck, sleeveless, with back zip</p></li><li class="desc-sub-title ">Material &amp; Care</li><li class="desc-sub-text "><p>95% Polyester, 5 % spandexHand wash cold, do not bleach, Hand dry, Iron low</p></li><li class="desc-sub-title">Size &amp; Fit</li><li class="desc-sub-text"><p>The model (height 5'6", chest 34", waist 26") is wearing a size 6 which measures 81.5 cm from shoulder to hem</p></li></ul>,26:02:2014,None
None,Tonga Women White Lace Halter Top,http://www.myntra.com/Tops/Tonga/Tonga-Women-White-Lace-Halter-Top/193186/buy,Rs. 644,women-apparel-new-arrivals,Clothing,Tonga,http://myntra.myntassets.com/images/style/properties/Tonga-Women-White-Lace-Halter-Top_e6a40e479bc7a7f4f48c08def095f22a_images_1080_1440_mini.jpg,Rs. 990,None,women,http://www.myntra.com/Tops/Tonga/Tonga-Women-White-Lace-Halter-Top/193186/buy,Sold byVector Ecommerce Pvt Ltd,None,None,['XS', 'S', 'M', 'L', 'XL'],None,<ul class="mk-pdpv1-product-helper mk-cf"><li class="desc-main-title">Product Description</li><li class="desc-sub-title">Style Note</li><li class="desc-sub-text " itemprop="description"><p>This hot white lace halter top is the best friend your shoulders will ever have. Pair with jeans or a skirt, white heels or flats with your hair up and look gorgeous in this Tonga original.</p></li><li class="desc-sub-title ">Product Details</li><li class="desc-sub-text"><p>White lace halter top, knit, halter neck, sleeveless with lining</p></li><li class="desc-sub-title ">Material &amp; Care</li><li class="desc-sub-text "><p>90% polyester<br/> 10% Spandex<br/>Hand wash cold</p></li><li class="desc-sub-title">Size &amp; Fit</li><li class="desc-sub-text"><p>The model (height 5'8", chest 32"and waist 26") is wearing a size 7</p></li></ul>,26:02:2014,None
None,Tonga Purple skater dress,http://www.myntra.com/Dresses/Tonga/Tonga-Purple-skater-dress/204538/buy,Rs. 1,163,women-apparel-new-arrivals,Clothing,Tonga,http://myntra.myntassets.com/images/style/properties/Purple-skater-dress_d271af7703a8e1cd70980a1f6c794ccc_images_1080_1440.jpg,Rs. 1,550,None,women,http://www.myntra.com/Dresses/Tonga/Tonga-Purple-skater-dress/204538/buy,Sold byVector Ecommerce Pvt Ltd,None,None,['XS', 'S', 'M', 'L', 'XL'],None,<ul class="mk-pdpv1-product-helper mk-cf"><li class="desc-main-title">Product Description</li><li class="desc-sub-title">Style Note</li><li class="desc-sub-text " itemprop="description"><p>Simple and sophisticated, this Tonga original is inspired by the opulent purples that are synonymous with royalty, balanced perfectly with the classic princess feel of its elegant skater cut.</p></li><li class="desc-sub-title ">Product Details</li><li class="desc-sub-text"><p>Purple skater dress, woven, square neck, sleeveless, back zip,belt loops on the side with black belt</p></li><li class="desc-sub-title ">Material &amp; Care</li><li class="desc-sub-text "><p>95% Polyester, 5 % spandexHand wash cold, do not bleach, Hand dry, Iron low</p></li><li class="desc-sub-title">Size &amp; Fit</li><li class="desc-sub-text"><p>The model (height 5'6", chest 34", waist 26") is wearing a size 6 which measures 82.5 cm from shoulder to hem</p></li></ul>,26:02:2014,None
None,Tonga Gold One-Shoulder Dress,http://www.myntra.com/Dresses/Tonga/Tonga-Gold-One-Shoulder-Dress/204547/buy,Rs. 875,women-apparel-new-arrivals,Clothing,Tonga,http://myntra.myntassets.com/images/style/properties/Tonga-Gold-One-Shoulder-Dress_6b9b2555a6f79b98b7572f102931a80b_images_1080_1440_mini.jpg,Rs. 1,250,None,women,http://www.myntra.com/Dresses/Tonga/Tonga-Gold-One-Shoulder-Dress/204547/buy,Sold byVector Ecommerce Pvt Ltd,None,None,['XS', 'S', 'M', 'L'],None,<ul class="mk-pdpv1-product-helper mk-cf"><li class="desc-main-title">Product Description</li><li class="desc-sub-title">Style Note</li><li class="desc-sub-text " itemprop="description"><p>Shimmer and shine in this gold one-shoulder dress from Tonga. Figure hugging and light in texture and feel, get ready to rock the dance floor in this number.</p></li><li class="desc-sub-title ">Product Details</li><li class="desc-sub-text"><p>Gold one shoulder bodycon dress, knit, one shoulder neck, sleeveless, straight hem</p></li><li class="desc-sub-title ">Material &amp; Care</li><li class="desc-sub-text "><p>95% polyester<br/>5 % Spandex<br/>Hand wash cold</p></li><li class="desc-sub-title">Size &amp; Fit</li><li class="desc-sub-text"><p>The model (height 5'8", chest 33", waist 26") is wearing a size 6 which measures 83.5 cm from shoulder to hem</p></li></ul>,26:02:2014,None
None,Tonga Sea Green Peplum Dress,http://www.myntra.com/Dresses/Tonga/Tonga-Sea-Green-Peplum-Dress/183281/buy,Rs. 763,women-apparel-new-arrivals,Clothing,Tonga,http://myntra.myntassets.com/images/style/properties/Tonga-Women-Dresses_da8c9ad49813141670e7b5027f9ba29b_images_1080_1440_mini.jpg,Rs. 1,090,None,women,http://www.myntra.com/Dresses/Tonga/Tonga-Sea-Green-Peplum-Dress/183281/buy,Sold byVector Ecommerce Pvt Ltd,None,None,['XS', 'S', 'M', 'L', 'XL'],None,<ul class="mk-pdpv1-product-helper mk-cf"><li class="desc-main-title">Product Description</li><li class="desc-sub-title">Style Note</li><li class="desc-sub-text " itemprop="description"><p>Look ladylike and elegant in a piece from Tonga's range of dresses. This one will look fabulous when styled with peep-toe pumps for a weekend outing.</p></li><li class="desc-sub-title ">Product Details</li><li class="desc-sub-text"><p>Sea green peplum shift dress, woven, round neck, sleeveless, peplum panels at the waist, concealed zip closure at the back, panelled below the waist at back</p></li><li class="desc-sub-title ">Material &amp; Care</li><li class="desc-sub-text "><p>100% polyester<br/>Hand wash cold</p></li><li class="desc-sub-title">Size &amp; Fit</li><li class="desc-sub-text"><p>The model (height 5'8", chest 33" and waist 28") is wearing a size 6 which measures 85 cm from shoulder to hem</p></li></ul>,26:02:2014,None
None,Tonga Peach skater dress with animal print collar,http://www.myntra.com/Dresses/Tonga/Tonga-Peach-skater-dress-with-animal-print-collar/204539/buy,Rs. 945,women-apparel-new-arrivals,Clothing,Tonga,http://myntra.myntassets.com/images/style/properties/Peach-skater-dress-with-animal-print-collar_92324e7c6b84c0d0d723f8efc907f1d6_images_1080_1440_mini.jpg,Rs. 1,350,None,women,http://www.myntra.com/Dresses/Tonga/Tonga-Peach-skater-dress-with-animal-print-collar/204539/buy,Sold byVector Ecommerce Pvt Ltd,None,None,['XS', 'S', 'M', 'L', 'XL'],None,<ul class="mk-pdpv1-product-helper mk-cf"><li class="desc-main-title">Product Description</li><li class="desc-sub-title">Style Note</li><li class="desc-sub-text " itemprop="description"><p>Reminiscent of the babydoll dresses and frocks of the 1990s, skater dresses are back with a bang this fall. The skater cut is perfect for most body types and this Tonga original has a sexy little twist with its animal print contrast collar - feminine and vixen all in one.</p></li><li class="desc-sub-title ">Product Details</li><li class="desc-sub-text"><p>Peach skater dress, woven, contrast animal print Peter Pan collar, half sleeved, zip on back</p></li><li class="desc-sub-title ">Material &amp; Care</li><li class="desc-sub-text "><p>95% Polyester, 5 % spandexHand wash cold, do not bleach, Hand dry, Iron low</p></li><li class="desc-sub-title">Size &amp; Fit</li><li class="desc-sub-text"><p>The model (height 5'6", chest 34", waist 26") is wearing a size 6 which measures 77.5 cm from shoulder to hem</p></li></ul>,26:02:2014,None
None,Tonga Black Polka Dot Skater Dress with Open Back,http://www.myntra.com/Dresses/Tonga/Tonga-Black-Polka-Dot-Skater-Dress-with-Open-Back/204542/buy,Rs. 954,women-apparel-new-arrivals,Clothing,Tonga,http://myntra.myntassets.com/images/style/properties/Tonga-Black-Polka-Dot-Skater-Dress-with-Open-Back_ccc5fc98d2371a5e8a2574df3beaf18e_images_1080_1440_mini.jpg,Rs. 1,590,None,women,http://www.myntra.com/Dresses/Tonga/Tonga-Black-Polka-Dot-Skater-Dress-with-Open-Back/204542/buy,Sold byVector Ecommerce Pvt Ltd,None,None,['XS', 'S', 'M', 'L'],None,<ul class="mk-pdpv1-product-helper mk-cf"><li class="desc-main-title">Product Description</li><li class="desc-sub-title">Style Note</li><li class="desc-sub-text " itemprop="description"><p>Discover your inner diva in this Tonga tribute to the 1970's. A demure skater dress with a daring open mesh back, this number is guaranteed to turn heads wherever you go. Pair with simple black Mary Jane heels and a black clutch.</p></li><li class="desc-sub-title ">Product Details</li><li class="desc-sub-text"><p>Polka dot mesh dress, woven, round neck, full sleeves, with open back and back zip on skirt</p></li><li class="desc-sub-title ">Material &amp; Care</li><li class="desc-sub-text "><p>95% Polyester, 5 % Spandex<br/>Hand wash cold, do not bleach, Hand dry, Iron low</p></li><li class="desc-sub-title">Size &amp; Fit</li><li class="desc-sub-text"><p>The model (height 5'6", chest 34", waist 26") is wearing a size 6 which measures 83.5 cm from shoulder to hem</p></li></ul>,26:02:2014,None
None,Tonga Red Brocade Dress,http://www.myntra.com/Dresses/Tonga/Tonga-Red-Brocade-Dress/204546/buy,Rs. 954,women-apparel-new-arrivals,Clothing,Tonga,http://myntra.myntassets.com/images/style/properties/Tonga-Red-Brocade-Dress_b0b11e92455bc6493a82dc67d6e2c01d_images_1080_1440_mini.jpg,Rs. 1,590,None,women,http://www.myntra.com/Dresses/Tonga/Tonga-Red-Brocade-Dress/204546/buy,Sold byVector Ecommerce Pvt Ltd,None,None,['XS', 'S', 'M', 'L'],None,<ul class="mk-pdpv1-product-helper mk-cf"><li class="desc-main-title">Product Description</li><li class="desc-sub-title">Style Note</li><li class="desc-sub-text " itemprop="description"><p>Ride the style wave with this red brocade skater dress from Tonga. This winter, Tonga takes inspiration from the rich fabrics and opulent splendour of Indian bridal tradition, with brocade infused cocktail dresses. Pair with heels and ethnic accessories for the complete look.</p></li><li class="desc-sub-title ">Product Details</li><li class="desc-sub-text"><p>Black skater dress with contrast red brocade skirt, woven, square neck, sleeveless, with back zip</p></li><li class="desc-sub-title ">Material &amp; Care</li><li class="desc-sub-text "><p>95% polyester<br/>5 % Spandex<br/>Hand wash cold</p></li><li class="desc-sub-title">Size &amp; Fit</li><li class="desc-sub-text"><p>The model (height 5'8", chest 33", waist 26") is wearing a size 6 which measures 81.5 cm from shoulder to hem</p></li></ul>,26:02:2014,None
None,Tonga Black Velvet Sequinned Shift Dress,http://www.myntra.com/Dresses/Tonga/Tonga-Black-Velvet-Sequinned-Shift-Dress/215785/buy,Rs. 909,women-apparel-new-arrivals,Clothing,Tonga,http://myntra.myntassets.com/images/style/properties/Tonga-Women-Dresses_11de23c5f986693b9d54d0f367812257_images_1080_1440_mini.jpg,Rs. 1,299,None,women,http://www.myntra.com/Dresses/Tonga/Tonga-Black-Velvet-Sequinned-Shift-Dress/215785/buy,Sold byVector Ecommerce Pvt Ltd,None,None,['S', 'M', 'L', 'XL'],None,<ul class="mk-pdpv1-product-helper mk-cf"><li class="desc-main-title">Product Description</li><li class="desc-sub-title">Style Note</li><li class="desc-sub-text " itemprop="description"><p>Tonga brings you dresses that will give a unique statement look this season. Team this chic piece with strappy stilettos for your next party.</p></li><li class="desc-sub-title ">Product Details</li><li class="desc-sub-text"><p>Black dress, sequinned, velvet panels throughout, has a round neck at front, long sleeves, scoop neck at back, curved hem, back hem longer than front</p></li><li class="desc-sub-title ">Material &amp; Care</li><li class="desc-sub-text "><p>95% polyester, 5% Spandex<br/>Hand wash cold</p></li><li class="desc-sub-title">Size &amp; Fit</li><li class="desc-sub-text"><p>The model (height 5'6", chest 34", waist 26") is wearing a size S which measures 89 cm from shoulder to hem</p></li></ul>,26:02:2014,None
None,Tonga White Polka Dot Skater Dress with Open Back,http://www.myntra.com/Dresses/Tonga/Tonga-White-Polka-Dot-Skater-Dress-with-Open-Back/204543/buy,Rs. 954,women-apparel-new-arrivals,Clothing,Tonga,http://myntra.myntassets.com/images/style/properties/Tonga-White-Polka-Dot-Skater-Dress-with-Open-Back_90e93973bcd560df7b52116e7ce3268b_images_1080_1440_mini.jpg,Rs. 1,590,None,women,http://www.myntra.com/Dresses/Tonga/Tonga-White-Polka-Dot-Skater-Dress-with-Open-Back/204543/buy,Sold byVector Ecommerce Pvt Ltd,None,None,['XS', 'S', 'M', 'L'],None,<ul class="mk-pdpv1-product-helper mk-cf"><li class="desc-main-title">Product Description</li><li class="desc-sub-title">Style Note</li><li class="desc-sub-text " itemprop="description"><p>Discover your inner diva in this Tonga tribute to the 1970's. A demure skater dress with a daring open mesh back, this number is guaranteed to turn heads wherever you go. Pair with simple black Mary Jane heels and a black clutch.</p></li><li class="desc-sub-title ">Product Details</li><li class="desc-sub-text"><p>Polka dot mesh dress, woven, round neck, full sleeves, with open back and back zip on skirt</p></li><li class="desc-sub-title ">Material &amp; Care</li><li class="desc-sub-text "><p>95% Polyester, 5 % Spandex<br/>Hand wash cold, do not bleach, Hand dry, Iron low</p></li><li class="desc-sub-title">Size &amp; Fit</li><li class="desc-sub-text"><p>The model (height 5'6", chest 34", waist 26") is wearing a size 6 which measures 83.5 cm from shoulder to hem</p></li></ul>,26:02:2014,None
None,Tonga Blue Bodycon Dress,http://www.myntra.com/Dresses/Tonga/Tonga-Blue-Bodycon-Dress/215790/buy,Rs. 779,women-apparel-new-arrivals,Clothing,Tonga,http://myntra.myntassets.com/images/style/properties/Tonga-Women-Dresses_1feeb34d94ba1bc3fa2316ec12f2a053_images_1080_1440_mini.jpg,Rs. 1,199,None,women,http://www.myntra.com/Dresses/Tonga/Tonga-Blue-Bodycon-Dress/215790/buy,Sold byVector Ecommerce Pvt Ltd,None,None,['XS', 'S', 'M', 'L', 'XL'],None,<ul class="mk-pdpv1-product-helper mk-cf"><li class="desc-main-title">Product Description</li><li class="desc-sub-title">Style Note</li><li class="desc-sub-text " itemprop="description"><p>Tonga brings you dresses that will give you a unique statement look this season. Team this chic piece with strappy stilettos for your next party.</p></li><li class="desc-sub-title ">Product Details</li><li class="desc-sub-text"><p>Blue dress, has a round neck with binding, short extended sleeves with binding at hems, tuck detailing all over</p></li><li class="desc-sub-title ">Material &amp; Care</li><li class="desc-sub-text "><p>90% polyester, 10% Spandex<br/>Hand wash cold</p></li><li class="desc-sub-title">Size &amp; Fit</li><li class="desc-sub-text"><p>The model (height 5'6", chest 34", waist 26") is wearing a size S which measures 86 cm from shoulder to hem</p></li></ul>,26:02:2014,None
None,Fit and flared polka dot dress,http://www.myntra.com/Dresses/Tonga/Fit-and-flared-polka-dot-dress/193178/buy,Rs. 903,women-apparel-new-arrivals,Clothing,Tonga,http://myntra.myntassets.com/images/style/properties/Fit-and-flared-polka-dot-dress_cc31ce83cdd4878732f6b4209c3fc6a8_images_1080_1440_mini.jpg,Rs. 1,290,None,women,http://www.myntra.com/Dresses/Tonga/Fit-and-flared-polka-dot-dress/193178/buy,Sold byVector Ecommerce Pvt Ltd,None,None,['XS', 'S', 'M', 'L', 'XL'],None,<ul class="mk-pdpv1-product-helper mk-cf"><li class="desc-main-title">Product Description</li><li class="desc-sub-title">Style Note</li><li class="desc-sub-text " itemprop="description"><p>Feminine, chic and just a tad bit retro, polka dots never go out of style. This fit and flared black and white polka dot dress is a tribute to the era of retro fashion, a perfect blend of the past and the future, of tradition and modernity.</p></li><li class="desc-sub-title ">Product Details</li><li class="desc-sub-text"><p>Fit and flared polka dot dress, woven, collared neckline, half sleeves, polka dot waistline self belt and zip at back</p></li><li class="desc-sub-title ">Material &amp; Care</li><li class="desc-sub-text "><p>100% CottonHand wash cold, do not bleach, Hand dry, Iron low</p></li><li class="desc-sub-title">Size &amp; Fit</li><li class="desc-sub-text"><p>The model (height 5'6", chest 34", waist 26") is wearing a size 6 which measures 91.5 cm from shoulder to hem</p></li></ul>,26:02:2014,None
None,Tonga Cream Linen Pencil Skirt,http://www.myntra.com/Skirts/Tonga/Tonga-Cream-Linen-Pencil-Skirt/193182/buy,Rs. 990,women-apparel-new-arrivals,Clothing,Tonga,http://myntra.myntassets.com/images/style/properties/Tonga-Cream-Linen-Pencil-Skirt_2ffcc0d9a17def3a1f062ddc7288d644_images_1080_1440_mini.jpg,None,None,women,http://www.myntra.com/Skirts/Tonga/Tonga-Cream-Linen-Pencil-Skirt/193182/buy,Sold byVector Ecommerce Pvt Ltd,None,None,['26', '28', '30', '32', '34'],None,<ul class="mk-pdpv1-product-helper mk-cf"><li class="desc-main-title">Product Description</li><li class="desc-sub-title">Style Note</li><li class="desc-sub-text " itemprop="description"><p>Perfect for the office, lunch or a movie date, this form fitting pencil skirt shows off your gorgeous figure. Pair with a classic black or white blosue for a quintessentially elegant look.</p></li><li class="desc-sub-title ">Product Details</li><li class="desc-sub-text"><p>Cream linen skirt with black stripes on waist and sides,  regular fit, straight hem above knee</p></li><li class="desc-sub-title ">Material &amp; Care</li><li class="desc-sub-text "><p>100% linen<br/>Hand wash cold</p></li><li class="desc-sub-title">Size &amp; Fit</li><li class="desc-sub-text"><p>The model (height 5'8", chest 33", waist 26") is wearing a size 6 which measures 51 cm from waist to hem</p></li></ul>,26:02:2014,None
None,Orange cut out dress,http://www.myntra.com/Dresses/Tonga/Orange-cut-out-dress/193180/buy,Rs. 839,women-apparel-new-arrivals,Clothing,Tonga,http://myntra.myntassets.com/images/style/properties/Orange-cut-out-dress_f12f159e17dfcd33e2390e04db5f2e98_images_1080_1440_mini.jpg,Rs. 1,290,None,women,http://www.myntra.com/Dresses/Tonga/Orange-cut-out-dress/193180/buy,Sold byVector Ecommerce Pvt Ltd,None,None,['XS', 'S', 'M', 'L', 'XL'],None,<ul class="mk-pdpv1-product-helper mk-cf"><li class="desc-main-title">Product Description</li><li class="desc-sub-title">Style Note</li><li class="desc-sub-text " itemprop="description"><p>It's clear from the runways that the cutout is having its sexy little moment this fall and of course, Tonga's never far behind! Get this original orange cut out dress from Tonga and pair with pumps, stilletos or platforms for the complete look.</p></li><li class="desc-sub-title ">Product Details</li><li class="desc-sub-text"><p>Orange cut out silhouette dress, woven, round neck, sleeveless, cut outs on bust with back zip</p></li><li class="desc-sub-title ">Material &amp; Care</li><li class="desc-sub-text "><p>100% PolyesterHand wash cold, do not bleach, Hand dry, Iron low</p></li><li class="desc-sub-title">Size &amp; Fit</li><li class="desc-sub-text"><p>The model (height 5'6", chest 34", waist 26") is wearing a size 6 which measures 84 cm from shoulder to hem</p></li></ul>,26:02:2014,None
None,Tonga Women Cream Lace Blouse,http://www.myntra.com/Tops/Tonga/Tonga-Women-Cream-Lace-Blouse/193191/buy,Rs. 818,women-apparel-new-arrivals,Clothing,Tonga,http://myntra.myntassets.com/images/style/properties/Tonga-Women-Cream-Lace-Blouse_59b57a48dad210791261f2288b6cf371_images_1080_1440_mini.jpg,Rs. 1,090,None,women,http://www.myntra.com/Tops/Tonga/Tonga-Women-Cream-Lace-Blouse/193191/buy,Sold byVector Ecommerce Pvt Ltd,None,None,['XS', 'S', 'M', 'L', 'XL'],None,<ul class="mk-pdpv1-product-helper mk-cf"><li class="desc-main-title">Product Description</li><li class="desc-sub-title">Style Note</li><li class="desc-sub-text " itemprop="description"><p>Define your personal style with this fabulously feminine lace top with a Peter Pan collar. Innocent and sexy all at once, pair this with jeans, capris or a skirt and get set to make a true fashion statement.</p></li><li class="desc-sub-title ">Product Details</li><li class="desc-sub-text"><p>Cream lace top with contrast collar, knit, Peter Pan collar neck, half sleeves, cream lining attached</p></li><li class="desc-sub-title ">Material &amp; Care</li><li class="desc-sub-text "><p>90% polyester<br/> 10% Spandex<br/>Hand wash cold</p></li><li class="desc-sub-title">Size &amp; Fit</li><li class="desc-sub-text"><p>The model (height 5'8", chest 32"and waist 26") is wearing a size 10</p></li></ul>,26:02:2014,None
