None,Roadster Men Navy Printed T-Shirt,http://www.myntra.com/tshirts/roadster/roadster-men-navy-printed-t-shirt/219556/buy,Rs. 299,men-tees-polos,T-shirts & Collared Tees,Do u speak green,http://myntra.myntassets.com/images/style/properties/Roadster-Men-Tshirts_1554adccb55f5d749ed34b1a946516fb_images_1080_1440_mini.jpg,None,None,men,http://www.myntra.com/tshirts/roadster/roadster-men-navy-printed-t-shirt/219556/buy,Sold byVector Ecommerce Pvt Ltd,None,None,['S', 'M', 'L', 'XL'],None,<ul class="mk-pdpv1-product-helper mk-cf"><li class="desc-main-title">Product Description</li><li class="desc-sub-title">Style Note</li><li class="desc-sub-text " itemprop="description"><p>This cool and trendy printed T-shirt from Roadster is sure to amplify your energy all day long. Style it with denim jeans or cargos and canvas sneakers for a perfect casual look.</p></li><li class="desc-sub-title ">Product Details</li><li class="desc-sub-text"><p>Navy blue printed T-shirt, knit, ribbed V neck, short sleeves, contrast print at front</p></li><li class="desc-sub-title ">Material &amp; Care</li><li class="desc-sub-text "><p>100% cotton<br/>Machine wash cold<br/>You are unique and wouldn't like it if the creator made too many people ditto.<br/>Similarly, this product is unique, handmade and crafted with love.<br/>There are no two products we make, which will ever be ditto.<br/>To maintain a high degree of authenticity, we advise our patrons to wash our products separately and expect some fading, colour bleeding, wear and tear.<br/>The article ages uniquely as you treat it, acquiring your personalised feel. Go on, enjoy this specially created product to the hilt. Have fun.</p></li><li class="desc-sub-title">Size &amp; Fit</li><li class="desc-sub-text"><p>Slim fit<br/>The model (height 6' and shoulders 18") is wearing a size M</p></li></ul>,25:02:2014,None
None,Roadster Men Grey Melange 78 Polo T-shirt,http://www.myntra.com/tshirts/roadster/roadster-men-grey-melange-78-polo-t-shirt/220587/buy,Rs. 699,men-tees-polos,T-shirts & Collared Tees,Do u speak green,http://myntra.myntassets.com/images/style/properties/Roadster-Men-Tshirts_12a298d7dfde0791657579bf3cbdf171_images_1080_1440_mini.jpg,None,None,men,http://www.myntra.com/tshirts/roadster/roadster-men-grey-melange-78-polo-t-shirt/220587/buy,Sold byVector Ecommerce Pvt Ltd,None,None,['S', 'M', 'L', 'XL'],None,<ul class="mk-pdpv1-product-helper mk-cf"><li class="desc-main-title">Product Description</li><li class="desc-sub-title">Style Note</li><li class="desc-sub-text " itemprop="description"><p>Our in-house brand Roadster presents a range of pique knit polo tees that'll up the sartorial credibility of your casual repertoire. Pair this piece with coloured chino trousers and leather trainers for a cool look.</p></li><li class="desc-sub-title ">Product Details</li><li class="desc-sub-text"><p>Grey mélange polo T-shirt, has a contrast ribbed spread collar and short buttoned chest placket, brand patch on the left chest and appliquè detail on the right chest, short sleeves with contrast ribbed cuffs and has a vented hem with back longer than the front</p></li><li class="desc-sub-title ">Material &amp; Care</li><li class="desc-sub-text "><p>Polyester cotton<br/>Machine wash cold<br/>You are unique and wouldn't like it if the Creator made too many people ditto.<br/>Similarly, this product is unique, handmade and crafted with love.<br/>There are no two products we make, which will ever be ditto.<br/>To maintain a high degree of authenticity, we advise our patrons to wash our products separately and expect some fading, colour bleeding and wear &amp; tear.The article ages uniquely as you treat it, acquiring your personalised feel.<br/>Go on, enjoy this specially created product to the hilt. Have fun.</p></li><li class="desc-sub-title">Size &amp; Fit</li><li class="desc-sub-text"><p>Slim fit<br/>The model (height 6' and shoulders 18") is wearing a size M</p></li></ul>,25:02:2014,None
None,Roadster Men Maroon Bardan Polo T-Shirt,http://www.myntra.com/tshirts/roadster/roadster-men-maroon-bardan-polo-t-shirt/141601/buy,Rs. 699,men-tees-polos,T-shirts & Collared Tees,Do u speak green,http://myntra.myntassets.com/images/style/properties/Roadster-Men-Tshirts_a63afcdcba467ed235a4e93e07ec8e25_images_1080_1440_mini.jpg,None,None,men,http://www.myntra.com/tshirts/roadster/roadster-men-maroon-bardan-polo-t-shirt/141601/buy,Sold byVector Ecommerce Pvt Ltd,None,None,['S', 'M', 'L', 'XL'],None,<ul class="mk-pdpv1-product-helper mk-cf"><li class="desc-main-title">Product Description</li><li class="desc-sub-title">Style Note</li><li class="desc-sub-text " itemprop="description"><p>Our in-house brand Roadster presents a range of pique knit polo tees that'll up the sartorial credibility of your casual repertoire. Pair this piece with coloured chino trousers and leather trainers for a cool look.</p></li><li class="desc-sub-title ">Product Details</li><li class="desc-sub-text"><p>Maroon, navy and cream striped polo T-shirt, has a ribbed spread collar in maroon, short buttoned chest placket, brand patch on the left chest, short sleeves with ribbed cuffs and has applique on the right sleeve and has a vented hem with back longer than the front</p></li><li class="desc-sub-title ">Material &amp; Care</li><li class="desc-sub-text "><p>100% cotton<br/>Machine wash cold<br/>You are unique and wouldn't like it if the Creator made too many people ditto.<br/>Similarly, this product is unique, handmade and crafted with love.<br/>There are no two products we make, which will ever be ditto.<br/>To maintain a high degree of authenticity, we advise our patrons to wash our products separately and expect some fading, colour bleeding and wear and tear.<br/>The article ages uniquely as you treat it, acquiring your personalised feel. Go on, enjoy this specially created product to the hilt. Have fun.</p></li><li class="desc-sub-title">Size &amp; Fit</li><li class="desc-sub-text"><p>Slim fit<br/>The model (height 6' and shoulders 18") is wearing a size M</p></li></ul>,25:02:2014,None
None,Kook N Keech Marvel Men Grey Captain America Printed T-shirt,http://www.myntra.com/tshirts/kook-n-keech-marvel/kook-n-keech-marvel-men-grey-captain-america-print/217774/buy,Rs. 499,men-tees-polos,T-shirts & Collared Tees,Do u speak green,http://myntra.myntassets.com/images/style/properties/Kook-N-Keech-Marvel-Men-Grey-Captain-America-Printed-T-shirt_626a56a0d2afe91e324f5ee73c77d771_images_1080_1440_mini.jpg,None,None,men,http://www.myntra.com/tshirts/kook-n-keech-marvel/kook-n-keech-marvel-men-grey-captain-america-print/217774/buy,Sold byVector Ecommerce Pvt Ltd,None,None,['S', 'M', 'L', 'XL'],None,<ul class="mk-pdpv1-product-helper mk-cf"><li class="desc-main-title">Product Description</li><li class="desc-sub-title">Style Note</li><li class="desc-sub-text " itemprop="description"><p>Inject some youth into your casual repertoire with Kook N Keech's Marvel range of fun graphic tees. We think this piece will look cool styled with pop coloured trousers and skate shoes on the weekend.</p></li><li class="desc-sub-title ">Product Details</li><li class="desc-sub-text"><p>Grey printed T-shirt, ribbed round neck, short sleeves with textured brand print on left sleeve, graphic print at front, printed branding at back</p></li><li class="desc-sub-title ">Material &amp; Care</li><li class="desc-sub-text "><p>100% cotton<br/>Machine wash cold</p></li><li class="desc-sub-title">Size &amp; Fit</li><li class="desc-sub-text"><p>Slim fit<br/>The model (height 6' and shoulders 18") is wearing a size M</p></li></ul>,25:02:2014,None
None,Roadster Men Maroon Printed T-shirt,http://www.myntra.com/tshirts/roadster/roadster-men-maroon-printed-t-shirt/219549/buy,Rs. 399,men-tees-polos,T-shirts & Collared Tees,Do u speak green,http://myntra.myntassets.com/images/style/properties/Roadster-Men-Maroon-Vinatge-Club-Printed-T-shirt_0f75916971264d1726e6eea0f4563939_images_1080_1440_mini.jpg,None,None,men,http://www.myntra.com/tshirts/roadster/roadster-men-maroon-printed-t-shirt/219549/buy,Sold byVector Ecommerce Pvt Ltd,None,None,['S', 'M', 'L', 'XL'],None,<ul class="mk-pdpv1-product-helper mk-cf"><li class="desc-main-title">Product Description</li><li class="desc-sub-title">Style Note</li><li class="desc-sub-text " itemprop="description"><p>This cool and trendy printed T-shirt from Roadster is sure to amplify your energy all day long. Style it with denim jeans or cargos and canvas sneakers for a perfect casual look.</p></li><li class="desc-sub-title ">Product Details</li><li class="desc-sub-text"><p>Maroon printed T-shirt, knit, ribbed round neck, short sleeves, graphic print at front</p></li><li class="desc-sub-title ">Material &amp; Care</li><li class="desc-sub-text "><p>100% cotton<br/>Machine wash cold<br/>You are unique and wouldn't like it if the Creator made too many people ditto.<br/>Similarly, this product is unique, handmade and crafted with love.<br/>There are no two products we make, which will ever be ditto.<br/>To maintain a high degree of authenticity, we advise our patrons to wash our products separately and expect some fading, colour bleeding and wear &amp; tear. The article ages uniquely as you treat it, acquiring your personalised feel.<br/>Go on, enjoy this specially created product to the hilt. Have fun.</p></li><li class="desc-sub-title">Size &amp; Fit</li><li class="desc-sub-text"><p>Slim fit<br/>The model (height 6' and shoulders 18") is wearing a size M</p></li></ul>,25:02:2014,None
None,Breakbounce Men Rust Orange Kreel Buddy Hug Regular Fit T-shirt,http://www.myntra.com/tshirts/breakbounce/breakbounce-men-rust-orange-kreel-buddy-hug-regula/244712/buy,Rs. 999,men-tees-polos,T-shirts & Collared Tees,Do u speak green,http://myntra.myntassets.com/images/style/properties/Breakbounce-Men-Rust-Orange-Kreel-Buddy-Hug-Regular-Fit-T-shirt_aaf4488d297ad67f649e63eff42cb993_images_1080_1440_mini.jpg,None,None,men,http://www.myntra.com/tshirts/breakbounce/breakbounce-men-rust-orange-kreel-buddy-hug-regula/244712/buy,Sold byVector Ecommerce Pvt Ltd,None,None,['S', 'M', 'L', 'XL', 'XXL'],None,<ul class="mk-pdpv1-product-helper mk-cf"><li class="desc-main-title">Product Description</li><li class="desc-sub-title">Style Note</li><li class="desc-sub-text " itemprop="description"><p>Add a new dimension to your wardrobe with this T-shirt from Breakbounce. Designed to redefine fashion statements, it can be teamed with distressed denims and plimsolls for an effortlessly casual and grungy look.</p></li><li class="desc-sub-title ">Product Details</li><li class="desc-sub-text"><p>Rust orange T-shirt in a pigment dyed effect, knit, Henley neck, short buttoned placket, long sleeves with a brand tag above left shoulder and left sleeve, patch pocket at left chest</p></li><li class="desc-sub-title ">Material &amp; Care</li><li class="desc-sub-text "><p>Cotton<br/>Hand wash (inside out)</p></li><li class="desc-sub-title">Size &amp; Fit</li><li class="desc-sub-text"><p>Buddy hug (Regular fit)<br/>The model (height 6' and shoulders 18") is wearing a size M</p></li></ul>,25:02:2014,None
None,Mast & Harbour Men Navy Polo T-shirt,http://www.myntra.com/tshirts/mast-harbour/mast-harbour-men-navy-polo-t-shirt/163678/buy,Rs. 999,men-tees-polos,T-shirts & Collared Tees,Do u speak green,http://myntra.myntassets.com/images/style/properties/Mast-&-Harbour-Men-Navy-Polo-T-shirt_40f5c2e5a3742ea17a31f6be5cf67ff9_images_1080_1440_mini.jpg,None,None,men,http://www.myntra.com/tshirts/mast-harbour/mast-harbour-men-navy-polo-t-shirt/163678/buy,Sold byVector Ecommerce Pvt Ltd,None,None,['S', 'M', 'L', 'XL'],None,<ul class="mk-pdpv1-product-helper mk-cf"><li class="desc-main-title">Product Description</li><li class="desc-sub-title">Style Note</li><li class="desc-sub-text " itemprop="description"><p>Maritime styling at its best, this polo tee by Mast &amp; Harbour exudes preppy charm. This piece by our in-house brand will surely set you apart from the crowd, when styled with slim fit chinos and boat shoes.</p></li><li class="desc-sub-title ">Product Details</li><li class="desc-sub-text"><p>Navy polo T-shirt with blue and red accents, has a ribbed spread collar with embroidery behind the collar, contrast short sleeves with ribbed cuffs and branding on the right sleeve, short buttoned chest placket, branding at left chest, contrast fabric panelling below chest with embroidery, yoke at back, side slits with contrast fabric taping, back hem longer than front</p></li><li class="desc-sub-title ">Material &amp; Care</li><li class="desc-sub-text "><p>100% cotton<br/>Machine wash cold</p></li><li class="desc-sub-title">Size &amp; Fit</li><li class="desc-sub-text"><p>Slim fit<br/>The model (height 6' and shoulders 18") is wearing a size M</p></li></ul>,25:02:2014,None
None,Kook N Keech Men Black Printed T-shirt,http://www.myntra.com/tshirts/kook-n-keech/kook-n-keech-men-black-printed-t-shirt/234647/buy,Rs. 499,men-tees-polos,T-shirts & Collared Tees,Do u speak green,http://myntra.myntassets.com/images/style/properties/Kooch-N-Keech-Men-Black-Printed-T-shirt_a3bbfde9fb958bec96fbd99416dcfd05_images_1080_1440_mini.jpg,None,None,men,http://www.myntra.com/tshirts/kook-n-keech/kook-n-keech-men-black-printed-t-shirt/234647/buy,Sold byVector Ecommerce Pvt Ltd,None,None,['S', 'M', 'L', 'XL'],None,<ul class="mk-pdpv1-product-helper mk-cf"><li class="desc-main-title">Product Description</li><li class="desc-sub-title">Style Note</li><li class="desc-sub-text " itemprop="description"><p>Inject some youth into your casual repertoire with Kook N Keech's range of fun graphic tees. We think this piece will look cool styled with pop coloured trousers and skate shoes on the weekend.</p></li><li class="desc-sub-title ">Product Details</li><li class="desc-sub-text"><p>Black T-shirt, ribbed round neck, short sleeves with print branding at left arm, graphic print on front, stitch detail throughout</p></li><li class="desc-sub-title ">Material &amp; Care</li><li class="desc-sub-text "><p>100% cotton<br/>Machine wash cold</p></li><li class="desc-sub-title">Size &amp; Fit</li><li class="desc-sub-text"><p>Slim fit<br/>The model (height 6' and shoulders 18") is wearing a size M</p></li></ul>,25:02:2014,None
None,Roadster Men Black Printed T-shirt,http://www.myntra.com/tshirts/roadster/roadster-men-black-printed-t-shirt/219555/buy,Rs. 399,men-tees-polos,T-shirts & Collared Tees,Do u speak green,http://myntra.myntassets.com/images/style/properties/Roadster-Men-Black-Automotive-Printed-T-shirt_2667a41150fbcf6a76f5385438cf6265_images_1080_1440_mini.jpg,None,None,men,http://www.myntra.com/tshirts/roadster/roadster-men-black-printed-t-shirt/219555/buy,Sold byVector Ecommerce Pvt Ltd,None,None,['S', 'M', 'L', 'XL'],None,<ul class="mk-pdpv1-product-helper mk-cf"><li class="desc-main-title">Product Description</li><li class="desc-sub-title">Style Note</li><li class="desc-sub-text " itemprop="description"><p>This cool and trendy printed T-shirt from Roadster is sure to amplify your energy all day long. Style it with denim jeans or cargos and canvas sneakers for a perfect casual look.</p></li><li class="desc-sub-title ">Product Details</li><li class="desc-sub-text"><p>Black printed T-shirt, knit, ribbed round neck, short sleeves, printed at front</p></li><li class="desc-sub-title ">Material &amp; Care</li><li class="desc-sub-text "><p>100% cotton<br/>Machine wash cold<br/>You are unique and wouldn't like it if the Creator made too many people ditto.<br/>Similarly, this product is unique, handmade and crafted with love.<br/>There are no two products we make, which will ever be ditto.<br/>To maintain a high degree of authenticity, we advise our patrons to wash our products separately and expect some fading, colour bleeding and wear &amp; tear. The article ages uniquely as you treat it, acquiring your personalised feel.<br/>Go on, enjoy this specially created product to the hilt. Have fun.</p></li><li class="desc-sub-title">Size &amp; Fit</li><li class="desc-sub-text"><p>Slim fit<br/>The model (height 6' and shoulders 18") is wearing a size M</p></li></ul>,25:02:2014,None
None,Mast & Harbour Men Blue Pique Polo T-shirt,http://www.myntra.com/tshirts/mast-harbour/mast-harbour-men-blue-pique-polo-t-shirt/163670/buy,Rs. 899,men-tees-polos,T-shirts & Collared Tees,Do u speak green,http://myntra.myntassets.com/images/style/properties/Mast-&-Harbour-Men-Blue-Pique-Polo-T-shirt_4fa40cdf5aab6927e5ceaaf629bf6f72_images_1080_1440_mini.jpg,None,None,men,http://www.myntra.com/tshirts/mast-harbour/mast-harbour-men-blue-pique-polo-t-shirt/163670/buy,Sold byVector Ecommerce Pvt Ltd,None,None,['S', 'M', 'L', 'XL'],None,<ul class="mk-pdpv1-product-helper mk-cf"><li class="desc-main-title">Product Description</li><li class="desc-sub-title">Style Note</li><li class="desc-sub-text " itemprop="description"><p>Maritime styling at its best, this polo tee by Mast &amp; Harbour exudes preppy charm. This piece by our in-house brand will surely set you apart from the crowd, when styled with slim fit chinos and boat shoes.</p></li><li class="desc-sub-title ">Product Details</li><li class="desc-sub-text"><p>Blue pique polo T-shirt with light blue accents, ribbed spread collar with tipping, short sleeves with contrast stripe ribbed cuffs, short buttoned chest placket, embroidery and appliqué at left chest, longer back hem, side slits</p></li><li class="desc-sub-title ">Material &amp; Care</li><li class="desc-sub-text "><p>100% cotton<br/>Machine wash cold</p></li><li class="desc-sub-title">Size &amp; Fit</li><li class="desc-sub-text"><p>Slim fit<br/>The model (height 6' and shoulders 18") is wearing a size M</p></li></ul>,25:02:2014,None
None,Mast & Harbour Men White & Navy Polo T-shirt,http://www.myntra.com/tshirts/mast-harbour/mast-harbour-men-white-navy-polo-t-shirt/163679/buy,Rs. 999,men-tees-polos,T-shirts & Collared Tees,Do u speak green,http://myntra.myntassets.com/images/style/properties/Mast-&-Harbour-Men-White-&-Navy-Polo-T-shirt_1ca174baa518917d1d3770face609841_images_1080_1440_mini.jpg,None,None,men,http://www.myntra.com/tshirts/mast-harbour/mast-harbour-men-white-navy-polo-t-shirt/163679/buy,Sold byVector Ecommerce Pvt Ltd,None,None,['S', 'M', 'L', 'XL'],None,<ul class="mk-pdpv1-product-helper mk-cf"><li class="desc-main-title">Product Description</li><li class="desc-sub-title">Style Note</li><li class="desc-sub-text " itemprop="description"><p>Maritime styling at its best, this polo tee by Mast &amp; Harbour exudes preppy charm. This piece by our in-house brand will surely set you apart from the crowd, when styled with slim fit chinos and boat shoes.</p></li><li class="desc-sub-title ">Product Details</li><li class="desc-sub-text"><p>White, navy and red polo T-shirt, pique knit, embroidered detail at back neck below the collar, short buttoned chest placket, short sleeves with ribbed cuffs, brand appliqué on either side at chest, embroidered branding at front, vented hem with back hem longer than front</p></li><li class="desc-sub-title ">Material &amp; Care</li><li class="desc-sub-text "><p>100% cotton<br/>Machine wash cold</p></li><li class="desc-sub-title">Size &amp; Fit</li><li class="desc-sub-text"><p>Slim fit<br/>The model (height 6' and shoulders 18") is wearing a size M</p></li></ul>,25:02:2014,None
None,Duke Men Pack of 2 Johny Collar T-shirts,http://www.myntra.com/tshirts/duke/duke-men-pack-of-2-johny-collar-t-shirts/117600/buy,Rs. 835,men-tees-polos,T-shirts & Collared Tees,Do u speak green,http://myntra.myntassets.com/images/style/properties/Duke-Men-Pack-of-Two-Johny-Collar-T-shirts_cc2b23b52c069ec2e8c5911842bfcd13_images_1080_1440_mini.jpg,None,None,men,http://www.myntra.com/tshirts/duke/duke-men-pack-of-2-johny-collar-t-shirts/117600/buy,Sold byVector Ecommerce Pvt Ltd,None,None,['S', 'M', 'L', 'XL', 'XXL'],None,<ul class="mk-pdpv1-product-helper mk-cf"><li class="desc-main-title">Product Description</li><li class="desc-sub-title">Style Note</li><li class="desc-sub-text " itemprop="description"><p>Looking for something to throw on with your jeans? Then these casual tees from Duke are perfect for you. This pack of two Johny collar tees is a grabber. Team this with a pair of denims and sneakers and you're good to go!</p></li><li class="desc-sub-title ">Product Details</li><li class="desc-sub-text"><p>Pack of two T-shirts<br/>Navy and red T-shirts have contrast coloured stripes on the body, has a ribbed, spread collar with a split V and  ribbing, short sleeves with contrast ribbed cuffs with brand tag on the left cuff and a vented hem</p></li><li class="desc-sub-title ">Material &amp; Care</li><li class="desc-sub-text "><p>Poly cotton<br/>Hand wash cold</p></li><li class="desc-sub-title">Size &amp; Fit</li><li class="desc-sub-text"><p>Short Style<br/>The model (height 6' and shoulders 18") is wearing a size M</p></li></ul>,25:02:2014,None
None,Proline Men Black T-shirt,http://www.myntra.com/tshirts/proline/proline-men-black-t-shirt/228229/buy,Rs. 649,men-tees-polos,T-shirts & Collared Tees,Do u speak green,http://myntra.myntassets.com/images/style/properties/Proline-Men-Tshirts_8632bcff1f29fd2305715a3141f8820f_images_1080_1440_mini.jpg,None,None,men,http://www.myntra.com/tshirts/proline/proline-men-black-t-shirt/228229/buy,Sold byVector Ecommerce Pvt Ltd,None,None,['S', 'M', 'L', 'XL', 'XXL'],None,<ul class="mk-pdpv1-product-helper mk-cf"><li class="desc-main-title">Product Description</li><li class="desc-sub-title">Style Note</li><li class="desc-sub-text " itemprop="description"><p>If simple is your style, then Proline is the brand for you. Their range of casual clothing is high on comfort and practicality while keeping in mind the style aspect. Team this plain tee with a pair of denims and sneakers before heading out.</p></li><li class="desc-sub-title ">Product Details</li><li class="desc-sub-text"><p>Black T-shirt, has a ribbed V neck, short sleeves with ribbed cuffs, embroidered branding at left chest</p></li><li class="desc-sub-title ">Material &amp; Care</li><li class="desc-sub-text "><p>Cotton and Spandex blend<br/>Dry clean</p></li><li class="desc-sub-title">Size &amp; Fit</li><li class="desc-sub-text"><p>Regular fit<br/>The model (height 6' and shoulders 18") is wearing a size M</p></li></ul>,25:02:2014,None
None,Roadster Men Black Printed T-shirt,http://www.myntra.com/tshirts/roadster/roadster-men-black-printed-t-shirt/219547/buy,Rs. 399,men-tees-polos,T-shirts & Collared Tees,Do u speak green,http://myntra.myntassets.com/images/style/properties/Roadster-Men-Tshirts_70350e2cbc296d4908ae4a0cac97e49c_images_1080_1440_mini.jpg,None,None,men,http://www.myntra.com/tshirts/roadster/roadster-men-black-printed-t-shirt/219547/buy,Sold byVector Ecommerce Pvt Ltd,None,None,['S', 'M', 'L', 'XL'],None,<ul class="mk-pdpv1-product-helper mk-cf"><li class="desc-main-title">Product Description</li><li class="desc-sub-title">Style Note</li><li class="desc-sub-text " itemprop="description"><p>This cool and trendy printed T-shirt from Roadster is sure to amplify your energy all day long. Style it with denim jeans or cargos and canvas sneakers for a perfect casual look.</p></li><li class="desc-sub-title ">Product Details</li><li class="desc-sub-text"><p>Black printed T-shirt, knit, ribbed round neck, short sleeves, contrast print at front</p></li><li class="desc-sub-title ">Material &amp; Care</li><li class="desc-sub-text "><p>100% cotton<br/>Machine wash cold<br/>You are unique and wouldn't like it if the creator made too many people ditto.<br/>Similarly, this product is unique, handmade and crafted with love.<br/>There are no two products we make, which will ever be ditto.<br/>To maintain a high degree of authenticity, we advise our patrons to wash our products separately and expect some fading, colour bleeding, wear and tear.<br/>The article ages uniquely as you treat it, acquiring your personalised feel. Go on, enjoy this specially created product to the hilt. Have fun.</p></li><li class="desc-sub-title">Size &amp; Fit</li><li class="desc-sub-text"><p>Slim fit<br/>The model (height 6' and shoulders 18") is wearing a size M</p></li></ul>,25:02:2014,None
None,U.S. Polo Assn. Men Green Pique Polo T-shirt,http://www.myntra.com/tshirts/us-polo-assn/us-polo-assn-men-green-pique-polo-t-shirt/236386/buy,Rs. 1,299,men-tees-polos,T-shirts & Collared Tees,Do u speak green,http://myntra.myntassets.com/images/style/properties/US-Polo-Assn-Men-Green-Pique-Polo-T-shirt_b420f6cbead8348c466537de9e3e4a60_images_1080_1440_mini.jpg,None,None,men,http://www.myntra.com/tshirts/us-polo-assn/us-polo-assn-men-green-pique-polo-t-shirt/236386/buy,Sold byVector Ecommerce Pvt Ltd,None,None,['S', 'M', 'L', 'XL', 'XXL'],None,<ul class="mk-pdpv1-product-helper mk-cf"><li class="desc-main-title">Product Description</li><li class="desc-sub-title">Style Note</li><li class="desc-sub-text " itemprop="description"><p>Add a touch of sophistication to your casual wear by wearing this classy polo tee by U.S. Polo Assn. We love its fabric composition and immaculately finished look. Match it with a pair of washed jeans and canvas shoes for a chic, relaxed appeal.</p></li><li class="desc-sub-title ">Product Details</li><li class="desc-sub-text"><p>Green pique polo T-shirt, knitted, ribbed spread collar, short sleeves with ribbed cuffs, short buttoned chest placket, contrast brand embroidered appliquè at left chest, vented hem with back longer than front</p></li><li class="desc-sub-title ">Material &amp; Care</li><li class="desc-sub-text "><p>100% cotton<br/>Machine wash cold</p></li><li class="desc-sub-title">Size &amp; Fit</li><li class="desc-sub-text"><p>Slim fit<br/>The model (height 6' and shoulders 18") is wearing a size M</p></li></ul>,25:02:2014,None
