None,Timberland Men Burgundy Leather Casual Boots,http://www.myntra.com/Casual-Shoes/Timberland/Timberland-Men-Burgundy-Leather-Casual-Boots/178203/buy,Rs. 11,990,fashion-sale,Extra 32% Off on 30,Timberland,http://myntra.myntassets.com/images/style/properties/Timberland-Men-Brown-Leather-Casual-Boots_abe5f7c2eaac6527121f92a92bcdca2e_images_1080_1440_mini.jpg,None,None,fashion,http://www.myntra.com/Casual-Shoes/Timberland/Timberland-Men-Burgundy-Leather-Casual-Boots/178203/buy,Sold byVector Ecommerce Pvt Ltd,None,None,['7', '8', '8.5', '9', '11'],None,<ul class="mk-pdpv1-product-helper mk-cf"><li class="desc-main-title">Product Description</li><li class="desc-sub-title">Style Note</li><li class="desc-sub-text " itemprop="description"><p>Timberland shoes have a universal appeal, and this is no different. The combination of sleek designs, comfortable constructions and evident environment consciousness has transformed us into loyal followers. This versatile pair can be worn to give your casual outfits a different look or with your leather jacket for an edgy look.</p></li><li class="desc-sub-title ">Product Details</li><li class="desc-sub-text"><p>Round toed, burgundy casual boots with central lace-ups and high top styling<br/>Leather upper with overlay and stitched detail<br/>Reinforced at the heel collar, has a pull loop<br/>Soft tongue, padded footbed with branding<br/>Tough and textured outsole with patterned lugs<br/>Comes with an extra pair of laces<br/><img alt="" src="http://myntra.myntassets.com/images/banners/march2013/1362660064-Timberland-Green-Rubber.jpg"/><br/>Green Rubber – Timberland is the first shoe company to use Green Rubber material in the soles. Green Rubber compound is made using DeLink technology — a process that converts scrap rubber, to a recycled compound that can then be reused in rubber products. Like shoe soles that provide all the traction and durability to live up to their high standards.<br/><img alt="" src="http://myntra.myntassets.com/images/banners/march2013/1363173389-Timberland-gripstick-rubber.jpg"/><br/>Gripstick Rubber – Gripstick Rubber is their stickiest rubber compound that provides improved traction. Sometimes they make it with Green Rubber and then it becomes their stickiest recycled rubber – 42% to be exact.<br/><img alt="" src="http://myntra.myntassets.com/images/banners/march2013/1363159656-Timberland-Ecosmart.JPG"/><br/>EcoSmart® environmental material is a soft-against-the-skin, performance fabric that we use in our footwear. It’s made from 100% recycled PET like everyday plastic bottles. <br/>Warranty: One year warranty against manufacturing defects only<br/><img alt="" src="http://myntra.myntassets.com/images/banners/march2013/1363175803-Timberland-ortholite-comfort-foam-insoles.jpg"/><br/>OrthoLite Insoles – OrthoLite comfort foam insoles provide breathability, moisture transport, anti-microbial function and long-term cushioning. That means the ultra-breathable material won’t break down or lose cushioning over time and your footwear will still be comfortable and supportive, no matter how long they’re worn or how far they go.<br/><br/>Warranty: 1 year warranty against manufacturing defects only</p></li><li class="desc-sub-title ">Material &amp; Care</li><li class="desc-sub-text "><p>Premium leather, GSR and green rubber<br/>Use Timberland waximum to clean this product</p></li></ul>,26:02:2014,None
None,Timberland Womens Grey And White Formentor Shoes,http://www.myntra.com/Casual-Shoes/Timberland/Timberland-Womens-Grey-And-White-Formentor-Shoes/92392/buy,Rs. 6,990,fashion-sale,Extra 32% Off on 30,Timberland,http://myntra.myntassets.com/images/style/properties/Timberland-Women-Casual-Shoes_71e59fad3456fe6a6e05751e0af386e6_images_1080_1440.jpg,None,None,fashion,http://www.myntra.com/Casual-Shoes/Timberland/Timberland-Womens-Grey-And-White-Formentor-Shoes/92392/buy,Sold byVector Ecommerce Pvt Ltd,None,None,['4', '5', '6', '7'],None,<ul class="mk-pdpv1-product-helper mk-cf"><li class="desc-main-title">Product Description</li><li class="desc-sub-title">Style Note</li><li class="desc-sub-text " itemprop="description"><p>A stylish looking pair can be a durable pair, packed with features for comfort and performance - Timberland proves that time and again with every creation. This pair will make you look great when you are indulging in outdoor adventures, while also making the trails and activities so much easier to undertake.</p></li><li class="desc-sub-title ">Product Details</li><li class="desc-sub-text"><p>Round toed, grey and white shoes with red detailing and central lace up for a secure, adjustable fit<br/>Air-tech mesh upper with leather overlays for a breathable and comfortable foot that is barefoot capable<br/>Hydrophobic breathable materials combined with Ion-mask Technology by P2i shed water easily<br/> Reflective detail for enhanced safety, is stain resistant, and has waterproof enhancing features<br/>Printed, removable footbed with cushioning for extra comfort<br/>X-Static anti-microbial footbed and lining for odor/fungal control<br/>Low-profile EVA midsole for lightweight cushioning<br/>Timberland GSR Gripstick rubber and multi directional siped outsole designed to maximize surface contact for superior traction on wet surfaces<br/>Extra ports in outsole for added drainage<br/>Warranty: One year warranty against manufacturing defects only<br/><img alt="" src="http://myntra.myntassets.com/images/banners/march2013/1363175275-Timberland-ion-mask-technology-by-p2i.jpg"/><br/>Ion-mask technology by P2i: Ion Mask Technology by P2i gives footwear a level of repellency that's hard to match. It keeps you comfortable and dry by repelling water from the outside and staying breathable inside. And since water and other liquids arenâ€™t absorbed, ion-mask technology also protects from stains so your boots and shoes look newer longer.<br/><img alt="" src="http://myntra.myntassets.com/images/banners/march2013/1362660064-Timberland-Green-Rubber.jpg"/><br/>Green Rubber: Timberland is the first shoe company to use Green Rubber material in the soles. Green Rubber compound is made using DeLink technology-a process that converts scrap rubber, to a recycled compound that can then be reused in rubber products. Like shoe soles that provide all the traction and durability to live up to their high standards.<br/><img alt="" src="http://myntra.myntassets.com/images/banners/march2013/1363173389-Timberland-gripstick-rubber.jpg"/><br/>Gripstick Rubber â€“ Gripstick Rubber is their stickiest rubber compound that provides improved traction. Sometimes they make it with Green Rubber and then it becomes their stickiest recycled rubber â€“ 42% to be exact.<br/><img alt="" src="http://myntra.myntassets.com/images/banners/march2013/1363357643-Timberland-x-static.jpg"/><br/>X-Static â€“ X-Static anti-micorbial footbed and lining for odor and fungal control.<br/><img alt="" src="http://myntra.myntassets.com/images/banners/march2013/1363179078-Timberland-quad-siped-sole.jpg"/><br/>Quad-siped Sole: Timberland's 4-way cycling design expels water away from the outsole, providing superior traction on wet, slippery surfaces.</p></li><li class="desc-sub-title ">Material &amp; Care</li><li class="desc-sub-text "><p>Leather and textile<br/>Clean with this <a href="http://www.myntra.com/92347">boot sauce cleaner</a> from Timberland</p></li></ul>,26:02:2014,None
None,Timberland Men Brown Leather Casual Shoes,http://www.myntra.com/Casual-Shoes/Timberland/Timberland-Men-Brown-Leather-Casual-Shoes/178213/buy,Rs. 8,990,fashion-sale,Extra 32% Off on 30,Timberland,http://myntra.myntassets.com/images/style/properties/Timberland-Men-Brown-Leather-Casual-Shoes_f2d2a3e2436ea57e03d8b44a7c476a06_images_1080_1440_mini.jpg,None,None,fashion,http://www.myntra.com/Casual-Shoes/Timberland/Timberland-Men-Brown-Leather-Casual-Shoes/178213/buy,Sold byVector Ecommerce Pvt Ltd,None,None,['7', '8', '9', '10', '11'],None,<ul class="mk-pdpv1-product-helper mk-cf"><li class="desc-main-title">Product Description</li><li class="desc-sub-title">Style Note</li><li class="desc-sub-text " itemprop="description"><p>No other brand defines 'comfortably stylish' better than Timberland.  Their cutting edge technology and unmatched designs are a delight for  any wearer. This pair of shoes has been crafted with the best of  materials to give you utmost comfort and style.</p></li><li class="desc-sub-title ">Product Details</li><li class="desc-sub-text"><p>Square toed, brown casual shoes with central lace-ups and low top styling<br/>Leather upper with stitched and overlay detail<br/>Reinforced overlay at the heel collar<br/>Soft tongue and padded footbed with branding<br/>Rubber outsole with patterned nubs<br/><img alt="" src="http://myntra.myntassets.com/images/banners/march2013/1362660214-Timberland-Anti-Fatigue.jpg"/><br/>Anti-Fatigue is Timberland’s exclusive footbed technology that uses a system of molded, inverted cones that collapse and return energy. The result – enhanced shock absorption and reduced fatigue. Anti-Fatigue footbeds are made up of a polyurethane compound that utilizes at least 10% natural oil polyols (NOPs) – derived from non-food source plants. NOPs are a renewable resource and environmentally preferred alternative to fossil fuels.<br/><img alt="" src="http://myntra.myntassets.com/images/banners/march2013/1363159656-Timberland-Ecosmart.JPG"/><br/>EcoSmart® environmental material is a soft-against-the-skin, performance fabric that we use in our footwear. It’s made from 100% recycled PET like everyday plastic bottles.<br/><img alt="" src="http://myntra.myntassets.com/images/banners/march2013/1362660064-Timberland-Green-Rubber.jpg"/><br/>Green Rubber – Timberland is the first shoe company to use Green Rubber material in the soles. Green Rubber compound is made using DeLink technology — a process that converts scrap rubber, to a recycled compound that can then be reused in rubber products. Like shoe soles that provide all the traction and durability to live up to their high standards.<br/> <img alt="" src="http://myntra.myntassets.com/images/banners/march2013/1363175803-Timberland-ortholite-comfort-foam-insoles.jpg"/><br/>OrthoLite Insoles – OrthoLite comfort foam insoles provide breathability, moisture transport, anti-microbial function and long-term cushioning. That means the ultra-breathable material won’t break down or lose cushioning over time and your footwear will still be comfortable and supportive, no matter how long they’re worn or how far they go.<br/><img src="http://myntra.myntassets.com/images/banners/october2013/1382614347-Sanitized.jpg"/><br/>Sanitized - This zinc-based anti-odor treatment performs a valuable function in our products, reducing shoe odor and keeping feet feeling fresh all day long. We incorporate it into our footbed linings and directly infuse it into the foam insole of many of our sandals. <br/><br/>Warranty: 1 year warranty against manufacturing defects only</p></li><li class="desc-sub-title ">Material &amp; Care</li><li class="desc-sub-text "><p>Nubuck leather<br/>Use Timberland foam cleaner to clean this product</p></li><li class="desc-sub-title">Size &amp; Fit</li><li class="desc-sub-text"><br/></li></ul>,26:02:2014,None
None,Timberland Womens Brown Wintage Closed Toe Sandals,http://www.myntra.com/Heels/Timberland/Timberland-Womens-Brown-Wintage-Closed-Toe-Sandals/92416/buy,Rs. 6,990,fashion-sale,Extra 32% Off on 30,Timberland,http://myntra.myntassets.com/images/style/properties/Timberland-Women-Sandals_29c765b8e60c1e4a949421c5a6a64ded_images_1080_1440_mini.jpg,None,None,fashion,http://www.myntra.com/Heels/Timberland/Timberland-Womens-Brown-Wintage-Closed-Toe-Sandals/92416/buy,Sold byVector Ecommerce Pvt Ltd,None,None,['4', '5', '6', '7'],None,<ul class="mk-pdpv1-product-helper mk-cf"><li class="desc-main-title">Product Description</li><li class="desc-sub-title">Style Note</li><li class="desc-sub-text " itemprop="description"><p>Finding a sturdy and comfortable pair of heels is a quest made easy by Timberland. This pair transitions from office wear to evening wear effortlessly. We recommend a leather jacket to add to the edginess or slim fit trousers for a refined look.</p></li><li class="desc-sub-title ">Product Details</li><li class="desc-sub-text"><p>Round toed, brown sandals with a buckled ankle loop closure<br/>Premium full grain leather and sheep suede upper for ultimate softness and durability<br/>Adjustable ankle strap for a customized fit<br/>Soft, synthetic suede lining and footbed cover for comfort<br/>Leather covered, foam cushioned footbed for optimal comfort<br/>Compression molded EVA midsole provides lightweight cushioning and shock absorption<br/>Durable rubber lug outsole (15% recycled rubber) for maximum traction<br/><img alt="" src="http://myntra.myntassets.com/images/banners/march2013/1362646952-Timberland-Earthkeepers.jpg"/><br/>Earthkeepers:Earthkeepers products represent Timberland's best efforts at utilizing their environmental values in action.<br/>Warranty: One year warranty against manufacturing defects only</p></li><li class="desc-sub-title ">Material &amp; Care</li><li class="desc-sub-text "><p>Suede and leather<br/>Clean with this <a href="http://www.myntra.com/92347">boot sauce cleaner</a> from Timberland</p></li><li class="desc-sub-title">Size &amp; Fit</li><li class="desc-sub-text"><p>Length: 3"</p></li></ul>,26:02:2014,None
None,Timberland Men Red & Blue Leather Casual Shoes,http://www.myntra.com/Casual-Shoes/Timberland/Timberland-Men-Red-&-Blue-Leather-Casual-Shoes/178221/buy,Rs. 7,990,fashion-sale,Extra 32% Off on 30,Timberland,http://myntra.myntassets.com/images/style/properties/Timberland-Men-Red-&-Blue-Leather-Casual-Shoes_0e34dca2ee256fafeea89eb359dcf1e0_images_1080_1440_mini.jpg,None,None,fashion,http://www.myntra.com/Casual-Shoes/Timberland/Timberland-Men-Red-&-Blue-Leather-Casual-Shoes/178221/buy,Sold byVector Ecommerce Pvt Ltd,None,None,['7', '8', '9', '10'],None,<ul class="mk-pdpv1-product-helper mk-cf"><li class="desc-main-title">Product Description</li><li class="desc-sub-title">Style Note</li><li class="desc-sub-text " itemprop="description"><p>No other brand defines 'comfortably stylish' better than Timberland.  Their cutting edge technology and unmatched designs are a delight for  any wearer. This pair of shoes has been crafted with the best of  materials to give you utmost comfort and style.</p></li><li class="desc-sub-title ">Product Details</li><li class="desc-sub-text"><p>Round toed, red and blue casual shoes with central lace-ups and mid top styling<br/>Leather upper with overlay and stitched detail<br/>Soft tongue, padded footbed with branding<br/>Tough and textured outsole with patterned grooves and branding<br/>Comes with an extra pair of laces<br/><img alt="" src="http://myntra.myntassets.com/images/banners/march2013/1363175803-Timberland-ortholite-comfort-foam-insoles.jpg"/><br/>OrthoLite Insoles – OrthoLite comfort foam insoles provide breathability, moisture transport, anti-microbial function and long-term cushioning. That means the ultra-breathable material won’t break down or lose cushioning over time and your footwear will still be comfortable and supportive, no matter how long they’re worn or how far they go.<br/><br/>Warranty: 1 year warranty against manufacturing defects only</p></li><li class="desc-sub-title ">Material &amp; Care</li><li class="desc-sub-text "><p>Nubuck leather<br/>Use Timberland foam cleaner to clean this product</p></li></ul>,26:02:2014,None
None,Timberland Men Blue Leather Casual Shoes,http://www.myntra.com/Casual-Shoes/Timberland/Timberland-Men-Blue-Leather-Casual-Shoes/178193/buy,Rs. 10,990,fashion-sale,Extra 32% Off on 30,Timberland,http://myntra.myntassets.com/images/style/properties/Timberland-Men-Blue-Leather-Casual-Shoes_71f1e9f4f2b25837c3f4d4e4f81cbe40_images_1080_1440_mini.jpg,None,None,fashion,http://www.myntra.com/Casual-Shoes/Timberland/Timberland-Men-Blue-Leather-Casual-Shoes/178193/buy,Sold byVector Ecommerce Pvt Ltd,None,None,['7', '8', '9', '10', '11'],None,<ul class="mk-pdpv1-product-helper mk-cf"><li class="desc-main-title">Product Description</li><li class="desc-sub-title">Style Note</li><li class="desc-sub-text " itemprop="description"><p>Timberland shoes have a universal appeal, and this is no different. The combination of sleek designs, comfortable constructions and evident environment consciousness has transformed us into loyal followers. This versatile pair can be worn to give your casual outfits a different look or with your leather jacket for an edgy look.</p></li><li class="desc-sub-title ">Product Details</li><li class="desc-sub-text"><p>Round toed, blue casual shoes with central lace-ups and mid top styling<br/>Leather, textured upper with stitched and overlay detail<br/>Reinforced at the heel collar<br/>Soft tongue, padded footbed with branding<br/>Tough and textured outsole with patterned nubs and grooves<br/><img alt="" src="http://myntra.myntassets.com/images/banners/march2013/1362660214-Timberland-Anti-Fatigue.jpg"/><br/>Anti-Fatigue is Timberland’s exclusive footbed technology that uses a system of molded, inverted cones that collapse and return energy. The result – enhanced shock absorption and reduced fatigue. Anti-Fatigue footbeds are made up of a polyurethane compound that utilizes at least 10% natural oil polyols (NOPs) – derived from non-food source plants. NOPs are a renewable resource and environmentally preferred alternative to fossil fuels.<br/><img alt="" src="http://myntra.myntassets.com/images/banners/march2013/1362660064-Timberland-Green-Rubber.jpg"/><br/>Green Rubber – Timberland is the first shoe company to use Green Rubber material in the soles. Green Rubber compound is made using DeLink technology — a process that converts scrap rubber, to a recycled compound that can then be reused in rubber products. Like shoe soles that provide all the traction and durability to live up to their high standards.<br/><img alt="" src="http://myntra.myntassets.com/images/banners/march2013/1363173389-Timberland-gripstick-rubber.jpg"/><br/>Gripstick Rubber – Gripstick Rubber is their stickiest rubber compound that provides improved traction. Sometimes they make it with Green Rubber and then it becomes their stickiest recycled rubber – 42% to be exact.<br/><img alt="" src="http://myntra.myntassets.com/images/banners/march2013/1363357332-Timberland-water.jpg"/><br/>Waterproof – Premium waterproof leather for comfort, durability and abrasion resistance.<br/><br/>Warranty: 1 year warranty against manufacturing defects only</p></li><li class="desc-sub-title ">Material &amp; Care</li><li class="desc-sub-text "><p>Nubuck leather and rubber<br/>Use Timberland foam cleaner to clean this product</p></li></ul>,26:02:2014,None
None,Timberland Women Blue Leather Casual Shoes,http://www.myntra.com/Casual-Shoes/Timberland/Timberland-Women-Blue-Leather-Casual-Shoes/178254/buy,Rs. 7,990,fashion-sale,Extra 32% Off on 30,Timberland,http://myntra.myntassets.com/images/style/properties/Timberland-Women-Blue-Leather-Casual-Shoes_a19f15fd81ef7f99b0923264cbcf669a_images_1080_1440_mini.jpg,None,None,fashion,http://www.myntra.com/Casual-Shoes/Timberland/Timberland-Women-Blue-Leather-Casual-Shoes/178254/buy,Sold byVector Ecommerce Pvt Ltd,None,None,['4', '5', '6', '7'],None,<ul class="mk-pdpv1-product-helper mk-cf"><li class="desc-main-title">Product Description</li><li class="desc-sub-title">Style Note</li><li class="desc-sub-text " itemprop="description"><p>No other brand defines 'comfortably stylish' better than Timberland. Their cutting edge technology and unmatched designs are a delight for any wearer. This pair of shoes has been crafted with the best of materials to give you utmost comfort and style.</p></li><li class="desc-sub-title ">Product Details</li><li class="desc-sub-text"><p>Round toed, blue casual shoes with central lace-ups and low top styling<br/>Leather upper with stitched and overlay detail<br/>Branding at the backfoot<br/>Soft tongue and padded footbed with branding<br/>Tough and textured outsole with patterned grooves<br/>Warranty: 1 year warranty against manufacturing defects only</p></li><li class="desc-sub-title ">Material &amp; Care</li><li class="desc-sub-text "><p>Full grain leather<br/>Use Timberland Maximum to clean this product</p></li></ul>,26:02:2014,None
None,Timberland Men Navy Bayfield Straight Fit Cargo Trousers,http://www.myntra.com/Trousers/Timberland/Timberland-Men-Navy-Bayfield-Straight-Fit-Cargo-Trousers/187034/buy,Rs. 5,490,fashion-sale,Extra 32% Off on 30,Timberland,http://myntra.myntassets.com/images/style/properties/Timberland-Men-Navy-Bayfield-Straight-Fit-Cargo-Trousers_c736069bb2deb9c23d731e6319e31592_images_1080_1440_mini.jpg,None,None,fashion,http://www.myntra.com/Trousers/Timberland/Timberland-Men-Navy-Bayfield-Straight-Fit-Cargo-Trousers/187034/buy,Sold byVector Ecommerce Pvt Ltd,None,None,['30', '32', '34', '36', '38'],None,<ul class="mk-pdpv1-product-helper mk-cf"><li class="desc-main-title">Product Description</li><li class="desc-sub-title">Style Note</li><li class="desc-sub-text " itemprop="description"><p>Diversify your wardrobe with this pair of cargo trousers from Timberland that are a great alternative to denim. Team them with a combat style shirt, bomber jacket and leather trainers for a relaxed weekend brunch with friends.</p></li><li class="desc-sub-title ">Product Details</li><li class="desc-sub-text"><p>Dark navy cargo trousers, zip and buttoned closure, slant pockets at the sides, waistband with belt loops, cargo pockets with buttoned flap closure at the thighs, welt pockets on the back, brand patch above right back pocket<br/> <img alt="" src="http://myntra.myntassets.com/images/banners/march2013/1362646952-Timberland-Earthkeepers.jpg"/><br/>Earthkeepers® - Earthkeepers products represent Timberland's best efforts at utilizing their environmental values in action</p></li><li class="desc-sub-title ">Material &amp; Care</li><li class="desc-sub-text "><p>100% cotton <br/>Machine wash cold</p></li><li class="desc-sub-title">Size &amp; Fit</li><li class="desc-sub-text"><p>Straight fit<br/>The model (height 6' and waist 32") is wearing a size 32</p></li></ul>,26:02:2014,None
None,Timberland Men Charcoal Black Shorts,http://www.myntra.com/Shorts/Timberland/Timberland-Men-Charcoal-Black-Shorts/187037/buy,Rs. 3,990,fashion-sale,Extra 32% Off on 30,Timberland,http://myntra.myntassets.com/images/style/properties/Timberland-Men-Trousers_d6ce75025a083e6af16121bf30de935a_images_1080_1440_mini.jpg,None,None,fashion,http://www.myntra.com/Shorts/Timberland/Timberland-Men-Charcoal-Black-Shorts/187037/buy,Sold byVector Ecommerce Pvt Ltd,None,None,['30', '32', '34', '36'],None,<ul class="mk-pdpv1-product-helper mk-cf"><li class="desc-main-title">Product Description</li><li class="desc-sub-title">Style Note</li><li class="desc-sub-text " itemprop="description"><p>Fresh air, great friends, good times - Timberland builds the gear that connects them all! This pair of shorts from the brand is specially formulated with organic content. Wear it with a polo tee and trekking shoes on an adventurous weekend with friends for a simply stylish look.</p></li><li class="desc-sub-title ">Product Details</li><li class="desc-sub-text"><p>Charcoal black shorts, has button and zipped fly closure, slant pockets on sides, belt loops at waistband, insert pockets at the back with flap and buttoned closure, brand embroidery above right back pocket<br/> <img alt="" src="http://myntra.myntassets.com/images/banners/march2013/1362646952-Timberland-Earthkeepers.jpg"/><br/>Earthkeepers® - Earthkeepers products represent Timberland's best efforts at utilizing their environmental values in action</p></li><li class="desc-sub-title ">Material &amp; Care</li><li class="desc-sub-text "><p>50% organic cotton, 50% cotton<br/>Machine wash cold</p></li><li class="desc-sub-title">Size &amp; Fit</li><li class="desc-sub-text"><p>Regular fit<br/>The model (height 6' and waist 32") is wearing a size 32</p></li></ul>,26:02:2014,None
