None,Fort Collins Women Grey Melange Hooded Sweatshirt,http://www.myntra.com/sweatshirts/fort-collins/fort-collins-women-grey-melange-hooded-sweatshirt/221272/buy,Rs. 1,035,women-sweaters-sweatshirts,Sweaters & Sweatshirts,ONLY,http://myntra.myntassets.com/images/style/properties/Fort-Collins-Women-Grey-Melange-Hooded-Sweatshirt_e2a4ce3475961c1b2192e4a97ea7256e_images_1080_1440_mini.jpg,Rs. 1,150,None,women,http://www.myntra.com/sweatshirts/fort-collins/fort-collins-women-grey-melange-hooded-sweatshirt/221272/buy,Sold byVector Ecommerce Pvt Ltd,None,None,['M', 'L', 'XL', 'XXL'],None,<ul class="mk-pdpv1-product-helper mk-cf"><li class="desc-main-title">Product Description</li><li class="desc-sub-title">Style Note</li><li class="desc-sub-text " itemprop="description"><p>Stay warm and stylish in this comfortable sweatshirt from Fort Collins. Style this with a casual T-shirt, skinny jeans and a pair of knee high boots for a sassy winter look.</p></li><li class="desc-sub-title ">Product Details</li><li class="desc-sub-text"><p>Grey melange sweatshirt, has an attached hood with contrast lining and drawstrings, long sleeves with ribbed cuffs, full zipped closure at front, branding on left chest, insert pockets at front waist, ribbed hemline, fleece lined</p></li><li class="desc-sub-title ">Material &amp; Care</li><li class="desc-sub-text "><p>Cotton blend<br/>Machine wash gentle</p></li><li class="desc-sub-title">Size &amp; Fit</li><li class="desc-sub-text"><p>The model (height 5'8" and chest 33") is wearing a size M</p></li></ul>,25:02:2014,None
None,Wills Lifestyle Women Navy Knit Sweater,http://www.myntra.com/sweaters/wills-lifestyle/wills-lifestyle-women-navy-knit-sweater/181320/buy,Rs. 1,949,women-sweaters-sweatshirts,Sweaters & Sweatshirts,ONLY,http://myntra.myntassets.com/images/style/properties/Wills-Lifestyle-Women-Navy-Knit-Sweater_2ccab1b302c124fd80859fa07ff0b4e7_images_1080_1440_mini.jpg,Rs. 2,599,None,women,http://www.myntra.com/sweaters/wills-lifestyle/wills-lifestyle-women-navy-knit-sweater/181320/buy,Sold byVector Ecommerce Pvt Ltd,None,None,['S', 'M', 'L', 'XL'],None,<ul class="mk-pdpv1-product-helper mk-cf"><li class="desc-main-title">Product Description</li><li class="desc-sub-title">Style Note</li><li class="desc-sub-text " itemprop="description"><p>Get trendy with this sweater from Wills Lifestyle, a piece that is designed to add more elegance to your winter collection. Pair it with your daily wear to add a classy touch to your look.</p></li><li class="desc-sub-title ">Product Details</li><li class="desc-sub-text"><p>Navy sweater with knitted pattern throughout, stylised buckle closure at front, ribbed shawl lapels, long sleeves with ribbed cuffs, ribbed hem</p></li><li class="desc-sub-title ">Material &amp; Care</li><li class="desc-sub-text "><p>100% acrylic<br/>Hand wash cold</p></li><li class="desc-sub-title">Size &amp; Fit</li><li class="desc-sub-text"><p>Regular fit<br/>The model (height 5'8" and chest 33") is wearing a size S</p></li></ul>,25:02:2014,None
None,Fort Collins Women Navy Hooded Sweatshirt,http://www.myntra.com/sweatshirts/fort-collins/fort-collins-women-navy-hooded-sweatshirt/221275/buy,Rs. 1,035,women-sweaters-sweatshirts,Sweaters & Sweatshirts,ONLY,http://myntra.myntassets.com/images/style/properties/Fort-Collins-Women-Navy-Hooded-Sweatshirt_7576166a7380c716780cfd4b8b74dcd4_images_1080_1440_mini.jpg,Rs. 1,150,None,women,http://www.myntra.com/sweatshirts/fort-collins/fort-collins-women-navy-hooded-sweatshirt/221275/buy,Sold byVector Ecommerce Pvt Ltd,None,None,['M', 'L', 'XL', 'XXL'],None,<ul class="mk-pdpv1-product-helper mk-cf"><li class="desc-main-title">Product Description</li><li class="desc-sub-title">Style Note</li><li class="desc-sub-text " itemprop="description"><p>Warm and cosy, this piece from Fort Collins is a must-have in your winter wardrobe. Wear it with casual jeans and sneakers for a casual outing with friends.</p></li><li class="desc-sub-title ">Product Details</li><li class="desc-sub-text"><p>Navy blue sweashirt, knitted, has an attached hood with drawstrings, long sleeves with ribbed cuffs, full zipped closure at front, embroidered branding at chest, kangaroo pockets at front waist, ribbed hem, fleece lining</p></li><li class="desc-sub-title ">Material &amp; Care</li><li class="desc-sub-text "><p>Cotton blend<br/>Wash inside out</p></li><li class="desc-sub-title">Size &amp; Fit</li><li class="desc-sub-text"><p>The model (height 5'8" and chest 33") is wearing a size M</p></li></ul>,25:02:2014,None
None,United Colors Of Benetton Women Pink & White Striped Sweater,http://www.myntra.com/sweaters/united-colors-of-benetton/united-colors-of-benetton-women-pink-white-striped/230250/buy,Rs. 1,699,women-sweaters-sweatshirts,Sweaters & Sweatshirts,ONLY,http://myntra.myntassets.com/images/style/properties/United-Colors-Of-Benetton-Women-Pink-&-White-Stripe-Sweater_91138dcc76145917c55b3cfe22e8187e_images_1080_1440_mini.jpg,None,None,women,http://www.myntra.com/sweaters/united-colors-of-benetton/united-colors-of-benetton-women-pink-white-striped/230250/buy,Sold byVector Ecommerce Pvt Ltd,None,None,['XS', 'S', 'M', 'L', 'XL'],None,<ul class="mk-pdpv1-product-helper mk-cf"><li class="desc-main-title">Product Description</li><li class="desc-sub-title">Style Note</li><li class="desc-sub-text " itemprop="description"><p>Sport a girl-next-door look with this piece from UCB. Wear it with casual jeans and a woolen cap for a chic look.</p></li><li class="desc-sub-title ">Product Details</li><li class="desc-sub-text"><p>Pink and white striped sweater, knitted, ribbed round neck, three quarter sleeves with stylised ribbed cuffs, brand tag towards front hem, ribbed hemline</p></li><li class="desc-sub-title ">Material &amp; Care</li><li class="desc-sub-text "><p>89% cotton, 8% nylon, 3% Spandex<br/>Hand wash cold</p></li><li class="desc-sub-title">Size &amp; Fit</li><li class="desc-sub-text"><p>The model (height 5'8" and chest 33") is wearing a size S</p></li></ul>,25:02:2014,None
None,United Colors Of Benetton Women Multi-Coloured Sweater,http://www.myntra.com/sweaters/united-colors-of-benetton/united-colors-of-benetton-women-multi-coloured-swe/232807/buy,Rs. 1,999,women-sweaters-sweatshirts,Sweaters & Sweatshirts,ONLY,http://myntra.myntassets.com/images/style/properties/United-Colors-Of-Benetton-Women-Multi-Coloured-Sweater_562e46e9711e38075ce295dd8663dd7d_images_1080_1440_mini.jpg,None,None,women,http://www.myntra.com/sweaters/united-colors-of-benetton/united-colors-of-benetton-women-multi-coloured-swe/232807/buy,Sold byVector Ecommerce Pvt Ltd,None,None,['XS', 'S', 'M', 'L'],None,<ul class="mk-pdpv1-product-helper mk-cf"><li class="desc-main-title">Product Description</li><li class="desc-sub-title">Style Note</li><li class="desc-sub-text " itemprop="description"><p>Step out in style this season with this piece from UCB. Wear it with casual jeans and ballerinas for a casual look.</p></li><li class="desc-sub-title ">Product Details</li><li class="desc-sub-text"><p>Multi-coloured sweater,knitted, ribbed round neck, short sleeves, ribbed hemline</p></li><li class="desc-sub-title ">Material &amp; Care</li><li class="desc-sub-text "><p>100% cotton<br/>Machine wash cold</p></li><li class="desc-sub-title">Size &amp; Fit</li><li class="desc-sub-text"><p>The model (height 5'8" and chest 33") is wearing a size S</p></li></ul>,25:02:2014,None
None,DressBerry Women Red Shrug,http://www.myntra.com/shrug/dressberry/dressberry-women-red-shrug/211148/buy,Rs. 699,women-sweaters-sweatshirts,Sweaters & Sweatshirts,ONLY,http://myntra.myntassets.com/images/style/properties/DressBerry-Women-Red-Shrug_9600b3562dfd843abfe6a8491c3cc673_images_1080_1440_mini.jpg,None,None,women,http://www.myntra.com/shrug/dressberry/dressberry-women-red-shrug/211148/buy,Sold byVector Ecommerce Pvt Ltd,None,None,['S', 'M', 'L', 'XL'],None,<ul class="mk-pdpv1-product-helper mk-cf"><li class="desc-main-title">Product Description</li><li class="desc-sub-title">Style Note</li><li class="desc-sub-text " itemprop="description"><p>In any season, outerwear should be lightweight and comfortable and this unique shrug from DressBerry is tailored for the same. Layer it over a tank top, worn with jeans for maximum effect.</p></li><li class="desc-sub-title ">Product Details</li><li class="desc-sub-text"><p>Red shrug, knitted, open front extended, short sleeves, curved hemline, raw edges</p></li><li class="desc-sub-title ">Material &amp; Care</li><li class="desc-sub-text "><p>Rayon<br/>Hand wash cold</p></li><li class="desc-sub-title">Size &amp; Fit</li><li class="desc-sub-text"><p>The model (height 5'8" and chest 33") is wearing a size S</p></li></ul>,25:02:2014,None
None,Fort Collins Women Grey Melange Hooded Sweatshirt,http://www.myntra.com/sweatshirts/fort-collins/fort-collins-women-grey-melange-hooded-sweatshirt/221273/buy,Rs. 1,035,women-sweaters-sweatshirts,Sweaters & Sweatshirts,ONLY,http://myntra.myntassets.com/images/style/properties/Fort-Collins-Women-Grey-Hooded-Sweatshirt_3b1b19bed078f0910c18c8649b739e85_images_1080_1440_mini.jpg,Rs. 1,150,None,women,http://www.myntra.com/sweatshirts/fort-collins/fort-collins-women-grey-melange-hooded-sweatshirt/221273/buy,Sold byVector Ecommerce Pvt Ltd,None,None,['M', 'L', 'XL', 'XXL'],None,<ul class="mk-pdpv1-product-helper mk-cf"><li class="desc-main-title">Product Description</li><li class="desc-sub-title">Style Note</li><li class="desc-sub-text " itemprop="description"><p>Warm and cosy, this piece from Fort Collins is a must-have in your winter wardrobe. Wear it with casual jeans and sneakers for a casual outing with friends.</p></li><li class="desc-sub-title ">Product Details</li><li class="desc-sub-text"><p>Grey melange sweashirt, knitted, has an attached hood with drawstrings, long sleeves with ribbed cuffs, full zipped closure at front, embroidered branding at chest, kangaroo pockets at front waist, ribbed hem, fleece lining</p></li><li class="desc-sub-title ">Material &amp; Care</li><li class="desc-sub-text "><p>Cotton blend<br/>Wash inside out</p></li><li class="desc-sub-title">Size &amp; Fit</li><li class="desc-sub-text"><p>The model (height 5'8" and chest 33") is wearing a size M</p></li></ul>,25:02:2014,None
None,Levis Women Black Rosa Sweater,http://www.myntra.com/sweaters/levis/levis-women-black-rosa-sweater/180416/buy,Rs. 1,539,women-sweaters-sweatshirts,Sweaters & Sweatshirts,ONLY,http://myntra.myntassets.com/images/style/properties/Levis-Women-Sweaters_e3b45355d7bcff6bda74ce69ff26da30_images_1080_1440_mini.jpg,Rs. 2,199,None,women,http://www.myntra.com/sweaters/levis/levis-women-black-rosa-sweater/180416/buy,Sold byVector Ecommerce Pvt Ltd,None,None,['XS', 'S', 'M', 'L'],None,<ul class="mk-pdpv1-product-helper mk-cf"><li class="desc-main-title">Product Description</li><li class="desc-sub-title">Style Note</li><li class="desc-sub-text " itemprop="description"><p>Look stylish with this elegant sweater from Levi's. Wear it over a tight T-shirt to beat the chills away.</p></li><li class="desc-sub-title ">Product Details</li><li class="desc-sub-text"><p>Black sweater, knitted, has a V neck, long sleeves with ribbed cuffs, full buttoned placket at front, ribbed hem, metal branding on the left side, above the hem</p></li><li class="desc-sub-title ">Material &amp; Care</li><li class="desc-sub-text "><p>80% acrylic, 20% wool<br/>Machine wash cold</p></li><li class="desc-sub-title">Size &amp; Fit</li><li class="desc-sub-text"><p>Regular fit<br/>The model (height 5'8" and chest 33") is wearing a size S</p></li></ul>,25:02:2014,None
None,Levis Women Black Hooded Sweater,http://www.myntra.com/sweaters/levis/levis-women-black-hooded-sweater/180413/buy,Rs. 1,539,women-sweaters-sweatshirts,Sweaters & Sweatshirts,ONLY,http://myntra.myntassets.com/images/style/properties/Levis-Women-Black-Hooded-Sweater_0dbb1c9f878ed3757b3492744664aa43_images_1080_1440_mini.jpg,Rs. 2,199,None,women,http://www.myntra.com/sweaters/levis/levis-women-black-hooded-sweater/180413/buy,Sold byVector Ecommerce Pvt Ltd,None,None,['XS', 'S', 'M', 'L'],None,<ul class="mk-pdpv1-product-helper mk-cf"><li class="desc-main-title">Product Description</li><li class="desc-sub-title">Style Note</li><li class="desc-sub-text " itemprop="description"><p>This gorgeous sweater by Levi's is a piece that can be easily thrown on when you're in a rush and still look fab. Best paired with tank top, distressed denims and canvas trainers.</p></li><li class="desc-sub-title ">Product Details</li><li class="desc-sub-text"><p>Black sweater, knitted, hooded, long sleeves with ribbed cuffs, full zipped front, stylised pouch pockets with ribbed detail at mouth, metal brand tag towards front hem, ribbed hemline</p></li><li class="desc-sub-title ">Material &amp; Care</li><li class="desc-sub-text "><p>80% acrylic, 20% wool<br/>Machine wash cold</p></li><li class="desc-sub-title">Size &amp; Fit</li><li class="desc-sub-text"><p>Regular fit<br/>The model (height 5'8" and chest 33") is wearing a size S</p></li></ul>,25:02:2014,None
None,Fort Collins Women Black Hooded Sweatshirt,http://www.myntra.com/sweatshirts/fort-collins/fort-collins-women-black-hooded-sweatshirt/221269/buy,Rs. 1,035,women-sweaters-sweatshirts,Sweaters & Sweatshirts,ONLY,http://myntra.myntassets.com/images/style/properties/Fort-Collins-Women-Sweatshirts_52072499a854e81462c207c71047c331_images_1080_1440_mini.jpg,Rs. 1,150,None,women,http://www.myntra.com/sweatshirts/fort-collins/fort-collins-women-black-hooded-sweatshirt/221269/buy,Sold byVector Ecommerce Pvt Ltd,None,None,['M', 'L', 'XL', 'XXL'],None,<ul class="mk-pdpv1-product-helper mk-cf"><li class="desc-main-title">Product Description</li><li class="desc-sub-title">Style Note</li><li class="desc-sub-text " itemprop="description"><p>This sweatshirt from Fort Collins is designed to keep you warm and give you great comfort. Wear it on a chilly morning or a lazy afternoon with a pair of denim jeans.</p></li><li class="desc-sub-title ">Product Details</li><li class="desc-sub-text"><p>Black sweatshirt, knitted, hooded with drawstring fastening, long sleeves with ribbed cuffs, full zipped front closure, embroidered branding on left chest, insert pockets on either side of front waist, ribbed hem</p></li><li class="desc-sub-title ">Material &amp; Care</li><li class="desc-sub-text "><p>Cotton<br/>Hand wash</p></li><li class="desc-sub-title">Size &amp; Fit</li><li class="desc-sub-text"><p>Regular fit<br/>The model (height 5'8" and chest 33") is wearing a size M</p><p> </p></li></ul>,25:02:2014,None
None,Silver Strings Women Green Short Shrug,http://www.myntra.com/shrug/silver-strings/silver-strings-women-green-short-shrug/137391/buy,Rs. 399,women-sweaters-sweatshirts,Sweaters & Sweatshirts,ONLY,http://myntra.myntassets.com/images/style/properties/Silver-Strings-Women-Green-Short-Shrug_2c827cd9fcd8513b542ff2d2b9dc3e94_images_1080_1440_mini.jpg,None,None,women,http://www.myntra.com/shrug/silver-strings/silver-strings-women-green-short-shrug/137391/buy,Sold byVector Ecommerce Pvt Ltd,None,None,['S', 'M', 'L', 'XL'],None,<ul class="mk-pdpv1-product-helper mk-cf"><li class="desc-main-title">Product Description</li><li class="desc-sub-title">Style Note</li><li class="desc-sub-text " itemprop="description"><p>Available in enticing hues, you can now cover-up in style with a range of shrugs from Silver Strings. The soft lightweight knit makes this piece a great pick for warmer days. Layer it over summer dresses or tank tops worn with jeans for maximum effect.</p></li><li class="desc-sub-title ">Product Details</li><li class="desc-sub-text"><p>Green shrug, knit, band along front opening continuing onto curved back hem, three quarter sleeves with band along hems</p></li><li class="desc-sub-title ">Material &amp; Care</li><li class="desc-sub-text "><p>95% viscose, 5% elastane<br/>Hand wash</p></li><li class="desc-sub-title">Size &amp; Fit</li><li class="desc-sub-text"><p>The model (height 5'8" and chest 33") is wearing a size M</p></li></ul>,25:02:2014,None
None,Roadster Women Beige & Green Striped Sweater,http://www.myntra.com/sweaters/roadster/roadster-women-beige-green-striped-sweater/210225/buy,Rs. 468,women-sweaters-sweatshirts,Sweaters & Sweatshirts,ONLY,http://myntra.myntassets.com/images/style/properties/Roadster-Women-Beige-&-Green-Striped-Sweater_2a803c2082994c1a94efd450f10ddd26_images_1080_1440_mini.jpg,Rs. 1,199,None,women,http://www.myntra.com/sweaters/roadster/roadster-women-beige-green-striped-sweater/210225/buy,Sold byVector Ecommerce Pvt Ltd,None,None,['S', 'M', 'L', 'XL'],None,<ul class="mk-pdpv1-product-helper mk-cf"><li class="desc-main-title">Product Description</li><li class="desc-sub-title">Style Note</li><li class="desc-sub-text " itemprop="description"><p>Dress up in style this winter with Roadster's range of snug sweaters. This piece is best styled with distressed boyfriend denim jeans and canvas slip-ons.</p></li><li class="desc-sub-title ">Product Details</li><li class="desc-sub-text"><p>Beige and green striped sweater, has a ribbed V neck, attached hood with ribbed detailing, long sleeves with fold over ribbed cuffs, stitch detail near arm holes, kangaroo pockets at front waist, vented hem, rolled hemline</p></li><li class="desc-sub-title ">Material &amp; Care</li><li class="desc-sub-text "><p>100% acrylic<br/>Dry clean preferred</p></li><li class="desc-sub-title">Size &amp; Fit</li><li class="desc-sub-text"><p>The model (height 5'8" and chest 33") is wearing a size S</p></li></ul>,25:02:2014,None
None,Puma Women Black Sleeveless Cardigan,http://www.myntra.com/sweaters/puma/puma-women-black-sleeveless-cardigan/154996/buy,Rs. 1,399,women-sweaters-sweatshirts,Sweaters & Sweatshirts,ONLY,http://myntra.myntassets.com/images/style/properties/Puma-Women-Black-Sleeveless-Cardigan_b42e83cba1ca06a057dd31875eab466e_images_1080_1440_mini.jpg,Rs. 1,999,None,women,http://www.myntra.com/sweaters/puma/puma-women-black-sleeveless-cardigan/154996/buy,Sold byVector Ecommerce Pvt Ltd,None,None,['S', 'M', 'L', 'XL'],None,<ul class="mk-pdpv1-product-helper mk-cf"><li class="desc-main-title">Product Description</li><li class="desc-sub-title">Style Note</li><li class="desc-sub-text " itemprop="description"><p>Cover-up in style this monsoon with this lovely sleeveless cardigan from Puma. We recommend styling it over a plain long sleeved tee and distressed jeans for best results.</p></li><li class="desc-sub-title ">Product Details</li><li class="desc-sub-text"><p>Black cardigan, shawl neck, sleeveless with ribbed arm holes, buttoned placket down front, patch pockets at front waist, embroidered branding towards front hem, ribbed hemline</p></li><li class="desc-sub-title ">Material &amp; Care</li><li class="desc-sub-text "><p>100% cotton<br/>Machine wash cold</p></li><li class="desc-sub-title">Size &amp; Fit</li><li class="desc-sub-text"><p>The model (height 5'8" and chest 33") is wearing a size M</p></li></ul>,25:02:2014,None
None,Fort Collins Women Burgundy Sweatshirt,http://www.myntra.com/sweatshirts/fort-collins/fort-collins-women-burgundy-sweatshirt/221270/buy,Rs. 1,035,women-sweaters-sweatshirts,Sweaters & Sweatshirts,ONLY,http://myntra.myntassets.com/images/style/properties/Fort-Collins-Women-Burgundy-Sweatshirt_40b3a1c12315d767202c5e3ccf999c17_images_1080_1440_mini.jpg,Rs. 1,150,None,women,http://www.myntra.com/sweatshirts/fort-collins/fort-collins-women-burgundy-sweatshirt/221270/buy,Sold byVector Ecommerce Pvt Ltd,None,None,['M', 'L', 'XL', 'XXL'],None,<ul class="mk-pdpv1-product-helper mk-cf"><li class="desc-main-title">Product Description</li><li class="desc-sub-title">Style Note</li><li class="desc-sub-text " itemprop="description"><p>Stay warm and stylish in this comfortable sweatshirt from Fort Collins. Style this with a casual T-shirt, skinny jeans and a pair of knee high boots for a sassy winter look.</p></li><li class="desc-sub-title ">Product Details</li><li class="desc-sub-text"><p>Burgundy sweatshirt, knitted, has a hood with drawstring fastening, full zipped front, long sleeves with ribbed cuffs, embroidered brand detail at left chest, two insert pockets at waist above ribbed hem, fleece lined</p></li><li class="desc-sub-title ">Material &amp; Care</li><li class="desc-sub-text "><p>Cotton blend<br/>Machine wash warm</p></li><li class="desc-sub-title">Size &amp; Fit</li><li class="desc-sub-text"><p>The model (height 5'8" and chest 33") is wearing a size M</p></li></ul>,25:02:2014,None
None,Femella Women Brown & Grey Melange Reversible Sweater,http://www.myntra.com/sweaters/femella/femella-women-brown-grey-melange-reversible-sweate/225414/buy,Rs. 818,women-sweaters-sweatshirts,Sweaters & Sweatshirts,ONLY,http://myntra.myntassets.com/images/style/properties/Femella-Women-Brown-&-Grey-Melange-Reversible-Sweater_81d04548df9ed6faeeda1ed947985d56_images_1080_1440_mini.jpg,Rs. 1,090,None,women,http://www.myntra.com/sweaters/femella/femella-women-brown-grey-melange-reversible-sweate/225414/buy,Sold byVector Ecommerce Pvt Ltd,None,None,['XS', 'S', 'M', 'L', 'XL', 'XXL'],None,<ul class="mk-pdpv1-product-helper mk-cf"><li class="desc-main-title">Product Description</li><li class="desc-sub-title">Style Note</li><li class="desc-sub-text " itemprop="description"><p>This pretty sweater by Femella is a piece that can be easily thrown on when you're in a rush and still look fab. Pair it with tank top and distressed denims and canvas trainers.</p></li><li class="desc-sub-title ">Product Details</li><li class="desc-sub-text"><p>Light brown and grey mélange reversible sweater<br/>Light brown sweater, knit, ribbed V neck, long sleeves with cuffs, panelled at back and hem<br/>Grey mélange on the reverse side, ribbed V neck, knit, long sleeves with cuffs, panelled back and hem</p></li><li class="desc-sub-title ">Material &amp; Care</li><li class="desc-sub-text "><p>Wool blend<br/>Dry clean only</p></li><li class="desc-sub-title">Size &amp; Fit</li><li class="desc-sub-text"><p>The model (height 5'8" and chest 33") is wearing a size S</p></li></ul>,25:02:2014,None
None,Fort Collins Women Red Hooded Sweatshirt,http://www.myntra.com/sweatshirts/fort-collins/fort-collins-women-red-hooded-sweatshirt/221274/buy,Rs. 1,035,women-sweaters-sweatshirts,Sweaters & Sweatshirts,ONLY,http://myntra.myntassets.com/images/style/properties/Fort-Collins-Women-Sweatshirts_a3cc88beba6577b66bdbe7efd1e572ca_images_1080_1440_mini.jpg,Rs. 1,150,None,women,http://www.myntra.com/sweatshirts/fort-collins/fort-collins-women-red-hooded-sweatshirt/221274/buy,Sold byVector Ecommerce Pvt Ltd,None,None,['M', 'L', 'XL', 'XXL'],None,<ul class="mk-pdpv1-product-helper mk-cf"><li class="desc-main-title">Product Description</li><li class="desc-sub-title">Style Note</li><li class="desc-sub-text " itemprop="description"><p>This sweatshirt from Fort Collins is designed to keep you warm and give you great comfort. Wear it on a chilly morning or a lazy afternoon with a pair of denim jeans.</p></li><li class="desc-sub-title ">Product Details</li><li class="desc-sub-text"><p>Red sweatshirt, knitted, hooded with drawstring fastening, long sleeves with ribbed cuffs, full zipped front closure, embroidered branding on left chest, insert pockets on either side of front waist, ribbed hem</p></li><li class="desc-sub-title ">Material &amp; Care</li><li class="desc-sub-text "><p>Cotton<br/>Hand wash</p></li><li class="desc-sub-title">Size &amp; Fit</li><li class="desc-sub-text"><p>Regular fit<br/>The model (height 5'8" and chest 33") is wearing a size M</p></li></ul>,25:02:2014,None
None,Alibi Women Off-White Printed Sweatshirt,http://www.myntra.com/sweatshirts/alibi/alibi-women-off-white-printed-sweatshirt/232806/buy,Rs. 899,women-sweaters-sweatshirts,Sweaters & Sweatshirts,ONLY,http://myntra.myntassets.com/images/style/properties/Alibi-Women-Light-Grey-Melange-Printed-Sweatshirt_bc43df61e702b3af9a2d4258080d3bb2_images_1080_1440_mini.jpg,None,None,women,http://www.myntra.com/sweatshirts/alibi/alibi-women-off-white-printed-sweatshirt/232806/buy,Sold byVector Ecommerce Pvt Ltd,None,None,['XS', 'S', 'M', 'L', 'XL'],None,<ul class="mk-pdpv1-product-helper mk-cf"><li class="desc-main-title">Product Description</li><li class="desc-sub-title">Style Note</li><li class="desc-sub-text " itemprop="description"><p>Stay stylish this winter in this pretty sweatshirt by Alibi. We recommend that you try matching this piece with a pair of skinny jeans or short and high-tops for a fun casual ensemble.</p></li><li class="desc-sub-title ">Product Details</li><li class="desc-sub-text"><p>Off-white printed sweatshirt, contrast round neck in a french terry knit pattern, long sleeves with cuffs in a french terry knit pattern, contrast sheer panel that extends from shoulder down the back, terry knit patterned hem</p></li><li class="desc-sub-title ">Material &amp; Care</li><li class="desc-sub-text "><p>100% cotton<br/>Machine wash</p></li><li class="desc-sub-title">Size &amp; Fit</li><li class="desc-sub-text"><p>The model (height 5'8" and chest 33") is wearing a size S</p></li></ul>,25:02:2014,None
