None,Style Quotient Women Blue Hay Shrug,http://www.myntra.com/shrug/style-quotient/style-quotient-women-blue-hay-shrug/220694/buy,Rs. 509,women-sweaters-sweatshirts,Sweaters & Sweatshirts,ONLY,http://myntra.myntassets.com/images/style/properties/Style-Quotient-Women-Blue-Hay-Shrug_3dd4fa81889e1318741b468d04bc0f21_images_1080_1440_mini.jpg,Rs. 599,None,women,http://www.myntra.com/shrug/style-quotient/style-quotient-women-blue-hay-shrug/220694/buy,Sold byVector Ecommerce Pvt Ltd,None,None,['XS', 'S', 'M', 'L', 'XL'],None,<ul class="mk-pdpv1-product-helper mk-cf"><li class="desc-main-title">Product Description</li><li class="desc-sub-title">Style Note</li><li class="desc-sub-text " itemprop="description"><p>Throw on this super-stylish shrug by Style Quotient to withstand the chilly morning air. We love its soft fabric composition and suggest that you try layering it over your tube dresses and tank tops.</p></li><li class="desc-sub-title ">Product Details</li><li class="desc-sub-text"><p>Blue shrug, knitted, stylised notch collar with button and tab closure below, cap sleeves, open front, yoke at front and back with gathers below</p></li><li class="desc-sub-title ">Material &amp; Care</li><li class="desc-sub-text "><p>Cotton blend<br/>Hand wash</p></li><li class="desc-sub-title">Size &amp; Fit</li><li class="desc-sub-text"><p>The model (height 5'8" and chest 33") is wearing a size S</p></li></ul>,25:02:2014,None
None,Lee Women Navy Sweatshirt,http://www.myntra.com/sweatshirts/lee/lee-women-navy-sweatshirt/174416/buy,Rs. 1,799,women-sweaters-sweatshirts,Sweaters & Sweatshirts,ONLY,http://myntra.myntassets.com/images/style/properties/Lee-Women-Navy-Sweatshirt_431bec8ebc5dcb65792d0e0588bacd7c_images_1080_1440_mini.jpg,None,None,women,http://www.myntra.com/sweatshirts/lee/lee-women-navy-sweatshirt/174416/buy,Sold byVector Ecommerce Pvt Ltd,None,None,['S', 'M', 'L', 'XL'],None,<ul class="mk-pdpv1-product-helper mk-cf"><li class="desc-main-title">Product Description</li><li class="desc-sub-title">Style Note</li><li class="desc-sub-text " itemprop="description"><p>Keep your style intact even during the cold days with this sweatshirt from Lee. Wear this piece with over-dyed denims and high top trainers for the best look.</p></li><li class="desc-sub-title ">Product Details</li><li class="desc-sub-text"><p>Navy sweatshirt, knitted, has a mock collar, long sleeves, full zipped front, insert pockets at the sides, metallic brand tag above left hem</p></li><li class="desc-sub-title ">Material &amp; Care</li><li class="desc-sub-text "><p>100% polyester<br/>Dry clean only</p></li><li class="desc-sub-title">Size &amp; Fit</li><li class="desc-sub-text"><p>Regular fit<br/>The model (height 6' and shoulders 18") is wearing a size S</p></li></ul>,25:02:2014,None
None,Riot Red Shrug,http://www.myntra.com/shrug/riot/riot-red-shrug/233413/buy,Rs. 699,women-sweaters-sweatshirts,Sweaters & Sweatshirts,ONLY,http://myntra.myntassets.com/images/style/properties/Riot-Red-Shrug_8ab7e2e30d62acc41f370024fc01108c_images_1080_1440_mini.jpg,None,None,women,http://www.myntra.com/shrug/riot/riot-red-shrug/233413/buy,Sold byVector Ecommerce Pvt Ltd,None,None,['S', 'M', 'L', 'XL'],None,<ul class="mk-pdpv1-product-helper mk-cf"><li class="desc-main-title">Product Description</li><li class="desc-sub-title">Style Note</li><li class="desc-sub-text " itemprop="description"><p>In any season, outerwear should be light-weight and comfortable. The versatility of this eye-catching shrug from Riot is endless. Layer it over tops, tunics and dresses for a chic look.</p></li><li class="desc-sub-title ">Product Details</li><li class="desc-sub-text"><p>Red shrug, knitted, panelled shawl collar that extends down an open front, three quarter length sleeves with buttoned tab feature, back hem longer than front</p></li><li class="desc-sub-title ">Material &amp; Care</li><li class="desc-sub-text "><p>100% viscose<br/>Machine wash cold</p></li><li class="desc-sub-title">Size &amp; Fit</li><li class="desc-sub-text"><p>The model (height 5'8" and chest 33") is wearing a size S</p></li></ul>,25:02:2014,None
None,Alibi Women Light Grey Melange Printed Sweatshirt,http://www.myntra.com/sweatshirts/alibi/alibi-women-light-grey-melange-printed-sweatshirt/232801/buy,Rs. 899,women-sweaters-sweatshirts,Sweaters & Sweatshirts,ONLY,http://myntra.myntassets.com/images/style/properties/Alibi-Women-Light-Grey-Melange-Printed-Sweatshirt_36efeeb362cebfa5a1d4d7062cce7030_images_1080_1440_mini.jpg,None,None,women,http://www.myntra.com/sweatshirts/alibi/alibi-women-light-grey-melange-printed-sweatshirt/232801/buy,Sold byVector Ecommerce Pvt Ltd,None,None,['XS', 'S', 'M', 'L', 'XL'],None,<ul class="mk-pdpv1-product-helper mk-cf"><li class="desc-main-title">Product Description</li><li class="desc-sub-title">Style Note</li><li class="desc-sub-text " itemprop="description"><p>Stay warm in style with the new range of sweatshirts from Alibi. Crafted for a trendy appeal, you can team this piece with jeans and skimmers for a perfect ensemble.</p></li><li class="desc-sub-title ">Product Details</li><li class="desc-sub-text"><p>Light grey melange sweatshirt, has a ribbed round neck, long sleeves with ribbed cuffs, embellished skull print at chest, ribbed hem</p></li><li class="desc-sub-title ">Material &amp; Care</li><li class="desc-sub-text "><p>100% cotton<br/>Machine wash</p></li><li class="desc-sub-title">Size &amp; Fit</li><li class="desc-sub-text"><p>The model (height 5'8" and chest 33") is wearing a size S</p></li></ul>,25:02:2014,None
None,Roadster Woman Black Sweater,http://www.myntra.com/sweaters/roadster/roadster-woman-black-sweater/211445/buy,Rs. 429,women-sweaters-sweatshirts,Sweaters & Sweatshirts,ONLY,http://myntra.myntassets.com/images/style/properties/Roadster-Woman-Black-Sweater_951817b58171289f3d8168a53fe8ac45_images_1080_1440_mini.JPG,Rs. 1,099,None,women,http://www.myntra.com/sweaters/roadster/roadster-woman-black-sweater/211445/buy,Sold byVector Ecommerce Pvt Ltd,None,None,['XS', 'S', 'M', 'L', 'XL'],None,<ul class="mk-pdpv1-product-helper mk-cf"><li class="desc-main-title">Product Description</li><li class="desc-sub-title">Style Note</li><li class="desc-sub-text " itemprop="description"><p>Dress up in style this winter when you are wearing a piece from Roadster's range of sweaters. This one is best styled with distressed boyfriend denims and canvas slip-ons.</p></li><li class="desc-sub-title ">Product Details</li><li class="desc-sub-text"><p>Black sweater, knitted, ribbed stylised V shaped round neck, short sleeves with ribbed upturned cuff detail along arm holes, ribbed hem</p></li><li class="desc-sub-title ">Material &amp; Care</li><li class="desc-sub-text "><p>Viscose and nylon blend<br/>Handwash cold</p></li><li class="desc-sub-title">Size &amp; Fit</li><li class="desc-sub-text"><p>The model (height 5'8" and chest 33") is wearing a size S</p></li></ul>,25:02:2014,None
None,Arrow Woman Black Sweater,http://www.myntra.com/sweaters/arrow-woman/arrow-woman-black-sweater/225461/buy,Rs. 1,999,women-sweaters-sweatshirts,Sweaters & Sweatshirts,ONLY,http://myntra.myntassets.com/images/style/properties/Arrow-Woman-Women-Sweaters_9fc46c7cc1fa7f4a0fdfcbd7a5df5b1b_images_1080_1440_mini.jpg,None,None,women,http://www.myntra.com/sweaters/arrow-woman/arrow-woman-black-sweater/225461/buy,Sold byVector Ecommerce Pvt Ltd,None,None,['XS', 'S', 'M', 'L', 'XL', 'XXL'],None,<ul class="mk-pdpv1-product-helper mk-cf"><li class="desc-main-title">Product Description</li><li class="desc-sub-title">Style Note</li><li class="desc-sub-text " itemprop="description"><p>Your winter wear wardrobe will get a fresh new definition of style with this fashionable sweater from Arrow Woman. Team it with jeans or shorts and funky ballet flats for a trendy casual look.</p></li><li class="desc-sub-title ">Product Details</li><li class="desc-sub-text"><p>Charcoal black knit sweater, ribbed V neckline, long sleeves with ribbed cuffs, metallic branding above hem, stylised ribbed hem</p></li><li class="desc-sub-title ">Material &amp; Care</li><li class="desc-sub-text "><p>100% cotton<br/>Machine wash warm</p></li><li class="desc-sub-title">Size &amp; Fit</li><li class="desc-sub-text"><p>The model (height 5'8" and chest 33") is wearing a size S</p></li></ul>,25:02:2014,None
None,United Colors of Benetton Women Yellow Cardigan,http://www.myntra.com/sweaters/united-colors-of-benetton/united-colors-of-benetton-women-yellow-cardigan/193901/buy,Rs. 1,749,women-sweaters-sweatshirts,Sweaters & Sweatshirts,ONLY,http://myntra.myntassets.com/images/style/properties/United-Colors-of-Benetton-Women-Yellow-Cardigan_7da5ed32965610b9670953f5bb0893ca_images_1080_1440_mini.jpg,Rs. 2,499,None,women,http://www.myntra.com/sweaters/united-colors-of-benetton/united-colors-of-benetton-women-yellow-cardigan/193901/buy,Sold byVector Ecommerce Pvt Ltd,None,None,['XS', 'S', 'M', 'L', 'XL'],None,<ul class="mk-pdpv1-product-helper mk-cf"><li class="desc-main-title">Product Description</li><li class="desc-sub-title">Style Note</li><li class="desc-sub-text " itemprop="description"><p>An essential addition to your winter wardrobe, this cardigan  from UCB is stylish and extremely versatile. Team it with jeans and funky ballet flats for a trendy casual look.</p></li><li class="desc-sub-title ">Product Details</li><li class="desc-sub-text"><p>Yellow cardigan, knitted, ribbed mock collar, concealed full zipped front, long sleeves with ribbed cuffs that have tipping detail, branded Swarovski element embellishment at left chest, ribbed hem with tipping detail</p></li><li class="desc-sub-title ">Material &amp; Care</li><li class="desc-sub-text "><p>80% lambswool, 20% nylon<br/>Dry clean</p></li><li class="desc-sub-title">Size &amp; Fit</li><li class="desc-sub-text"><p>The model (height 5'8" and chest 33") is wearing a size S</p></li></ul>,25:02:2014,None
