None,Remanika Women Off-White & Black Striped Shirt,http://www.myntra.com/Shirts/Remanika/Remanika-Women-Off-White-&-Black-Striped-Shirt/196340/buy,Rs. 1,400,fashion-sale,Extra 32% Off on 30,Remanika,http://myntra.myntassets.com/images/style/properties/Remanika-Women-Off-White-&-Black-Striped-Shirt_f0809b0e54339e41b5846158737a9e8d_images_1080_1440_mini.jpg,None,None,fashion,http://www.myntra.com/Shirts/Remanika/Remanika-Women-Off-White-&-Black-Striped-Shirt/196340/buy,Sold byVector Ecommerce Pvt Ltd,None,None,['XS', 'S', 'M', 'L', 'XL'],None,<ul class="mk-pdpv1-product-helper mk-cf"><li class="desc-main-title">Product Description</li><li class="desc-sub-title">Style Note</li><li class="desc-sub-text " itemprop="description"><p>Make a statement with this stylish shirt from Remanika, which is designed to delight the fashionista in you. Pair it with skinny jeans and ballerinas for a look that spells casual wherever you go.</p></li><li class="desc-sub-title ">Product Details</li><li class="desc-sub-text"><p>Black and off-white striped shirt, woven, spread collar, long sleeves with elasticated cuffs, full buttoned chest placket, solid back, curved hem</p></li><li class="desc-sub-title ">Material &amp; Care</li><li class="desc-sub-text "><p>Polyester<br/>Machine wash warm</p></li><li class="desc-sub-title">Size &amp; Fit</li><li class="desc-sub-text"><p>Loose fit<br/>The model (height 5'8" and chest 33") is wearing a size S</p></li></ul>,26:02:2014,None
None,Remanika Charcoal Grey Tailored Fit Dress,http://www.myntra.com/Dresses/Remanika/Remanika-Charcoal-Grey-Tailored-Fit-Dress/196326/buy,Rs. 2,200,fashion-sale,Extra 32% Off on 30,Remanika,http://myntra.myntassets.com/images/style/properties/Remanika-Charcoal-Grey-Tailored-Fit-Dress_0a8373decfe5bdbb4cdeee41869a3baa_images_1080_1440_mini.jpg,None,None,fashion,http://www.myntra.com/Dresses/Remanika/Remanika-Charcoal-Grey-Tailored-Fit-Dress/196326/buy,Sold byVector Ecommerce Pvt Ltd,None,None,['XS', 'S', 'M', 'L', 'XL'],None,<ul class="mk-pdpv1-product-helper mk-cf"><li class="desc-main-title">Product Description</li><li class="desc-sub-title">Style Note</li><li class="desc-sub-text " itemprop="description"><p>Celebrate your femininity with Remanika's latest range of classy dresses. Match this number with pumps in a neutral hue and a chain sling quilted bag.</p></li><li class="desc-sub-title ">Product Details</li><li class="desc-sub-text"><p>Charcoal grey tailored dress with black print detail, panel at front yoke with cowl neck detail, short sleeves with gathers at shoulders, panel along waist</p></li><li class="desc-sub-title ">Material &amp; Care</li><li class="desc-sub-text "><p>Viscose<br/>Machine wash warm</p></li><li class="desc-sub-title">Size &amp; Fit</li><li class="desc-sub-text"><p>The model (height 5'8", chest 33" and waist 28") is wearing a size S which measures 92 cm from shoulder to hem</p></li></ul>,26:02:2014,None
None,Remanika Women Black & White Striped Top,http://www.myntra.com/Tops/Remanika/Remanika-Women-Black-&-White-Striped-Top/196355/buy,Rs. 1,300,fashion-sale,Extra 32% Off on 30,Remanika,http://myntra.myntassets.com/images/style/properties/Remanika-Women-Black-&-White-Striped-Top_1a1857ad3669d25aa5c1d244fc915973_images_1080_1440_mini.jpg,None,None,fashion,http://www.myntra.com/Tops/Remanika/Remanika-Women-Black-&-White-Striped-Top/196355/buy,Sold byVector Ecommerce Pvt Ltd,None,None,['XS', 'S', 'M'],None,<ul class="mk-pdpv1-product-helper mk-cf"><li class="desc-main-title">Product Description</li><li class="desc-sub-title">Style Note</li><li class="desc-sub-text " itemprop="description"><p>Make a statement with this stylish top from Remanika, which is designed to delight the fashionista in you. Pair it with skinny jeans and ballerinas for a look that spells casual wherever you go.</p></li><li class="desc-sub-title ">Product Details</li><li class="desc-sub-text"><p>Black and white striped top, knitted, V neck, long sleeves, full buttoned chest placket, panelled front with stitch detail, back, yoke, sheer back, front hem dipped at sides, curved back hem longer than front</p></li><li class="desc-sub-title ">Material &amp; Care</li><li class="desc-sub-text "><p>50% viscose, 50% polyester<br/>Machine wash warm</p></li><li class="desc-sub-title">Size &amp; Fit</li><li class="desc-sub-text"><p>Loose fit<br/>The model (height 5'8" and chest 33" ) is wearing a size S</p></li></ul>,26:02:2014,None
None,Remanika Women Grey & Blue Printed Tunic,http://www.myntra.com/Tunics/Remanika/Remanika-Women-Grey-&-Blue-Printed-Tunic/150837/buy,Rs. 1,700,fashion-sale,Extra 32% Off on 30,Remanika,http://myntra.myntassets.com/images/style/properties/Remanika-Women-Grey-&-Blue-Printed-Tunic_95930ab582abeb68c6eb1e08d53488d9_images_1080_1440.jpg,None,None,fashion,http://www.myntra.com/Tunics/Remanika/Remanika-Women-Grey-&-Blue-Printed-Tunic/150837/buy,Sold byVector Ecommerce Pvt Ltd,None,None,['XS', 'S', 'M', 'L', 'XL'],None,<ul class="mk-pdpv1-product-helper mk-cf"><li class="desc-main-title">Product Description</li><li class="desc-sub-title">Style Note</li><li class="desc-sub-text " itemprop="description"><p>Remanika sure knows how create coveted styles that make it to the top of our wish-list. Match this printed number with a pair of tonal leggings and ballerina flats for mall-hopping with your girlfriends.</p></li><li class="desc-sub-title ">Product Details</li><li class="desc-sub-text"><p>Grey and teal blue printed tunic with brown accents, woven, partial mandarin collar with a round neck and a slit, sleeveless, chest panel with lace trimming, gathered panelling across waist with slight gathers beneath, curved hem</p></li><li class="desc-sub-title ">Material &amp; Care</li><li class="desc-sub-text "><p>Cotton<br/>Hand wash only</p></li><li class="desc-sub-title">Size &amp; Fit</li><li class="desc-sub-text"><p>The model (height 5'8" and chest 33") is wearing a size S</p></li></ul>,26:02:2014,None
None,Remanika Women Satchet Black Top,http://www.myntra.com/Tops/Remanika/Remanika-Women-Satchet-Black-Top/111747/buy,Rs. 1,330,fashion-sale,Extra 32% Off on 30,Remanika,http://myntra.myntassets.com/images/style/properties/Remanika-Women-Tops_6b3c366a3a08b7738496bc327f0a2b1d_images_1080_1440_mini.jpg,Rs. 1,900,None,fashion,http://www.myntra.com/Tops/Remanika/Remanika-Women-Satchet-Black-Top/111747/buy,Sold byVector Ecommerce Pvt Ltd,None,None,['XS', 'S', 'M', 'L'],None,<ul class="mk-pdpv1-product-helper mk-cf"><li class="desc-main-title">Product Description</li><li class="desc-sub-title">Style Note</li><li class="desc-sub-text " itemprop="description"><p>Remanika - a brand with a penchant for the unusual, lives up to its reputation and brings out this beautiful black top that we love at first sight. Pair this piece with skin fit denim jeans and pop hues pumps for a simple, smart yet stylish look.</p></li><li class="desc-sub-title ">Product Details</li><li class="desc-sub-text"><p>Black top, asymmetric neck with net strap on one side, pleated net overlay in front, elasticated at sides near hem</p></li><li class="desc-sub-title ">Material &amp; Care</li><li class="desc-sub-text "><p>Polyester<br/>Hand wash</p></li><li class="desc-sub-title">Size &amp; Fit</li><li class="desc-sub-text"><p>Regular fit<br/>The model (height 5'8" and chest 33") is wearing a size XS</p></li></ul>,26:02:2014,None
None,Remanika Women Purple Creed Top,http://www.myntra.com/Tunics/Remanika/Remanika-Women-Purple-Creed-Top/122739/buy,Rs. 1,800,fashion-sale,Extra 32% Off on 30,Remanika,http://myntra.myntassets.com/images/style/properties/Remanika-Women-Purple-Creed-Top_b8428fb1472d03c63b99f9a339aac54b_images_1080_1440_mini.jpg,None,None,fashion,http://www.myntra.com/Tunics/Remanika/Remanika-Women-Purple-Creed-Top/122739/buy,Sold byVector Ecommerce Pvt Ltd,None,None,['XS', 'S', 'M', 'L', 'XL'],None,<ul class="mk-pdpv1-product-helper mk-cf"><li class="desc-main-title">Product Description</li><li class="desc-sub-title">Style Note</li><li class="desc-sub-text " itemprop="description"><p>An extremely lady-like casual tunic, this purple piece from Remanika is perfect for your Sunday outings and brunches. We suggest you team it with khaki pants and mules for a laid-back weekend look.</p></li><li class="desc-sub-title ">Product Details</li><li class="desc-sub-text"><p>Purple tunic, spread collar, short buttoned placket, yoke in front with pleats beneath, three quarter sleeves with buttoned tabs, lace yoke at back, buttoned tabs at hem near side seams</p></li><li class="desc-sub-title ">Material &amp; Care</li><li class="desc-sub-text "><p>Rayon<br/>Hand wash</p></li><li class="desc-sub-title">Size &amp; Fit</li><li class="desc-sub-text"><p>The model (height 5'8" and chest 33") is wearing a size S</p></li></ul>,26:02:2014,None
None,Remanika Women Green Shirt,http://www.myntra.com/Shirts/Remanika/Remanika-Women-Green-Shirt/196336/buy,Rs. 1,600,fashion-sale,Extra 32% Off on 30,Remanika,http://myntra.myntassets.com/images/style/properties/Remanika-Women-Green-Top_1499ea619cfa05bfe587dea63dcb7e86_images_1080_1440_mini.jpg,None,None,fashion,http://www.myntra.com/Shirts/Remanika/Remanika-Women-Green-Shirt/196336/buy,Sold byVector Ecommerce Pvt Ltd,None,None,['XS', 'S', 'M', 'L', 'XL'],None,<ul class="mk-pdpv1-product-helper mk-cf"><li class="desc-main-title">Product Description</li><li class="desc-sub-title">Style Note</li><li class="desc-sub-text " itemprop="description"><p>Make a statement with this stylish shirt from Remanika, which is designed to delight the fashionista in you. Pair it with skinny jeans and ballerinas for a look that spells casual wherever you go.</p></li><li class="desc-sub-title ">Product Details</li><li class="desc-sub-text"><p>Green shirt, woven, spread collar, three quarter sleeves with elasticated cuffs, lace detail at shoulder yokes, full buttoned chest placket, cut-out detail at back with gathers below</p></li><li class="desc-sub-title ">Material &amp; Care</li><li class="desc-sub-text "><p>100% rayon<br/>Hand wash</p></li><li class="desc-sub-title">Size &amp; Fit</li><li class="desc-sub-text"><p>The model (height 5'8" and chest 33" ) is wearing a size S</p></li></ul>,26:02:2014,None
None,Remanika Women Grey Hooded Tunic,http://www.myntra.com/Tunics/Remanika/Remanika-Women-Grey-Hooded-Tunic/83171/buy,Rs. 2,200,fashion-sale,Extra 32% Off on 30,Remanika,http://myntra.myntassets.com/images/style/properties/Remanika-Women-Grey-Hooded-Tunic_5af5a44a11daffb6590b85bef09d7328_images_1080_1440_mini.jpg,None,None,fashion,http://www.myntra.com/Tunics/Remanika/Remanika-Women-Grey-Hooded-Tunic/83171/buy,Sold byVector Ecommerce Pvt Ltd,None,None,['XS', 'S', 'M', 'L', 'XL'],None,<ul class="mk-pdpv1-product-helper mk-cf"><li class="desc-main-title">Product Description</li><li class="desc-sub-title">Style Note</li><li class="desc-sub-text " itemprop="description"><p>Remanika sure knows how create coveted styles that make it to the top of our wish-list. Match this tunic with a pair of tonal leggings and ballerina flats for mall-hopping with your girlfriends.</p></li><li class="desc-sub-title ">Product Details</li><li class="desc-sub-text"><p>Grey tunic in a knitted and woven combo, hood, epaulettes, sleeveless, panelled front, half zipped closure at chest, patch pocket at the right front side, buttoned tab detail at left side, contrast back yoke with gathers below, elasticated drop waist with inverted box pleats below</p></li><li class="desc-sub-title ">Material &amp; Care</li><li class="desc-sub-text "><p>Cotton<br/>Machine wash warm</p></li><li class="desc-sub-title">Size &amp; Fit</li><li class="desc-sub-text"><p>The model (height 5'8" and chest 33") is wearing a size S</p></li></ul>,26:02:2014,None
None,Remanika Women White & Black Top,http://www.myntra.com/Tops/Remanika/Remanika-Women-White-&-Black-Top/196353/buy,Rs. 1,250,fashion-sale,Extra 32% Off on 30,Remanika,http://myntra.myntassets.com/images/style/properties/Remanika-Women-White-&-Black-Top_5bfead185ea581f8c35a5cb52ea601f5_images_1080_1440.jpg,None,None,fashion,http://www.myntra.com/Tops/Remanika/Remanika-Women-White-&-Black-Top/196353/buy,Sold byVector Ecommerce Pvt Ltd,None,None,['XS', 'S', 'M'],None,<ul class="mk-pdpv1-product-helper mk-cf"><li class="desc-main-title">Product Description</li><li class="desc-sub-title">Style Note</li><li class="desc-sub-text " itemprop="description"><p>Make a statement with this stylish top from Remanika, which is designed to delight the fashionista in you. Pair it with a pair of skinny jeans and ballerinas for a look that spells casual wherever you go.</p></li><li class="desc-sub-title ">Product Details</li><li class="desc-sub-text"><p>White and black top, knit, sequin and bead detail on spread collar with split at back, sleeveless, short buttoned placket at chest, lace back</p></li><li class="desc-sub-title ">Material &amp; Care</li><li class="desc-sub-text "><p>Cotton<br/>Hand wash cold</p></li><li class="desc-sub-title">Size &amp; Fit</li><li class="desc-sub-text"><p>The model (height 5'8" and chest 33" ) is wearing a size S</p></li></ul>,26:02:2014,None
None,Remanika Women Blue Narcisse Top,http://www.myntra.com/Tops/Remanika/Remanika-Women-Blue-Narcisse-Top/196356/buy,Rs. 1,000,fashion-sale,Extra 32% Off on 30,Remanika,http://myntra.myntassets.com/images/style/properties/Remanika-Women-Blue-Narcisse-Top_6035795af6156de145b83d5c64676c0d_images_1080_1440_mini.jpg,None,None,fashion,http://www.myntra.com/Tops/Remanika/Remanika-Women-Blue-Narcisse-Top/196356/buy,Sold byVector Ecommerce Pvt Ltd,None,None,['XS', 'S', 'M', 'L'],None,<ul class="mk-pdpv1-product-helper mk-cf"><li class="desc-main-title">Product Description</li><li class="desc-sub-title">Style Note</li><li class="desc-sub-text " itemprop="description"><p>Remanika sure knows how to create coveted styles that make it to the top of our wish-list. Match this top with skinny jeans, peep toes and hoop earrings for mall-hopping with your girlfriends.</p></li><li class="desc-sub-title ">Product Details</li><li class="desc-sub-text"><p>Blue top with magenta and green accents, knitted, round neck with trim, sleeveless with pleated frill at shoulders, lace back, striped ribbed hem band</p></li><li class="desc-sub-title ">Material &amp; Care</li><li class="desc-sub-text "><p>Cotton<br/>Machine wash warm</p></li><li class="desc-sub-title">Size &amp; Fit</li><li class="desc-sub-text"><p>Regular fit<br/>The model (height 5'8" and chest 33") is wearing a size S</p></li></ul>,26:02:2014,None
None,Remanika Women Off-White Printed Top,http://www.myntra.com/Tops/Remanika/Remanika-Women-Off-White-Printed-Top/137672/buy,Rs. 680,fashion-sale,Extra 32% Off on 30,Remanika,http://myntra.myntassets.com/images/style/properties/Remanika-Women-Off-White-Printed-Top_77fa282f15cc1a512fe94f489ecf66e1_images_1080_1440_mini.jpg,None,None,fashion,http://www.myntra.com/Tops/Remanika/Remanika-Women-Off-White-Printed-Top/137672/buy,Sold byVector Ecommerce Pvt Ltd,None,None,['XS', 'S', 'M', 'L', 'XL'],None,<ul class="mk-pdpv1-product-helper mk-cf"><li class="desc-main-title">Product Description</li><li class="desc-sub-title">Style Note</li><li class="desc-sub-text " itemprop="description"><p>Remanika sure knows how create coveted styles that make  it to the top of our wish-list. Embrace laid back dressing this weekend pairing this piece with  denims shorts and canvas shoes and a funky tote bag.</p></li><li class="desc-sub-title ">Product Details</li><li class="desc-sub-text"><p>Off-white knit top, has a round neck, short cap sleeves with gathers, graphic print with bead detail on front, slight curved hem</p></li><li class="desc-sub-title ">Material &amp; Care</li><li class="desc-sub-text "><p>Cotton<br/>Machine wash</p></li><li class="desc-sub-title">Size &amp; Fit</li><li class="desc-sub-text"><p>Fitted (slim) fit<br/>The model (height 5'8" and chest 33") is wearing a size M</p></li></ul>,26:02:2014,None
None,Remanika Women Green Top,http://www.myntra.com/Tops/Remanika/Remanika-Women-Green-Top/174394/buy,Rs. 1,700,fashion-sale,Extra 32% Off on 30,Remanika,http://myntra.myntassets.com/images/style/properties/Remanika-Women-Green-Top_be5804401adc37375cea3c67c4060fb6_images_1080_1440_mini.jpg,None,None,fashion,http://www.myntra.com/Tops/Remanika/Remanika-Women-Green-Top/174394/buy,Sold byVector Ecommerce Pvt Ltd,None,None,['XS', 'S', 'M', 'L', 'XL'],None,<ul class="mk-pdpv1-product-helper mk-cf"><li class="desc-main-title">Product Description</li><li class="desc-sub-title">Style Note</li><li class="desc-sub-text " itemprop="description"><p>Add some variety to your wardrobe with this beautiful top by Remanika. This versatile piece can be worn with jeans, shorts and trousers.</p></li><li class="desc-sub-title ">Product Details</li><li class="desc-sub-text"><p>Green top, knit, round neck with V shaped panelling and bead detail around it, short sleeves with wavy hem, tie-up detail at chest, ruffle detailing at front, wavy hemline with with back longer than front</p></li><li class="desc-sub-title ">Material &amp; Care</li><li class="desc-sub-text "><p>Viscose<br/>Machine wash warm</p></li><li class="desc-sub-title">Size &amp; Fit</li><li class="desc-sub-text"><p>Regular fit<br/>The model (height 5'8" and chest 33" ) is wearing a size S</p></li></ul>,26:02:2014,None
None,Remanika Women Black & White Printed Damita Top,http://www.myntra.com/Tops/Remanika/Remanika-Women-Black-&-White-Printed-Damita-Top/196348/buy,Rs. 1,200,fashion-sale,Extra 32% Off on 30,Remanika,http://myntra.myntassets.com/images/style/properties/Remanika-Women-Black-&-White-Printed-Damita-Top_b85853a6d9948798e58751f254e42886_images_1080_1440_mini.jpg,None,None,fashion,http://www.myntra.com/Tops/Remanika/Remanika-Women-Black-&-White-Printed-Damita-Top/196348/buy,Sold byVector Ecommerce Pvt Ltd,None,None,['XS', 'S', 'M', 'L', 'XL'],None,<ul class="mk-pdpv1-product-helper mk-cf"><li class="desc-main-title">Product Description</li><li class="desc-sub-title">Style Note</li><li class="desc-sub-text " itemprop="description"><p>Remanika sure knows how to create coveted styles that make it to the top of our wish-list. Match this top with bright skinny jeans, peep toes and vintage stud earrings for mall-hopping with your girlfriends.</p></li><li class="desc-sub-title ">Product Details</li><li class="desc-sub-text"><p>Black and white printed top, woven, boat neck with taping, short extended sleeves with solid panel along hems, contrast print panel at bottom half</p></li><li class="desc-sub-title ">Material &amp; Care</li><li class="desc-sub-text "><p>Polyester<br/>Machine wash warm</p></li><li class="desc-sub-title">Size &amp; Fit</li><li class="desc-sub-text"><p>Regular fit<br/>The model (height 5'8" and chest 33") is wearing a size S</p></li></ul>,26:02:2014,None
None,Remanika Women Purple Finn Top,http://www.myntra.com/Tops/Remanika/Remanika-Women-Purple-Finn-Top/196350/buy,Rs. 1,700,fashion-sale,Extra 32% Off on 30,Remanika,http://myntra.myntassets.com/images/style/properties/Remanika-Women-Purple-Finn-Top_979d5f3f66d6d9cba752bb63c36bd637_images_1080_1440_mini.jpg,None,None,fashion,http://www.myntra.com/Tops/Remanika/Remanika-Women-Purple-Finn-Top/196350/buy,Sold byVector Ecommerce Pvt Ltd,None,None,['XS', 'S', 'M', 'L', 'XL'],None,<ul class="mk-pdpv1-product-helper mk-cf"><li class="desc-main-title">Product Description</li><li class="desc-sub-title">Style Note</li><li class="desc-sub-text " itemprop="description"><p>Remanika sure knows how create coveted styles that make it to the top of our wish-list. Match this top with dark skinny jeans, peep toes and vintage stud earrings for mall-hopping with your girlfriends.</p></li><li class="desc-sub-title ">Product Details</li><li class="desc-sub-text"><p>Purple top, woven, rounded V neck with lace trim, three quarter sleeves with tuck detail and ladder lace insert along hems, short buttoned chest placket with tucks at either side, purple embroidery with sheer ribbon trim along front hem, back yoke with gathers below, ladder lace insert along hemline</p></li><li class="desc-sub-title ">Material &amp; Care</li><li class="desc-sub-text "><p>Cotton<br/>Machine wash warm</p></li><li class="desc-sub-title">Size &amp; Fit</li><li class="desc-sub-text"><p>The model (height 5'8" and chest 33") is wearing a size S</p></li></ul>,26:02:2014,None
None,Remanika Women Red and Blue Printed Tunic,http://www.myntra.com/Tunics/Remanika/Remanika-Women-Red-and-Blue-Printed-Tunic/83174/buy,Rs. 1,500,fashion-sale,Extra 32% Off on 30,Remanika,http://myntra.myntassets.com/images/style/properties/Remanika-Women-Red-and-Blue-Printed-Top_cfe661b48ced31c93ca3ce74b2507d83_images_1080_1440_mini.jpg,None,None,fashion,http://www.myntra.com/Tunics/Remanika/Remanika-Women-Red-and-Blue-Printed-Tunic/83174/buy,Sold byVector Ecommerce Pvt Ltd,None,None,['XS', 'S', 'M', 'L', 'XL'],None,<ul class="mk-pdpv1-product-helper mk-cf"><li class="desc-main-title">Product Description</li><li class="desc-sub-title">Style Note</li><li class="desc-sub-text " itemprop="description"><p>Wear the latest fashion trends with Remanika's versatile collection. This chic top will give you a vibrant look. You can style it with classic denims or skirts and strappy flats.</p></li><li class="desc-sub-title ">Product Details</li><li class="desc-sub-text"><p>Red and blue, floral printed, woven tunic, has a round neckline, sleeveless, lace detail at the arm holes, horizontal tucks below the neckline, slightly flared at the waist with pleats, concealed zipper at the back and a slightly curved hemline</p></li><li class="desc-sub-title ">Material &amp; Care</li><li class="desc-sub-text "><p>Cotton<br/>Machine wash</p></li><li class="desc-sub-title">Size &amp; Fit</li><li class="desc-sub-text"><p>Regular fit<br/>The model (height 5'8" and chest 33") is wearing a size M</p></li></ul>,26:02:2014,None
None,Remanika Women Navy & Brown Printed Tunic,http://www.myntra.com/Tunics/Remanika/Remanika-Women-Navy-&-Brown-Printed-Tunic/174402/buy,Rs. 800,fashion-sale,Extra 32% Off on 30,Remanika,http://myntra.myntassets.com/images/style/properties/Remanika-Women-Beige-Printed-Tunic_8467665657a15a9c904ee45d83066385_images_1080_1440_mini.jpg,None,None,fashion,http://www.myntra.com/Tunics/Remanika/Remanika-Women-Navy-&-Brown-Printed-Tunic/174402/buy,Sold byVector Ecommerce Pvt Ltd,None,None,['XS', 'S', 'M', 'L', 'XL', 'XXL'],None,<ul class="mk-pdpv1-product-helper mk-cf"><li class="desc-main-title">Product Description</li><li class="desc-sub-title">Style Note</li><li class="desc-sub-text " itemprop="description"><p>Make a statement this season with this beautiful tunic by Remanika. Team this piece with denims or linen trousers to embody desi-chic.</p></li><li class="desc-sub-title ">Product Details</li><li class="desc-sub-text"><p>Navy blue, brown and beige tunic with multi-coloured prints, has a round neck, short sleeves with smocking detailing, panel detailing in front, ruffles at chest, elasticated drop waist with gathers below it, ruffle detailing at the back with pleats below it, curved hem with back slightly longer than front</p></li><li class="desc-sub-title ">Material &amp; Care</li><li class="desc-sub-text "><p>Polyester<br/>Machine wash warm</p></li><li class="desc-sub-title">Size &amp; Fit</li><li class="desc-sub-text"><p>Regular fit<br/>The model height (height 5'8" and chest 33") is wearing a size M</p></li></ul>,26:02:2014,None
None,Remanika Women Red Printed Tunic,http://www.myntra.com/Tunics/Remanika/Remanika-Women-Red-Printed-Tunic/174403/buy,Rs. 980,fashion-sale,Extra 32% Off on 30,Remanika,http://myntra.myntassets.com/images/style/properties/Remanika-Women-Red-Printed-Tunic_a642ae80317d673b96a8e2d5832d415e_images_1080_1440_mini.jpg,None,None,fashion,http://www.myntra.com/Tunics/Remanika/Remanika-Women-Red-Printed-Tunic/174403/buy,Sold byVector Ecommerce Pvt Ltd,None,None,['XS', 'S', 'M', 'XL', 'XXL'],None,<ul class="mk-pdpv1-product-helper mk-cf"><li class="desc-main-title">Product Description</li><li class="desc-sub-title">Style Note</li><li class="desc-sub-text " itemprop="description"><p>Make a statement with this stylish tunic from Remanika, which is designed to delight the fashionista in you. Pair it with skinny jeans and ballerinas for a look that spells casual wherever you go.</p></li><li class="desc-sub-title ">Product Details</li><li class="desc-sub-text"><p>Red tunic with printed detail throughout, woven, round neck with woven ruffles around it, button and loop closure at back neck, three quarter sleeves with elasticated cuffs and tie-up styling, stylised tucks at chest with threaded detail, ruffle detail below the waist</p></li><li class="desc-sub-title ">Material &amp; Care</li><li class="desc-sub-text "><p>Cotton<br/>Machine wash warm</p></li><li class="desc-sub-title">Size &amp; Fit</li><li class="desc-sub-text"><p>The model (height 5'8" and chest 33" ) is wearing a size S</p></li></ul>,26:02:2014,None
