None,Remanika Women Peach Coloured Top,http://www.myntra.com/Tops/Remanika/Remanika-Women-Peach-Coloured-Top/196360/buy,Rs. 1,200,fashion-sale,Extra 32% Off on 30,Remanika,http://myntra.myntassets.com/images/style/properties/Remanika-Women-Peach-Coloured-Top_fcab7ef7af1ffc6f7733a742b6c885fc_images_1080_1440_mini.jpg,None,None,fashion,http://www.myntra.com/Tops/Remanika/Remanika-Women-Peach-Coloured-Top/196360/buy,Sold byVector Ecommerce Pvt Ltd,None,None,['XS', 'S', 'M', 'L', 'XL'],None,<ul class="mk-pdpv1-product-helper mk-cf"><li class="desc-main-title">Product Description</li><li class="desc-sub-title">Style Note</li><li class="desc-sub-text " itemprop="description"><p>Make a statement with this stylish top from Remanika, which is designed to delight the fashionista in you. Pair it with skinny jeans and ballerinas for a look that spells casual wherever you go.</p></li><li class="desc-sub-title ">Product Details</li><li class="desc-sub-text"><p>Peach coloured top, knitted, round neck, short grown-on sleeves with cut-out detail at shoulders, lace detail at front back and shoulder yokes, hem band</p></li><li class="desc-sub-title ">Material &amp; Care</li><li class="desc-sub-text "><p>Cotton<br/>Machine wash warm</p></li><li class="desc-sub-title">Size &amp; Fit</li><li class="desc-sub-text"><p>Regular fit<br/>The model (height 5'8" and chest 33" ) is wearing a size S</p></li></ul>,26:02:2014,None
None,Remanika Red Arpege Fit & Flare Dress,http://www.myntra.com/Dresses/Remanika/Remanika-Red-Arpege-Fit-&-Flare-Dress/196328/buy,Rs. 1,600,fashion-sale,Extra 32% Off on 30,Remanika,http://myntra.myntassets.com/images/style/properties/Remanika-Red-Arpege-Fit-&-Flare-Dress_712b3b73e707da5c98beb87e1e921015_images_1080_1440_mini.jpg,None,None,fashion,http://www.myntra.com/Dresses/Remanika/Remanika-Red-Arpege-Fit-&-Flare-Dress/196328/buy,Sold byVector Ecommerce Pvt Ltd,None,None,['XS', 'S', 'M'],None,<ul class="mk-pdpv1-product-helper mk-cf"><li class="desc-main-title">Product Description</li><li class="desc-sub-title">Style Note</li><li class="desc-sub-text " itemprop="description"><p>Remanika sure knows how to create coveted styles that make it to the top of our wish-list. Match this dress with peep toes and chandelier earrings for mall-hopping with your girlfriends.</p></li><li class="desc-sub-title ">Product Details</li><li class="desc-sub-text"><p>Red dress with black accents, woven, round neck with binding, sleeveless, sheer panel at front with concealed half buttoned placket, elasticated waist, skirt with sheer under layer</p></li><li class="desc-sub-title ">Material &amp; Care</li><li class="desc-sub-text "><p>100% rayon<br/>Hand wash</p></li><li class="desc-sub-title">Size &amp; Fit</li><li class="desc-sub-text"><p>Slim fit<br/>The model (height 5'8", chest 33" and waist 28") is wearing a size S which measures 85 cm from shoulder to hem</p></li></ul>,26:02:2014,None
None,Remanika Women Black & White Printed Damita Top,http://www.myntra.com/Tops/Remanika/Remanika-Women-Black-&-White-Printed-Damita-Top/196348/buy,Rs. 1,200,fashion-sale,Extra 32% Off on 30,Remanika,http://myntra.myntassets.com/images/style/properties/Remanika-Women-Black-&-White-Printed-Damita-Top_b85853a6d9948798e58751f254e42886_images_1080_1440_mini.jpg,None,None,fashion,http://www.myntra.com/Tops/Remanika/Remanika-Women-Black-&-White-Printed-Damita-Top/196348/buy,Sold byVector Ecommerce Pvt Ltd,None,None,['XS', 'S', 'M', 'L', 'XL'],None,<ul class="mk-pdpv1-product-helper mk-cf"><li class="desc-main-title">Product Description</li><li class="desc-sub-title">Style Note</li><li class="desc-sub-text " itemprop="description"><p>Remanika sure knows how to create coveted styles that make it to the top of our wish-list. Match this top with bright skinny jeans, peep toes and vintage stud earrings for mall-hopping with your girlfriends.</p></li><li class="desc-sub-title ">Product Details</li><li class="desc-sub-text"><p>Black and white printed top, woven, boat neck with taping, short extended sleeves with solid panel along hems, contrast print panel at bottom half</p></li><li class="desc-sub-title ">Material &amp; Care</li><li class="desc-sub-text "><p>Polyester<br/>Machine wash warm</p></li><li class="desc-sub-title">Size &amp; Fit</li><li class="desc-sub-text"><p>Regular fit<br/>The model (height 5'8" and chest 33") is wearing a size S</p></li></ul>,26:02:2014,None
None,Remanika Women Brown Tunic,http://www.myntra.com/Tunics/Remanika/Remanika-Women-Brown-Tunic/174400/buy,Rs. 900,fashion-sale,Extra 32% Off on 30,Remanika,http://myntra.myntassets.com/images/style/properties/Remanika-Women-Orange-Tunic_e0ef4ebac8ab46ddbe6ac42398736f3e_images_1080_1440_mini.jpg,None,None,fashion,http://www.myntra.com/Tunics/Remanika/Remanika-Women-Brown-Tunic/174400/buy,Sold byVector Ecommerce Pvt Ltd,None,None,['XS', 'S', 'M', 'L', 'XL', 'XXL'],None,<ul class="mk-pdpv1-product-helper mk-cf"><li class="desc-main-title">Product Description</li><li class="desc-sub-title">Style Note</li><li class="desc-sub-text " itemprop="description"><p>Go mod this season with this trendy tunic from Remanika. Style it with contrast leggings and ballet flats for a cute day look.</p></li><li class="desc-sub-title ">Product Details</li><li class="desc-sub-text"><p>Brown tunic, woven, round neck, sleeveless, pleats in the front and back below the waist, curved hem</p></li><li class="desc-sub-title ">Material &amp; Care</li><li class="desc-sub-text "><p>Cotton<br/>Machine wash warm</p></li><li class="desc-sub-title">Size &amp; Fit</li><li class="desc-sub-text"><p>Regular fit<br/>The model height (height 5'8" and chest 33") is wearing a size S</p></li></ul>,26:02:2014,None
None,Remanika Women Blue Top,http://www.myntra.com/Tops/Remanika/Remanika-Women-Blue-Top/196362/buy,Rs. 1,200,fashion-sale,Extra 32% Off on 30,Remanika,http://myntra.myntassets.com/images/style/properties/Remanika-Women-Blue-Top_278d2e7c5885d77118e3a3648efac91b_images_1080_1440_mini.jpg,None,None,fashion,http://www.myntra.com/Tops/Remanika/Remanika-Women-Blue-Top/196362/buy,Sold byVector Ecommerce Pvt Ltd,None,None,['XS', 'S', 'M', 'L', 'XL'],None,<ul class="mk-pdpv1-product-helper mk-cf"><li class="desc-main-title">Product Description</li><li class="desc-sub-title">Style Note</li><li class="desc-sub-text " itemprop="description"><p>Make a statement with this stylish top from Remanika, which is designed to delight the fashionista in you. Pair it with skinny jeans and ballerinas for a look that spells casual wherever you go.</p></li><li class="desc-sub-title ">Product Details</li><li class="desc-sub-text"><p>Blue top, knitted, round neck, short grown-on sleeves with cut-out detail at shoulders, lace detail at front, back and shoulder yokes, hem band</p></li><li class="desc-sub-title ">Material &amp; Care</li><li class="desc-sub-text "><p>Cotton<br/>Machine wash warm</p></li><li class="desc-sub-title">Size &amp; Fit</li><li class="desc-sub-text"><p>Regular fit<br/>The model (height 5'8" and chest 33") is wearing a size S</p></li></ul>,26:02:2014,None
None,Remanika Women Blue Top,http://www.myntra.com/Tops/Remanika/Remanika-Women-Blue-Top/196354/buy,Rs. 1,300,fashion-sale,Extra 32% Off on 30,Remanika,http://myntra.myntassets.com/images/style/properties/Remanika-Women-Blue-Top_da18554a2705ebdfe48ba989b9d53986_images_1080_1440_mini.jpg,None,None,fashion,http://www.myntra.com/Tops/Remanika/Remanika-Women-Blue-Top/196354/buy,Sold byVector Ecommerce Pvt Ltd,None,None,['XS', 'S', 'M'],None,<ul class="mk-pdpv1-product-helper mk-cf"><li class="desc-main-title">Product Description</li><li class="desc-sub-title">Style Note</li><li class="desc-sub-text " itemprop="description"><p>Make a statement with this stylish top from Remanika, which is designed to delight the fashionista in you. Pair it with skinny jeans and ballerinas for a look that spells casual wherever you go.</p></li><li class="desc-sub-title ">Product Details</li><li class="desc-sub-text"><p>Blue top, knitted, V neck, long sleeves, full buttoned chest placket, panelled front with stitch detail, back, yoke, sheer back, front hem dipped at sides, curved back hem longer than front</p></li><li class="desc-sub-title ">Material &amp; Care</li><li class="desc-sub-text "><p>50% viscose, 50% polyester<br/>Machine wash warm</p></li><li class="desc-sub-title">Size &amp; Fit</li><li class="desc-sub-text"><p>Loose fit<br/>The model (height 5'8" and chest 33" ) is wearing a size S</p></li></ul>,26:02:2014,None
None,Remanika Blue Fit & Flare Dress,http://www.myntra.com/Dresses/Remanika/Remanika-Blue-Fit-&-Flare-Dress/196325/buy,Rs. 1,500,fashion-sale,Extra 32% Off on 30,Remanika,http://myntra.myntassets.com/images/style/properties/Remanika-Blue-Fit-&-Flare-Dress_74fda6c0e84ab302868f4b259ae1eef7_images_1080_1440_mini.jpg,None,None,fashion,http://www.myntra.com/Dresses/Remanika/Remanika-Blue-Fit-&-Flare-Dress/196325/buy,Sold byVector Ecommerce Pvt Ltd,None,None,['XS', 'S', 'M', 'L', 'XL'],None,<ul class="mk-pdpv1-product-helper mk-cf"><li class="desc-main-title">Product Description</li><li class="desc-sub-title">Style Note</li><li class="desc-sub-text " itemprop="description"><p>You can see the smooth blend of style and comfort in this Remanika creation. This dress can be worn out on a casual date or an evening spent hanging out in a cafe with friends. Pair it with black strappy sandals for an elegant understated look.</p></li><li class="desc-sub-title ">Product Details</li><li class="desc-sub-text"><p>Blue fit and flare dress, woven, round neck, sleeveless, lace trim and slight gathers at bodice, drawstring detail at waist with lace trim and gathers below, back yoke with gathers below, short button placket at back, has lining attached</p></li><li class="desc-sub-title ">Material &amp; Care</li><li class="desc-sub-text "><p>Cotton<br/>Machine wash warm</p></li><li class="desc-sub-title">Size &amp; Fit</li><li class="desc-sub-text"><p>The model (height 5'8", chest 33" and waist 28") is wearing a size S which measures 85 cm from shoulder to hem</p></li></ul>,26:02:2014,None
None,Remanika Women Navy Blue Dress,http://www.myntra.com/Dresses/Remanika/Remanika-Women-Navy-Blue-Dress/41774/buy,Rs. 1,400,fashion-sale,Extra 32% Off on 30,Remanika,http://myntra.myntassets.com/images/style/properties/59121ea72e413d3dde25835cf2f3032b_images_1080_1440_mini.jpg,None,None,fashion,http://www.myntra.com/Dresses/Remanika/Remanika-Women-Navy-Blue-Dress/41774/buy,Sold byVector Ecommerce Pvt Ltd,None,None,['XS', 'S', 'M', 'L', 'XL'],None,<ul class="mk-pdpv1-product-helper mk-cf"><li class="desc-main-title">Product Description</li><li class="desc-sub-title">Style Note</li><li class="desc-sub-text " itemprop="description"><p>Remanika combines edgy style with stylish fits in their creations. They  did that in this summery dress as well. Wear it with a pair of strappy  flat sandals for a trip to a cafe or on a Sunday brunch.</p></li><li class="desc-sub-title ">Product Details</li><li class="desc-sub-text"><p>Multi-coloured, printed spaghetti dress with a zipper from the neckline to below the bust, has flaring tucks from below the bust, an elasticated smocking detail at the back and adjustable spaghetti straps<br/> <strong><br/></strong></p></li><li class="desc-sub-title ">Material &amp; Care</li><li class="desc-sub-text "><p>Cotton <br/> Gentle machine wash</p></li><li class="desc-sub-title">Size &amp; Fit</li><li class="desc-sub-text"><p>Regular fit <br/> The model (height 5'8" and chest 33") is wearing a size M which measures 70 cm from the neckline to the hem</p></li></ul>,26:02:2014,None
None,Remanika Women Black Dress,http://www.myntra.com/Dresses/Remanika/Remanika-Women-Black-Dress/174389/buy,Rs. 850,fashion-sale,Extra 32% Off on 30,Remanika,http://myntra.myntassets.com/images/style/properties/Remanika-Women-Black-Dress_8560c76046d1b2c33ea8c4b9f530a650_images_1080_1440_mini.jpg,None,None,fashion,http://www.myntra.com/Dresses/Remanika/Remanika-Women-Black-Dress/174389/buy,Sold byVector Ecommerce Pvt Ltd,None,None,['XS', 'S', 'M', 'L', 'XL'],None,<ul class="mk-pdpv1-product-helper mk-cf"><li class="desc-main-title">Product Description</li><li class="desc-sub-title">Style Note</li><li class="desc-sub-text " itemprop="description"><p>Look gorgeous in this pretty dress by Remanika. We suggest you match it with a pair of stilettos and contemporary metallic jewellery for an evening pool party look.</p></li><li class="desc-sub-title ">Product Details</li><li class="desc-sub-text"><p>Black knit dress, V neck, has adjustable shoulder straps, straight hem</p></li><li class="desc-sub-title ">Material &amp; Care</li><li class="desc-sub-text "><p>90% cotton, 10% Lycra<br/>Hand wash cold</p></li><li class="desc-sub-title">Size &amp; Fit</li><li class="desc-sub-text"><p>Regular fit<br/>The model (height 5'8'', chest 33'' and waist 28") is wearing a size L which measures 130 cm from the shoulder to hem</p></li></ul>,26:02:2014,None
None,Remanika Charcoal Grey Tailored Fit Dress,http://www.myntra.com/Dresses/Remanika/Remanika-Charcoal-Grey-Tailored-Fit-Dress/196326/buy,Rs. 2,200,fashion-sale,Extra 32% Off on 30,Remanika,http://myntra.myntassets.com/images/style/properties/Remanika-Charcoal-Grey-Tailored-Fit-Dress_0a8373decfe5bdbb4cdeee41869a3baa_images_1080_1440_mini.jpg,None,None,fashion,http://www.myntra.com/Dresses/Remanika/Remanika-Charcoal-Grey-Tailored-Fit-Dress/196326/buy,Sold byVector Ecommerce Pvt Ltd,None,None,['XS', 'S', 'M', 'L', 'XL'],None,<ul class="mk-pdpv1-product-helper mk-cf"><li class="desc-main-title">Product Description</li><li class="desc-sub-title">Style Note</li><li class="desc-sub-text " itemprop="description"><p>Celebrate your femininity with Remanika's latest range of classy dresses. Match this number with pumps in a neutral hue and a chain sling quilted bag.</p></li><li class="desc-sub-title ">Product Details</li><li class="desc-sub-text"><p>Charcoal grey tailored dress with black print detail, panel at front yoke with cowl neck detail, short sleeves with gathers at shoulders, panel along waist</p></li><li class="desc-sub-title ">Material &amp; Care</li><li class="desc-sub-text "><p>Viscose<br/>Machine wash warm</p></li><li class="desc-sub-title">Size &amp; Fit</li><li class="desc-sub-text"><p>The model (height 5'8", chest 33" and waist 28") is wearing a size S which measures 92 cm from shoulder to hem</p></li></ul>,26:02:2014,None
None,Remanika Women Red Embroidered Tunic,http://www.myntra.com/Tunics/Remanika/Remanika-Women-Red-Embroidered-Tunic/137647/buy,Rs. 1,800,fashion-sale,Extra 32% Off on 30,Remanika,http://myntra.myntassets.com/images/style/properties/Remanika-Women-Tunics_eec91c78f9569cfb98217d3c52a46189_images_1080_1440_mini.jpg,None,None,fashion,http://www.myntra.com/Tunics/Remanika/Remanika-Women-Red-Embroidered-Tunic/137647/buy,Sold byVector Ecommerce Pvt Ltd,None,None,['XS', 'S', 'M', 'L', 'XL'],None,<ul class="mk-pdpv1-product-helper mk-cf"><li class="desc-main-title">Product Description</li><li class="desc-sub-title">Style Note</li><li class="desc-sub-text " itemprop="description"><p>Perfect for the summer, this red hot tunic from Remanika is a wardrobe must-have for the season. It'll look best paired with black leggings and thong sandals for an evening out with friends.</p></li><li class="desc-sub-title ">Product Details</li><li class="desc-sub-text"><p>Red dobby weave tunic, woven, stylised yoke with pleat detail at back, has a mandarin collar with a split in front, short buttoned placket at chest, floral embroidery and appliqué detailed panel at chest, tucks below panel, three quarter sleeves with elasticated mid-arm and cuffs, lace at hem</p></li><li class="desc-sub-title ">Material &amp; Care</li><li class="desc-sub-text "><p>Cotton<br/> Hand wash cold</p></li><li class="desc-sub-title">Size &amp; Fit</li><li class="desc-sub-text"><p>Regular fit<br/> The model (height 5'8” and chest 33”) is wearing a size M</p></li></ul>,26:02:2014,None
None,Remanika Women Purple Creed Top,http://www.myntra.com/Tunics/Remanika/Remanika-Women-Purple-Creed-Top/122739/buy,Rs. 1,800,fashion-sale,Extra 32% Off on 30,Remanika,http://myntra.myntassets.com/images/style/properties/Remanika-Women-Purple-Creed-Top_b8428fb1472d03c63b99f9a339aac54b_images_1080_1440_mini.jpg,None,None,fashion,http://www.myntra.com/Tunics/Remanika/Remanika-Women-Purple-Creed-Top/122739/buy,Sold byVector Ecommerce Pvt Ltd,None,None,['XS', 'S', 'M', 'L', 'XL'],None,<ul class="mk-pdpv1-product-helper mk-cf"><li class="desc-main-title">Product Description</li><li class="desc-sub-title">Style Note</li><li class="desc-sub-text " itemprop="description"><p>An extremely lady-like casual tunic, this purple piece from Remanika is perfect for your Sunday outings and brunches. We suggest you team it with khaki pants and mules for a laid-back weekend look.</p></li><li class="desc-sub-title ">Product Details</li><li class="desc-sub-text"><p>Purple tunic, spread collar, short buttoned placket, yoke in front with pleats beneath, three quarter sleeves with buttoned tabs, lace yoke at back, buttoned tabs at hem near side seams</p></li><li class="desc-sub-title ">Material &amp; Care</li><li class="desc-sub-text "><p>Rayon<br/>Hand wash</p></li><li class="desc-sub-title">Size &amp; Fit</li><li class="desc-sub-text"><p>The model (height 5'8" and chest 33") is wearing a size S</p></li></ul>,26:02:2014,None
None,Remanika Women Black & White Striped Top,http://www.myntra.com/Tops/Remanika/Remanika-Women-Black-&-White-Striped-Top/196355/buy,Rs. 1,300,fashion-sale,Extra 32% Off on 30,Remanika,http://myntra.myntassets.com/images/style/properties/Remanika-Women-Black-&-White-Striped-Top_1a1857ad3669d25aa5c1d244fc915973_images_1080_1440_mini.jpg,None,None,fashion,http://www.myntra.com/Tops/Remanika/Remanika-Women-Black-&-White-Striped-Top/196355/buy,Sold byVector Ecommerce Pvt Ltd,None,None,['XS', 'S', 'M'],None,<ul class="mk-pdpv1-product-helper mk-cf"><li class="desc-main-title">Product Description</li><li class="desc-sub-title">Style Note</li><li class="desc-sub-text " itemprop="description"><p>Make a statement with this stylish top from Remanika, which is designed to delight the fashionista in you. Pair it with skinny jeans and ballerinas for a look that spells casual wherever you go.</p></li><li class="desc-sub-title ">Product Details</li><li class="desc-sub-text"><p>Black and white striped top, knitted, V neck, long sleeves, full buttoned chest placket, panelled front with stitch detail, back, yoke, sheer back, front hem dipped at sides, curved back hem longer than front</p></li><li class="desc-sub-title ">Material &amp; Care</li><li class="desc-sub-text "><p>50% viscose, 50% polyester<br/>Machine wash warm</p></li><li class="desc-sub-title">Size &amp; Fit</li><li class="desc-sub-text"><p>Loose fit<br/>The model (height 5'8" and chest 33" ) is wearing a size S</p></li></ul>,26:02:2014,None
None,Remanika Women Cream Coloured & Blue Checked Hooded Tunic,http://www.myntra.com/Tunics/Remanika/Remanika-Women-Cream-Coloured-&-Blue-Checked-Hooded-Tunic/69478/buy,Rs. 1,800,fashion-sale,Extra 32% Off on 30,Remanika,http://myntra.myntassets.com/images/style/properties/Remanika-Women-Cream-Coloured-&-Blue-Checked-Hooded-Tunic_53d657b7fe916f6ad332bb111c640eb3_images_1080_1440_mini.jpg,None,None,fashion,http://www.myntra.com/Tunics/Remanika/Remanika-Women-Cream-Coloured-&-Blue-Checked-Hooded-Tunic/69478/buy,Sold byVector Ecommerce Pvt Ltd,None,None,['S', 'M', 'L', 'XL'],None,<ul class="mk-pdpv1-product-helper mk-cf"><li class="desc-main-title">Product Description</li><li class="desc-sub-title">Style Note</li><li class="desc-sub-text " itemprop="description"><p>Remanika sure knows how create coveted styles that make it to the top of our wish-list. Match this tunic with a pair of tonal leggings and ballerina flats for mall-hopping with your girlfriends.</p></li><li class="desc-sub-title ">Product Details</li><li class="desc-sub-text"><p>Cream coloured, blue and brown checked tunic in a textured weave, hood with drawstrings, long sleeves, half buttoned placket, cargo style pockets at front hip, drawstring channelled through waist which ties at back</p></li><li class="desc-sub-title ">Material &amp; Care</li><li class="desc-sub-text "><p>Cotton<br/>Machine wash warm</p></li><li class="desc-sub-title">Size &amp; Fit</li><li class="desc-sub-text"><p>The model (height 5'8" and chest 33") is wearing a size S</p></li></ul>,26:02:2014,None
None,Remanika Women Green Top,http://www.myntra.com/Tops/Remanika/Remanika-Women-Green-Top/174394/buy,Rs. 1,700,fashion-sale,Extra 32% Off on 30,Remanika,http://myntra.myntassets.com/images/style/properties/Remanika-Women-Green-Top_be5804401adc37375cea3c67c4060fb6_images_1080_1440_mini.jpg,None,None,fashion,http://www.myntra.com/Tops/Remanika/Remanika-Women-Green-Top/174394/buy,Sold byVector Ecommerce Pvt Ltd,None,None,['XS', 'S', 'M', 'L', 'XL'],None,<ul class="mk-pdpv1-product-helper mk-cf"><li class="desc-main-title">Product Description</li><li class="desc-sub-title">Style Note</li><li class="desc-sub-text " itemprop="description"><p>Add some variety to your wardrobe with this beautiful top by Remanika. This versatile piece can be worn with jeans, shorts and trousers.</p></li><li class="desc-sub-title ">Product Details</li><li class="desc-sub-text"><p>Green top, knit, round neck with V shaped panelling and bead detail around it, short sleeves with wavy hem, tie-up detail at chest, ruffle detailing at front, wavy hemline with with back longer than front</p></li><li class="desc-sub-title ">Material &amp; Care</li><li class="desc-sub-text "><p>Viscose<br/>Machine wash warm</p></li><li class="desc-sub-title">Size &amp; Fit</li><li class="desc-sub-text"><p>Regular fit<br/>The model (height 5'8" and chest 33" ) is wearing a size S</p></li></ul>,26:02:2014,None
None,Remanika Women White & Black Top,http://www.myntra.com/Tops/Remanika/Remanika-Women-White-&-Black-Top/196353/buy,Rs. 1,250,fashion-sale,Extra 32% Off on 30,Remanika,http://myntra.myntassets.com/images/style/properties/Remanika-Women-White-&-Black-Top_5bfead185ea581f8c35a5cb52ea601f5_images_1080_1440_mini.jpg,None,None,fashion,http://www.myntra.com/Tops/Remanika/Remanika-Women-White-&-Black-Top/196353/buy,Sold byVector Ecommerce Pvt Ltd,None,None,['XS', 'S', 'M'],None,<ul class="mk-pdpv1-product-helper mk-cf"><li class="desc-main-title">Product Description</li><li class="desc-sub-title">Style Note</li><li class="desc-sub-text " itemprop="description"><p>Make a statement with this stylish top from Remanika, which is designed to delight the fashionista in you. Pair it with a pair of skinny jeans and ballerinas for a look that spells casual wherever you go.</p></li><li class="desc-sub-title ">Product Details</li><li class="desc-sub-text"><p>White and black top, knit, sequin and bead detail on spread collar with split at back, sleeveless, short buttoned placket at chest, lace back</p></li><li class="desc-sub-title ">Material &amp; Care</li><li class="desc-sub-text "><p>Cotton<br/>Hand wash cold</p></li><li class="desc-sub-title">Size &amp; Fit</li><li class="desc-sub-text"><p>The model (height 5'8" and chest 33" ) is wearing a size S</p></li></ul>,26:02:2014,None
None,Remanika Women Green Shirt,http://www.myntra.com/Shirts/Remanika/Remanika-Women-Green-Shirt/196336/buy,Rs. 1,600,fashion-sale,Extra 32% Off on 30,Remanika,http://myntra.myntassets.com/images/style/properties/Remanika-Women-Green-Top_1499ea619cfa05bfe587dea63dcb7e86_images_1080_1440_mini.jpg,None,None,fashion,http://www.myntra.com/Shirts/Remanika/Remanika-Women-Green-Shirt/196336/buy,Sold byVector Ecommerce Pvt Ltd,None,None,['XS', 'S', 'M', 'L', 'XL'],None,<ul class="mk-pdpv1-product-helper mk-cf"><li class="desc-main-title">Product Description</li><li class="desc-sub-title">Style Note</li><li class="desc-sub-text " itemprop="description"><p>Make a statement with this stylish shirt from Remanika, which is designed to delight the fashionista in you. Pair it with skinny jeans and ballerinas for a look that spells casual wherever you go.</p></li><li class="desc-sub-title ">Product Details</li><li class="desc-sub-text"><p>Green shirt, woven, spread collar, three quarter sleeves with elasticated cuffs, lace detail at shoulder yokes, full buttoned chest placket, cut-out detail at back with gathers below</p></li><li class="desc-sub-title ">Material &amp; Care</li><li class="desc-sub-text "><p>100% rayon<br/>Hand wash</p></li><li class="desc-sub-title">Size &amp; Fit</li><li class="desc-sub-text"><p>The model (height 5'8" and chest 33" ) is wearing a size S</p></li></ul>,26:02:2014,None
