None,Remanika Black & White Striped Shift Dress,http://www.myntra.com/Dresses/Remanika/Remanika-Black-&-White-Striped-Shift-Dress/196330/buy,Rs. 1,600,fashion-sale,Extra 32% Off on 30,Remanika,http://myntra.myntassets.com/images/style/properties/Remanika-Black-&-White-Striped-Shift-Dress_e768ef2a9c1cd12683613111f98bf258_images_1080_1440_mini.jpg,None,None,fashion,http://www.myntra.com/Dresses/Remanika/Remanika-Black-&-White-Striped-Shift-Dress/196330/buy,Sold byVector Ecommerce Pvt Ltd,None,None,['XS', 'S', 'M', 'L', 'XL'],None,<ul class="mk-pdpv1-product-helper mk-cf"><li class="desc-main-title">Product Description</li><li class="desc-sub-title">Style Note</li><li class="desc-sub-text " itemprop="description"><p>Make a statement with this stylish dress from Remanika, which is designed to delight the fashionista in you. Style it with a pair of peep-toes and a clutch for a pretty lunch date with your girlfriends.</p></li><li class="desc-sub-title ">Product Details</li><li class="desc-sub-text"><p>White and black striped dress, woven, round neck with flat collar, pleats at front neck, sleeveless, panel at front hip sides, button-and-loop fastened slit at back neck</p></li><li class="desc-sub-title ">Material &amp; Care</li><li class="desc-sub-text "><p>Polyester<br/>Machine wash warm</p></li><li class="desc-sub-title">Size &amp; Fit</li><li class="desc-sub-text"><p>The model (height 5'8", chest 33" and waist 28") is wearing a size M which measures 87 cm from shoulder to hem</p></li></ul>,26:02:2014,None
None,Remanika Women Peach Coloured Beth Shirt,http://www.myntra.com/Shirts/Remanika/Remanika-Women-Peach-Coloured-Beth-Shirt/150697/buy,Rs. 1,600,fashion-sale,Extra 32% Off on 30,Remanika,http://myntra.myntassets.com/images/style/properties/Remanika-Women-Peach-Coloured-Beth-Shirt_f476e7fbd59fddd76d871393a02d6510_images_1080_1440_mini.jpg,None,None,fashion,http://www.myntra.com/Shirts/Remanika/Remanika-Women-Peach-Coloured-Beth-Shirt/150697/buy,Sold byVector Ecommerce Pvt Ltd,None,None,['XS', 'S', 'M', 'L', 'XL'],None,<ul class="mk-pdpv1-product-helper mk-cf"><li class="desc-main-title">Product Description</li><li class="desc-sub-title">Style Note</li><li class="desc-sub-text " itemprop="description"><p>Remanika is a brand with a penchant for the unusual and it lives up to its reputation with this beautiful peach shirt that we love at first sight. Pair this piece with skin fit jeggings and pop hues pumps for a simple, smart yet stylish look.</p></li><li class="desc-sub-title ">Product Details</li><li class="desc-sub-text"><p>Peach coloured shirt, woven, mandarin collar, full buttoned chest placket with tucks and lace panels on either side, short sleeves with gathers at hems and buttoned cuffs</p></li><li class="desc-sub-title ">Material &amp; Care</li><li class="desc-sub-text "><p>Cotton<br/>Machine wash warm</p></li><li class="desc-sub-title">Size &amp; Fit</li><li class="desc-sub-text"><p>The model (height 5'8" and chest 33") is wearing a size S</p></li></ul>,26:02:2014,None
None,Remanika Women Cream & Maroon Printed Tunic,http://www.myntra.com/Tunics/Remanika/Remanika-Women-Cream-&-Maroon-Printed-Tunic/150808/buy,Rs. 1,800,fashion-sale,Extra 32% Off on 30,Remanika,http://myntra.myntassets.com/images/style/properties/Remanika-Women-Cream-&-Maroon-Printed-Tunic_4ad1e2b9db95ff629a7ea1b84dbc4b7b_images_1080_1440_mini.jpg,None,None,fashion,http://www.myntra.com/Tunics/Remanika/Remanika-Women-Cream-&-Maroon-Printed-Tunic/150808/buy,Sold byVector Ecommerce Pvt Ltd,None,None,['XS', 'S', 'M', 'L', 'XL'],None,<ul class="mk-pdpv1-product-helper mk-cf"><li class="desc-main-title">Product Description</li><li class="desc-sub-title">Style Note</li><li class="desc-sub-text " itemprop="description"><p>Choose this lovely printed tunic to take you through the seasons. Match it with a pair of tonal leggings and pretty ballerina flats for a comfortable, stylish look.</p></li><li class="desc-sub-title ">Product Details</li><li class="desc-sub-text"><p>Cream printed tunic with maroon and blue accents, woven, mandarin collar, short buttoned chest placket, three quarter length sleeves with elasticated cuffs, smocking at shoulders, yoke at back with slight gathers beneath, drawstring fastening at waist</p></li><li class="desc-sub-title ">Material &amp; Care</li><li class="desc-sub-text "><p>Cotton<br/>Machine wash warm</p></li><li class="desc-sub-title">Size &amp; Fit</li><li class="desc-sub-text"><p>The model (height 5'8" and chest 33") is wearing a size S</p></li></ul>,26:02:2014,None
None,Remanika Women Blue Shift Dress,http://www.myntra.com/Dresses/Remanika/Remanika-Women-Blue-Shift-Dress/174395/buy,Rs. 1,800,fashion-sale,Extra 32% Off on 30,Remanika,http://myntra.myntassets.com/images/style/properties/Remanika-Women-Blue-Top_ac2f079f9896ad61a30883fab7631480_images_1080_1440_mini.jpg,None,None,fashion,http://www.myntra.com/Dresses/Remanika/Remanika-Women-Blue-Shift-Dress/174395/buy,Sold byVector Ecommerce Pvt Ltd,None,None,['XS', 'S', 'M', 'L', 'XXL'],None,<ul class="mk-pdpv1-product-helper mk-cf"><li class="desc-main-title">Product Description</li><li class="desc-sub-title">Style Note</li><li class="desc-sub-text " itemprop="description"><p>Make a statement with this stylish dress from Remanika, which is designed to delight the fashionista in you. Style it with a pair of delicate peep-toes and an elegant clutch for the a pretty lunch date with girlfriends.</p></li><li class="desc-sub-title ">Product Details</li><li class="desc-sub-text"><p>Blue shift dress, woven, cowl neck, sleeveless</p></li><li class="desc-sub-title ">Material &amp; Care</li><li class="desc-sub-text "><p>Cotton<br/>Machine wash warm</p></li><li class="desc-sub-title">Size &amp; Fit</li><li class="desc-sub-text"><p>The model (height 5'8", chest 33" and waist 28") is wearing a size M which measures 90 cm from shoulder to hem</p></li></ul>,26:02:2014,None
None,Remanika Women Beige & Green Printed Tunic,http://www.myntra.com/Tunics/Remanika/Remanika-Women-Beige-&-Green-Printed-Tunic/174401/buy,Rs. 850,fashion-sale,Extra 32% Off on 30,Remanika,http://myntra.myntassets.com/images/style/properties/Remanika-Women-Beige-Printed-Tunic_226584337f4013d3931d7568878cb222_images_1080_1440_mini.jpg,None,None,fashion,http://www.myntra.com/Tunics/Remanika/Remanika-Women-Beige-&-Green-Printed-Tunic/174401/buy,Sold byVector Ecommerce Pvt Ltd,None,None,['XS', 'S', 'M', 'L', 'XL'],None,<ul class="mk-pdpv1-product-helper mk-cf"><li class="desc-main-title">Product Description</li><li class="desc-sub-title">Style Note</li><li class="desc-sub-text " itemprop="description"><p>Beautiful and stylish, this eye-catching tunic is an absolute must-have. Style this printed tunic with leggings and heels for a fusion inspired look.</p></li><li class="desc-sub-title ">Product Details</li><li class="desc-sub-text"><p>Beige, off-white and green tunic with printed detail throughout, woven, round neck with woven ruffles around it, button and loop closure at back neck, long sleeves with elasticated cuffs and tie-up styling, stylised tucks at chest with threaded detail, ruffle detail below the waist</p></li><li class="desc-sub-title ">Material &amp; Care</li><li class="desc-sub-text "><p>Polyester<br/>Machine wash warm</p></li><li class="desc-sub-title">Size &amp; Fit</li><li class="desc-sub-text"><p>Regular fit<br/>The model (height 5'8" and chest 33" ) is wearing a size S</p></li></ul>,26:02:2014,None
None,Remanika Women Black & Coral Orange Bridge Tunic,http://www.myntra.com/Tunics/Remanika/Remanika-Women-Black-&-Coral-Orange-Bridge-Tunic/196368/buy,Rs. 1,500,fashion-sale,Extra 32% Off on 30,Remanika,http://myntra.myntassets.com/images/style/properties/Remanika-Women-Black-&-Coral-Orange-Bridge-Tunic_8d654d86bd1b2d19e41c255685caf924_images_1080_1440_mini.JPG,None,None,fashion,http://www.myntra.com/Tunics/Remanika/Remanika-Women-Black-&-Coral-Orange-Bridge-Tunic/196368/buy,Sold byVector Ecommerce Pvt Ltd,None,None,['XS', 'S', 'M', 'L'],None,<ul class="mk-pdpv1-product-helper mk-cf"><li class="desc-main-title">Product Description</li><li class="desc-sub-title">Style Note</li><li class="desc-sub-text " itemprop="description"><p>Remanika sure knows how to create coveted styles that make it to the top of our wish-list. Match this tunic with  skinny jeans, peep toes and vintage stud earrings for mall-hopping with your girlfriends.</p></li><li class="desc-sub-title ">Product Details</li><li class="desc-sub-text"><p>Black and coral orange georgette tunic, woven, V neck, three quarter sleeves, piped patch pocket with sequin detail at left chest, lace panel at sides, contrast back with longer hem, curved hemline</p></li><li class="desc-sub-title ">Material &amp; Care</li><li class="desc-sub-text "><p>100% polyester<br/>Hand wash</p></li><li class="desc-sub-title">Size &amp; Fit</li><li class="desc-sub-text"><p>Loose fit<br/>The model (height 5'8" and chest 33") is wearing a size S</p></li></ul>,26:02:2014,None
None,Remanika Women Cream Coloured & Blue Checked Hooded Tunic,http://www.myntra.com/Tunics/Remanika/Remanika-Women-Cream-Coloured-&-Blue-Checked-Hooded-Tunic/69478/buy,Rs. 1,800,fashion-sale,Extra 32% Off on 30,Remanika,http://myntra.myntassets.com/images/style/properties/Remanika-Women-Cream-Coloured-&-Blue-Checked-Hooded-Tunic_53d657b7fe916f6ad332bb111c640eb3_images_1080_1440_mini.jpg,None,None,fashion,http://www.myntra.com/Tunics/Remanika/Remanika-Women-Cream-Coloured-&-Blue-Checked-Hooded-Tunic/69478/buy,Sold byVector Ecommerce Pvt Ltd,None,None,['S', 'M', 'L', 'XL'],None,<ul class="mk-pdpv1-product-helper mk-cf"><li class="desc-main-title">Product Description</li><li class="desc-sub-title">Style Note</li><li class="desc-sub-text " itemprop="description"><p>Remanika sure knows how create coveted styles that make it to the top of our wish-list. Match this tunic with a pair of tonal leggings and ballerina flats for mall-hopping with your girlfriends.</p></li><li class="desc-sub-title ">Product Details</li><li class="desc-sub-text"><p>Cream coloured, blue and brown checked tunic in a textured weave, hood with drawstrings, long sleeves, half buttoned placket, cargo style pockets at front hip, drawstring channelled through waist which ties at back</p></li><li class="desc-sub-title ">Material &amp; Care</li><li class="desc-sub-text "><p>Cotton<br/>Machine wash warm</p></li><li class="desc-sub-title">Size &amp; Fit</li><li class="desc-sub-text"><p>The model (height 5'8" and chest 33") is wearing a size S</p></li></ul>,26:02:2014,None
None,Remanika Women Green Printed Top,http://www.myntra.com/Tops/Remanika/Remanika-Women-Green-Printed-Top/196358/buy,Rs. 1,400,fashion-sale,Extra 32% Off on 30,Remanika,http://myntra.myntassets.com/images/style/properties/Remanika-Women-Green-Printed-Top_03338b1c07c488bbc7316f7ca28526ba_images_1080_1440_mini.jpg,None,None,fashion,http://www.myntra.com/Tops/Remanika/Remanika-Women-Green-Printed-Top/196358/buy,Sold byVector Ecommerce Pvt Ltd,None,None,['XS', 'S', 'M', 'L', 'XL'],None,<ul class="mk-pdpv1-product-helper mk-cf"><li class="desc-main-title">Product Description</li><li class="desc-sub-title">Style Note</li><li class="desc-sub-text " itemprop="description"><p>Make a statement with this stylish top from Remanika, which is designed to delight the fashionista in you. Pair it with skinny jeans and ballerinas for a look that spells casual wherever you go.</p></li><li class="desc-sub-title ">Product Details</li><li class="desc-sub-text"><p>Green printed top, knitted and woven combo, has a ribbed round neck, short extended sleeves with ribbed cuffs, woven front with contrast striped printed detail, solid knit back, curved hem with back longer than front</p></li><li class="desc-sub-title ">Material &amp; Care</li><li class="desc-sub-text "><p>Cotton and Lycra blend<br/>Machine wash warm</p></li><li class="desc-sub-title">Size &amp; Fit</li><li class="desc-sub-text"><p>Loose fit<br/>The model (height 5'8" and chest 33" ) is wearing a size S</p></li></ul>,26:02:2014,None
None,Remanika Women Peach Coloured Top,http://www.myntra.com/Tops/Remanika/Remanika-Women-Peach-Coloured-Top/196360/buy,Rs. 1,200,fashion-sale,Extra 32% Off on 30,Remanika,http://myntra.myntassets.com/images/style/properties/Remanika-Women-Peach-Coloured-Top_fcab7ef7af1ffc6f7733a742b6c885fc_images_1080_1440_mini.jpg,None,None,fashion,http://www.myntra.com/Tops/Remanika/Remanika-Women-Peach-Coloured-Top/196360/buy,Sold byVector Ecommerce Pvt Ltd,None,None,['XS', 'S', 'M', 'L', 'XL'],None,<ul class="mk-pdpv1-product-helper mk-cf"><li class="desc-main-title">Product Description</li><li class="desc-sub-title">Style Note</li><li class="desc-sub-text " itemprop="description"><p>Make a statement with this stylish top from Remanika, which is designed to delight the fashionista in you. Pair it with skinny jeans and ballerinas for a look that spells casual wherever you go.</p></li><li class="desc-sub-title ">Product Details</li><li class="desc-sub-text"><p>Peach coloured top, knitted, round neck, short grown-on sleeves with cut-out detail at shoulders, lace detail at front back and shoulder yokes, hem band</p></li><li class="desc-sub-title ">Material &amp; Care</li><li class="desc-sub-text "><p>Cotton<br/>Machine wash warm</p></li><li class="desc-sub-title">Size &amp; Fit</li><li class="desc-sub-text"><p>Regular fit<br/>The model (height 5'8" and chest 33" ) is wearing a size S</p></li></ul>,26:02:2014,None
None,Remanika Women Blue Top,http://www.myntra.com/Tops/Remanika/Remanika-Women-Blue-Top/196362/buy,Rs. 1,200,fashion-sale,Extra 32% Off on 30,Remanika,http://myntra.myntassets.com/images/style/properties/Remanika-Women-Blue-Top_278d2e7c5885d77118e3a3648efac91b_images_1080_1440_mini.jpg,None,None,fashion,http://www.myntra.com/Tops/Remanika/Remanika-Women-Blue-Top/196362/buy,Sold byVector Ecommerce Pvt Ltd,None,None,['XS', 'S', 'M', 'L', 'XL'],None,<ul class="mk-pdpv1-product-helper mk-cf"><li class="desc-main-title">Product Description</li><li class="desc-sub-title">Style Note</li><li class="desc-sub-text " itemprop="description"><p>Make a statement with this stylish top from Remanika, which is designed to delight the fashionista in you. Pair it with skinny jeans and ballerinas for a look that spells casual wherever you go.</p></li><li class="desc-sub-title ">Product Details</li><li class="desc-sub-text"><p>Blue top, knitted, round neck, short grown-on sleeves with cut-out detail at shoulders, lace detail at front, back and shoulder yokes, hem band</p></li><li class="desc-sub-title ">Material &amp; Care</li><li class="desc-sub-text "><p>Cotton<br/>Machine wash warm</p></li><li class="desc-sub-title">Size &amp; Fit</li><li class="desc-sub-text"><p>Regular fit<br/>The model (height 5'8" and chest 33") is wearing a size S</p></li></ul>,26:02:2014,None
None,Remanika Red Arpege Fit & Flare Dress,http://www.myntra.com/Dresses/Remanika/Remanika-Red-Arpege-Fit-&-Flare-Dress/196328/buy,Rs. 1,600,fashion-sale,Extra 32% Off on 30,Remanika,http://myntra.myntassets.com/images/style/properties/Remanika-Red-Arpege-Fit-&-Flare-Dress_712b3b73e707da5c98beb87e1e921015_images_1080_1440_mini.jpg,None,None,fashion,http://www.myntra.com/Dresses/Remanika/Remanika-Red-Arpege-Fit-&-Flare-Dress/196328/buy,Sold byVector Ecommerce Pvt Ltd,None,None,['XS', 'S', 'M'],None,<ul class="mk-pdpv1-product-helper mk-cf"><li class="desc-main-title">Product Description</li><li class="desc-sub-title">Style Note</li><li class="desc-sub-text " itemprop="description"><p>Remanika sure knows how to create coveted styles that make it to the top of our wish-list. Match this dress with peep toes and chandelier earrings for mall-hopping with your girlfriends.</p></li><li class="desc-sub-title ">Product Details</li><li class="desc-sub-text"><p>Red dress with black accents, woven, round neck with binding, sleeveless, sheer panel at front with concealed half buttoned placket, elasticated waist, skirt with sheer under layer</p></li><li class="desc-sub-title ">Material &amp; Care</li><li class="desc-sub-text "><p>100% rayon<br/>Hand wash</p></li><li class="desc-sub-title">Size &amp; Fit</li><li class="desc-sub-text"><p>Slim fit<br/>The model (height 5'8", chest 33" and waist 28") is wearing a size S which measures 85 cm from shoulder to hem</p></li></ul>,26:02:2014,None
None,Remanika Women Burgundy Sequinned Jasmine Top,http://www.myntra.com/Tops/Remanika/Remanika-Women-Burgundy-Sequinned-Jasmine-Top/196351/buy,Rs. 1,500,fashion-sale,Extra 32% Off on 30,Remanika,http://myntra.myntassets.com/images/style/properties/Remanika-Women-Burgundy-Sequinned-Jasmine-Top_3343809f58b0bbb9def10738d3a19dd4_images_1080_1440_mini.jpg,None,None,fashion,http://www.myntra.com/Tops/Remanika/Remanika-Women-Burgundy-Sequinned-Jasmine-Top/196351/buy,Sold byVector Ecommerce Pvt Ltd,None,None,['XS', 'S', 'M', 'L', 'XL'],None,<ul class="mk-pdpv1-product-helper mk-cf"><li class="desc-main-title">Product Description</li><li class="desc-sub-title">Style Note</li><li class="desc-sub-text " itemprop="description"><p>Remanika sure knows how to create coveted styles that make it to the top of our wish-list. Match this top with skinny jeans, peep toes and hoop earrings for mall-hopping with your girlfriends.</p></li><li class="desc-sub-title ">Product Details</li><li class="desc-sub-text"><p>Burgundy melange top, knitted, round neck with trim, short extended sleeves with upturned hems, sequinned design at front</p></li><li class="desc-sub-title ">Material &amp; Care</li><li class="desc-sub-text "><p>Cotton<br/>Machine wash warm</p></li><li class="desc-sub-title">Size &amp; Fit</li><li class="desc-sub-text"><p>Loose fit<br/>The model (height 5'8" and chest 33") is wearing a size S</p></li></ul>,26:02:2014,None
None,Remanika Blue Embroidered Blouson Dress,http://www.myntra.com/Dresses/Remanika/Remanika-Blue-Embroidered-Blouson-Dress/196327/buy,Rs. 1,900,fashion-sale,Extra 32% Off on 30,Remanika,http://myntra.myntassets.com/images/style/properties/Remanika-Blue-Embroidered-Blouson-Dress_85b038b0f1ff860ffa3307da47a86e6b_images_1080_1440_mini.jpg,None,None,fashion,http://www.myntra.com/Dresses/Remanika/Remanika-Blue-Embroidered-Blouson-Dress/196327/buy,Sold byVector Ecommerce Pvt Ltd,None,None,['XS', 'S', 'M'],None,<ul class="mk-pdpv1-product-helper mk-cf"><li class="desc-main-title">Product Description</li><li class="desc-sub-title">Style Note</li><li class="desc-sub-text " itemprop="description"><p>Make a statement with this stylish dress from Remanika, which is designed to delight the fashionista in you. Style it with a pair of peep-toes and a clutch for a pretty lunch date with your girlfriends.</p></li><li class="desc-sub-title ">Product Details</li><li class="desc-sub-text"><p>Blue blouson dress, woven, V neck, long raglan dolman sleeves, contrast embroidery at chest, elasticated waistband with gathers below, two insert pockets at front sides</p></li><li class="desc-sub-title ">Material &amp; Care</li><li class="desc-sub-text "><p>100% rayon<br/>Hand wash</p></li><li class="desc-sub-title">Size &amp; Fit</li><li class="desc-sub-text"><p>The model (height 5'8", chest 33" and waist 28") is wearing a size M which measures 98 cm from shoulder to hem</p></li></ul>,26:02:2014,None
None,Remanika Blue Fit & Flare Dress,http://www.myntra.com/Dresses/Remanika/Remanika-Blue-Fit-&-Flare-Dress/196325/buy,Rs. 1,500,fashion-sale,Extra 32% Off on 30,Remanika,http://myntra.myntassets.com/images/style/properties/Remanika-Blue-Fit-&-Flare-Dress_74fda6c0e84ab302868f4b259ae1eef7_images_1080_1440_mini.jpg,None,None,fashion,http://www.myntra.com/Dresses/Remanika/Remanika-Blue-Fit-&-Flare-Dress/196325/buy,Sold byVector Ecommerce Pvt Ltd,None,None,['XS', 'S', 'M', 'L', 'XL'],None,<ul class="mk-pdpv1-product-helper mk-cf"><li class="desc-main-title">Product Description</li><li class="desc-sub-title">Style Note</li><li class="desc-sub-text " itemprop="description"><p>You can see the smooth blend of style and comfort in this Remanika creation. This dress can be worn out on a casual date or an evening spent hanging out in a cafe with friends. Pair it with black strappy sandals for an elegant understated look.</p></li><li class="desc-sub-title ">Product Details</li><li class="desc-sub-text"><p>Blue fit and flare dress, woven, round neck, sleeveless, lace trim and slight gathers at bodice, drawstring detail at waist with lace trim and gathers below, back yoke with gathers below, short button placket at back, has lining attached</p></li><li class="desc-sub-title ">Material &amp; Care</li><li class="desc-sub-text "><p>Cotton<br/>Machine wash warm</p></li><li class="desc-sub-title">Size &amp; Fit</li><li class="desc-sub-text"><p>The model (height 5'8", chest 33" and waist 28") is wearing a size S which measures 85 cm from shoulder to hem</p></li></ul>,26:02:2014,None
None,Remanika Women Navy Blue Dress,http://www.myntra.com/Dresses/Remanika/Remanika-Women-Navy-Blue-Dress/41774/buy,Rs. 1,400,fashion-sale,Extra 32% Off on 30,Remanika,http://myntra.myntassets.com/images/style/properties/59121ea72e413d3dde25835cf2f3032b_images_1080_1440_mini.jpg,None,None,fashion,http://www.myntra.com/Dresses/Remanika/Remanika-Women-Navy-Blue-Dress/41774/buy,Sold byVector Ecommerce Pvt Ltd,None,None,['XS', 'S', 'M', 'L', 'XL'],None,<ul class="mk-pdpv1-product-helper mk-cf"><li class="desc-main-title">Product Description</li><li class="desc-sub-title">Style Note</li><li class="desc-sub-text " itemprop="description"><p>Remanika combines edgy style with stylish fits in their creations. They  did that in this summery dress as well. Wear it with a pair of strappy  flat sandals for a trip to a cafe or on a Sunday brunch.</p></li><li class="desc-sub-title ">Product Details</li><li class="desc-sub-text"><p>Multi-coloured, printed spaghetti dress with a zipper from the neckline to below the bust, has flaring tucks from below the bust, an elasticated smocking detail at the back and adjustable spaghetti straps<br/> <strong><br/></strong></p></li><li class="desc-sub-title ">Material &amp; Care</li><li class="desc-sub-text "><p>Cotton <br/> Gentle machine wash</p></li><li class="desc-sub-title">Size &amp; Fit</li><li class="desc-sub-text"><p>Regular fit <br/> The model (height 5'8" and chest 33") is wearing a size M which measures 70 cm from the neckline to the hem</p></li></ul>,26:02:2014,None
None,Remanika Women Black Dress,http://www.myntra.com/Dresses/Remanika/Remanika-Women-Black-Dress/174389/buy,Rs. 850,fashion-sale,Extra 32% Off on 30,Remanika,http://myntra.myntassets.com/images/style/properties/Remanika-Women-Black-Dress_8560c76046d1b2c33ea8c4b9f530a650_images_1080_1440_mini.jpg,None,None,fashion,http://www.myntra.com/Dresses/Remanika/Remanika-Women-Black-Dress/174389/buy,Sold byVector Ecommerce Pvt Ltd,None,None,['XS', 'S', 'M', 'L', 'XL'],None,<ul class="mk-pdpv1-product-helper mk-cf"><li class="desc-main-title">Product Description</li><li class="desc-sub-title">Style Note</li><li class="desc-sub-text " itemprop="description"><p>Look gorgeous in this pretty dress by Remanika. We suggest you match it with a pair of stilettos and contemporary metallic jewellery for an evening pool party look.</p></li><li class="desc-sub-title ">Product Details</li><li class="desc-sub-text"><p>Black knit dress, V neck, has adjustable shoulder straps, straight hem</p></li><li class="desc-sub-title ">Material &amp; Care</li><li class="desc-sub-text "><p>90% cotton, 10% Lycra<br/>Hand wash cold</p></li><li class="desc-sub-title">Size &amp; Fit</li><li class="desc-sub-text"><p>Regular fit<br/>The model (height 5'8'', chest 33'' and waist 28") is wearing a size L which measures 130 cm from the shoulder to hem</p></li></ul>,26:02:2014,None
None,Remanika Women Red Embroidered Tunic,http://www.myntra.com/Tunics/Remanika/Remanika-Women-Red-Embroidered-Tunic/137647/buy,Rs. 1,800,fashion-sale,Extra 32% Off on 30,Remanika,http://myntra.myntassets.com/images/style/properties/Remanika-Women-Tunics_eec91c78f9569cfb98217d3c52a46189_images_1080_1440_mini.jpg,None,None,fashion,http://www.myntra.com/Tunics/Remanika/Remanika-Women-Red-Embroidered-Tunic/137647/buy,Sold byVector Ecommerce Pvt Ltd,None,None,['XS', 'S', 'M', 'L', 'XL'],None,<ul class="mk-pdpv1-product-helper mk-cf"><li class="desc-main-title">Product Description</li><li class="desc-sub-title">Style Note</li><li class="desc-sub-text " itemprop="description"><p>Perfect for the summer, this red hot tunic from Remanika is a wardrobe must-have for the season. It'll look best paired with black leggings and thong sandals for an evening out with friends.</p></li><li class="desc-sub-title ">Product Details</li><li class="desc-sub-text"><p>Red dobby weave tunic, woven, stylised yoke with pleat detail at back, has a mandarin collar with a split in front, short buttoned placket at chest, floral embroidery and appliqué detailed panel at chest, tucks below panel, three quarter sleeves with elasticated mid-arm and cuffs, lace at hem</p></li><li class="desc-sub-title ">Material &amp; Care</li><li class="desc-sub-text "><p>Cotton<br/> Hand wash cold</p></li><li class="desc-sub-title">Size &amp; Fit</li><li class="desc-sub-text"><p>Regular fit<br/> The model (height 5'8” and chest 33”) is wearing a size M</p></li></ul>,26:02:2014,None
