None,Remanika Women Red Printed Tunic,http://www.myntra.com/Tunics/Remanika/Remanika-Women-Red-Printed-Tunic/174403/buy,Rs. 980,fashion-sale,Extra 32% Off on 30,Remanika,http://myntra.myntassets.com/images/style/properties/Remanika-Women-Red-Printed-Tunic_a642ae80317d673b96a8e2d5832d415e_images_1080_1440_mini.jpg,None,None,fashion,http://www.myntra.com/Tunics/Remanika/Remanika-Women-Red-Printed-Tunic/174403/buy,Sold byVector Ecommerce Pvt Ltd,None,None,['XS', 'S', 'M', 'XL', 'XXL'],None,<ul class="mk-pdpv1-product-helper mk-cf"><li class="desc-main-title">Product Description</li><li class="desc-sub-title">Style Note</li><li class="desc-sub-text " itemprop="description"><p>Make a statement with this stylish tunic from Remanika, which is designed to delight the fashionista in you. Pair it with skinny jeans and ballerinas for a look that spells casual wherever you go.</p></li><li class="desc-sub-title ">Product Details</li><li class="desc-sub-text"><p>Red tunic with printed detail throughout, woven, round neck with woven ruffles around it, button and loop closure at back neck, three quarter sleeves with elasticated cuffs and tie-up styling, stylised tucks at chest with threaded detail, ruffle detail below the waist</p></li><li class="desc-sub-title ">Material &amp; Care</li><li class="desc-sub-text "><p>Cotton<br/>Machine wash warm</p></li><li class="desc-sub-title">Size &amp; Fit</li><li class="desc-sub-text"><p>The model (height 5'8" and chest 33" ) is wearing a size S</p></li></ul>,26:02:2014,None
None,Remanika Women Pink Chypre Top,http://www.myntra.com/Tops/Remanika/Remanika-Women-Pink-Chypre-Top/196344/buy,Rs. 1,600,fashion-sale,Extra 32% Off on 30,Remanika,http://myntra.myntassets.com/images/style/properties/Remanika-Women-Pink-Chypre-Top_0970ef293681d262bc00f0a81d33ff60_images_1080_1440_mini.jpg,None,None,fashion,http://www.myntra.com/Tops/Remanika/Remanika-Women-Pink-Chypre-Top/196344/buy,Sold byVector Ecommerce Pvt Ltd,None,None,['XS', 'S', 'M', 'L', 'XL'],None,<ul class="mk-pdpv1-product-helper mk-cf"><li class="desc-main-title">Product Description</li><li class="desc-sub-title">Style Note</li><li class="desc-sub-text " itemprop="description"><p>Remanika sure knows how to create coveted styles that make it to the top of our wish-list. Match this top with dark skinny jeans, peep toes and vintage stud earrings for mall-hopping with your girlfriends.</p></li><li class="desc-sub-title ">Product Details</li><li class="desc-sub-text"><p>Pink georgette top, woven, round neck with cross-over drape at front, short sleeves with upturned hems</p></li><li class="desc-sub-title ">Material &amp; Care</li><li class="desc-sub-text "><p>Polyester<br/>Machine wash warm</p></li><li class="desc-sub-title">Size &amp; Fit</li><li class="desc-sub-text"><p>Regular fit<br/>The model (height 5'8" and chest 33") is wearing a size S</p></li></ul>,26:02:2014,None
None,Remanika Women Navy & Brown Printed Tunic,http://www.myntra.com/Tunics/Remanika/Remanika-Women-Navy-&-Brown-Printed-Tunic/174402/buy,Rs. 800,fashion-sale,Extra 32% Off on 30,Remanika,http://myntra.myntassets.com/images/style/properties/Remanika-Women-Beige-Printed-Tunic_8467665657a15a9c904ee45d83066385_images_1080_1440_mini.jpg,None,None,fashion,http://www.myntra.com/Tunics/Remanika/Remanika-Women-Navy-&-Brown-Printed-Tunic/174402/buy,Sold byVector Ecommerce Pvt Ltd,None,None,['XS', 'S', 'M', 'L', 'XL', 'XXL'],None,<ul class="mk-pdpv1-product-helper mk-cf"><li class="desc-main-title">Product Description</li><li class="desc-sub-title">Style Note</li><li class="desc-sub-text " itemprop="description"><p>Make a statement this season with this beautiful tunic by Remanika. Team this piece with denims or linen trousers to embody desi-chic.</p></li><li class="desc-sub-title ">Product Details</li><li class="desc-sub-text"><p>Navy blue, brown and beige tunic with multi-coloured prints, has a round neck, short sleeves with smocking detailing, panel detailing in front, ruffles at chest, elasticated drop waist with gathers below it, ruffle detailing at the back with pleats below it, curved hem with back slightly longer than front</p></li><li class="desc-sub-title ">Material &amp; Care</li><li class="desc-sub-text "><p>Polyester<br/>Machine wash warm</p></li><li class="desc-sub-title">Size &amp; Fit</li><li class="desc-sub-text"><p>Regular fit<br/>The model height (height 5'8" and chest 33") is wearing a size M</p></li></ul>,26:02:2014,None
None,Remanika Women Cream & Red Printed Tunic,http://www.myntra.com/Tunics/Remanika/Remanika-Women-Cream-&-Red-Printed-Tunic/83176/buy,Rs. 1,800,fashion-sale,Extra 32% Off on 30,Remanika,http://myntra.myntassets.com/images/style/properties/Remanika-Women-Cream-&-Red-Printed-Tunic_4181402733d92d1d0495c0b3e6e47ec5_images_1080_1440_mini.jpg,None,None,fashion,http://www.myntra.com/Tunics/Remanika/Remanika-Women-Cream-&-Red-Printed-Tunic/83176/buy,Sold byVector Ecommerce Pvt Ltd,None,None,['XS', 'S', 'M', 'L', 'XL'],None,<ul class="mk-pdpv1-product-helper mk-cf"><li class="desc-main-title">Product Description</li><li class="desc-sub-title">Style Note</li><li class="desc-sub-text " itemprop="description"><p>Choose this lovely printed tunic to take you through the seasons. Match it with a pair of tonal leggings and pretty ballerina flats for a comfortable, stylish look.</p></li><li class="desc-sub-title ">Product Details</li><li class="desc-sub-text"><p>Cream printed tunic with green and red accents, woven, mandarin collar, short buttoned chest placket, three quarter length sleeves with elasticated cuffs, smocking at shoulders, yoke at back with slight gathers beneath, drawstring fastening at waist</p></li><li class="desc-sub-title ">Material &amp; Care</li><li class="desc-sub-text "><p>Cotton<br/>Machine wash warm</p></li><li class="desc-sub-title">Size &amp; Fit</li><li class="desc-sub-text"><p>The model (height 5'8" and chest 33") is wearing a size S</p></li></ul>,26:02:2014,None
None,Remanika Women Orange Tunic,http://www.myntra.com/Tunics/Remanika/Remanika-Women-Orange-Tunic/196337/buy,Rs. 1,500,fashion-sale,Extra 32% Off on 30,Remanika,http://myntra.myntassets.com/images/style/properties/Remanika-Women-Orange-Tunic_6bd5d978b03ab9aec64b620c7b4b1fbf_images_1080_1440_mini.jpg,None,None,fashion,http://www.myntra.com/Tunics/Remanika/Remanika-Women-Orange-Tunic/196337/buy,Sold byVector Ecommerce Pvt Ltd,None,None,['XS', 'S', 'M', 'L', 'XL'],None,<ul class="mk-pdpv1-product-helper mk-cf"><li class="desc-main-title">Product Description</li><li class="desc-sub-title">Style Note</li><li class="desc-sub-text " itemprop="description"><p>Make a statement with this stylish tunic from Remanika, which is designed to delight the fashionista in you. Pair it with skinny jeans and ballerinas for a look that spells casual wherever you go.</p></li><li class="desc-sub-title ">Product Details</li><li class="desc-sub-text"><p>Orange tunic, woven, shirt collar, sleeveless, full buttoned chest placket, cut-out detail at front chest and back</p></li><li class="desc-sub-title ">Material &amp; Care</li><li class="desc-sub-text "><p>100% rayon<br/>Hand wash</p></li><li class="desc-sub-title">Size &amp; Fit</li><li class="desc-sub-text"><p>The model (height 5'8" and chest 33") is wearing a size S</p></li></ul>,26:02:2014,None
None,Remanika Women Red and Blue Printed Tunic,http://www.myntra.com/Tunics/Remanika/Remanika-Women-Red-and-Blue-Printed-Tunic/83174/buy,Rs. 1,500,fashion-sale,Extra 32% Off on 30,Remanika,http://myntra.myntassets.com/images/style/properties/Remanika-Women-Red-and-Blue-Printed-Top_cfe661b48ced31c93ca3ce74b2507d83_images_1080_1440_mini.jpg,None,None,fashion,http://www.myntra.com/Tunics/Remanika/Remanika-Women-Red-and-Blue-Printed-Tunic/83174/buy,Sold byVector Ecommerce Pvt Ltd,None,None,['XS', 'S', 'M', 'L', 'XL'],None,<ul class="mk-pdpv1-product-helper mk-cf"><li class="desc-main-title">Product Description</li><li class="desc-sub-title">Style Note</li><li class="desc-sub-text " itemprop="description"><p>Wear the latest fashion trends with Remanika's versatile collection. This chic top will give you a vibrant look. You can style it with classic denims or skirts and strappy flats.</p></li><li class="desc-sub-title ">Product Details</li><li class="desc-sub-text"><p>Red and blue, floral printed, woven tunic, has a round neckline, sleeveless, lace detail at the arm holes, horizontal tucks below the neckline, slightly flared at the waist with pleats, concealed zipper at the back and a slightly curved hemline</p></li><li class="desc-sub-title ">Material &amp; Care</li><li class="desc-sub-text "><p>Cotton<br/>Machine wash</p></li><li class="desc-sub-title">Size &amp; Fit</li><li class="desc-sub-text"><p>Regular fit<br/>The model (height 5'8" and chest 33") is wearing a size M</p></li></ul>,26:02:2014,None
None,Remanika Women Black & Off-White Printed Top,http://www.myntra.com/Tops/Remanika/Remanika-Women-Black-&-Off-White-Printed-Top/196347/buy,Rs. 1,200,fashion-sale,Extra 32% Off on 30,Remanika,http://myntra.myntassets.com/images/style/properties/Remanika-Women-Black-&-Off-White-Printed-Top_5bda9cc1e51fb46a511daf3849a891d7_images_1080_1440_mini.jpg,None,None,fashion,http://www.myntra.com/Tops/Remanika/Remanika-Women-Black-&-Off-White-Printed-Top/196347/buy,Sold byVector Ecommerce Pvt Ltd,None,None,['XS', 'S', 'M', 'L', 'XL'],None,<ul class="mk-pdpv1-product-helper mk-cf"><li class="desc-main-title">Product Description</li><li class="desc-sub-title">Style Note</li><li class="desc-sub-text " itemprop="description"><p>Make a statement with this stylish top from Remanika, which is designed to delight the fashionista in you. Pair it with skinny jeans and ballerinas for a look that spells casual wherever you go.</p></li><li class="desc-sub-title ">Product Details</li><li class="desc-sub-text"><p>Black and off-white printed top, woven, round neck, short grown-on sleeves with solid taping at hems</p></li><li class="desc-sub-title ">Material &amp; Care</li><li class="desc-sub-text "><p>Polyester<br/>Machine wash warm</p></li><li class="desc-sub-title">Size &amp; Fit</li><li class="desc-sub-text"><p>Regular fit<br/>The model (height 5'8" and chest 33") is wearing a size S</p></li></ul>,26:02:2014,None
None,Remanika Women Blue Tunic,http://www.myntra.com/Tunics/Remanika/Remanika-Women-Blue-Tunic/196338/buy,Rs. 1,500,fashion-sale,Extra 32% Off on 30,Remanika,http://myntra.myntassets.com/images/style/properties/Remanika-Women-Blue-Tunic_4095139797371e85ecbc08f53f043a1e_images_1080_1440_mini.JPG,None,None,fashion,http://www.myntra.com/Tunics/Remanika/Remanika-Women-Blue-Tunic/196338/buy,Sold byVector Ecommerce Pvt Ltd,None,None,['XS', 'S', 'M', 'L', 'XL'],None,<ul class="mk-pdpv1-product-helper mk-cf"><li class="desc-main-title">Product Description</li><li class="desc-sub-title">Style Note</li><li class="desc-sub-text " itemprop="description"><p>Add oomph to your casual wear collection with this detailed tunic from Remanika. Spruce up your look by teaming this piece with jeggings or jeans and pumps.</p></li><li class="desc-sub-title ">Product Details</li><li class="desc-sub-text"><p>Blue tunic, has a spread collar, sleeveless, cut-out detailing at front and back, full button placket at front, yoke at shoulder and back, inward curved front hem</p></li><li class="desc-sub-title ">Material &amp; Care</li><li class="desc-sub-text "><p>100% rayon<br/>Hand wash</p></li><li class="desc-sub-title">Size &amp; Fit</li><li class="desc-sub-text"><p>The model (height 5'8" and chest 33") is wearing a size S</p></li></ul>,26:02:2014,None
None,Remanika Women Golden & Turquoise Blue Printed Donalda Top,http://www.myntra.com/Tops/Remanika/Remanika-Women-Golden-&-Turquoise-Blue-Printed-Donalda-Top/196345/buy,Rs. 1,600,fashion-sale,Extra 32% Off on 30,Remanika,http://myntra.myntassets.com/images/style/properties/Remanika-Women-Golden-&-Turquoise-Blue-Printed-Donalda-Top_e7c04431a9f48bc7faa5cdc943a7d65f_images_1080_1440_mini.jpg,None,None,fashion,http://www.myntra.com/Tops/Remanika/Remanika-Women-Golden-&-Turquoise-Blue-Printed-Donalda-Top/196345/buy,Sold byVector Ecommerce Pvt Ltd,None,None,['XS', 'S', 'M'],None,<ul class="mk-pdpv1-product-helper mk-cf"><li class="desc-main-title">Product Description</li><li class="desc-sub-title">Style Note</li><li class="desc-sub-text " itemprop="description"><p>Remanika sure knows how to create coveted styles that make it to the top of our wish-list. Match this top with skinny jeans, peep toes and vintage stud earrings for mall-hopping with your girlfriends.</p></li><li class="desc-sub-title ">Product Details</li><li class="desc-sub-text"><p>Golden and turquoise blue printed top, woven, V neck that stands at back, long sleeves with buttoned cuffs, wrap style front that is tacked at neck, flap at left chest, back yoke with pleat below, curved hemline</p></li><li class="desc-sub-title ">Material &amp; Care</li><li class="desc-sub-text "><p>Polyester<br/>Machine wash warm</p></li><li class="desc-sub-title">Size &amp; Fit</li><li class="desc-sub-text"><p>Loose fit<br/>The model (height 5'8" and chest 33") is wearing a size S</p></li></ul>,26:02:2014,None
None,Remanika Women Blue Blouson Top,http://www.myntra.com/Tops/Remanika/Remanika-Women-Blue-Blouson-Top/196335/buy,Rs. 1,700,fashion-sale,Extra 32% Off on 30,Remanika,http://myntra.myntassets.com/images/style/properties/Remanika-Women-Blue-Blouson-Top_8dbc1fc217c816a0f8cd233ea410cd90_images_1080_1440_mini.jpg,None,None,fashion,http://www.myntra.com/Tops/Remanika/Remanika-Women-Blue-Blouson-Top/196335/buy,Sold byVector Ecommerce Pvt Ltd,None,None,['XS', 'S', 'M', 'L', 'XL'],None,<ul class="mk-pdpv1-product-helper mk-cf"><li class="desc-main-title">Product Description</li><li class="desc-sub-title">Style Note</li><li class="desc-sub-text " itemprop="description"><p>Make a statement with this stylish top from Remanika, which is designed to delight the fashionista in you. Pair it with skinny jeans and ballerinas for a look that spells casual wherever you go.</p></li><li class="desc-sub-title ">Product Details</li><li class="desc-sub-text"><p>Blue blouson top, woven, spread collar, sleeveless, draped front with pleats at placket and side seams, full buttoned chest placket, lace detail at back</p></li><li class="desc-sub-title ">Material &amp; Care</li><li class="desc-sub-text "><p>70% polyester and 30% viscose<br/>Dry clean only</p></li><li class="desc-sub-title">Size &amp; Fit</li><li class="desc-sub-text"><p>Loose fit<br/>The model (height 5'8" and chest 33") is wearing a size S</p></li></ul>,26:02:2014,None
None,Remanika Women Brown Tunic,http://www.myntra.com/Tunics/Remanika/Remanika-Women-Brown-Tunic/174400/buy,Rs. 900,fashion-sale,Extra 32% Off on 30,Remanika,http://myntra.myntassets.com/images/style/properties/Remanika-Women-Orange-Tunic_e0ef4ebac8ab46ddbe6ac42398736f3e_images_1080_1440.jpg,None,None,fashion,http://www.myntra.com/Tunics/Remanika/Remanika-Women-Brown-Tunic/174400/buy,Sold byVector Ecommerce Pvt Ltd,None,None,['XS', 'S', 'M', 'L', 'XL', 'XXL'],None,<ul class="mk-pdpv1-product-helper mk-cf"><li class="desc-main-title">Product Description</li><li class="desc-sub-title">Style Note</li><li class="desc-sub-text " itemprop="description"><p>Go mod this season with this trendy tunic from Remanika. Style it with contrast leggings and ballet flats for a cute day look.</p></li><li class="desc-sub-title ">Product Details</li><li class="desc-sub-text"><p>Brown tunic, woven, round neck, sleeveless, pleats in the front and back below the waist, curved hem</p></li><li class="desc-sub-title ">Material &amp; Care</li><li class="desc-sub-text "><p>Cotton<br/>Machine wash warm</p></li><li class="desc-sub-title">Size &amp; Fit</li><li class="desc-sub-text"><p>Regular fit<br/>The model height (height 5'8" and chest 33") is wearing a size S</p></li></ul>,26:02:2014,None
None,Remanika Women Orange Coloured Embroidered Tunic,http://www.myntra.com/Tunics/Remanika/Remanika-Women-Orange-Coloured-Embroidered-Tunic/196370/buy,Rs. 1,800,fashion-sale,Extra 32% Off on 30,Remanika,http://myntra.myntassets.com/images/style/properties/Remanika-Women-Peach-Coloured-Embroidered-Tunic_d92d07883a7de8c80f0139089303bae0_images_1080_1440_mini.jpg,None,None,fashion,http://www.myntra.com/Tunics/Remanika/Remanika-Women-Orange-Coloured-Embroidered-Tunic/196370/buy,Sold byVector Ecommerce Pvt Ltd,None,None,['XS', 'S', 'M', 'L', 'XL'],None,<ul class="mk-pdpv1-product-helper mk-cf"><li class="desc-main-title">Product Description</li><li class="desc-sub-title">Style Note</li><li class="desc-sub-text " itemprop="description"><p>Make a statement with this stylish tunic from Remanika, which is designed to delight the fashionista in you. Pair it with skinny jeans and ballerinas for a look that spells casual wherever you go.</p></li><li class="desc-sub-title ">Product Details</li><li class="desc-sub-text"><p>Orange embroidered tunic, woven, mandarin collar with embroidery and slit, three quarter panelled and elasticated sleeves with elasticated hems, short buttoned chest placket, embroidered overlay at chest with pleats below, stylised back yoke with pleats below, lace trim along hemline</p></li><li class="desc-sub-title ">Material &amp; Care</li><li class="desc-sub-text "><p>Cotton<br/>Hand wash</p></li><li class="desc-sub-title">Size &amp; Fit</li><li class="desc-sub-text"><p>Loose fit<br/>The model (height 5'8" and chest 33" ) is wearing a size S</p></li></ul>,26:02:2014,None
None,Remanika Navy & White Striped Shift Dress,http://www.myntra.com/Dresses/Remanika/Remanika-Navy-&-White-Striped-Shift-Dress/196329/buy,Rs. 1,600,fashion-sale,Extra 32% Off on 30,Remanika,http://myntra.myntassets.com/images/style/properties/Remanika-Navy-&-White-Striped-Shift-Dress_e0b63783d08bba69a21041e0c640b110_images_1080_1440_mini.jpg,None,None,fashion,http://www.myntra.com/Dresses/Remanika/Remanika-Navy-&-White-Striped-Shift-Dress/196329/buy,Sold byVector Ecommerce Pvt Ltd,None,None,['XS', 'S', 'M', 'L', 'XL'],None,<ul class="mk-pdpv1-product-helper mk-cf"><li class="desc-main-title">Product Description</li><li class="desc-sub-title">Style Note</li><li class="desc-sub-text " itemprop="description"><p>You don't have to set sail to wear this nautical-inspired piece by Remanika. Go sailor chic by pairing this with pumps and ocean-themed jewels, like an anchor chain.</p></li><li class="desc-sub-title ">Product Details</li><li class="desc-sub-text"><p>White and navy striped dress, woven, round neck with flat collar, pleats at front neck, sleeveless, panel at front hip sides, button-and-loop fastened slit at back neck</p></li><li class="desc-sub-title ">Material &amp; Care</li><li class="desc-sub-text "><p>Polyester<br/>Machine wash warm</p></li><li class="desc-sub-title">Size &amp; Fit</li><li class="desc-sub-text"><p>Slim fit<br/>The model (height 5'6", chest 34", waist 26") is wearing a size S which measures 87 cm from shoulder to hem</p></li></ul>,26:02:2014,None
None,Remanika Women Blue Printed tunic,http://www.myntra.com/Tunics/Remanika/Remanika-Women-Blue-Printed-tunic/83169/buy,Rs. 800,fashion-sale,Extra 32% Off on 30,Remanika,http://myntra.myntassets.com/images/style/properties/Remanika-Women-Blue-Printed-tunic_df529918cd851ea109ed4e4369aa950e_images_1080_1440_mini.jpg,Rs. 1,600,None,fashion,http://www.myntra.com/Tunics/Remanika/Remanika-Women-Blue-Printed-tunic/83169/buy,Sold byVector Ecommerce Pvt Ltd,None,None,['XS', 'S', 'M', 'L'],None,<ul class="mk-pdpv1-product-helper mk-cf"><li class="desc-main-title">Product Description</li><li class="desc-sub-title">Style Note</li><li class="desc-sub-text " itemprop="description"><p>Wear this flirty tunic from Remanika for an evening out or when shopping with your girl friends. You can style this charming and chic tunic with stockings or with a sleek watch and strappy heels for a dressier look.</p></li><li class="desc-sub-title ">Product Details</li><li class="desc-sub-text"><p>Blue tunic with multi coloured floral prints, woven, has shoulder straps with petal like embellishments, ruffles in front, square neckline, gathers at the waist and elasticated smocking at the back</p></li><li class="desc-sub-title ">Material &amp; Care</li><li class="desc-sub-text "><p>Cotton<br/>Machine wash</p></li><li class="desc-sub-title">Size &amp; Fit</li><li class="desc-sub-text"><p>Regular fit<br/>The model (height 5'8" and chest 33") is wearing a size M</p></li></ul>,26:02:2014,None
None,Remanika Women Beige Tunic,http://www.myntra.com/Tunics/Remanika/Remanika-Women-Beige-Tunic/174399/buy,Rs. 900,fashion-sale,Extra 32% Off on 30,Remanika,http://myntra.myntassets.com/images/style/properties/Remanika-Women-Beige-Tunic_6c6cd52690e8619d285c9acd26ae53fb_images_1080_1440_mini.jpg,None,None,fashion,http://www.myntra.com/Tunics/Remanika/Remanika-Women-Beige-Tunic/174399/buy,Sold byVector Ecommerce Pvt Ltd,None,None,['XS', 'S', 'M', 'L', 'XL', 'XXL'],None,<ul class="mk-pdpv1-product-helper mk-cf"><li class="desc-main-title">Product Description</li><li class="desc-sub-title">Style Note</li><li class="desc-sub-text " itemprop="description"><p>Beautiful and stylish, this eye-catching tunic is an absolute must-have. Team it over a pair of contrast leggings and ballet flats for a relaxed look.</p></li><li class="desc-sub-title ">Product Details</li><li class="desc-sub-text"><p>Beige tunic, woven, round neck, sleeveless, pleats in the front and back below the waist, curved hem</p></li><li class="desc-sub-title ">Material &amp; Care</li><li class="desc-sub-text "><p>Cotton<br/>Machine wash warm</p></li><li class="desc-sub-title">Size &amp; Fit</li><li class="desc-sub-text"><p>Regular fit<br/>The model height (height 5'8" and chest 33") is wearing a size S</p></li></ul>,26:02:2014,None
None,Remanika Women Blue Top,http://www.myntra.com/Tops/Remanika/Remanika-Women-Blue-Top/196354/buy,Rs. 1,300,fashion-sale,Extra 32% Off on 30,Remanika,http://myntra.myntassets.com/images/style/properties/Remanika-Women-Blue-Top_da18554a2705ebdfe48ba989b9d53986_images_1080_1440_mini.jpg,None,None,fashion,http://www.myntra.com/Tops/Remanika/Remanika-Women-Blue-Top/196354/buy,Sold byVector Ecommerce Pvt Ltd,None,None,['XS', 'S', 'M'],None,<ul class="mk-pdpv1-product-helper mk-cf"><li class="desc-main-title">Product Description</li><li class="desc-sub-title">Style Note</li><li class="desc-sub-text " itemprop="description"><p>Make a statement with this stylish top from Remanika, which is designed to delight the fashionista in you. Pair it with skinny jeans and ballerinas for a look that spells casual wherever you go.</p></li><li class="desc-sub-title ">Product Details</li><li class="desc-sub-text"><p>Blue top, knitted, V neck, long sleeves, full buttoned chest placket, panelled front with stitch detail, back, yoke, sheer back, front hem dipped at sides, curved back hem longer than front</p></li><li class="desc-sub-title ">Material &amp; Care</li><li class="desc-sub-text "><p>50% viscose, 50% polyester<br/>Machine wash warm</p></li><li class="desc-sub-title">Size &amp; Fit</li><li class="desc-sub-text"><p>Loose fit<br/>The model (height 5'8" and chest 33" ) is wearing a size S</p></li></ul>,26:02:2014,None
None,Remanika Women Black Sheer Top,http://www.myntra.com/Tops/Remanika/Remanika-Women-Black-Sheer-Top/196339/buy,Rs. 1,800,fashion-sale,Extra 32% Off on 30,Remanika,http://myntra.myntassets.com/images/style/properties/Remanika-Women-Black-Sheer-Top_7c596b9800618249263f110df88e061b_images_1080_1440_mini.jpg,None,None,fashion,http://www.myntra.com/Tops/Remanika/Remanika-Women-Black-Sheer-Top/196339/buy,Sold byVector Ecommerce Pvt Ltd,None,None,['XS', 'S', 'M'],None,<ul class="mk-pdpv1-product-helper mk-cf"><li class="desc-main-title">Product Description</li><li class="desc-sub-title">Style Note</li><li class="desc-sub-text " itemprop="description"><p>Make a statement with this stylish top from Remanika, which is designed to delight the fashionista in you. Pair it with skinny jeans and ballerinas for a look that spells casual wherever you go.</p></li><li class="desc-sub-title ">Product Details</li><li class="desc-sub-text"><p>Black sheer top, woven, spread collar with metal stud detail and slit at back, sleeveless, draped panels at sides with pleats at seams, full buttoned chest placket</p></li><li class="desc-sub-title ">Material &amp; Care</li><li class="desc-sub-text "><p>100% polyester<br/>Hand wash</p></li><li class="desc-sub-title">Size &amp; Fit</li><li class="desc-sub-text"><p>Loose fit<br/>The model (height 5'8" and chest 33") is wearing a size S</p></li></ul>,26:02:2014,None
