None,Merrell Women Yellow Orenco Jacket,http://www.myntra.com/Jackets/Merrell/Merrell-Women-Yellow-Orenco-Jacket/146560/buy,Rs. 3,959,winterwear,Winterwear - Flat 30%,Merrell,http://myntra.myntassets.com/images/style/properties/Merrell-Women-Yellow-Orenco-Jacket_aa7dd7db510cf75fe270014700a72ab1_images_1080_1440_mini.jpg,Rs. 6,599,None,winterwear,http://www.myntra.com/Jackets/Merrell/Merrell-Women-Yellow-Orenco-Jacket/146560/buy,Sold byVector Ecommerce Pvt Ltd,None,None,['M', 'L', 'XL'],None,<ul class="mk-pdpv1-product-helper mk-cf"><li class="desc-main-title">Product Description</li><li class="desc-sub-title">Style Note</li><li class="desc-sub-text " itemprop="description"><p>Packed with functional features, this breeze blocking jacket from Merrell will be a great pick for that adventure sports weekend you've got planned. Lightweight with water and stain repelling technology, coupled with trademark Aeroblock wind resistance, you're sure to be protected from the elements in this peppy piece of outerwear.</p></li><li class="desc-sub-title ">Product Details</li><li class="desc-sub-text"><p>Yellow jacket with self checks, woven, super lightweight DWR finish repels water and resists staining, moisture wicking, reflective piping and logos for visibility in low light, Merrell Aeroblock provides high wind-resistance and breathability, hood with contrast binding, mock collar, long sleeves with elasticated hems, mesh underarm panels, panelled overlays across shoulders with mesh lined vents for breathability, open ended zip closure down front, zipped back pocket with light reflecting strip, elasticated hemline</p></li><li class="desc-sub-title ">Material &amp; Care</li><li class="desc-sub-text "><p>100% polyester<br/>Machine wash warm</p></li><li class="desc-sub-title">Size &amp; Fit</li><li class="desc-sub-text"><p>The model (height 5'8" and chest 33") is wearing a size M</p></li></ul>,26:02:2014,None
None,Merrell Women Charcoal Grey Quilted Astor Down Hooded Jacket,http://www.myntra.com/Jackets/Merrell/Merrell-Women-Charcoal-Grey-Quilted-Astor-Down-Hooded-Jacket/219474/buy,Rs. 5,999,winterwear,Winterwear - Flat 30%,Merrell,http://myntra.myntassets.com/images/style/properties/Merrell-Women-Charcoal-Grey-Quilted-Astor-Down-Hooded-Jacket_ac52edb7423b15866f3b6c6b662ab80d_images_1080_1440_mini.JPG,Rs. 9,999,None,winterwear,http://www.myntra.com/Jackets/Merrell/Merrell-Women-Charcoal-Grey-Quilted-Astor-Down-Hooded-Jacket/219474/buy,Sold byVector Ecommerce Pvt Ltd,None,None,['XS', 'S', 'M', 'L'],None,<ul class="mk-pdpv1-product-helper mk-cf"><li class="desc-main-title">Product Description</li><li class="desc-sub-title">Style Note</li><li class="desc-sub-text " itemprop="description"><p>Packed with functional features, this super warm jacket from Merrell will be a great pick for the winter season. Lightweight, durable and down insulated, you're sure to be protected from the elements in this piece of outerwear. We think it would look great paired with skinny jeans or track pants and sturdy footwear.</p></li><li class="desc-sub-title ">Product Details</li><li class="desc-sub-text"><p>Charcoal grey quilted jacket, insulated down padding, M Select WARM for warmth without bulk, M Select DRY stays dry inside and out, water resistant, mock collar with grown-on hood that is elasticated along opening, long sleeves with elastication along hems, full zipped closure at front with chin guard at neck to prevent chafing, zipped pockets at front waist, printed branding towards front hem, has lining attached with zipped pocket at left chest, elasticated drawstring channelled through hem with toggle adjuster at sides</p></li><li class="desc-sub-title ">Material &amp; Care</li><li class="desc-sub-text "><p>Shell: 100% polyester<br/>Padding: 80% goose down, 20% goose feather<br/>Machine wash cold</p></li><li class="desc-sub-title">Size &amp; Fit</li><li class="desc-sub-text"><p>The model (height 5'8" and chest 33") is wearing a size S</p></li></ul>,26:02:2014,None
None,Merrell Men Grey & Grey Melange Nanook Softshell Jacket,http://www.myntra.com/Jackets/Merrell/Merrell-Men-Grey-&-Grey-Melange-Nanook-Softshell-Jacket/219460/buy,Rs. 5,999,winterwear,Winterwear - Flat 30%,Merrell,http://myntra.myntassets.com/images/style/properties/Merrell-Men-Jackets_e9be6bc2d69e5fd3a23b926be30cc182_images_1080_1440_mini.jpg,Rs. 9,999,None,winterwear,http://www.myntra.com/Jackets/Merrell/Merrell-Men-Grey-&-Grey-Melange-Nanook-Softshell-Jacket/219460/buy,Sold byVector Ecommerce Pvt Ltd,None,None,['S', 'M', 'L', 'XL'],None,<ul class="mk-pdpv1-product-helper mk-cf"><li class="desc-main-title">Product Description</li><li class="desc-sub-title">Style Note</li><li class="desc-sub-text " itemprop="description"><p>Experience the best comfort in style by wearing this jacket from Merrell. We absolutely love the detailing and high-end features and think it would look great when paired with a pair of tapered jeans and high-tops.</p></li><li class="desc-sub-title ">Product Details</li><li class="desc-sub-text"><p>Grey and grey melange jacket with orange accents, M Select REGULATE for warmth, M Select DRY stays dry inside and out, M select WIND for shelter from storm, water resistant, lightly padded, panelled, mock collar, panelled long sleeves, printed branding at left sleeve, full zipped closure at front, printed branding at left chest, concealed zipped pocket built into panel at left chest, zipped pockets at front waist, has lining attached with insert pockets at either sides, elasticated drawstring channelled through hem with toggle adjuster at sides</p></li><li class="desc-sub-title ">Material &amp; Care</li><li class="desc-sub-text "><p>Polyester<br/>Machine wash cold</p></li><li class="desc-sub-title">Size &amp; Fit</li><li class="desc-sub-text"><p>The model (height 5'8" and chest 33") is wearing a size M</p></li></ul>,26:02:2014,None
None,Merrell Men Blue Grady Soft Shell Jacket,http://www.myntra.com/Jackets/Merrell/Merrell-Men-Blue-Grady-Soft-Shell-Jacket/219464/buy,Rs. 4,799,winterwear,Winterwear - Flat 30%,Merrell,http://myntra.myntassets.com/images/style/properties/Merrell-Men-Jackets_04c05e8b051cc151ea6f2512e25d4920_images_1080_1440_mini.jpg,Rs. 7,999,None,winterwear,http://www.myntra.com/Jackets/Merrell/Merrell-Men-Blue-Grady-Soft-Shell-Jacket/219464/buy,Sold byVector Ecommerce Pvt Ltd,None,None,['S', 'M', 'L', 'XL'],None,<ul class="mk-pdpv1-product-helper mk-cf"><li class="desc-main-title">Product Description</li><li class="desc-sub-title">Style Note</li><li class="desc-sub-text " itemprop="description"><p>Packed with functional features, this jacket from Merrell will be a great pick for the winter season. Giving you high mobility, breathability and wind resistance, you're sure to be protected from the elements in this piece of outerwear.</p></li><li class="desc-sub-title ">Product Details</li><li class="desc-sub-text"><p>Blue jacket, M Select Wind combines high mobility, breathability and wind resistance technologies, mock collar, panelled long sleeves with Velcro fastened tab at hems, full zipped closure at front, zipped pocket and embroidered branding at left chest, zipped pockets at front waist, elasticated drawstring channelled through hem with toggle adjuster at sides, plastic loop attached on the inside at front hem, pockets at either side of front on the inside</p></li><li class="desc-sub-title ">Material &amp; Care</li><li class="desc-sub-text "><p>87% polyester, 13% elastane<br/>Machine wash warm</p></li><li class="desc-sub-title">Size &amp; Fit</li><li class="desc-sub-text"><p>The model (height 6' and shoulders 18") is wearing a size M</p></li></ul>,26:02:2014,None
None,Merrell Men Grey Quentin Sleeveless Jacket,http://www.myntra.com/Jackets/Merrell/Merrell-Men-Grey-Quentin-Sleeveless-Jacket/219454/buy,Rs. 3,599,winterwear,Winterwear - Flat 30%,Merrell,http://myntra.myntassets.com/images/style/properties/Merrell-Men-Grey-Quentin-Sleeveless-Jacket_0fd21836b8920e629273c47e40486a2a_images_1080_1440_mini.jpg,Rs. 5,999,None,winterwear,http://www.myntra.com/Jackets/Merrell/Merrell-Men-Grey-Quentin-Sleeveless-Jacket/219454/buy,Sold byVector Ecommerce Pvt Ltd,None,None,['S', 'M', 'L', 'XL'],None,<ul class="mk-pdpv1-product-helper mk-cf"><li class="desc-main-title">Product Description</li><li class="desc-sub-title">Style Note</li><li class="desc-sub-text " itemprop="description"><p>Packed with functional features, this breeze blocking jacket from Merrell will be a great pick for this winter season. Lightweight with water resistant and thermal efficient technology, you're sure to be protected from the elements in this peppy piece of outerwear.</p></li><li class="desc-sub-title ">Product Details</li><li class="desc-sub-text"><p>Grey slightly padded jacket with a tinge of purple and stitch detailing throughout, mock collar, sleeveless with contrast binding, zipped front, two pockets at chest with buttoned flaps, contrast knit panelled detailing at the sides, zipped pockets at either side on front waist, brand print above left hem, attached lining</p></li><li class="desc-sub-title ">Material &amp; Care</li><li class="desc-sub-text "><p>100% polyester<br/>Machine wash warm</p></li><li class="desc-sub-title">Size &amp; Fit</li><li class="desc-sub-text"><p>Regular fit<br/>The model (height 5'8" and chest 33") is wearing a size M</p></li></ul>,26:02:2014,None
None,Merrell Men Navy Alpino Hooded Sweatshirt,http://www.myntra.com/Sweatshirts/Merrell/Merrell-Men-Navy-Alpino-Hooded-Sweatshirt/219461/buy,Rs. 3,599,winterwear,Winterwear - Flat 30%,Merrell,http://myntra.myntassets.com/images/style/properties/Merrell-Men-Jackets_1c6896c174f89a32cb2dddae1cedce12_images_1080_1440_mini.jpg,Rs. 5,999,None,winterwear,http://www.myntra.com/Sweatshirts/Merrell/Merrell-Men-Navy-Alpino-Hooded-Sweatshirt/219461/buy,Sold byVector Ecommerce Pvt Ltd,None,None,['S', 'M', 'L', 'XL'],None,<ul class="mk-pdpv1-product-helper mk-cf"><li class="desc-main-title">Product Description</li><li class="desc-sub-title">Style Note</li><li class="desc-sub-text " itemprop="description"><p>Packed with functional features, this sweatshirt from Merrell will be a great pick for the winter season. With moisture and body heat managing technologies like M Select WICK and M Select PERFORMIX, you're sure to be comfy and warm in this piece of outerwear. Team it with a pair of jeans or track pants.</p></li><li class="desc-sub-title ">Product Details</li><li class="desc-sub-text"><p>Navy sweatshirt, knitted, panelled, has a stand collar, attached hood, long raglan sleeves with elbow patches, full zipped closure at front, two zipped insert pockets at either side of front waist, printed branding above hem at left front, elasticated drawstring channelled through hem with toggle adjuster at sides</p></li><li class="desc-sub-title ">Material &amp; Care</li><li class="desc-sub-text "><p>Shell 1: 100% polyester<br/>Shell 2: 38% acrylic, 38% polyester, 38% wool<br/>Machine wash cold</p></li><li class="desc-sub-title">Size &amp; Fit</li><li class="desc-sub-text"><p>The model (height 6' and shoulders 18") is wearing a size M</p></li></ul>,26:02:2014,None
None,Merrell Women Blue Muffler & Beanie Cap Set,http://www.myntra.com/Mufflers/Merrell/Merrell-Women-Blue-Muffler-&-Beanie-Cap-Set/219441/buy,Rs. 2,099,winterwear,Winterwear - Flat 30%,Merrell,http://myntra.myntassets.com/images/style/properties/Merrell-Women-Blue-Muffler-&-Beanie-Cap-Set_e76dca9d4c409143f616214412ec873e_images_1080_1440_mini.jpg,Rs. 3,499,None,winterwear,http://www.myntra.com/Mufflers/Merrell/Merrell-Women-Blue-Muffler-&-Beanie-Cap-Set/219441/buy,Sold byVector Ecommerce Pvt Ltd,None,None,single size,None,<ul class="mk-pdpv1-product-helper mk-cf"><li class="desc-main-title">Product Description</li><li class="desc-sub-title">Style Note</li><li class="desc-sub-text " itemprop="description"><p>This muffler and beanie cap combo by Merrell is great way to add dimension to your mundane  outfits. Team it with your western attire to jazz up your look  instantly.</p></li><li class="desc-sub-title ">Product Details</li><li class="desc-sub-text"><p>Blue knit muffler and beanie cap<br/>Blue muffler in a Fair Isle knit pattern, four-colour tonal colourways, brand tag at one end and metal branding at the other,  ribbed hem<br/>Blue beanie cap in a Fair Isle knit pattern, four-colour tonal colourways, pom-pom detail at top, ribbed hem with a fold-up feature and metallic branding</p></li><li class="desc-sub-title ">Material &amp; Care</li><li class="desc-sub-text "><p>70% acrylic, 30% wool<br/>Hand wash</p></li><li class="desc-sub-title">Size &amp; Fit</li><li class="desc-sub-text"><p>Muffler length: 170 cm<br/>Muffler width: 13 cm</p></li></ul>,26:02:2014,None
None,Merrell Women Orange & Blue Cisteran Muffler,http://www.myntra.com/Mufflers/Merrell/Merrell-Women-Orange-&-Blue-Cisteran-Muffler/219481/buy,Rs. 1,199,winterwear,Winterwear - Flat 30%,Merrell,http://myntra.myntassets.com/images/style/properties/Merrell-Women-Scarves_25d7d7ee9ab67da308f1439b09e441d5_images_1080_1440_mini.jpg,Rs. 1,999,None,winterwear,http://www.myntra.com/Mufflers/Merrell/Merrell-Women-Orange-&-Blue-Cisteran-Muffler/219481/buy,Sold byVector Ecommerce Pvt Ltd,None,None,single size,None,<ul class="mk-pdpv1-product-helper mk-cf"><li class="desc-main-title">Product Description</li><li class="desc-sub-title">Style Note</li><li class="desc-sub-text " itemprop="description"><p>This muffler by Merrell is great way to add dimension to your mundane outfits. Team it with your western attire to jazz up your look instantly.</p></li><li class="desc-sub-title ">Product Details</li><li class="desc-sub-text"><p>Orange, blue and off-white muffler, knitted, ribbed hem, brand tag at one end and metal branding at the other</p></li><li class="desc-sub-title ">Material &amp; Care</li><li class="desc-sub-text "><p>70% acrylic, 30% wool<br/>Hand wash</p></li><li class="desc-sub-title">Size &amp; Fit</li><li class="desc-sub-text"><p>Length: 168 cm<br/>Width: 16 cm</p></li></ul>,26:02:2014,None
None,Merrell Men Blue Quentin Vest Sleeveless Jacket,http://www.myntra.com/Jackets/Merrell/Merrell-Men-Blue-Quentin-Vest-Sleeveless-Jacket/219457/buy,Rs. 3,599,winterwear,Winterwear - Flat 30%,Merrell,http://myntra.myntassets.com/images/style/properties/Merrell-Men-Jackets_5ed3d4a08eb79d23e54ed88d08ae8b99_images_1080_1440_mini.jpg,Rs. 5,999,None,winterwear,http://www.myntra.com/Jackets/Merrell/Merrell-Men-Blue-Quentin-Vest-Sleeveless-Jacket/219457/buy,Sold byVector Ecommerce Pvt Ltd,None,None,['S', 'M', 'L', 'XL'],None,<ul class="mk-pdpv1-product-helper mk-cf"><li class="desc-main-title">Product Description</li><li class="desc-sub-title">Style Note</li><li class="desc-sub-text " itemprop="description"><p>Experience the best comfort in style by wearing this jacket from Merrell. We absolutely love the detailing and high-end features and think it would look great when paired with a pair of tapered jeans and high-tops.</p></li><li class="desc-sub-title ">Product Details</li><li class="desc-sub-text"><p>Blue and navy quilted jacket, constructed in Primaloft fabric that is high loft, water resistant, soft, compressible and thermally efficient, M Select WARM for warmth without bulk, M Select DRY stays dry inside and out, lightly padded, mock collar, sleeveless with piping at armholes, full zipped closure at front, welt pockets with press buttoned flap at chest, zipped pockets at front waist, printed branding towards front hem, contrast panel at sides, elasticated drawstring channelled through hem with toggle adjuster at sides, has lining attached with slip pocket at either sides</p></li><li class="desc-sub-title ">Material &amp; Care</li><li class="desc-sub-text "><p>Polyester<br/>Machine wash cold</p></li><li class="desc-sub-title">Size &amp; Fit</li><li class="desc-sub-text"><p>The model (height 5'8" and chest 33") is wearing a size M</p></li></ul>,26:02:2014,None
None,Merrell Men Brown & Navy Quentin Vest Sleeveless Jacket,http://www.myntra.com/Jackets/Merrell/Merrell-Men-Brown-&-Navy-Quentin-Vest-Sleeveless-Jacket/219455/buy,Rs. 3,599,winterwear,Winterwear - Flat 30%,Merrell,http://myntra.myntassets.com/images/style/properties/Merrell-Men-Jackets_14b5e02917b3dceae1db2d78fd360b90_images_1080_1440_mini.JPG,Rs. 5,999,None,winterwear,http://www.myntra.com/Jackets/Merrell/Merrell-Men-Brown-&-Navy-Quentin-Vest-Sleeveless-Jacket/219455/buy,Sold byVector Ecommerce Pvt Ltd,None,None,['S', 'M', 'L', 'XL'],None,<ul class="mk-pdpv1-product-helper mk-cf"><li class="desc-main-title">Product Description</li><li class="desc-sub-title">Style Note</li><li class="desc-sub-text " itemprop="description"><p>Experience the best comfort in style by wearing this jacket from Merrell. We absolutely love the detailing and high-end features and think it would look great when paired with a pair of tapered jeans and high-tops.</p></li><li class="desc-sub-title ">Product Details</li><li class="desc-sub-text"><p>Brown and navy quilted jacket, constructed in Primaloft fabric that is high loft, water resistant, soft, compressible and thermally efficient, M Select WARM for warmth without bulk, M Select DRY stays dry inside and out, lightly padded, mock collar, sleeveless with piping at armholes, full zipped closure at front, welt pockets with press buttoned flap at chest, zipped pockets at front waist, printed branding towards front hem, contrast panel at sides, elasticated drawstring channelled through hem with toggle adjuster at sides, has lining attached with slip pocket at either side</p></li><li class="desc-sub-title ">Material &amp; Care</li><li class="desc-sub-text "><p>Polyester<br/>Machine wash cold</p></li><li class="desc-sub-title">Size &amp; Fit</li><li class="desc-sub-text"><p>The model (height 5'8" and chest 33") is wearing a size M</p></li></ul>,26:02:2014,None
None,Merrell Men Black Torrent Shell Jacket,http://www.myntra.com/Jackets/Merrell/Merrell-Men-Black-Torrent-Shell-Jacket/146557/buy,Rs. 4,199,winterwear,Winterwear - Flat 30%,Merrell,http://myntra.myntassets.com/images/style/properties/Merrell-Men-Jackets_10087deae64d04fb6e86cc4ad01b4833_images_1080_1440_mini.jpg,Rs. 6,999,None,winterwear,http://www.myntra.com/Jackets/Merrell/Merrell-Men-Black-Torrent-Shell-Jacket/146557/buy,Sold byVector Ecommerce Pvt Ltd,None,None,['S', 'M', 'L', 'XL'],None,<ul class="mk-pdpv1-product-helper mk-cf"><li class="desc-main-title">Product Description</li><li class="desc-sub-title">Style Note</li><li class="desc-sub-text " itemprop="description"><p>Packed with functional features, this breeze blocking jacket from Merrell will be a great pick for that adventure sports weekend you've got planned. Lightweight with water and stain repelling technology, coupled with trademark Aeroblock wind resistance, you're sure to be protected from the elements in this peppy piece of outerwear.</p></li><li class="desc-sub-title ">Product Details</li><li class="desc-sub-text"><p>Black jacket, woven, made with super lightweight DWR (durable water resistant) finish that repels water and resists staining, Merrell Aeroblock provides high wind-resistance and breathability, moisture wicking, reflective piping and logos for visibility in low light, mock collar, full zipped placket on front,  knit stretchable side panels, long sleeves with elasticated hems, zipped welt pocket at left chest, toggle strap detail at hem</p></li><li class="desc-sub-title ">Material &amp; Care</li><li class="desc-sub-text "><p>100% polyester<br/>Machine wash warm</p></li><li class="desc-sub-title">Size &amp; Fit</li><li class="desc-sub-text"><p>Relaxed fit<br/>The model (height 5'8" and chest 33") is wearing a size M</p></li></ul>,26:02:2014,None
