None,Merrell Men Rust Red Adventure Rest Ridge Hooded Jacket,http://www.myntra.com/Jackets/Merrell/Merrell-Men-Rust-Red-Adventure-Rest-Ridge-Hooded-Jacket/219451/buy,Rs. 5,999,winterwear,Winterwear - Flat 30%,Merrell,http://myntra.myntassets.com/images/style/properties/Merrell-Men-Jackets_537301b6b0ba2cfc3760cd4b31337ffa_images_1080_1440.jpg,Rs. 9,999,None,winterwear,http://www.myntra.com/Jackets/Merrell/Merrell-Men-Rust-Red-Adventure-Rest-Ridge-Hooded-Jacket/219451/buy,Sold byVector Ecommerce Pvt Ltd,None,None,['S', 'M', 'L', 'XL'],None,<ul class="mk-pdpv1-product-helper mk-cf"><li class="desc-main-title">Product Description</li><li class="desc-sub-title">Style Note</li><li class="desc-sub-text " itemprop="description"><p>Experience the best comfort in style by wearing this jacket from Merrell. We absolutely love the detailing and high-end features and think it would look great when paired with a pair of tapered jeans and high-tops.</p></li><li class="desc-sub-title ">Product Details</li><li class="desc-sub-text"><p>Rust red quilted jacket, constructed in Primaloft fabric that is high loft, water resistant, soft, compressible and thermally efficient, padded, transforms into a neck pillow when packed in the compartment at the inner lining with zip closure, mock collar with grown-on hood that is elasticated along opening, tab with Velcro closure at back of hood, long sleeves with elasticated hems, printed branding at left sleeve, full zipped closure at front, printed branding at left chest, zipped pockets at front waist, has lining attached with insert pocket at left side, elasticated drawstring channelled through hem with toggle adjuster at sides</p></li><li class="desc-sub-title ">Material &amp; Care</li><li class="desc-sub-text "><p>Polyester and nylon<br/>Machine wash cold</p></li><li class="desc-sub-title">Size &amp; Fit</li><li class="desc-sub-text"><p>The model (height 5'8" and chest 33") is wearing a size M</p></li></ul>,26:02:2014,None
None,Merrell Men Black & Grey Nanook Softshell Jacket,http://www.myntra.com/Jackets/Merrell/Merrell-Men-Black-&-Grey-Nanook-Softshell-Jacket/219458/buy,Rs. 5,999,winterwear,Winterwear - Flat 30%,Merrell,http://myntra.myntassets.com/images/style/properties/Merrell-Men-Black-&-Grey-Nanook-Softshell-Jacket_22404be728741ca96ace8e7f4355629b_images_1080_1440_mini.jpg,Rs. 9,999,None,winterwear,http://www.myntra.com/Jackets/Merrell/Merrell-Men-Black-&-Grey-Nanook-Softshell-Jacket/219458/buy,Sold byVector Ecommerce Pvt Ltd,None,None,['S', 'M', 'L', 'XL'],None,<ul class="mk-pdpv1-product-helper mk-cf"><li class="desc-main-title">Product Description</li><li class="desc-sub-title">Style Note</li><li class="desc-sub-text " itemprop="description"><p>Experience the best comfort in style by wearing this jacket from Merrell. We absolutely love the detailing and high-end features and think it would look great when paired with a pair of tapered jeans and high-tops.</p></li><li class="desc-sub-title ">Product Details</li><li class="desc-sub-text"><p>Black and grey melange jacket, M Select REGULATE for warmth, M Select DRY stays dry inside and out, M select WIND for shelter from storm, water resistant, lightly padded, panelled, mock collar, panelled long sleeves with contrast patches on elbow, printed branding at left sleeve, full zipped closure at front, printed branding at left chest, concealed zipped pocket built into panel at left chest, zipped pockets at front waist, has lining attached with insert pockets at either sides, elasticated drawstring channelled through hem with toggle adjuster at sides</p></li><li class="desc-sub-title ">Material &amp; Care</li><li class="desc-sub-text "><p>Polyester<br/>Machine wash cold</p></li><li class="desc-sub-title">Size &amp; Fit</li><li class="desc-sub-text"><p>The model (height 5'8" and chest 33") is wearing a size M</p></li></ul>,26:02:2014,None
None,Merrell Men Grey & Black Quentin Jacket,http://www.myntra.com/Jackets/Merrell/Merrell-Men-Grey-&-Black-Quentin-Jacket/219452/buy,Rs. 4,799,winterwear,Winterwear - Flat 30%,Merrell,http://myntra.myntassets.com/images/style/properties/Merrell-Men-Jackets_2b623083d971a77fe58a950d45de1548_images_1080_1440_mini.JPG,Rs. 7,999,None,winterwear,http://www.myntra.com/Jackets/Merrell/Merrell-Men-Grey-&-Black-Quentin-Jacket/219452/buy,Sold byVector Ecommerce Pvt Ltd,None,None,['S', 'M', 'L', 'XL'],None,<ul class="mk-pdpv1-product-helper mk-cf"><li class="desc-main-title">Product Description</li><li class="desc-sub-title">Style Note</li><li class="desc-sub-text " itemprop="description"><p>Experience the best comfort in style by wearing this jacket from Merrell. We absolutely love the detailing and high-end features and think it would look great when paired with a pair of tapered jeans and high-tops.</p></li><li class="desc-sub-title ">Product Details</li><li class="desc-sub-text"><p>Grey and black quilted jacket, constructed in Primaloft fabric that is high loft, water resistant, soft, compressible and thermally efficient, M Select WARM for warmth without bulk, M Select DRY stays dry inside and out, lightly padded, mock collar, panelled long sleeves with elasticated hems, printed branding at left sleeve, full zipped closure at front, welt pockets with press buttoned flap at chest, zipped pockets at front waist, printed branding towards front hem, contrast panel at sides, elasticated drawstring channelled through hem with toggle adjuster at sides, has lining attached with slip pocket at either side</p></li><li class="desc-sub-title ">Material &amp; Care</li><li class="desc-sub-text "><p>Polyester<br/>Machine wash cold</p></li><li class="desc-sub-title">Size &amp; Fit</li><li class="desc-sub-text"><p>The model (height 5'8" and chest 33") is wearing a size M</p></li></ul>,26:02:2014,None
None,Merrell Men Black Torrent Shell Jacket,http://www.myntra.com/Jackets/Merrell/Merrell-Men-Black-Torrent-Shell-Jacket/146557/buy,Rs. 4,199,winterwear,Winterwear - Flat 30%,Merrell,http://myntra.myntassets.com/images/style/properties/Merrell-Men-Jackets_10087deae64d04fb6e86cc4ad01b4833_images_1080_1440_mini.jpg,Rs. 6,999,None,winterwear,http://www.myntra.com/Jackets/Merrell/Merrell-Men-Black-Torrent-Shell-Jacket/146557/buy,Sold byVector Ecommerce Pvt Ltd,None,None,['S', 'M', 'L', 'XL'],None,<ul class="mk-pdpv1-product-helper mk-cf"><li class="desc-main-title">Product Description</li><li class="desc-sub-title">Style Note</li><li class="desc-sub-text " itemprop="description"><p>Packed with functional features, this breeze blocking jacket from Merrell will be a great pick for that adventure sports weekend you've got planned. Lightweight with water and stain repelling technology, coupled with trademark Aeroblock wind resistance, you're sure to be protected from the elements in this peppy piece of outerwear.</p></li><li class="desc-sub-title ">Product Details</li><li class="desc-sub-text"><p>Black jacket, woven, made with super lightweight DWR (durable water resistant) finish that repels water and resists staining, Merrell Aeroblock provides high wind-resistance and breathability, moisture wicking, reflective piping and logos for visibility in low light, mock collar, full zipped placket on front,  knit stretchable side panels, long sleeves with elasticated hems, zipped welt pocket at left chest, toggle strap detail at hem</p></li><li class="desc-sub-title ">Material &amp; Care</li><li class="desc-sub-text "><p>100% polyester<br/>Machine wash warm</p></li><li class="desc-sub-title">Size &amp; Fit</li><li class="desc-sub-text"><p>Relaxed fit<br/>The model (height 5'8" and chest 33") is wearing a size M</p></li></ul>,26:02:2014,None
None,Merrell Women Orange & Blue Cisteran Muffler,http://www.myntra.com/Mufflers/Merrell/Merrell-Women-Orange-&-Blue-Cisteran-Muffler/219481/buy,Rs. 1,199,winterwear,Winterwear - Flat 30%,Merrell,http://myntra.myntassets.com/images/style/properties/Merrell-Women-Scarves_25d7d7ee9ab67da308f1439b09e441d5_images_1080_1440_mini.jpg,Rs. 1,999,None,winterwear,http://www.myntra.com/Mufflers/Merrell/Merrell-Women-Orange-&-Blue-Cisteran-Muffler/219481/buy,Sold byVector Ecommerce Pvt Ltd,None,None,single size,None,<ul class="mk-pdpv1-product-helper mk-cf"><li class="desc-main-title">Product Description</li><li class="desc-sub-title">Style Note</li><li class="desc-sub-text " itemprop="description"><p>This muffler by Merrell is great way to add dimension to your mundane outfits. Team it with your western attire to jazz up your look instantly.</p></li><li class="desc-sub-title ">Product Details</li><li class="desc-sub-text"><p>Orange, blue and off-white muffler, knitted, ribbed hem, brand tag at one end and metal branding at the other</p></li><li class="desc-sub-title ">Material &amp; Care</li><li class="desc-sub-text "><p>70% acrylic, 30% wool<br/>Hand wash</p></li><li class="desc-sub-title">Size &amp; Fit</li><li class="desc-sub-text"><p>Length: 168 cm<br/>Width: 16 cm</p></li></ul>,26:02:2014,None
None,Merrell Women Blue Muffler & Beanie Cap Set,http://www.myntra.com/Mufflers/Merrell/Merrell-Women-Blue-Muffler-&-Beanie-Cap-Set/219441/buy,Rs. 2,099,winterwear,Winterwear - Flat 30%,Merrell,http://myntra.myntassets.com/images/style/properties/Merrell-Women-Blue-Muffler-&-Beanie-Cap-Set_e76dca9d4c409143f616214412ec873e_images_1080_1440_mini.jpg,Rs. 3,499,None,winterwear,http://www.myntra.com/Mufflers/Merrell/Merrell-Women-Blue-Muffler-&-Beanie-Cap-Set/219441/buy,Sold byVector Ecommerce Pvt Ltd,None,None,single size,None,<ul class="mk-pdpv1-product-helper mk-cf"><li class="desc-main-title">Product Description</li><li class="desc-sub-title">Style Note</li><li class="desc-sub-text " itemprop="description"><p>This muffler and beanie cap combo by Merrell is great way to add dimension to your mundane  outfits. Team it with your western attire to jazz up your look  instantly.</p></li><li class="desc-sub-title ">Product Details</li><li class="desc-sub-text"><p>Blue knit muffler and beanie cap<br/>Blue muffler in a Fair Isle knit pattern, four-colour tonal colourways, brand tag at one end and metal branding at the other,  ribbed hem<br/>Blue beanie cap in a Fair Isle knit pattern, four-colour tonal colourways, pom-pom detail at top, ribbed hem with a fold-up feature and metallic branding</p></li><li class="desc-sub-title ">Material &amp; Care</li><li class="desc-sub-text "><p>70% acrylic, 30% wool<br/>Hand wash</p></li><li class="desc-sub-title">Size &amp; Fit</li><li class="desc-sub-text"><p>Muffler length: 170 cm<br/>Muffler width: 13 cm</p></li></ul>,26:02:2014,None
None,Merrell Women Charcoal Grey Quilted Astor Down Hooded Jacket,http://www.myntra.com/Jackets/Merrell/Merrell-Women-Charcoal-Grey-Quilted-Astor-Down-Hooded-Jacket/219474/buy,Rs. 5,999,winterwear,Winterwear - Flat 30%,Merrell,http://myntra.myntassets.com/images/style/properties/Merrell-Women-Charcoal-Grey-Quilted-Astor-Down-Hooded-Jacket_ac52edb7423b15866f3b6c6b662ab80d_images_1080_1440_mini.JPG,Rs. 9,999,None,winterwear,http://www.myntra.com/Jackets/Merrell/Merrell-Women-Charcoal-Grey-Quilted-Astor-Down-Hooded-Jacket/219474/buy,Sold byVector Ecommerce Pvt Ltd,None,None,['XS', 'S', 'M', 'L'],None,<ul class="mk-pdpv1-product-helper mk-cf"><li class="desc-main-title">Product Description</li><li class="desc-sub-title">Style Note</li><li class="desc-sub-text " itemprop="description"><p>Packed with functional features, this super warm jacket from Merrell will be a great pick for the winter season. Lightweight, durable and down insulated, you're sure to be protected from the elements in this piece of outerwear. We think it would look great paired with skinny jeans or track pants and sturdy footwear.</p></li><li class="desc-sub-title ">Product Details</li><li class="desc-sub-text"><p>Charcoal grey quilted jacket, insulated down padding, M Select WARM for warmth without bulk, M Select DRY stays dry inside and out, water resistant, mock collar with grown-on hood that is elasticated along opening, long sleeves with elastication along hems, full zipped closure at front with chin guard at neck to prevent chafing, zipped pockets at front waist, printed branding towards front hem, has lining attached with zipped pocket at left chest, elasticated drawstring channelled through hem with toggle adjuster at sides</p></li><li class="desc-sub-title ">Material &amp; Care</li><li class="desc-sub-text "><p>Shell: 100% polyester<br/>Padding: 80% goose down, 20% goose feather<br/>Machine wash cold</p></li><li class="desc-sub-title">Size &amp; Fit</li><li class="desc-sub-text"><p>The model (height 5'8" and chest 33") is wearing a size S</p></li></ul>,26:02:2014,None
None,Merrell Men Black & Charcoal Grey Nanook Hooded Jacket,http://www.myntra.com/Jackets/Merrell/Merrell-Men-Black-&-Charcoal-Grey-Nanook-Hooded-Jacket/219448/buy,Rs. 7,799,winterwear,Winterwear - Flat 30%,Merrell,http://myntra.myntassets.com/images/style/properties/Merrell-Men-Jackets_73ac6c15602ad90d050c5e582db94472_images_1080_1440_mini.JPG,Rs. 12,999,None,winterwear,http://www.myntra.com/Jackets/Merrell/Merrell-Men-Black-&-Charcoal-Grey-Nanook-Hooded-Jacket/219448/buy,Sold byVector Ecommerce Pvt Ltd,None,None,['S', 'M', 'L', 'XL'],None,<ul class="mk-pdpv1-product-helper mk-cf"><li class="desc-main-title">Product Description</li><li class="desc-sub-title">Style Note</li><li class="desc-sub-text " itemprop="description"><p>Experience the best comfort in style by wearing this jacket from Merrell. We absolutely love the detailing and high-end features and think it would look great when paired with a pair of tapered jeans and high-tops.</p></li><li class="desc-sub-title ">Product Details</li><li class="desc-sub-text"><p>Black and charcoal grey quilted jacket with, insulated down padding, water resistant, panelled, mock collar with grown-on hood that is elasticated along opening, tab with Velcro closure at back of hood, long sleeves with elasticated hems, printed branding at left sleeve, full zipped closure at front, printed branding at left chest, concealed zipped pocket built into panel at left chest, zipped pockets at front waist, has lining attached with slip pocket at either sides of front, elasticated drawstring channelled through hem with toggle adjuster at sides</p></li><li class="desc-sub-title ">Material &amp; Care</li><li class="desc-sub-text "><p>Shell: 100% polyester<br/>Padding: 80% goose down, 20% goose feather<br/>Machine wash cold</p></li><li class="desc-sub-title">Size &amp; Fit</li><li class="desc-sub-text"><p>The model (height 5'8" and chest 33") is wearing a size M</p></li></ul>,26:02:2014,None
None,Merrell Women Red Silken Fleece Jacket,http://www.myntra.com/Jackets/Merrell/Merrell-Women-Red-Silken-Fleece-Jacket/219472/buy,Rs. 3,299,winterwear,Winterwear - Flat 30%,Merrell,http://myntra.myntassets.com/images/style/properties/Merrell-Women-Jackets_a5cd2fe3603e364205411ec0349da289_images_1080_1440_mini.jpg,Rs. 5,499,None,winterwear,http://www.myntra.com/Jackets/Merrell/Merrell-Women-Red-Silken-Fleece-Jacket/219472/buy,Sold byVector Ecommerce Pvt Ltd,None,None,['XS', 'S', 'M', 'L'],None,<ul class="mk-pdpv1-product-helper mk-cf"><li class="desc-main-title">Product Description</li><li class="desc-sub-title">Style Note</li><li class="desc-sub-text " itemprop="description"><p>This jacket, engineered with moisture managing M Select WICK technology, from Merrell will be a great pick for that fun weekend you've got planned. Lightweight and in a bright hue, you're sure to look good in this peppy piece of outerwear. Team it with jeans or track pants.</p></li><li class="desc-sub-title ">Product Details</li><li class="desc-sub-text"><p>Red jacket, knitted, made with M Select WICK technology, mock collar, long sleeves with elasticated hems, full zipped closure at front, two zipped pockets at front waist, brand embroidery at front left hem, hem band, fleece lining</p></li><li class="desc-sub-title ">Material &amp; Care</li><li class="desc-sub-text "><p>Shell: 94% nylon, 6% Spandex<br/>Pocket lining: 100% polyester<br/>Machine wash cold</p></li><li class="desc-sub-title">Size &amp; Fit</li><li class="desc-sub-text"><p>The model (height 5'8" and chest 33") is wearing a size S</p></li></ul>,26:02:2014,None
None,Merrell Women Teal Blue Silken Fleece Jacket,http://www.myntra.com/Jackets/Merrell/Merrell-Women-Teal-Blue-Silken-Fleece-Jacket/219471/buy,Rs. 3,299,winterwear,Winterwear - Flat 30%,Merrell,http://myntra.myntassets.com/images/style/properties/Merrell-Women-Jackets_d206350133a6aa13abadfc242b734d91_images_1080_1440_mini.jpg,Rs. 5,499,None,winterwear,http://www.myntra.com/Jackets/Merrell/Merrell-Women-Teal-Blue-Silken-Fleece-Jacket/219471/buy,Sold byVector Ecommerce Pvt Ltd,None,None,['XS', 'S', 'M', 'L'],None,<ul class="mk-pdpv1-product-helper mk-cf"><li class="desc-main-title">Product Description</li><li class="desc-sub-title">Style Note</li><li class="desc-sub-text " itemprop="description"><p>This jacket, engineered with moisture managing M Select WICK technology, from Merrell will be a great pick for that fun weekend you've got planned. Lightweight and in a bright hue, you're sure to look good in this peppy piece of outerwear. Team it with jeans or track pants.</p></li><li class="desc-sub-title ">Product Details</li><li class="desc-sub-text"><p>Teal blue jacket, knitted, made with M Select WICK technology, mock collar, long sleeves with elasticated hems, full zipped closure at front, two zipped pockets at front waist, brand embroidery at front left hem, hem band, fleece lining</p></li><li class="desc-sub-title ">Material &amp; Care</li><li class="desc-sub-text "><p>Shell: 94% nylon, 6% Spandex<br/>Pocket lining: 100% polyester<br/>Machine wash cold</p></li><li class="desc-sub-title">Size &amp; Fit</li><li class="desc-sub-text"><p>The model (height 5'8" and chest 33") is wearing a size S</p></li></ul>,26:02:2014,None
None,Merrell Men Blue & Grey Striped Muffler & Beanie Cap,http://www.myntra.com/Mufflers/Merrell/Merrell-Men-Blue-&-Grey-Striped-Muffler-&-Beanie-Cap/219446/buy,Rs. 2,099,winterwear,Winterwear - Flat 30%,Merrell,http://myntra.myntassets.com/images/style/properties/Merrell-Men-Blue-&-Grey-Striped-Muffler-&-Beanie-Cap_dca189cba3863bdc4145b686e324e3dc_images_1080_1440_mini.jpg,Rs. 3,499,None,winterwear,http://www.myntra.com/Mufflers/Merrell/Merrell-Men-Blue-&-Grey-Striped-Muffler-&-Beanie-Cap/219446/buy,Sold byVector Ecommerce Pvt Ltd,None,None,single size,None,<ul class="mk-pdpv1-product-helper mk-cf"><li class="desc-main-title">Product Description</li><li class="desc-sub-title">Style Note</li><li class="desc-sub-text " itemprop="description"><p>This muffler and beanie cap combo by Merrell is a great way to add dimension to your mundane outfits. Team it with your western attire to jazz up your look instantly.</p></li><li class="desc-sub-title ">Product Details</li><li class="desc-sub-text"><p><span dir="ltr" id=":1vu">Blue and grey striped muffler and beanie cap set<br/>Blue and grey striped muffler, knitted, branding at both ends<br/>Blue and grey striped matching beanie cap, has branding at rim</span></p></li><li class="desc-sub-title ">Material &amp; Care</li><li class="desc-sub-text "><p>70% acrylic, 30% wool<br/> Hand wash</p></li><li class="desc-sub-title">Size &amp; Fit</li><li class="desc-sub-text"><p>Muffler length: 172 cm<br/>Muffler width: 15 cm</p></li></ul>,26:02:2014,None
None,Merrell Men Navy Adventure Rest Ridge Padded Jacket,http://www.myntra.com/Jackets/Merrell/Merrell-Men-Navy-Adventure-Rest-Ridge-Padded-Jacket/219450/buy,Rs. 5,999,winterwear,Winterwear - Flat 30%,Merrell,http://myntra.myntassets.com/images/style/properties/Merrell-Men-Jackets_d6d01acb67e38caac12cb075990d9f9e_images_1080_1440_mini.jpg,Rs. 9,999,None,winterwear,http://www.myntra.com/Jackets/Merrell/Merrell-Men-Navy-Adventure-Rest-Ridge-Padded-Jacket/219450/buy,Sold byVector Ecommerce Pvt Ltd,None,None,['S', 'M', 'L'],None,<ul class="mk-pdpv1-product-helper mk-cf"><li class="desc-main-title">Product Description</li><li class="desc-sub-title">Style Note</li><li class="desc-sub-text " itemprop="description"><p>Experience the best comfort in style by wearing this jacket from Merrell. We absolutely love the detailing and high-end features and think it would look great when paired with a pair of tapered jeans and high-tops.</p></li><li class="desc-sub-title ">Product Details</li><li class="desc-sub-text"><p>Navy quilted jacket with orange accents, constructed in Primaloft fabric that is high loft, water resistant, soft, compressible and thermally efficient, padded, panelled, transforms into neck pillow when packed into the compartment at the inner lining with zip closure, mock collar with grown-on hood that is elasticated along opening, tab with Velcro closure at back of hood, long sleeves with elasticated hems, printed branding at left sleeve, full zipped closure at front, printed branding at left chest, zipped pockets at front waist, has lining attached with insert pocket at left side, elasticated drawstring channelled through hem with toggle adjuster at sides</p></li><li class="desc-sub-title ">Material &amp; Care</li><li class="desc-sub-text "><p>Polyester and nylon<br/>Machine wash cold</p></li><li class="desc-sub-title">Size &amp; Fit</li><li class="desc-sub-text"><p>The model (height 5'8" and chest 33") is wearing a size M</p></li></ul>,26:02:2014,None
None,Merrell Men Rust Red Adventure Rest Ridge Hooded Jacket,http://www.myntra.com/Jackets/Merrell/Merrell-Men-Rust-Red-Adventure-Rest-Ridge-Hooded-Jacket/219451/buy,Rs. 5,999,winterwear,Winterwear - Flat 30%,Merrell,http://myntra.myntassets.com/images/style/properties/Merrell-Men-Jackets_537301b6b0ba2cfc3760cd4b31337ffa_images_1080_1440_mini.jpg,Rs. 9,999,None,winterwear,http://www.myntra.com/Jackets/Merrell/Merrell-Men-Rust-Red-Adventure-Rest-Ridge-Hooded-Jacket/219451/buy,Sold byVector Ecommerce Pvt Ltd,None,None,['S', 'M', 'L', 'XL'],None,<ul class="mk-pdpv1-product-helper mk-cf"><li class="desc-main-title">Product Description</li><li class="desc-sub-title">Style Note</li><li class="desc-sub-text " itemprop="description"><p>Experience the best comfort in style by wearing this jacket from Merrell. We absolutely love the detailing and high-end features and think it would look great when paired with a pair of tapered jeans and high-tops.</p></li><li class="desc-sub-title ">Product Details</li><li class="desc-sub-text"><p>Rust red quilted jacket, constructed in Primaloft fabric that is high loft, water resistant, soft, compressible and thermally efficient, padded, transforms into a neck pillow when packed in the compartment at the inner lining with zip closure, mock collar with grown-on hood that is elasticated along opening, tab with Velcro closure at back of hood, long sleeves with elasticated hems, printed branding at left sleeve, full zipped closure at front, printed branding at left chest, zipped pockets at front waist, has lining attached with insert pocket at left side, elasticated drawstring channelled through hem with toggle adjuster at sides</p></li><li class="desc-sub-title ">Material &amp; Care</li><li class="desc-sub-text "><p>Polyester and nylon<br/>Machine wash cold</p></li><li class="desc-sub-title">Size &amp; Fit</li><li class="desc-sub-text"><p>The model (height 5'8" and chest 33") is wearing a size M</p></li></ul>,26:02:2014,None
None,Merrell Men Black & Grey Nanook Softshell Jacket,http://www.myntra.com/Jackets/Merrell/Merrell-Men-Black-&-Grey-Nanook-Softshell-Jacket/219458/buy,Rs. 5,999,winterwear,Winterwear - Flat 30%,Merrell,http://myntra.myntassets.com/images/style/properties/Merrell-Men-Black-&-Grey-Nanook-Softshell-Jacket_22404be728741ca96ace8e7f4355629b_images_1080_1440_mini.jpg,Rs. 9,999,None,winterwear,http://www.myntra.com/Jackets/Merrell/Merrell-Men-Black-&-Grey-Nanook-Softshell-Jacket/219458/buy,Sold byVector Ecommerce Pvt Ltd,None,None,['S', 'M', 'L', 'XL'],None,<ul class="mk-pdpv1-product-helper mk-cf"><li class="desc-main-title">Product Description</li><li class="desc-sub-title">Style Note</li><li class="desc-sub-text " itemprop="description"><p>Experience the best comfort in style by wearing this jacket from Merrell. We absolutely love the detailing and high-end features and think it would look great when paired with a pair of tapered jeans and high-tops.</p></li><li class="desc-sub-title ">Product Details</li><li class="desc-sub-text"><p>Black and grey melange jacket, M Select REGULATE for warmth, M Select DRY stays dry inside and out, M select WIND for shelter from storm, water resistant, lightly padded, panelled, mock collar, panelled long sleeves with contrast patches on elbow, printed branding at left sleeve, full zipped closure at front, printed branding at left chest, concealed zipped pocket built into panel at left chest, zipped pockets at front waist, has lining attached with insert pockets at either sides, elasticated drawstring channelled through hem with toggle adjuster at sides</p></li><li class="desc-sub-title ">Material &amp; Care</li><li class="desc-sub-text "><p>Polyester<br/>Machine wash cold</p></li><li class="desc-sub-title">Size &amp; Fit</li><li class="desc-sub-text"><p>The model (height 5'8" and chest 33") is wearing a size M</p></li></ul>,26:02:2014,None
