None,Lee Women Navy Sweatshirt,http://www.myntra.com/Sweatshirts/Lee/Lee-Women-Navy-Sweatshirt/174416/buy,Rs. 1,799,fashion-sale,Extra 32% Off on 30,Lee,http://myntra.myntassets.com/images/style/properties/Lee-Women-Navy-Sweatshirt_431bec8ebc5dcb65792d0e0588bacd7c_images_1080_1440_mini.jpg,None,None,fashion,http://www.myntra.com/Sweatshirts/Lee/Lee-Women-Navy-Sweatshirt/174416/buy,Sold byVector Ecommerce Pvt Ltd,None,None,['S', 'M', 'L', 'XL'],None,<ul class="mk-pdpv1-product-helper mk-cf"><li class="desc-main-title">Product Description</li><li class="desc-sub-title">Style Note</li><li class="desc-sub-text " itemprop="description"><p>Keep your style intact even during the cold days with this sweatshirt from Lee. Wear this piece with over-dyed denims and high top trainers for the best look.</p></li><li class="desc-sub-title ">Product Details</li><li class="desc-sub-text"><p>Navy sweatshirt, knitted, has a mock collar, long sleeves, full zipped front, insert pockets at the sides, metallic brand tag above left hem</p></li><li class="desc-sub-title ">Material &amp; Care</li><li class="desc-sub-text "><p>100% polyester<br/>Dry clean only</p></li><li class="desc-sub-title">Size &amp; Fit</li><li class="desc-sub-text"><p>Regular fit<br/>The model (height 6' and shoulders 18") is wearing a size S</p></li></ul>,26:02:2014,None
None,Lee Women Black Capris,http://www.myntra.com/Capris/Lee/Lee-Women-Black-Capris/97846/buy,Rs. 900,fashion-sale,Extra 32% Off on 30,Lee,http://myntra.myntassets.com/images/style/properties/Lee-Women-Black-Capris_1a9e0a2678ad0dc18b64640b674c84ab_images_1080_1440_mini.jpg,Rs. 1,799,None,fashion,http://www.myntra.com/Capris/Lee/Lee-Women-Black-Capris/97846/buy,Sold byVector Ecommerce Pvt Ltd,None,None,['26', '27', '28', '29', '30', '31', '32', '34'],None,<ul class="mk-pdpv1-product-helper mk-cf"><li class="desc-main-title">Product Description</li><li class="desc-sub-title">Style Note</li><li class="desc-sub-text " itemprop="description"><p>Capris from Lee that are a perfect addition to your casual wardrobe. Style this with a jersey or a tee for a sporty vibe or with flip flops for a laid back feel.</p></li><li class="desc-sub-title ">Product Details</li><li class="desc-sub-text"><p>Black capris with a branded buttoned waistband and a zipper fly, loops at the waistband that extend below the waistband<br/>Two front pockets with a coin pocket in the right pocket, the pockets have stitch detailing in black near the mouth area, contrast silver stitch detailing on the pockets and waistline, two patch pockets at the back with branding on the right pocket and stitch detailing<br/>Branded applique at the back and a broad folded and stitched hem</p></li><li class="desc-sub-title ">Material &amp; Care</li><li class="desc-sub-text "><p>Cotton blend, lycra<br/> Machine wash separately</p></li><li class="desc-sub-title">Size &amp; Fit</li><li class="desc-sub-text"><p>Mid rise, slim, skinny fit<br/> The model (height 5'8" and waist 28") is wearing a size 28</p></li></ul>,26:02:2014,None
None,Lee Men Brown Leather Wallet,http://www.myntra.com/Wallets/Lee/Lee-Men-Brown-Leather-Wallet/214670/buy,Rs. 1,399,fashion-sale,Extra 32% Off on 30,Lee,http://myntra.myntassets.com/images/style/properties/Lee-Men-Brown-Leather-Wallet_da52af68a65cae34feae78f40c5a1b61_images_1080_1440_mini.jpg,None,None,fashion,http://www.myntra.com/Wallets/Lee/Lee-Men-Brown-Leather-Wallet/214670/buy,Sold byVector Ecommerce Pvt Ltd,None,None,single size,None,<ul class="mk-pdpv1-product-helper mk-cf"><li class="desc-main-title">Product Description</li><li class="desc-sub-title">Style Note</li><li class="desc-sub-text " itemprop="description"><p>Carry your monetary essentials in style and comfort with this wallet from Lee. The multiple compartments lets you organise your essentials in an orderly manner.</p></li><li class="desc-sub-title ">Product Details</li><li class="desc-sub-text"><p>Brown, two fold wallet with a textured upper, stitched detail and banding at front<br/>One main compartment with an inner separator sleeve<br/>The left fold has four card holders and two slip pockets<br/>The right fold has four card holders and two slip pockets</p></li><li class="desc-sub-title ">Material &amp; Care</li><li class="desc-sub-text "><p>Leather<br/>Wipe with a clean, dry cloth when needed</p></li><li class="desc-sub-title">Size &amp; Fit</li><li class="desc-sub-text"><p>Height: 9.5 cm<br/>Width: 11 cm</p></li></ul>,26:02:2014,None
None,Lee Men Grey Haiden Sweater,http://www.myntra.com/Sweaters/Lee/Lee-Men-Grey-Haiden-Sweater/202850/buy,Rs. 1,874,fashion-sale,Extra 32% Off on 30,Lee,http://myntra.myntassets.com/images/style/properties/Lee-Men-Sweaters_a952e949d2740b02075f86cca589132e_images_1080_1440_mini.JPG,Rs. 2,499,None,fashion,http://www.myntra.com/Sweaters/Lee/Lee-Men-Grey-Haiden-Sweater/202850/buy,Sold byVector Ecommerce Pvt Ltd,None,None,['S', 'M', 'L', 'XL', 'XXL'],None,<ul class="mk-pdpv1-product-helper mk-cf"><li class="desc-main-title">Product Description</li><li class="desc-sub-title">Style Note</li><li class="desc-sub-text " itemprop="description"><p>This trendy sweater from Lee is an absolute must-have this winter. Cut and styled for an amazing fit, this piece can be paired with your favourite jeans and a shirt on a windy day for an effortlessly stylish look.</p></li><li class="desc-sub-title ">Product Details</li><li class="desc-sub-text"><p>Grey sweater with multi-coloured speckled knit detailing, ribbed turtle neck with short zipped closure in front, long sleeves with elbow patch and ribbed cuffs, branding at left chest, ribbed hem</p></li><li class="desc-sub-title ">Material &amp; Care</li><li class="desc-sub-text "><p>100% acrylic<br/>Hand wash cold</p></li><li class="desc-sub-title">Size &amp; Fit</li><li class="desc-sub-text"><p>Regular fit<br/>The model (height 6' and shoulders 18") is wearing a size M</p></li></ul>,26:02:2014,None
None,Lee Men White & Blue Striped Slim Fit Casual Shirt,http://www.myntra.com/Shirts/Lee/Lee-Men-White-&-Blue-Striped-Slim-Fit-Casual-Shirt/202844/buy,Rs. 1,599,fashion-sale,Extra 32% Off on 30,Lee,http://myntra.myntassets.com/images/style/properties/Lee-Men-Shirts_9612edde7497363f473fa629501565a4_images_1080_1440_mini.JPG,None,None,fashion,http://www.myntra.com/Shirts/Lee/Lee-Men-White-&-Blue-Striped-Slim-Fit-Casual-Shirt/202844/buy,Sold byVector Ecommerce Pvt Ltd,None,None,['38', '40', '42', '44', '46'],None,<ul class="mk-pdpv1-product-helper mk-cf"><li class="desc-main-title">Product Description</li><li class="desc-sub-title">Style Note</li><li class="desc-sub-text " itemprop="description"><p>Look smart with a pick from the wide range of shirts by Lee. We recommend styling this piece with beige chinos and loafers for maximum effect.</p></li><li class="desc-sub-title ">Product Details</li><li class="desc-sub-text"><p>White, blue and lavender striped shirt, woven, spread collar, long sleeves with buttoned cuffs, full buttoned chest placket, patch pocket with embroidered branding at left chest, back yoke, curved hem</p></li><li class="desc-sub-title ">Material &amp; Care</li><li class="desc-sub-text "><p>100% cotton<br/>Machine wash warm</p></li><li class="desc-sub-title">Size &amp; Fit</li><li class="desc-sub-text"><p>Slim fit<br/>The model (height 6' and shoulders 18") is wearing a size 40</p></li></ul>,26:02:2014,None
None,Lee Men Black Argyle Sleeveless Sweater,http://www.myntra.com/Sweaters/Lee/Lee-Men-Black-Argyle-Sleeveless-Sweater/202853/buy,Rs. 1,274,fashion-sale,Extra 32% Off on 30,Lee,http://myntra.myntassets.com/images/style/properties/Lee-Men-Sweaters_345e863c8cdf0ea473def8d15739e614_images_1080_1440_mini.jpg,Rs. 1,699,None,fashion,http://www.myntra.com/Sweaters/Lee/Lee-Men-Black-Argyle-Sleeveless-Sweater/202853/buy,Sold byVector Ecommerce Pvt Ltd,None,None,['S', 'M', 'L', 'XL', 'XXL'],None,<ul class="mk-pdpv1-product-helper mk-cf"><li class="desc-main-title">Product Description</li><li class="desc-sub-title">Style Note</li><li class="desc-sub-text " itemprop="description"><p>Specially designed to give your winter wardrobe a refined feel, this Lee sweater is a season essential. We absolutely adore its preppy styling and cosy fabric. Wear it with a short sleeve T-shirt and washed jeans for a relaxed look.</p></li><li class="desc-sub-title ">Product Details</li><li class="desc-sub-text"><p>Black, purple, grey and blue argyle sweater, knit, ribbed V neck with contrast tipping detail, sleeveless with contrast tipping detail at ribbed arm holes, solid back, ribbed hemline with contrast tipping detail, brand embroidery at left hem</p></li><li class="desc-sub-title ">Material &amp; Care</li><li class="desc-sub-text "><p>Acrylic and wool blend<br/>Machine wash warm</p></li><li class="desc-sub-title">Size &amp; Fit</li><li class="desc-sub-text"><p>Regular fit<br/>The model (height 6' and shoulders 18") is wearing a size M</p></li></ul>,26:02:2014,None
None,Lee Men Navy Printed T-shirt,http://www.myntra.com/Tshirts/Lee/Lee-Men-Navy-Printed-T-shirt/202863/buy,Rs. 1,199,fashion-sale,Extra 32% Off on 30,Lee,http://myntra.myntassets.com/images/style/properties/Lee-Men-Tshirts_3902d19631b33deac696fddeb9407496_images_1080_1440.jpg,None,None,fashion,http://www.myntra.com/Tshirts/Lee/Lee-Men-Navy-Printed-T-shirt/202863/buy,Sold byVector Ecommerce Pvt Ltd,None,None,['S', 'M', 'L', 'XL', 'XXL'],None,<ul class="mk-pdpv1-product-helper mk-cf"><li class="desc-main-title">Product Description</li><li class="desc-sub-title">Style Note</li><li class="desc-sub-text " itemprop="description"><p>This stylish printed tee in a classic hue from Lee is a must-have this season. We suggest that you match it with a pair of tapered jeans and canvas shoes for a trendy, urban appeal.</p></li><li class="desc-sub-title ">Product Details</li><li class="desc-sub-text"><p>Navy knit T-shirt, has a ribbed round neck, short sleeves, print on the front, brand tag at the straight hem on the left</p></li><li class="desc-sub-title ">Material &amp; Care</li><li class="desc-sub-text "><p>100% cotton<br/>Machine wash cold</p></li><li class="desc-sub-title">Size &amp; Fit</li><li class="desc-sub-text"><p>The model (height 6' and shoulders 18") is wearing a size M</p></li></ul>,26:02:2014,None
None,Lee Men Navy Argyle Sleeveless Sweater,http://www.myntra.com/Sweaters/Lee/Lee-Men-Navy-Argyle-Sleeveless-Sweater/202854/buy,Rs. 1,274,fashion-sale,Extra 32% Off on 30,Lee,http://myntra.myntassets.com/images/style/properties/Lee-Men-Sweaters_73e27ced58c278f05dbd6ca19e4f90ba_images_1080_1440_mini.jpg,Rs. 1,699,None,fashion,http://www.myntra.com/Sweaters/Lee/Lee-Men-Navy-Argyle-Sleeveless-Sweater/202854/buy,Sold byVector Ecommerce Pvt Ltd,None,None,['S', 'M', 'L', 'XL', 'XXL'],None,<ul class="mk-pdpv1-product-helper mk-cf"><li class="desc-main-title">Product Description</li><li class="desc-sub-title">Style Note</li><li class="desc-sub-text " itemprop="description"><p>Specially designed to give your winter wardrobe a refined feel, this Lee sweater is a season essential. We absolutely adore its preppy styling and cosy fabric. Wear it with a short sleeve T-shirt and washed jeans for a relaxed look.</p></li><li class="desc-sub-title ">Product Details</li><li class="desc-sub-text"><p>Navy, green, maroon and white argyle sweater, knit, ribbed V neck with contrast tipping detail, sleeveless with contrast tipping detail at ribbed arm holes, solid back, ribbed hemline with contrast tipping detail, brand embroidery at left hem</p></li><li class="desc-sub-title ">Material &amp; Care</li><li class="desc-sub-text "><p>Acrylic and wool blend<br/>Machine wash warm</p></li><li class="desc-sub-title">Size &amp; Fit</li><li class="desc-sub-text"><p>Regular fit<br/>The model (height 6' and shoulders 18") is wearing a size M</p></li></ul>,26:02:2014,None
None,Lee Men Brown Leather Belt,http://www.myntra.com/Belts/Lee/Lee-Men-Brown-Leather-Belt/175704/buy,Rs. 1,399,fashion-sale,Extra 32% Off on 30,Lee,http://myntra.myntassets.com/images/style/properties/Lee-Men-Brown-Leather-Belt_2c2e97734f8af9bd7330f37b04770862_images_1080_1440_mini.jpg,None,None,fashion,http://www.myntra.com/Belts/Lee/Lee-Men-Brown-Leather-Belt/175704/buy,Sold byVector Ecommerce Pvt Ltd,None,None,['32', '34', '38'],None,<ul class="mk-pdpv1-product-helper mk-cf"><li class="desc-main-title">Product Description</li><li class="desc-sub-title">Style Note</li><li class="desc-sub-text " itemprop="description"><p>Cut a stylish profile with this simple yet superbly sophisticated belt  from Lee. Note the subtle detailing  that sets this stylish piece apart from the rest.</p></li><li class="desc-sub-title ">Product Details</li><li class="desc-sub-text"><p>Brown belt, has a textured upper with dual tone<br/>Tang closure and a fixed loop to hold the belt in place<br/>Holes to customise the fit</p></li><li class="desc-sub-title ">Material &amp; Care</li><li class="desc-sub-text "><p>Leather<br/>Wipe with a clean, dry cloth when needed</p></li><li class="desc-sub-title">Size &amp; Fit</li><li class="desc-sub-text"><p>Width: 3.8 cm</p></li></ul>,26:02:2014,None
None,Lee Men Grey Leather Belt,http://www.myntra.com/Belts/Lee/Lee-Men-Grey-Leather-Belt/214690/buy,Rs. 1,399,fashion-sale,Extra 32% Off on 30,Lee,http://myntra.myntassets.com/images/style/properties/Lee-Men-Grey-Leather-Belt_f1570730228572fb61a619fc218f548f_images_1080_1440_mini.jpg,None,None,fashion,http://www.myntra.com/Belts/Lee/Lee-Men-Grey-Leather-Belt/214690/buy,Sold byVector Ecommerce Pvt Ltd,None,None,['32', '34', '38'],None,<ul class="mk-pdpv1-product-helper mk-cf"><li class="desc-main-title">Product Description</li><li class="desc-sub-title">Style Note</li><li class="desc-sub-text " itemprop="description"><p>Cut a stylish profile with this simple yet superbly sophisticated belt  from Lee. Note the subtle detailing  that sets this piece apart from the rest.</p></li><li class="desc-sub-title ">Product Details</li><li class="desc-sub-text"><p>Grey belt with a textured upper<br/>Tang clasp and a fixed loop to hold the belt in place<br/>Holes to customise the fit</p></li><li class="desc-sub-title ">Material &amp; Care</li><li class="desc-sub-text "><p>Leather<br/>Wipe with a clean, dry cloth when needed</p></li><li class="desc-sub-title">Size &amp; Fit</li><li class="desc-sub-text"><p>Width: 3.8 cm</p></li></ul>,26:02:2014,None
None,Lee Men Brown & Burgundy Leather Belt,http://www.myntra.com/Belts/Lee/Lee-Men-Brown-&-Burgundy-Leather-Belt/214696/buy,Rs. 1,299,fashion-sale,Extra 32% Off on 30,Lee,http://myntra.myntassets.com/images/style/properties/Lee-Men-Brown-&-Burgundy-Leather-Belt_3c877d84b09be6f6cfac6c137991baa0_images_1080_1440_mini.jpg,None,None,fashion,http://www.myntra.com/Belts/Lee/Lee-Men-Brown-&-Burgundy-Leather-Belt/214696/buy,Sold byVector Ecommerce Pvt Ltd,None,None,['32', '34', '38'],None,<ul class="mk-pdpv1-product-helper mk-cf"><li class="desc-main-title">Product Description</li><li class="desc-sub-title">Style Note</li><li class="desc-sub-text " itemprop="description"><p>Cut a stylish profile with this simple yet superbly sophisticated belt  from Lee. Note the subtle detailing  that sets this piece apart from the rest.</p></li><li class="desc-sub-title ">Product Details</li><li class="desc-sub-text"><p>Brown and burgundy belt, has a textured upper with stitched detail<br/>Tang clasp and a fixed loop to hold the belt in place<br/>Holes to customise the fit</p></li><li class="desc-sub-title ">Material &amp; Care</li><li class="desc-sub-text "><p>Leather<br/>Wipe with a clean, dry cloth when needed</p></li><li class="desc-sub-title">Size &amp; Fit</li><li class="desc-sub-text"><p>Width: 3.8 cm</p></li></ul>,26:02:2014,None
None,Lee Men Pack of 2 Socks,http://www.myntra.com/Socks/Lee/Lee-Men-Pack-of-2-Socks/214682/buy,Rs. 349,fashion-sale,Extra 32% Off on 30,Lee,http://myntra.myntassets.com/images/style/properties/Lee-Men-Pack-of-2-Socks_5d4ec12e23898b74c17627174252d793_images_1080_1440_mini.jpg,None,None,fashion,http://www.myntra.com/Socks/Lee/Lee-Men-Pack-of-2-Socks/214682/buy,Sold byVector Ecommerce Pvt Ltd,None,None,single size,None,<ul class="mk-pdpv1-product-helper mk-cf"><li class="desc-main-title">Product Description</li><li class="desc-sub-title">Style Note</li><li class="desc-sub-text " itemprop="description"><p>Soft, comfy socks from Lee to keep your feet in cushioned bliss all day. This set is definitely a great buy.</p></li><li class="desc-sub-title ">Product Details</li><li class="desc-sub-text"><p>Pack of two socks<br/>Grey and black, ankle length socks, knit, with blue accents, ribbed cuffs with branding, and striped detail<br/>Blue and black, ankle length socks, knit, with red accents, ribbed cuffs with branding, and striped detail</p></li><li class="desc-sub-title ">Material &amp; Care</li><li class="desc-sub-text "><p>Cotton<br/>Machine wash</p></li></ul>,26:02:2014,None
None,Lee Men Blue Blazer,http://www.myntra.com/Blazers/Lee/Lee-Men-Blue-Blazer/213063/buy,Rs. 3,999,fashion-sale,Extra 32% Off on 30,Lee,http://myntra.myntassets.com/images/style/properties/Lee-Men-Blue-Blazer_b726c945d15c37e5867d9ec8c222d4d9_images_1080_1440_mini.jpg,None,None,fashion,http://www.myntra.com/Blazers/Lee/Lee-Men-Blue-Blazer/213063/buy,Sold byVector Ecommerce Pvt Ltd,None,None,['38', '40', '42', '44', '46'],None,<ul class="mk-pdpv1-product-helper mk-cf"><li class="desc-main-title">Product Description</li><li class="desc-sub-title">Style Note</li><li class="desc-sub-text " itemprop="description"><p>Add some style to your collection with this trendy jacket from Lee. Team it up with a pair of denim jeans and boots for a look that makes jaws drop.</p></li><li class="desc-sub-title ">Product Details</li><li class="desc-sub-text"><p>Blue panelled blazer, woven, notched lapel collar, long sleeves with mock buttoned closure, single breasted with two buttoned placket, patch pocket at left chest, pockets with flap closure at front waist, pocket on the left built into lining, has an attached lining<br/>Comes with a hanger</p></li><li class="desc-sub-title ">Material &amp; Care</li><li class="desc-sub-text "><p>Shell: 100% cotton<br/>Lining: polyester and cotton<br/>Machine wash cold</p></li><li class="desc-sub-title">Size &amp; Fit</li><li class="desc-sub-text"><p>The model (height 6' and chest 33") is wearing a size 40</p></li></ul>,26:02:2014,None
None,Lee Men Blue Blazer,http://www.myntra.com/Blazers/Lee/Lee-Men-Blue-Blazer/213063/buy,Rs. 3,999,fashion-sale,Extra 32% Off on 30,Lee,http://myntra.myntassets.com/images/style/properties/Lee-Men-Blue-Blazer_b726c945d15c37e5867d9ec8c222d4d9_images_1080_1440_mini.jpg,None,None,fashion,http://www.myntra.com/Blazers/Lee/Lee-Men-Blue-Blazer/213063/buy,Sold byVector Ecommerce Pvt Ltd,None,None,['38', '40', '42', '44', '46'],None,<ul class="mk-pdpv1-product-helper mk-cf"><li class="desc-main-title">Product Description</li><li class="desc-sub-title">Style Note</li><li class="desc-sub-text " itemprop="description"><p>Add some style to your collection with this trendy jacket from Lee. Team it up with a pair of denim jeans and boots for a look that makes jaws drop.</p></li><li class="desc-sub-title ">Product Details</li><li class="desc-sub-text"><p>Blue panelled blazer, woven, notched lapel collar, long sleeves with mock buttoned closure, single breasted with two buttoned placket, patch pocket at left chest, pockets with flap closure at front waist, pocket on the left built into lining, has an attached lining<br/>Comes with a hanger</p></li><li class="desc-sub-title ">Material &amp; Care</li><li class="desc-sub-text "><p>Shell: 100% cotton<br/>Lining: polyester and cotton<br/>Machine wash cold</p></li><li class="desc-sub-title">Size &amp; Fit</li><li class="desc-sub-text"><p>The model (height 6' and chest 33") is wearing a size 40</p></li></ul>,26:02:2014,None
None,Lee Men Blue Padded Sleeveless Jacket,http://www.myntra.com/Jackets/Lee/Lee-Men-Blue-Padded-Sleeveless-Jacket/196665/buy,Rs. 2,249,fashion-sale,Extra 32% Off on 30,Lee,http://myntra.myntassets.com/images/style/properties/Lee-Men-Blue-Padded-Sleeveless-Jacket_e487a222f4ed310fa6a3101457bafdde_images_1080_1440_mini.jpg,Rs. 2,999,None,fashion,http://www.myntra.com/Jackets/Lee/Lee-Men-Blue-Padded-Sleeveless-Jacket/196665/buy,Sold byVector Ecommerce Pvt Ltd,None,None,['S', 'M', 'L', 'XL', 'XXL'],None,<ul class="mk-pdpv1-product-helper mk-cf"><li class="desc-main-title">Product Description</li><li class="desc-sub-title">Style Note</li><li class="desc-sub-text " itemprop="description"><p>This trendy and warm jacket from Lee is the perfect addition for your winter wardrobe. Team it with dark dyed denims and sneakers for a perfectly casual look.</p></li><li class="desc-sub-title ">Product Details</li><li class="desc-sub-text"><p>Blue jacket, padded, high neck, sleeveless, open ended zip closure down front, embroidered branding at left chest, insert pockets with buttoned closures at front waist, a welt pocket built into the lining</p></li><li class="desc-sub-title ">Material &amp; Care</li><li class="desc-sub-text "><p>100% polyester<br/>Dry clean only</p></li><li class="desc-sub-title">Size &amp; Fit</li><li class="desc-sub-text"><p>The model (height 6' and shoulders 18") is wearing a size M</p></li></ul>,26:02:2014,None
None,Lee Men Blue Denim Jacket,http://www.myntra.com/Jackets/Lee/Lee-Men-Blue-Denim-Jacket/213065/buy,Rs. 2,174,fashion-sale,Extra 32% Off on 30,Lee,http://myntra.myntassets.com/images/style/properties/Lee-Men-Blue-Denim-Jacket_9e9cb26d6970ccb24f5efc24bcefcc8d_images_1080_1440_mini.jpg,Rs. 2,899,None,fashion,http://www.myntra.com/Jackets/Lee/Lee-Men-Blue-Denim-Jacket/213065/buy,Sold byVector Ecommerce Pvt Ltd,None,None,['S', 'M', 'L', 'XL', 'XXL'],None,<ul class="mk-pdpv1-product-helper mk-cf"><li class="desc-main-title">Product Description</li><li class="desc-sub-title">Style Note</li><li class="desc-sub-text " itemprop="description"><p>Match this cool jacket with a T-shirt, chinos of your choice and aviators when heading out on a road trip. Ride in style and comfort with this latest Lee jacket.</p></li><li class="desc-sub-title ">Product Details</li><li class="desc-sub-text"><p>Blue denim jacket with wash detail, has a spread collar, full buttoned placket, long sleeves with buttoned cuffs, two patch pockets on the chest with buttoned flap closures and stitch detail, panelled body, panelled hem with buttoned tabs at the sides, contrast stitch detail throughout</p></li><li class="desc-sub-title ">Material &amp; Care</li><li class="desc-sub-text "><p>Lycra and cotton<br/>Machine wash cold</p></li><li class="desc-sub-title">Size &amp; Fit</li><li class="desc-sub-text"><p>The model (height 6' and shoulders 18") is wearing a size M</p></li></ul>,26:02:2014,None
None,Lee Men Grey Jonny Sleeveless Sweater,http://www.myntra.com/Sweaters/Lee/Lee-Men-Grey-Jonny-Sleeveless-Sweater/203057/buy,Rs. 1,274,fashion-sale,Extra 32% Off on 30,Lee,http://myntra.myntassets.com/images/style/properties/Lee-Men-Sweaters_f3c930459b187627533d6b147fe4f732_images_1080_1440_mini.JPG,Rs. 1,699,None,fashion,http://www.myntra.com/Sweaters/Lee/Lee-Men-Grey-Jonny-Sleeveless-Sweater/203057/buy,Sold byVector Ecommerce Pvt Ltd,None,None,['S', 'M', 'L', 'XL'],None,<ul class="mk-pdpv1-product-helper mk-cf"><li class="desc-main-title">Product Description</li><li class="desc-sub-title">Style Note</li><li class="desc-sub-text " itemprop="description"><p>This trendy sweater from Lee is an absolute must-have this winter. Cut and styled for an amazingly fit, this piece can also be paired with your favourite jeans and a full-sleeved shirt on a windy day for an effortlessly casual look.</p></li><li class="desc-sub-title ">Product Details</li><li class="desc-sub-text"><p>Grey sweater, patterned knit detailing, ribbed and striped V neckline, sleeveless with ribbed and striped detail along arm holes, embroidered branding on left ribbed and striped hem</p></li><li class="desc-sub-title ">Material &amp; Care</li><li class="desc-sub-text "><p>100% acrylic<br/>Hand wash cold</p></li><li class="desc-sub-title">Size &amp; Fit</li><li class="desc-sub-text"><p>Regular fit<br/>The model (height 6' and shoulders 18") is wearing a size M</p></li></ul>,26:02:2014,None
None,Lee Women Blue Jeans,http://www.myntra.com/Jeans/Lee/Lee-Women-Blue-Jeans/97857/buy,Rs. 1,050,fashion-sale,Extra 32% Off on 30,Lee,http://myntra.myntassets.com/images/style/properties/Lee-Women-Jeans_4661cb808e06fe417bf6c398784838e6_images_1080_1440_mini.jpg,Rs. 2,099,None,fashion,http://www.myntra.com/Jeans/Lee/Lee-Women-Blue-Jeans/97857/buy,Sold byVector Ecommerce Pvt Ltd,None,None,['26', '27', '28', '29', '30', '31', '32', '34'],None,<ul class="mk-pdpv1-product-helper mk-cf"><li class="desc-main-title">Product Description</li><li class="desc-sub-title">Style Note</li><li class="desc-sub-text " itemprop="description"><p>A true blue pair of denim jeans, this piece from Lee is minimalistically designed and classically washed. Cut from blended fabric that will contour your every curve, this is one piece that you will not want to get out of!</p></li><li class="desc-sub-title ">Product Details</li><li class="desc-sub-text"><p>Blue jeans, has two scoop pockets on the front with an insert pocket on the right, yoke and two patch pockets, brand patch at the back, waistband with loops, metal zipper and button closure</p></li><li class="desc-sub-title ">Material &amp; Care</li><li class="desc-sub-text "><p>Cotton and elastane blend<br/> Machine wash</p></li><li class="desc-sub-title">Size &amp; Fit</li><li class="desc-sub-text"><p>Regular fit<br/> The model (height 5'8&amp;    rdquo  and waist 28") is wearing a size 28</p></li></ul>,26:02:2014,None
