None,Lee Men Black Printed T-shirt,http://www.myntra.com/Tshirts/Lee/Lee-Men-Black-Printed-T-shirt/157177/buy,Rs. 899,fashion-sale,Extra 32% Off on 30,Lee,http://myntra.myntassets.com/images/style/properties/Lee-Men-Black-Printed-T-shirt_87ec60d39349300d623e2c2dd10c5ee4_images_1080_1440_mini.jpg,None,None,fashion,http://www.myntra.com/Tshirts/Lee/Lee-Men-Black-Printed-T-shirt/157177/buy,Sold byVector Ecommerce Pvt Ltd,None,None,['S', 'M', 'L', 'XL', 'XXL'],None,<ul class="mk-pdpv1-product-helper mk-cf"><li class="desc-main-title">Product Description</li><li class="desc-sub-title">Style Note</li><li class="desc-sub-text " itemprop="description"><p>Lee T-shirts are iconic and it can be safely said that every style conscious man definitely owns a creation of the brand. This T-shirt is simplistic and suave and it's best teamed with dark denims and sneakers.</p></li><li class="desc-sub-title ">Product Details</li><li class="desc-sub-text"><p>Black knit T-shirt, has a ribbed round neck, stitch detail at back neck and shoulders, short sleeves, print on the front,  brand tag at the straight hem on the left</p></li><li class="desc-sub-title ">Material &amp; Care</li><li class="desc-sub-text "><p>100% cotton<br/>Machine wash cold</p></li><li class="desc-sub-title">Size &amp; Fit</li><li class="desc-sub-text"><p>Regular fit<br/>The model (height 6' and shoulders 18") is wearing a size M</p></li></ul>,26:02:2014,None
None,Lee Women Blue Cherrie Slim Fit Jeans,http://www.myntra.com/Jeans/Lee/Lee-Women-Blue-Cherrie-Slim-Fit-Jeans/9141/buy,Rs. 950,fashion-sale,Extra 32% Off on 30,Lee,http://myntra.myntassets.com/images/style/properties/Lee-Women-Blue-Cherrie-Slim-Fit-Jeans_12d3a6df8ce62705e634eb7ed4b3c105_images_1080_1440_mini.jpg,Rs. 1,899,None,fashion,http://www.myntra.com/Jeans/Lee/Lee-Women-Blue-Cherrie-Slim-Fit-Jeans/9141/buy,Sold byVector Ecommerce Pvt Ltd,None,None,['26', '27', '28', '29', '30', '31', '32', '34'],None,<ul class="mk-pdpv1-product-helper mk-cf"><li class="desc-main-title">Product Description</li><li class="desc-sub-title">Style Note</li><li class="desc-sub-text " itemprop="description"><p>The right shade of blue, this pair of denim jeans from Lee will quickly become your favourite. With minimal wash detail and lycra blend fabrication, this pair is a super versatile piece for your casual wardrobe.</p></li><li class="desc-sub-title ">Product Details</li><li class="desc-sub-text"><p>Blue jeans, has two scoop pockets on the front with an insert pocket on the right, yoke and two patch pockets, brand patch at the back, waistband with loops, metal zipper and button closure</p></li><li class="desc-sub-title ">Material &amp; Care</li><li class="desc-sub-text "><p>Cotton and lycra blend<br/> Machine wash</p></li><li class="desc-sub-title">Size &amp; Fit</li><li class="desc-sub-text"><p>Low rise, slim fit, straight leg<br/> The model (height 5'8" and waist 28") is wearing a size 28</p></li></ul>,26:02:2014,None
None,Lee Men Red Sleeveless Jacket,http://www.myntra.com/Jackets/Lee/Lee-Men-Red-Sleeveless-Jacket/180747/buy,Rs. 2,699,fashion-sale,Extra 32% Off on 30,Lee,http://myntra.myntassets.com/images/style/properties/Lee-Men-Red-Sleeveless-Jacket_679a2cb091bf9a2ae8dc8f4dbacd9cdf_images_1080_1440_mini.jpg,None,None,fashion,http://www.myntra.com/Jackets/Lee/Lee-Men-Red-Sleeveless-Jacket/180747/buy,Sold byVector Ecommerce Pvt Ltd,None,None,['S', 'M', 'L', 'XL', 'XXL'],None,<ul class="mk-pdpv1-product-helper mk-cf"><li class="desc-main-title">Product Description</li><li class="desc-sub-title">Style Note</li><li class="desc-sub-text " itemprop="description"><p>Feel that chill in the air? Here's a jacket from Lee, a transitional piece, that lends itself to layering and adds practical style to your wardrobe. Team it with dark dyed denims and sneakers for a perfectly casual look.</p></li><li class="desc-sub-title ">Product Details</li><li class="desc-sub-text"><p>Dark red flannel jacket, high collar, open ended zip closure down front, contrast panel across front and back shoulders, sleeveless, insert pocket with zip closure at left chest, contrast patch pockets at either side at the waist with concealed zip closure, has a mesh lining, printed patch above back hem, ribbed hem</p></li><li class="desc-sub-title ">Material &amp; Care</li><li class="desc-sub-text "><p>100% polyester<br/>Machine wash cold</p></li><li class="desc-sub-title">Size &amp; Fit</li><li class="desc-sub-text"><p>The model (height 6' and shoulders 18") is wearing a size M</p></li></ul>,26:02:2014,None
None,Lee Men Grey & Olive Green Sweater,http://www.myntra.com/Sweaters/Lee/Lee-Men-Grey-&-Olive-Green-Sweater/213070/buy,Rs. 1,649,fashion-sale,Extra 32% Off on 30,Lee,http://myntra.myntassets.com/images/style/properties/Lee-Men-Grey-&-Olive-Green-Sweater_b90323c9c6a2353b0d7dca84a641eb96_images_1080_1440_mini.jpg,Rs. 2,199,None,fashion,http://www.myntra.com/Sweaters/Lee/Lee-Men-Grey-&-Olive-Green-Sweater/213070/buy,Sold byVector Ecommerce Pvt Ltd,None,None,['S', 'M', 'L', 'XL', 'XXL'],None,<ul class="mk-pdpv1-product-helper mk-cf"><li class="desc-main-title">Product Description</li><li class="desc-sub-title">Style Note</li><li class="desc-sub-text " itemprop="description"><p>This trendy sweater from Lee is an absolute must-have this winter. Cut and styled for an amazing fit, this piece can be paired with your favourite jeans and a shirt on a windy day for cool casual look.</p></li><li class="desc-sub-title ">Product Details</li><li class="desc-sub-text"><p>Grey and olive green sweater, knitted, ribbed V neckline, long sleeves with ribbed cuffs, brand print above left ribbed hem</p></li><li class="desc-sub-title ">Material &amp; Care</li><li class="desc-sub-text "><p>100% cotton<br/>Hand wash cold</p></li><li class="desc-sub-title">Size &amp; Fit</li><li class="desc-sub-text"><p>Regular fit<br/>The model (height 6' and shoulders 18") is wearing a size M</p></li></ul>,26:02:2014,None
None,Lee Men Mustard Yellow & Black Checked Casual Shirt,http://www.myntra.com/Shirts/Lee/Lee-Men-Mustard-Yellow-&-Black-Checked-Casual-Shirt/202843/buy,Rs. 1,799,fashion-sale,Extra 32% Off on 30,Lee,http://myntra.myntassets.com/images/style/properties/Lee-Men-Shirts_8fa139505899ba9cfd3a5a06dbe36e43_images_1080_1440_mini.jpg,None,None,fashion,http://www.myntra.com/Shirts/Lee/Lee-Men-Mustard-Yellow-&-Black-Checked-Casual-Shirt/202843/buy,Sold byVector Ecommerce Pvt Ltd,None,None,['38', '40', '42', '44', '46'],None,<ul class="mk-pdpv1-product-helper mk-cf"><li class="desc-main-title">Product Description</li><li class="desc-sub-title">Style Note</li><li class="desc-sub-text " itemprop="description"><p>Look smart this casual Friday with a pick from the wide range of shirts by Lee. We recommend styling this piece with pink chinos and loafers for maximum effect.</p></li><li class="desc-sub-title ">Product Details</li><li class="desc-sub-text"><p>Mustard yellow, black and white checked shirt, woven, spread collar with buttoned closure, long sleeves with press button cuffs, full press button chest placket, panelled detailing at shoulders, patch pockets at chest with press button flaps, brand patch at left patch pocket, stylised back yoke, curved hem</p></li><li class="desc-sub-title ">Material &amp; Care</li><li class="desc-sub-text "><p>100% cotton<br/>Machine wash warm</p></li><li class="desc-sub-title">Size &amp; Fit</li><li class="desc-sub-text"><p>Regular fit<br/>The model (height 6' and shoulders 18") is wearing a size 40</p></li></ul>,26:02:2014,None
None,Lee Men Blue Rick Sweatshirt,http://www.myntra.com/Sweatshirts/Lee/Lee-Men-Blue-Rick-Sweatshirt/202857/buy,Rs. 1,724,fashion-sale,Extra 32% Off on 30,Lee,http://myntra.myntassets.com/images/style/properties/Lee-Men-Sweatshirts_e357f7fcd412295655dd5ffebb44409b_images_1080_1440_mini.jpg,Rs. 2,299,None,fashion,http://www.myntra.com/Sweatshirts/Lee/Lee-Men-Blue-Rick-Sweatshirt/202857/buy,Sold byVector Ecommerce Pvt Ltd,None,None,['S', 'M', 'L', 'XL', 'XXL'],None,<ul class="mk-pdpv1-product-helper mk-cf"><li class="desc-main-title">Product Description</li><li class="desc-sub-title">Style Note</li><li class="desc-sub-text " itemprop="description"><p>Spruce up your winter wardrobe with this warm sweatshirt from Lee. Layer it over a simple tee and washed denims for a trendy and urban look.</p></li><li class="desc-sub-title ">Product Details</li><li class="desc-sub-text"><p>Blue sweatshirt, ribbed mock collar, panel insert at back of neck, full concealed zipped front, long panelled sleeves with ribbed cuffs, high density print at left chest, contrast panelling down the sides with mesh panels at shoulders, insert pockets at front waist, print above left hem at back, ribbed and striped hem</p></li><li class="desc-sub-title ">Material &amp; Care</li><li class="desc-sub-text "><p>100% cotton<br/>Machine wash warm</p></li><li class="desc-sub-title">Size &amp; Fit</li><li class="desc-sub-text"><p>Regular fit<br/>The model (height 6' and shoulders 18") is wearing a size M</p></li></ul>,26:02:2014,None
None,Lee Men Red Polo T-shirt,http://www.myntra.com/Tshirts/Lee/Lee-Men-Red-Polo-T-shirt/157191/buy,Rs. 1,399,fashion-sale,Extra 32% Off on 30,Lee,http://myntra.myntassets.com/images/style/properties/Lee-Men-Red-Polo-T-shirt_2435fa7ca52182d8c9c76069943197b6_images_1080_1440_mini.jpg,None,None,fashion,http://www.myntra.com/Tshirts/Lee/Lee-Men-Red-Polo-T-shirt/157191/buy,Sold byVector Ecommerce Pvt Ltd,None,None,['S', 'M', 'L', 'XL', 'XXL'],None,<ul class="mk-pdpv1-product-helper mk-cf"><li class="desc-main-title">Product Description</li><li class="desc-sub-title">Style Note</li><li class="desc-sub-text " itemprop="description"><p>Lee presents a line of classic  polo tees in a range of colourways so you can look your smart casual best. Style this piece with denims and loafers for a cool casual look.</p></li><li class="desc-sub-title ">Product Details</li><li class="desc-sub-text"><p>Red knit polo T-shirt, has  a navy ribbed spread collar with white and yellow stripes and tipping, has a contrast printed yellow under collar, white piping at shoulder seams, short buttoned and panelled chest placket, short sleeves with ribbed cuffs, brand embroidery at left chest, side slits with brand tag at left straight hem, contrast stitch detail at hem</p></li><li class="desc-sub-title ">Material &amp; Care</li><li class="desc-sub-text "><p>100% cotton<br/>Machine wash cold</p></li><li class="desc-sub-title">Size &amp; Fit</li><li class="desc-sub-text"><p>Regular fit<br/>The model (height 6' and shoulders 18") is wearing a size M</p></li></ul>,26:02:2014,None
None,Lee Men White Jerry T-shirt,http://www.myntra.com/Tshirts/Lee/Lee-Men-White-Jerry-T-shirt/162000/buy,Rs. 1,099,fashion-sale,Extra 32% Off on 30,Lee,http://myntra.myntassets.com/images/style/properties/Lee-Men-White-Jerry-T-shirt_7c8949abb61bafb2e9e941ff2667e945_images_1080_1440_mini.jpg,None,None,fashion,http://www.myntra.com/Tshirts/Lee/Lee-Men-White-Jerry-T-shirt/162000/buy,Sold byVector Ecommerce Pvt Ltd,None,None,['S', 'M', 'L', 'XL', 'XXL'],None,<ul class="mk-pdpv1-product-helper mk-cf"><li class="desc-main-title">Product Description</li><li class="desc-sub-title">Style Note</li><li class="desc-sub-text " itemprop="description"><p>Lee presents a line of classic tees in a range of colourways so you can look your smart casual best. Style this piece with denims and loafers for a cool casual look.</p></li><li class="desc-sub-title ">Product Details</li><li class="desc-sub-text"><p>White knit T-shirt, round neck, short sleeves with metallic tab detail at left sleeve cuff, seam across chest, brand print at left chest, brand label at left seam, straight hem</p></li><li class="desc-sub-title ">Material &amp; Care</li><li class="desc-sub-text "><p>100% cotton<br/>Machine wash cold</p></li><li class="desc-sub-title">Size &amp; Fit</li><li class="desc-sub-text"><p>Regular fit<br/>The model (height 6' and shoulders 18") is wearing a size M</p></li></ul>,26:02:2014,None
None,Lee Men White & Beige Striped Slim Fit Casual Shirt,http://www.myntra.com/Shirts/Lee/Lee-Men-White-&-Beige-Striped-Slim-Fit-Casual-Shirt/202845/buy,Rs. 1,599,fashion-sale,Extra 32% Off on 30,Lee,http://myntra.myntassets.com/images/style/properties/Lee-Men-Shirts_cd4597499b24cd4026f440b4c216befd_images_1080_1440.JPG,None,None,fashion,http://www.myntra.com/Shirts/Lee/Lee-Men-White-&-Beige-Striped-Slim-Fit-Casual-Shirt/202845/buy,Sold byVector Ecommerce Pvt Ltd,None,None,['38', '40', '42', '44', '46'],None,<ul class="mk-pdpv1-product-helper mk-cf"><li class="desc-main-title">Product Description</li><li class="desc-sub-title">Style Note</li><li class="desc-sub-text " itemprop="description"><p>Look smart with a pick from the wide range of shirts by Lee. We recommend styling this piece with beige chinos and loafers for maximum effect.</p></li><li class="desc-sub-title ">Product Details</li><li class="desc-sub-text"><p>White, blue and beige striped shirt, woven, spread collar, long sleeves with buttoned cuffs, full buttoned chest placket, patch pocket with embroidered branding at left chest, back yoke, curved hem</p></li><li class="desc-sub-title ">Material &amp; Care</li><li class="desc-sub-text "><p>100% cotton<br/>Machine wash warm</p></li><li class="desc-sub-title">Size &amp; Fit</li><li class="desc-sub-text"><p>Slim fit<br/>The model (height 6' and shoulders 18") is wearing a size 40</p></li></ul>,26:02:2014,None
None,Lee Women Off-White & Blue Striped Cindy Sweater,http://www.myntra.com/Sweaters/Lee/Lee-Women-Off-White-&-Blue-Striped-Cindy-Sweater/207149/buy,Rs. 1,999,fashion-sale,Extra 32% Off on 30,Lee,http://myntra.myntassets.com/images/style/properties/Lee-Women-Off-White-&-Blue-Striped-Cindy-Sweater_874623d44bd2ec950ca743219b00c43a_images_1080_1440_mini.jpg,None,None,fashion,http://www.myntra.com/Sweaters/Lee/Lee-Women-Off-White-&-Blue-Striped-Cindy-Sweater/207149/buy,Sold byVector Ecommerce Pvt Ltd,None,None,['S', 'M', 'L', 'XL'],None,<ul class="mk-pdpv1-product-helper mk-cf"><li class="desc-main-title">Product Description</li><li class="desc-sub-title">Style Note</li><li class="desc-sub-text " itemprop="description"><p>Cut a pretty figure in this super-cute sweater by Lee. We love its retro striped pattern and recommend that you try matching it with a pair of skinny jeans or chinos, a muffler and slouchy boots for the perfect winter ensemble.</p></li><li class="desc-sub-title ">Product Details</li><li class="desc-sub-text"><p>Off-white, green and blue striped sweater, knitted, solid ribbed mandarin collar with a V-shaped slit below, short buttoned chest placket, knitted pattern at chest and back, long sleeves with solid ribbed cuffs, solid ribbed hem, metallic branding above left hem</p></li><li class="desc-sub-title ">Material &amp; Care</li><li class="desc-sub-text "><p>100% cotton<br/>Hand wash cold</p></li><li class="desc-sub-title">Size &amp; Fit</li><li class="desc-sub-text"><p>The model (height 5'8" and chest 33") is wearing a size S</p></li></ul>,26:02:2014,None
None,Lee Men White Printed T-shirt,http://www.myntra.com/Tshirts/Lee/Lee-Men-White-Printed-T-shirt/202862/buy,Rs. 1,199,fashion-sale,Extra 32% Off on 30,Lee,http://myntra.myntassets.com/images/style/properties/Lee-Men-Tshirts_15031b5ebdba0ce76feaa6dc01d1c185_images_1080_1440_mini.jpg,None,None,fashion,http://www.myntra.com/Tshirts/Lee/Lee-Men-White-Printed-T-shirt/202862/buy,Sold byVector Ecommerce Pvt Ltd,None,None,['S', 'M', 'L', 'XL', 'XXL'],None,<ul class="mk-pdpv1-product-helper mk-cf"><li class="desc-main-title">Product Description</li><li class="desc-sub-title">Style Note</li><li class="desc-sub-text " itemprop="description"><p>A stylish printed tee in a vibrant hue from Lee is a must-have this season. We suggest that you match it with a pair of tapered jeans and canvas shoes for a trendy, urban appeal.</p></li><li class="desc-sub-title ">Product Details</li><li class="desc-sub-text"><p>White knit T-shirt, has a ribbed round neck, contrast dots print at back right shoulder, short sleeves,  high density print on the front, brand tag at the straight hem on the left</p></li><li class="desc-sub-title ">Material &amp; Care</li><li class="desc-sub-text "><p>Cotton and polyester blend<br/>Machine wash cold</p></li><li class="desc-sub-title">Size &amp; Fit</li><li class="desc-sub-text"><p>Regular fit<br/>The model (height 6' and shoulders 18") is wearing a size M</p></li></ul>,26:02:2014,None
None,Lee Men Charcoal Grey Herringbone Slim Fit Casual Shirt,http://www.myntra.com/Shirts/Lee/Lee-Men-Charcoal-Grey-Herringbone-Slim-Fit-Casual-Shirt/202839/buy,Rs. 1,699,fashion-sale,Extra 32% Off on 30,Lee,http://myntra.myntassets.com/images/style/properties/Lee-Men-Shirts_e1909c0a16f8b3812dfcc49fa27d823e_images_1080_1440_mini.JPG,None,None,fashion,http://www.myntra.com/Shirts/Lee/Lee-Men-Charcoal-Grey-Herringbone-Slim-Fit-Casual-Shirt/202839/buy,Sold byVector Ecommerce Pvt Ltd,None,None,['38', '40', '42', '44', '46'],None,<ul class="mk-pdpv1-product-helper mk-cf"><li class="desc-main-title">Product Description</li><li class="desc-sub-title">Style Note</li><li class="desc-sub-text " itemprop="description"><p>Look smart this casual Friday with a pick from the wide range of shirts by Lee. We recommend styling this piece with beige chinos and loafers for maximum effect.</p></li><li class="desc-sub-title ">Product Details</li><li class="desc-sub-text"><p>Charcoal grey shirt in a herringbone weave, spread collar, long sleeves with buttoned cuffs, full buttoned chest placket, buttoned patch pocket at left chest with branding above, back yoke, curved hem</p></li><li class="desc-sub-title ">Material &amp; Care</li><li class="desc-sub-text "><p>100% cotton<br/>Machine wash warm</p></li><li class="desc-sub-title">Size &amp; Fit</li><li class="desc-sub-text"><p>Slim fit<br/>The model (height 6' and shoulders 18") is wearing a size 40</p></li></ul>,26:02:2014,None
None,Lee Men Grey Herringbone Slim Fit Casual Shirt,http://www.myntra.com/Shirts/Lee/Lee-Men-Grey-Herringbone-Slim-Fit-Casual-Shirt/202838/buy,Rs. 1,699,fashion-sale,Extra 32% Off on 30,Lee,http://myntra.myntassets.com/images/style/properties/Lee-Men-Shirts_5739a7ae4de6db52b917dd45ae997e49_images_1080_1440_mini.JPG,None,None,fashion,http://www.myntra.com/Shirts/Lee/Lee-Men-Grey-Herringbone-Slim-Fit-Casual-Shirt/202838/buy,Sold byVector Ecommerce Pvt Ltd,None,None,['38', '40', '42', '44', '46'],None,<ul class="mk-pdpv1-product-helper mk-cf"><li class="desc-main-title">Product Description</li><li class="desc-sub-title">Style Note</li><li class="desc-sub-text " itemprop="description"><p>Look smart this casual Friday with a pick from the wide range of shirts by Lee. We recommend styling this piece with beige chinos and loafers for maximum effect.</p></li><li class="desc-sub-title ">Product Details</li><li class="desc-sub-text"><p>Grey shirt in a herringbone weave, spread collar, long sleeves with buttoned cuffs, full buttoned chest placket, buttoned patch pocket at left chest with branding above, back yoke, curved hem</p></li><li class="desc-sub-title ">Material &amp; Care</li><li class="desc-sub-text "><p>100% cotton<br/>Machine wash warm</p></li><li class="desc-sub-title">Size &amp; Fit</li><li class="desc-sub-text"><p>Slim fit<br/>The model (height 6' and shoulders 18") is wearing a size 40</p></li></ul>,26:02:2014,None
None,Lee Men Beige Leather Belt,http://www.myntra.com/Belts/Lee/Lee-Men-Beige-Leather-Belt/214691/buy,Rs. 999,fashion-sale,Extra 32% Off on 30,Lee,http://myntra.myntassets.com/images/style/properties/Lee-Men-Beige-Leather-Belt_dc019a3aa11dce7fb60de0e7a1813869_images_1080_1440_mini.jpg,None,None,fashion,http://www.myntra.com/Belts/Lee/Lee-Men-Beige-Leather-Belt/214691/buy,Sold byVector Ecommerce Pvt Ltd,None,None,['32', '34', '38'],None,<ul class="mk-pdpv1-product-helper mk-cf"><li class="desc-main-title">Product Description</li><li class="desc-sub-title">Style Note</li><li class="desc-sub-text " itemprop="description"><p>Cut a stylish profile with this simple yet superbly sophisticated belt  from Lee. Note the subtle detailing  that sets this piece apart from the rest.</p></li><li class="desc-sub-title ">Product Details</li><li class="desc-sub-text"><p>Beige belt with canvas panelling in the front and stitched detail<br/>Tang clasp and a fixed loop to hold the belt in place<br/>Holes to customise the fit</p></li><li class="desc-sub-title ">Material &amp; Care</li><li class="desc-sub-text "><p>Leather and canvas<br/>Wipe with a clean, dry cloth when needed</p></li><li class="desc-sub-title">Size &amp; Fit</li><li class="desc-sub-text"><p>Width: 4 cm</p></li></ul>,26:02:2014,None
None,Lee Men Khaki Blazer,http://www.myntra.com/Blazers/Lee/Lee-Men-Khaki-Blazer/202821/buy,Rs. 3,299,fashion-sale,Extra 32% Off on 30,Lee,http://myntra.myntassets.com/images/style/properties/Lee-Men-Blazers_716e65f91bbbfda59cc09fccca58f162_images_1080_1440_mini.jpg,None,None,fashion,http://www.myntra.com/Blazers/Lee/Lee-Men-Khaki-Blazer/202821/buy,Sold byVector Ecommerce Pvt Ltd,None,None,['38', '40', '42', '44'],None,<ul class="mk-pdpv1-product-helper mk-cf"><li class="desc-main-title">Product Description</li><li class="desc-sub-title">Style Note</li><li class="desc-sub-text " itemprop="description"><p>Add a dash of elegance to your wardrobe with this finely crafted blazer from Lee. Tailored for a crisp urban look, this blazer can be matched with shirts and denims.</p></li><li class="desc-sub-title ">Product Details</li><li class="desc-sub-text"><p>Khaki panelled blazer, woven, notched lapel, long sleeves with buttoned cuffs, single breasted with three buttoned chest placket, panelled welt pocket at left chest, panelled patch pockets at front waist, has an attached lining<br/>Comes with a hanger</p></li><li class="desc-sub-title ">Material &amp; Care</li><li class="desc-sub-text "><p>Shell: 100% cotton<br/>Lining: 100% polyester<br/>Machine wash cold</p></li><li class="desc-sub-title">Size &amp; Fit</li><li class="desc-sub-text"><p>The model (height 6' and chest 33") is wearing a size M</p></li></ul>,26:02:2014,None
None,Lee Men Off-White Printed T-shirt,http://www.myntra.com/Tshirts/Lee/Lee-Men-Off-White-Printed-T-shirt/180744/buy,Rs. 1,099,fashion-sale,Extra 32% Off on 30,Lee,http://myntra.myntassets.com/images/style/properties/Lee-Men-Off-White-Printed-T-shirt_2bab015f60530c350eb7766e33b4ae92_images_1080_1440_mini.jpg,None,None,fashion,http://www.myntra.com/Tshirts/Lee/Lee-Men-Off-White-Printed-T-shirt/180744/buy,Sold byVector Ecommerce Pvt Ltd,None,None,['S', 'M', 'L', 'XL', 'XXL'],None,<ul class="mk-pdpv1-product-helper mk-cf"><li class="desc-main-title">Product Description</li><li class="desc-sub-title">Style Note</li><li class="desc-sub-text " itemprop="description"><p>Lee T-shirts are iconic and it can be safely said that every style conscious man definitely owns a creation of the brand. This T-shirt is trendy and suave and it's best teamed with dark denims and sneakers.</p></li><li class="desc-sub-title ">Product Details</li><li class="desc-sub-text"><p>Off-white and black speckled knit T-shirt, has a contrast ribbed round neck, short sleeves with contrast stitch detail, print on the front,  brand tag at the straight hem on the left</p></li><li class="desc-sub-title ">Material &amp; Care</li><li class="desc-sub-text "><p>Cotton and polyester blend<br/>Machine wash cold</p></li><li class="desc-sub-title">Size &amp; Fit</li><li class="desc-sub-text"><p>Regular fit<br/>The model (height 6' and shoulders 18") is wearing a size M</p></li></ul>,26:02:2014,None
None,Lee Women Navy Blue Capris,http://www.myntra.com/Capris/Lee/Lee-Women-Navy-Blue-Capris/97870/buy,Rs. 1,000,fashion-sale,Extra 32% Off on 30,Lee,http://myntra.myntassets.com/images/style/properties/Lee-Women-34-Length-Pants_f94e673c886324bc318daceb16c3b451_images_1080_1440_mini.jpg,Rs. 1,999,None,fashion,http://www.myntra.com/Capris/Lee/Lee-Women-Navy-Blue-Capris/97870/buy,Sold byVector Ecommerce Pvt Ltd,None,None,['26', '27', '28', '29', '30', '31', '32', '34'],None,<ul class="mk-pdpv1-product-helper mk-cf"><li class="desc-main-title">Product Description</li><li class="desc-sub-title">Style Note</li><li class="desc-sub-text " itemprop="description"><p>Lee presents yet another stunner to bring out the diva in you.This pair of capris in navy blue flatters your figure and enhances your curves. Pick a cropped T-shirt with bold print, add matching earrings and a sling bag to spruce it up.</p></li><li class="desc-sub-title ">Product Details</li><li class="desc-sub-text"><p>Navy blue denim capris with stitched detailing and a washed look, has a mid rise, straight leg and slim fit, buttoned and zipped closure, low slung belt loops around the waist, brand patch at the back of the waistband, two insert pockets in front with cross stitch detailing at the mouth  with a change pocket in the right pocket, and two patch pockets at the back with cross stitch detailing</p></li><li class="desc-sub-title ">Material &amp; Care</li><li class="desc-sub-text "><p>Cotton blend<br/> Hand wash cold</p></li><li class="desc-sub-title">Size &amp; Fit</li><li class="desc-sub-text"><p>Leola Carpri Fit<br/> The model (height 5'8" and waist 28") is wearing a size M</p></li></ul>,26:02:2014,None
