None,Lee Women Off-White & Blue Striped Cindy Sweater,http://www.myntra.com/Sweaters/Lee/Lee-Women-Off-White-&-Blue-Striped-Cindy-Sweater/207149/buy,Rs. 1,999,fashion-sale,Extra 32% Off on 30,Lee,http://myntra.myntassets.com/images/style/properties/Lee-Women-Off-White-&-Blue-Striped-Cindy-Sweater_874623d44bd2ec950ca743219b00c43a_images_1080_1440_mini.jpg,None,None,fashion,http://www.myntra.com/Sweaters/Lee/Lee-Women-Off-White-&-Blue-Striped-Cindy-Sweater/207149/buy,Sold byVector Ecommerce Pvt Ltd,None,None,['S', 'M', 'L', 'XL'],None,<ul class="mk-pdpv1-product-helper mk-cf"><li class="desc-main-title">Product Description</li><li class="desc-sub-title">Style Note</li><li class="desc-sub-text " itemprop="description"><p>Cut a pretty figure in this super-cute sweater by Lee. We love its retro striped pattern and recommend that you try matching it with a pair of skinny jeans or chinos, a muffler and slouchy boots for the perfect winter ensemble.</p></li><li class="desc-sub-title ">Product Details</li><li class="desc-sub-text"><p>Off-white, green and blue striped sweater, knitted, solid ribbed mandarin collar with a V-shaped slit below, short buttoned chest placket, knitted pattern at chest and back, long sleeves with solid ribbed cuffs, solid ribbed hem, metallic branding above left hem</p></li><li class="desc-sub-title ">Material &amp; Care</li><li class="desc-sub-text "><p>100% cotton<br/>Hand wash cold</p></li><li class="desc-sub-title">Size &amp; Fit</li><li class="desc-sub-text"><p>The model (height 5'8" and chest 33") is wearing a size S</p></li></ul>,26:02:2014,None
None,Lee Men Beige Leather Belt,http://www.myntra.com/Belts/Lee/Lee-Men-Beige-Leather-Belt/214691/buy,Rs. 999,fashion-sale,Extra 32% Off on 30,Lee,http://myntra.myntassets.com/images/style/properties/Lee-Men-Beige-Leather-Belt_dc019a3aa11dce7fb60de0e7a1813869_images_1080_1440_mini.jpg,None,None,fashion,http://www.myntra.com/Belts/Lee/Lee-Men-Beige-Leather-Belt/214691/buy,Sold byVector Ecommerce Pvt Ltd,None,None,['32', '34', '38'],None,<ul class="mk-pdpv1-product-helper mk-cf"><li class="desc-main-title">Product Description</li><li class="desc-sub-title">Style Note</li><li class="desc-sub-text " itemprop="description"><p>Cut a stylish profile with this simple yet superbly sophisticated belt  from Lee. Note the subtle detailing  that sets this piece apart from the rest.</p></li><li class="desc-sub-title ">Product Details</li><li class="desc-sub-text"><p>Beige belt with canvas panelling in the front and stitched detail<br/>Tang clasp and a fixed loop to hold the belt in place<br/>Holes to customise the fit</p></li><li class="desc-sub-title ">Material &amp; Care</li><li class="desc-sub-text "><p>Leather and canvas<br/>Wipe with a clean, dry cloth when needed</p></li><li class="desc-sub-title">Size &amp; Fit</li><li class="desc-sub-text"><p>Width: 4 cm</p></li></ul>,26:02:2014,None
None,Lee Women Navy Sweatshirt,http://www.myntra.com/Sweatshirts/Lee/Lee-Women-Navy-Sweatshirt/174416/buy,Rs. 1,799,fashion-sale,Extra 32% Off on 30,Lee,http://myntra.myntassets.com/images/style/properties/Lee-Women-Navy-Sweatshirt_431bec8ebc5dcb65792d0e0588bacd7c_images_1080_1440_mini.jpg,None,None,fashion,http://www.myntra.com/Sweatshirts/Lee/Lee-Women-Navy-Sweatshirt/174416/buy,Sold byVector Ecommerce Pvt Ltd,None,None,['S', 'M', 'L', 'XL'],None,<ul class="mk-pdpv1-product-helper mk-cf"><li class="desc-main-title">Product Description</li><li class="desc-sub-title">Style Note</li><li class="desc-sub-text " itemprop="description"><p>Keep your style intact even during the cold days with this sweatshirt from Lee. Wear this piece with over-dyed denims and high top trainers for the best look.</p></li><li class="desc-sub-title ">Product Details</li><li class="desc-sub-text"><p>Navy sweatshirt, knitted, has a mock collar, long sleeves, full zipped front, insert pockets at the sides, metallic brand tag above left hem</p></li><li class="desc-sub-title ">Material &amp; Care</li><li class="desc-sub-text "><p>100% polyester<br/>Dry clean only</p></li><li class="desc-sub-title">Size &amp; Fit</li><li class="desc-sub-text"><p>Regular fit<br/>The model (height 6' and shoulders 18") is wearing a size S</p></li></ul>,26:02:2014,None
None,Lee Men Black Argyle Sleeveless Sweater,http://www.myntra.com/Sweaters/Lee/Lee-Men-Black-Argyle-Sleeveless-Sweater/202853/buy,Rs. 1,274,fashion-sale,Extra 32% Off on 30,Lee,http://myntra.myntassets.com/images/style/properties/Lee-Men-Sweaters_345e863c8cdf0ea473def8d15739e614_images_1080_1440_mini.jpg,Rs. 1,699,None,fashion,http://www.myntra.com/Sweaters/Lee/Lee-Men-Black-Argyle-Sleeveless-Sweater/202853/buy,Sold byVector Ecommerce Pvt Ltd,None,None,['S', 'M', 'L', 'XL', 'XXL'],None,<ul class="mk-pdpv1-product-helper mk-cf"><li class="desc-main-title">Product Description</li><li class="desc-sub-title">Style Note</li><li class="desc-sub-text " itemprop="description"><p>Specially designed to give your winter wardrobe a refined feel, this Lee sweater is a season essential. We absolutely adore its preppy styling and cosy fabric. Wear it with a short sleeve T-shirt and washed jeans for a relaxed look.</p></li><li class="desc-sub-title ">Product Details</li><li class="desc-sub-text"><p>Black, purple, grey and blue argyle sweater, knit, ribbed V neck with contrast tipping detail, sleeveless with contrast tipping detail at ribbed arm holes, solid back, ribbed hemline with contrast tipping detail, brand embroidery at left hem</p></li><li class="desc-sub-title ">Material &amp; Care</li><li class="desc-sub-text "><p>Acrylic and wool blend<br/>Machine wash warm</p></li><li class="desc-sub-title">Size &amp; Fit</li><li class="desc-sub-text"><p>Regular fit<br/>The model (height 6' and shoulders 18") is wearing a size M</p></li></ul>,26:02:2014,None
None,Lee Men Rinse Navy Blue Jeans,http://www.myntra.com/Jeans/Lee/Lee-Men-Rinse-Navy-Blue-Jeans/44581/buy,Rs. 1,899,fashion-sale,Extra 32% Off on 30,Lee,http://myntra.myntassets.com/images/style/properties/7fb1ee6bfd21d057c2da28d8471723b6_images_1080_1440_mini.jpg,None,None,fashion,http://www.myntra.com/Jeans/Lee/Lee-Men-Rinse-Navy-Blue-Jeans/44581/buy,Sold byVector Ecommerce Pvt Ltd,None,None,['28', '30', '32', '34', '36', '38'],None,<ul class="mk-pdpv1-product-helper mk-cf"><li class="desc-main-title">Product Description</li><li class="desc-sub-title ">Product Details</li><li class="desc-sub-text"><p><strong>Style Note</strong><br/>Look cool in these <a href="../denim">denim</a> <a href="../jeans">jeans</a> from <a href="../lee">lee</a>. The design is classic and the cotton fabric keeps you comfortable all day. Team this pair with a slim <a href="../Fit">Fit</a> shirt or graphic tee and <a href="../canvas-shoes">canvas shoes</a> for a casual look.<br/><br/><strong>Product Details</strong><br/>Blue jeans with metal zip and button fastening, two side pockets with one change pocket, two patch pockets on the back<br/><br/><strong>Material and Care</strong><br/>Cotton blend<br/>Machine wash cold, separately with mild detergent as colour may bleed<br/>Turn inside out before washing and drying<br/>Do not bleach or wring<br/><br/><strong>Size and fit</strong><br/>Slim fit, stretch fabric, narrow leg, mid low rise<br/>The model (height 6' and waist 32") is wearing a size 32</p></li></ul>,26:02:2014,None
None,Lee Men Grey Herringbone Slim Fit Casual Shirt,http://www.myntra.com/Shirts/Lee/Lee-Men-Grey-Herringbone-Slim-Fit-Casual-Shirt/202838/buy,Rs. 1,699,fashion-sale,Extra 32% Off on 30,Lee,http://myntra.myntassets.com/images/style/properties/Lee-Men-Shirts_5739a7ae4de6db52b917dd45ae997e49_images_1080_1440_mini.JPG,None,None,fashion,http://www.myntra.com/Shirts/Lee/Lee-Men-Grey-Herringbone-Slim-Fit-Casual-Shirt/202838/buy,Sold byVector Ecommerce Pvt Ltd,None,None,['38', '40', '42', '44', '46'],None,<ul class="mk-pdpv1-product-helper mk-cf"><li class="desc-main-title">Product Description</li><li class="desc-sub-title">Style Note</li><li class="desc-sub-text " itemprop="description"><p>Look smart this casual Friday with a pick from the wide range of shirts by Lee. We recommend styling this piece with beige chinos and loafers for maximum effect.</p></li><li class="desc-sub-title ">Product Details</li><li class="desc-sub-text"><p>Grey shirt in a herringbone weave, spread collar, long sleeves with buttoned cuffs, full buttoned chest placket, buttoned patch pocket at left chest with branding above, back yoke, curved hem</p></li><li class="desc-sub-title ">Material &amp; Care</li><li class="desc-sub-text "><p>100% cotton<br/>Machine wash warm</p></li><li class="desc-sub-title">Size &amp; Fit</li><li class="desc-sub-text"><p>Slim fit<br/>The model (height 6' and shoulders 18") is wearing a size 40</p></li></ul>,26:02:2014,None
None,Lee Men Grey Haiden Sweater,http://www.myntra.com/Sweaters/Lee/Lee-Men-Grey-Haiden-Sweater/202850/buy,Rs. 1,874,fashion-sale,Extra 32% Off on 30,Lee,http://myntra.myntassets.com/images/style/properties/Lee-Men-Sweaters_a952e949d2740b02075f86cca589132e_images_1080_1440_mini.JPG,Rs. 2,499,None,fashion,http://www.myntra.com/Sweaters/Lee/Lee-Men-Grey-Haiden-Sweater/202850/buy,Sold byVector Ecommerce Pvt Ltd,None,None,['S', 'M', 'L', 'XL', 'XXL'],None,<ul class="mk-pdpv1-product-helper mk-cf"><li class="desc-main-title">Product Description</li><li class="desc-sub-title">Style Note</li><li class="desc-sub-text " itemprop="description"><p>This trendy sweater from Lee is an absolute must-have this winter. Cut and styled for an amazing fit, this piece can be paired with your favourite jeans and a shirt on a windy day for an effortlessly stylish look.</p></li><li class="desc-sub-title ">Product Details</li><li class="desc-sub-text"><p>Grey sweater with multi-coloured speckled knit detailing, ribbed turtle neck with short zipped closure in front, long sleeves with elbow patch and ribbed cuffs, branding at left chest, ribbed hem</p></li><li class="desc-sub-title ">Material &amp; Care</li><li class="desc-sub-text "><p>100% acrylic<br/>Hand wash cold</p></li><li class="desc-sub-title">Size &amp; Fit</li><li class="desc-sub-text"><p>Regular fit<br/>The model (height 6' and shoulders 18") is wearing a size M</p></li></ul>,26:02:2014,None
None,Lee Men Brown Leather Wallet,http://www.myntra.com/Wallets/Lee/Lee-Men-Brown-Leather-Wallet/214670/buy,Rs. 1,399,fashion-sale,Extra 32% Off on 30,Lee,http://myntra.myntassets.com/images/style/properties/Lee-Men-Brown-Leather-Wallet_da52af68a65cae34feae78f40c5a1b61_images_1080_1440_mini.jpg,None,None,fashion,http://www.myntra.com/Wallets/Lee/Lee-Men-Brown-Leather-Wallet/214670/buy,Sold byVector Ecommerce Pvt Ltd,None,None,single size,None,<ul class="mk-pdpv1-product-helper mk-cf"><li class="desc-main-title">Product Description</li><li class="desc-sub-title">Style Note</li><li class="desc-sub-text " itemprop="description"><p>Carry your monetary essentials in style and comfort with this wallet from Lee. The multiple compartments lets you organise your essentials in an orderly manner.</p></li><li class="desc-sub-title ">Product Details</li><li class="desc-sub-text"><p>Brown, two fold wallet with a textured upper, stitched detail and banding at front<br/>One main compartment with an inner separator sleeve<br/>The left fold has four card holders and two slip pockets<br/>The right fold has four card holders and two slip pockets</p></li><li class="desc-sub-title ">Material &amp; Care</li><li class="desc-sub-text "><p>Leather<br/>Wipe with a clean, dry cloth when needed</p></li><li class="desc-sub-title">Size &amp; Fit</li><li class="desc-sub-text"><p>Height: 9.5 cm<br/>Width: 11 cm</p></li></ul>,26:02:2014,None
None,Lee Men Charcoal Grey Herringbone Slim Fit Casual Shirt,http://www.myntra.com/Shirts/Lee/Lee-Men-Charcoal-Grey-Herringbone-Slim-Fit-Casual-Shirt/202839/buy,Rs. 1,699,fashion-sale,Extra 32% Off on 30,Lee,http://myntra.myntassets.com/images/style/properties/Lee-Men-Shirts_e1909c0a16f8b3812dfcc49fa27d823e_images_1080_1440_mini.JPG,None,None,fashion,http://www.myntra.com/Shirts/Lee/Lee-Men-Charcoal-Grey-Herringbone-Slim-Fit-Casual-Shirt/202839/buy,Sold byVector Ecommerce Pvt Ltd,None,None,['38', '40', '42', '44', '46'],None,<ul class="mk-pdpv1-product-helper mk-cf"><li class="desc-main-title">Product Description</li><li class="desc-sub-title">Style Note</li><li class="desc-sub-text " itemprop="description"><p>Look smart this casual Friday with a pick from the wide range of shirts by Lee. We recommend styling this piece with beige chinos and loafers for maximum effect.</p></li><li class="desc-sub-title ">Product Details</li><li class="desc-sub-text"><p>Charcoal grey shirt in a herringbone weave, spread collar, long sleeves with buttoned cuffs, full buttoned chest placket, buttoned patch pocket at left chest with branding above, back yoke, curved hem</p></li><li class="desc-sub-title ">Material &amp; Care</li><li class="desc-sub-text "><p>100% cotton<br/>Machine wash warm</p></li><li class="desc-sub-title">Size &amp; Fit</li><li class="desc-sub-text"><p>Slim fit<br/>The model (height 6' and shoulders 18") is wearing a size 40</p></li></ul>,26:02:2014,None
None,Lee Men Brown Leather Belt,http://www.myntra.com/Belts/Lee/Lee-Men-Brown-Leather-Belt/175704/buy,Rs. 1,399,fashion-sale,Extra 32% Off on 30,Lee,http://myntra.myntassets.com/images/style/properties/Lee-Men-Brown-Leather-Belt_2c2e97734f8af9bd7330f37b04770862_images_1080_1440_mini.jpg,None,None,fashion,http://www.myntra.com/Belts/Lee/Lee-Men-Brown-Leather-Belt/175704/buy,Sold byVector Ecommerce Pvt Ltd,None,None,['32', '34', '38'],None,<ul class="mk-pdpv1-product-helper mk-cf"><li class="desc-main-title">Product Description</li><li class="desc-sub-title">Style Note</li><li class="desc-sub-text " itemprop="description"><p>Cut a stylish profile with this simple yet superbly sophisticated belt  from Lee. Note the subtle detailing  that sets this stylish piece apart from the rest.</p></li><li class="desc-sub-title ">Product Details</li><li class="desc-sub-text"><p>Brown belt, has a textured upper with dual tone<br/>Tang closure and a fixed loop to hold the belt in place<br/>Holes to customise the fit</p></li><li class="desc-sub-title ">Material &amp; Care</li><li class="desc-sub-text "><p>Leather<br/>Wipe with a clean, dry cloth when needed</p></li><li class="desc-sub-title">Size &amp; Fit</li><li class="desc-sub-text"><p>Width: 3.8 cm</p></li></ul>,26:02:2014,None
None,Lee Men Navy Printed T-shirt,http://www.myntra.com/Tshirts/Lee/Lee-Men-Navy-Printed-T-shirt/202863/buy,Rs. 1,199,fashion-sale,Extra 32% Off on 30,Lee,http://myntra.myntassets.com/images/style/properties/Lee-Men-Tshirts_3902d19631b33deac696fddeb9407496_images_1080_1440_mini.jpg,None,None,fashion,http://www.myntra.com/Tshirts/Lee/Lee-Men-Navy-Printed-T-shirt/202863/buy,Sold byVector Ecommerce Pvt Ltd,None,None,['S', 'M', 'L', 'XL', 'XXL'],None,<ul class="mk-pdpv1-product-helper mk-cf"><li class="desc-main-title">Product Description</li><li class="desc-sub-title">Style Note</li><li class="desc-sub-text " itemprop="description"><p>This stylish printed tee in a classic hue from Lee is a must-have this season. We suggest that you match it with a pair of tapered jeans and canvas shoes for a trendy, urban appeal.</p></li><li class="desc-sub-title ">Product Details</li><li class="desc-sub-text"><p>Navy knit T-shirt, has a ribbed round neck, short sleeves, print on the front, brand tag at the straight hem on the left</p></li><li class="desc-sub-title ">Material &amp; Care</li><li class="desc-sub-text "><p>100% cotton<br/>Machine wash cold</p></li><li class="desc-sub-title">Size &amp; Fit</li><li class="desc-sub-text"><p>The model (height 6' and shoulders 18") is wearing a size M</p></li></ul>,26:02:2014,None
None,Lee Men Blue Rick Sweatshirt,http://www.myntra.com/Sweatshirts/Lee/Lee-Men-Blue-Rick-Sweatshirt/202857/buy,Rs. 1,724,fashion-sale,Extra 32% Off on 30,Lee,http://myntra.myntassets.com/images/style/properties/Lee-Men-Sweatshirts_e357f7fcd412295655dd5ffebb44409b_images_1080_1440_mini.jpg,Rs. 2,299,None,fashion,http://www.myntra.com/Sweatshirts/Lee/Lee-Men-Blue-Rick-Sweatshirt/202857/buy,Sold byVector Ecommerce Pvt Ltd,None,None,['S', 'M', 'L', 'XL', 'XXL'],None,<ul class="mk-pdpv1-product-helper mk-cf"><li class="desc-main-title">Product Description</li><li class="desc-sub-title">Style Note</li><li class="desc-sub-text " itemprop="description"><p>Spruce up your winter wardrobe with this warm sweatshirt from Lee. Layer it over a simple tee and washed denims for a trendy and urban look.</p></li><li class="desc-sub-title ">Product Details</li><li class="desc-sub-text"><p>Blue sweatshirt, ribbed mock collar, panel insert at back of neck, full concealed zipped front, long panelled sleeves with ribbed cuffs, high density print at left chest, contrast panelling down the sides with mesh panels at shoulders, insert pockets at front waist, print above left hem at back, ribbed and striped hem</p></li><li class="desc-sub-title ">Material &amp; Care</li><li class="desc-sub-text "><p>100% cotton<br/>Machine wash warm</p></li><li class="desc-sub-title">Size &amp; Fit</li><li class="desc-sub-text"><p>Regular fit<br/>The model (height 6' and shoulders 18") is wearing a size M</p></li></ul>,26:02:2014,None
None,Lee Men Brown & Burgundy Leather Belt,http://www.myntra.com/Belts/Lee/Lee-Men-Brown-&-Burgundy-Leather-Belt/214696/buy,Rs. 1,299,fashion-sale,Extra 32% Off on 30,Lee,http://myntra.myntassets.com/images/style/properties/Lee-Men-Brown-&-Burgundy-Leather-Belt_3c877d84b09be6f6cfac6c137991baa0_images_1080_1440_mini.jpg,None,None,fashion,http://www.myntra.com/Belts/Lee/Lee-Men-Brown-&-Burgundy-Leather-Belt/214696/buy,Sold byVector Ecommerce Pvt Ltd,None,None,['32', '34', '38'],None,<ul class="mk-pdpv1-product-helper mk-cf"><li class="desc-main-title">Product Description</li><li class="desc-sub-title">Style Note</li><li class="desc-sub-text " itemprop="description"><p>Cut a stylish profile with this simple yet superbly sophisticated belt  from Lee. Note the subtle detailing  that sets this piece apart from the rest.</p></li><li class="desc-sub-title ">Product Details</li><li class="desc-sub-text"><p>Brown and burgundy belt, has a textured upper with stitched detail<br/>Tang clasp and a fixed loop to hold the belt in place<br/>Holes to customise the fit</p></li><li class="desc-sub-title ">Material &amp; Care</li><li class="desc-sub-text "><p>Leather<br/>Wipe with a clean, dry cloth when needed</p></li><li class="desc-sub-title">Size &amp; Fit</li><li class="desc-sub-text"><p>Width: 3.8 cm</p></li></ul>,26:02:2014,None
None,Lee Men Red Sleeveless Jacket,http://www.myntra.com/Jackets/Lee/Lee-Men-Red-Sleeveless-Jacket/180747/buy,Rs. 2,699,fashion-sale,Extra 32% Off on 30,Lee,http://myntra.myntassets.com/images/style/properties/Lee-Men-Red-Sleeveless-Jacket_679a2cb091bf9a2ae8dc8f4dbacd9cdf_images_1080_1440_mini.jpg,None,None,fashion,http://www.myntra.com/Jackets/Lee/Lee-Men-Red-Sleeveless-Jacket/180747/buy,Sold byVector Ecommerce Pvt Ltd,None,None,['S', 'M', 'L', 'XL', 'XXL'],None,<ul class="mk-pdpv1-product-helper mk-cf"><li class="desc-main-title">Product Description</li><li class="desc-sub-title">Style Note</li><li class="desc-sub-text " itemprop="description"><p>Feel that chill in the air? Here's a jacket from Lee, a transitional piece, that lends itself to layering and adds practical style to your wardrobe. Team it with dark dyed denims and sneakers for a perfectly casual look.</p></li><li class="desc-sub-title ">Product Details</li><li class="desc-sub-text"><p>Dark red flannel jacket, high collar, open ended zip closure down front, contrast panel across front and back shoulders, sleeveless, insert pocket with zip closure at left chest, contrast patch pockets at either side at the waist with concealed zip closure, has a mesh lining, printed patch above back hem, ribbed hem</p></li><li class="desc-sub-title ">Material &amp; Care</li><li class="desc-sub-text "><p>100% polyester<br/>Machine wash cold</p></li><li class="desc-sub-title">Size &amp; Fit</li><li class="desc-sub-text"><p>The model (height 6' and shoulders 18") is wearing a size M</p></li></ul>,26:02:2014,None
None,Lee Men Grey Leather Belt,http://www.myntra.com/Belts/Lee/Lee-Men-Grey-Leather-Belt/214690/buy,Rs. 1,399,fashion-sale,Extra 32% Off on 30,Lee,http://myntra.myntassets.com/images/style/properties/Lee-Men-Grey-Leather-Belt_f1570730228572fb61a619fc218f548f_images_1080_1440_mini.jpg,None,None,fashion,http://www.myntra.com/Belts/Lee/Lee-Men-Grey-Leather-Belt/214690/buy,Sold byVector Ecommerce Pvt Ltd,None,None,['32', '34', '38'],None,<ul class="mk-pdpv1-product-helper mk-cf"><li class="desc-main-title">Product Description</li><li class="desc-sub-title">Style Note</li><li class="desc-sub-text " itemprop="description"><p>Cut a stylish profile with this simple yet superbly sophisticated belt  from Lee. Note the subtle detailing  that sets this piece apart from the rest.</p></li><li class="desc-sub-title ">Product Details</li><li class="desc-sub-text"><p>Grey belt with a textured upper<br/>Tang clasp and a fixed loop to hold the belt in place<br/>Holes to customise the fit</p></li><li class="desc-sub-title ">Material &amp; Care</li><li class="desc-sub-text "><p>Leather<br/>Wipe with a clean, dry cloth when needed</p></li><li class="desc-sub-title">Size &amp; Fit</li><li class="desc-sub-text"><p>Width: 3.8 cm</p></li></ul>,26:02:2014,None
None,Lee Men Navy Argyle Sleeveless Sweater,http://www.myntra.com/Sweaters/Lee/Lee-Men-Navy-Argyle-Sleeveless-Sweater/202854/buy,Rs. 1,274,fashion-sale,Extra 32% Off on 30,Lee,http://myntra.myntassets.com/images/style/properties/Lee-Men-Sweaters_73e27ced58c278f05dbd6ca19e4f90ba_images_1080_1440_mini.jpg,Rs. 1,699,None,fashion,http://www.myntra.com/Sweaters/Lee/Lee-Men-Navy-Argyle-Sleeveless-Sweater/202854/buy,Sold byVector Ecommerce Pvt Ltd,None,None,['S', 'M', 'L', 'XL', 'XXL'],None,<ul class="mk-pdpv1-product-helper mk-cf"><li class="desc-main-title">Product Description</li><li class="desc-sub-title">Style Note</li><li class="desc-sub-text " itemprop="description"><p>Specially designed to give your winter wardrobe a refined feel, this Lee sweater is a season essential. We absolutely adore its preppy styling and cosy fabric. Wear it with a short sleeve T-shirt and washed jeans for a relaxed look.</p></li><li class="desc-sub-title ">Product Details</li><li class="desc-sub-text"><p>Navy, green, maroon and white argyle sweater, knit, ribbed V neck with contrast tipping detail, sleeveless with contrast tipping detail at ribbed arm holes, solid back, ribbed hemline with contrast tipping detail, brand embroidery at left hem</p></li><li class="desc-sub-title ">Material &amp; Care</li><li class="desc-sub-text "><p>Acrylic and wool blend<br/>Machine wash warm</p></li><li class="desc-sub-title">Size &amp; Fit</li><li class="desc-sub-text"><p>Regular fit<br/>The model (height 6' and shoulders 18") is wearing a size M</p></li></ul>,26:02:2014,None
None,Lee Women Blue Cherrie Slim Fit Jeans,http://www.myntra.com/Jeans/Lee/Lee-Women-Blue-Cherrie-Slim-Fit-Jeans/9141/buy,Rs. 950,fashion-sale,Extra 32% Off on 30,Lee,http://myntra.myntassets.com/images/style/properties/Lee-Women-Blue-Cherrie-Slim-Fit-Jeans_12d3a6df8ce62705e634eb7ed4b3c105_images_1080_1440_mini.jpg,Rs. 1,899,None,fashion,http://www.myntra.com/Jeans/Lee/Lee-Women-Blue-Cherrie-Slim-Fit-Jeans/9141/buy,Sold byVector Ecommerce Pvt Ltd,None,None,['26', '27', '28', '29', '30', '31', '32', '34'],None,<ul class="mk-pdpv1-product-helper mk-cf"><li class="desc-main-title">Product Description</li><li class="desc-sub-title">Style Note</li><li class="desc-sub-text " itemprop="description"><p>The right shade of blue, this pair of denim jeans from Lee will quickly become your favourite. With minimal wash detail and lycra blend fabrication, this pair is a super versatile piece for your casual wardrobe.</p></li><li class="desc-sub-title ">Product Details</li><li class="desc-sub-text"><p>Blue jeans, has two scoop pockets on the front with an insert pocket on the right, yoke and two patch pockets, brand patch at the back, waistband with loops, metal zipper and button closure</p></li><li class="desc-sub-title ">Material &amp; Care</li><li class="desc-sub-text "><p>Cotton and lycra blend<br/> Machine wash</p></li><li class="desc-sub-title">Size &amp; Fit</li><li class="desc-sub-text"><p>Low rise, slim fit, straight leg<br/> The model (height 5'8" and waist 28") is wearing a size 28</p></li></ul>,26:02:2014,None
None,Lee Men Pack of 2 Socks,http://www.myntra.com/Socks/Lee/Lee-Men-Pack-of-2-Socks/214682/buy,Rs. 349,fashion-sale,Extra 32% Off on 30,Lee,http://myntra.myntassets.com/images/style/properties/Lee-Men-Pack-of-2-Socks_5d4ec12e23898b74c17627174252d793_images_1080_1440_mini.jpg,None,None,fashion,http://www.myntra.com/Socks/Lee/Lee-Men-Pack-of-2-Socks/214682/buy,Sold byVector Ecommerce Pvt Ltd,None,None,single size,None,<ul class="mk-pdpv1-product-helper mk-cf"><li class="desc-main-title">Product Description</li><li class="desc-sub-title">Style Note</li><li class="desc-sub-text " itemprop="description"><p>Soft, comfy socks from Lee to keep your feet in cushioned bliss all day. This set is definitely a great buy.</p></li><li class="desc-sub-title ">Product Details</li><li class="desc-sub-text"><p>Pack of two socks<br/>Grey and black, ankle length socks, knit, with blue accents, ribbed cuffs with branding, and striped detail<br/>Blue and black, ankle length socks, knit, with red accents, ribbed cuffs with branding, and striped detail</p></li><li class="desc-sub-title ">Material &amp; Care</li><li class="desc-sub-text "><p>Cotton<br/>Machine wash</p></li></ul>,26:02:2014,None
